url;review
https://www.yelp.it/biz/focacceria-santagostino-torino-2; Una pausa veloce con pizza e farinata di qualità. Servizio veloce e personale disponibile e gentile. Consigliato per un pranzo buono e veloce.
https://www.yelp.it/biz/focacceria-tipica-ligure-torino; Anche il servizio è cordiale e veloce. Consigliatissimo per un pasto veloce in centro. Personale molto gentile e veloce nel servizio.
https://www.yelp.it/biz/forchetta-e-scarpetta-torino; Adatta ad una pausa pranzo lavorativa, veloce economica è semplice. Buon vino della casa e servizio veloce per una pausa pranzo di qualità. Servizio veloce, ambiente informale, comodissimo alla stazione.
https://www.yelp.it/biz/fratelli-la-cozza-torino-2; Il servizio molto veloce e il personale è molto scherzoso,disponibile e rapido. Posto giusto per una pausa pranzo allegra. Pulito, servizio veloce e adeguato, cucina ottima!
https://www.yelp.it/biz/fratelli-roselli-torino; Tappa fissa anche per la pizza d'asporto. Il servizio è veloce e i camerieri gentilissimi. Ottimo pranzo con un servizio rapido e cordiale.
https://www.yelp.it/biz/freemadam-torino; Ottimo per pausa pranzo e colazioni veloci. Provato una volta a pranzo mangiando nella saletta sopraelevata.
https://www.yelp.it/biz/freevolo-torino; Discreta scelta delle pietanze e servizio abbastanza veloce. Pranzo veloce girando il centro storico di Torino. Servizio gentile e veloce, tanta gente rilassata tutt'intorno, consigliato.
https://www.yelp.it/biz/friedas-pub-torino; Cura del cliente, ottime birre, ed ampi spazi fanno il resto Davvero consigliato Cucina nella media di un locale di questo tipo e servizio gentile.
https://www.yelp.it/biz/fuzion-torino; Il proprietario molto gentile e il servizio veloce. Consigliato per chi deve partire e vuole fare un pranzo veloce. Personale molto gentile e disponibile, ospitalità al top.
https://www.yelp.it/biz/gadi-bari; Leggere tanta soddisfazione nelle sue parole ci gratifica enormemente. Locale pulitissimo, personale sempre gentile e disponibile, gelato cremoso e gustoso..semplicemente delizioso. Il vero spettacolo è la sua soddisfazione.
https://www.yelp.it/biz/galante-torino; veramente carino .... servizio e qualità  esagerata ...
https://www.yelp.it/biz/galante-torino-2; Servizio molto buono e il conto in linea con qualità del cibo e con la raffinatezza del posto. ristorante elegante e accogliente, personale gentile e disponibilissimo, servizio buono da ritornare Locale piccolo ma accogliente con ambiente formale, molto gentile il personale di sala.
https://www.yelp.it/biz/gandhi-torino; Personale gentile e servizio non molto rapido. Il personale indiano è attento, rapido ma sereno e sorridente. Il locale è ben arredato ed accogliente, il servizio é buono ed il personale rapido e cortese.
https://www.yelp.it/biz/garden-caffetteria-torino; Un locale nella media, senza infamia e senza lode, gentili i proprietari, veloce il servizio! La titolare è molto gentile ed i camerieri cortesi ed efficienti.
https://www.yelp.it/biz/gasperini-bari; Il personale preparato su tutti i gusti, anche i più particolari, sorridente e gentile. Personale gentile e simpatico da provare sicuramente !!! Ottima gelateria con grande varietà di gusti, è d'obbligo una sosta ma non solo gelato, personale gentile e cortese...
https://www.yelp.it/biz/gelateria-ciuffos-torino; Ogni settimana sostituiamo dei gusti con delle new entry per cercare di accontentare tutti quindi passi a ritrovarci! Gelato ottimo e personale molto cortese, da provare. Per il resto davvero una bella scoperta.
https://www.yelp.it/biz/gelateria-delle-alpi-torino; Per una piccola pausa all'insegna della golosità. I prezzi delle paste (discrete) sono da asporto. Veloce visita per una crèpes, molto buona e gustosa.
https://www.yelp.it/biz/gelateria-due-salette-torino; I prodotti si rivelano di buona qualità, gentile il cameriere pur facendosi attendere inizialmente. Il cassiere all' uscita è parso scostante e poco gentile. la degustazione vale solo con il panino!!
https://www.yelp.it/biz/gelateria-grom-torino-2; Il personale, invece, molto cortese e veloce. Buonissimo gelato di qualità, vasto assortimento di gusti, servizio veloce e cordiale, possibilità di consumare seduti all'interno del locale Il personale è gentile ma ha modi di fare molto sbrigativi.
https://www.yelp.it/biz/gelateria-miretti-torino-7; Locale curato e pulito che offre piatti semplici per una pausa pranzo leggera e sfiziosa. Servizio al top e qualità della caffetteria sorprendente. Un punto a favore è l'arredamento interno, molto elegante.
https://www.yelp.it/biz/gelateria-mondello-torino; Dopo un pomeriggio turistico una pausa rinfrescante. Personale super gentile e competente soprattutto nel punto vendita di Santa Rita Il personale è fantastico, disponibile, gentile e sempre con voglia di rinnovarsi.
https://www.yelp.it/biz/gelateria-monginevro-smaldone-raffaele-torino; Porzioni abbondanti sia nei coni sia nell'asporto. Il personale è sempre gentile e sorridente: caratteristica molto rara da trovare nella maggior parte dei posti. Grande vastità di gusti e personale gentile.
https://www.yelp.it/biz/gelateria-nicola-torino; I gusti alla frutta sono leggermente superiori al resto.
https://www.yelp.it/biz/gelateria-piccinni-bari; Meta fissa almeno due volte alla settimana. Un plauso anche al personale gentile e cordiale. Personale gentile e competente che dimostra molta dedizione nella realizzazione del loro lavoro.
https://www.yelp.it/biz/gelateria-piu-di-un-gelato-torino; Il locale è piccolino ma in settimana non c'è fila. Una ulteriore nota di merito va al personale, sempre gentile. locale piccolo pulito e personale gentile e paziente e davvero professionale.
https://www.yelp.it/biz/gelateria-popolare-torino; Più da asporto visto il poco spazio, ma la qualità è impagabile. Il locale è originale e accogliente, il personale gentile. Anche il locale merita uno sguardo, ricco di foto e messaggi di pace.
https://www.yelp.it/biz/gennaro-esposito-torino-2; Nonostante l'affluenza di persone in coda per l'asporto, il servizio è piuttosto rapido. Il pizzaiolo e' veloce ,il proprietario non particolarmente gentile . Ambiente spartano, si può mangiare lì o prendere da asporto.
https://www.yelp.it/biz/giapponese-ohashi-torino; Pesce fresco, sushi fantastico, prezzi onesti e servizio rapido! Il locale propone un menù fisso, diverso ogni settimana. ... buttati via 70 euro per un sushi che nemmeno ad Auchan da asporto.
https://www.yelp.it/biz/giapponese-sakura-torino; Il personale è disponibile e abbastanza veloce. Il servizio è veloce, il cibo buono e gustoso. Sushi e giapponese a rullo medi è abbastanza vari, piacevole pausa pranzo.
https://www.yelp.it/biz/giapponese-xia-torino; Bel locale, personale cortese, cucina in stile made in Japan. Il loro riso saltato con frutti di mare alla piastra lo ricorderò per il resto della vita.
https://www.yelp.it/biz/ginza-sushi-king-torino; Servizio: veloce anche quando si sceglie dal Menù. Consigliato per un pranzo veloce ed economico, sconsigliato per gli esperti di cibo giapponese. Il servizio all you can eat è un ottimo compromesso per mangiare tanto a un prezzo conveniente.
https://www.yelp.it/biz/girarrosto-santa-rita-torino; Cena veloce e buona con soli 5€! Cordialissimi, possibilità da asporto e da consumo in loco. Personale cortese Pulizia del locale ottima Prezzi eccessivi
https://www.yelp.it/biz/giudice-esercizio-torino; Elegante, ottimo servizio e soprattutto piatti di livello. Lasagnette asciutte e servizio agitato e poco gentile a eccezione di qualcuno! Eccellente l'agnello in due cotture: soprattutto il carré al sangue: era impeccabile.
https://www.yelp.it/biz/giusti-torino; Clientela chiaramente fidelizzata e di buon livello, almeno a pranzo, e cortese e veloce servizio. Senza infastidirsi hanno aspettato che arrivassero tutti, il cibo ottimo, le porzioni consistenti e il servizio veloce. Non è possibile visitare San Salvario patria della nuova movida rumorosa senza concedersi prima una pausa al giusti!
https://www.yelp.it/biz/gramsci-torino-2; Il servizio è attento e veloce . Bella location, servizio veloce e staff cordiale. disponibile. Servizio rapido e cortese, ambiente curato e ottimo cibo.
https://www.yelp.it/biz/granbar-torino; Servizio veloce e con personale molto gentile. Ideale per un pranzo veloce o per un abbondante aperitivo. Servizio abbastanza veloce ,considerando che il locale era sempre pieno!
https://www.yelp.it/biz/grande-muraglia-di-zhans-rong-e-li-songhai-torino; Personale molto efficiente e veloce a prendere le ordinazioni. Il servizio, sopratutto durante i fine settimana, è inacettabile. Per un pasto veloce, ma buono, ed un ambiente informale.
https://www.yelp.it/biz/greek-food-lab-torino-2; Provato in pausa pranzo, mangiando l'insalata greca. Cibo buonissimo, locale super carino, servizio veloce e gentile! E la baklava dalla consistenza sembrava di una settimana fa.
https://www.yelp.it/biz/grezzo-torino; Il servizio è veramente cordiale e molto competente. L'addetta, una ragazza giovane, è stata poco cortese: brusca nelle risposte e poco cordiale. Ne avresti sicuramente apprezzato diversamente il valore.
https://www.yelp.it/biz/grill-burger-house-bari; Servizio molto cortese, disponibile e abbastanza rapido. Consigliabile la prenotazione specie nei fine settimana. Servizio veloce ed efficiente, molteplicità di panini disponibili, location semplice ed essenziale.
https://www.yelp.it/biz/grom-torino; Il servizio è stato molto veloce e cortese. Buon servizio, prezzi nella media, gelato molto buono, personale cortese! Gelato molto buono, personale gentile, prezzi nella media di Torino, situato a poca distanza dalla stazione di Porta Nuova.
https://www.yelp.it/biz/grom-torino-2; Locale piacevole e pulito ( gelato da asporto) Riprovato il Pistacchio..molto cremoso e poco gusto pistacchio, torrone indecifrabile, Servizio Gentile&veloce. Preludio ad una bella passegiata in centro a Torino, la pausa da Grom è sempre consigliata.
https://www.yelp.it/biz/grom-torino-4; Dopo pranzo il gelato ci sta sempre, catena conosciuta, gelato buono e presentato bene. Comoda la posizione...buono e gentile il servizio dello staff.. Il personale è gentile ed il posto ben collegato coi mezzi e vicino ad un parcheggio multipiano, facilmente accessibile.
https://www.yelp.it/biz/grotta-azzurra-bari; Cucina tradizionale con buone portate e qualitá discreta.Arredamento un pò datato. In generale il locale è carino ma manca atmosfera, il cameriere è cortese ma freddo. Qui si mangia semplice, si spende poco, il personale è semplice ma gentile.
https://www.yelp.it/biz/gufo-bianco-torino; Tavoli sufficientemente distanziati, servizio veloce e cortese. Il servizio è stato attento e veloce, il cibo cucinato benissimo. �? stata una serata perfetta, resa tale anche grazie al servizio efficiente, veloce, attento, premuroso dall'inizio fino alla fine.
https://www.yelp.it/biz/guido-gobino-torino-3; Personale sicuramente molto gentile e rapido nelle ordinazioni. Anche sugli scaffali ci sono sacchetti e scatole prontamente disponibili per un rapido acquisto. Il servizio non è molto veloce, ma la sala è in buon luogo per chiacchierare.
https://www.yelp.it/biz/gusti-e-sapori-torino; Nonostante fosse stato sabato il servizio è stato veloce e cordiale. Prmi e secondi nonchè Pizza davvero buonissimi, servizio davvero rapido e cortese! Il servizio è veloce , pizza nella media, così come i primi..
https://www.yelp.it/biz/gyrosteria-yannis-bari-2; Molto veloce il servizio, un po' piccolo il posto ma carino, cibo caratteristico ma molto buono. Ottima impressione all'inizio per il servizio ma poi la sbavatura di non servire tutti contemporaneamente . Leggere tanta soddisfazione nelle sue parole ci gratifica enormemente.
https://www.yelp.it/biz/habanero-torino-2; Buon messicano, servizio rapido e molto cortese. Personale gentilissimo ed il servizio è veloce. Dolci discreti, servizio puntuale ed affabile, conto giusto.
https://www.yelp.it/biz/hagakure-fusion-bari; Anche il take away funziona alla grande. Comodissima la possibilità del take-away soprattutto con la nuova app. Ottima anche la formula take away: servizio collaudato, puntuali, packaging perfetto.
https://www.yelp.it/biz/hamp-bari; Rapporto qualità/prezzo ottimo, servizio veloce e cortese. La qualità è molto buona, il servizio rapido e l'atmosfera accogliente. Locale in pieno centro, è stato in settimana e non c'era molta gente.
https://www.yelp.it/biz/happy-days-bar-torino; Il servizio è stato veloce ed il cibo molto buono. 11 Agosto, un pasto veloce prima di rimetterci in macchina. In pausa pranzo per un secondo (il contorno è escluso),acqua e caffè 18 euro.
https://www.yelp.it/biz/hokkaido-torino; Questo luogo è un altro punto di riferimento per la pausa pranzo in settimana. Servizio rapido (quasi troppo) e staff gentile ! Personale veloce e preparazione del sushi a vista.
https://www.yelp.it/biz/home-burger-palese; Poshed fino take-away burger di posti a sedere in legno. Personale solare, accogliente e veloce nel servizio. Prezzi sopra alla media, servizio rapido e cortese.
https://www.yelp.it/biz/horas-kebab-torino; Servizio veloce e cortese, ma cibo pessimo. Kebab molto buono, servizio rapido, prezzi abbordabili. Buona qualità del cibo e servizio veloce.
https://www.yelp.it/biz/hua-dou-cheng-torino; Servizio veloce, piatto buoni e abbondanti: consigliatissimo! Comunque ottimo il cibo, veloce ed efficiente il personale. Come in tutti ristoranti cinesi il servizio è veloce!
https://www.yelp.it/biz/hua-li-du-torino; Il cibo è buono ed il servizio veloce. Servizio rapido, camerieri disponibili, piatti abbondanti e prezzi onesti. Qualità buona, prezzi molto contenuti, ideale per pranzo o cena tranquilla e veloce.
https://www.yelp.it/biz/i-soliti-amici-torino; Veloce pranzo di lavoro durante la pausa. Il locale è accogliente e il personale cordiale,rapido,disponibile. Servizio mediamente veloce (accettabile per un sabato sera affollato).
https://www.yelp.it/biz/i-soliti-ignoti-torino; Consigliato in giorni più tranquilli in settimana, molto buono! Il servizio è stato puntuale e la pizza molto buona. Il servizio è veloce e la pizza è molto buona.
https://www.yelp.it/biz/i-tartufi-bistrot-torino; Servizio è veloce ed è tutto molto buono. Ottimo servizio, personale cordiale e veloce, alta qualità a prezzi ragionevoli. Personale cortese e disponibile, servizio veloce, buona anche la disponibilità di vini.
https://www.yelp.it/biz/i-tesori-bari; Locale molto carino, personale gentile e disponibile. Location molto confortevole, personale disponibile e sempre molto gentile. Servizio spigliato e cordiale prezzi leggermente alti ma ci può stare!
https://www.yelp.it/biz/i-tre-scalini-torino; Consigliato per una cena veloce in settimana spendendo poco Ottimo il servizio veloce anche se affollato. Prezzi sotto la media, servizio abbastanza rapido.
https://www.yelp.it/biz/ichiban-torino; Molto carino il locale e servizio veloce . Riservano sempre un servizio accogliente e soprattutto puntuale. Ottimo per un pranzo veloce in centro a Torino!
https://www.yelp.it/biz/il-barotto-torino; Il servizio è veloce e il personale cordiale e disponibile. Cibo di ottima qualità e servizio cordiale, amichevole e spiritoso. Il personale è molto gentile è disponibile
https://www.yelp.it/biz/il-buco-torino; Davvero il ristorante è elegantissimo curato nei dettagli e il proprietario è molto gentile.
https://www.yelp.it/biz/il-caciucco-torino; Cortese e veloce il servizio, prezzo nella media, ottimo il vino. Arredamento un po' retrò, servizio impeccabile: allo stesso tempo professionale ma non impersonale. La location non è niente di che, il personale invece è estremamente gentile e disponibile.
https://www.yelp.it/biz/il-caffe-di-roma-torino; , per il pranzo poco indicato, c'è poca scelta di panini e piatti, d altronde è specializzato in caffè!
https://www.yelp.it/biz/il-cortiletto-torino-2; Pochi tavoli, cucina a vista (come se fosse la casa di amici), personale cortese e non invadente. Un pranzo molto soddisfacente e piacevole, dal rapporto qualità e prezzo ottimo: 50€ tutto compreso. Ambiente tranquillo e molto curato, personale gentile e pietanze buone.
https://www.yelp.it/biz/il-dolcetto-bari; Cornetti vegani buonissimi,marmellate fantastiche e personale gentile e accogliente!
https://www.yelp.it/biz/il-fornaccio-bari; Panzerotti molto buoni così come le pizze, anche da asporto, servizio rapido e tutto molto buono come sempre. I panzerotti sono fatti bene e il servizio è rapido ed efficiente. ottimo panzerottata fritto ottimi prodotti servizio veloce habitat familiare locale pulito solo problemi di parcheggio
https://www.yelp.it/biz/il-gelatiere-bari-3; Gelateria Take away su viale salandra con numerevoli gusti, anonima all'apparenza ma il gelato è eccezionale. Servizio veloce, finalmente con i numeri per la coda. Ottimo gelato servito in un molteplicità di gusti da personale gentile e abbastanza veloce.
https://www.yelp.it/biz/il-gelato-amico-torino; Ottima gelateria da asporto di fronte a piazza Benefica in zona stazione di Porta Susa. Ottimo gelato, tutti i gusti sono prodotti con ingredienti di origine vegetale, servizio pronto e veloce! Da sottolineare: ragazza al banco davvero gentile e cialda del cono buonissima.
https://www.yelp.it/biz/il-giglio-torino; Il tutto condito da servizio veloce e attento. Ottima cucina di pesce, patron gentile e servizio veloce. Servizio rapido e personale disponibile Prezzi nella media Consigliato
https://www.yelp.it/biz/il-padellino-torino; Servizio rapido e qualità del cibo ottima. Servizio distratto e approssimativo, tuttavia molto rapido. Servizio super veloce nonostante il locale pieno.
https://www.yelp.it/biz/il-panino-giusto-torino; Il servizio è stato veloce e cortese. Giusto per un pranzo veloce, ma di qualità! Perfetta per un pranzo veloce ma sostanzioso ,)
https://www.yelp.it/biz/il-peccato-torino; Servizio veloce, educato e sorridente : ottima la cucina. Il personale è gentile, disponibile e veloce nel servire. Molto buono il servizio offerto dai camerieri.
https://www.yelp.it/biz/il-picchio-torino; Servizio molto rapido e locale ben arredato. Servizio veloce con personale simpatico e qualificato . Servizio essenziale e rapido, come i piatti serviti.
https://www.yelp.it/biz/il-porticciolo-torino; Provato menu veloce da pranzo e dalla carta a cena. Servizio ottimale, cortese, veloce Buon rapporto qualità/ prezzo Discreta lista vini Buono anche per cena romantica Personale veloce ed attento, qualità del cibo nella media, costo normale per un ristorante di pesce.
https://www.yelp.it/biz/il-porto-torino; Un plauso al personale molto attento e puntuale. Il personale è molto gentile ed il servizio veloce. Il servizio è veloce e attento nel rispetto dei tempi!
https://www.yelp.it/biz/il-punto-verde-torino-2; Consigliato a vegetariani ma anche per chi vuole una pausa pranzo un po' diversa! Il servizio è ottimo, perchè il titolare è molto cortese e disponibile. Location tranquilla con dehor, proprietario cordiale e molto gentile.
https://www.yelp.it/biz/il-ristoro-dei-mercanti-torino; Adatto sia per un pranzo veloce che per un pranzo più lungo. Ottimo per un pranzo veloce, ma genuino, se si è di passaggio per un visita in città. Ambiente famigliare con personale molto gentile e premuroso.
https://www.yelp.it/biz/il-rospetto-torino; Servizio veloce e cortese, prezzi nella norma. Personale molto gentile e disponibili, rapido il servizio. Il servizio è veloce e il personale cortese.
https://www.yelp.it/biz/il-rustico-bari; Spartano . ...ma che soddisfa ampiamente . ...personale gentile e veloce. Consigliato per una cena veloce senza troppi fronzoli, e decisamente economico. Antipasti abbondanti e buoni, la pizza molto buona, personale simpatico e veloce.
https://www.yelp.it/biz/il-sedile-bari; Il servizio è molto cortese e veloce. Cameriera era molto cordiale e veloce . Pizze erano ok, buon vino bianco, servizio veloce.
https://www.yelp.it/biz/il-tabisca-turin; Personale gentile e rapido nel servire . Previa prenotazione del tavolo, personale preparato e gentile rapido ed efficiente. Anche se il ristorante era pieno il servizio è stato rapido.
https://www.yelp.it/biz/il-vicolo-torino; Pranzo veloce in una calda giornata di giugno. Personale attento e cordiale, veloce nel servizio e non invasivo. Soggiorno due sere alla settimana a Torino per motivi di lavoro.
https://www.yelp.it/biz/imbarchino-torino; Ideale per un aperitivo e per ascoltare della buona musica. Posto molto carino e tranquillo sulla riva del Po, all'interno del parco del Valentino! location incantevole ma per il resto bisogna cambiare mestiere o affidarsi a mani più esperte.
https://www.yelp.it/biz/imbarco-perosino-torino; Il servizio è stato puntuale e molto gentile. Nonostante la splendida posizione, se si cerca un ristorante, questo è da evitare, in particolare nei fine settimana. Un posto meraviglioso proprio sul fiume nel parco con un servizio eccellente e cordiale.
https://www.yelp.it/biz/in-vino-veritas-torino; Il servizio è stato veramente veloce senza attese. Locale piccolino ,è consigliabile prenotare soprattutto nel fine settimana. Il cibo è davvero buono, il servizio veloce e cortese, la location è calda, intrigante, piacevolissima.
https://www.yelp.it/biz/indian-street-food-torino; Consigliato per uno pasto veloce e saporito. Il locale e' proprio piccolo pensato soprattutto per il take-away visto che i posti al bancone sono veramente limitati. Una prassi non scontata in un locale pensato per brevi soste o per l'asporto.
https://www.yelp.it/biz/istanbul-santasophia-torino; I prezzi sono tranquilli, il personale davvero gentile e rapido. Aperto tutti i giorni fino alle 23.
https://www.yelp.it/biz/italians-wok-better-torino-3; Peccato per il conto salatissimo, il cibo è buono (poco ma buono), l'addetta è carina,simpatica, gentile e molto brava. Ottimo per un pranzo o una cena tranquilla. di cartone e plastica, posate di plastica (quanto inquinamento!)
https://www.yelp.it/biz/japs-torino-2; Anche l asporto é sempre curato e puntuale! Comodo per chi è di fretta ma anche per il Take away! Ottimo per un pranzo veloce e soddisfacente.
https://www.yelp.it/biz/japs-torino-3; Take away sempre molto veloce, anche senza aver prenotato in anticipo. Provato sia come take away che sul posto. Take away o in loco la qualità rimane sempre ottima.
https://www.yelp.it/biz/john-joy-torino; Si va un giorno della settimana per curiosità viste una parte delle recensioni positive. Locale è meraviglioso e raffinato con atmosfera molto intima, la cucina è buona, il servizio accogliente e veloce. Il servizio è stato preciso ed attento e allo stesso tempo discreto e professionale.
https://www.yelp.it/biz/john-lennons-torino; Prezzi assolutamente nella norma e servizio rapido. Per il resto il servizio è stato veloce. Affollatissimo nel fine settimana, più abbordabile negli altri giorni.
https://www.yelp.it/biz/joys-pub-bari; Sempre pieno di gente, soprattutto nel fine settimana. Ogni settimana ci sono serate a tema, per il divertimento dei grandi tanto quanto quello dei piccoli. Posto ideale per passare una tranquilla serata tra amici.
https://www.yelp.it/biz/jubin-di-hu-lidan-torino; Consigliatissimo per una pasto veloce ed economico Locale molto pulito, servizio rapido e personale gentile! Ristorante molto comodo per mangiare in pausa pranzo!
https://www.yelp.it/biz/jumping-jester-torino; Pausa pranzo nel pub, servizio veloce, ragazze simpatiche e cibo buono! Pranzo con la famiglia, veloce...economico...buono e gustoso. Atmosfera accogliente e personale sorridente e veloce.
https://www.yelp.it/biz/karmacola-torino; Le portate sono generose e il servizio curato e veloce. Il servizio è veloce cordiale e gentile..e i piatti decisamente ottimi! Carina l'idea di portare, a fine pasto, dei digestivi.
https://www.yelp.it/biz/kashmir-torino-2; Funziona sia da ristorante che da fast food o take away. Consigliato per un pranzo rapido ed econimico Ideale per un pasto veloce vicino alla stazione!
https://www.yelp.it/biz/kensho-torino; Tappa fissa almeno una volta alla settimana. Ristorante raffinato, elegante... ottima presentazione dei piatti, prodotti di qualità, servizio rapido... Personale simpatico, gentile, professionale, a volte troppo ingoffito da manierismi esagerati.
https://www.yelp.it/biz/kido-ism-torino; Per concludere: servizio puntuale e sorridente, un unico appunto sulla carta dei vini. Gentilezza e discrezione, al contempo presenza del servizio in sala, sempre puntuale e mai indiscreta. Il cibo è ottimo, l'ambiente accogliente e il personale molto gentile.
https://www.yelp.it/biz/kiki-torino; Servizio veloce e pesce delizioso e fresco. Pesce freschissimo,ottimo il riso, veloce e curato il servizio! Il personale è cortese, preparato e il servizio è rapido.
https://www.yelp.it/biz/kipling-torino; Servizio veloce e locale davvero molto carino. In settimana trovate piatto unico ad €11. Servizio rapido e molto discreto, senza grandi interazioni.
https://www.yelp.it/biz/km5-torino; Ottimo per un aperitivo veloce e nella movida torinese. Cibo buono, servizio veloce e gentile, buon rapporto qualità prezzo. Sia per una pausa pranzo o per un aperitivo la sera consigliatissimo
https://www.yelp.it/biz/kokoroya-torino; Ma al massimo, c'è il take away :) Gastronomia giapponese da take away o eat in, con anche prodotti confezionati. I bento box d'asporto sono poi un'ottima trovata.
