url;review
https://www.yelp.it/biz/kombu-torino; Il servizio al tavolo è veloce pur essendo il locale pieno di gente per il take away. Da non sottovalutare la possibilità di take away e di ordinare prima di arrivare su internet. Velocità nel servizio e cortesia, sia per mangiare in loco che per l'asporto.
https://www.yelp.it/biz/kyoto-torino; Il servizio è stato rapido e preciso nelle ordinazioni. Ma servizio rapido e sushi di qualità nella media! Non è mai caotico ed il servizio è veloce.
https://www.yelp.it/biz/l-accademia-del-panino-torino; Assolutamente da provare per una pausa pranzo veloce! (3,50 euro) personale gentile e rapido..che dire, consigliato! Per una pausa pranzo breve ma con gusto!
https://www.yelp.it/biz/l-aglio-torino; Il personale è rapido e molto cordiale. Prezzo onesto e pausa pranzo veramente rilassante. Bella location (anche se manca un insegna fuori) Buon servizio ma prezzi fuori media per cio che viene servito.
https://www.yelp.it/biz/l-agrifoglio-torino; La scelta dei vini è di un buon livello e il servizio al tavolo veloce ed efficiente. Il locale è carino e non troppo grande, il servizio è stato veloce e il personale molto gentile. In settimana il locale non è pieno ed insieme alla pacata musica in sottofondo, crea un connubio rilassante
https://www.yelp.it/biz/l-ancora-torino-2; Il menu della pausa pranzo non è molto variato. Il servizio è professionale e attento, e veloce il giusto. A pranzo, nei giorni feriali, prezzi abbordabili (primi piatti dai 10 ai 15 euro, più bevande e coperto).
https://www.yelp.it/biz/l-ancora-torino-3; Vi è la possibilità di take away. Consigliato per una pausa pranzo e una cena, anche con amici. E' un ristorante informale, con personale molto cortese, ma il servizio è un pò lento..
https://www.yelp.it/biz/l-angolo-del-caff%C3%A8-torino; Ottimo per una colazione mattutina o uno spuntino a pranzo.
https://www.yelp.it/biz/l-angolo-divino-torino; Il personale è giovane e cortese, il servizio puntuale e veloce. Servizio cordiale e puntuale, ottimo anche il rapporto qualità / prezzo. Il servizio è veloce, attento e competente, con buona disponibilità verso il cliente.
https://www.yelp.it/biz/l-antico-arco-cellamare; Il servizio al tavolo è abbastanza veloce. Servizio veloce nonostante la piccola saletta fosse piena in un anonimo mercoledì. Il servizio da asporto è meglio della location che purtroppo è piccola.
https://www.yelp.it/biz/l-birichin-torino-2; Pur essendo in settimana il locale, molto intimo, caldo e accogliente era pieno. Il posto ideale se desideri una pausa pranzo davvero rilassante e senza riempirti troppo ! Lo Chef Batavia è stato delizioso, un gentiluomo di talento, gentile e interessante.
https://www.yelp.it/biz/l-hamburgueria-di-eataly-torino; Ottimo per una pausa pranzo veloce e non cara Ideale per una pausa dalla quotidianità e dalla frenesia cittadina. Il personale è disponibile, gentile e veloce.
https://www.yelp.it/biz/l-idrovolante-torino; Il personale è molto affabile e rapido. SERVIZIO: 4/5 Personale disponibile e cordiale, servizio veloce. Il servizio è eccellente e veloce i piatti gustosi e invitanti.
https://www.yelp.it/biz/l-oca-fola-torino; Interessantissime le proposte per la pausa pranzo L'accoglienza è ottima così come il servizio puntuale e preciso. Pausa pranzo con tutti i colleghi per i saluti di Natale.
https://www.yelp.it/biz/l-osteria-di-pierantonio-torino; Servizio rapido e staff simpatico e cordiale Tutto ottimo, veloce, personale educato e cortese. Locale pulito, personale molto gentile e servizio veloce.
https://www.yelp.it/biz/l-osteria-le-ferriere-torino; Ora fanno anche pizzeria d'asporto quindi ancora meglio! Il padrone molto gentile e il servizio veloce. Il servizio è stato veloce e il personale è gentile.
https://www.yelp.it/biz/la-badessa-torino-2; Piatti ben preparati è un serv attento e puntuale. Servizio attento e puntuale con ottima accoglienza del titolare. Servizio veloce ed efficiente, il menù ben studiato, ben presentato e di qualità.
https://www.yelp.it/biz/la-baita-bari; Location sul mare con piccolo spazio all aperto ma ideale per Take-away un panino al volo. C'è da fare coda, non sempre e anche quando si fa è abbastanza veloce. Il panino è buono e gli ingredienti per il condimento sono altrettanto.
https://www.yelp.it/biz/la-battigia-di-schiralli-antonio-bari; Buono il servizio ed anche veloce . Servizio più che veloce, antipasti tutti eccezionali, soprattutto quelli di pesce. Primi di pasta ai frutti di mare ottimi, servizio gentile e anche veloce.
https://www.yelp.it/biz/la-botte-gaia-torino; Una piacevole pausa nell'intensa giornata del turista. Favolosa selezione di vini - drink o da asporto. Il personale è cortese e molto preparato.
https://www.yelp.it/biz/la-bottega-del-gusto-torino; Unica pecca: la cena è stata un po' troppo veloce, forse perché di sabato. Servizio rapido. qualità  dei piatti eccelsa. specialità : tris di carne crudo, cous cous alle verdure e tanto tanto altro.... Ottime specialità piemontesi, personale cortese e ambiente confortevole... da provare sicuramente............
https://www.yelp.it/biz/la-bufala-torino; I prezzi sono in linea con altri locali, il personale é cortese. Servizio poco cordiale e decisamente non professionale. Aperto sia a pranzo che a cena, non si tratta del franchising !!
https://www.yelp.it/biz/la-cabane-torino-2; Buona la carta dei vini, ottime le ostriche, tutto molto fresco, servizio preciso e puntuale. Buono il servizio ed il rapporto qualità/prezzo abbastanza proporzionato. Personale gentile e attendo a trattare i prodotti.
https://www.yelp.it/biz/la-campana-torino-2; Ottimo per un pranzo veloce o per una cena informale L'occasione è stata una pausa pranzo nel capoluogo piemontese, accompagnato da un collega. Servizio veloce e cortese in un locale semivuoto, un po' datato ma ben tenuto.
https://www.yelp.it/biz/la-cantina-torino; Servizio veloce, buon prezzo dei piatti,la cantina leggermente cara!! Il locale è grazioso e il servizio cortese e veloce. Atmosfera accogliente da vineria, servizio veloce e presente, cibo in prevalenza piemontese.
https://www.yelp.it/biz/la-cantinella-torino; Servizio un po' freddo ma cordiale e veloce. Servizio rapido e personale davvero cortese e disponibile. Pizza anche da asporto arriva a casa buona!
https://www.yelp.it/biz/la-capannina-torino-2; Ottimo impasto,ottimi ingredienti, servizio rapido, prezzi nella media! Servizio attento e molto veloce, personale super gentile. Servizio rapido e gentile, ambiente tranquillo e cibo di qualità.
https://www.yelp.it/biz/la-casa-del-demone-torino; Complessivamente piacevole con servizio veloce e buoni cocktail Servizio perfetto, personale attento,gentile, veloce ma soprattutto estremamente disponibile! Servizio rapido e gentile.. in ultimo ma non come importanza, ottimo rapporto qualità prezzo.
https://www.yelp.it/biz/la-conca-torino-2; Ovviamente veloce il servizio e pulitissimi i bagni. Soggiorno due sere alla settimana a Torino per motivi di lavoro. Questo pacchetto è disponibile solo a pranzo e nei giorni feriali.
https://www.yelp.it/biz/la-cuite-torino; Servizio ragionevolmente attendo e rapido nonostante il flusso di clienti (San Salvario d'estate...). Prezzi alti servizio pessimo e cucina pretenziosa. Ambiente piacevole e giovanile ma professionale e cortese.
https://www.yelp.it/biz/la-drogheria-torino; Bellissima ed effetto la piazza è personale veloce e simpatico. Tutto sommato, per un pranzo veloce e senza pretese va bene. Provato ieri sera,un cocktail ALCOLICO per un rapido aperitivo accompagnato da patatine...
https://www.yelp.it/biz/la-fila-torino; Servizio veloce e cortese prezzo nella media Tutto ok personale attento gentile , servizio veloce. Accogliente, camerieri educati, servizio impeccabile e giustamente veloce.
https://www.yelp.it/biz/la-gaia-scienza-torino; cibo squisito e servizio veloce e discreto. Il personale è cordiale e il servizio è puntuale. �? bastato contattare l'osteria via mail una settimana prima per concordare tutto in due giorni.
https://www.yelp.it/biz/la-galina-scannata-torino; Servizio veloce ma non frettoloso, personale gentilissimo. Il servizio è sempre puntuale, elegante ma non distaccato. Formula molto divertente, veloce il servizio, personale molto professionale e simpatico.
https://www.yelp.it/biz/la-granseola-torino; Durante la settimana di sera ha menù di pesce a 15 euro. In settimana menù anche a 10 Euro per carne e 15 Euro per pesce. Tuttavia a pranzo il servizio è lentissimo e inadeguato a una pausa pranzo dì lavoro.
https://www.yelp.it/biz/la-gricia-torino; Per una pausa pranzo buona e di qualità! Ottima la cucina, ambiente accogliente, piatti curati e servizio rapido e cortese. Servizio adeguato non troppo lento non troppo veloce giusto per chi desiderare trascorrere la serata.
https://www.yelp.it/biz/la-gustosa-torino; Molto veloce anche il servizio al tavolo. La signora ai tavoli veloce, sorridente ed educata. �? un'ottimo posto anche per pizza da asporto.
https://www.yelp.it/biz/la-limonaia-torino; Atmosfera informale e molto gradevole, un servizio puntuale e preciso. Un servizio puntuale e preciso, ma mai invadente, perfetto per una cena romantica. La carta dei vini è molto buona e il servizio rapido, attento e gentile.
https://www.yelp.it/biz/la-locanda-bari; Prodotto fresco e servizio impeccabile lo ha sempre contraddistinto. Carissimo Francesco, sono davvero felice di registrare il suo genuino apprezzamento! Buono anche il livello di trasparenza nel costo del servizio grazie alla disponibilità di una dettagliata lista delle pietanze.
https://www.yelp.it/biz/la-luna-rossa-torino; Personale in compenso cortese e servizio veloce. Il servizio è stato gentile e rapido. Locale carino dal personale gentile e veloce.
https://www.yelp.it/biz/la-madia-torino; Unica pecca il servizio non così veloce, tuttavia l'attesa viene pienamente ripagata! Insomma anche un tradizionalista come il sottoscritto trova soddisfazione. Il servizio e' ottimo ed ingentilito dal sorriso cortese e dall'attenzione di due sorridenti signorine .
https://www.yelp.it/biz/la-magnolia-torino-3; Buona accoglienza, buon cibo e servizio veloce. La prima volta camerieri molto educati,servizio molto veloce e cibo fresco. Il personale è stato veramente cortese ed il servizio rapido e preciso.
https://www.yelp.it/biz/la-monachella-torino; Servizio molto veloce e con personale cortese. Il servizio è stato veloce, personale gentile. Servizio veloce, abbastanza cortesi e pizza molto buona.
https://www.yelp.it/biz/la-pace-torino; Il servizio è piuttosto attento e veloce. Sempre i soliti piatti ma il servizio è rapido ed i prezzi sono buoni. I tavoli sono abbastanza distanziati fra di loro e il servizio risulta essere veloce e preciso.
https://www.yelp.it/biz/la-pagoda-di-hu-lia-meng-torino; Personale gentile veloce parlano molto bene l'italiano. Il servizio e sempre abbastanza veloce e cortesissimo. Servizio gradevole e cordiale,veloce anche l'arrivo dei piatti.
https://www.yelp.it/biz/la-panzanella-torino; I prezzi non sono alti, sono giustissimi rispetto alla qualità del cibo e a tutto il resto. Il servizio è molto buono, la ragazza che ha preso le prenotazioni era davvero molto cortese e disponibile. Il ragazzo di sala vi accoglierà con gentilezza e simpatia e con estrema professionalità vi consiglierà sulla scelta.
https://www.yelp.it/biz/la-parrilla-de-juan-bari; Il personale e' sempre molto gentile e veloce! E soprattutto locale sempre pieno anche in settimana. Almeno una volta a settimana è una tappa fissa.
https://www.yelp.it/biz/la-piadineria-torino; Ottima per una pausa pranzo veloce e gustosa! Consigliato per un pranzo/cena veloce e informale! Servizio veloce ottimo per un pasto veloce.
https://www.yelp.it/biz/la-pignata-bari; Ambiente elegante, personale gentile e rapido nel servizio. Forse il servizio, come dicevo perfettamente oliato, e' un po' troppo veloce e ingolfante. Una sana ed impeccabile cucina di tradizione!
https://www.yelp.it/biz/la-piramide-torino; Il personale è gentile e abbastanza veloce. Calcone era veramente buono e il servizio era veloce. Consigliatissimo per ogni tipo di pausa e per il pranzo.
https://www.yelp.it/biz/la-porta-rossa-torino; Il servizio è veloce, camerieri competenti e non invasivi. Ostriche freschissime, servizio puntuale, finalmente spazi ampi e vivibili. Semplice da trovare e anche il parcheggio non è difficoltoso, almeno durante la settimana.
https://www.yelp.it/biz/la-provolina-bari; Veloce il servizio nonostante l' affollamento e gentilissimo il personale. Riserva anche dei posti senza pagare il coperto perché prende una pizza d'asporto. La formula scelta è stata da asporto con utilizzo dei tavoli di cortesia.
https://www.yelp.it/biz/la-pupetta-bari; Disponibili anche numerose proposte di rosticceria e primi per una pausa pranzo gustosa, veloce e economica. In pausa pranzo quasi sempre si fa la coda !!! Un piccolo locale nel centro di Bari, sempre affollato ma con un servizio rapido e sempre cordiale.
https://www.yelp.it/biz/la-reseda-torino; Servizio cortese e veloce, locale abbastanza ampio e luminoso. buoni ingredienti, servizio veloce e proprietari cortesi e disponibili. Assolutamente da tornare soprattutto in settimana che è piu tranquillo.
https://www.yelp.it/biz/la-ristonomia-torino; Servizio al tavolo veloce e personale gentile. Prezzi per la pausa pranzo da 10€... Servizio lento per la pausa pranzo (preso permesso).
https://www.yelp.it/biz/la-romana-torino; Ottimo gelato e personale carino e veloce. Gusti particolari, dessert deliziosi e personale sveglio e veloce. Lo staff è assolutamente preparato e veloce nel servire, consigliare e i membri sono anche simpatici.
https://www.yelp.it/biz/la-societ%C3%A0-dei-carbonari-torino; Il cibo era buono, i prezzi erano accettabili, il ristorante era accogliente e il personale era gentile e disponibile.
https://www.yelp.it/biz/la-stadera-pizzeria-la-stadera-di-muscariello-s-e-c-pizz-torino; Servizio abbastanza veloce sia durante la pausa pranzo sia la sera. Il servizio è rapido, efficiente e cortese. Complimenti al servizio piuttosto veloce e gentile
https://www.yelp.it/biz/la-svolta-torino; Servizio abbastanza veloce e cibo molto buono: tagliata di tonno buonissima. Bel locale, si respira una bella atmosfera, personale cordiale, gentile e veloce. Il personale è gentile e il servizio è stato molto veloce nonostante fosse sabato sera.
https://www.yelp.it/biz/la-tana-del-polpo-bari; Potete andare sia al ristorante che al take away accanto. Servizio ottimo e veloce, il conto giusto! Servizio veloce, personale sorridente ed estremamente gentile.
https://www.yelp.it/biz/la-taverna-dei-mercanti-turin; Personale gentile, veloce nel prendere ordine ed altrettanto nel servirci. Bella location consigliata da gestori b&b personale gentilissimo e super veloce.Buonissimi gli agnolotti ripieni!! Locale accogliente servizio attento rapido impeccabile, buoni gli antipasti, vitello tonnato fresco e saporito, buoni i primi, prezzi bassi..consigliato
https://www.yelp.it/biz/la-taverna-greca-torino-2; �? molto frequentato, anche durante la settimana. Locale accogliente ed informale con servizio rapido e personale cortese. Servizio cortese e puntuale, locale piacevole anche x serate di coppia.
https://www.yelp.it/biz/la-vecchia-europa-torino; Il servizio è stato curato e veloce. Servizio rapido e cortese, ottimo anche con just eat. Rapida veloce e all'esterno si trova con facilità parcheggio !
https://www.yelp.it/biz/la-via-del-sale-torino; Ambiente molto curato e servizio veloce e cortese. Comunque il servizio è stato ottimo e veloce. Il servizio è stato cortese, attento e veloce.
https://www.yelp.it/biz/la-via-della-seta-torino; Molta attesa ai tavoli e al take away. Il personale è molto cortese e veloce. Personale molto cordiale e simpatico, attento e disponibile oltre che rapido.
https://www.yelp.it/biz/la-voglia-matta-torino-6; Per le vaschette d'asporto i prezzi sono più nella norma, forse conviene addirittura mangiare sul momento. Tappa fissa almeno una volta a settimana,gelato buonissimo e immenso.Giovanni ci mette la vera passione,bravissimo,educato e....locale sempre pieno. Il rapporto quantità/prezzo è esageratamente conveniente, soprattutto per chi decide di mangiare solo un gelato veloce per pranzo.
https://www.yelp.it/biz/laboratorio-comba-torino; Il titolare molto gentile, disponibile, attento al cliente.
https://www.yelp.it/biz/las-vegas-torre-a-mare; Servizio veloce e definisco questo gelato FAVOLOSO! Posti all'aperto e all'interno, personale cortese e servizio rapido. Il servizio è abbastanza scontroso, cosa mai facciate, non sedersi di una sedia con un take away gelato!!
https://www.yelp.it/biz/le-cantine-di-bacco-torino; servizio molto cordiale e rapido il giusto. Servizio veloce (eravano i soli avventori), prezzi medi. Conviene prenotare (soprattutto nel fine settimana), perché la sala non è grandissima.
https://www.yelp.it/biz/le-grand-tabu-bari; Ottimo bar, bell arredamento, tavoli all esterno, personale molto gentile. Un buon posto per aperitivi e pranzo.
https://www.yelp.it/biz/le-lupin-dei-f-lli-zambetta-bari; Adatto sia per studenti che per gli impiegati per un pranzo veloce. Ideale per la pausa pranzo dei lavoratori e studenti, essendo vicinissimo al campus universitario. Offrono un servizio Self Service di buona qualità  con prezzi modici.
https://www.yelp.it/biz/le-mura-bari; Consigliato anche per il servizio molto cortese, celere e disponibile! per il resto cucina si scarsa qualità
https://www.yelp.it/biz/le-plus-bon-bari; Lunghe attese il sabato a causa del intenso servizio d'asporto. Pizza da asporto, ma anche da magiare sul posto al bancone. Sono di poche parole E non mancano di offerte per conquistare il cliente da asporto.
https://www.yelp.it/biz/le-rondini-torino; Poi però il servizio è puntuale e veloce. Sevizio cortese e veloce anche con locale pieno Locale carino, servizio veloce, attento e molto cortese.
https://www.yelp.it/biz/le-tre-lanterne-bari; Encomio anche al personale, gentilissimo e veloce. Simpaticissimo il proprietario, servizio rapido e cortese... Il personale è veloce e disponibile, ma non mostra entusiasmo o simpatia, non ci si sente particolarmente accolti.
https://www.yelp.it/biz/le-veronique-bari-2; Il personale è gentile e il sevizio veloce. Servizio molto rapido, efficiente, molto preciso e grande organizzazione. Ma per una serata tranquilla, in settimana, è molto piacevole andarci.
https://www.yelp.it/biz/le-vigne-torino; Le 3 proposte di piatti unici sono ideali per una pausa pranzo veloce. Ottima qualità prezzo, personale cordiale e veloce. Cibo ottimo, ben presentati e servizio rapido ed accogliente.
https://www.yelp.it/biz/libery-pizza-e-artigianal-beer-torino; Il personale è veloce, attento e molto simpatico. Il servizio è abbastanza veloce ma non completamente affabile. Personale gentile,servizio rapido nonostante il locale sia sempre pieno!
https://www.yelp.it/biz/lo-scugnizzo-torino; tavolata di 15 persone. un po troppo stretti. servizio veloce e puntuale. Bel locale, piccolo ma curato, buon servizio veloce e preciso. Il servizio è stato veloce e il personale molto servizievole.
https://www.yelp.it/biz/lo-sfizio-bitritto; Posto molto carino, personale veloce e garbato. Posto molto caratteristico, rustico ed elegante, servizio rapido e cortese. Il personale è sempre gentile e molto disponibile.
https://www.yelp.it/biz/lobelix-torino; Il personale è gentile e il rapporto qualità prezzo è molto buono. Per il resto il prezzo era ragionevole, il personale gentile e disponibile Cocktail sempre molto buoni e ampia scelta , ma il buffet varia a seconda dei giorni e degli eventi.
https://www.yelp.it/biz/locanda-da-betty-torino; Servizio veloce e impeccabile, conto nella norma. Locale ben arredato, tranquillo, personale gentile e servizio veloce. Servizio puntuale e cortese Buono il rapporto qualità prezzo Consigliato
https://www.yelp.it/biz/lord-nelson-torino; In compenso il servizio era rapido e cortese. Il servizio è un po' sbrigativo ma rapido e preciso. l'ambientazione è davvero molto carina e una sera a settimana fanno anche il karaoke.
https://www.yelp.it/biz/luce-e-gas-torino-2; Servizio ok, veloce, gentile, pulito e preciso. Camerieri molto gentili, simpatici e servizio veloce. Cibo ottimo con ampissima scelta e personale veloce e attento.
https://www.yelp.it/biz/lunarossa-torino; Personale in compenso cortese e servizio veloce. Il servizio è stato gentile e rapido. Locale carino dal personale gentile e veloce.
https://www.yelp.it/biz/m-bun-torino; Servizio veloce per la mole di persone. Attesa lunghissima nei weekend, consigliabile andare in settimana. Veloce nelle ordinazioni e disponibile ad ogni richiesta.
https://www.yelp.it/biz/m-bun-torino-3; Consigliato per un pasto veloce e soddisfacente. Servizio veloce e buona qualità del cibo. Buona qualità-prezzo, ideale per un pasto veloce.
https://www.yelp.it/biz/magorabin-torino; Gradito anche la disponibilità di Chef Trentini a scambiare qualche parola durante la cena. Ottima location, molto ben curata nei dettagli dell'arredamento e del servizio. Questa formula dei 25€ si può sfruttare a pranzo dal martedì al venerdì è assolutamente consigliata!!
https://www.yelp.it/biz/maks-torino; Il servizio è troppo lento, le code sono sempre lunghe.
https://www.yelp.it/biz/maltos-beer-bari; Da andare almeno una volta a settimana! Il personale è gentile ed il servizio abbastanza veloce. Ambiente del locale insolito e carino,molto spazioso.Personale veloce e disponibile.
https://www.yelp.it/biz/mamasita-torino; Cibo molto buono e abbondante, personale molto gentile e veloce. Il mangiare è ottimo, veloce il servizio, gentili i camerieri. La prenotazione e' consigliata in settimana, pressoché obbligatoria nel weekend.
https://www.yelp.it/biz/mamma-licia-torino; bellissimo posto, un po' retrò, ambiente easy e cordiale, personale piacevolissimo, servizio veloce....bisogna prenotare xò almeno il sabato sera! Apprendo solo ora che la storica trattoria Mamma Licia ha chiuso i battenti causa affitto troppo caro....... Ambiente rustico, ricorda una trattoria di altri tempi.
https://www.yelp.it/biz/mamma-mia-torino-2; Il servizio è stato attento e veloce. Buona pizza e servizio rapido anche di sabato sera! Il servizio è veloce, il personale gentile e affabile.
https://www.yelp.it/biz/manhattan-pub-torino; Servizio 'alla buona ma molto efficiente e rapido. Se si va nel fine settimana meglio prenotare (sopratutto per orari oltre le 22). Ampio cortile interno, con grandi murales colorati e musica dal vivo.
https://www.yelp.it/biz/mar-rosso-torino-2; Atmosfera molto carina, cucina buona e veloce nel servizio. Per il cous cous del venerdi sera è meglio prenotarlo il giovedì. Cibo molto buono (il piatto principale eritreo è molto speziato ) e cameriera molto gentile.
https://www.yelp.it/biz/mara-dei-boschi-torino; Poi sono carine le vaschette da asporto inserite in una scatolina con scritti sopra i gusti!! Il personale é sempre molto gentile e cortese! ogni gusto proposto supererà ogni vostra aspettativa !
https://www.yelp.it/biz/marechiaro-torino; Prezzo nella norma, servizio ottimo e veloce. fine settimana a Torino e cena in questo locale. Il servizio è stato rapido e cortese, nulla di più.
https://www.yelp.it/biz/marhaba-torino; Il servizio è gentilissimo e abbastanza veloce. Tutte le tajine sono squisite, il venerdi è giornata di cous cous, ricchissimo e con molte varietà di verdure. Il personale è gentile e simpatico, disposto a dare consigli anche a chi non conosce questa cucina.
https://www.yelp.it/biz/martin-pescatore-torino; Come sempre ingredienti freschissimi, servizio veloce, cortese e professionale. Arredamento semplice con servizio molto professionale ed abbastanza rapido. Nei giorni di fine settimana è meglio mettere la macchina in corso Vittorio.
https://www.yelp.it/biz/martinucci-bari-2; Il personale è attento, gentile e veloce. I gelati ottimi, il servizio veloce e gentile. E' sempre molto frequentato ma il servizio è sempre accurato e veloce.
https://www.yelp.it/biz/masaniello-%C3%A9-turnat-torino; Il personale è gentile e giovane, i prezzi non eccessivi, calcolando la posizione.
https://www.yelp.it/biz/master-sandwich-torino; Qualità ottima per un gran panino d'asporto. Ottimo per uno spuntino veloce e sostanzioso. Un pit-stop veloce post visita al museo.
https://www.yelp.it/biz/mastro-ciccio-di-mastrandrea-fabio-bari; Locale simpatico, giovane e veloce nel servizio. Pranzo veloce duramte una breve visita a Bari. Servizio al banco sempre puntuale e svolto con grande simpatia.
https://www.yelp.it/biz/matti-brown-bari; Il servizio è stato efficiente e veloce. Locale storico della città vecchia, ottimo cocktail e birre artigianali insolite e daavero buone Servizio cortese e veloce. Gentile e molto premurosa nei confronto dei clienti.
https://www.yelp.it/biz/mazzini-38-torino; Personale molto gentile e servizio abbastanza rapido. Pizza squisita, servizio molto buono e rapido, ambiente raffinato. Pizza davvero eccezionale anche a pranzo, ottimo servizio molto curato anche se solo per un pranzo veloce!!!
https://www.yelp.it/biz/mc-donald-torino; In questo posto c'è anche la possibilità  di richiedere il servizio take-away in automobile (mc drive). Uno dei Mcdonald's più buoni, personale gentile e veloce, i panini sono gustosi e con tanta salsa. Ubicato in un punto frequentato da facce ben poco raccomandabili, sporchissimo all'esterno e pure al suo interno.
