url;review
https://www.yelp.it/biz/pizzeria-da-donato-bari;Ottimo il servizio, abbastanza veloce nonostante il locale fosse pieno, per tale motivo è preferibile la prenotazione.
https://www.yelp.it/biz/pizzeria-da-candido-torino;Locale semplice e senza fronzoli, pizza eccellente nelle due varianti disponibili (pala e padellino) e farinata gustosissima.
https://www.yelp.it/biz/pizzeria-d-autore-bari;Pizza sottile alla barese di ottima qualità e a prezzo inferiore alla media delle pizze di qualità in Bari.
https://www.yelp.it/biz/pizzeria-cristina-torino;Da provare la pizza Cannelloni, una vera bomba calorica con cannelloni di prosciutto e ricotta su una classica Margherita.
https://www.yelp.it/biz/pizzeria-continental-pizzorante-bari-2;Anche una nota positiva va fatta al personale cordiale e gentile sempre pronto a soddisfare ogni richiesta!
https://www.yelp.it/biz/pizzeria-chez-jo-bari;Il locale è carino e accogliente e i camerieri bravi e disponibili.
https://www.yelp.it/biz/pizzeria-bella-vita-torino;Locale con pochi tavoli e dall'atmosfera accogliente.
https://www.yelp.it/biz/pizzeria-baraonda-bari;Ambiente piccolo ma ben curato con un bel televisore per accompagnare i morsi dati ad una pizza molto buona.
https://www.yelp.it/biz/pizzeria-au-lapin-agile-torino-2;Pizza Buona, personale affabile e atmosfera accogliente.
https://www.yelp.it/biz/pizzeria-antipasteria-bistro-bari;Personale gentilissimo, la pulizia regna sovrana, bagno immacolato.
https://www.yelp.it/biz/pizzeria-amalfi-torino;Il servizio è stato veloce e la pizza più che accettabile, ad un giusto prezzo.
https://www.yelp.it/biz/pizzeria-alloca-di-pulcinella-torino;Servizio molto rapido e i camerieri sono molto gentili e disponibili.
https://www.yelp.it/biz/pizzeria-aladino-bari;La pizzeria offre dei menù a prezzo fisso che a dir la verità hanno un rapporto qualità-prezzo assolutamente giusto.
https://www.yelp.it/biz/pizzeria-al-buco-bari;Il personale e' simpatico e gentile ed il servizio ( a parte l'attesa prima di entrare ) e' veloce.
https://www.yelp.it/biz/pizzeri-lapislazzulo-torino;Anche il personale e gentile e molto simpatico Qualità prezzo nella media ( 3 pizze e una farinata 30€)
https://www.yelp.it/biz/pizze-e-cozze-torino;Pasta al pesce in crosta che mangiavi in 2 ottimo personale simpatico bravi
https://www.yelp.it/biz/pizza-speedy-torino-3;Il personale é molto simpatico e veloce !
https://www.yelp.it/biz/pizza-speedy-torino-2;La pizza è molto buona, arriva sempre calda e fragrante e il personale è sempre molto gentile.
https://www.yelp.it/biz/pizza-speedy-torino;Pizza buona e portata fino a casa in meno di mezz'ora dall'ordine, regalano anche la bevanda a tua scelta.
https://www.yelp.it/biz/pizza-pistrocchio-torino;La pizza è buona, la farinata dipende dalle volte, può capitare che sia un po' bruciata.
https://www.yelp.it/biz/pizza-bon-bari;pizza buona ... la gigante merita , l'unica cosa è che potrebbero farla leggermente più sottile .
https://www.yelp.it/biz/pizza-ad-hoc-torino;Il locale è molto carino, vicinissimo a piazza Vittorio, il personale gentile e simpatico.
https://www.yelp.it/biz/piu-di-un-gelato-torino;Il personale e' simpatico e gentile: sempre pronto a dare consigli/informazioni sui vari gusti di gelato.
https://www.yelp.it/biz/pistacchio-torino;Ottima qualità......peccato che il personale è simpatico come i sassolini nelle scarpe.
https://www.yelp.it/biz/pippo-paranza-torino;Locale carino senza molte pretese, Collocato al quadrilatero zona di locali con atmosfera francese.
https://www.yelp.it/biz/piper-pub-torino;Peccato per il locale (un po' spartano) però il servizio è ottimo e veloce anche quando è pienissimo.
https://www.yelp.it/biz/piola-cianci-torino;Cibo davvero ottimo e personale molto gentile e simpatico.
https://www.yelp.it/biz/piano-b-torino;Personale molto simpatico, locali molto ben arredati e puliti.
https://www.yelp.it/biz/petit-baladin-torino;Piccolo locale con pochi tavoli e un personale gentile e simpatico.
https://www.yelp.it/biz/perbacco-bari;Il locale è carino, con una atmosfera da trattoria e pochi tavoli.
https://www.yelp.it/biz/pepino-torino;Personale gentile e simpatico, senza fretta il servizio.
https://www.yelp.it/biz/peperosso-torino;Ristorante molto buono soprattutto qualità prezzo da raccomandare il titolare molto simpatico Personale gentile
https://www.yelp.it/biz/pepe-torino;Con la bella stagione ampi ed eleganti dehors accolgono gli ospiti in cerca di un'atmosfera più informale.
https://www.yelp.it/biz/pastis-torino;Ottimo servizio sempre gentili puntuali e disponibili in un contesto meraviglioso e fresco per serate all'aperto da primavera all'autunno.
https://www.yelp.it/biz/pastis-2020-torino;Ottimo servizio sempre gentili puntuali e disponibili in un contesto meraviglioso e fresco per serate all'aperto da primavera all'autunno.
https://www.yelp.it/biz/pastificio-defilippis-torino;Il personale è molto cortese e la varietà di proposte è notevole... ovviamente offre vini e pietanze del luogo.
https://www.yelp.it/biz/pastificio-baretti-torino;Locale piccolo e semplice con servizio spartano (ognuno ha il proprio vassoietto) e il personale è gentile e sorridente.
https://www.yelp.it/biz/pasticceria-venier-torino;Il locale è molto carino ed accogliente e si trova a pochi passi da piazza Castello.
https://www.yelp.it/biz/pasticceria-beatrice-2008-torino;L'atmosfera è piacevole, e il personale è cortese e simpatico!
https://www.yelp.it/biz/pasticceria-amore-torino;Prezzo nella norma 27 euro 5 spritz, una cola e 3 vasoi di deliziosi stuzzichini!
https://www.yelp.it/biz/pastamaneria-torino;Piccolo locale molto semplice in cui gustare ottimi primi piatti tradizionali a prezzi più che accettabili.
https://www.yelp.it/biz/pasta-mon-amour-torino;Ottimo rapporto qualità prezzo, pesonale simpatico e cordiale,locale super accogliente: molto intimo nel cuore della movida torinese, san salvario!
https://www.yelp.it/biz/passamaneria-torino;Personale gentilissimo e cordiale pronto ogni qualvolta veniva richiesta la loro professionalità nel scegliere le pietanze dal menù.
https://www.yelp.it/biz/passaggio-in-india-torino;Personale molto gentile e atmosfera indiana, peccato per le pietanze.
https://www.yelp.it/biz/pantagruel-torino;Servizio ottimo, ottima atmosfera e proprietario simpaticissimo.
https://www.yelp.it/biz/panperfocaccia-torino-2;Anche questa sera cena al panperfocaccia calzone squisito e sempre troppo gentile e disponibile la signorina Federica.
https://www.yelp.it/biz/panino-giusto-torino;Il servizio è ottimo e le ragazze sempre e molto disponibili.
https://www.yelp.it/biz/panificio-magda-bari;Focaccia super ottimo a pranzo con servizio veloce varietà di scelta, ma molto affollato.diversi tipi di taralli Caffetteria completa
https://www.yelp.it/biz/panificio-el-focacciaro-bari;Il personale è molto gentile e i prezzi assolutamente nella media Da provare assolutamente
https://www.yelp.it/biz/panetteria-borgo-nuovo-torino;Il personale molto gentile e rapido nel servizio.
https://www.yelp.it/biz/pan-cafe-torino;Il cibo molto buono ed il servizio, contando i molti tavoli occupati, assolutamente ottimo.
https://www.yelp.it/biz/palazzo-reale-di-torino-torino;Attenzione ai dettagli in tutto il palazzo.
https://www.yelp.it/biz/pai-bikery-torino;Si respira una bella atmosfera con la cucina a vista che sa un pò di casa!
https://www.yelp.it/biz/paese-zhou-torino-2;Ovviamente ci sono altri ristoranti molto più carini come arredamento ma come qualità prezzo non lo batte nessuno.
https://www.yelp.it/biz/paco-torino;Indicatissimo per trascorrere una serata in compagnia, atmosfera calorosa e frizzante, ci si sente subito a casa.
https://www.yelp.it/biz/ottimo-torino;Il rapporto qualità/prezzo nella media ed il servizio buono, le persone che ci lavorano sono gentili e disponibili.
https://www.yelp.it/biz/osteria-sopravento-bari-2;Personale competente e sempre pronto a rispondere ed a soddisfare ad ogni esigenza, se è possibile.
https://www.yelp.it/biz/osteria-rotonda-dei-facchinetti-torino;E' una soddisfazione sapere che i nostri sforzi per tenere pulito e ordinato il locale vengano apprezzati!
https://www.yelp.it/biz/osteria-povrom-torino;Buon compromesso per chi cerca buon cibo, buon prezzo e facile parcheggio non lontano dal centro.
https://www.yelp.it/biz/osteria-le-arpie-bari;Servizio molto rapido ed efficiente, le cameriere molto disponibili e il titolare Enzo molto gentile.
https://www.yelp.it/biz/osteria-fate-infretta-a-tavola-torino;Locale molto carino e caratteristico, cibo squisito, personale gentile, rapporto qualità/prezzo ottimo!
https://www.yelp.it/biz/osteria-della-travi-bari;Locale molto semplice pulito ma per niente caratteristico.
https://www.yelp.it/biz/osteria-del-frate-torino;Locale carino, tavoli un po' vicini, ma buona atmosfera.
https://www.yelp.it/biz/osteria-del-fiat-torino;Locale molto carino e caratteristico, cibo squisito, personale gentile, rapporto qualità/prezzo ottimo!
https://www.yelp.it/biz/osteria-dei-quattro-gatti-bari;La pizza è ottima il servizio molto efficiente competenza cortesia e disponibilità da parte del personale ci ritornerei sicuramente
https://www.yelp.it/biz/osteria-degli-ottoni-torino;Di tutto rispetto anche il vino della casa (nebbiolo).Il tutto in un bel locale accogliente, curato e d'atmosfera.
https://www.yelp.it/biz/osteria-antichi-sapori-bari;pranzo in un'atmosfera rilassata e piacevole. cibo di altissima qualità personale socievole, simpatico e molto preparato!
https://www.yelp.it/biz/osteria-antiche-sere-torino;buonissime pietanze servite con cortesia e cordialità in ambiente rustico, buona selezione di vini.
https://www.yelp.it/biz/osteria-al-gambero-bari;Servizio veloce , personale disponibile e molto informale.
https://www.yelp.it/biz/ortigia-bistrot-torino;una rara attenzione ai dettagli e all' accoglienza in un' atmosfera rilassata!
https://www.yelp.it/biz/orso-torino;Il personale gentile e simpatico, che spiega e consiglia con accuratezza i propri prodotti completa l'opera.
https://www.yelp.it/biz/oro-birra-torino;Personale simpatico e perfettamente competente in grado di comprendere i gusti del clienti e di consigliare di conseguenza.
https://www.yelp.it/biz/opera-bari;Il locale è molto accogliete e il personale gentile, si respira una bella atmosfera.
https://www.yelp.it/biz/open-baladin-torino;Il locale è poi molto curato, volutamente rustico e vintage, oltre che a vantare un setting di prima classe.
https://www.yelp.it/biz/oolivoo-bari;Camerieri disponibili e gentili e servizio veloce.
https://www.yelp.it/biz/one-apple-torino;i camerieri professionali e disponibili a soddisfare le richieste dei clienti!
https://www.yelp.it/biz/olsen-di-caldi-cinzia-torino;Il servizio è veloce e il locale è molto carino sebbene molto piccolo.
https://www.yelp.it/biz/old-wild-west-torino-2;Personale gentile, piatti senza pretese ma buoni, conto giusto, se ci sarà occasione è un posto da riprovare
https://www.yelp.it/biz/old-wild-west-torino;ottimo e accogliente cibo molto buono e servizio velocissimo nonostante le varie prenotazioni tra l'altro sempre pieno di gente.
https://www.yelp.it/biz/okinawa-torino;PREZZO: A svantaggio della qualità il prezzo è più abbordabile, nella media alta degli All you can eat.
https://www.yelp.it/biz/oinos-torino;Il locale è curato ma poi succede che all'interno non è ben condizionato e la temperatura è alta.
https://www.yelp.it/biz/officine-panino-torino;I panini sono abbondanti e preparati con buoni ingredienti con prezzi competitivi tra i 6 e i 7 euro.
https://www.yelp.it/biz/o-raffertys-pub-torino;Il personale è gentile e l'atmosfera era piacevole e lo ha fatto servire cibo.
https://www.yelp.it/biz/nuovo-fizzarotti-bari;Il locale è noderno e accogliente con personale simpatico e gentile.
https://www.yelp.it/biz/nuova-dezzuto-torino;ci sono infiniti posti di qualità e cortesia a Torino ma questo non rientra per nulla.
https://www.yelp.it/biz/nouvel-vis-a-vis-modugno;ristorante carino accogliente e caloroso. ottima cucina servizio discreto un po troppo caldo all interno per la stagione .
https://www.yelp.it/biz/niva-cremeria-torino;Personale simpatico e nei momenti di calma paziente nel descrivere i vari gusti e farveli eventualmente assaggiare.
https://www.yelp.it/biz/nishiki-torino;Sembra pulito e il personale è molto gentile e simpatico.
https://www.yelp.it/biz/neko-cafe-torino;Cibo molto buono e servizio professionale e simpatico.
https://www.yelp.it/biz/napul-e-bari;Il locale è carino, ben tenuto e molto pulito, l'atmosfera è piacevole.
https://www.yelp.it/biz/napples-torino;Locale carino stile vintage, un po' stretto in particolar modo i tavoli nel dehor.
https://www.yelp.it/biz/my-ecosmartfood-torino-2;L'atmosfera è splendida e l'attenzione per i dettagli e le esigenze di tutti i clienti fa la differenza.
https://www.yelp.it/biz/murphys-torino;Atmosfera piacevole e tranquilla, con chiacchiere accompagnate da una buona birra.
https://www.yelp.it/biz/murphys-pub-torino;Atmosfera piacevole e tranquilla, con chiacchiere accompagnate da una buona birra.
https://www.yelp.it/biz/mr-rooster-torino-3;ottima Ottima cucina ottima accoglienza un personale molto cortese pronto a risolvere qualsiasi problema del cliente.
https://www.yelp.it/biz/morelli-antonio-modugno;Servizio veloce, personale simpatico cibi buoni, da tavola calda ma freschi e gustosi.
https://www.yelp.it/biz/mordillo-torino;Locale ampio e luminoso, servizio nella media, la qualità non è eccellente ma è in linea con il prezzo.
https://www.yelp.it/biz/montecarlo-torino;Il servizio è accurato , familiare ed attento con una cantina abbastanza ben fornita di etichette di qualità.
https://www.yelp.it/biz/monte-dei-cappuccini-torino;Servizio accurato, personale gentilissimo e cortese, è un piacere per il palato e gli occhi.
https://www.yelp.it/biz/monferrato-torino;Personale gentilissimo, cortese e simpatico (ma assolutamente non invadente) è stato davvero piacevole cenare qui.
https://www.yelp.it/biz/monegato-torino;Il proprietario è simpaticissimo e molto cordiale La storia della nascita del locale è davvero simpatica!
https://www.yelp.it/biz/moderat-bari;L'atmosfera è informale con ottima musica e il cibo è eccezionale e a buon prezzo.
https://www.yelp.it/biz/mixer-bar-di-figliolia-m-torino;Personale gentile, è un bar che offre tutti i servizi di un esercizio di questo tipo.
https://www.yelp.it/biz/mitiko-pizzeria-consegna-a-domicilio-torino;Il servizio è rapido sia andando personalmente presso il locale, sia nel caso di consegna a casa.
https://www.yelp.it/biz/mister-hu-torino;Ottima atmosfera, bello mangiare fuori all'aperto d'estate.
https://www.yelp.it/biz/mina-torino;Atmosfera accogliente e un pranzo di Pasqua molto buono.
https://www.yelp.it/biz/michi-tanzariello-torino;Ottimo servizio nonostante sia sempre pieno. risultato al di sopra delle aspettative e prezzo onestissimo.
https://www.yelp.it/biz/miagola-cafe-torino;Locale carino personale giovane e simpatico, gatti che girano liberi tra i tavoli.
https://www.yelp.it/biz/mezzaluna-osteria-torino;Un locale molto carino, si notano subito i toni caldi e accoglienti dell'arredamento oltre che un servizio molto valido.
https://www.yelp.it/biz/mexico-70-torino;Atmosfera godibile servizio veloce e gestori cordiali e onesti....
https://www.yelp.it/biz/messicano-mamasita-torino;Personale attento ma non invasivo, ti accoglie in questa atmosfera messicana fantastica!
https://www.yelp.it/biz/menupizza-torino;Personale molto gentile , il locale appena ristrutturato , molto pulito e spazioso
https://www.yelp.it/biz/menodiciotto-torino;Personale gentilissimo, atmosfera splendida, gelato all'altezza delle aspettative.
https://www.yelp.it/biz/mc-donalds-torino-5;Personale attento, cortese e veloce, prodotti sempre perfetti e molto buoni.
https://www.yelp.it/biz/mc-donald-torino;Locale molto ampio, con anche dehor esterno.
https://www.yelp.it/biz/mazzini-38-torino;Il locale è molto carino, il personale è simpatico e cordiale ed il menù ricco di piatti golosi.
https://www.yelp.it/biz/matti-brown-bari;bel locale e piatti sfiziosi. personale gentile e simpatico. posto molto bello un pochino caro e piatti contenuti
https://www.yelp.it/biz/mastro-ciccio-di-mastrandrea-fabio-bari;Personale simpatico e gentile, posizione ottima, in pieno centro.
https://www.yelp.it/biz/master-sandwich-torino;Così anche il personale simpatico e disponibile, che ti mette, da subito, a proprio agio.
https://www.yelp.it/biz/masaniello-%C3%A9-turnat-torino;Il menù è ricco di piatti tipici e nuovi abbinamenti, per accontentare i curiosi, ma anche gli scettici.
https://www.yelp.it/biz/martinucci-bari-2;Se non si è in grado di reggere molti clienti è meglio fare altro o almeno assumere personale cortese.
https://www.yelp.it/biz/martin-pescatore-torino;Locale informale Personale cortese e piacevole. piatti sono abbondanti e di ottima qualità.
https://www.yelp.it/biz/marhaba-torino;Il personale è gentile e simpatico, disposto a dare consigli anche a chi non conosce questa cucina.
https://www.yelp.it/biz/marechiaro-torino;Perspnale simpatico e la pizza molto buona anche i gusti particolari.
https://www.yelp.it/biz/mara-dei-boschi-torino;Personale gentile, locale stretto e lungo con laboratorio a vista.
https://www.yelp.it/biz/mar-rosso-torino-2;Personale super gentile, l'ambiente del ristorante è informale e i piatti sono ottimi!
https://www.yelp.it/biz/manhattan-pub-torino;Il personale è simpatico cordiale e molto gentile.
https://www.yelp.it/biz/mamma-mia-torino-2;Il servizio è rapido e preciso, i ragazzi in sala sono molto disponibili e cordiali.
https://www.yelp.it/biz/mamma-licia-torino;Menù non troppo ricco ma con cose interessanti.
https://www.yelp.it/biz/mamasita-torino;Personale attento ma non invasivo, ti accoglie in questa atmosfera messicana fantastica!
https://www.yelp.it/biz/maltos-beer-bari;Atmosfera piacevole, personale gentile, ampia scelta dal menù.
https://www.yelp.it/biz/maks-torino;Buonissimo locale centrale e pulito ...gusti favolosi e personale gentilissimo ..
https://www.yelp.it/biz/magorabin-torino;Il personale è attento, cortese e preparato nonostante la giovane età, presente il giusto senza essere soffocante.
https://www.yelp.it/biz/macario-caffe-torino;Personale poco simpatico Drink ... nulla di speciale...
https://www.yelp.it/biz/m-bun-torino-3;Locale carino, menu da fast food ma con ingredienti e nomi dei piatti in pieno stile piemontese.
https://www.yelp.it/biz/m-bun-torino;Personale simpatico, panini e hamburger in chiave piementose come le varie voci dei prodotti alimentari di buona qualità.
https://www.yelp.it/biz/lucky-nugget-saloon-torino;Servizio accurato in un ristorante fashion, una cena a due e poi serata in discoteca al quasar.
https://www.yelp.it/biz/luce-e-gas-torino-2;Ottima l'atmosfera e buon rapporto qualità/ prezzo
https://www.yelp.it/biz/lord-nelson-torino;Locale originale in centro a torino: pizza buona senza eccellere, la serata karaoke è divertente e il locale accogliente.
https://www.yelp.it/biz/locanda-da-betty-torino;Atmosfera accogliente e vintage, ideale sia per una cenetta romantica che per un pasto in compagnia
https://www.yelp.it/biz/lobelix-torino;Cibo buono anche se non molto vario e personale simpatico.
https://www.yelp.it/biz/lo-stonnato-torino;Locale carino nel cuore di San Salvario che offre una cucina a 360°, buoni i primi e la pizza.
https://www.yelp.it/biz/lo-sfizio-bitritto;Un posto davvero unico e con un'atmosfera accogliente e professionale.
https://www.yelp.it/biz/lo-scugnizzo-torino;Locale molto carino, cameriere gentili e disponibili.
https://www.yelp.it/biz/libery-pizza-e-artigianal-beer-torino;(Il menù era ricco di antipasti, primi e secondi) La pizza si presenta alta ma leggera nel suo impasto.
https://www.yelp.it/biz/le-vitel-etonne-torino;Ottimi primi ed il vero vitello to nato piemontese.posto piccolo e caratteristico con cucina a vista.da visitare sicuramente.
https://www.yelp.it/biz/le-vigne-torino;Il servizio è cortese, accorto e simpatico, l'ambiente assolutamente accogliente e rilassante....insomma un a gran bella scoperta!
https://www.yelp.it/biz/le-veronique-bari-2;L'atmosfera è piacevole e informale, ma comunque con la giusta attenzione per i dettagli.
https://www.yelp.it/biz/le-tre-lanterne-bari;Il personale è gentile e il prezzi non sono economici, ma comunque nella fascia media
https://www.yelp.it/biz/le-rondini-torino;Servizio veloce ma forse un po' più di classe ed eleganza sarebbe gradita.
https://www.yelp.it/biz/le-putrelle-osteria-torino;Atmosfera informale e rilassante, ottimo cibo (battuta di fassona eccezionale) e prezzi, delizioso il bonet
https://www.yelp.it/biz/le-plus-bon-bari;Personale gentile e simpatico, ottima pizza, prezzi contenuti.
https://www.yelp.it/biz/le-mura-bari;volete un posto accogliente e quasi intimo con una ottima pizza e una scelta di birre non usuale?
https://www.yelp.it/biz/le-grand-tabu-bari;Per il titolare: non basta avere un bel locale e mettere bella musica con qualche bottiglia esposta !!!
https://www.yelp.it/biz/le-due-antenne-bari;Locale ampio, personale cordiale, grandissima abbuffata di antipasti vari caldi, freddi, carne e pesce.
https://www.yelp.it/biz/le-cantine-di-bacco-torino;L'atmosfera è molto piacevole soprattutto nei mes invernali.
https://www.yelp.it/biz/las-vegas-torre-a-mare;Locale davvero carino, prezzi medio alti ma che garantiscono una ottima qualità del prodotto.
https://www.yelp.it/biz/laboratorio-comba-torino;Hanno un ottimo rapporto qualità prezzo e sono molto cortesi e disponibili con tutti.
https://www.yelp.it/biz/la-voglia-matta-torino-6;I prezzi sono ottimi è c'è un eccellente rapporto qualità prezzo (anzi, la qualità è superiore al prezzo).
https://www.yelp.it/biz/la-via-della-seta-torino;Bel ristorante cinese in centro curato in tutto personale gentile e buona cucina a prezzi del tutto onesti .
https://www.yelp.it/biz/la-via-del-sale-torino;Personale gentile e locale piacevole , in aggiunta al resto, sono ulteriori motivi per scegliere questo ristorante
https://www.yelp.it/biz/la-vecchia-europa-torino;Il locale è ampio e piacevole, il personale simpatico ed attento ed il prezzo è giusto.
https://www.yelp.it/biz/la-uascezze-bari;Ristorante caratteristico, prodotti e piatti della zona con un buon bicchiere di vino.
https://www.yelp.it/biz/la-taverna-greca-torino-2;Il personale è cortese e alla mano, e anche l'atmosfera è familiare.
https://www.yelp.it/biz/la-taverna-dei-mercanti-turin;Personale gentile e simpatico, molto disponibile nel dialogo con i clienti e piuttosto spiritoso...ma molto professionale e preparato.
https://www.yelp.it/biz/la-tana-del-polpo-bari;Personale gentile e disponibile, proprietario simpatico e super alla mano!!!
https://www.yelp.it/biz/la-svolta-torino;Posizionato nella collina torinese Posto molto carino e con un'ottima atmosfera creata da luci soffuse.
https://www.yelp.it/biz/la-stadera-pizzeria-la-stadera-di-muscariello-s-e-c-pizz-torino;Il locale è davvero carino, molto elegante, con una bella atmosfera.
https://www.yelp.it/biz/la-romana-torino;Personale cortese e rapido nel servizio, preparati sui prodotti da vendere in negozio (non è una cosa scontata).
https://www.yelp.it/biz/la-ristonomia-torino;Atmosfera sempre accogliente e rilassante con personale molto gentile ed attento alle esigenze dei commensali.
https://www.yelp.it/biz/la-reseda-torino;Il servizio infatti è rapido e l'atmosfera creata nel complesso è familiare e naturale, piacevole.
https://www.yelp.it/biz/la-provolina-bari;Il personale è simpatico e verace, i prezzi fin troppo alti per la qualità dei cibi.
https://www.yelp.it/biz/la-prima-da-moreno-torino;Il servizio è sempre ottimo, personale molto cordiale e professionale.
https://www.yelp.it/biz/la-porta-rossa-torino;il personale è davvero gentile e riesce a soddisfare ogni esigenza!
https://www.yelp.it/biz/la-piramide-torino;Prodotti di qualità ad un prezzo equo, possibilità inoltre di sedersi sotto ai fantastici portici antichi.
https://www.yelp.it/biz/la-pignata-bari;Il servizio è sicuramente accurato ed anche il rapporto qualità/prezzo è molto buono, atteso il target del ristorante.
https://www.yelp.it/biz/la-piadineria-torino;Dove si può degustare una buona piadina cotta al momento in una cucina tutta a vista.
https://www.yelp.it/biz/la-parrilla-de-juan-bari;Il proprietario è simpatico e il personale molto gentile ma sinceramente se volete mangiare messicano andate altrove
https://www.yelp.it/biz/la-panzanella-torino;ottimo servizio e grande professionalità dei titolari,un locale semplice ma bello e molto pulito!
https://www.yelp.it/biz/la-pagoda-di-hu-lia-meng-torino;L'atmosfera è piacevole, senza troppo fronzoli e perfetta per una cena di coppia o da soli.
https://www.yelp.it/biz/la-pace-torino;Locale carino, muri e soffitti in mattoni a vista (discutibili colonne agli spigoli...), atmosfera calda.
https://www.yelp.it/biz/la-monachella-torino;Cibo discreto servizio veloce con personale gentile, anche i bagni sono ben tenuti...consigliato
https://www.yelp.it/biz/la-mela-stregata-torino;Da provare assolutamente le brioches alla nocciola e al cioccolato bianco...personale gentile...sempre aperto, anche in piena notte.
https://www.yelp.it/biz/la-magnolia-torino-3;Il servizio é stato abbastanza veloce, la pizza molto buona e i camerieri disponibili e simpatici.
https://www.yelp.it/biz/la-madia-torino;Ottimo il servizio svolto con professionalità e discreta cortesia.
https://www.yelp.it/biz/la-luna-rossa-torino;Bel Locale in centro, carino e capiente, buonissima la pizza e soprattutto grande professionalità nel servizio.
https://www.yelp.it/biz/la-locanda-del-bollito-torino;Così come il servizio: personale gentilissimo ma a tratti un pò sperso fra i soli quattro tavoli del locale.
