url;review
https://www.yelp.it/biz/zucca-torino;L'aria condizionata ci permette di riprendere fiato, prima di rientrare nella caldissima afa della città ( 37°C).
https://www.yelp.it/biz/zonk-di-brigada-igor-torino;Locale molto carino ...cibo discreto e personale cortese !!
https://www.yelp.it/biz/zichella-torino;Personale molto simpatico, gentile e ti offre un servizio veloce e di qualità.
https://www.yelp.it/biz/zheng-yang-torino-2;Il prezzo per una cena è intorno a 22 euro ma il rapporto qualità prezzo è eccellente
https://www.yelp.it/biz/zelli-wine-bar-torino;locale carino propietario molto cordiale musica carina e buoni i cocktail . nn male per stare in compagnia.
https://www.yelp.it/biz/yu-jiasheng-torino;Pranzo di lavoro con i colleghi locale pulito personale gentile e disponibile menù e prezzi nella media
https://www.yelp.it/biz/younger-pub-bari;Bel locale irlandese nel quale, in alunne serate, è possibile ascoltare della buona musica dal vivo.
https://www.yelp.it/biz/yoshi-bar-torino;Menu fissi non disponibili ma ottima scelta e precisi suggerimenti del personale estremamente gentile e disponibile.
https://www.yelp.it/biz/wispobish-torino;Ristorante accogliente in corso Vittorio Emanuele II ottima carne e ben cucinata personale molto gentile e disponibile.
https://www.yelp.it/biz/winston-churchill-new-pub-torino;Il personale è simpatico e alla mano.
https://www.yelp.it/biz/waxy-torino;Locale top e tranquillo tutte le sere con servizio perfetto, in particolare della cameriera preferita Federica.
https://www.yelp.it/biz/wasabi-torino;Personale molto gentile, piatti buoni e di giuste porzioni, alla fine conto non particolarmente caro.
https://www.yelp.it/biz/walima-torino;Il locale è molto carino e l'arredamento etnico è molto caratteristico, ma non ci sono molte opzioni.
https://www.yelp.it/biz/vyta-torino;Il personale e' molto gentile e sono a disposizione anche numerosi tavoli sia all'interno che all'esterno.
https://www.yelp.it/biz/volver-torino-2;La cena è stata ottima (e abbondante aggiungerei), proprietario e camerieri molto disponibili, simpatici e sorridenti.
https://www.yelp.it/biz/vo-torino;Il servizio è cortese ma si avvale di camerieri di classe molto diversa tra loro.
https://www.yelp.it/biz/vitelloni-torino;Personale gentile e simpatico (...oh finalmente qualcuno che si lancia in qualche battuta).
https://www.yelp.it/biz/vintage-torino;ottima accoglienza da parte dello staff di sala e del titolare. cena eccellente e in atmosfera ovattata.
https://www.yelp.it/biz/vinolento-torino;Locale informale ma di ampio respiro ottimo servizio con personale gentile ed efficiente .
https://www.yelp.it/biz/villa-somis-torino;Personale gentile disponibile e preparato sul tema ... un sommelier preparatissimo e oltretutto simpatico!!
https://www.yelp.it/biz/vermouth-anselmo-torino;il locale è molto carino, bell'atmosfera, peccato che c'è poca organizzazione da parte dei camerieri e dei baristi.
https://www.yelp.it/biz/verdi-d-indivia-torino;il rapporto qualità prezzo è ottimo e il personale gentile e simpatico!
https://www.yelp.it/biz/vanilla-torino;C'è sempre un ottima scelta e il personale è gentile e simpatico.
https://www.yelp.it/biz/urban-bari;Locale bellissimo, cibo ottimo, personale gentile, simpatico e disponibile, posto ideale per studiare, chiacchierare e ascoltare buona musica!
https://www.yelp.it/biz/turet-torino;Atmosfera accogliente e personale molto gentile, disponibile e al tempo stesso simpatico.
https://www.yelp.it/biz/tre-galline-torino-2;Serata piacevole in questo bel ristorante caratteristico.
https://www.yelp.it/biz/tre-galli-torino-2;Il locale è carino, bell'atmosfera ed il personale è molto cortese e veloce.
https://www.yelp.it/biz/tre-da-tre-torino;Locale molto carino, grande e ospitale con personale simpatico e buoni piatti.
https://www.yelp.it/biz/trattoria-vineria-da-ale-torino;La proprietaria sempre gentile, camerieri disponibili, ed un particolare ringraziamento va a Luciano per la sua simpatia e cordialità.
https://www.yelp.it/biz/trattoria-valenza-torino;Personale molto simpatico e location stupenda: si tratta di una TRATTORIA ed è meravigliosamente rimasta tale.
https://www.yelp.it/biz/trattoria-toscana-torino;Piatti ricercati e buonissimi.. e altra cosa da non sottovalutare e' la simpatia e la cordialità del personale..
https://www.yelp.it/biz/trattoria-torricelli-torino;Atmosfera: piacevole sensazione di trattoria di qualità, che non ha nulla da invidiare a più blasonati ristoranti.
https://www.yelp.it/biz/trattoria-spirito-santo-torino-2;A torino ci sono numerose ottime gelateria ma questa le batte tutte per il rapporto qualità - prezzo.
https://www.yelp.it/biz/trattoria-pizzeria-mare-e-monti-torino;Proprietario gentile e disponibile, personale cortese e discreto.
https://www.yelp.it/biz/trattoria-piemontese-torino;Personale gentile e ambiente simpatico, bravi ragazzi e brava Elena che come suo marito Mauro non sbaglia un colpo!
https://www.yelp.it/biz/trattoria-mombercelli-di-antico-elena-torino;Il locale e' discreto ed abbastanza accogliente ed il personale e' gentile ed efficiente.
https://www.yelp.it/biz/trattoria-da-cinzia-torino;Personale gentilissimo, atmosfera di casa e si mangia stra bene!!
https://www.yelp.it/biz/trattoria-casalinga-torino;Posto accogliente, un po' malinconico, casalingo ma discreto, proprio alla torinese.
https://www.yelp.it/biz/trattoria-alba-torino;Innanzi tutto quello che caratterizza il locale sono la simpatia e la cordialità della proprietaria.
https://www.yelp.it/biz/toscano-torino-3;Il personale è molto cortese ed il locale (rinnovato) è accogliente.
https://www.yelp.it/biz/torteria-berlicabarbis-torino;Locale bellissimo, atmosfera accogliente... perfetto d'inverno e anche d'estate.
https://www.yelp.it/biz/tor-na-torino;Personale super attento quasi da ristorante stellato, camerieri che versano acqua /vino appena bicchiere semivuoto.
https://www.yelp.it/biz/tommy-tegamino-torino;La pizza era molto buona così come gli ingredienti di ottima qualità.
https://www.yelp.it/biz/tobiko-torino;Un locale molto carino ben arredato , atmosfera gradevole, cibo di ottima qualità e preparato in maniera impeccabile.
https://www.yelp.it/biz/tisaneria-della-consolata-torino;Il locale e' carino, con un'atmosfera di altri tempi e la varietà' di tisane e the e' abbastanza ampia.
https://www.yelp.it/biz/tio-chico-torino-2;Personale simpatico ed appassionato, ambiente pulito e carino accompagnato da ottima musica di sottofondo.
https://www.yelp.it/biz/timeout-bari;Locale ampio e originale ma la musica ad alto volume non permette una conversazione e finisce per stordire.
https://www.yelp.it/biz/tiffany-lounge-torino;Personale molto gentile e pronto a soddisfare qualsiasi esigenza.
https://www.yelp.it/biz/tiella-bari;Cenare da tiella vuol dire sentirsi a casa.Atmosfera accogliente,personale disponibile e amichevole.
https://www.yelp.it/biz/the-stuart-pub-bari;Il locale è molto carino e il personale veramente qualificato.
https://www.yelp.it/biz/the-queen-victoria-torino;Il posto è accogliente e d'estate vi è anche un dehor estivo.
https://www.yelp.it/biz/the-governor-pub-torino;In conclusione locale carino, bisognerebbe rivedere solo le attenzioni al cliente!
https://www.yelp.it/biz/the-egg-torino;Atmosfera informale ma accogliente, personale gentile, veloce e preparato.
https://www.yelp.it/biz/the-duke-of-wellington-torino;Il tutto splendidamente completato da un personale simpatico, di eccellente presenza e molto disponibile alle richieste del cliente!
https://www.yelp.it/biz/the-bakery-torino;Il locale è molto carino e la vetrina ti ispira sin da subito e ti fa decidere di entrare.
https://www.yelp.it/biz/terra-di-mezzo-bari;Prezzo nella norma riguardo la tipologia di locale ma elevato in relazione al servizio e prodotti offerti.
https://www.yelp.it/biz/teriyaky-torino;buono il cibo ma soprattutto leggero. servizio molto rapido e cortese. buon rapporto qualità prezzo.
https://www.yelp.it/biz/teapot-torino;Locale carino,diverso dal solito:i mobili riciclati e rivisitati danno un'aria vissuta e un'atmosfera calda.
https://www.yelp.it/biz/taxi-pizza-torino;Il proprietario é simpaticissimo. la pizza é ottima, ma anche il kebab
https://www.yelp.it/biz/taverna-rossa-di-zappia-pasquale-torino;La pizza è buona: sottile e cotta al punto giusto, il servizio veloce ed i prezzi economici.
https://www.yelp.it/biz/taverna-i-miserabili-torino;L'ottima atmosfera della Taverna ti offre tutto questo.
https://www.yelp.it/biz/taverna-delloca-torino;Ottima accoglienza, professionalità in sala ma soprattutto piatti sopraffini con un'impiattata che rende felice anche l'occhio.
https://www.yelp.it/biz/tatami-bari;Personale simpatico e disponibile, in particolare il titolare è stato molto simpatico!
https://www.yelp.it/biz/tasty-burger-torino;Locale carino e tranquillo con personale accogliente e gentile e panini buonissimi!
https://www.yelp.it/biz/taiki-bari;Servizio decisamente buono, proprietari gentilissimi e disponibili!
https://www.yelp.it/biz/taglio-torino;Location molto carina a lato di una piazza affollata con molta tranquillità .personale gentilissimo .
https://www.yelp.it/biz/taco-bang-torino;Atmosfera accogliente, servizio rapido e cibo ottimo per un pranzo veloce ma sostazioso e dal gusto un po' diverso
https://www.yelp.it/biz/tabit-bari;Ristorante di classe con personale molto gentile, chef di qualità e cibo ottimo.
https://www.yelp.it/biz/t-bone-station-torino;Servizio veloce, personale simpatico e disponibile, prezzi medi o medio-alti.
https://www.yelp.it/biz/sweet-lab-torino;Il personale è gentile e molto disponile, ogni cosa è impeccabile, dall'atmosfera ai piatti stile British del brunch.
https://www.yelp.it/biz/sushitao-bari;Ristorante giapponese a bari molto carino con personale molto simpatico e gentile .
https://www.yelp.it/biz/sushi-yu-torino;Unica pecca: poca scelta nel menù, non molti piatti disponibili per l'AYCE e in generale.
https://www.yelp.it/biz/sushi-sound-torino;Bellissima location, atmosfera moderna con toni di antica cultura nipponica, personale gentilissimo e preparato.
https://www.yelp.it/biz/sushi-j-torino;Il personale è gentile, il posto pulito, la qualità del SUSHI speciale :) Vasto assortimento, piatti per niente banali!
https://www.yelp.it/biz/storie-del-vecchio-sud-bari;bel locale, originale, che consente di gustare un bel bicchiere di vino o di birra a prezzi onesti.
https://www.yelp.it/biz/stars-e-roses-torino;Il ristorante infatti è molto caratteristico e particolare e sicuramente immerso in una piazzetta splendida.
https://www.yelp.it/biz/st-martin-torino;Personale per nulla simpatico, soprattutto i proprietari al bancone.
https://www.yelp.it/biz/spaghetteria-70cento-bari;Il locale è carino molto sobrio nel complesso con atmosfera piacevole.
https://www.yelp.it/biz/spada-reale-torino;Il servizio è stato veloce il giusto ed il menù molto ben illustrato dal giovane Armando, gentile e professionale.
https://www.yelp.it/biz/soup-e-go-torino;Servizio rapido perché te lo fai da te, prezzi modici, ambiente informale.
https://www.yelp.it/biz/soul-kitchen-torino;Il personale è davvero molto cortese, il locale molto ampio e sono disponibili anche tavoli tondi.
https://www.yelp.it/biz/sotto-la-mole-torino;Servizio cortese e discreto, ambiente semplice ed elegante...e molto silenzioso, il che è davvero ormai una rarità.
https://www.yelp.it/biz/solferino-torino;Ambiente cordiale, personale preparato e pronto a darvi consigli e suggerimenti preziosi per una cucina piemontese di tutto rispetto.
https://www.yelp.it/biz/sir-francis-drake-torino;Per il resto passi una serata tranquilla tra amici il personale è accogliente e simpatico.
https://www.yelp.it/biz/singapore-torino;Ottima atmosfera, servizio eccellente e pasti ottimi!!
https://www.yelp.it/biz/simini-giuliano-torino;Qualità prezzo assolutamente proporzionata, non ci si può aspettare di mangiare pesce crudo e ostriche e spender poco!
https://www.yelp.it/biz/simbad-kebab-torino;Ristorante favoloso personale simpatico e preparato l'unica pecca e il numero di telefono sbagliato il nunero giusto è 0114338867
https://www.yelp.it/biz/silvano-torino-2;Ormai a Torino decine di gelaterie fanno un ottimo gelato e hanno un servizio più che ottimo.
https://www.yelp.it/biz/signorvino-torino;Locale ricavato in un palazzo storico veramente molto bello ed invitante cucina a vista ed annessa enoteca.
https://www.yelp.it/biz/sicomoro-torino;La pizza era buona, gli ingredienti freschi, il servizio veloce, puntuale e preciso, il conto molto onesto.
https://www.yelp.it/biz/sicily-bar-torino;Inoltre il posto è molto carino ed accogliente, il personale è professionale, cortese e simpatico.
https://www.yelp.it/biz/siciloso-torino;Quanto alla location il locale è molto carino e ben curato, personale gentile.
https://www.yelp.it/biz/sibir-torino-2;Il locale é davvero bellissimo,con soffitto a cassettoni in legno, e atmosfera calda e romantica.
https://www.yelp.it/biz/shore-torino;Il personale è gentile ed è simpatico vedere il barman che ti prepara i cocktails al bancone.
https://www.yelp.it/biz/shodai-bari;Il nuovo cameriere un po' sgorbutico al contrario del collega alla cassa invece molto gentile e professionale!
https://www.yelp.it/biz/shizen-torino;Il locale è molto carino e ben curato, atmosfera accogliente e personale gentilissimo e sorridente.
https://www.yelp.it/biz/sharazad-torino;Il locale è semplice e informale, ma la cucina è ottima e i prezzi sono contenuti.
https://www.yelp.it/biz/shannon-torino;Bel locale in stile Irlandese e con qualche posto anche fuori.
https://www.yelp.it/biz/shamrock-inn-torino;Servizio veloce, personale cordiale e molto disponibile.
https://www.yelp.it/biz/shaka-brah-torino;Locale molto carino,con musica dal vivo, atmosfera Hawaiiana e ampia scelta di Leggi il seguito
https://www.yelp.it/biz/sfashion-cafe-torino;Il locale è molto carino, tutto colorato e si respira una bella atmosfera.
https://www.yelp.it/biz/seven-up-torino;Servizio molto gradevole e una bella atmosfera informale (dentro o fuori).
https://www.yelp.it/biz/settes%C3%AC-torino-2;Tanta cura e attenzione ai dettagli nella preparazione e presentazione di cibo di alta qualità !
https://www.yelp.it/biz/serranos-torino;Locale molto carino e accogliente nel centro di Torino, personale gentile e simpatico.
https://www.yelp.it/biz/sen-mi-ya-torino-2;Personale poco simpatico, molto sbrigativo e mai sorridente.
https://www.yelp.it/biz/sciuscia-pizzeria-torino;Servizio molto veloce, un discreto numero di coperti e una bella location lungo il po.
https://www.yelp.it/biz/scapadaca-torino;Chi gestisce il locale è gentile e simpatico.
https://www.yelp.it/biz/scannabue-torino;Il ristorante è in una bella piazzetta e il locale è caratteristico e il personale è cortese.
https://www.yelp.it/biz/scalo-vanchiglia-torino;Pizza ottima e pizze diverse dal solito come la pesto patate viola pinoli e pomodorini cotti a legna.
https://www.yelp.it/biz/sbrodolone-torino;Pizza molto gustosa e servizio rapido, gestori simpatici e rapidi nella preparazione.
https://www.yelp.it/biz/sara-caffetteria-torino;Il personale è sempre cortese e disponibile.
https://www.yelp.it/biz/sandrino-bari;Il personale è gentile e pronto a consigliare i giusti abbinamenti o le specialità di giornata.
https://www.yelp.it/biz/san-tommaso-10-torino;Ottima atmosfera , ottima cucina , servizio professionale , prezzo adeguato al servizio ed alla qualità del cibo .
https://www.yelp.it/biz/samoa-torino;Porzioni abbondanti e buone.Prezzi nella media di un ristorante.Ambiente pulito e servizio rapido.
https://www.yelp.it/biz/sale-in-zucca-torino;L'atmosfera è molto piacevole e rilassante, una vera pausa dal lavoro!
https://www.yelp.it/biz/sa-corte-noa-torino;Servizio ottimo cordialità e professionalità del personale pietanze curate e deliziose che dire ottimo!!!!!
https://www.yelp.it/biz/rossosapore-torino;Bellissima location in stile rustico, un ambientazione molto affascinante a mo di cascina.
https://www.yelp.it/biz/rossopomodoro-torino;Il personale è super disponibile, simpatico, ed efficiente.
https://www.yelp.it/biz/roar-roads-torino;Molto buono bel locale camerieri molto cordiali e disponibili.
https://www.yelp.it/biz/rizzelli-torino;Personale molto cortese ed accogliente, tuttavia un po' di professionalità in più non guasterebbe.
https://www.yelp.it/biz/rivareno-torino;Buonissimo gelato morbido e cremoso gusti nuovi molto gentile e disponibile prezzo giusto buona ubicazione
https://www.yelp.it/biz/ristrot-guviol-torino;Atmosfera accogliente, personale gentile e preparato e assolutamente non invadente...
https://www.yelp.it/biz/ristoro-28-3-torino-2;Il servizio è cortese ed informale, il prezzo è adeguato ed i fuori menu non generano sorprese.
https://www.yelp.it/biz/ristoranti-tropicana-torino;Pizza molto buona (anche integrale o nera) ed una cucina abbastanza varia ne completano l'offerta in un ambiente informale!
https://www.yelp.it/biz/ristoranti-tromlin-torino;Il locale e' accogliente .Personale cortese in ambiente molto simpatico, Menù fisso in stile piemontese.
https://www.yelp.it/biz/ristoranti-taverna-delle-rose-torino-2;Il ristorante di per se è caratteristico, sia nell'arredamento che all'esterno.
https://www.yelp.it/biz/ristoranti-sardegna-torino;Il personale è gentilissimo e pronto a venire in contro al cliente per qualsiasi esigenza.
https://www.yelp.it/biz/ristoranti-alba-torino;La famiglia che gestisce il locale è davvero molto gentile e sollecita, ma le note positive si fermano qui.
https://www.yelp.it/biz/ristorante-ratatui-torino-2;Servizio veloce, cordialità, dehor estivo impagabile, buono il vino, anche quello della casa ...
https://www.yelp.it/biz/ristorante-peppino-torino;Ottimo rapporto qualità - prezzo, cibo buono ed abbondante, servizio veloce e personale simpatico e professionale.
https://www.yelp.it/biz/ristorante-consorzio-torino;Atmosfera informale e accogliente, servizio attento e veloce, cibo ben presentato e davvero buono.
https://www.yelp.it/biz/ristopizza-giampaolo-bari;Bel ristorante caratteristico in stile pugliese con sala principale molto ampia.
https://www.yelp.it/biz/regina-margherita-torino;Bel posto e personale molto simpatico e cordiale.
https://www.yelp.it/biz/re-vittorio-bari;Il locale è carino ed il personale gentile e accogliente.
https://www.yelp.it/biz/re-sole-torino-2;Locale molto carino, ingresso scenografico e bella atmosfera.
https://www.yelp.it/biz/raspino-lorenzo-torino;Il locale è molto carino ed è possible sedersi anche in un comodo dehor esterno.
https://www.yelp.it/biz/quo-vadis-torino-2;Sorpresa piacevole al momento del conto: molto inferiore a quello di un tempo: ottimo rapporto qualità/prezzo.
https://www.yelp.it/biz/quelli-che-ben-pensano-torino;Servizio veloce, pizze molto buone e locale abbastanza familiare ed informale.
https://www.yelp.it/biz/quelli-che-ben-pensano-2-torino;Il personale è davvero simpatico, celere e generoso (per ogni pizza hanno offerto una bevanda - coca/birra/acqua).
https://www.yelp.it/biz/quattro-soldi-torino;Personale simpatico e competente indirizzato con professionalità dai titolari.
https://www.yelp.it/biz/quanto-basta-bari;Personale molto gentile e disponibile, pizza napoletana preparata con cura e buona scelta di birre con una carta dedicata!
https://www.yelp.it/biz/quaglia-teresa-torino;Il locale è ben curato, il personale è informale ma non invadente, coccolate e servite con un sorriso. consigiatissimo!!
https://www.yelp.it/biz/punto-pizza-di-moro-michel-torino;Il proprietario é simpaticissimo e il locale é accogliente ma da aggiornare, per il resto é tutto fantastico!
https://www.yelp.it/biz/primaepoi-torino-3;Veloce il servizio con personale gentile e professionale e cibi genuini e presentati molto bene.Complimenti, non cambiate!
https://www.yelp.it/biz/prima-e-poi-torino;Veloce il servizio con personale gentile e professionale e cibi genuini e presentati molto bene.Complimenti, non cambiate!
https://www.yelp.it/biz/premiata-osteria-dellhermada-torino;ottimo servizio,ottima qualità, locale molto bello e caratteristico,e che dire....costa anche poco il che non guasta mai!
https://www.yelp.it/biz/porto-di-savona-torino;Ideale per gli amanti del buon cibo all'interno di un locale caratteristico in una delle più belle piazze d'Europa.
https://www.yelp.it/biz/porcaloca-torino;Il locale è carino e accogliente, il servizio molto veloce e i camerieri sono disponibili e gentili.
https://www.yelp.it/biz/poormanger-torino;Locale carino, servizio informale, clientela giovane, si distingue per la formula originale.
https://www.yelp.it/biz/ponte-regina-torino;Il personale è gentile e simpatico, il locale è carino, e i prezzi sono nella norma.
https://www.yelp.it/biz/ponte-dora-torino;la pizza è buona e questa è sicuramente una nota molto positiva!
https://www.yelp.it/biz/pollastrini-torino;Servizio veloce e piatti fatti in casa (gustosi e ricercati), ambiente familiare ed elegante al tempo stesso.
https://www.yelp.it/biz/platti-torino-2;Ottimo anche il servizio pranzo con enorme scelta di tramezzini di gran qualità fatti al momento.
https://www.yelp.it/biz/pizzificio-torino;Buona scelta di pizze dall' ottimo rapporto qualità prezzo...menzione speciale per le gourmet: davvero saporite e digeribili.
https://www.yelp.it/biz/pizzerie-charlie-chaplin-torino;La pizza è buona sia quello al mattone che al padellino, la focaccia e la farinata altrettanto.
https://www.yelp.it/biz/pizzeria-vecchio-forno-garibaldi-torino;Il locale è piccolo ma il personale è sempre gentile e discreto.
https://www.yelp.it/biz/pizzeria-vecchia-londra-torino;La pizza è buona, anche se non va bene per coloro che la amano molto lievitata.
https://www.yelp.it/biz/pizzeria-tarantini-al-cancello-rotto-bari;Il locale è molto curato, sia all'aperto che nell'interno e nello spazio verandato.Il locale è' inoltre molto ben frequentato.
https://www.yelp.it/biz/pizzeria-spaccanapoli-torino;Pizza al metro molto buona e personale simpatico e molto gentile.
https://www.yelp.it/biz/pizzeria-silvestro-torino;Professionalità e disponibilità del personale molto attento alle esigenze del cliente unita alla simpatia del titolare.
https://www.yelp.it/biz/pizzeria-queendici-torino;La pizza è buona, sono disponibili anche impasti diversi (ad esempio al kamut), il servizio è veloce e cortese.
https://www.yelp.it/biz/pizzeria-poldo-torino;Personale gentile, bel dehors che consiste in alcuni tavolini sulla via di nanni, pedonalizzata in questo punto!
https://www.yelp.it/biz/pizzeria-pizzabon-bari;la pizza è buona, ce ne sono tantissime tra cui scegliere e avrete solo l'imbarazzo della scelta.
https://www.yelp.it/biz/pizzeria-pizza-e-altro-bari;Ambiente informale molto accogliente con personale simpatico e competente.
https://www.yelp.it/biz/pizzeria-pieros-torino;Prezzi contenuti e personale gentile e simpatico.
https://www.yelp.it/biz/pizzeria-petit-roi-bitritto;Pizza pizza pizza spettacolare antipasti classici ma buonissimi personale simpatico e prezzi molto bassi
https://www.yelp.it/biz/pizzeria-osteria-dal-vassallo-bari;Un posto veramente carino nel pieno centro di bari.qualita',cortesia,velocità' tutte componenti che sono sufficienti a consigliarvi questo bel ristorante!
https://www.yelp.it/biz/pizzeria-marfi-torino;Staff simpatico e ottimo rapporto qualità prezzo.
https://www.yelp.it/biz/pizzeria-la-tana-bari;Personale simpatico e servizio veloce: basta non andarci quando il locale è tutto pieno..
https://www.yelp.it/biz/pizzeria-la-stua-torino;locale in centro a Torino fanno un'ottima pizza buona anche anche la cucina. bella anche la location. da provare
https://www.yelp.it/biz/pizzeria-la-sacrestia-torino;Servizio anche rapido ma il locale, vista l'ora, non era pieno.
https://www.yelp.it/biz/pizzeria-l-orchidea-torino;Il personale è gentilissimo e l'atmosfera è molto amichevole.
https://www.yelp.it/biz/pizzeria-il-pirata-bari;Il locale è carino e soprattutto i tavoli non sono tutti attaccati come spesso accade in molti altri locali.
https://www.yelp.it/biz/pizzeria-ideal-di-atzori-alberto-torino;Personale gentile e prezzi nella norma (2 farinata, 3 pizze, acqua, birra e 1 caffè 37 €).
https://www.yelp.it/biz/pizzeria-gino-torino;Locale discreto, ma pizza al tegamino e farinata superlative, un po' care le birre.
https://www.yelp.it/biz/pizzeria-giampy-di-mazzola-giuseppe-torino;Ottimo rapporto qualità/prezzo, professionalità e gentilezza di tutto il personale giovane e sempre sorridente.
https://www.yelp.it/biz/pizzeria-gelateria-cecchi-torino;Ottima farinata e pizza al padellino molto competitiva.personale gentile e ambiente informale Prezzi contenuti insomma sempre piacevole mangiareda cecchi!
https://www.yelp.it/biz/pizzeria-fratelli-la-bufala-torino;Il locale è carino, con materiali poveri hanno fatto un arredamento stiloso, puntando sull illuminazione e sui colori.
https://www.yelp.it/biz/pizzeria-enzo-e-ciro-di-fraddosio-v-c-bari;Locale semplice e informale ma cibo gustosissimo, soprattutto il prosciutto crudo!
https://www.yelp.it/biz/pizzeria-enzo-bari;locale molto accogliente... personale molto simpatico, gentile e professionale!
https://www.yelp.it/biz/pizzeria-dual-torino;Il locale è ampio e ha tanti tavoli, l'atmosfera è chic e la pizza varia.
https://www.yelp.it/biz/pizzeria-divina-bari;Personale competente molto cortese e attento ad accontentare le richieste del cliente.
https://www.yelp.it/biz/pizzeria-di-cosimo-bari;Personale cortese e gentile, Giacomo (il più anziano della famiglia) ha sempre un sorriso per tutti.
https://www.yelp.it/biz/pizzeria-da-michele-torino;Atmosfera informale e grande cura nella presentazione dei piatti.
