url;review
https://www.yelp.it/biz/dai-saletta-torino-2;L'atmosfera informale, calda ed accogliente, contribuisce a sentirsi a proprio agio.
https://www.yelp.it/biz/da-paolo-bari;Locale accogliente e personale gentile ed attento ... ampia scelta di vini per ogni gusto ed esigenza ..
https://www.yelp.it/biz/da-nicola-torre-a-mare;Prezzo corretto e personale simpatico e professionale
https://www.yelp.it/biz/da-nathalie-bari;Locale molto carino, pulito e con personale cordiale e simpatico.
https://www.yelp.it/biz/da-mauro-torino;Ristorante caratteristico sempre molto affollato ( purtroppo non si prenota, quindi armarsi di pazienza,ma ne vale la pena!
https://www.yelp.it/biz/da-giuliano-torino;La pizza è buona e ben condita, la cucina propone piatti semplici gustosi e molto abbondanti... prezzi molto onesti...
https://www.yelp.it/biz/da-giannino-l-angolo-d-abruzzo-torino;Il servizio è stato veloce e cordiale, il locale è ben arredato e accogliente, c'è una bella atmosfera.
https://www.yelp.it/biz/da-ciro-torino;Il personale è molto simpatico e disponibile, il locale è semplice, ma carino.
https://www.yelp.it/biz/da-ciccillo-torino;Il personale è più che simpatico e cordiale, specialmente la ragazza è davvero gentile, simpatica ed efficiente.
https://www.yelp.it/biz/da-benito-torino;Intatti anche il servizio è stato molto veloce preciso puntuale e di elevata professionalità.
https://www.yelp.it/biz/curry-zone-turin;Sembra quasi di aver lasciato l'Europa e di esser stati catapultati in India: buon cibo, bella atmosfera, locale tranquillo.
https://www.yelp.it/biz/crocetta-torino;Il personale gentile , simpatico e professionale, rende il pasto ancora più piacevole.
https://www.yelp.it/biz/cris-e-bio-bari;Atmosfera accogliente , servizio celere, personale cortese , musica in sottofondo ottima , buono il cibo ..
https://www.yelp.it/biz/costadoro-torino;Il personale è gentile e simpatico, il servizio rapido.
https://www.yelp.it/biz/cornetti-night-torino-2;Posto davvero accogliente, il proprietario simpaticissimo e cornetti buonissimi.
https://www.yelp.it/biz/cornetti-night-torino;Posto davvero accogliente, il proprietario simpaticissimo e cornetti buonissimi.
https://www.yelp.it/biz/copacabana-torino;Il cibo è molto buono e il locale è carino e di gusto.
https://www.yelp.it/biz/coox-torino;Buon cibo, cordialità, un menù rinnovato e con proposte accattivanti oltre che cruelty free!
https://www.yelp.it/biz/conte-verde-torino-2;Servizio ottimo, con camerieri disponibili, gentilissimi e veloci... proprio barvi.
https://www.yelp.it/biz/conogelato-torino;Personale simpatico e gelato squisito, geniale l'idea di usare il latte di bufola.
https://www.yelp.it/biz/complice-di-zhou-jinshu-torino;Il servizio è veloce, informale ma discretamente attento alle richieste dell'avventore.
https://www.yelp.it/biz/colorado-caffe-bari;Ottimo il servizio, ma soprattutto l'atmosfera, resa ancora più familiare dalla simpatia del titolare....provare per credere.
https://www.yelp.it/biz/cit-ma-bon-torino;Qualità degli ingredienti e servizio cortese ed attento ne fanno un locale piacevole in cui è bello tornare.
https://www.yelp.it/biz/circolo-dei-lettori-torino;Atmosfera molto accogliente, tavoli comodi e ben distanziati, personale gentilissimo malgrado il periodo di grande lavoro.
https://www.yelp.it/biz/cioccolato-peyrano-torino-2;Personale gentile, inclusa la signora alla cassa, verosimilmente la gerente o proprietaria.
https://www.yelp.it/biz/cinque-lire-torino;Ottima accoglienza ed atmosfera, servizio rapido ed eccellente rapporto qualità/prezzo.
https://www.yelp.it/biz/cinese-nanchino-torino;Da segnalare che il personale è estremamente gentile e disponibile, ma purtroppo non basta.
https://www.yelp.it/biz/cinese-mei-li-hua-torino;Il personale è molto gentile e cordiale e anche molto disponibili.
https://www.yelp.it/biz/cinese-fang-xiang-bari;Servizio cortese e rapido, locale molto informale, menù molto ampio e prezzi ragionevoli.
https://www.yelp.it/biz/cinese-du-cheng-torino-2;Ottimo ristorante si mangia proprio bene da ritornare I prezzi sono accessibili a tutti il servizio e ottimo
https://www.yelp.it/biz/cinese-chen-lon-torino;L'atmosfera è piacevole e se volete passare un pranzo in tranquillità questo è il posto giusto.
https://www.yelp.it/biz/ciclatera-sotto-il-mare-bari;Locale molto carino all'interno, servizio efficiente e prodotti di qualità buona a prezzo discreto.
https://www.yelp.it/biz/ciacolon-ca-veneta-torino;Locale molto caratteristico con personale simpatico ed attento.
https://www.yelp.it/biz/chiodi-latini-new-food-torino;Il tutto in un'atmosfera accogliente e finemente elegante.
https://www.yelp.it/biz/chez-zeina-torino;Atmosfera accogliente e suggestiva tipica dell'altra sponda del Mediterraneo.
https://www.yelp.it/biz/che-bolle-in-pentola-torino;Il locale è carino e caratteristico, il personale gentile e le porzioni abbondanti.
https://www.yelp.it/biz/cera-una-volta-torino;Il personale e' super accogliente, l'atmosfera e' molto calorosa e' rilassante.
https://www.yelp.it/biz/cento-90-due-torino-2;Il rapporto qualità prezzo rimane molto buono ma forse si poteva evitare l'aumento sulla consumazione obbligatoria a 12€.
https://www.yelp.it/biz/cecchi-torino;Ambiente informale per una pizzeria storica di Torino.
https://www.yelp.it/biz/ceccarelli-torino;ambiente famigliare pronti a soddisfare qualsiasi esigenza camerieri molto simpatici e attenti Una qualità prezzo che non ha rivali!!!
https://www.yelp.it/biz/catullo-torino-2;Locale ampio e carino ( nella norma niente di così speciale ), il cameriere gentile servizio al tavolo efficiente.
https://www.yelp.it/biz/casale93-torino;Il locale ha un'atmosfera poco accogliente, il personale è freddo ma veloce, anche troppo.
https://www.yelp.it/biz/casablanca-bari;Ottimo nel servizio e nel gusto, piatti abbondanti ottimo anche il servizio,posto con vista sul mare molto bello.
https://www.yelp.it/biz/casa-vicina-torino;Il cibo superbo con una lista favolosa di vino e servizio molto professionale rendono questo ristorante davvero speciale.
https://www.yelp.it/biz/casa-mad-torino;L'ambiente è molto particolare con dei bei quadri e un'atmosfera familiare il cameriere/lavapiatti molto cortese anche se poco professionale.
https://www.yelp.it/biz/casa-fiore-torino;Il personale molto simpatico , preparato e cortese , vi farà passare una bella serata nell'atmosfera torinese .
https://www.yelp.it/biz/casa-del-barolo-torino-3;Personale gentile e preparato, attenti in ogni dettaglio ed esigenza del cliente...
https://www.yelp.it/biz/cantine-risso-torino;Il locale è carino e caratteristico...con un'atmosfera quasi romantica.
https://www.yelp.it/biz/cammaf%C3%A0-torino-4;Anche il locale è carino rinnovato da poco
https://www.yelp.it/biz/camilla-kitchen-torino;Locale carino ed elegante e personale disponibili, gentili e competenti.
https://www.yelp.it/biz/caffetteria-pasticceria-torino;Atmosfera piacevole, per un salentino è come sentirsi a casa.
https://www.yelp.it/biz/caffetteria-mazzini-torino;La cameriera era gentile e disponibile, il vino eccellente, i prezzi bassi e le persone - guardando affascinante!
https://www.yelp.it/biz/caffeteria-federico-ii-bari;Da notare anche la cortesia del personale simpatico e disponibile verso il cliente.
https://www.yelp.it/biz/caffe-vittorio-veneto-torino;Il locale ha un bellissimo dehor con vista su piazza vittorio, gran madre e collina di Torino.
https://www.yelp.it/biz/caffe-vergnano-torino;Molti quotidiani da leggere e personale molto simpatico.
https://www.yelp.it/biz/caffe-lumiere-torino;La scelta di due torte vegane molto buone lo rende un posto ancora più accogliente e aperto a tutti.
https://www.yelp.it/biz/caff%C3%A8-torino-torino-2;Servizio curato dal personale cortese, mai invadente e sempre premuroso.Nessun cameriere di secondo lavoro.
https://www.yelp.it/biz/caff%C3%A8-della-posta-torino;Il bar è stato completamente ristrutturato da poco e dà  subito l'impressione di essere ben curato e pulito.
https://www.yelp.it/biz/caff%C3%A8-borghese-bari;Il Cafe Borghese è un bar molto confortevole con un'ottima atmosfera.
https://www.yelp.it/biz/caff%C3%A8-bodoni-torino;Il servizio è rapido e molto gentile!
https://www.yelp.it/biz/cafe-vergnano-1882-torino;Il personale è cortese, posto pulito,moderno, un po' caro( un caffè 2,50 euro, una sacher mono porzione 5 euro)
https://www.yelp.it/biz/cacio-e-pepe-torino;Il locale è molto semplice ed informale, gli spazi molto ristretti fra i vari tavoli.
https://www.yelp.it/biz/busters-coffee-torino;Un piccolo locale carino e ben arredato con personale molto simpatico.
https://www.yelp.it/biz/burgheria-torino-2;Locale con atmosfera accogliente e servizio rapido, buona scelta di birre, prezzi contenuti.
https://www.yelp.it/biz/burgheria-torino;Il servizio è cortese, le cameriere sono molto disponibili a spiegare il funzionamento un po' criptico di ordinazione.
https://www.yelp.it/biz/buosi-torino;Da ritornare .. ottimo qualità/ prezzo e personale cortese e gentile!
https://www.yelp.it/biz/bunet-torino;Locale curato con personale simpatico ma cortese: aperitivo molto buono, forse poco vario, ma di qualità.
https://www.yelp.it/biz/bucks-g-d-34-torino-2;Bel locale abbastanza grande. ha un menù molto vario e si mangia davvero bene.
https://www.yelp.it/biz/bruschetteria-pautasso-di-stecco-susanna-torino;Atmosfera piacevole e servizio molto cortese (e simpatico!).
https://www.yelp.it/biz/briss-torino;Servizio molto attento e tempi di attesa molto ragionevoli tenuto conto dei tempi necessari x la preparazione dei piatti.
https://www.yelp.it/biz/brek-torino;Buoni i piatti e discreto il rapporto qualità prezzo...
https://www.yelp.it/biz/brasserie-bordeaux-torino-3;Il locale è bello...servizio ottimo..cortesia e professionalità.
https://www.yelp.it/biz/brasserie-bordeaux-torino-2;Il locale è bello...servizio ottimo..cortesia e professionalità.
https://www.yelp.it/biz/braceria-signorile-bari;Consigliato ve lo dice un ristoratore Ottima carne Ottimo servizio Ottimo rapporto qualità prezzo Il proprietario molto simpatico.
https://www.yelp.it/biz/bottega-baretti-moncalieri;Dipone anche di dehor ed il personale è simpatico e per niente invadente, che dire, complimenti e alla prossima!
https://www.yelp.it/biz/botta-bari;Il personale è molto alla mano e pronto a soddisfare ogni esigenza.
https://www.yelp.it/biz/borgo-dora-torino;Locale molto semplice, da fuori sembra quasi che non sia aperto ma dentro è spesso pieno.
https://www.yelp.it/biz/borgo-antico-bari;Camerieri disponibili e simpatici, dal servizio rapido ed efficiente.
https://www.yelp.it/biz/bollicine-di-gigliotti-e-de-bartolo-torino;Personale sempre simpatico ed all'altezza della situazione.
https://www.yelp.it/biz/boja-fauss-torino-2;Personale simpatico e disponibile, piatti curati e ben serviti e molto buoni.
https://www.yelp.it/biz/boheme-torino;Il personale è sempre simpatico e professionale.
https://www.yelp.it/biz/bocciofila-mossetto-torino;Il personale è gentilissimo e cordiale e il cuoco ci sa fare con piatti tipici o rivisitati.
https://www.yelp.it/biz/bocciofila-cavorettese-torino;Qualità prezzo eccellente,personale gentile professionale e molto simpatico,tutto sulla collina torinese...si mangia veramente bene
https://www.yelp.it/biz/blue-eyes-bari;Posto giusto per trascorrere una serata in compagnia mangiando e bevendo secondo la giusta qualità e prezzo rimanendo soddisfatti.
https://www.yelp.it/biz/blah-blah-torino;Un bel locale in centro a torino per passare due ore sentendo buona musica divertendosi
https://www.yelp.it/biz/black-jack-torino;Questa pizzeria a conduzione familiare è aperta anche a pranzo e offre ottime pizze cotte nel forno a legna!
https://www.yelp.it/biz/black-e-white-bari;Personale estremamente cortese quanto professionale, ha certamente contribuito a suggellare al meglio una giornata di festa quale quella odierna.
https://www.yelp.it/biz/black-angus-turin;Ristorante carino e molto accogliente, tutto nuovo con una bella atmosfera.
https://www.yelp.it/biz/bistrot-turin-torino;Locale molto caratteristico personale gentilissimo preparato veloce Mangiato benissimo e bevuto ancora meglio se possibile bravi
https://www.yelp.it/biz/birrificio-torino-torino;Il personale è cortese, anche se a causa del numero di clienti da servire il servizio non è veloce.
https://www.yelp.it/biz/birreria-la-divina-commedia-torino;Il servizio è molto cortese anche se in serate di punta vanno un po' in difficoltà.
https://www.yelp.it/biz/birreria-don-giovanni-torino;Buona la selezione della birra del mese... personale molto gentile e simpatico!
https://www.yelp.it/biz/biffi-valenzano;Il personale è cortese e l'atmosfera piacevole.
https://www.yelp.it/biz/bicyclette-torino;Atmosfera accogliente e particolare, non i soliti locali fatti con lo stampino.
https://www.yelp.it/biz/biberon-torino;In compenso i gestori sono cordiali e l'atmosfera molto piacevole.
https://www.yelp.it/biz/biancofiore-bari;Un rosato negramaro ha accompagnato il rapido pranzo di lavoro in un'atmosfera sempre molto accogliente e curata.
https://www.yelp.it/biz/biancofarina-bari;In poche parole: vasta scelta nel menù, servizio veloce e buon rapporto qualità/prezzo, camerieri simpatici, attenti e disponibili.
https://www.yelp.it/biz/berbel-torino;L'atmosfera è sempre piacevole, il personale all'altezza e lo chef sempre pronto a raccontarti il piatto che hai davanti.
https://www.yelp.it/biz/beaubar-torino;Il meglio bar....l hamburger di chianina è fantastico...vini e birra di qualitá a buon prezzo....personale simpatico e disponibile.....daje!!!!!!
https://www.yelp.it/biz/bbq-di-pennestri-davide-antonio-c-torino;Ambiente particolare con la lama d'acqua sulla parete, molto bello anche d'estate con il suo dehors sul Po.
https://www.yelp.it/biz/bastimento-torino;Locale situato in centro a Torino dall'atmosfera accogliente, seppure gli spazi siano limitati.
https://www.yelp.it/biz/barnum-torino;Bel locale in zona San Salvario a Torino, è gestito da ragazzi giovani, disponibili e simpatici.
https://www.yelp.it/biz/barbagia-di-ollolai-torino;Il titolare è di un'estrema simpatia e cordialità,il tutto accompagnato da unsottofondo musicale ricercato e raffinato!
https://www.yelp.it/biz/baratti-e-milano-torino-2;Locale molto raffinato, sia nell'arredamento che nell'atmosfera che si respira.
https://www.yelp.it/biz/bar-torrefazione-beccuti-torino;Il locale è piccolo e spesso affollato ma il servizio è veloce ed efficiente.
https://www.yelp.it/biz/bar-telebari-bari;Locale esteticamente non particolarmente invitante, ma il gusto straordinario dei loro gelati fa dimenticare il resto!
https://www.yelp.it/biz/bar-miramare-bari;Gelato eccellente e personale cortese, gelateria con vista sul porticciolo della cittadina che è un Belvedere per gli occhi.
https://www.yelp.it/biz/bar-marconi-di-torre-francesco-torino;Il locale e arredato in modo semplice e il personale e gentile.
https://www.yelp.it/biz/bar-gerla-1927-torino;Posto storico molto elegante personale molto gentile cibo ottimo e molta professionalità.
https://www.yelp.it/biz/bar-delle-scienze-torino;Locale carino gestito da ragazzi giovani bravi ma soprattutto GENTILI E DISPONIBILI!
https://www.yelp.it/biz/bar-del-duomo-torino;ristorante di nuova gestione familiare. proposta di menù con molte verdure e primi piatti. personale accogliente e servizio veloce.
https://www.yelp.it/biz/bar-costarica-torino;Servizio ottimo (grazie anche alla bravura dei camerieri e alla loro simpatia, Julien in primis) e cortesia.
https://www.yelp.it/biz/bangla-takeaway-torino;Più che consigliato per chi vuole mangiare vera cucina indiana di altissima qualità!
https://www.yelp.it/biz/banco-vini-e-alimenti-torino;veramente tutto ottimo dal cibo al servizio cordiale e ben curato.Ci ritornero' sicuramente una piacevole sorpresa a Torino.
https://www.yelp.it/biz/banco-di-sicilia-torino;Tutta la tradizione siciliana in questo ristorante dal personale simpatico e accogliente.
https://www.yelp.it/biz/bacco-bari;La cena è stata ottima sotto tutti i punti di vista: qualità del cibo, atmosfera, servizio...
https://www.yelp.it/biz/baccanale-torino;Locale carino e pulito, atmosfera niente di particolare ne in bene ne in male.
https://www.yelp.it/biz/babayaga-bari;buonissimo mai mangiato un gelato cosi buono ottimo il servizio gusti buoni ottimo il pistacchio e nutella gelato
https://www.yelp.it/biz/b2-burger-and-beer-torino;Il personale simpatico e a disposizione per ogni esigenza.
https://www.yelp.it/biz/b-eat-torino;Cucina a vista, personale simpatico, ottimo cibo e ti senti in una puntata di A tavola con Guy!
https://www.yelp.it/biz/augusto-torino;Servizio professionale, informale e simpatico da parte del sig Francesco ( cameriere) .prezzi in linea con la media .
https://www.yelp.it/biz/astoria-torino;Il locale è molto carino, stile berlinese.
https://www.yelp.it/biz/artinfood-torino;Bel locale, caratteristico, cibo ben presentato e buono.
https://www.yelp.it/biz/art-lunch-di-jo-cafe-torino;Locale carino, personale molto gentile, qualità del cibo e presentazione dei piatti buona.
https://www.yelp.it/biz/armeria-reale-torino;Raffinata e preziosa collezione con pezzi di altissima qualità oltre ogni previsione.
https://www.yelp.it/biz/arigato-torino;L'atmosfera è accogliente e il personale quasi di famiglia ormai, consigliatissimo!
https://www.yelp.it/biz/arcadia-torino-4;Il personale è gentile, simpatico e attento ad ogni esigenza del cliente.
https://www.yelp.it/biz/antonelli-torino;I prodotti sono buoni e il personale è molto simpatico e disponibile.
https://www.yelp.it/biz/antico-balon-torino;Gentili i proprietari e i camerieri disponibili a consigliare e nel dare le spiegazioni richieste.
https://www.yelp.it/biz/antichi-sapori-torre-a-mare;La simpatia e la cordialità ne fanno da padrona.
https://www.yelp.it/biz/antica-trattoria-del-sole-torino;Un locale discreto, con un ottima cucina fatta di materie prime davvero eccellenti.
https://www.yelp.it/biz/antica-salumeria-torino;Il personale è molto cortese e disponibile all'esigenza della clientela.
https://www.yelp.it/biz/angolo-del-parin-torino;Il personale è simpatico e a disposizione per chiarimenti sui piatti più tipici.
https://www.yelp.it/biz/anema-e-cozze-torino;Pizza buona ma non sensazionale, come ce ne sono tante a Torino.
https://www.yelp.it/biz/amici-miei-torino;Tutto da provare IL PERSONALE MOLTO GENTILE e simpatico GRAZIE
https://www.yelp.it/biz/america-graffiti-torino;Locale molto carino in cui è possibile vivere l'atmosfera (o quasi) di una tipica cena americana anni 60.
https://www.yelp.it/biz/alla-portata-torino;In più il personale è molto simpatico e cortese.
https://www.yelp.it/biz/alla-lettera-torino;Il servizio è stato veloce e il personale simpatico, adeguati i prezzi.
https://www.yelp.it/biz/alivella-torino;Era poco affollata infatti il servizio è stato veloce ed efficiente.
https://www.yelp.it/biz/aldente-torino;Il personale simpatico preparato e a disposizione per qualsiasi informazione.
https://www.yelp.it/biz/alberto-marchetti-torino-2;Bel locale disposto su due piani, ordinato e abbastanza pulito nonostante il grande via vai di gente, sempre pieno!
https://www.yelp.it/biz/alberto-marchetti-torino;Bel locale disposto su due piani, ordinato e abbastanza pulito nonostante il grande via vai di gente, sempre pieno!
https://www.yelp.it/biz/alberosole-bari;carino il locale, semplice la cucina. in un azona molto centrale
https://www.yelp.it/biz/ala-torino;L' ambiente è carino e accogliente, caratterizzato dalla semplicità tipica delle osterie Il personale è gentile e rapido.
https://www.yelp.it/biz/al-tegamino-moncalieri;La pizza è buona e sostanziosa, adatta anche a persone vegeteriane in quanto non è presente carne nel menu.
https://www.yelp.it/biz/al-sorso-preferito-bari;Servizio impeccabile: personale gentile, simpatico e sempre attento alle esigenze del cliente.
https://www.yelp.it/biz/al-savoia-bari;Aperitivo ottimo ma il servizio è arroganza della giovane cameriera fa passare la fantasia di tornare!
https://www.yelp.it/biz/al-raffaello-bari;Locale molto curato, ottimo servizio, Personale estremamente gradevole è simpatico allietavano la serata .
https://www.yelp.it/biz/al-paradise-palese;le pizze sono sfiziose e buonissime. il personale competente. locale raffinato per serate in compagnia. consigliatissimo
https://www.yelp.it/biz/al-grassi-torino-2;Il servizio nonostante sia accurato e relativamente rapido.
https://www.yelp.it/biz/al-gatto-nero-torino;Cena ottima di livello assoluto, nessuna sbavatura in nessun piatto (dagli antipasti al dessert) e buona lista dei vini.
https://www.yelp.it/biz/al-garamond-torino;LOCATION 8 Locale molto curato ed intimo, ottima atmosfera grazie ad una leggera musica di sottofondo.
https://www.yelp.it/biz/al-cantuccio-bari;È adatto per chi vuole una serata tranquilla senza finire nel caos del centro città.
https://www.yelp.it/biz/al-cacimperio-torino;Buona carta dei vini e atmosfera piacevole.
https://www.yelp.it/biz/al-bicerin-torino;L'atmosfera che si respira nel piccolissimo locale è decisamente piacevole grazie anche al personale gentile e professionale.
https://www.yelp.it/biz/al-111-bari-2;Il servizio è ottimo: camerieri attenti, disponibili a consigliare e ad accogliere le varie richieste.
https://www.yelp.it/biz/ai-4-assi-di-sanna-roberto-torino;Pizza buona, servizio veloce, un posto moderno, tanti camerieri, disponibili!
https://www.yelp.it/biz/ai-2-ghiottoni-bari-2;Piatti buonissimi ( antipasti crudi e caldi con 2 primi tagliolini e risotto ) abbondanti .qualità prezzo ottima .
https://www.yelp.it/biz/agnolotti-e-friends-torino;Il personale gentile e professionale sempre a disposizione per la descrizione e la presentazione di tutti i piatti.
https://www.yelp.it/biz/adonis-torino;Il servizio è ottimo : i ragazzi che ci lavorano sono super gentili e disponibili.
https://www.yelp.it/biz/a6-sciamadda-torino;Personale davvero simpatico Cibo ottimo e di qualità Prezzi contenuti e locale molto carino.
https://www.yelp.it/biz/a-vucciria-torino;Personale simpatico e premuroso Locale carino e adatto ad ogni evento..
https://www.yelp.it/biz/a-picciridda-torino;Personale simpatico,tempi di attesa buoni,pulizia e accoglienza apprezzabili, prezzo...beh,un po alto!!!
https://www.yelp.it/biz/a-la-merenda-sinoira-torino;ottimo servizio,ottima qualità, locale molto bello e caratteristico,e che dire....costa anche poco il che non guasta mai!
https://www.yelp.it/biz/a-casa-di-pulcinella-torino;Il servizio è veloce e i camerieri moltomcordiali e disponibili.
https://www.yelp.it/biz/7-nani-torino;Servizio rapido: pizza al padellino piccola, sofficissima e leggera (anche nel gusto) e farinata da leccarsi le dita, imperdibile!!!
https://www.yelp.it/biz/500-calorie-torino;Il locale è carino, l'idea è originale, il personale è cortese.
https://www.yelp.it/biz/1610-bagel-torino;Servizio rapido, ottimo rapporto qualità prezzo, buona musica di sottofondo e Gene, il proprietario, è gentile e simpaticissimo.
