url;review
https://www.yelp.it/biz/la-locanda-bari;Il locale è bellissimo, si respira una atmosfera particolare, personale di sala davvero impeccabile e presente, mai invadente.
https://www.yelp.it/biz/la-limonaia-torino;Il servizio è discreto e il personale è molto competente e disponibile per chiarimenti, spiegazioni e consigli.
https://www.yelp.it/biz/la-gustosa-torino;A parte questi dettagli la pizza è molto buona, sottile e ben cotta, con un'ottima scelta di ingredienti.
https://www.yelp.it/biz/la-gricia-torino;Il locale è molto carino e il titolare è simpatico e garbato....
https://www.yelp.it/biz/la-granseola-torino;I prezzi sono buoni rispetto alla qualità anche a prezzo pieno, senza coupon.
https://www.yelp.it/biz/la-galina-scannata-torino;Personale simpatico e gentile, ottimi consigli per quanto riguarda il vino ed anche la birra.
https://www.yelp.it/biz/la-gaia-scienza-torino;Una bella piola: personale simpatico alla mano e divertente, cibo nella tradizione delle piole piemontesi, prezzo assolutamente onesto.
https://www.yelp.it/biz/la-fila-torino;Il personale è molto simpatico ed educato.
https://www.yelp.it/biz/la-drogheria-torino;Prezzo nella norma ma buffet molto ricco e atmosfera molto tranquillo, ideale per un apericena con gli amici
https://www.yelp.it/biz/la-cuite-torino;Il locale è informale con un atmosfera decisamente piacevole e i piatti serviti con un sorriso.
https://www.yelp.it/biz/la-conca-torino-2;Il personale inoltre è molto gentile, disponibile e simpatico.
https://www.yelp.it/biz/la-cena-coi-fiocchi-torino;Il personale è molto simpatico e so mangia bene.
https://www.yelp.it/biz/la-cecchina-bari;Ottimo ristorante materie prime di qualità personale gentile e simpatico bello il locale prezzo adeguato complimenti da parma
https://www.yelp.it/biz/la-casa-del-demone-torino;Fanno la cheesecake più buona del mondo e il personale è molto simpatico!
https://www.yelp.it/biz/la-caravella-torino-2;Come ci metti piede trovi Personale che ti mette a tuo agio in un'atmosfera accogliente e cordiale .
https://www.yelp.it/biz/la-capannina-torino-2;Bel locale, molto di classe, personale molto gentile e servizio efficiente.
https://www.yelp.it/biz/la-cantinella-torino;Ottima scelta di menù,molto varia e per tutt i gusti, cibo buonissimo, personale molto cortese e atmosfera rilassante.
https://www.yelp.it/biz/la-cantina-torino;Cena ottima: buonissimo rapporto qualità prezzo, cortesia del ristoratore ed ottima atmosfera!
https://www.yelp.it/biz/la-campana-torino-2;Rapporto qualità prezzo abbastanza alto anche senza coupon. 5 stelle di incoraggiamento, dato il punteggio non brillante finora!
https://www.yelp.it/biz/la-cabane-torino-2;Per chi vuole un aperitivo raffinato in una bella location (peccato non ci fosse ancora il dehor) ..
https://www.yelp.it/biz/la-bufala-torino;Locale carino ma pizza da dimenticare: biscottosa e insipida.
https://www.yelp.it/biz/la-bottega-del-gusto-torino;Il proprietario è simpaticissimo e molto disponibile.
https://www.yelp.it/biz/la-botte-gaia-torino;Vini ottimi a prezzi competitivi, semplicità nel porsi con la clientela e soprattutto tanto spirito di iniziativa femminile!
https://www.yelp.it/biz/la-battigia-di-schiralli-antonio-bari;Ottimo cibo cucinato in maniera impeccabile Crudo freschissimo Personale simpatico e cortese Anche il prezzo ok
https://www.yelp.it/biz/la-badessa-torino-2;Ottimo il servizio, tranquilla e rilassante atmosfera seppur la sala fosse piena!
https://www.yelp.it/biz/l-osteria-le-ferriere-torino;Il locale è molto accogliente ed il personale di sala esperto, professionale e (da non sottovalutare) simpatico.
https://www.yelp.it/biz/l-osteria-di-pierantonio-torino;Ottima atmosfera, cibo incredibile e il vino .... non pensarci più!
https://www.yelp.it/biz/l-oca-fola-torino;Piatti ricercati e genuini in un simpatico ambiente rustico!
https://www.yelp.it/biz/l-idrovolante-torino;All'interno del parco Valentino di fronte al borgo medioevale c'è questo piccolo ristorante con una splendida terrazza sul Po.
https://www.yelp.it/biz/l-hamburgueria-di-eataly-torino;Buon rapporto qualità prezzo : menu panino patatine e bevanda (vino o birra o acqua) a 12 euro circa.
https://www.yelp.it/biz/l-birichin-torino-2;Posto molto accogliente con musica di sottofondo per creare la giusta atmosfera per passare una bella serata.
https://www.yelp.it/biz/l-antico-arco-cellamare;Gentile e disponibile anche il titolare che ha saputo come farsi perdonare e non smetteva mai di scusarsi.
https://www.yelp.it/biz/l-angolo-divino-torino;Cena nel dehor...personale giovane cordiale e simpatico...menu semplice e ottimo...molto buona la pizza anche da asporto...ottimo servizio...tornero' sicuramente
https://www.yelp.it/biz/l-ancora-torino-3;Servizio cortese e attento, personale molto simpatico e discreto.
https://www.yelp.it/biz/l-ancora-torino-2;Pesce ottimo con una chef Roberta che presenta e prepara i piatti di ottimo livello Ottimo anche il servizio.
https://www.yelp.it/biz/l-agrifoglio-torino;Il locale è molto carino, il personale gentile e competente e l'atmosfera rilassata hanno reso molto piacevole il pranzo.
https://www.yelp.it/biz/l-aglio-torino;Locale carino ben arredato, personale ottimo, simpatico, giovane e cordiale, mai invadente!
https://www.yelp.it/biz/l-accademia-del-panino-torino;Personale simpatico, panini per tutti i gusti e di tutte le dimensioni a prezzi economicissimi.
https://www.yelp.it/biz/kyoto-torino;Il locale è carino e pulito, il sushi è stato buon ed abbondante ed il personale cordiale e gentile.
https://www.yelp.it/biz/kombu-torino;Il locale è spartano e non c'è servizio ai tavoli ma il personale è sempre molto gentile.
https://www.yelp.it/biz/kokoroya-torino;Il proprietario è stato davvero gentile e disponibile per quanto riguarda la spiegazione dei piatti proposti!
https://www.yelp.it/biz/km5-torino;Ottima qualità dei piatti proposti in abbinamento a cocktail eseguiti con professionalità e competenza!
https://www.yelp.it/biz/kipling-torino;Locale discreto, pulito, personale competente, discreto e gentile.
https://www.yelp.it/biz/kiki-torino;Il servizio è stato veloce e il personale gentile e simpatico.
https://www.yelp.it/biz/kido-ism-torino;accoglienza speciale attenzione a tutti i dettagli cibo raffinato ogni boccone è una esperienza da provare consigliatissimo
https://www.yelp.it/biz/kensho-torino;Personale simpatico, gentile, professionale, a volte troppo ingoffito da manierismi esagerati.
https://www.yelp.it/biz/kashmir-torino-2;Nota positiva: locale pulito e ordinato, personale discreto.
https://www.yelp.it/biz/karmacola-torino;Ottimo per passare una serata immersi nei profumi e i sapori dell'Oriente ad un ottimo rapporto qualità prezzo
https://www.yelp.it/biz/jumping-jester-torino;Atmosfera accogliente e personale sorridente e veloce.
https://www.yelp.it/biz/jubin-di-hu-lidan-torino;Servizio molto veloce, personale molto cortese ed attento alle esigenze dei più piccoli, e prezzi assolutamente economici.
https://www.yelp.it/biz/joys-pub-bari;Ottimo per trascorrere una serata sfiziosa in compagnia di amici sorseggiando una birra e stuzzicando un ottimo panino...
https://www.yelp.it/biz/jolly-principi-di-piemonte-torino;Il servizio non è buono, anche se il personale è molto cordiale. 3 Faretti nel...Più
https://www.yelp.it/biz/john-lennons-torino;Il locale è carino e l'atmosfera è molto caratteristica.
https://www.yelp.it/biz/john-joy-torino;La scelta del menù non è molto estesa, ma sicuramente si trova qualcosa che possa soddisfare il proprio gusto.
https://www.yelp.it/biz/japs-torino-3;molto carino il locale,ottimo il servizio e ottima la cucina...costi relativamente contenuti rispetto ad altri locali giapponesi. consigliato
https://www.yelp.it/biz/japs-torino-2;Locale molto carino e accogliente, personale gentile e simpatico, e sushi stellare!!
https://www.yelp.it/biz/indiano-shri-ganesh-torino;Servizio rapido e molto professionale, offerto da personale discreto ma attento e presente, in abbigliamento consono.
https://www.yelp.it/biz/in-vino-veritas-torino;Bella l'atmosfera e molto piacevole il servizio: informale, simpatico ma molto cortese.
https://www.yelp.it/biz/imbarco-perosino-torino;Personale simpatico e disponibile, sono dell'idea che molto dipende da come ci si pone...
https://www.yelp.it/biz/imbarchino-torino;Il locale è davvero carino..proprio sulla riva del Po.L'atmosfera é informale e il personale gentile e spiritoso!
https://www.yelp.it/biz/il-vicolo-torino;Tutto sommato il mangiare è buono ed il personale è gentile e meriterebbe qualche pallino in più.
https://www.yelp.it/biz/il-tabisca-turin;Il locale è molto carino e curato, meglio prenotare, la zona è molto affollata.
https://www.yelp.it/biz/il-siculo-di-savona-monica-torino;L'ambiente è molto familiare e il personale è gentile e simpaticissimo.
https://www.yelp.it/biz/il-sedile-bari;Personale gentile e zelante, clima accogliente, e location nel centro storico in uno dei punti più suggestivi della città!
https://www.yelp.it/biz/il-rustico-bari;Personale simpatico e disponibile, disposto anche ad offrire il bis a richiesta di qualsiasi pietanza si voglia.
https://www.yelp.it/biz/il-rospetto-torino;Una varietà di pizze enorme e personale simpatico e veloce.
https://www.yelp.it/biz/il-ristoro-dei-mercanti-torino;Nonostante la cortesia e l'atmosfera accogliente, il risultato finale di questo ristorante rimane scarso.
https://www.yelp.it/biz/il-porto-torino;Il servizio è rapido, il personale competente, educato e simpatico.
https://www.yelp.it/biz/il-porticciolo-torino;Nel complesso si mangia molto bene ma il locale non è il massimo e il personale competente e gentile.
https://www.yelp.it/biz/il-peccato-torino;Il personale è gentile e disponibile ma mette un po' a disagio e il servizio è lento.
https://www.yelp.it/biz/il-panino-giusto-torino;Il servizio è ottimo e le ragazze sempre e molto disponibili.
https://www.yelp.it/biz/il-padellino-torino;Il personale gentile si adatta ad ogni esigenza e viene incontro alle richieste dei clienti più esigenti.
https://www.yelp.it/biz/il-giglio-torino;Il locale é una semplice ed informale trattoria ma la cucina di pesce é sempre ottima.
https://www.yelp.it/biz/il-gelato-amico-torino;Il personale è molto gentile e disponibile a far assaggiare i gusti
https://www.yelp.it/biz/il-gelatiere-bari-3;Il personale è molto simpatico e ti aiuta nelle scelte quando sei in difficoltà!
https://www.yelp.it/biz/il-fornaccio-bari;ottimo panzerottata fritto ottimi prodotti servizio veloce habitat familiare locale pulito solo problemi di parcheggio
https://www.yelp.it/biz/il-cortiletto-torino-2;Piccolo ristorante nel cuore del Balon, ma in un cortile tranquillo e molto affascinante.
https://www.yelp.it/biz/il-caciucco-torino;Bel locale con atmosfera raffinata e cibo di buona qualità.
https://www.yelp.it/biz/il-brigantino-torino;Il locale e discreto, anche se molto anonimo, ma e' proprio la materia prima che manca.
https://www.yelp.it/biz/il-barotto-torino;Il personale è cortese, competente e simpatico e non ti mette pressione per i tempi di seduta.
https://www.yelp.it/biz/ij-brande-torino;Ij Brandè è un ristorante moderno con un'atmosfera informale e piacevole non lontano da Porta Nuova.
https://www.yelp.it/biz/ichiban-torino;Il servizio è veloce e i camerieri sono disponibili.
https://www.yelp.it/biz/ichi-torino;Il ristorante Ichi presenta un bel locale, con personale simpatico ed un servizio veloce.
https://www.yelp.it/biz/i-tre-scalini-torino;Pizza di buona qualità, ingredienti genuini e prezzi nella media ma un atmosfera imbarazzante.
https://www.yelp.it/biz/i-tesori-bari;La simpatia cordialità e bellezza della signora Maria Luisa.
https://www.yelp.it/biz/i-tartufi-bistrot-torino;Ottimo il servizio per l'attenzione del gestore nel consigliare il tipo di tartufo (indipendente dal valore economico del piatto).
https://www.yelp.it/biz/i-soliti-ignoti-torino;Provato con la famiglia dispone sia di un ottima sala con aria condizionata che di un bel dehors.
https://www.yelp.it/biz/i-soliti-amici-torino;Buona qualità sia per le pizze che per i primi piatti con un servizio veloce e discreto.
https://www.yelp.it/biz/huntsman-pub-torino;C'è molto di meglio in giro in termini di qualità prezzo, paga solo la posizione centrale.
https://www.yelp.it/biz/hua-li-du-torino;Servizio rapido, camerieri disponibili, piatti abbondanti e prezzi onesti.
https://www.yelp.it/biz/hua-dou-cheng-torino;Anche il personale è gentile, disponibile e simpatico!
https://www.yelp.it/biz/horas-kebab-torino;Il personale è simpatico e decisamente pittoresco, il kebab si fa mangiare e la pulizia è discreta.
https://www.yelp.it/biz/home-burger-palese;Il personale però è gentile e simpatico!
https://www.yelp.it/biz/hokkaido-torino;Il personale e' comunque molto gentile e simpatico.
https://www.yelp.it/biz/happy-days-bar-torino;Un posto ideale per iniziare al meglio la giornata Personale simpatico.
https://www.yelp.it/biz/hamp-bari;Anche il locale molto carino e caratteristico in pieno centro a bari.
https://www.yelp.it/biz/habanero-torino-2;Il locale è semplice ma caratteristico, molto belle le candele all'interno.
https://www.yelp.it/biz/gyrosteria-yannis-bari-2;Ottimo panino e moglie soddisfattissima... locale molto carino e caratteristico a due passi dall'ateneo...
https://www.yelp.it/biz/gusti-e-sapori-torino;Si mangia bene personale attento cordiale e simpatico locale accogliente.
https://www.yelp.it/biz/gulp-bari;Personale simpatico, cibo ottimo, servizio all'altezza nonostante i tanti clienti
https://www.yelp.it/biz/guido-gobino-torino-3;Tutto molto raffinato e gustoso: ottima accoglienza, ambiente raffinato ed esclusivo ma soprattutto la qualità gustosa dei prodotti offerti.
https://www.yelp.it/biz/gufo-bianco-torino;Personale competente, molto gentile e di classe..
https://www.yelp.it/biz/grotta-azzurra-bari;In generale il locale è carino ma manca atmosfera, il cameriere è cortese ma freddo.
https://www.yelp.it/biz/grom-torino-4;Il personale è gentile ed il posto ben collegato coi mezzi e vicino ad un parcheggio multipiano, facilmente accessibile.
https://www.yelp.it/biz/grom-torino-2;Provate i gusti stagionali e la panna che è una vera chicca.
https://www.yelp.it/biz/grom-torino;Piacevolissima sorpresa assaggiare un gelato di qualità così alta in una catena.Fossero tutte così.Promossi !!!
https://www.yelp.it/biz/grill-burger-house-bari;Locale carino, bella l'idea di poter scegliere liberamente cosa mettere nel panino, e personale molto veloce, simpatico e disponibile.
https://www.yelp.it/biz/grezzo-torino;bellissimo locale attrezzatissimo e personale cordiale e preparato una vera chicca per la città di Torino, impossibile non andarci
https://www.yelp.it/biz/greek-food-lab-torino-2;Servizio abbastanza veloce, cibo curato seppur surgelato e importato direttamente dalla Grecia così Piatti interessanti e prezzi contenuti
https://www.yelp.it/biz/grande-muraglia-di-zhans-rong-e-li-songhai-torino;Locale discreto che fa vincere la titubanza e a volte la diffidenza verso locali gestiti da persone non italiane.
https://www.yelp.it/biz/granbar-torino;Bella location, servizio discreto ( alcune volte eccellente altre volte distratto), qualità degli alimenti .
https://www.yelp.it/biz/gramsci-torino-2;Locale con luci basse e atmosfera piacevole, bella musica di sottofondo, ambiente elegante.
https://www.yelp.it/biz/giusti-torino;Il personale è gentile e disponibile, a qualsiasi ora e per qualsiasi esigenza.
https://www.yelp.it/biz/giudice-esercizio-torino;L'occasione richiedeva una cena speciale e lo chef si è messo a completa disposizione per la scelta del menù.
https://www.yelp.it/biz/girarrosto-santa-rita-torino;Personale cortese Locale pulito Unica pecca prezzi eccessivi Ma non solo in questo esercizio...
https://www.yelp.it/biz/giovanni-torino;L'ambiente è molto carino e ben curato, ma ci è capitato un cameriere intollerabile e scortese.
https://www.yelp.it/biz/ginza-sushi-king-torino;Servizio: veloce anche quando si sceglie dal Menù.
https://www.yelp.it/biz/giapponese-xia-torino;Bel locale, personale cortese, cucina in stile made in Japan.
https://www.yelp.it/biz/giapponese-sakura-torino;Buona qualità e grande scelta nel menù, personale molto cortese, simpatico e disponibile!
https://www.yelp.it/biz/giapponese-ohashi-torino;Personale cortese e gentile, Il ristorante non è dei più nuovi , ma il cibo e' ottimo!
https://www.yelp.it/biz/gennaro-esposito-torino-2;Street food......il nuovo modo di mangiare senza impegno a torino....ottima pizza e personale molto simpatico...!!...
https://www.yelp.it/biz/gelateria-popolare-torino;Il locale è carino, apprezzabile la descrizione dei gusti con indicate le percentuali degli ingredienti.
https://www.yelp.it/biz/gelateria-piu-di-un-gelato-torino;Questa piccola gelateria offre un gelato di alta qualità ad un prezzo onesto.
https://www.yelp.it/biz/gelateria-piccinni-bari;Personale gentile e competente che dimostra molta dedizione nella realizzazione del loro lavoro.
https://www.yelp.it/biz/gelateria-monginevro-smaldone-raffaele-torino;Il personale è sempre gentile e sorridente: caratteristica molto rara da trovare nella maggior parte dei posti.
https://www.yelp.it/biz/gelateria-mondello-torino;Personale simpatico e disponibile, peccato che non facciano il cono piccolo anche per gli adulti.
https://www.yelp.it/biz/gelateria-miretti-torino-7;Locale curato e pulito che offre piatti semplici per una pausa pranzo leggera e sfiziosa.
https://www.yelp.it/biz/gelateria-grom-torino-2;Il personale è gentile ma ha modi di fare molto sbrigativi.
https://www.yelp.it/biz/gelateria-due-salette-torino;Gelato da degustare .Fatto ancora a mano con una vecchia macchina il gelato è ottimo.Personale simpatico e disponibile.
https://www.yelp.it/biz/gelateria-delle-alpi-torino;Personale cortese ambiente informale ma carino e buona pasticceria.
https://www.yelp.it/biz/gelateria-ciuffos-torino;Gelato ottimo e personale molto cortese, da provare.
https://www.yelp.it/biz/gaudenti-1971-torino;Locale carino, accogliente molto pulito ed ordinato.
https://www.yelp.it/biz/gatsbys-torino;Il bar è estremamente pulito e i camerieri disponibili e cordiali.
https://www.yelp.it/biz/gasperini-bari;Personale gentile e simpatico da provare sicuramente !!!
https://www.yelp.it/biz/gandhi-torino;Cordialità ed accoglienza in ambiente caratteristico Buone le pietanze Buon rapporto qualità prezzo.
https://www.yelp.it/biz/galante-torino-2;Ottimo servizio, un'atmosfera sobria, competenza e professionalità.
https://www.yelp.it/biz/gadi-bari;Personale gentilissimo e sempre disponibile per qualsiasi cosa.
https://www.yelp.it/biz/fuzion-torino;Piatti deliziosi e personale molto simpatico che ti consiglia il meglio...
https://www.yelp.it/biz/frulez-bari;Locale simpatico con servizio rapido ed efficace.
https://www.yelp.it/biz/friedas-pub-torino;Locale discreto molto pulito e abbastanza curato.
https://www.yelp.it/biz/freevolo-torino;Personale gentile e simpatico che crea una bella atmosfera.
https://www.yelp.it/biz/fratelli-roselli-torino;Il locale è discreto, si mangia in due verande ben coibentate, e calde.
https://www.yelp.it/biz/fratelli-la-cozza-torino-2;Locale davvero ampio dallo stile eclettico ed informale.
https://www.yelp.it/biz/forchetta-e-scarpetta-torino;Locale piccolo ma accogliente personale simpatico e ben disposto.
https://www.yelp.it/biz/focacceria-tipica-ligure-torino;A passeggio per Torino pranzo veloce pizza buona a buona prezzo consigliato per pausa pranzo molto veloce
https://www.yelp.it/biz/focacceria-santagostino-torino-2;Locale simpatico con personale gentile e accogliente e una buona varietà di pizze.
https://www.yelp.it/biz/focacceria-santagostino-torino;Locale simpatico con personale gentile e accogliente e una buona varietà di pizze.
https://www.yelp.it/biz/focacceria-riviera-ligure-torino;A passeggio per Torino pranzo veloce pizza buona a buona prezzo consigliato per pausa pranzo molto veloce
https://www.yelp.it/biz/fiorio-gelateria-torino;Interno carino e personale gentile, tutto molto buono
https://www.yelp.it/biz/fiorfood-torino;Il ristorante ( emanazione della Credenza ) è ben arredato ( 6/7 tavoli) e con personale cortese e preparato.
https://www.yelp.it/biz/filo-di-marianna-torino;Ottimo abbinamento vini e soprattutto un ottimo rapporto qualità - prezzo - cordialità.
https://www.yelp.it/biz/fassoneria-torino;Il locale è carino e il personale è gentile I panini sono buoni e il prezzo non è esagerato.
https://www.yelp.it/biz/farmacia-dei-sani-bari;Servizio veloce e discreto, padrone di casa cortese ed ospitale.
https://www.yelp.it/biz/farini-da-lia-torino;Il locale è discreto, una buona trattoria.
https://www.yelp.it/biz/factory-bari;Il personale è simpatico e cordiale e il servizio abbastanza veloce, nonostante sia molte volte pieno.
https://www.yelp.it/biz/exki-pietro-micca-torino;Cibo buono e personale molto gentile, un'ottima scelta per mangiare qualcosa di leggero e più salutare
https://www.yelp.it/biz/exki-giolitti-torino-3;Il personale è molto gentile e garbato ed il locale ti mette a tuo agio.
https://www.yelp.it/biz/exki-8-gallery-torino-2;Il personale è molto gentile e amichevole.
https://www.yelp.it/biz/estrella-do-sul-torino;Il locale è molto semplice, pulito e curato.
https://www.yelp.it/biz/esperia-torino-2;Per il resto si può dire che il cibo è discreto ed il personale gentile.
https://www.yelp.it/biz/eos-torino;Davvero una bella sorpresa questo piccolo ristorante aperto da poco in zona Gran Madre: arredamento raffinato e cucina innovativa.
https://www.yelp.it/biz/enzo-e-grazia-di-matera-grazia-torino;Personale gentile così come tutta la famiglia che gestisce i 2 punti vendita a pochi passi uno dall'altro.
https://www.yelp.it/biz/entremetier-di-lingweifu-torino;Il servizio è stato buono, cameriere gentili e disponibili.
https://www.yelp.it/biz/enoteca-rossorubino-torino;Locale carino per fare un piacevole aperitivo.. ottimi vini, cibo discreto, prezzi ragionevoli, la pecca sta nel servizio.
https://www.yelp.it/biz/eno-libero-emporio-enogastronomico-torino;Locale carino nel cuore di San Salvario, servizio molto curato e personale gentile e simpatico.
https://www.yelp.it/biz/emporio-gastronomico-torino;Il Servizio rapido e professionale assicura una buona performance anche a pranzo Buone le pizze ,da testare il ristorante
https://www.yelp.it/biz/el-puig-d-estelles-torino;Piccolo ma molto carino e accogliente, cibo di qualità e personale gentile e simpatico.
https://www.yelp.it/biz/el-pollo-loco-torino;(Sono disponibili parecchi televisori per seguire eventi sportivi tra amici) Servizio rapido, personale gentile e prezzi nella media!
https://www.yelp.it/biz/el-churrasco-bari-2;Selezione di carni di altissima qualità accompagnate da estrema professionalità e simpatia.
https://www.yelp.it/biz/el-centenario-torino-2;Locale molto semplice dallo spirito Messicano, ideale per serate tra amici che amano i locali non molto silenziosi.
https://www.yelp.it/biz/eataly-torino-torino;Dove il buon cibo è l'alimentazione di qualità si incontrano..
https://www.yelp.it/biz/eataly-bari;personale gentile e disponibile , il conto non è economico ma giustificato da piatti di buona qualità e abbondanti
https://www.yelp.it/biz/eat-sicily-torino;Serata piacevole con personale gentilissimo e simpatico.
https://www.yelp.it/biz/e-pronto-torino-2;Ottimo il cibo vegetariano e ottima l'accoglienza.
https://www.yelp.it/biz/dublin-house-bari;Personale simpatico e accogliente, rapporto qualità prezzo buono, da consigliare
https://www.yelp.it/biz/du-cesari-torino;Personale alla mano e simpatico , complimenti allo chef e a tutto lo staff!
https://www.yelp.it/biz/doubletree-torino;Personale cortese, disponibile ed attento ad ogni esigenza della clientela.
https://www.yelp.it/biz/dorian-gray-torino;Un locale caratteristico con un servizio cortese e attento, piatti abbondanti e prezzi medio bassi.
https://www.yelp.it/biz/dora-in-poi-torino;Locale semplice e moderno e personale gentile e simpatico.Cucina straordinaria...curata,originale e ricercata.
https://www.yelp.it/biz/don-panino-torino;Molto carino il locale, e simpatico il fatto di poter scegliere Il tipo di pane.
https://www.yelp.it/biz/don-gennaro-torino;Pizza ottima, in un ambiente caldo e accogliente, condita con un personale simpatico e disponibile!
https://www.yelp.it/biz/dolce-mania-di-lepori-raffaele-torino;A torino ci sono numerose ottime gelateria ma questa le batte tutte per il rapporto qualità - prezzo.
https://www.yelp.it/biz/dolce-basilico-torino;Il locale è piccolo ma carino e curato, le pizze sono buone e ben condite.
https://www.yelp.it/biz/dog-out-presso-otto-gallery-torino;Il personale è davvero gentile e garbato, il cibo è ottimo e il posto tranquillo.
https://www.yelp.it/biz/diplomatic-torino;Ottimo anche il servizio di garage che in questa zona è veramente un extra!
https://www.yelp.it/biz/diecicento-torino-2;Pizza molto buona, personale giovane e simpatico locale molto curato.
https://www.yelp.it/biz/dickens-inn-bari;Personale gentile e discreto e, non da poco, possibilità di parcheggio.
https://www.yelp.it/biz/dess%C3%AC-torino;Prezzi nella norma e locale carino, ma niente di che
https://www.yelp.it/biz/delfino-blu-torino;Il personale gentilissimo e simpaticissimo, molto attento alle esigenze del cliente.
https://www.yelp.it/biz/del-cambio-torino;Ristorante fine ed elegante servizio ottimo di classe ed elegante come i piatti che ti servono buoni.
https://www.yelp.it/biz/dausin-torino;Personale simpatico e competente, a due passi dalla stazione Porta Nuova.
https://www.yelp.it/biz/dal-vecchio-torino;Un rapporto qualità prezzo notevole e la cortesia dei proprietari ti fanno venir voglia di eleggerlo locale preferito.
