url;review
https://www.yelp.it/biz/yoshi-bar-torino;"Locale non molto grande, ma con cibo di ottima qualità, cibi freschi e molto buoni, Personale educato e gentile."
https://www.yelp.it/biz/wasabi-torino;"Ambiente accogliente e ottimo cibo,ingredienti freschi, cucinati alla perfezione e serviti in ciotole eleganti...personale gentile e molto disponibile."
https://www.yelp.it/biz/vo-torino;"Personale gentile, preparato e servizio di alto livello, tavoli ampi e spazio adeguato tra di essi, corretta l'illuminazione."
https://www.yelp.it/biz/vintage-torino;"Personale gentile ma non troppo attento e nemmeno tanto attento ad un perfetto galateo della tavola."
https://www.yelp.it/biz/villa-somis-torino;"Personale gentile disponibile e preparato sul tema ... un sommelier preparatissimo e oltretutto simpatico!!"
https://www.yelp.it/biz/tre-galline-torino-2;"Servizio preciso e cordiale e presentazione da parte del maitre del luogo storico e dei piatti del menù."
https://www.yelp.it/biz/tre-galli-torino-2;"Personale gentile e disponibile, agnolotti buoni e vino della casa di buon livello."
https://www.yelp.it/biz/trattoria-da-cinzia-torino;"Il locale è Curato e arredato con gusto, lo staff si è mostrato disponibile e cordiale."
https://www.yelp.it/biz/torteria-berlicabarbis-torino;"è un locale molto curato, un salotto da the, accogliente, caldo, confortevole."
https://www.yelp.it/biz/tiella-bari;"Prezzi onesti...e poi scopri che larga parte della gestione e quella del Vassallo ...merita e si ritornerà!!"
https://www.yelp.it/biz/the-stuart-pub-bari;"Il personale è molto cordiale e i titolari affabili e simpatici!"
https://www.yelp.it/biz/teapot-torino;"Il personale è gentile e disponibile e in cucina soddisfano anche le richieste di cambiamenti ai piatti."
https://www.yelp.it/biz/taiki-bari;"Personale sempre molto gentile e disponibile e pronti a soddisfare il cliente al meglio, SEMPRE SORRIDENTI."
https://www.yelp.it/biz/solferino-torino;"Il servizio molto cordiale, gli impiattamenti decisamente gradevoli, il locale confortevole, i piatti tra il discreto ed il buono."
https://www.yelp.it/biz/signorvino-torino;"Tutto confermato (buona qualità dei cibi, quantità corrette, prezzi ragionevoli, personale gentile...) in un ambiente decisamente più bello."
https://www.yelp.it/biz/shodai-bari;"Il personale è gentile e alcuni camerieri sanno dare ottimi consigli sulle pietanze da assaggiare."
https://www.yelp.it/biz/sfashion-cafe-torino;"La maggior parte dei camerieri è super gentile e disponibile ed attento."
https://www.yelp.it/biz/seven-up-torino;"Peccato davvero.. per quanto il personale sia gentile ciò non basta al cliente se manca il buon cibo."
https://www.yelp.it/biz/sandrino-bari;"Il personale è gentile e pronto a consigliare i giusti abbinamenti o le specialità di giornata."
https://www.yelp.it/biz/roar-roads-torino;"personale gentile e disponibile e servizio molto buono e veloce nonostante il locale fosse pieno di gente."
https://www.yelp.it/biz/ristrot-guviol-torino;"Ottimo servizio e cucina interessante che, senza essere pretenziosa, abbina molto bene sapori nuovi e gusti del territorio."
https://www.yelp.it/biz/ristoranti-tromlin-torino;"Il locale e' accogliente .Personale cortese in ambiente molto simpatico, Menù fisso in stile piemontese."
https://www.yelp.it/biz/ristoranti-taverna-delle-rose-torino-2;"Il servizio è cordiale ed impeccabile, cucina di buona livello ed ottima carta dei vini."
https://www.yelp.it/biz/ristoranti-sardegna-torino;"Locale accogliente, personale gentile, il titolare e chef sig Sergio cordiale e prodigo di consigli."
https://www.yelp.it/biz/ristoranti-alba-torino;"Personale molto gentile e accogliente ma menù con pochi spunti, piatti decorosi ma niente in più."
https://www.yelp.it/biz/prima-e-poi-torino;"Veloce il servizio con personale gentile e professionale e cibi genuini e presentati molto bene.Complimenti, non cambiate!"
https://www.yelp.it/biz/pizzeria-fratelli-la-bufala-torino;"Il personale è stato molto gentile e disponibile, la pizza era gustosa con molti formaggi saporiti."
https://www.yelp.it/biz/pizzeria-enzo-e-ciro-di-fraddosio-v-c-bari;"Il locale è piccolo e accogliente, il personale gentile e spiritoso, allo stesso tempo efficiente e veloce."
https://www.yelp.it/biz/pizzeria-baraonda-bari;"Il personale gentile e disponibile completa positivamente il giudizio di questa pizzeria."
https://www.yelp.it/biz/pizzeria-aladino-bari;"La pizzeria offre dei menù a prezzo fisso che a dir la verità hanno un rapporto qualità-prezzo assolutamente giusto."
https://www.yelp.it/biz/pizza-speedy-torino-3;"Ottimo approccio professionale. ..davvero in gamba e puntuali nella consegna. ..da provare e poi la pizza è buona..."
https://www.yelp.it/biz/pippo-paranza-torino;"Il locale è piccolo, ma offre un'atmosfera carina e cordiale."
https://www.yelp.it/biz/perbacco-bari;"Locale accogliente, silenzioso e soprattutto una chicca per chi adora magiar bene e degustare un buon vino."
https://www.yelp.it/biz/pepino-torino;"Servizio poco attento, del resto la posizione a portata dei turisti, rende il posto sempre pieno di clientela."
https://www.yelp.it/biz/panino-giusto-torino;"peccato per il personale poco attento e scordiale. caffè ottimo accompagnato da una mattonella DaiDai croccante e cremoso!!!"
https://www.yelp.it/biz/panificio-magda-bari;"Il locale è molto bello e il personale è veloce e gentile."
https://www.yelp.it/biz/panificio-el-focacciaro-bari;"Il personale è molto gentile e i prezzi assolutamente nella media Da provare assolutamente"
https://www.yelp.it/biz/panetteria-borgo-nuovo-torino;"Il personale molto gentile e rapido nel servizio."
https://www.yelp.it/biz/pai-bikery-torino;"Il servizio è stato veloce e attento, le ragazze sono molto solari e disponibili."
https://www.yelp.it/biz/paese-zhou-torino-2;"Ovviamente ci sono altri ristoranti molto più carini come arredamento ma come qualità prezzo non lo batte nessuno."
https://www.yelp.it/biz/ottimo-torino;"Personale molto cordiale e sorridente, gusti particolari ed unici,quali mango e zenzero o pompelmo rosa e Campari."
https://www.yelp.it/biz/osteria-rotonda-dei-facchinetti-torino;"Locale ampio, con parcheggio nelle vicinanze.Buona scelta, piatti di qualità, personale veloce e gentile."
https://www.yelp.it/biz/osteria-dei-quattro-gatti-bari;"Personale gentile, attento alle richieste, che suggerisce ma non si sostituisce o indirizza la volontà del cliente."
https://www.yelp.it/biz/osteria-degli-ottoni-torino;"Piatti ottimi e con buon rapporto qualità prezzo Locale molto accogliente, personale gentile ed efficiente, consigliata la prenotazione."
https://www.yelp.it/biz/osteria-antichi-sapori-bari;"A partire dal cibo di ottima qualità a finire al personale cordiale e molto preparato sui prodotti da vendere."
https://www.yelp.it/biz/opera-bari;"Da Lecce con la famiglia in questo ristorante ottimo per accoglienza e gentilezza del personale."
https://www.yelp.it/biz/old-wild-west-torino;"Il personale è molto gentile e disponiobile, inoltre nonostante durante le partite sia ovviamente affollatissimo non ti fanno fretta."
https://www.yelp.it/biz/okinawa-torino;"Il personale è sempre cordiale e sorridente ,ottimo servizio con i giusti tempi di attesa !"
https://www.yelp.it/biz/nuovo-fizzarotti-bari;"Personale cordiale e gentile, ambiente piccolo ma rilassante ed elegante, sito nel bel Corso Vittorio Emanuele II a Bari."
https://www.yelp.it/biz/napul-e-bari;"Locale molto bello e in pieno centro, personale accogliente e titolare simpatico."
https://www.yelp.it/biz/mr-rooster-torino-3;"ottima Ottima cucina ottima accoglienza un personale molto cortese pronto a risolvere qualsiasi problema del cliente."
https://www.yelp.it/biz/mezzaluna-osteria-torino;"La qualità dei piatti è davvero ottima .. personale attento , non scalda il cuore ma professionale ..."
https://www.yelp.it/biz/masaniello-%C3%A9-turnat-torino;"Il personale è gentile e giovane, i prezzi non eccessivi, calcolando la posizione."
https://www.yelp.it/biz/marechiaro-torino;"Perspnale simpatico e la pizza molto buona anche i gusti particolari."
https://www.yelp.it/biz/maltos-beer-bari;"Pub carino con personale gentile ed accogliente e con tanti posti a sedere anche all'esterno, in una verandina riscaldata."
https://www.yelp.it/biz/magorabin-torino;"Il personale è attento, cortese e preparato nonostante la giovane età, presente il giusto senza essere soffocante."
https://www.yelp.it/biz/locanda-da-betty-torino;"Locale piccolo ma molto bello, personale gentile e preparato, porzioni abbondanti e buone, tanti piatti che fanno voglia."
https://www.yelp.it/biz/le-vitel-etonne-torino;"Il locale è accogliente, il personale gentile, preparato e disponibile a venire incontro alle esigenze del cliente."
https://www.yelp.it/biz/le-tre-lanterne-bari;"Il personale è gentile e il prezzi non sono economici, ma comunque nella fascia media"
https://www.yelp.it/biz/le-rondini-torino;"Ciao personale cordiale, lavale abbastanza pulito, mangiare nella norma prezzo giusto X quello che mangi fine serata offerto limoncello"
https://www.yelp.it/biz/le-grand-tabu-bari;"Staff molto cordiale e disponibile, ambiente molto accogliente e allo stesso tempo elegante."
https://www.yelp.it/biz/la-via-della-seta-torino;"Bel ristorante cinese in centro curato in tutto personale gentile e buona cucina a prezzi del tutto onesti ."
https://www.yelp.it/biz/la-uascezze-bari;"Un particolare ringraziamento va al personale sempre molto gentile e tanto preparato nel ben consigliare i vari abbinamenti."
https://www.yelp.it/biz/la-taverna-greca-torino-2;"Locale piccolo ma accogliente, il personale è sempre cordiale e disponibile, il cibo abbondante e ottimo."
https://www.yelp.it/biz/la-svolta-torino;"Locale effettivamente bello, servizio ottimo e gentile, unica pecca la poca scelta di pizze e non modificabili."
https://www.yelp.it/biz/la-stadera-pizzeria-la-stadera-di-muscariello-s-e-c-pizz-torino;"Il locale è carino ed il proprietario con il resto del personale è molto gentile e disponibile."
https://www.yelp.it/biz/la-ristonomia-torino;"Si deve tornare x forza.....anche per il personale cordiale e attento...e sopratutto per il conto..... decisamente sotto le aspettative!"
https://www.yelp.it/biz/la-prima-da-moreno-torino;"Qualità eccellente in ogni portata e servizio al tavolo più che ottimo."
https://www.yelp.it/biz/la-piadineria-torino;"il personale è sempre molto cordiale e ti aiuta a scegliere la combinazione giusta tra gli ingredienti. ottima!!"
https://www.yelp.it/biz/la-pagoda-di-hu-lia-meng-torino;"Il locale è carino, non molto grande, il personale è gentile e si intrattiene molto con i clienti conosciuti."
https://www.yelp.it/biz/la-mela-stregata-torino;"Da provare assolutamente le brioches alla nocciola e al cioccolato bianco...personale gentile...sempre aperto, anche in piena notte."
https://www.yelp.it/biz/la-cecchina-bari;"Personale gentile e accogliente piatti pregevoli che rendono onore alla eccelle tradizione culinaria pugliese, riservando slanci di armoniosa creatività."
https://www.yelp.it/biz/la-capannina-torino-2;"Tutto il personale cordiale , ambiente accogliente , piatti perfetti nelle quantità e soprattutto nella qualità."
https://www.yelp.it/biz/la-cabane-torino-2;"Il personale è molto gentile e preparato e il cibo è sublime."
https://www.yelp.it/biz/la-bufala-torino;"Servizio poco cordiale e decisamente non professionale."
https://www.yelp.it/biz/la-bottega-del-gusto-torino;"La nota positiva è che il personale è molto gentile e preparato."
https://www.yelp.it/biz/la-badessa-torino-2;"Personale attento e cordiale,sensibile alle richieste dei clienti, anche se sicuramente la stanchezza di questi giorni si fa sentire."
https://www.yelp.it/biz/l-osteria-di-pierantonio-torino;"Materie prime di grande scelta per un menu piacevole e goloso servito da un personale gentile e sorridente."
https://www.yelp.it/biz/l-idrovolante-torino;"Personale molto cortese e cibo davvero ottimo, presentato bene e preparato con cura."
https://www.yelp.it/biz/l-antico-arco-cellamare;"Gentile e disponibile anche il titolare che ha saputo come farsi perdonare e non smetteva mai di scusarsi."
https://www.yelp.it/biz/l-aglio-torino;"Cena con amici in questo grazioso ristoranti ai piedi della collina torinese... personale molto gentile servizio ottimo piatti raffinati!!!"
https://www.yelp.it/biz/kipling-torino;"Personale molto gentile e attento, il parcheggio sotterraneo di piazza Bodoni viene offerto dal ristorante tramite voucher prepagato"
https://www.yelp.it/biz/karmacola-torino;"Il cibo è ottimo, il personale é cordiale e disponibile, il luogo è caratteristico e ben curato."
https://www.yelp.it/biz/joys-pub-bari;"Un posto accogliente, nel quale si mangia benissimo, con delle specialità mai assaggiate prima in un Irish pub."
https://www.yelp.it/biz/in-vino-veritas-torino;"Ambiente molto caldo e raccolto con personale gentile professionale Attento e sorridente."
https://www.yelp.it/biz/imbarchino-torino;"Il locale è davvero carino..proprio sulla riva del Po.L'atmosfera é informale e il personale gentile e spiritoso!"
https://www.yelp.it/biz/il-siculo-di-savona-monica-torino;"La premessa è che appena entri ti salutano con grande calore e questa è sicuramente una immediata nota positiva."
https://www.yelp.it/biz/il-picchio-torino;"Personale simpatico e cortese, ma... alla fine sembrava mancasse qualcosa... forse un po' di anima in più"
https://www.yelp.it/biz/il-gelatiere-bari-3;"Il personale è cordiale e pronto a consigliarti, nel caso in cui se ne avesse bisogno."
https://www.yelp.it/biz/il-dolcetto-bari;"La pasta dei cornetti è davvero molto buona e il personale cordiale."
https://www.yelp.it/biz/il-cortiletto-torino-2;"locale piccolo ma molto carino,signora gentile in sala cibo squisito ...un pochin lunghe le attese e cuoco scorbutico."
https://www.yelp.it/biz/il-brigantino-torino;"Servizio attento e cordiale Lo chef come il gestore si sono presentati per un feedback questo è da apprezzare."
https://www.yelp.it/biz/ij-brande-torino;"Un servizio attento e puntuale e un atmosfera sicuramente di rilievo."
https://www.yelp.it/biz/i-tesori-bari;"è tutto ai massimi livelli e prezzi onesti."
https://www.yelp.it/biz/hua-dou-cheng-torino;"Personale molto cordiale e attento ,anche i prezzi sono molto contenuti ....... puoi cenare bene anche spendendo € 10"
https://www.yelp.it/biz/gulp-bari;"Il locale è molto carino, il personale estremamente gentile e il cibo buono e di ottima qualità."
https://www.yelp.it/biz/guido-gobino-torino-3;"Il personale è stato molto gentile, se chiedete vi consigliano e spiegano le tipologie di cioccolato."
https://www.yelp.it/biz/gufo-bianco-torino;"Il personale molto gentile ti fa sentire subito a tuo agio."
https://www.yelp.it/biz/giapponese-ohashi-torino;"Personale cortese e gentile, Il ristorante non è dei più nuovi , ma il cibo e' ottimo!"
https://www.yelp.it/biz/gadi-bari;"Personale gentilissimo e sempre disponibile per qualsiasi cosa."
https://www.yelp.it/biz/fuzion-torino;"davvero gentile e disponibile, parlando con lui si capisce davvero quanta passione e dedizione metta il quello che fa."
https://www.yelp.it/biz/fratelli-roselli-torino;"Il personale é attento e cordiale.. le pizze ottime e fuori dal comune.. la materia prima veramente di qualità."
https://www.yelp.it/biz/farmacia-dei-sani-bari;"Ottimo il servizio, il personale molto gentile ed educato ed il proprietario una persona veramente alla mano."
https://www.yelp.it/biz/eos-torino;"personale cordiale, qualità del cibo davvero sorprendente, prezzo nella media ma tutto sommato giusto."
https://www.yelp.it/biz/enoteca-rossorubino-torino;"Personale molto gentile, menu ristretto, prezzi medio alti, porzioni non abbondanti, Ottimo il crudo di pesce."
https://www.yelp.it/biz/el-churrasco-bari-2;"Locale accogliente, nella zona a piano terra, musica di sottofondo gradevole, servizio gentile veloce e paziente."
https://www.yelp.it/biz/e-pronto-torino-2;"Ottimo il cibo vegetariano e ottima l'accoglienza."
https://www.yelp.it/biz/del-cambio-torino;"Il locale è molto curato e ben conservato, il personale è molto professionale e cordiale e assolutamente efficiente."
https://www.yelp.it/biz/da-paolo-bari;"Locale accogliente e personale gentile ed attento ... ampia scelta di vini per ogni gusto ed esigenza .."
https://www.yelp.it/biz/da-ciccillo-torino;"Anche il personale molto cordiale e simpatico, prezzi normalissimi nulla di eccessivo."
https://www.yelp.it/biz/cornetti-night-torino-2;"Personale molto gentile e pronto a dispensare consigli."
https://www.yelp.it/biz/cinese-du-cheng-torino-2;"Il personale è gentile, il tempo di attesa è poco, sembra pulito e l'arredamento è quello classico cinese."
https://www.yelp.it/biz/cera-una-volta-torino;"Il personale è estremamente cordiale e disponibile, anche con i bimbi piccoli, ti mettono a tuo agio."
https://www.yelp.it/biz/casa-vicina-torino;"Il plus è il servizio: sempre attento e puntuale, mai invadente."
https://www.yelp.it/biz/casa-mad-torino;"Comunque prezzi onesti, diversi buoni vini al bicchiere e materie prime molto buone."
https://www.yelp.it/biz/caffe-vergnano-torino;"Per il resto dal locale alla gentilezza del personale tutto molto bene."
https://www.yelp.it/biz/caff%C3%A8-torino-torino-2;"Servizio curato dal personale cortese, mai invadente e sempre premuroso.Nessun cameriere di secondo lavoro."
https://www.yelp.it/biz/burgheria-torino-2;"Il locale è molti carino e il personale è gentile e disponibile."
https://www.yelp.it/biz/buosi-torino;"Da ritornare .. ottimo qualità/ prezzo e personale cortese e gentile!"
https://www.yelp.it/biz/botta-bari;"locale storico di bari....ottima pizza e buoni antipasti...personale gentile e nel complesso buona la qualità della cucina.. consigliato...."
https://www.yelp.it/biz/boja-fauss-torino-2;"Ambiente molto curato e caldo, il personale gentile e molto cortese con attenzione alle esigenze del cliente."
https://www.yelp.it/biz/blue-eyes-bari;"Inoltre il personale sempre gentile e attento, soprattutto il titolare."
https://www.yelp.it/biz/black-e-white-bari;"Buona qualità della materia prima, ottima la preparazione, gentile il servizio, corretto lo sconto applicato TheFork."
https://www.yelp.it/biz/bistrot-turin-torino;"Materia prima di buona qualità, servizio attento cortese, molto alla mano ma non invadente."
https://www.yelp.it/biz/berbel-torino;"Personale davvero gentile, chef molto simpatico , location davvero bella, ottima apparecchiatura e carta dei vini davvero ricca."
https://www.yelp.it/biz/baratti-e-milano-torino-2;"Sara' anche turistico...nel centro di Torino, pero' si mangia bene e con prezzi onesti."
https://www.yelp.it/biz/bar-telebari-bari;"Gelato buonissimo con molte varietà di gusti.Personale molto gentile e cortese facile da raggiungere"
https://www.yelp.it/biz/banco-di-sicilia-torino;"Il personale è gentile e il locale è accogliente."
https://www.yelp.it/biz/baccanale-torino;"Locale carino e pulito, atmosfera niente di particolare ne in bene ne in male."
https://www.yelp.it/biz/babayaga-bari;"buonissimo mai mangiato un gelato cosi buono ottimo il servizio gusti buoni ottimo il pistacchio e nutella gelato"
https://www.yelp.it/biz/arigato-torino;"Il personale è gentile e ti portano da mangiare in fretta."
https://www.yelp.it/biz/arcadia-torino-4;"Location molto bella ed il personale gentile e disponibile... questo è il bello del ristorante."
https://www.yelp.it/biz/alberosole-bari;"Locale molto carino con personale davvero gentile."
https://www.yelp.it/biz/al-sorso-preferito-bari;"Personale cordiale, Sala accogliente ottima cucina, Primi buonissimi,,pesce sempre Fresco, tanta varietà di Vini !"
https://www.yelp.it/biz/al-savoia-bari;"Aperitivo ottimo ma il servizio è arroganza della giovane cameriera fa passare la fantasia di tornare!"
https://www.yelp.it/biz/al-cacimperio-torino;"Locale semplice ma accogliente, personale gentile, cucina varia con impronta piemontese, ma il pezzo forte è la carne."
https://www.yelp.it/biz/al-bicerin-torino;"L'atmosfera che si respira nel piccolissimo locale è decisamente piacevole grazie anche al personale gentile e professionale."
https://www.yelp.it/biz/ai-2-ghiottoni-bari-2;"Locale pulito e personale cordiale, ottima cucina e prodotti di prima qualità, con specialità di pesce curdo e cotto."
https://www.yelp.it/biz/a6-sciamadda-torino;"Si viene accolti dal titolare che racconta il menù facendo venire l'acquolina solo ad ascoltare."
