url;review
https://www.yelp.it/biz/zonk-di-brigada-igor-torino;Ora sono tornati i vecchi gestori e l'apericena è tornata ad essere di ottima qualità.
https://www.yelp.it/biz/zichella-torino;Bar pasticceria di classe, gestione familiare e accogliente, prodotti di ottima qualità, dal caffè alla pasticceria, agli aperitivi.
https://www.yelp.it/biz/winston-churchill-new-pub-torino;Le birre hanno grande varietà e si può spaziare molto con alcune davvero rare.
https://www.yelp.it/biz/vyta-torino;La caffetteria è buona e la scelta di brioches e muffin è ottima e sono di buona qualità.
https://www.yelp.it/biz/tisaneria-della-consolata-torino;Locale accogliente e piacevolmente demode`, tantissimi the, tisane ed infusi vari accompagnati da musica classica in sottofondo.
https://www.yelp.it/biz/tiffany-lounge-torino;I primi e i secondi sono buonissimi, di qualità e abbondantissimi.
https://www.yelp.it/biz/teapot-torino;Ampia scelta sul menù sia per colazione che per pranzo.
https://www.yelp.it/biz/sicily-bar-torino;Mai trovato in un bar pasticceria un'accoglienza di questo genere.
https://www.yelp.it/biz/sara-caffetteria-torino;Ottimi prodotti, competenza, pulizia, cortesia, disponibilità massima per accontentare i clienti e livello alto mantenuto nel corso degli anni.
https://www.yelp.it/biz/raspino-lorenzo-torino;Punto di riferimento per un buon caffè e ottime brioches a pochi passi dal centro.
https://www.yelp.it/biz/platti-torino-2;La nuova gestione ha ridato valore e qualità ad un Caffè storico fra i più belli della città
https://www.yelp.it/biz/pistacchio-torino;Prodotti di caffetteria buoni ma l'assortimento di croissant con le creme fa scoppiare di piacere le vostre papille gustative.
https://www.yelp.it/biz/pastis-2020-torino;Servizio veloce e soddisfacente, camerieri simpatici e con una buona memoria, gli aperitivi nella norma...e conto nella media...
https://www.yelp.it/biz/pasticceria-venier-torino;un buon caffè a due passi da piazza castello, comodo per posizione, ottimo caffè, personale molto cordiale. da provare
https://www.yelp.it/biz/pasticceria-amore-torino;Il tutto di ottima qualità, servito da personale cortese.
https://www.yelp.it/biz/panificio-magda-bari;Focaccia super ottimo a pranzo con servizio veloce varietà di scelta, ma molto affollato.diversi tipi di taralli Caffetteria completa
https://www.yelp.it/biz/orso-torino;Un'ampia scelta di caffè provenienti da tutto il mondo e splendida accoglienza da parte del proprietario e del personale.
https://www.yelp.it/biz/one-apple-torino;Locale accogliente e ben arredato, ideale per giovani e frequentato da ottima gente.
https://www.yelp.it/biz/olsen-di-caldi-cinzia-torino;Torta sempre scura all'interno ma con confetturaa di frutti di bosco e all'esterno cioccolato bianco.
https://www.yelp.it/biz/nuova-dezzuto-torino;Le brioches (croissant con crema) ha una pasta sfoglia croccante con la crema leggera ma saporita.
https://www.yelp.it/biz/neko-cafe-torino;Locale accogliente, fra una vecchia e anacronista caffetteria e un Pomodori Verdi Fritti in acquerello.
https://www.yelp.it/biz/menodiciotto-torino;Buon caffè da gustare e ottimo marocchino, molto cremoso e con giusta aggiunta di cioccolato!
https://www.yelp.it/biz/martinucci-bari-2;Nella Bari vecchia il bar pasticceria Martinucci sta diventando un'istituzione così come nel salento.
https://www.yelp.it/biz/le-mura-bari;volete un posto accogliente e quasi intimo con una ottima pizza e una scelta di birre non usuale?
https://www.yelp.it/biz/le-grand-tabu-bari;I piatto sono ben decorati e le pietanze di ottima qualità.
https://www.yelp.it/biz/le-cantine-di-bacco-torino;Cucina di ottima fattura, scelta un po limitata ma abbastanza varia.personale molto accogliente specialmente il cameriere espertissimo in vini.
https://www.yelp.it/biz/las-vegas-torre-a-mare;Luogo assolutamente consigliato per un buon caffè ed un ottimo gelato in compagnia.
https://www.yelp.it/biz/la-mela-stregata-torino;Nonostante la gentilezza del personale, l'aperitivo va un po' di traverso :scadente qualità degli alimenti e approssimativa preparazione.
https://www.yelp.it/biz/km5-torino;Buon rapporto qualità prezzo, non eccezionale la scelta del cibo e forse un po' scarse le quantità nei bicchieri.
https://www.yelp.it/biz/il-caffe-di-roma-torino;Indicato per la colazione (buone brioches e buon caffè!)
https://www.yelp.it/biz/i-tesori-bari;un semplice bar con una pasticceria deliziosa e pranzo da lavoro con insalate e altro.
https://www.yelp.it/biz/happy-days-bar-torino;Un bel posto per il pranzo o caffè durante la vostra visita...Più
https://www.yelp.it/biz/grezzo-torino;Dolci sempre molto buoni e personale preparato a fornire aiuto nella scelta.
https://www.yelp.it/biz/granbar-torino;Aperitivo a scelta tra pinsa o sushi a 10€ con prodotti di ottima qualità!
https://www.yelp.it/biz/gelateria-piccinni-bari;La barretta rivestita di cioccolato fondente con gelato al cocco e caramello è divina!
https://www.yelp.it/biz/gelateria-grom-torino-2;Ovviamente al primo posto sta l'ottima qualità dei gelati, preparati con prodotti scelti e di stagione.
https://www.yelp.it/biz/gelateria-bucaneve-2-torino;Prenotato torta compleanno per un uomo fatto scritta al femminile.
https://www.yelp.it/biz/garden-caffetteria-torino;La titolare è molto gentile ed i camerieri cortesi ed efficienti.
https://www.yelp.it/biz/frulez-bari;Tutto di ottima qualità, adatto anche a vegetariani, vegani, a chi ha problemi di intolleranze.
https://www.yelp.it/biz/exki-pietro-micca-torino;Ottima qualità dei prodotti, i prezzi un po' sopra la media ma li valgono tutti.
https://www.yelp.it/biz/eataly-torino-torino;Posto assolutamente consigliato, anche solo per rilassarsi davanti a un buon caffè.
https://www.yelp.it/biz/del-cambio-torino;I primi e i secondi che abbismo preso sono buoni ma manca qualcosa per il livello del locale.
https://www.yelp.it/biz/dal-vecchio-torino;Un rapporto qualità prezzo notevole e la cortesia dei proprietari ti fanno venir voglia di eleggerlo locale preferito.
https://www.yelp.it/biz/costadoro-torino;colazione eccellente carinissimo il locale buonissime le brioches e caffè giusto rapporto qualità prezzo!
https://www.yelp.it/biz/cornetti-night-torino-2;Ampia scelta di cornetti con tanti topping e ripieni molto buoni!
https://www.yelp.it/biz/cornetti-night-torino;Un esempio: Crema alla nocciola, crema ai frutti di bosco, marmellata di fichi, marmellata di ciliegie, marmellata di arance.
https://www.yelp.it/biz/conchigliabar-bari;Prezzi nella media ma fuori rapporto qualità-prezzo.
https://www.yelp.it/biz/cioccolato-peyrano-torino-2;Del resto è il rovescio della medaglia per degustare dell'ottimo cioccolato.
https://www.yelp.it/biz/caffetteria-pasticceria-torino;Questa pasticceria è un vero paradiso di golosità specializzati in prodotti SALENTINI CONOSCIUTA PER I FAVOLOSI PASTICCIOTTI DA PROVARE
https://www.yelp.it/biz/caffeteria-federico-ii-bari;Non solo gelati ma anche un'ottima torta nera a base di cioccolato fondente !
https://www.yelp.it/biz/caffe-vittorio-veneto-torino;Un buon caffè da gustare in un locale dall'aria storica nella cornice della famosa piazza Vittorio Veneto!
https://www.yelp.it/biz/caffe-vergnano-torino;Il locale è molto accogliente e ben arredato e il personale cortese e disponibile.
https://www.yelp.it/biz/caffe-mozart-bari;In ogni caso il caffè era ottimo, come pure i cornetti, personale simpaticissimo, cordiale e abbastanza veloce.Niente da ridire.
https://www.yelp.it/biz/caffe-lumiere-torino;Buon caffè e buonissime le torte , il tutto accompagnato dalla gentilezza e simpatia delle due ragazze bariste
https://www.yelp.it/biz/caff%C3%A8-mulassano-torino-3;Colazione deliziosa Colazione deliziosa Bicherin Bicherin Guarda tutte le foto da Jessica D. per Caffè Mulassano
https://www.yelp.it/biz/cafe-vergnano-1882-torino;Gran vegetariano: una fetta di torta verde senza gusto e carote di contorno ancora con la buccia!!
https://www.yelp.it/biz/busters-coffee-torino;Un buon caffè, per chi piace quello americano, aromatizzato e a molti gusti, Wi-Fi e ambiente amichevole.
https://www.yelp.it/biz/bunet-torino;5 euro regolarmente scontrinati per un aperitivo servito al tavolo con 6 salatini freschi di pasticceria è molto onesto.
https://www.yelp.it/biz/birreria-la-divina-commedia-torino;Ormai ovunque si può trovare la pizza ma una Buona non è facile da trovare!
https://www.yelp.it/biz/biffi-valenzano;Locale con gazebo esterno (riscaldato d'inverno) e ottimo rapporto qualità prezzo.
https://www.yelp.it/biz/beaubar-torino;bar discreto nell'arredo ma con ampia scelta (panini, hamburger, piade). qualità prodotti buona, prezzi anche. comodissimo per museo cinema
https://www.yelp.it/biz/barber-and-caffee-torino;Un ottima torta è un buon caffè.
https://www.yelp.it/biz/baratti-e-milano-torino-2;Bellissimo bar bancone bar d'epoca si respira l'atmosfera di una vita passata Caffè molto buono Molto caratteristico
https://www.yelp.it/biz/bar-torrefazione-beccuti-torino;La gestione del locale è cambiata da poco ma il caffè é sempre ottimo.
https://www.yelp.it/biz/bar-miramare-bari;L'interno è piccolo ma accogliente e si può gustare un buon caffè solo in piedi.
https://www.yelp.it/biz/bar-marconi-di-torre-francesco-torino;D'inverno caldi infusi e the - tisane accompagnate con una buona fetta di torta .
https://www.yelp.it/biz/bar-lo-scudiero-torino;Buon caffè espresso con croissant alla marmellata.
https://www.yelp.it/biz/bar-gerla-1927-torino;Storica pasticceria in centro Torino, come ci si aspetta è cara ma almeno all'altezza.
https://www.yelp.it/biz/bar-delle-scienze-torino;Caffè ottimo ....e tutto il personale veramente delizioso ...sempre.. virtù non disponibile nella maggior parte degli altri locali!!!
https://www.yelp.it/biz/bar-costarica-torino;Il caffè è ottimo, i prezzi concorrenziali.
https://www.yelp.it/biz/babayaga-bari;Il cioccolato fondente è così cremoso che sembra un budino!
https://www.yelp.it/biz/antonelli-torino;Molto buoni anche tutti i prodotti della caffetteria.
