url;review
https://www.yelp.it/biz/zucca-torino;Il piano terra è tuttavia poco spazioso per sedersi ed i prezzi abbastanza elevati.
https://www.yelp.it/biz/wispobish-torino;Ristorante accogliente in corso Vittorio Emanuele II ottima carne e ben cucinata personale molto gentile e disponibile.
https://www.yelp.it/biz/vyta-torino;Il personale e' molto gentile e sono a disposizione anche numerosi tavoli sia all'interno che all'esterno.
https://www.yelp.it/biz/volver-torino-2;Luogo accogliente e familiare, il servizio è l'accoglienza impeccabili, gentili!
https://www.yelp.it/biz/vo-torino;Personale gentile, preparato e servizio di alto livello, tavoli ampi e spazio adeguato tra di essi, corretta l'illuminazione.
https://www.yelp.it/biz/vitelloni-torino;Il personale è stato gentile e disponibile, il locale era pulito e spazioso e la tavola apparecchiata con cura.
https://www.yelp.it/biz/vanilla-torino;Qualità eccellente, ampia scelta di gusti senza lattosio (tra cui alcune creme) e il proprietario è assolutamente squisito.
https://www.yelp.it/biz/vale-un-per%C3%B9-torino;Cucina molto buona coi piatti tipici Peruviani.
https://www.yelp.it/biz/urban-bari;Location molto accogliente con luci calde e ampi spazi.
https://www.yelp.it/biz/turet-torino;Il locale è ben organizzato e pur se tutto pieno, il rumore di fondo del chiacchiericcio non disturba.
https://www.yelp.it/biz/tre-galline-torino-2;Locale accogliente, elegante ma informale con personale davvero professionale, offre i piatti della tipica cucina Piemontese davvero ottimi.
https://www.yelp.it/biz/trattoria-torricelli-torino;L ambiente e' sempre accogliente e familiare e il servizio e' gestito in maniera garbata e simpatica.
https://www.yelp.it/biz/trattoria-spirito-santo-torino-2;Unico neo, scarso parcheggio nei dintorni, ma non si può pretendere in via Guido Reni!!!
https://www.yelp.it/biz/trattoria-piemontese-torino;Locale ampio con mattoni rossi a vista e seggiolini in legno che sanno molto di rustico.
https://www.yelp.it/biz/trattoria-mombercelli-di-antico-elena-torino;Nulla da dire sulla qualità del cibo, in linea con le caratteristiche del locale, trattoria popolare di discreto livello.
https://www.yelp.it/biz/trattoria-da-cinzia-torino;Ambiente accogliente , semplice e molto familiare.
https://www.yelp.it/biz/trattoria-alba-torino;Il locale è accogliente e l'atmosfera è familiare.
https://www.yelp.it/biz/toscano-torino-3;La presentazione è molto casereccia: buona accoglienza della proprietaria, ambiente essenziale, tavolo con salumi in esposizione.
https://www.yelp.it/biz/tommy-tegamino-torino;La pizza era molto buona così come gli ingredienti di ottima qualità.
https://www.yelp.it/biz/tobiko-torino;I prezzi sono alti come in altri ristoranti giapponesi ma la qualità del cibo non è altrettanto buona.
https://www.yelp.it/biz/tiella-bari;Locale molto carino,luci giuste,sedute comode.In questo periodo si trova agevolmente parcheggio lì vicino!!
https://www.yelp.it/biz/the-stuart-pub-bari;Il personale è molto cordiale e i titolari affabili e simpatici!
https://www.yelp.it/biz/the-egg-torino;Il locale accogliente e la simpatia del personale e dello chef Nicola fanno il resto.
https://www.yelp.it/biz/the-bakery-torino;Il locale è molto carino e la vetrina ti ispira sin da subito e ti fa decidere di entrare.
https://www.yelp.it/biz/teapot-torino;Il locale è carino, le seggiole tutte diverse e le teiere sugli scaffali rendono particolare e familiare il locale.
https://www.yelp.it/biz/taverna-rossa-di-zappia-pasquale-torino;Il personale è molto gentile, disponibile e il locale è molto carino.
https://www.yelp.it/biz/taverna-delloca-torino;Cibo ottimo, dagli antipasti vario tipo ma sempre con l'oca quale il filo conduttore, alla rolatina d'oca con carciofi.
https://www.yelp.it/biz/taiki-bari;Ottima qualità, personale impeccabile e qualificato, location accogliente, preparazione del sushi goduriosa sia alla vista che al palato.
https://www.yelp.it/biz/t-bone-station-torino;Cibo ottimo, menù molto vario e che ha messo d'accordo 14 persone, prezzi nella norma e serata assolutamente piacevole!
https://www.yelp.it/biz/sushitao-bari;Provato con la formula all you can eat servizio veloce e pietanze tutte molto buone a modici prezzi
https://www.yelp.it/biz/spaghetteria-70cento-bari;Il personale è cortese e disponibile, si respira un'aria familiare ormai difficile trovare!
https://www.yelp.it/biz/spada-reale-torino;Il servizio è stato veloce il giusto ed il menù molto ben illustrato dal giovane Armando, gentile e professionale.
https://www.yelp.it/biz/soup-e-go-torino;Locale molto molto carino, piccolo ma, in realtà, spazioso (ha posto sia dentro che fuori).
https://www.yelp.it/biz/soul-kitchen-torino;Il locale è molto carino, il servizio a tavola e del personale nonchè i piatti sono molto ricercati.
https://www.yelp.it/biz/sotto-la-mole-torino;Cibo di buona qualità ma ambiente asettico con personale un po' scostante e poco collaborativo .
https://www.yelp.it/biz/singapore-torino;Del servizio non ci si può lamentare:il personale è gentile e i piatti arrivano subito.
https://www.yelp.it/biz/silvano-torino-2;Locale carino, comodo per una pausa caffè, il gelato merita una fermata ma se siete in zona.
https://www.yelp.it/biz/sicomoro-torino;Il locale è carino e si trova in una zona molto caratteristica, anche con tavoli esterni.
https://www.yelp.it/biz/siciloso-torino;Un bel posto, con un arredo originale, tavolini comodi, belle luci, un bel bancone e persone simpatiche.
https://www.yelp.it/biz/sibir-torino-2;Bel locale, spazioso e arredato senza eccessi.
https://www.yelp.it/biz/sfashion-cafe-torino;La cucina spazia dalla pizza a piatti tipici della tradizione italiana senza però mai raggiungere un'eccellenza.
https://www.yelp.it/biz/seven-up-torino;Qualità del cibo nella media - prezzi corretti - servizio veloce sicuramente si può trovare di meglio in zona
https://www.yelp.it/biz/sen-mi-ya-torino-2;Il servizio è abbastanza veloce calcolando che i cibi son preparati sul momento ed è praticamente sempre pieno.
https://www.yelp.it/biz/sandrino-bari-2;una valida alternativa a Martinucci per quanto riguarda il gelato nel centro storico ingredienti freschi e di qualità consigliato
https://www.yelp.it/biz/sandrino-bari;Il personale è gentile e pronto a consigliare i giusti abbinamenti o le specialità di giornata.
https://www.yelp.it/biz/rossopomodoro-torino;La pizza è veramente buona , i primi molto ben fatti e i secondi non hanno rivali.
https://www.yelp.it/biz/roar-roads-torino;Si mangia con una discreta qualità a prezzi contenuti, per cui il rapporto qualità/prezzo è di tutto rispetto.
https://www.yelp.it/biz/ristrot-guviol-torino;Bella location, ci sono tre sale in cui i tavoli sono predisposti lasciando spazio tra uno e l'altro.
https://www.yelp.it/biz/ristoranti-taverna-delle-rose-torino-2;Ambiente curato ed accogliente, atmosfera intima e riservata ideale tanto per cene romantiche quanto per pranzi di lavoro.
https://www.yelp.it/biz/ristoranti-sardegna-torino;Il locale è carino e spazioso, il personale cordiale e disponibile.
https://www.yelp.it/biz/ristorante-ratatui-torino-2;Si mangia bene e l'atmosfera è quasi familiare, gestione semplice e molto cordiale.
https://www.yelp.it/biz/ristorante-peppino-torino;Il personale molto cortese è disponibile e il locale si trova in una via molto suggestiva di Torino.
https://www.yelp.it/biz/ristorante-lo-scoglio-da-vito-bari-2;Servizio veloce e cortese. 1 Frittura, 1 Polpo alla griglia,acqua, 1 Chardonnay 375 ml, 2 sorbetti: 40,00 Euro.
https://www.yelp.it/biz/ristorante-consorzio-torino;La cucina è ispirata alla tradizione piemontese ma con l'intrusione piacevole di alcune materie prime provenienti da altre regioni.
https://www.yelp.it/biz/ristopizza-giampaolo-bari;In sintesi bel locale, personale cortese e disponibile, cibo tutto buono, compreso la pizza, e prezzo nella norma.
https://www.yelp.it/biz/re-vittorio-bari;Il locale è carino ed il personale gentile e accogliente.
https://www.yelp.it/biz/quelli-che-ben-pensano-torino;Servizio veloce, pizze molto buone e locale abbastanza familiare ed informale.
https://www.yelp.it/biz/quattro-soldi-torino;Il ristorante ha un'ampia offerta di piatti e pizze di ottima qualità, il personale è molto cortese e cordiale.
https://www.yelp.it/biz/prima-e-poi-torino;Veloce il servizio con personale gentile e professionale e cibi genuini e presentati molto bene.Complimenti, non cambiate!
https://www.yelp.it/biz/premiata-osteria-dellhermada-torino;Il locale é molto familiare ed accogliente, un atmosfera che ricorda molto un'osteria o una locanda.
https://www.yelp.it/biz/porto-di-savona-torino;È stata un'ottima cena tipica piemontese in centro cittá: il personale era simpatico e disponibile e il cibo ottimo.
https://www.yelp.it/biz/porcaloca-torino;Buon punto di riferimento per una serata tra amici anche con bimbi piccoli.
https://www.yelp.it/biz/poormanger-torino;Scortesi e poco disponibili con le famiglie con bambini.
https://www.yelp.it/biz/platti-torino-2;E una buona scelta anche per il pranzo con piatti della tradizione o insalate leggere.
https://www.yelp.it/biz/pizzeria-vecchio-forno-garibaldi-torino;Un po meno facile e trovare parcheggio nei dintorni.
https://www.yelp.it/biz/pizzeria-vecchia-londra-torino;Nel menu ogni giorno diverse proposte tra primi, secondi e contorni con la formula prezzo fisso.
https://www.yelp.it/biz/pizzeria-tarantini-al-cancello-rotto-bari;Ottimo ristorante con vasta scelta tra pizza carne pesce e primi piatti ottima cucina personale gentile.
https://www.yelp.it/biz/pizzeria-silvestro-torino;Ospitali e cordiali con i bimbi piccoli.
https://www.yelp.it/biz/pizzeria-poldo-torino;Personale gentile, bel dehors che consiste in alcuni tavolini sulla via di nanni, pedonalizzata in questo punto!
https://www.yelp.it/biz/pizzeria-la-sacrestia-torino;Il locale è davvero carino e ben decorato.
https://www.yelp.it/biz/pizzeria-gino-torino;Il personale è molto cortese... sembra di essere da amici , trattamento sincero e senza fronzoli.
https://www.yelp.it/biz/pizzeria-giampy-di-mazzola-giuseppe-torino;Si fatica a trovare il parcheggio nel week end ma ci vuole un po di fortuna.Consigliato
https://www.yelp.it/biz/pizzeria-fratelli-la-bufala-torino;Vero relax per chi ha bimbi piccoli ma anche per chi non ne ha, avendo spazi separati e dedicati.
https://www.yelp.it/biz/pizzeria-enzo-e-ciro-di-fraddosio-v-c-bari;Il locale si trova in una via centrale di Bari, ma con il dramma del parcheggio in città.
https://www.yelp.it/biz/pizzeria-dual-torino;Personale gentile e professionale e paziente con i bimbi.
https://www.yelp.it/biz/pizzeria-divina-bari;Piatti tipici della cucina pugliese di ottima qualità , nonchè pizze della tradizione barese con ingredienti freschi e di stagione.
https://www.yelp.it/biz/pizzeria-di-cosimo-bari;Personale cortese e gentile, Giacomo (il più anziano della famiglia) ha sempre un sorriso per tutti.
https://www.yelp.it/biz/pizzeria-da-michele-torino;Il locale è piccolo ma ha un'atmosfera familiare e cordiale
https://www.yelp.it/biz/pizzeria-da-donato-bari;Trovare parcheggio in zona però è un'impresa.
https://www.yelp.it/biz/pizzeria-continental-pizzorante-bari-2;Ambiente raffinato ma al tempo stesso familiare, la cortesia discreta d'altri tempi dei camerieri, la pizza ottima.
https://www.yelp.it/biz/pizzeria-bella-vita-torino;Con i bimbi piccoli non si ha a disposizione tutto quel tempo per pizza e chiacchere con la nutella.
https://www.yelp.it/biz/pizzeria-baraonda-bari;Gli ingredienti sono sempre freschi e l'estate si può gustare la pizza al fresco e soprattutto in relax :)
https://www.yelp.it/biz/pizzeria-au-lapin-agile-torino-2;La zona è tranquilla e non è neppure stato difficile trovare parcheggio.
https://www.yelp.it/biz/pizzeria-amalfi-torino;Comunque posto accogliente anche per famiglie e amici con cani.
https://www.yelp.it/biz/pizzeria-aladino-bari;Pizza buona e locale accogliente, meglio prenotare se si è numerosi.
https://www.yelp.it/biz/pizzeri-lapislazzulo-torino;Il personale è gentile e accogliente, il clima familiare.
https://www.yelp.it/biz/pizza-speedy-torino-3;Dovuto all'ottima pizza e anche al personale estremamente cortese.
https://www.yelp.it/biz/pizza-speedy-torino-2;Ottima la pizza , la farinata , e gli ingredienti .
https://www.yelp.it/biz/pizza-pistrocchio-torino;La pizza non è eccezionale ma per una serata al volo con gli amici va bene.
https://www.yelp.it/biz/pizza-ad-hoc-torino;Servizi igienici ampi, puliti ed in ordine (anche se ce n'è uno solo).
https://www.yelp.it/biz/pippo-paranza-torino;Può essere non semplice trovare parcheggio specialmente il venerdì e sabato sera.
https://www.yelp.it/biz/piola-cianci-torino;I piatti sono quelli della tradizione piemontese, l'ambiente è informale, i prezzi sono alla portata di tutti.
https://www.yelp.it/biz/piano-b-torino;Impasto molto leggero digeribile ottima qualità da tornare sicuramente, personale simpatico e disponibile...locale spazioso e originale
https://www.yelp.it/biz/perbacco-bari;Il locale è davvero carino, molto intimo e familiare, la qualità del cibo ottima, il personale cortese.
https://www.yelp.it/biz/pepino-torino;servizio veloce e professionale,paziente soprattutto con i bambini a volte indecisi ma entusiasti di tanta bontà!!!
https://www.yelp.it/biz/peperosso-torino;Ristorante molto buono soprattutto qualità prezzo da raccomandare il titolare molto simpatico Personale gentile
https://www.yelp.it/biz/pastificio-defilippis-torino;Il personale è molto cortese e la varietà di proposte è notevole... ovviamente offre vini e pietanze del luogo.
https://www.yelp.it/biz/pasticceria-amore-torino;Aperitivo molto ricco con stuzzichini di qualità eccellente e personale molto gentile.
https://www.yelp.it/biz/pastamaneria-torino;Prezzi abbordabili Nel complesso è un bel posto per provare della pasta veramente buona fatta in casa.
https://www.yelp.it/biz/pasta-mon-amour-torino;Locale molto carino e accogliente, arredamento particolare, i tavoli sono ricavati dalle casse che contengono le bottiglie di vino.
https://www.yelp.it/biz/panperfocaccia-torino-2;Anche questa sera cena al panperfocaccia calzone squisito e sempre troppo gentile e disponibile la signorina Federica.
https://www.yelp.it/biz/panino-giusto-torino;molto gentile e disponibile...e poi le attese lunghe e spesso senza motivi ...peccato.
https://www.yelp.it/biz/paco-torino;Il cibo è ottimo e la location molto particolare, ma a rendere veramente speciale il Paco è lo staff!
https://www.yelp.it/biz/ottimo-torino;Ottima qualità di gelati e gusti ricercati e unici fatti solo con materie prime naturali e di qualità.
https://www.yelp.it/biz/osteria-sopravento-bari-2;Orecchiette al sugo favolose e pesce freschissimo prezzo molto abbordabile il tutto accompagnato con una bottiglia di vino spaziale.
https://www.yelp.it/biz/osteria-rotonda-dei-facchinetti-torino;Locale ampio, con parcheggio nelle vicinanze.Buona scelta, piatti di qualità, personale veloce e gentile.
https://www.yelp.it/biz/osteria-le-arpie-bari;Consigliati gli antipasti (tutti) ed i primi (da provare la teglia di patate riso e cozze).
https://www.yelp.it/biz/osteria-fate-infretta-a-tavola-torino;Il locale è raccolto e dall'aria familiare, il cibo nella norma.
https://www.yelp.it/biz/osteria-della-travi-bari;cucina tipica in un ambiente molto familiare e davvero ben organizzato. ottimi gli antipasti abbondanti
https://www.yelp.it/biz/osteria-del-frate-torino;Qualità del cibo eccellente, gentilezza dei proprietari e del personale assolutamente al di fuori del comune, prezzi praticamente stracciati.
https://www.yelp.it/biz/osteria-del-fiat-torino;Il locale è raccolto e dall'aria familiare, il cibo nella norma.
https://www.yelp.it/biz/osteria-dei-quattro-gatti-bari;Locale davvero molto accogliente, grandi spazi , grandi tavolate ma anche ottimo per cene a 2.
https://www.yelp.it/biz/osteria-antichi-sapori-bari;A partire dal cibo di ottima qualità a finire al personale cordiale e molto preparato sui prodotti da vendere.
https://www.yelp.it/biz/osteria-al-gambero-bari;L'ambiente è accogliente e familiare ed hai la sensazione di essere invitato a casa dei suoi titolari.
https://www.yelp.it/biz/ortigia-bistrot-torino;Locale accogliente e personale gentile e attento alle esigenze del cliente Consigliato a chi ricerca la vera cucina siciliana
https://www.yelp.it/biz/opera-bari;Buonissimi sia gli antipasti che i primi, giusti in quantità e che si presentano anche visivamente in maniera impeccabile.
https://www.yelp.it/biz/open-baladin-torino;Il menù comprende un'ampia scelta di piatti e stuzzichini tutti di ottima qualità e le porzioni sono enormi.
https://www.yelp.it/biz/oolivoo-bari;Personale gentile, bello il posto direttamente sul mare ma il cibo purtroppo poco gradevole.......mozzarelle a parte......
https://www.yelp.it/biz/olsen-di-caldi-cinzia-torino;L'ambiente è sempre caldo ed accogliente, il personale è educato ma malinconico, un sorriso in più non guasterebbe.
https://www.yelp.it/biz/old-wild-west-torino;posto gradevole divertente ideale per amici o famiglie...la qualità della carne è ottima il servizio veloce
https://www.yelp.it/biz/nuovo-fizzarotti-bari;cibo di buona qualità , buona presentazione delle pietanze , gentilezza e rapidità nel servizio , prezzo buono .
https://www.yelp.it/biz/nuova-dezzuto-torino;Per quanto riguarda il resto del personale ben educato e sicuramente avranno tanto da insegnare al cosiddetto responsabile.
https://www.yelp.it/biz/niva-cremeria-torino;Bontà e cortesia del personale rendono questa gelateria un riferimento in città!
https://www.yelp.it/biz/new-mexico-torino-2;se ti va di mangiare un ottima pizza servita fumante al tavolo con un sorriso, vai in questa pizzeria.
https://www.yelp.it/biz/napples-torino;Il locale è pulito e il servizio veloce ma cortese e puntuale, il proprietario alla cassa è sempre gentilissimo.
https://www.yelp.it/biz/mr-rooster-torino-3;ottima Ottima cucina ottima accoglienza un personale molto cortese pronto a risolvere qualsiasi problema del cliente.
https://www.yelp.it/biz/monte-dei-cappuccini-torino;Serate con le amiche di sempre in un ristorante con posizione splendida e vista meravigliosa sulla città !
https://www.yelp.it/biz/monferrato-torino;Servizio impeccabile, ambiente piacevole e tranquillo, conto non a buon mercato ma in linea con la qualità del cibo.
https://www.yelp.it/biz/monegato-torino;Anzitutto il locale è accogliente colorato e l'ambiente è familiare.
https://www.yelp.it/biz/michi-tanzariello-torino;Locale ampio e piacevole anche se con spazi stretti tra i tavoli.
https://www.yelp.it/biz/miagola-cafe-torino;Il personale è molto cordiale, e i prezzi sono buoni,tenendo presente che si trova proprio nel centro di torino
https://www.yelp.it/biz/mezzaluna-osteria-torino;Ambiente carino, parcheggio in prossimità, c'è anche un negozio all'interno.
https://www.yelp.it/biz/mexico-70-torino;servizio veloce,cordiale e gentile.ideale anche per i take away,basta chiamare prima e arrivi la che è già tutto pronto!
https://www.yelp.it/biz/mcdonalds-bari-3;E' situato su due piani - c'erano posti liberi al piano terra.
https://www.yelp.it/biz/mc-donalds-torino-4;Consigliato comunque per la qualità del cibo preparate sempre fresco.
https://www.yelp.it/biz/masaniello-%C3%A9-turnat-torino;Il menù è ricco di piatti tipici e nuovi abbinamenti, per accontentare i curiosi, ma anche gli scettici.
https://www.yelp.it/biz/martinucci-bari-2;Se non si è in grado di reggere molti clienti è meglio fare altro o almeno assumere personale cortese.
https://www.yelp.it/biz/marechiaro-torino;Locale pulito con ampi spazi per gli ospiti.
https://www.yelp.it/biz/mamma-licia-torino;Menù non troppo ricco ma con cose interessanti.
https://www.yelp.it/biz/mamasita-torino;Locale accogliente e molto spazioso, comodo anche per gruppi numerosi.
https://www.yelp.it/biz/maltos-beer-bari;Pub carino con personale gentile ed accogliente e con tanti posti a sedere anche all'esterno, in una verandina riscaldata.
https://www.yelp.it/biz/m-bun-torino-3;Bel posto vicino al centro di Torino, locale con area giochi bimbi.
https://www.yelp.it/biz/m-bun-torino;Locale accattivante soprattutto per i bambini nel piano interrato, carne e pane molto buoni.
https://www.yelp.it/biz/lo-stonnato-torino;Locale carino nel cuore di San Salvario che offre una cucina a 360°, buoni i primi e la pizza.
https://www.yelp.it/biz/lo-scugnizzo-torino;Facile trovare parcheggio su C.so San Maurizio se si arriva prima delle 21.
https://www.yelp.it/biz/libery-pizza-e-artigianal-beer-torino;(Il menù era ricco di antipasti, primi e secondi) La pizza si presenta alta ma leggera nel suo impasto.
https://www.yelp.it/biz/le-vitel-etonne-torino;Qualità del cibo, cucinato ad arte, servizio encomiabile ed il tutto ad un prezzo decisamente ben rapportato al contesto.
https://www.yelp.it/biz/le-veronique-bari-2;Pizzeria tra le storiche di Bari che con questo locale è voluta tornare nel quartiere in cui e' nata.
https://www.yelp.it/biz/le-tre-lanterne-bari;Il locale è accogliente e la conduzione familiare ti fa sentire a casa.
https://www.yelp.it/biz/le-rondini-torino;Nulla di entusiasmante ma comunque un buon locale...Si presenta leggermente scuro o meglio,forse scarsamente illuminato, arredamento standard ma gradevole.
https://www.yelp.it/biz/le-putrelle-osteria-torino;È un locale carino e adatto anche a bambini piccoli.
https://www.yelp.it/biz/le-lupin-dei-f-lli-zambetta-bari;Locale grande, ideale quando si hanno dei bambini che hanno il loro giusto spazio per muoversi.
https://www.yelp.it/biz/le-grand-tabu-bari;Per il titolare: non basta avere un bel locale e mettere bella musica con qualche bottiglia esposta !!!
https://www.yelp.it/biz/le-due-antenne-bari;Locale ampio, personale cordiale, grandissima abbuffata di antipasti vari caldi, freddi, carne e pesce.
https://www.yelp.it/biz/le-cantine-di-bacco-torino;Il personale è molto cordiale ed il risotto al radicchio è stato cucinato bene, ben separato, in porzione adeguata.
https://www.yelp.it/biz/la-via-della-seta-torino;Bel ristorante cinese in centro curato in tutto personale gentile e buona cucina a prezzi del tutto onesti .
https://www.yelp.it/biz/la-taverna-greca-torino-2;Il personale è cortese e alla mano, e anche l'atmosfera è familiare.
https://www.yelp.it/biz/la-taverna-dei-mercanti-turin;Locale familiare e molto accogliente, personale gentilissimo ed attento.
https://www.yelp.it/biz/la-tana-del-polpo-bari;Pesce freschissimo, personale accogliente e familiare e cucina top!
https://www.yelp.it/biz/la-reseda-torino;Il locale e  grazioso e pulito adatto per le famiglie !
https://www.yelp.it/biz/la-piramide-torino;Si sente che gli ingredienti sono freschi e veri, le creme sono spettacolari, una su tutte la crema moscato.
https://www.yelp.it/biz/la-piadineria-torino;il personale è sempre molto cordiale e ti aiuta a scegliere la combinazione giusta tra gli ingredienti. ottima!!
https://www.yelp.it/biz/la-mela-stregata-torino;Il locale è ampio e spazioso, il personale gentile anche se un po' frettoloso
https://www.yelp.it/biz/la-madia-torino;Ristorante molto carino pochi tavoli fuori dal centro ...apprezzabile per il parcheggio Personale molto gentile e professionale.
https://www.yelp.it/biz/la-locanda-bari;Nella piazza principale di Bari vecchia questo locale offre un fantastico ambiente per gustare piatti tipici di ottima qualità.
https://www.yelp.it/biz/la-limonaia-torino;Il personale è cortese e spiega con molta pazienza le portate e la filosofia del posto.
https://www.yelp.it/biz/la-gustosa-torino;La pizza è squisita e c'è solo l'imbarazzo della scelta, ma anche gli spaghetti allo scoglio in pasta.
https://www.yelp.it/biz/la-gricia-torino;A cena un sabato sera della scorsa settimana...il locale è accogliente e con una posizione ottima, su piazzetta E.
https://www.yelp.it/biz/la-granseola-torino;Ottima la cortesia del personale e l'ambiente è curato e accogliente.
https://www.yelp.it/biz/la-gaia-scienza-torino;Cibo ottimo, accoglienza calorosa e ottimo rapporto qualità- prezzo, menù con piatti della tradizione cucinati in maniera casereccia.
https://www.yelp.it/biz/la-fila-torino;Locale carino in stile belle époque, proprio di fronte al Museo egizio, servizio rapido e cordiale, pizza davvero mediocre.
https://www.yelp.it/biz/la-drogheria-torino;Hanno riservato due salette al piano superiore con buffet privato davvero eccezionale Molta cortesia Davvero consigliato!
https://www.yelp.it/biz/la-cecchina-bari;Personale gentile e accogliente piatti pregevoli che rendono onore alla eccelle tradizione culinaria pugliese, riservando slanci di armoniosa creatività.
https://www.yelp.it/biz/la-casa-del-demone-torino;E in effetti non si può che parlarne bene: ottima qualità della carne e buona selezione di birre.
https://www.yelp.it/biz/la-capannina-torino-2;Essendo un po' decentrato dal centro è facile trovare parcheggio, negli adiacenti Corso Vittorio o Corso Matteotti.
https://www.yelp.it/biz/la-cantinella-torino;Sicuramente personale gentile e premuroso in sala,buona cucina buon servizio,conto giusto, sono i punti di forza di questo ristorante.
https://www.yelp.it/biz/la-cantina-torino;Il menù abbastanza essenziale lascia comunque la possibilità di scegliere ai vari commensali secondo il proprio gusto.
https://www.yelp.it/biz/la-campana-torino-2;La cucina è stata abbastanza buona anche se lontana da quella pugliese e il personale cordiale e disponibile.
https://www.yelp.it/biz/l-osteria-le-ferriere-torino;Bel locale moderno, ben decorato, pulito, spazioso, con tavoli ben distanziati e tanto spazio a disposizione.
https://www.yelp.it/biz/l-oca-fola-torino;Unico difetto la difficoltà di trovare parcheggio.
