url;review
https://www.yelp.it/biz/l-antico-arco-cellamare;Il locale è accogliente e familiare, il titolare é sempre disponibile a giusti consigli e spiegazioni.
https://www.yelp.it/biz/l-aglio-torino;Locale molto carino in zona tranquilla con ampia scelta di parcheggio.
https://www.yelp.it/biz/l-accademia-del-panino-torino;Ottimo club sandwich con pane nero al carbon vegetale servizio ottimo cameriera gentilissima con i bambini ottimo veramente
https://www.yelp.it/biz/kipling-torino;Personale molto gentile e attento, il parcheggio sotterraneo di piazza Bodoni viene offerto dal ristorante tramite voucher prepagato
https://www.yelp.it/biz/karmacola-torino;Il locale si trova al piano interrato ed ha una discreta possibilità di parcheggio nelle vie limitrofe.
https://www.yelp.it/biz/joys-pub-bari;Unica pecca è trovare parcheggio, ma con un colpo di fortuna si trova.
https://www.yelp.it/biz/japs-torino-3;molto carino il locale,ottimo il servizio e ottima la cucina...costi relativamente contenuti rispetto ad altri locali giapponesi. consigliato
https://www.yelp.it/biz/japs-torino-2;prezzi contenuti ma nulla a che vedere con altri sushi in città., locale molto semplice all'interno, personale gentile
https://www.yelp.it/biz/indian-street-food-torino;Cibo ottimo, autentico e preparato sul momento.
https://www.yelp.it/biz/imbarchino-torino;Il locale è davvero carino..proprio sulla riva del Po.L'atmosfera é informale e il personale gentile e spiritoso!
https://www.yelp.it/biz/il-vicolo-torino;Ambiente accogliente e di design, personale gentilissimo e professionale, porzioni abbondanti e cibo di qualità cucinato con originalità.
https://www.yelp.it/biz/il-siculo-di-savona-monica-torino;L'ambiente è molto familiare e il personale è gentile e simpaticissimo.
https://www.yelp.it/biz/il-porto-torino;Il locale non è molto grande, ma gli arredi ricreano l'ambiente marinaro, dalle reti agli attrezzi per la pesca.
https://www.yelp.it/biz/il-picchio-torino;Bel locale, ottimo l'Antipasto del Picchio mentre la pizza è buona, ma a parità di prezzo c'è di meglio.
https://www.yelp.it/biz/il-gelatiere-bari-3;C'è un po' di difficoltà nel trovare parcheggio essendo una zona molto trafficata e adiacente al Policlinico.
https://www.yelp.it/biz/il-dolcetto-bari;La pasta dei cornetti è davvero molto buona e il personale cordiale.
https://www.yelp.it/biz/ichi-torino;Semplicemente fantastico per la qualità del cibo.. per l'accoglienza da parte del personale e cosa molto importante la pulizia.
https://www.yelp.it/biz/i-tartufi-bistrot-torino;Il locale si presenta piccolo ma molto accogliente ,con personale gentile e presente per ogni esigenza .
https://www.yelp.it/biz/i-soliti-ignoti-torino;Cibo ottimo, servizio accurato anche se non velocissimo, atmosfera gradevole, location perfetta in un parco dedicato
https://www.yelp.it/biz/huntsman-pub-torino;Pub sempre aperto buona selezione di birre e sicuramente buoni hamburger carne di buona qualità.... da tener presente!
https://www.yelp.it/biz/hua-dou-torino;Ottima cucina cinese e buonissima la pizza!
https://www.yelp.it/biz/horas-kebab-torino;Il personale è molto cordiale, lo spazio esterno è ristretto ma i piatti ed i panini veramente gustosi.
https://www.yelp.it/biz/home-burger-palese;Panini eccellenti con carne di ottima qualità e sapientemente conditi per non alterarne il gusto.
https://www.yelp.it/biz/hamp-bari;Posto adatto anche alle famiglie con bambini.
https://www.yelp.it/biz/gusti-e-sapori-torino;Se volete un posto intimo per mangiare non fa per voi...per il resto buona scelta per gruppi numerosi
https://www.yelp.it/biz/gulp-bari;L'allestimento del locale è molto carino, così come è simpatica l'idea di utilizzare dei dischi in vinile come sottopiatti.
https://www.yelp.it/biz/grom-torino-2;Servizio impeccabile e scelta ampia, sempre aggiornata, di gusti, tutti buoni.
https://www.yelp.it/biz/grill-burger-house-bari;Locale carino, bella l'idea di poter scegliere liberamente cosa mettere nel panino, e personale molto veloce, simpatico e disponibile.
https://www.yelp.it/biz/girarrosto-santa-rita-torino;Prezzi bassi : trancio di pizza ai funghi, trancio di farinata e birra piccola 6,50 euro
https://www.yelp.it/biz/gennaro-esposito-torino;Pizza veramente buona, personale cortese e, una volta seduti, servizio veloce.
https://www.yelp.it/biz/gelateria-mondello-torino;Gelati di ottima qualità con numerosi gusti da scegliere.
https://www.yelp.it/biz/gasperini-bari;Personale gentile e simpatico da provare sicuramente !!!
https://www.yelp.it/biz/galante-torino-2;Servizio molto buono e il conto in linea con qualità del cibo e con la raffinatezza del posto.
https://www.yelp.it/biz/gadi-bari;I gelati sono artigianali e di buona qualità.
https://www.yelp.it/biz/fuzion-torino;davvero gentile e disponibile, parlando con lui si capisce davvero quanta passione e dedizione metta il quello che fa.
https://www.yelp.it/biz/frulez-bari;Locale carino, accogliente ma stretto di spazi.
https://www.yelp.it/biz/freevolo-torino;In generale ottimo rapporto qualità ed il personale è cordiale e sempre presente anche nei momenti di maggior caos.
https://www.yelp.it/biz/fratelli-roselli-torino;Pizza buonissima personale presente e simpatico piccolo locale ma molto familiare da provare ottimi anche i piatti da portata
https://www.yelp.it/biz/fratelli-la-cozza-torino-2;Locale con ampi spazi, carino, con arredamento particolare quasi buffo.
https://www.yelp.it/biz/forchetta-e-scarpetta-torino;Localino piccolo ma confortevole...titolare e dipendenti simpatici...cenetta all'insegna del gusto e prezzi competitivi per l'ottima qualità dei piatti !!
https://www.yelp.it/biz/focacceria-santagostino-torino-2;Personale molto gentile anche con i bimbi.
https://www.yelp.it/biz/focacceria-riviera-ligure-torino;Molto comodo per pranzare in centro a Torino e mangiare pizza veramente buona, Da provare!!!
https://www.yelp.it/biz/fassoneria-torino;Personale molto cordiale e disponibile, atmosfera familiare e calorosa.
https://www.yelp.it/biz/farini-da-lia-torino;Il cibo è ottimo e fresco, preparato con cura sapiente di chi conosce il pesce.
https://www.yelp.it/biz/exki-pietro-micca-torino;Cibo buono e personale molto gentile, un'ottima scelta per mangiare qualcosa di leggero e più salutare
https://www.yelp.it/biz/exki-8-gallery-torino-2;Il personale è molto gentile e amichevole.
https://www.yelp.it/biz/esperia-torino-2;Se ti interessa solo la location vacci se la qualità del cibo per te è importante evita questo posto.
https://www.yelp.it/biz/entremetier-di-lingweifu-torino;Sempre all'altezza delle aspettative.Dehors ampio e comodo.Porzioni spettacolari e tutto cucinato bene.Prezzi contenuti per il tipo di cucina.
https://www.yelp.it/biz/eno-libero-emporio-enogastronomico-torino;Il cibo è ottimo, curano molto la presentazione e il sapore non è da meno.
https://www.yelp.it/biz/emporio-gastronomico-torino;Nel quartiere della Crocetta un bel locale antico con uno spazioso dehor moderno.
https://www.yelp.it/biz/el-pollo-loco-torino;Ottimo locale accogliente ..personale educato la cucina molto buona e si spende poco..menu vasto e carne molto buona
https://www.yelp.it/biz/el-centenario-torino-2;Cibo ottimo così come il margarita frozen e simpaticissima l'idea della tequila bum bum analcolica per bambini temerari!!
https://www.yelp.it/biz/eataly-torino-torino;C'è un bar al piano terra con un'enorme selezione di difficile da trovare (e mai sentito parlare di birre).
https://www.yelp.it/biz/eataly-bari;Facile trovare parcheggio auto (zona periferica e strisce bianche non a pagamento su uno dei lati della strada).
https://www.yelp.it/biz/du-cesari-torino;Comunque il locale si presenta come una classica osteria e il personale é molto disponibile e simpatico.
https://www.yelp.it/biz/dess%C3%AC-torino;Prezzi nella norma e locale carino, ma niente di che
https://www.yelp.it/biz/delfino-blu-torino;Bel posto , ottimo pesce, e personale eccellente, facile da trovare parcheggio, e, prezzi adeguati al cibo
https://www.yelp.it/biz/dai-saletta-torino-2;Ristorante che propone una buona cucina casalinga nella piena tradizione piemontese , atmosfera piacevole e prezzi nella media .
https://www.yelp.it/biz/da-paolo-bari;L' ambiente è accogliente,spazioso e pulito, il personale gentile e professionale.
https://www.yelp.it/biz/da-giuliano-torino;La pizza è veramente buona ma i bimbi, presumo figli dei gestori... rumorosissimi!
https://www.yelp.it/biz/da-giannino-l-angolo-d-abruzzo-torino;Posto molto familiare per passare una serata.
https://www.yelp.it/biz/da-ciro-torino;.. ottima pizza e scelta di ingredienti freschi e genuini.. complimenti al grande Ciro Ferrara ed al suo staff..
https://www.yelp.it/biz/da-ciccillo-torino;Questa pizzeria si trova lungo via nizza e non è facile trovare parcheggio nella zona.
https://www.yelp.it/biz/cris-e-bio-bari;Locale adatto sia a famiglie sia a giovani con il retro del locale con musica.
https://www.yelp.it/biz/cornetti-night-torino-2;Quante volte capita di aver trascorso una bella serata, magari in zona movida,ma di sentire che manca ancora qualcosina.
https://www.yelp.it/biz/coox-torino;L'ambiente è sempre pulito ed accogliente, il personale educato cortese e disponibile, decisamente oltre la media.
https://www.yelp.it/biz/complice-di-zhou-jinshu-torino;Prezzi bassi, in linea con i ristoranti cinesi in generale e, ahimè, in linea con la qualitá del cibo.
https://www.yelp.it/biz/cinese-nanchino-torino;Da segnalare che il personale è estremamente gentile e disponibile, ma purtroppo non basta.
https://www.yelp.it/biz/cinese-mei-li-hua-torino;Unico neo: il parcheggio è decisamente difficile da trovare.
https://www.yelp.it/biz/cinese-du-cheng-torino-2;Cibo ottimo, grandissima varietà di piatti, servizio veloce, porzioni abbondanti e quando esci non sai nemmeno troppo di fritto.
https://www.yelp.it/biz/ciacolon-ca-veneta-torino;Ottima location e ottimo personale Gentile e attento al dettaglio e alla cura dell'ospite senza mai essere invadente !!
https://www.yelp.it/biz/chez-zeina-torino;Cibo ottimo e abbondante Personale estremamente cortese e competente Affrontate la cosa con lo spirito giusto e senza preconcetti.
https://www.yelp.it/biz/cecchi-torino;Posto consigliato anche per le famiglie con bambini piccoli.
https://www.yelp.it/biz/catullo-torino-2;Luogo adatto per famiglie o per coppie.
https://www.yelp.it/biz/casale93-torino;Anche il servizio è sempre stato impeccabile, ovviamente il sabato può capitare di aspettare ma sempre un tempo ragionevole.
https://www.yelp.it/biz/cantine-risso-torino;Un vantaggio: la sera è facile trovare parcheggio nel piazzale antistante che durante il mattino è riservato ai mercatali
https://www.yelp.it/biz/cammaf%C3%A0-torino-4;Anche il locale è carino rinnovato da poco
https://www.yelp.it/biz/camilla-kitchen-torino;Bella location nel centro di Torino a pochi passi da piazza Vittorio Buon pesce e discreta scelta di champagne
https://www.yelp.it/biz/caffe-vittorio-veneto-torino;Parcheggio comodo sotterraneo Buffet di cibi con buona scelta non refrigerati e non coperti.
https://www.yelp.it/biz/caff%C3%A8-torino-torino-2;Servizio curato dal personale cortese, mai invadente e sempre premuroso.Nessun cameriere di secondo lavoro.
https://www.yelp.it/biz/cacio-e-pepe-torino;Personale gentile prezzo buono e cibo fresco che varia dalla pizza alla pasta, alla carne e al pesce.
https://www.yelp.it/biz/busters-coffee-torino;ambiente carino con tanto di wifi,e ottimo sia d'estate che d'inverno per passare un momento tranquillo con gli amici.
https://www.yelp.it/biz/burgheria-torino;Peccato è un bel locale con un bel dehor, personale squisito ma il cibo è di scarsa qualità.
https://www.yelp.it/biz/brek-torino;Il personale è gentile, molto comodo perchè è sotto i portici e se piove...
https://www.yelp.it/biz/braceria-signorile-bari;Consigliato ve lo dice un ristoratore Ottima carne Ottimo servizio Ottimo rapporto qualità prezzo Il proprietario molto simpatico.
https://www.yelp.it/biz/botta-bari;Ambiente rustico familiare, servizio veloce, personale gentile, professionale ed efficiente, ingredienti freschissimi, possibilità di scegliere tra varie farine.
https://www.yelp.it/biz/borgo-dora-torino;Le porzioni sono abbondanti e di ottima qualità.
https://www.yelp.it/biz/borgo-antico-bari;Il cibo era ottimo, ristorante al centro di Bari Vecchia, vicinissimo alla Basilica di San Nicola!
https://www.yelp.it/biz/blue-eyes-bari;Posto giusto per trascorrere una serata in compagnia mangiando e bevendo secondo la giusta qualità e prezzo rimanendo soddisfatti.
https://www.yelp.it/biz/black-e-white-bari;La qualità del cibo è alta, i piatti sono ben curati e i camerieri sono molto gentili e premurosi.
https://www.yelp.it/biz/bistrot-turin-torino;Ampia la scelta dei vini Spazi davvero angusti ma personale molto cortese
https://www.yelp.it/biz/biancofiore-bari;Unico neo: trovare un parcheggio nelle vicinanze, soprattutto il fine settimana.
https://www.yelp.it/biz/bene-cos%C3%AC-torino;Ottima la scelta della musica in sottofondo, e il volume era perfetto per riuscire a chiacchierare.
https://www.yelp.it/biz/bbq-di-pennestri-davide-antonio-c-torino;Il tutto affiancato da massima disponibilità e cortesia dei proprietari.
https://www.yelp.it/biz/bastimento-torino;Atmosfera familiare in un locale luminoso nonostante le dimensioni.
https://www.yelp.it/biz/barnum-torino;Il locale è accogliente e familiare, il personale cordiale e simpatico.
https://www.yelp.it/biz/bari-napoli-bari;ottimo rapporto qualità prezzo. resta un must delle risto pizzerie della città. con qualità del cibo e buon bere
https://www.yelp.it/biz/banco-di-sicilia-torino;Facile trovare parcheggio in zona in settimana.
https://www.yelp.it/biz/babayaga-bari;tutto freschissimo e personale educato e veloce!
https://www.yelp.it/biz/b-eat-torino;Buona scelta di birre americane, dai prezzi leggermente esosi (dai 5€ in su per la bottiglia da 0,33).
https://www.yelp.it/biz/augusto-torino;Servizio professionale, informale e simpatico da parte del sig Francesco ( cameriere) .prezzi in linea con la media .
https://www.yelp.it/biz/anema-e-cozze-torino;Il locale è gradevole, con ampio affaccio su corso Matteotti, un arredo semplice e non pacchiano.
https://www.yelp.it/biz/amici-miei-torino;Da sottolineare anche la vasta gamma di scelta di pizze con impasto 'gluten free e l'ottima qualità degli ingredienti.
https://www.yelp.it/biz/america-graffiti-torino;Locale molto carino in cui è possibile vivere l'atmosfera (o quasi) di una tipica cena americana anni 60.
https://www.yelp.it/biz/alla-lettera-torino;La pizza è veramente buona, gli ingredienti sono freschi e la scelta è ampia (ma la burrata è deludente!).
https://www.yelp.it/biz/alcool-torino-2;Ambiente curato, spazi ampi, grande varietà  di cocktail
https://www.yelp.it/biz/alberto-marchetti-torino;Bel locale disposto su due piani, ordinato e abbastanza pulito nonostante il grande via vai di gente, sempre pieno!
https://www.yelp.it/biz/alberosole-bari;Ristorante molto carino con ambiente accogliente, con soffitti alti in pietra viva, e atmosfera con luci soffuse...
https://www.yelp.it/biz/ala-torino;L' ambiente è carino e accogliente, caratterizzato dalla semplicità tipica delle osterie Il personale è gentile e rapido.
https://www.yelp.it/biz/al-tegamino-moncalieri;Il locale si presenta bene, accogliente e luminoso ( i lampadari di Artemide, seppur datati, sono sempre belli).
https://www.yelp.it/biz/al-sorso-preferito-bari;Anche questa volta il ristorante Al sorso preferito si è dimostrato all'altezza.... ottimi antipasti e fantastica cucina.
https://www.yelp.it/biz/al-savoia-bari;Forse un tempo era un riferimento per qualità e cortesia ma ora non più.
https://www.yelp.it/biz/al-cacimperio-torino;Potete trovare parcheggio piu' facilmente nel vicino Corso Galileo Ferraris.
https://www.yelp.it/biz/al-bicerin-torino;L'atmosfera che si respira nel piccolissimo locale è decisamente piacevole grazie anche al personale gentile e professionale.
https://www.yelp.it/biz/al-111-bari-2;Fantastico il crudo.... ostriche noci ricci gamberi cozze ..... delicati i primi piatti... decisi e azzeccati i secondi..
https://www.yelp.it/biz/ai-4-assi-di-sanna-roberto-torino;Locale spazioso e molto pulito .Il personale è gentile e il servizio veloce.Ottimo rapporto qualità prezzo!
https://www.yelp.it/biz/adonis-torino;Personale gentile, buona scelta di crèpes salate, ottima presentazione dei piatti, molto elaborati e con ingredienti di prima qualità.
https://www.yelp.it/biz/a6-sciamadda-torino;Ma a determinare la buona scelta del locale non è il prezzo ma la qualità del cibo nel piatto.
https://www.yelp.it/biz/a-vucciria-torino;Personale cortese e disponibile anche nel consigliare i piatti più adatti anche a chi non conosce la cucina sicula.
https://www.yelp.it/biz/a-picciridda-torino;Personale cortese, nei fine settimana tempi d'attesa un po lunghi ma il locale è pieno.
https://www.yelp.it/biz/a-casa-di-pulcinella-torino;Ottima qualità della pizza,una Delle più buone mangiate a Torino ed ottimo anche il rapporto qualità prezzo!
https://www.yelp.it/biz/500-calorie-torino;Ci sono locali che offrono prezzi più bassi con una qualità simile.
https://www.yelp.it/biz/%C3%A8-cucina-cesare-marretti-torino;Il menu è impostato con gli ingredienti più freschi possibili.
