url;review
https://www.yelp.it/biz/zucca-torino;Prezzi un po' alti ma in linea con la qualità proposta e con il tono del locale.
https://www.yelp.it/biz/zichella-torino;Caffè e cappuccini ottimi e da non sottovalutare il banco pasticceria. .. ottimo soprattutto il rapporto qualità/prezzo
https://www.yelp.it/biz/zheng-yang-torino-2;Innegabile la ricerca di materie prime di grande qualitàe il grande sforzo di servire piatti di valore.
https://www.yelp.it/biz/zelli-wine-bar-torino;primi favolosi buffet molto ricco caldo e freddo ottima qualità bella location ambiente familiare due dehor
https://www.yelp.it/biz/yu-jiasheng-torino;Il sushi é buono: il pesce fresco e il riso saporito..
https://www.yelp.it/biz/younger-pub-bari;La qualità è nella media e per il rapporto qualità prezzo non ne vale proprio la pena
https://www.yelp.it/biz/yoshi-bar-torino;Piatti fantasiosi e pesce molto fresco, il personale è molto attento e gentile e i prezzi non sono esorbitanti.
https://www.yelp.it/biz/waxy-torino;Scelta di birre alla spina e cibo di buona qualità.
https://www.yelp.it/biz/wasabi-torino;La qualità delle materie prime e la cura della preparazione dei piatti è stata sempre costante e di livello.
https://www.yelp.it/biz/walima-torino;Una piacevole esperienza per chi si vuole immergere in un'altra cultura, quella marocchina, particolare.
https://www.yelp.it/biz/volver-torino-2;Il livello della carne è di buona qualità anche se si potrebbe curare di più i piatti.
https://www.yelp.it/biz/vo-torino;Adeguato il rapporto qualità prezzo (in sei, con i vini, poco più di 60 € a testa).
https://www.yelp.it/biz/vittoria-torino-3;I prezzi sono un pò alti ma paghi veramente con piacere quando ti alzi da tavola !
https://www.yelp.it/biz/vintage-torino;Cucina di ottimo livello con carta molto estesa dalla tradizione piemontese al pesce ce n'è per tutti i gusti.
https://www.yelp.it/biz/vinolento-torino;I piatti sono realizzati bene e con materie prime di qualità, peccato per l'uso della panna nei piatti provati.
https://www.yelp.it/biz/villa-somis-torino;Ottima la cura in ciascun piatto e scelta di ingredienti sempre freschissimi e si prima qualità!
https://www.yelp.it/biz/vermouth-anselmo-torino;Rapporto qualità prezzo pessimo. andateci se volete apparire non se volete mangiare bene.
https://www.yelp.it/biz/verdi-d-indivia-torino;Il cibo è di ottima qualità e molto buono, le porzioni sono abbondanti,i prezzi contenuti e le torte sublimi!
https://www.yelp.it/biz/vanilla-torino;Gelato con ingredienti di qualità e gusti classici e non ma sempre sorprendenti, il gusto del mese di agosto?
https://www.yelp.it/biz/urban-bari;Il menù di Urban varia giornalmente e si basa sulla stagionalità e la qualità delle materie prime.
https://www.yelp.it/biz/turet-torino;Il rapporto qualità - prezzo è adeguato, ci ritornerei sicuramente per provare la terrazza con vista su piazza Solferino.
https://www.yelp.it/biz/tre-galline-torino-2;Ciò che è eccellente è il cibo e in particolare l'alta qualità delle materie prime, cucinate con sapienza tradizionale.
https://www.yelp.it/biz/tre-galli-torino-2;Ottimo posto x una cena davvero squisita Rapporto qualità prezzo più che giusto Fantastici i formaggi ed i primi
https://www.yelp.it/biz/trattoria-vineria-da-ale-torino;Il personale gentile e cortese, il cibo ottimo e genuino, locale semplice ma ben arredato e pulito.
https://www.yelp.it/biz/trattoria-valenza-torino;Gradevole ambiente all'interno Apprezzabile velocità nel ricevere i piatti richiesti: tutto di buona qualità, porzioni médie.
https://www.yelp.it/biz/trattoria-spirito-santo-torino-2;A torino ci sono numerose ottime gelateria ma questa le batte tutte per il rapporto qualità - prezzo.
https://www.yelp.it/biz/trattoria-pizzeria-mare-e-monti-torino;Buono anche il rapporto qualità prezzo così come la pulizia e la celerità del servizio ( anche troppo veloce).
https://www.yelp.it/biz/trattoria-mombercelli-di-antico-elena-torino;Il conto è giusto € 15- 20 il rapporto qualità prezzo ok.
https://www.yelp.it/biz/trattoria-da-cinzia-torino;Per quanto riguarda la scelta dei piatti è vasta e la qualità dei piatti e condimenti buona.
https://www.yelp.it/biz/trattoria-casalinga-torino;Posto tranquillo a due passi dal centro cucina semplice e veloce....verdure fresche funghi porcini una bontà!
https://www.yelp.it/biz/trattoria-alba-torino;Il menù è semplice ma gli ingredienti sono sempre freschi e ben rispecchiano la tradizione culinaria italiana.
https://www.yelp.it/biz/toscano-torino-3;La cucina e le materie prime sono veramente corrette , il menù non è molto ampio ma comunque sufficiente.
https://www.yelp.it/biz/torteria-berlicabarbis-torino;Il prezzo non rispecchia la qualità del cibo (prezzi alti per torte industriali).
https://www.yelp.it/biz/tobiko-torino;I prezzi sono alti come in altri ristoranti giapponesi ma la qualità del cibo non è altrettanto buona.
https://www.yelp.it/biz/tisaneria-della-consolata-torino;Prezzi abbastanza alti, ma in linea con altri dello stesso genre, considerando che si trova all'interno del quadrilatero romano.
https://www.yelp.it/biz/tio-chico-torino-2;Panini di ottima qualità ma soprattutto superlativa la birra, nel caso specifico la Janis divina.
https://www.yelp.it/biz/timeout-bari;Per quanto riguarda il cibo..offre un menu molto vario e c'e un buon rapporto qualità-prezzo.
https://www.yelp.it/biz/tiffany-lounge-torino;Prezzi alti rispetto ad altri competitor ( meglio avvisare il pubblico pagante )
https://www.yelp.it/biz/tiella-bari;L'ottimo rapporto qualità/prezzo e l'accoglienza del cliente fanno la differenza!
https://www.yelp.it/biz/the-stuart-pub-bari;�? stata una bella sorpresa mangiare ottimi hamburger di carne di qualità e stuzzicare nell'attesa delle ottime tartine variegate.
https://www.yelp.it/biz/the-queen-victoria-torino;Il posto è accogliente e d'estate vi è anche un dehor estivo.
https://www.yelp.it/biz/the-bakery-torino;Il tutto è preparato con ingredienti freschi di giornata  Personale gentile è disponibile  Consigliato!
https://www.yelp.it/biz/terra-di-mezzo-bari;Non è solo questione di offrire un buon servizio e buona qualità di cibi e bevande.
https://www.yelp.it/biz/teapot-torino;Considerando la qualità degli ingredienti i prezzi sono buoni e nella media per la categoria.
https://www.yelp.it/biz/taxi-pizza-torino;Il proprietario é simpaticissimo. la pizza é ottima, ma anche il kebab
https://www.yelp.it/biz/taverna-rossa-di-zappia-pasquale-torino;Pizza ottima, sia tradizionale che al Tegamino, anche ottima la birra alla spina, locale familiare e accogliente
https://www.yelp.it/biz/taverna-i-miserabili-torino;Si respira la passione per la buona cucina e l'ottimo vino che sicuramente è di alta qualità.
https://www.yelp.it/biz/taverna-delloca-torino;Quì si ha la possibilità di scegliere tra il menù alla carta o 3 diversi menù degustazione (piemontese/pesce/oca).
https://www.yelp.it/biz/tatami-bari;Ottima location forse un po' piccola ma molto accogliente Personale gentile Pesce fresco e di qualità ottimo sushi
https://www.yelp.it/biz/tasty-burger-torino;Sorpresa finale: un prezzo contenuto rispetto alla qualità e alla quantità del cibo consumato.
https://www.yelp.it/biz/taiki-bari;Qualità degli ingredienti sempre al top, abbinamenti originali e salse deliziose, un'ottima proposta fusion, presentata sempre in maniera impeccabile.
https://www.yelp.it/biz/taglio-torino;Ottima pizza leggera con ingredienti ottimi e di qualità, gli abbinamenti proposti sono diversi dal solito ma buonissimi.
https://www.yelp.it/biz/taco-bang-torino;La qualità del cibo ottima e il servizio veloce (vista anche la grande quantità di ordinazioni a portar via).
https://www.yelp.it/biz/tabit-bari;Il cibo di ottima qualità e lo si nota subito dai prodotti usati a km 0 e biologici.
https://www.yelp.it/biz/t-bone-station-torino;Non sono per nulla rimasta soddisfatta ma Soprattutto il rapporto qualità prezzo non ne vale la pena.
https://www.yelp.it/biz/sweet-lab-torino;Ottima la qualità dei prodotti, fresche e saporite le ricette, con ampia varietà nel menu.
https://www.yelp.it/biz/sushitao-bari;Sushi con menù all you can it di buona qualità e con prezzi nella media.
https://www.yelp.it/biz/sushi-yu-torino;La formula all you can eat a pranzo (11 € bevande escluse) è l'ideale grazie all'ottimo rapporto qualità/prezzo!
https://www.yelp.it/biz/sushi-sound-torino;Rapporto qualità-prezzo OTTIMO, a pranzo con 10€ mangi veramente in abbondanza, a cena sotto i 30€...
https://www.yelp.it/biz/sushi-j-torino;Il personale è gentile, il posto pulito, la qualità del SUSHI speciale :) Vasto assortimento, piatti per niente banali!
https://www.yelp.it/biz/storie-del-vecchio-sud-bari;STORIE DEL VECCHIO SUD è un punto di riferimento durante le serate fredde a Bari.
https://www.yelp.it/biz/stars-e-roses-torino;Gli ingredienti sono di qualità, il prezzo assolutamente giusto, se si pensa che si è in pieno centro.
https://www.yelp.it/biz/st-martin-torino;Le birre artigianali davvero di ottima qualità ed, con piacevole sorpresa, anche il cibo lo è stato altrettanto.
https://www.yelp.it/biz/spaghetteria-70cento-bari;Tutti gli ingredienti/condimenti sono freschi e genuini, si percepisce che il prodotto è qualitativamente buono.
https://www.yelp.it/biz/spada-reale-torino;Buon rapporto qualità-prezzo considerando anche la posizione, alle spalle di piazza Vittorio ed il locale ben arredato e pulito.
https://www.yelp.it/biz/soup-e-go-torino;Buona qualità del cibo soprattutto rapportata al prezzo, buonissime le insalate e certe zuppe sono veramente fantastiche.
https://www.yelp.it/biz/soul-kitchen-torino;La qualità dei piatti è buona e sono senz'altro ben presentati, anche se le porzioni sono ridotte.
https://www.yelp.it/biz/sotto-la-mole-torino;Cibo di buona qualità ma ambiente asettico con personale un po' scostante e poco collaborativo .
https://www.yelp.it/biz/solferino-torino;Personale molto gentile e disponibile, porzioni abbondanti, piatti di qualità, ampia scelta sia di carne che di pesce.
https://www.yelp.it/biz/sir-francis-drake-torino;I prezzi super competitivi 3.5 euro per la media e il rapporto qualità prezzo ottimo.
https://www.yelp.it/biz/singapore-torino;Del servizio non ci si può lamentare:il personale è gentile e i piatti arrivano subito.
https://www.yelp.it/biz/simini-giuliano-torino;Ristorante che offre pesce molto fresco di grande qualita', il personale gentile e competente ottimi prezzi, abbondanti le porzioni.
https://www.yelp.it/biz/simbad-kebab-torino;Piatti ben preparati con ingredienti freschi, ampia scelta nel menu, ottimo rapporto qualità/prezzo, personale gentile.
https://www.yelp.it/biz/silvano-torino-2;Ogni gusto ha il suo inconfondibile sapore e si avverte la qualità e la semplicità delle materie prime.
https://www.yelp.it/biz/signorvino-torino;Tutto confermato (buona qualità dei cibi, quantità corrette, prezzi ragionevoli, personale gentile...) in un ambiente decisamente più bello.
https://www.yelp.it/biz/sicomoro-torino;Pizza ottima (notevole l'impasto integrale disponibile per ogni tipo di pizza) e birra Weiss di qualità.
https://www.yelp.it/biz/sicily-bar-torino;Locale molto carino pulito e accogliente Personale gentile ed educato Brioches di tutti i tipi fresche e buone.
https://www.yelp.it/biz/sibir-torino-2;Il rapporto qualità prezzo è giusto e anche la quantità di cibo servito per ogni piatto.
https://www.yelp.it/biz/shore-torino;I cocktail sono molto buoni e il cibo non è da meno in quanto di buona qualità e varietà.
https://www.yelp.it/biz/shodai-bari;Il sushi viene preparato con materie prime di eccellenza, a cominciare dal riso, di qualità e cotto alla perfezione.
https://www.yelp.it/biz/sharazad-torino;Rapporto qualità-prezzo molto molto buono.Una bella scoperta a pochi passi da Via Garibaldi.
https://www.yelp.it/biz/shannon-torino;Prezzi nella norma, parcheggi in zona non tantissimi.
https://www.yelp.it/biz/shamrock-inn-torino;Il locale è molto bello ed originale il cibo è ottimo e che dire delle birre....una più buona dell'altra.
https://www.yelp.it/biz/shaka-brah-torino;Ottimo servizio buona scelta dei vini spiegati con grande competenza, preantipastino con shot gratuito.
https://www.yelp.it/biz/sfashion-cafe-torino;Particolarmente consigliato per il pranzo: il rapporto qualità / prezzo del menù fisso è molto valido.
https://www.yelp.it/biz/seven-up-torino;Qualità del cibo nella media - prezzi corretti - servizio veloce sicuramente si può trovare di meglio in zona
https://www.yelp.it/biz/serranos-torino;La paella è su ordinazione ed è preparata con prodotti freschi e di prima qualità.
https://www.yelp.it/biz/sen-mi-ya-torino-2;Il sushi era mediamente buono e il prezzo è accessibile anche considerando la buona qualità del cibo.
https://www.yelp.it/biz/sciuscia-pizzeria-torino;E' possibile inoltre mangiare con caraffe da un litro di birra (di buona qualità) a un prezzo equo.
https://www.yelp.it/biz/scapadaca-torino;Il cibo è ottimo e vario, così come i cocktail, ben fatti.
https://www.yelp.it/biz/scannabue-torino;Buon rapporto qualità prezzo, non da sottovalutare perché spesso si pagano più le parole che la qualità.
https://www.yelp.it/biz/scalo-vanchiglia-torino;Qualità dei prodotti indubbiamente buona, ma prezzi esageratamente elevati per le porzioni servite.
https://www.yelp.it/biz/sbrodolone-torino;Negozio molto piccolo ma personale molto gentile e accogliente!
https://www.yelp.it/biz/sara-caffetteria-torino;I prezzi sono più alti della media, ma si ribadisce l'alto livello dei prodotti.
https://www.yelp.it/biz/sandrino-bari-2;una valida alternativa a Martinucci per quanto riguarda il gelato nel centro storico ingredienti freschi e di qualità consigliato
https://www.yelp.it/biz/sandrino-bari;Ottima la qualità, tutto buonissimo, ottimo rapporto qualità prezzo.
https://www.yelp.it/biz/san-giorgio-torino;Dunque... kebab buoni ingredienti e pasta sono notevoli.. peccato il personale!!!
https://www.yelp.it/biz/sa-corte-noa-torino;Portate con buone materie prime cucinate in modo gustoso, ma alcuni piatti eccessivamente scarsi come quantità, rispetto al costo.
https://www.yelp.it/biz/rossosapore-torino;Cibo veramente di qualità ( bravi a scegliere le materie prime) e sanno sapientemente come prepararlo .
https://www.yelp.it/biz/rossopomodoro-torino;Classica pizza stile napoletano con buoni ingredienti, come da consuetudine della catena, pizza non buonissima un po' ciccosa
https://www.yelp.it/biz/rivareno-torino;Si percepisce subito che è un gelato artigianale e la qualità è ottima e i prezzi sono nella media.
https://www.yelp.it/biz/ristrot-guviol-torino;Gli stessi piatti è possibile trovarli a pari qualità sicuramente a prezzo inferiore in altri ristoranti a Torino.
https://www.yelp.it/biz/ristrorante-la-chicca-torino-2;Materie prime di qualità, però porzioni un po' piccine, il locale veramente grazioso...un unico neo, l'aria condizionata NON funzionante!
https://www.yelp.it/biz/ristoranti-tropicana-torino;I piatti sono abbondanti e di buona qualità, oltre alla sala interna c'è anche un dehor chiuso.
https://www.yelp.it/biz/ristoranti-tromlin-torino;Il cibo molto piemontese cucinato con prodotti molto ma veramente molto a km.0 ed un ottimo rapporto qualità prezzo.
https://www.yelp.it/biz/ristoranti-taverna-delle-rose-torino-2;Prezzi un po' alti ma giustificati dalla buona qualità del cibo e dalle porzioni generose.
https://www.yelp.it/biz/ristoranti-sardegna-torino;Rapporto qualità prezzo perfetto, anzi, oserei dire che per la qualità e quantità del cibo i prezzi sono bassi.
https://www.yelp.it/biz/ristoranti-alba-torino;Menù vario eseguito con cura e con materie prime che si sente essere fresche e di ottima qualità.
https://www.yelp.it/biz/ristorante-ratatui-torino-2;I prezzi sono bassi e la qualità dei cibi è di buon livello.
https://www.yelp.it/biz/ristorante-peppino-torino;Ottimo rapporto qualità prezzo, per 9 euro si pranza (10 euro per la cena invece) rimanendo sazi e soddisfatti.
https://www.yelp.it/biz/ristorante-consorzio-torino;La cucina è ispirata alla tradizione piemontese ma con l'intrusione piacevole di alcune materie prime provenienti da altre regioni.
https://www.yelp.it/biz/ristopizza-giampaolo-bari;Buono il vino bianco e la proposta di 'piatto unico primo+secondo di pesce.
https://www.yelp.it/biz/re-vittorio-bari;Il locale è carino ed il personale gentile e accogliente.
https://www.yelp.it/biz/re-sole-torino-2;Personale gentile e cordiale, prezzi leggermente sopra la media ma per quello che offrono vanno bene così!
https://www.yelp.it/biz/raspino-lorenzo-torino;La gentilezza e l'effcienza sono immutate così come la qualità dei prodotti.
https://www.yelp.it/biz/quo-vadis-torino-2;Sorpresa piacevole al momento del conto: molto inferiore a quello di un tempo: ottimo rapporto qualità/prezzo.
https://www.yelp.it/biz/quelli-che-ben-pensano-torino;Pizza ed ingredienti di ottima qualità.. 5 stelle anche per l 'originalità nella presentazione delle portate!
https://www.yelp.it/biz/quelli-che-ben-pensano-2-torino;Qualità dei prodotti e prezzi sinceri, come i gestori , attenti e disponibili alle esigenze dei clienti!
https://www.yelp.it/biz/quattro-soldi-torino;Il ristorante ha un'ampia offerta di piatti e pizze di ottima qualità, il personale è molto cortese e cordiale.
https://www.yelp.it/biz/quaglia-teresa-torino;Ottima la qualità dei piatti, alcuni molto raffinati (prevalentemente a base di pesce).
https://www.yelp.it/biz/punto-pizza-di-moro-michel-torino;Ingredienti freschi e di alta qualità, prezzo basso, buon servizio, una grande selezione di pizza, atmosfera calda e amichevole.
https://www.yelp.it/biz/primaepoi-torino-3;Veloce il servizio con personale gentile e professionale e cibi genuini e presentati molto bene.Complimenti, non cambiate!
https://www.yelp.it/biz/prima-e-poi-torino;Avevano una gran quantità  di cozze di tutti i tipi diversi sul menu, oltre a pizze, pesce, pasta, ecc.
https://www.yelp.it/biz/premiata-osteria-dellhermada-torino;La cortesia nel servizio da parte dei camerieri e l'ottima qualità del cibo hanno reso la serata davvero piacevole.
https://www.yelp.it/biz/porto-di-savona-torino;Prezzi alti per la qualità del menù ma adeguati per la posizione centralissima.
https://www.yelp.it/biz/porcaloca-torino;Ottimo rapporto qualità prezzo, la pizza è buona ma il loro punto di forza è sicuramente la farinata: buonissima!
https://www.yelp.it/biz/poormanger-torino;Materie prime genuine, che ben si amalgamano con la patata, in un condensato di sapori originali e appaganti.
https://www.yelp.it/biz/ponte-regina-torino;Il prezzo e' giusto per la qualita' delle materie prime e per la cortesia.
https://www.yelp.it/biz/pollastrini-torino;I prodotti sono di ottima qualità e anche i vini, sia il bianco che il nero sono soddisfacenti.
https://www.yelp.it/biz/platti-torino-2;Ottimo anche il servizio pranzo con enorme scelta di tramezzini di gran qualità fatti al momento.
https://www.yelp.it/biz/pizzeria-vecchio-forno-garibaldi-torino;Pizza di ottima qualità, disponibile sia nel formato più diffuso che al padellino, oggi nuovamente richiesto da molte persone.
https://www.yelp.it/biz/pizzeria-vecchia-londra-torino;Regge bene il rapporto qualità / prezzo, ideale per chi vuole mangiare tanto senza moltissime pretese.
https://www.yelp.it/biz/pizzeria-tarantini-al-cancello-rotto-bari;Ottimo ristorantae con vasta scelta tra pizza carne pesce e primi piatti ottima cucina personale gentile.
https://www.yelp.it/biz/pizzeria-spaccanapoli-torino;Servizio veloce, personale gentilissimo, meglio i taglieri di pizza che le classiche, cibo di buona qualità, prezzi nella media.
https://www.yelp.it/biz/pizzeria-silvestro-torino;Tutto di ottima qualità e fatto al meglio.
https://www.yelp.it/biz/pizzeria-queendici-torino;Una pizzeria accogliente e con prodotti di qualità ottima per un pranzo di lavoro se si è in zona.
https://www.yelp.it/biz/pizzeria-pizza-e-altro-bari;Sul rapporto qualità prezzo condivido i commenti di altri ospiti, è un po' caro, ma tutto sommato non eccessivo.
https://www.yelp.it/biz/pizzeria-pieros-torino;Gli ingredienti sono di qualità e il prodotto è perfettamente digeribile.
https://www.yelp.it/biz/pizzeria-petit-roi-bitritto;Pizza d alta qualità  e servizio impeccabile...dimostrato anche dai clienti VIP che hanno cenato nel locale....SICURAMENTE CI TORNERO !!
https://www.yelp.it/biz/pizzeria-osteria-dal-vassallo-bari;Pizza ottima cotta nel forno a legna con ingredienti freschi e prezzi nella media.
https://www.yelp.it/biz/pizzeria-la-tana-bari;La scelta di birre è molto limitata (due o tre ma di buona qualità) così come quella dei vini.
https://www.yelp.it/biz/pizzeria-l-orchidea-torino;La pizza è ottima: sottile, di grandi dimensioni e realizzata con ingredienti di qualità.
https://www.yelp.it/biz/pizzeria-il-pirata-bari;Locale semplice come arredamento e in ottima posizione con ampio parcheggio .prezzo adeguato alla qualità e quantità
https://www.yelp.it/biz/pizzeria-ideal-di-atzori-alberto-torino;Ottimo anche il rapporto qualità prezzo :) �? vicina anche al cinema, ideale per le serata pizza&cinema!
https://www.yelp.it/biz/pizzeria-gino-torino;Il rapporto qualità prezzo è ottimo e il personale molto gentile e disponibile.
https://www.yelp.it/biz/pizzeria-giampy-di-mazzola-giuseppe-torino;pranzo veloce di lavoro. pesce spada, patate acqua caffè.. gentili e veloci: consigliato. locale moderno e semplice.
https://www.yelp.it/biz/pizzeria-gelateria-cecchi-torino;Servizio veloce, ottima anche per la pausa pranzo, personale gentile e cortese. qualità prezzo ottima!
https://www.yelp.it/biz/pizzeria-fratelli-la-bufala-torino;L'impasto della pizza è leggero e digeribile e gli ingredienti di ottima qualità.
https://www.yelp.it/biz/pizzeria-enzo-e-ciro-di-fraddosio-v-c-bari;Qualità prezzo equilibrato, Lo chef offre una gamma ampia di piatti e varietà di preparazioni.
https://www.yelp.it/biz/pizzeria-enzo-bari;Enzo è certezza di qualità a prezzo contenuto.
https://www.yelp.it/biz/pizzeria-dual-torino;Menù con materie prime selezionate ed un'offerta in grado di accontentare tutti senza la pretesa di sbalordire.
https://www.yelp.it/biz/pizzeria-di-cosimo-bari;Verso il 2008-2010 già non erano più buoni come una volta.. forse gli ingredienti, non si sa.
https://www.yelp.it/biz/pizzeria-da-michele-torino;Nel complesso un buon rapporto qualità prezzo e realizzazione da riprovare per la parte mancante pietanze con carne.
https://www.yelp.it/biz/pizzeria-da-donato-bari;Servizio veloce, personale cordiale, cibo di qualità, sono solo alcuni aggettivi per definire questo buonissimo ristorante/pizzeria!
https://www.yelp.it/biz/pizzeria-da-candido-torino;Gli ingredienti ottimi fanno sì che le pizze, anche quelle più originali, siano sempre delicate e digeribili.
https://www.yelp.it/biz/pizzeria-d-autore-bari;Pizza sottile alla barese di ottima qualità e a prezzo inferiore alla media delle pizze di qualità in Bari.
https://www.yelp.it/biz/pizzeria-continental-pizzorante-bari-2;La pizza è ottima, il ristorante altrettanto, ricco di antipasti freschi e a base di pesce.
https://www.yelp.it/biz/pizzeria-chez-jo-bari;Qualità ottima delle portate Molto buona la pizza Buonissimi gli antipasti Cordialità del servizio Da provare ...
https://www.yelp.it/biz/pizzeria-bella-vita-torino;Ingredienti ottimi e freschi, si sente la qualità.
https://www.yelp.it/biz/pizzeria-baraonda-bari;Gli ingredienti sono sempre freschi e l'estate si può gustare la pizza al fresco e soprattutto in relax :)
https://www.yelp.it/biz/pizzeria-au-lapin-agile-torino-2;Eccellente la qualità dei prodotti, e l'attenzione del personale di servizio a prestare attenzione ai clienti.
https://www.yelp.it/biz/pizzeria-amalfi-torino;Bisogna passare più spesso: pesce sempre fresco e cucinato magistralmente dal cuoco egiziano.
https://www.yelp.it/biz/pizzeria-alloca-di-pulcinella-torino;Qualità degli ingredienti, gentilezza e velocità del servizio anche nei momenti più affollati.
https://www.yelp.it/biz/pizzeria-aladino-bari;La pizzeria offre dei menù a prezzo fisso che a dir la verità hanno un rapporto qualità-prezzo assolutamente giusto.
https://www.yelp.it/biz/pizzeria-al-buco-bari;Niente da dire sulla qualità degli ingredienti, peccato non avere tempo e possibilità di gustarli.
https://www.yelp.it/biz/pizzeri-lapislazzulo-torino;Anche il personale e gentile e molto simpatico Qualità prezzo nella media ( 3 pizze e una farinata 30€)
https://www.yelp.it/biz/pizze-e-cozze-torino;I prezzi sono un po' più alti della media di questa città ma ampiamente giustificati dalla qualità dell' insieme.
https://www.yelp.it/biz/pizza-speedy-torino;Servizio veloce come promette il nome, proprietario e dipendenti cordiali, ma soprattutto pizze ottime.
https://www.yelp.it/biz/pizza-pistrocchio-torino;Locale spartano personale gentile e disponibile, servizio velocissimo e pizza di gran qualità.
https://www.yelp.it/biz/pizza-bon-bari;Pizza di ottima qualita' e prezzo, da non perdere il calzone di cipolla e di carne.
https://www.yelp.it/biz/pizza-ad-hoc-torino;Pizza ottima, impasto leggero e sottile, ingredienti saporiti e proposte originali nel menu (fidatevi anche delle più 'eccentriche).
https://www.yelp.it/biz/piu-di-un-gelato-torino;Gusto genuino e capisci che le materie prime sono ottime e trattate come si deve.
https://www.yelp.it/biz/pistacchio-torino;I croissant sono di ottima qualità e c'è molta scelta di gusti!
https://www.yelp.it/biz/piper-pub-torino;Vastissima scelta di birre di buona qualità.
https://www.yelp.it/biz/piola-cianci-torino;Il rapporto qualità prezzo è buono ma non è accettabile essere serviti in questo modo.
