url;review
https://www.yelp.it/biz/buosi-torino;Scelta di vini di qualità Assolutamente consigliato
https://www.yelp.it/biz/bunet-torino;La qualità dei prodotti è eccellente, dal caffè alla pasticceria prodotta in loco al reparto salato.
https://www.yelp.it/biz/bucks-g-d-34-torino-2;In conclusione é un pub nella media con prezzi leggermente alti.
https://www.yelp.it/biz/bruschetteria-pautasso-di-stecco-susanna-torino;Il menù è molto vario ed il cibo è di ottima qualità pur nella sua semplicità nella presentazione.
https://www.yelp.it/biz/briss-torino;Le proposte in menu sono varie e in quantità logica per poter mantenere materie prime sempre fresche.
https://www.yelp.it/biz/brek-torino;Molto peggiorato per scarsa qualità dei cibi e maleducazione del personale molto poco professionale.
https://www.yelp.it/biz/brasserie-bordeaux-torino-2;Piatti molto ricercati materie prime di qualità cucinate servite e presentate in maniera impeccabile abbinamenti che lasciano piacevolmente sorpresi!!!
https://www.yelp.it/biz/braceria-signorile-bari;La formula è la classica di questo tipo: scegli la carne (qualità e quantità desiderate), loro te la cucinano.
https://www.yelp.it/biz/bottega-baretti-moncalieri;Il rapporto qualità prezzo è accettabile non troppo caro ma neanche convenientissimo però merita!!
https://www.yelp.it/biz/botta-bari;Ambiente rustico familiare, servizio veloce, personale gentile, professionale ed efficiente, ingredienti freschissimi, possibilità di scegliere tra varie farine.
https://www.yelp.it/biz/borgo-dora-torino;Le porzioni sono abbondanti e di ottima qualità.
https://www.yelp.it/biz/borgo-antico-bari;Dunque pizza e rapporto qualità prezzo pessimo.
https://www.yelp.it/biz/bollicine-di-gigliotti-e-de-bartolo-torino;La pizza è sempre ottima, ben cotta e ben condita.
https://www.yelp.it/biz/boja-fauss-torino-2;Eccellente la qualità del cibo e la presentazione dei piatti, personale disponibile , paziente , gentile e simpatico .
https://www.yelp.it/biz/blue-eyes-bari;Posto giusto per trascorrere una serata in compagnia mangiando e bevendo secondo la giusta qualità e prezzo rimanendo soddisfatti.
https://www.yelp.it/biz/blah-blah-torino;Certo che se volete prendervi un vino non aspettatevi l'ottima qualità (la scelta è pure poco varia).
https://www.yelp.it/biz/black-jack-torino;Pizza ottima qualità prezzo eccellente Bisognerebbe solo rinnovare il locale ma per il resto ottima.
https://www.yelp.it/biz/black-e-white-bari;Ottima qualità del cibo, piatti molto ricercati, si va da piatti tradizionali a vere e proprie sperimentazioni.
https://www.yelp.it/biz/black-angus-turin;Con la carne viene sempre servita un'abbondante porzione di verdure di contorno.
https://www.yelp.it/biz/bistrot-turin-torino;Ottimo il rapporto qualità-prezzo e anche la posizione in quanto si trova a due passi da piazza castello.
https://www.yelp.it/biz/birrificio-torino-torino;ottima birreria artigianale. birra di ottima qualità, buon cibo (consigliato: stinco di maiale), ottimo servizio. prezzi nella media.
https://www.yelp.it/biz/birreria-la-divina-commedia-torino;Gli ingredienti sembrano di buona qualità,ed il gusto è davvero buono (merito anche della cottura al forno a legna).
https://www.yelp.it/biz/birreria-don-giovanni-torino;Buon locale ottima qualità prezzo sulle birre ... sul cibo porzioni un po' piccine ... ma locale  !
https://www.yelp.it/biz/biffi-valenzano;Locale con gazebo esterno (riscaldato d'inverno) e ottimo rapporto qualità prezzo.
https://www.yelp.it/biz/bicyclette-torino;Prezzi medio-bassi Buone crepes e basta scelta Ottima scelta di birre di qualità Da provare..
https://www.yelp.it/biz/biberon-torino;Qualità prezzo superlativo per la zona !!!
https://www.yelp.it/biz/biancofiore-bari;Pesce freschissimo, servizio impeccabile, varietà dell'offerta molto apprezzabile, eccellenti i suggerimenti dello staff su vini e piatti del giorno.
https://www.yelp.it/biz/biancofarina-bari;Va da sé che tanto alla qualità dei prodotti, quanto all'efficienza del servizio, siano poi commisurati i nostri prezzi.
https://www.yelp.it/biz/berbel-torino;Andateci previa prenotazione perché non è grande il locale ma è grande la qualità del servizio e del cibo!!!!
https://www.yelp.it/biz/bene-cos%C3%AC-torino;Ottima la scelta della musica in sottofondo, e il volume era perfetto per riuscire a chiacchierare.
https://www.yelp.it/biz/beaubar-torino;Un bellissimo ambiente con molta varietà di scelta e un ottimo rapporto qualità/prezzo, panini ottimi, personale accogliente.
https://www.yelp.it/biz/bastimento-torino;Le materie prime sono eccellenti e la preparazione ne esalta profumi e sapori senza eccedere in inutili virtuosismi.
https://www.yelp.it/biz/barnum-torino;Il menu nonostante nn sia estremamente vario ha una buona qualità ed è tutto buono!
https://www.yelp.it/biz/bari-napoli-bari;ottimo rapporto qualità prezzo. resta un must delle risto pizzerie della città. con qualità del cibo e buon bere
https://www.yelp.it/biz/barbagia-di-ollolai-torino;Il rapporto qualità prezzo è eccellente e l'accoglienza del proprietario è veramente unica.
https://www.yelp.it/biz/baratti-e-milano-torino-2;Entrambe le portate erano molto abbondanti e di ottima qualità, fino a questo punto niente da dire.
https://www.yelp.it/biz/bar-torrefazione-beccuti-torino;Altra storica caffetteria torinese ed un punto di riferimento per gli amanti del caffè di qualità.
https://www.yelp.it/biz/bar-telebari-bari;I prezzi sono un po' alti, tuttavia a fronte di una qualità immutata nel tempo.
https://www.yelp.it/biz/bar-miramare-bari;bar con ottima vista sul porto con buoni prodotti di pasticceria e gelateria e personale gentile ed efficente
https://www.yelp.it/biz/bar-marconi-di-torre-francesco-torino;Nel menu vi è un'ampia e ottima scelta di tè e altre bevande, a prezzi abbordabili.
https://www.yelp.it/biz/bar-imperfetto-di-da-campo-giuseppe-torino;Le verdure sono fresche e cucinate benissimo.
https://www.yelp.it/biz/bar-del-duomo-torino;ristorante di nuova gestione familiare. proposta di menù con molte verdure e primi piatti. personale accogliente e servizio veloce.
https://www.yelp.it/biz/banco-vini-e-alimenti-torino;Rapporto qualità prezzo giusto forse qualche ricarico in meno sul vino sarebbe giusto.
https://www.yelp.it/biz/banco-di-sicilia-torino;Cibo davvero ottimo, tutto molto di qualità e per tutti i tipi di palati.
https://www.yelp.it/biz/bacco-bari;�?' tutto quello che vorresti trovare in un ristorante : qualità' dei cibi, maestria nella preparazione, cantina superba!!!!!
https://www.yelp.it/biz/baccanale-torino;Qualità eccellente nelle materie prime, porzioni abbondanti e piatti tradizionali, gustosi e cucinati benissimo...
https://www.yelp.it/biz/babayaga-bari;Peccato per questo aspetto di forma perché la qualità dei prodotti e il rapporto con il prezzo sono buoni.
https://www.yelp.it/biz/b2-burger-and-beer-torino;Ottimi gli ingredienti, originali gli hamburger proposti .... abbinati a una buona scelta di birre artigianali.
https://www.yelp.it/biz/b-eat-torino;Il rapporto qualità prezzo è eccellente e i prodotti utilizzati si sente che sono di qualità.
https://www.yelp.it/biz/augusto-torino;Conto finale onesto sia per la qualità dei prodotti che per gli interni arredati in modo suggestivo, consigliato!
https://www.yelp.it/biz/astoria-torino;In generale è un posto accogliente, interessante.
https://www.yelp.it/biz/art-lunch-di-jo-cafe-torino;Il cibo è di buona qualità, ben cucinato e buona è anche la presentazione dei piatti.
https://www.yelp.it/biz/arigato-torino;pesce di ottima qualità e freschezza (i pezzi di sashimi erano lucidi, compatti, senza odore e di buon spessore).
https://www.yelp.it/biz/arcadia-torino-4;Ottima scelta che copre un po' tutti i gusti: piemontese, pesce e ... esotico (con il sushi).
https://www.yelp.it/biz/antonelli-torino;Rapporto qualità- prezzo buono per essere in una delle piazze più turistiche della città
https://www.yelp.it/biz/antico-balon-torino;Puntiamo alla qualità e non alla quantità Per un po' di attesa ci sta il Sabato sera Buona giornata
https://www.yelp.it/biz/antichi-sapori-torre-a-mare;Ottima la qualità dei prodotti , gradito anche il cambio del piatto ogni due o tre assaggi.
https://www.yelp.it/biz/antica-trattoria-del-sole-torino;E il rapporto tra la qualità del vostro pasto e il conto finale sarà la finale, piacevole sorpresa !!
https://www.yelp.it/biz/antica-salumeria-torino;Buono il rapporto qualità prezzo : 9 euro in due.
https://www.yelp.it/biz/angolo-del-parin-torino;Prezzo medio-alto ma prodotti ottimi e personale assolutamente cordiale e coinvolgente nel descrivere i piatti per aiutare nella scelta.
https://www.yelp.it/biz/anema-e-cozze-torino;Certo il pesce fresco e ben cucinato non è piatto economico, ma lo si paga per quel che vale.
https://www.yelp.it/biz/amici-miei-torino;Da sottolineare anche la vasta gamma di scelta di pizze con impasto 'gluten free e l'ottima qualità degli ingredienti.
https://www.yelp.it/biz/america-graffiti-torino;Porzioni medio-abbondanti per prezzi forse un po' troppo alti rispetto alla qualità di ciò che viene poi presentato.
https://www.yelp.it/biz/alla-portata-torino;Tuttavia bravi per il rapporto qualità prezzo e la simpatia.
https://www.yelp.it/biz/alla-lettera-torino;Ingredienti di qualità e pizza molto buona a prezzi nella media e accessibili.
https://www.yelp.it/biz/alivella-torino;Le materie prime usate sono di alta qualità ed i piatti ben preparati.
https://www.yelp.it/biz/aldente-torino;Posto carino e personale gentile e professionale...il cibo buono e di buona qualità...il problema si pone sul rapporto quantità/prezzo!
https://www.yelp.it/biz/alberto-marchetti-torino-2;Alberto Marchetti è ormai una garanzia: gelato con materie prime di alta qualità e che non stanca mai.
https://www.yelp.it/biz/alberto-marchetti-torino;Alberto Marchetti è ormai una garanzia: gelato con materie prime di alta qualità e che non stanca mai.
https://www.yelp.it/biz/alberosole-bari;Porzioni un po' piccole in funzione del prezzo ma ribadisco di ottima qualità.
https://www.yelp.it/biz/al-tegamino-moncalieri;Ingredienti di qualità che fanno decisamente la differenza, anche il locale è molto bello e il personale molto cortese.
https://www.yelp.it/biz/al-sorso-preferito-bari;Primo super abbondante e prezzi nella norma: antipasto a 15 euro e primo con pesce a 20.
https://www.yelp.it/biz/al-savoia-bari;Forse un tempo era un riferimento per qualità e cortesia ma ora non più.
https://www.yelp.it/biz/al-raffaello-bari;Il conto è stato giusto per un pranzo di ottima qualità ( non è un locale caro).
https://www.yelp.it/biz/al-paradise-palese;Ottima location Pesce e frutta di mare freschissimi Buona la pizza Personale gentile e professionale Rapporto qualità prezzo eccellente
https://www.yelp.it/biz/al-grassi-torino-2;La loro caratteristica e' il pesce crudo e su queste portate la scelta e' ampia e il pesce fresco.
https://www.yelp.it/biz/al-garamond-torino;Veramente un posto in cui devi andare se vuoi goderti un'esperienza gastronomica ad un giustissimo rapporto qualità prezzo!
https://www.yelp.it/biz/al-cantuccio-bari;Vasta selezione di pizze di ottima qualità, i prezzi sono molto competitivi!
https://www.yelp.it/biz/al-cacimperio-torino;Corretto il rapporto qualità prezzo anche per il vino: attenta scelta di cantine e uvaggi strepitosi.
https://www.yelp.it/biz/al-bicerin-torino;Gli ingredienti di qualità superlativa si sentono e si apprezzano, così come l'ambiente di sapore antico (1763).
https://www.yelp.it/biz/al-111-bari-2;Rapporto qualità prezzo più che eccellente, soprattutto per un locale situato in una via principale del centro di Bari.
https://www.yelp.it/biz/ai-2-ghiottoni-bari-2;Piatti buonissimi ( antipasti crudi e caldi con 2 primi tagliolini e risotto ) abbondanti .qualità prezzo ottima .
https://www.yelp.it/biz/adonis-torino;Personale gentile, buona scelta di crèpes salate, ottima presentazione dei piatti, molto elaborati e con ingredienti di prima qualità.
https://www.yelp.it/biz/a6-sciamadda-torino;Personale davvero simpatico Cibo ottimo e di qualità Prezzi contenuti e locale molto carino.
https://www.yelp.it/biz/a-vucciria-torino;Ottima qualità del cibo , menù ricco di squisite leccornie ( anche della cucina siciliana ).
https://www.yelp.it/biz/a-picciridda-torino;Vini siciliani e non di buon livello ed i prezzi sempre accettabili e proporzionati alla qualità dei prodotti.
https://www.yelp.it/biz/a-la-merenda-sinoira-torino;La cortesia nel servizio da parte dei camerieri e l'ottima qualità del cibo hanno reso la serata davvero piacevole.
https://www.yelp.it/biz/a-casa-di-pulcinella-torino;Tutte ricche e con buoni ingredienti: una margherita, una salamino, una spaccalegna senza patate ma con 'nduja (fuori menu).
https://www.yelp.it/biz/500-calorie-torino;Ideale per una pausa pranzo veloce e leggera.
https://www.yelp.it/biz/1610-bagel-torino;La scelta di bagel è varia e gli ingredienti sono di ottima qualità e il proprietario è gentilissimo.
https://www.yelp.it/biz/%C3%A8-cucina-cesare-marretti-torino;I prodotti sono freschi e preparati ogni giorno e il menu cambia ogni giorno.
