url;review
https://www.yelp.it/biz/kido-ism-torino;La cucina offre piatti particolari simil giapponesi con abbinamenti interessanti e qualità delle materie prime di ottimo livello.
https://www.yelp.it/biz/kensho-torino;Cucina eccellente con prodotti freschi di qualità, sapiente abbinamento di sapori e colori per una vera esperienza sensoriale .
https://www.yelp.it/biz/kashmir-torino-2;Molto consigliato per l'ottimo rapporto qualità/prezzo: buon cibo e ottimo prezzo.
https://www.yelp.it/biz/karmacola-torino;Ottimo per passare una serata immersi nei profumi e i sapori dell'Oriente ad un ottimo rapporto qualità prezzo
https://www.yelp.it/biz/jumping-jester-torino;Il wrap preso aveva ingredienti molto freschi ed era ottimo, accompagnato da una Guinness è stato felicemente trangugiato.
https://www.yelp.it/biz/joys-pub-bari;Buona la qualità dei piatti e delle materie prime, ampliabile il menù.
https://www.yelp.it/biz/jolly-principi-di-piemonte-torino;Il rapporto qualità prezzo ne risente particolarmente.
https://www.yelp.it/biz/john-lennons-torino;Considerato il fatto che trattasi di un pub la cucina è molto buona e il servizio veloce ed efficiente...
https://www.yelp.it/biz/john-joy-torino;Buona la scelta dei vini e tutte le porzioni più che abbondanti ma la qualità è approssimativa.
https://www.yelp.it/biz/japs-torino-3;Il sushi é di buona qualità, il locale molto piccolo, spesso si rischia d non trovare posto..
https://www.yelp.it/biz/japs-torino-2;Pesce freschissimo e molta scelta sul menu, il ristorante è pulitissimo e il personale è gentile.....
https://www.yelp.it/biz/indiano-shri-ganesh-torino;La cucina è molto speziata e forte di gusto però tutto di ottima qualità.
https://www.yelp.it/biz/indian-street-food-torino;Sia del prezzo che della qualità e della quantità delle porzioni.
https://www.yelp.it/biz/in-vino-veritas-torino;Ottimo rapporto qualità prezzo, qualità del cibo eccelente, cantina ben rifornita.
https://www.yelp.it/biz/imbarco-perosino-torino;Antipasti a buffet di grande qualità, specie se si amano le tipicità piemontesi e torinesi, come mangiare dalla nonna!
https://www.yelp.it/biz/imbarchino-torino;Il locale è davvero carino..proprio sulla riva del Po.L'atmosfera é informale e il personale gentile e spiritoso!
https://www.yelp.it/biz/il-vicolo-torino;I piatti sono inaspettatamente abbondanti e di buona qualità, anche se non tutto è eccezionale.
https://www.yelp.it/biz/il-tabisca-turin;Il servizio è stato molto veloce e il posto è in piazza Vittorio quindi vince anche per la location.
https://www.yelp.it/biz/il-siculo-di-savona-monica-torino;Qualità prezzo perfetto al di sotto dello standard dei marchi in città
https://www.yelp.it/biz/il-sedile-bari;Personale gentile e zelante, clima accogliente, e location nel centro storico in uno dei punti più suggestivi della città!
https://www.yelp.it/biz/il-rustico-bari;Nella top 3 dei locali da me visitati per rapporto qualità prezzo.
https://www.yelp.it/biz/il-ristoro-dei-mercanti-torino;Ottimo per un pranzo veloce, ma genuino, se si è di passaggio per un visita in città.
https://www.yelp.it/biz/il-porto-torino;Servizio impeccabile, degustazione di antipasti favolosa, grigliata di pesce ottima ed abbondante come la zuppa di pesce.
https://www.yelp.it/biz/il-picchio-torino;Buona la qualità del pescato, logicamente surgelato e buona anche la cottura del tutto.
https://www.yelp.it/biz/il-peccato-torino;La cucina è varia (va dalla pizza ai secondi) ed è di buona qualità, manca solo qualche proposta vegana.
https://www.yelp.it/biz/il-padellino-torino;Migliorando la qualità dei prodotti si può ambire a molto di più.
https://www.yelp.it/biz/il-giglio-torino;I piatti proposti sono di buona qualità ed il rapporto con il relativo prezzo, è più che buono.
https://www.yelp.it/biz/il-gelato-amico-torino;Banco con pozzetti(come una volta)e l'attenzione alle materie prime e al gelato naturale/vegano molto marcato.
https://www.yelp.it/biz/il-gelatiere-bari-3;Solo prodotti freschi e non surrogati...se si ha voglia di mangiare un ottimo gelato è !!
https://www.yelp.it/biz/il-fornaccio-bari;ottimo panzerottata fritto ottimi prodotti servizio veloce habitat familiare locale pulito solo problemi di parcheggio
https://www.yelp.it/biz/il-cortiletto-torino-2;La cucina è di tradizione prettamente piemontese con un occhio attento alle materie prime di ottima qualità.
https://www.yelp.it/biz/il-caciucco-torino;Cucina di pesce di ottimo livello, il serivizio è molto curato ed il prezzo è assolutamente nella norma.
https://www.yelp.it/biz/il-buco-torino;Davvero il ristorante è elegantissimo curato nei dettagli e il proprietario è molto gentile.
https://www.yelp.it/biz/il-brigantino-torino;Il costo è medio basso (dai 10 € in sù) per la qualità delle materie prime!
https://www.yelp.it/biz/ij-brande-torino;Le porzioni non sono proprio abbondanti ma la qualità delle materie prime utilizzate è veramente degna di nota.
https://www.yelp.it/biz/ichiban-torino;Qualità mediocre ma per in pranzo veloce e abbonda va più che bene.
https://www.yelp.it/biz/ichi-torino;Che fine ha fatto il pesce fresco, servito quasi a temperatura ambiente così da poterne apprezzare il buon sapore?
https://www.yelp.it/biz/i-tre-scalini-torino;Un posto rustico stile anni 70/80... impasto ben lievitato e condimenti generosissimi e di buona qualità...
https://www.yelp.it/biz/i-tesori-bari;Buono il rapporto qualità-prezzo, purtroppo difficile il parcheggio per chi ci arriva in auto.
https://www.yelp.it/biz/i-soliti-ignoti-torino;I piatti invece sempre abbondanti e di buona qualità comprese le pizze.
https://www.yelp.it/biz/i-soliti-amici-torino;La qualità delle materie prime è ottima, il personale è sempre cordiale ed attendo alle necessità del cliente.
https://www.yelp.it/biz/huntsman-pub-torino;Pub sempre aperto buona selezione di birre e sicuramente buoni hamburger carne di buona qualità.... da tener presente!
https://www.yelp.it/biz/hua-li-du-torino;ristorante cinese molto buono curato nei particolari ottimo rapporto qualità-prezzo, una certezza in Torino. personale disponibile e premuroso.
https://www.yelp.it/biz/hua-dou-cheng-torino;Il menù è molto vario e gli ingredienti sono di ottima qualità.
https://www.yelp.it/biz/horas-kebab-torino;Ottimo rapporto qualità prezzo e sempre apprezzatissimo the verde a fine pasto, offerto dalla casa.
https://www.yelp.it/biz/home-burger-palese;La qualità dei prodotti serviti è buona, considerando la predilezione dei prodotti locali (soprattutto nei formaggi)!
https://www.yelp.it/biz/hokkaido-torino;Il pesce è fresco,grande varietà sul menù è ottimo rapporto qualità prezzo sia a pranzo che a cena.
https://www.yelp.it/biz/happy-days-bar-torino;Buona anche la cucina per un pranzo veloce, più cara rispetto ad altri posti simili ma di qualità.
https://www.yelp.it/biz/habanero-torino-2;I piatti sono molto abbondanti e un'alta qualità di ingredienti...nulla è pasticciato!
https://www.yelp.it/biz/gyrosteria-yannis-bari-2;Sapore della pita Gyros davvero eccezionale e prezzi nella norma ( 17 euro x 2pite gyros maxi + acqua).
https://www.yelp.it/biz/gusti-e-sapori-torino;Tutto molto ben presentato e di buona qualità (un po' meno sale sotto la pizza sarebbe preferibile).
https://www.yelp.it/biz/gulp-bari;I prodotti sono freschissimi e di primissima scelta, salumi e formaggi fanno da padroni nei piatti principali del locale.
https://www.yelp.it/biz/guido-gobino-torino-3;Punta molto sulla qualità degli ingredienti per cercare sapori interessanti e originali.
https://www.yelp.it/biz/gufo-bianco-torino;Materie prime di primissima qualità Ristorante di ottima qualità Ambiente tranquillo Ottimo per cene di lavoro
https://www.yelp.it/biz/grom-torino-4;Il gelato e' molto buono e genuino , gusti particolari e il cono si può scegliere quello di biscotto.
https://www.yelp.it/biz/grom-torino-2;Non si può non apprezzare la qualita' delle materie prime, anche se ... ahimè, la coda può essere lunga.
https://www.yelp.it/biz/grom-torino;Gelato e granite di ottima qualità e locale pulito.
https://www.yelp.it/biz/grill-burger-house-bari;Insomma sicuramente due spanne sopra le solite catene fastfood e con materie prime di qualità certo superiore.
https://www.yelp.it/biz/grezzo-torino;Peccato per i prezzi un po' altini ma è comprensibile vista la scelta delle materie prime e la lavorazione!!
https://www.yelp.it/biz/greek-food-lab-torino-2;Il cibo è di buona qualità e per questo merita le 4 stelle.
https://www.yelp.it/biz/grande-muraglia-di-zhans-rong-e-li-songhai-torino;Non vi è l'opzione per un menù fisso-cena ma vi è un buon rapporto qualità-prezzo. da provare
https://www.yelp.it/biz/granbar-torino;Il gran bar offre un servizio impeccabile e di qualità  a costi accessibili in maniera cortese e sempre disponibile.
https://www.yelp.it/biz/gramsci-torino-2;Si può lavorare ancora rifinendo la qualità dei piatti come gli interni del locale.
https://www.yelp.it/biz/giusti-torino;Buon rapporto qualità-prezzo, il servizio è impeccabile.
https://www.yelp.it/biz/giudice-esercizio-torino;In generale le materie prime sono ottime, il ristorante è accogliente e sufficientemente riservato ed elegante.
https://www.yelp.it/biz/girarrosto-santa-rita-torino;Non si intende solo la lavorazione delle materie prime ma è compresa anche la gentilezza dei gestori.
https://www.yelp.it/biz/giovanni-torino;Prezzi leggermente più alti della media, ma in linea con la qualità proposta (antipasti €10-16, primi €12-16, secondi €16-20).
https://www.yelp.it/biz/ginza-sushi-king-torino;Peccato perché la qualità del pesce è sopra la media dei ristoranti del settore all you can eat.
https://www.yelp.it/biz/giapponese-sakura-torino;il sushi era ottimo e fresco ma anche il resto era davvero gradevole!
https://www.yelp.it/biz/giapponese-ohashi-torino;Il pesce è fresco e i sushi sono impeccabili: grossi, il riso non si sfalda, buonissimi!
https://www.yelp.it/biz/gennaro-esposito-torino-2;Felici di aver mangiato bene ad un prezzo accessibile a tutti con ingredienti di qualità.
https://www.yelp.it/biz/gelateria-popolare-torino;Da segnalare anche la qualità delle materie prime: i gusti alla frutta sono tutti superlativi e seguono la stagionalità.
https://www.yelp.it/biz/gelateria-piu-di-un-gelato-torino;Gelati e frappè di ottima qualità, serviti in un ambiente piccolo ma confortevole, con personale disponibile e preparato.
https://www.yelp.it/biz/gelateria-piccinni-bari;Il prodotto risulta molto ben mantecato anche grazie alla buona qualità degli ingredienti utilizzati.
https://www.yelp.it/biz/gelateria-nicola-torino;I gusti alla frutta sono leggermente superiori al resto.
https://www.yelp.it/biz/gelateria-mondello-torino;L'eccellenza delle materie prime è evidente, la cura nella lavorazione artigianale rasenta la perfezione, e il risultato è eccezionale.
https://www.yelp.it/biz/gelateria-miretti-torino-7;Ottima scelta, gusti particolari e tutto molto artigianale (si sente la presenza di materie prime di prima qualità).
https://www.yelp.it/biz/gelateria-grom-torino-2;Il gelato è tutto e gli ingredienti e la qualità fanno la differenza è da gromm su sente.
https://www.yelp.it/biz/gelateria-due-salette-torino;I prodotti si rivelano di buona qualità, gentile il cameriere pur facendosi attendere inizialmente.
https://www.yelp.it/biz/gelateria-delle-alpi-torino;Oltre al personale scortese e poco organizzato il servizio è lento e la qualità dei prodotti lascia a desiderare.
https://www.yelp.it/biz/gelateria-ciuffos-torino;Ottimo il rapporto qualità/prezzo (16 euro un chilo).
https://www.yelp.it/biz/gatsbys-torino;Bicerin mediocre e con ingredienti di bassa qualità con prezzi alti assolutamente ingiustificati!
https://www.yelp.it/biz/gasperini-bari;Personale gentile e simpatico da provare sicuramente !!!
https://www.yelp.it/biz/gadi-bari;Comunque ingredienti ottimi e di qualità,lo pensi lo crei e lo gusti che altro vuoi di più.
https://www.yelp.it/biz/fuzion-torino;I prezzi sono in linea con la qualità degli ingredienti con una spesa media di 25 euro a persona.
https://www.yelp.it/biz/frulez-bari;Tutto di ottima qualità, adatto anche a vegetariani, vegani, a chi ha problemi di intolleranze.
https://www.yelp.it/biz/freevolo-torino;In generale ottimo rapporto qualità ed il personale è cordiale e sempre presente anche nei momenti di maggior caos.
https://www.yelp.it/biz/fratelli-roselli-torino;Il servizio è amichevole e molto attento al cliente e il rapporto qualità prezzo è veramente invidiabile.
https://www.yelp.it/biz/fratelli-la-cozza-torino-2;Pizza ottima,buona qualità Delle marerw prime location originale un po' da fighetti, servizio molto celere, cassiera poco sorridente.
https://www.yelp.it/biz/focacceria-tipica-ligure-torino;Prezzi un po' più alti della media ma vale assolutamente la qualità.
https://www.yelp.it/biz/focacceria-santagostino-torino-2;Prezzi in linea con la posizione centralissima nella città e con la qualità dei prodotti utilizzati.
https://www.yelp.it/biz/focacceria-riviera-ligure-torino;Prezzi un po' più alti della media ma vale assolutamente la qualità.
https://www.yelp.it/biz/fiorio-gelateria-torino-2;Nella storica gelateria di Torino il gelato e di ottima qualità, eccezionale fior di latte.
https://www.yelp.it/biz/fiorfood-torino;Qualità dei piatti ottima, cortesia del personale, prezzo in linea con i ristoranti del centro di Torino.
https://www.yelp.it/biz/fassoneria-torino;Ottima qualità della carne e altri piatti a scelta per chi non volesse mangiare solo un panino.
https://www.yelp.it/biz/farmacia-dei-sani-bari;Consigliatissimo per chi sa cosa vuol dire preparare cibi elaborati con materie prime eccellenti.
https://www.yelp.it/biz/farini-da-lia-torino;Grandi quantità e grande qualità di pesce, crudo a volontà, antipasti caldi, ampia scelta di primi e di secondi.
https://www.yelp.it/biz/factory-bari;Vasto assortimento del menù dagli Hamburger ai buonissimi club sandwich fino ai vari classici stuzzichini tutto di ottima qualità.
https://www.yelp.it/biz/exki-pietro-micca-torino;Ottima qualità dei prodotti, i prezzi un po' sopra la media ma li valgono tutti.
https://www.yelp.it/biz/exki-8-gallery-torino-2;Nel centro commerciale 8Gallery sono presenti strutture più a buon mercato che offrono più o meno gli stessi prodotti.
https://www.yelp.it/biz/esperia-torino-2;Prezzi medio alti e cucina di buona qualità ma che segue più l estetica e servizio.
https://www.yelp.it/biz/eos-torino;Menù molto interessante e ricercato con prezzi decisamente abbordabili e giusti per le ottime materie prime servite.
https://www.yelp.it/biz/enzo-e-grazia-di-matera-grazia-torino;Pasticceria di ottima qualità,per i napoletani mangiare le zeppole di Enzo & Grazia e un po' ritornare a....
https://www.yelp.it/biz/entremetier-di-lingweifu-torino;Ma soprattutto la qualità e la quantità dei primi e dei secondi di pesce fanno riconciliare con l'ambiente.
https://www.yelp.it/biz/enoteca-rossorubino-torino;Il personale è molto cortese e preparato e sa consigliare vino di ottima qualità al prezzo corretto.
https://www.yelp.it/biz/eno-libero-emporio-enogastronomico-torino;Ottimo rapporto qualità prezzo,locale originale e accogliente,personale gentile ..quindi un posto da consigliare !
https://www.yelp.it/biz/el-puig-d-estelles-torino;A parte la qualità dei piatti proposti sottolineo la gentilezza e la competenza delle ragazze che ti accolgono.
https://www.yelp.it/biz/el-pollo-loco-torino;Locale cibo personale super ... rapporto qualità prezzo ottimo ...
https://www.yelp.it/biz/el-mir-torino;Ottima la qualità dei prodotti, la presentazione,la competenza sui vini.
https://www.yelp.it/biz/el-churrasco-bari-2;la vera carne di qualità' della città' e' al churrasco, tartare, hamburger o falda, uno meglio dell'altro
https://www.yelp.it/biz/el-centenario-torino-2;Cibo di buona qualità, hanno menù per bambini.
https://www.yelp.it/biz/eataly-torino-torino;Il cibo e' ottimo anche se un po' caro, i prodotti all'interno dei negozi anche.
https://www.yelp.it/biz/eataly-bari;personale gentile e disponibile , il conto non è economico ma giustificato da piatti di buona qualità e abbondanti
https://www.yelp.it/biz/eat-sicily-torino;La qualità del pesce era ottima, servizio al tavolo eccellente, tempi tutto sommato rapidi considerando che era sabato sera.
https://www.yelp.it/biz/dublin-house-bari;Tutti i nostri panini sono preparati con materie prime di ottima scelta, in qualsiasi momento dell'anno.
https://www.yelp.it/biz/du-cesari-torino;Prezzi nella norma, qualche piatto un po' più caro però per la qualità , ne vale !
https://www.yelp.it/biz/doubletree-torino;Cibo di ottima qualità e cucinato in maniera impeccabile.Il servizio eccellente.
https://www.yelp.it/biz/dorian-gray-torino;Servizio lento e prezzi troppo alti per la qualità/quantità del cibo.Personale non tanto professionale
https://www.yelp.it/biz/dora-in-poi-torino;Nel complesso atmosfera curata ed elevata qualità delle materie prime e dei piatti in generale, tutti di ottimo livello.
https://www.yelp.it/biz/don-panino-torino;La qualità dei prodotti è eccellente e i ragazzi che lavorano nel locale sono super disponibili e simpatici.
https://www.yelp.it/biz/don-gennaro-torino;La pizza era ottima niente da dire il prezzo non è economico ma giusto rispetto alla qualità della pizza...
https://www.yelp.it/biz/dolce-mania-di-lepori-raffaele-torino;A torino ci sono numerose ottime gelateria ma questa le batte tutte per il rapporto qualità - prezzo.
https://www.yelp.it/biz/diplomatic-torino;Nulla da eccepire anche per l'ottimo rapporto qualità / prezzo.
https://www.yelp.it/biz/diecicento-torino-2;La pizza e gli ingredienti sono ottimi , veramente originale e buona la pizza al metro .
https://www.yelp.it/biz/dickens-inn-bari;Il rapporto qualità-prezzo è per sommi capi giusto, se costasse un po' meno sarebbe da 5 stelle!
https://www.yelp.it/biz/delfino-blu-torino;Ottimo e abbondante invece il Plateau Royale .Nulla da dire sulla freschezza e qualità del pesce.
https://www.yelp.it/biz/del-cambio-torino;Al cuore di tutto stanno materie prime superiori e una cucina attualmente eccelsa.
https://www.yelp.it/biz/dausin-torino;Gentilissimo e professionali Qualità ottima Prezzi bassi  Buonissimi tutti gli antipasti con un pane e salame di altro tempi.
https://www.yelp.it/biz/da-paolo-bari;Sempre una conferma questo posto pesce fresco piatti abbondanti tutti gentili e clientela affezionata segno di qualità .
https://www.yelp.it/biz/da-nicola-torre-a-mare;Il ristorante da Nicola come sempre una garanzia..pesce fresco, tutto ben cucinato e su una bella terrazza vista mare.
https://www.yelp.it/biz/da-nathalie-bari;Nonostante il forno sia elettrico la pizza è a dir poco deliziosa grazie anche all'alta qualità degli ingredienti!
https://www.yelp.it/biz/da-mauro-torino;Il ristorante risulta accogliente ed ha una vasta scelta di piatti tipici di Ottima qualità.
https://www.yelp.it/biz/da-giuliano-torino;Buon rapporto qualità prezzo e molto gentile e disponibile il personale, locale molto ampio e servizi puliti.
https://www.yelp.it/biz/da-giannino-l-angolo-d-abruzzo-torino;Cibo di buona qualità e buon prezzo , servizio al tavolo da parte di cameriere maschile, poco gentile !
https://www.yelp.it/biz/da-ciro-torino;.. ottima pizza e scelta di ingredienti freschi e genuini.. complimenti al grande Ciro Ferrara ed al suo staff..
https://www.yelp.it/biz/da-ciccillo-torino;Ingredienti DI QUALIT�? a prezzi contenuti, personale gentile e disponibile e la BURRATA è qualcosa di incredibile !
https://www.yelp.it/biz/da-benito-torino;Ottimo ristorante ottima la qualità del cib o..pesce di ottima qualità prezzo basso sotto la media..servizio ok
https://www.yelp.it/biz/curry-zone-turin;Ottimo cibo pakistano Alta qualita delle materie prime Prezzi tra i 18 e i 25 euro Molto onesto Consigliato
https://www.yelp.it/biz/crocetta-torino;Carne e pesce di ottima qualità, un menù ampio e una carta dei vini che non delude mai.
https://www.yelp.it/biz/cristina-due-torino;Forse i prezzi sono un pò alti ma gli ingredienti sono genuini e freschi.
https://www.yelp.it/biz/cris-e-bio-bari;Pizza ottima, antipasti buoni, personale educato e disponibile.
https://www.yelp.it/biz/costadoro-torino;I prezzi sono nella norma e il servizio e la qualità  delle cose servite sono di un altissima qualità .
https://www.yelp.it/biz/cornetti-night-torino-2;Da rivedere la qualità degli ingredienti e il tipo di pane.
https://www.yelp.it/biz/cornetti-night-torino;Da rivedere la qualità degli ingredienti e il tipo di pane.
https://www.yelp.it/biz/coox-torino;Ottimo sia per un pranzo veloce che per un pranzo con gli amici, atmosfera e locale di qualità.
https://www.yelp.it/biz/conte-verde-torino-2;Ristorante molto accogliente e confortevole..personale cordiale e disponibile...ambiente pulito..qualità del cibo buona..buono anche il rapporto qualità prezzo.
https://www.yelp.it/biz/conogelato-torino;Anche i gusti frutta sono assolutamente da provare, una piacevolissima sorpresa!
https://www.yelp.it/biz/complice-di-zhou-jinshu-torino;Il servizio è veloce, informale ma discretamente attento alle richieste dell'avventore.
https://www.yelp.it/biz/cit-ma-bon-torino;Qualità degli ingredienti e servizio cortese ed attento ne fanno un locale piacevole in cui è bello tornare.
https://www.yelp.it/biz/circolo-dei-lettori-torino;In un palazzo storico meraviglioso il ristorante offre piatti della tradizione cucinati con materie prime di grande qualità.
https://www.yelp.it/biz/cioccolato-peyrano-torino-2;La lacuna maggiore è rappresentata dai prezzi molto alti, non giustificati dal servizio ne dalla qualità.
https://www.yelp.it/biz/cinque-lire-torino;La qualità degli ingredienti è decisamente buona.
https://www.yelp.it/biz/cinese-nanchino-torino;Da segnalare che il personale è estremamente gentile e disponibile, ma purtroppo non basta.
https://www.yelp.it/biz/cinese-fang-xiang-bari;Il prezzo é conveniente ....ma la qualità dei piatti lascia un po' a desiderare...
https://www.yelp.it/biz/cinese-du-cheng-torino-2;La qualità dei piatti è molto buona, e il tempo da attendere è ragionevole, con qualche eccezione.
https://www.yelp.it/biz/cinese-chen-lon-torino;Le ragazze sono tutte gentili e il servizio é veloce, senza perdere la qualità e la freschezza dei piatti.
https://www.yelp.it/biz/ciclatera-sotto-il-mare-bari;Infatti è l'ideale per un aperitivo molto completo o un pranzo veloce in riva al mare, sulla muraglia.
https://www.yelp.it/biz/chez-zeina-torino;Il menù è molto ridotto (a dimostrazione che i cibi sono tutti fatti sul momento e con ingredienti freschi).
https://www.yelp.it/biz/cera-una-volta-torino;Sempre ottima la qualità del cibo e una ricchissima carta dei vini per tutte le tasche e gusti
https://www.yelp.it/biz/cecchi-torino;Ottimo rapporto qualità prezzo da non dimenticare che fanno anche il gelato.
https://www.yelp.it/biz/ceccarelli-torino;ambiente famigliare pronti a soddisfare qualsiasi esigenza camerieri molto simpatici e attenti Una qualità prezzo che non ha rivali!!!
https://www.yelp.it/biz/catullo-torino-2;Ottimo ristorante pulito e ben tenuto personale cortese e disponibile ottima qualità del cibo e carta dei vini consigliato
https://www.yelp.it/biz/casale93-torino;Molto organizzati e gentili si sono fatti apprezzare soprattutto per la qualità del pesce (branzino) e dei dessert.
https://www.yelp.it/biz/casa-vicina-torino;Piatto semplicissimo ( così come gli altri ) che però ha fatto notare l'ottima qualità delle materie prime.
https://www.yelp.it/biz/casa-mad-torino;Piatti della cucina italiana preparati al momento con ingredienti freschissimi, ambiente meraviglioso e personale cortese, cordiale e amichevole.
https://www.yelp.it/biz/casa-fiore-torino;Lo chef sa davvero trattare in maniera egregia le ottime materie prime, questo si nota dalla primo all'ultimo piatto.
https://www.yelp.it/biz/casa-del-barolo-torino-3;Cibo ottimo e servizio veloce e curato, prezzi in media con la qualità offerta e con la location.
https://www.yelp.it/biz/cantine-risso-torino;Materie prime buone, ragazzi del servizio cortesi veloci e FANTATICI DESSERT fatti da loro con una ampia scelta.
https://www.yelp.it/biz/camilla-kitchen-torino;Ottima la qualità del cibo e la rivisitazione in chiave moderna dei cibi della tradizione piemontese.
https://www.yelp.it/biz/caffetteria-pasticceria-torino;Ottima la qualità della caffetteria e della pasticceria.
https://www.yelp.it/biz/caffetteria-mazzini-torino;La cameriera era gentile e disponibile, il vino eccellente, i prezzi bassi e le persone - guardando affascinante!
https://www.yelp.it/biz/caffeteria-federico-ii-bari;Il servizio è veloce e apprezzabile, il conto è adeguato ai prodotti e alle porzioni!
https://www.yelp.it/biz/caffe-vittorio-veneto-torino;Ottimi i cocktail e il rapporto qualità prezzo
https://www.yelp.it/biz/caffe-vergnano-torino;Appena sufficiente la qualita' delle materie prime a cominciare dal pancarre' che in un tramezzino buono fa' la differenza.
https://www.yelp.it/biz/caffe-lumiere-torino;Il livello di qualità dei cibi è peggiorato e la quantità ancor di più.
https://www.yelp.it/biz/cafe-vergnano-1882-torino;(Al di là della qualità ottima delle brioches) Colazione di famiglia improponibile!
https://www.yelp.it/biz/busters-coffee-torino;Qualità dei prodotti veramente scarsa e prezzi che sono molto alti.
https://www.yelp.it/biz/burgheria-torino-2;Hamburger di ottima qualità, carina la possibilità di poter variare a propria scelta il panino e le sue componenti!
https://www.yelp.it/biz/burgheria-torino;Perdersi per strada....era una ottima hamburgeria con pane e carne di qualità con un formato originale libero da vincoli.
