url;review
https://www.yelp.it/biz/cento-90-due-torino-2; Consigliato per chiunque voglia trascorrere una piacevole serata in compagnia!!! locale molto carino, l'aperitivo non è il massimo ma compensano gli ottimi cocktail. Aspetto del locale: bello l'ingresso, il retro con i dehors un po' ''improvvisato'', tutto sommato gradevole.
https://www.yelp.it/biz/cera-una-volta-torino; Tutto è stato perfetto dall'accoglienza al servizio . Accoglienza e servizio impeccabile, ideale per una cena tranquilla, di coppia e non. Locale molto carino, al primo piano di un palazzo in cui per entrare occorre suonare dall'ingresso.
https://www.yelp.it/biz/chiodi-latini-new-food-torino; Il tutto in un'atmosfera accogliente e finemente elegante. Il personale è gentile e premuroso come lo chef che illustra con passione il menù! Il locale è molto piccolo e il servizio cortese.
https://www.yelp.it/biz/ciclatera-sotto-il-mare-bari; Fantastica location per trascorrere una piacevole serata insieme agli amici. Prezzi modici e personale simpatico e competente Perfetto per chi vuole passare una serata con amici, Da solo o per fare nuove conoscenze.
https://www.yelp.it/biz/cinese-chen-lon-torino; Locale molto bello con dehor e pulitissimo. Locale dallo stile moderno ed essenziale, accogliente e fresco, particolare il soffitto con canne di bambù. Abbia.o passato una serata .molto piacevole con dell'ottimo cibo.Locale molto pulito e personale cortese e disponibile.Da tornare!
https://www.yelp.it/biz/cinese-du-cheng-torino-2; Personale gentile, servizio svelto e piatti ottimi. Locale ben curato, pulito, titolari gentili ed accoglienti, piatti gustosi. Il personale è gentile, il tempo di attesa è poco, sembra pulito e l'arredamento è quello classico cinese.
https://www.yelp.it/biz/cinese-fang-xiang-bari; Servizio cortese e rapido, locale molto informale, menù molto ampio e prezzi ragionevoli. La location è molto informale e il servizio rapido. Tutto veramente buono servizio rapido e personale gentile.
https://www.yelp.it/biz/cinese-mei-li-hua-torino; il locale è molto bello, arredamento tipico cinese. il cibo è ottimo, il personale gentilissimo e i prezzi buoni Il personale è gentile, purtroppo il cibo ha perso molti punti. Nulla da dire sul personale che era gentile e disponibile.
https://www.yelp.it/biz/cit-ma-bon-torino; Il servizio è rapido e veloce, la location è molto semplice, ma la pizza è davvero squisita...consigliatissimo!!! Ottima la pizza al padellino sia le classiche ed a seconda della stagionalità le pizze speciali!! Qualità degli ingredienti e servizio cortese ed attento ne fanno un locale piacevole in cui è bello tornare.
https://www.yelp.it/biz/conogelato-torino; Personale simpatico e gelato squisito, geniale l'idea di usare il latte di bufola. Locale bello , pulito e titolari sorridenti e cordiali.
https://www.yelp.it/biz/conte-verde-torino-2; Locale consigliato per chi desidera passare una serata in centro, senza pagare un occhio della testa e mangiar bene. Il locale si presenta carino, accogliente, personale cortese e disponibile. Piatti unici nel gusto tipico piemontese...buono...personale gentile e cortese.... prezzo accettabile ... centrale
https://www.yelp.it/biz/copacabana-torino; Carne buona e servizio gentile e simpatico. Il locale è accogliente e le pietanze buone ed in -abbondanza! Il cibo è molto buono e il locale è carino e di gusto.
https://www.yelp.it/biz/cornetti-night-torino; Il personale è stato simpatico e sorridente! Personale molto gentile e pronto a dispensare consigli. Posto davvero accogliente, il proprietario simpaticissimo e cornetti buonissimi.
https://www.yelp.it/biz/cornetti-night-torino-2; Il personale è stato simpatico e sorridente! Personale molto gentile e pronto a dispensare consigli. Posto davvero accogliente, il proprietario simpaticissimo e cornetti buonissimi.
https://www.yelp.it/biz/costadoro-torino; Ottimo servizio personale simpatico, gentile e preparato. Il personale è gentile e simpatico, il servizio rapido. Locale carino con un design moderno situato di fronte alla Rinascente.
https://www.yelp.it/biz/cris-e-bio-bari; Il personale è gentile, simpatico ed educato. Prezzi accessibili e personale simpatico ed educato. �? un luogo adatto per passare una serata alternativa.
https://www.yelp.it/biz/crocetta-torino; Buona l'accoglienza, buona la qualità dei piatti, buono il servizio. Il personale gentile , simpatico e professionale, rende il pasto ancora più piacevole. Ristorante piccolino ma pulito e con personale cortese per una serata più che piacevole.
https://www.yelp.it/biz/curry-zone-turin; Posto molto interessante per passare una serata diversa! Il servizio è rapido e gentile, i prezzi modesti. Il cibo è ottimo curato e fresco.
https://www.yelp.it/biz/da-ciccillo-torino; Nota di merito al personale molto simpatico! Personale simpatico e cortese e il servizio veloce. Consigliatissima per cene tra amici o in famiglia.
https://www.yelp.it/biz/da-ciro-torino; Ideale per chi vuole passare una serata tra amici e mangiare bene. Il personale è molto simpatico e disponibile, il locale è semplice, ma carino. Pizza molto buona e locale decisamente carina.
https://www.yelp.it/biz/da-mauro-torino; Il personale è molto simpatico e cortese per fortuna Porzioni abbondanti ambiente rilassato e personale simpatico e cordiale. Il cibo è ottimo freschissimo scelto personalmente dal proprietario.si mangia velocemente ottimo per proseguire la serata consigliatissimo
https://www.yelp.it/biz/da-paolo-bari; La location è semplice ed informale ed il personale molto gentile . Il locale si presenta semplice come si rivelano poi servizio e cucina. Il locale è' semplice e offre una cucina tradizionale ma senza pesce.
https://www.yelp.it/biz/dai-saletta-torino-2; Locale spartano ma carino, servizio simpatico anche se non proprio rapidissimo. Personale simpatico, professionale e davvero molto disponibile. Il personale è molto simpatico e competente.
https://www.yelp.it/biz/dal-vecchio-torino; Cena con genitori ed amici trascorsa in un bel locale con splendide persone.
https://www.yelp.it/biz/dausin-torino; Locale carino per una serata tra amici, con un'ottimo rapporto qualità prezzo. Pietanze tipiche piemontesi ottime e personale molto simpatico e professionale. Locale molto carino, giovanile e colorato, il personale molto gentile.
https://www.yelp.it/biz/delfino-blu-torino; Provato in serata con amici ottimo ristorante con bella proposta vini . Locale molto bello silenzioso curato e pulito cucina davvero ottima pesce fresco . Il locale elegante, il personale cordiale, professionale e molto attento nei confronti dei clienti e i piatti sono squisiti.
https://www.yelp.it/biz/dess%C3%AC-torino; Prezzi nella norma e locale carino, ma niente di che
https://www.yelp.it/biz/diecicento-torino-2; Una bella serata fra amici, bei momenti e buoni sapori. Locale ampio e buona dislocazione dei tavoli. Il personale molto simpatico e ben formato .
https://www.yelp.it/biz/dog-out-presso-otto-gallery-torino; Consigliato per il buon cibo, per il servizio e la cortesia del gestore Personale molto gentile e location molto simpatica in pieno stile americano vintage. Il personale è davvero gentile e garbato, il cibo è ottimo e il posto tranquillo.
https://www.yelp.it/biz/dolce-basilico-torino; Il locale non è una classica pizzeria in cui passare una serata. Pizza molto buona con ottimi ingredienti, personale gentilissimo e cordiale...
https://www.yelp.it/biz/dolce-mania-di-lepori-raffaele-torino; Il locale è accogliente, con le vetrine presentate molto bene. Il personale è sempre gentile e cordiale.oytimo qualità prezzo Il personale è sempre molto gentile e cordiale.
https://www.yelp.it/biz/don-gennaro-torino; Locale semplice e datato con pochi coperti. Ottima pizza, prezzi nella media, servizio semplice ed onesto. Ormai diventato luogo di ritrovo per pizzate tra amici e in famiglia.
https://www.yelp.it/biz/don-panino-torino; Grande assortimento e personale davvero simpatico e gentile. Panini ottimi e personale simpatico con prezzi nella media. Sempre stato a livelli eccezionali e il personale è gentile e simpatico!
https://www.yelp.it/biz/dorian-gray-torino; Consigliatissimo er passare una buona serata con gli amici e un'ottima birra, ma anche con il proprio partner. Un locale caratteristico con un servizio cortese e attento, piatti abbondanti e prezzi medio bassi. La cameriera ai tavoli è sicuramente molto gentile e disponibile.
https://www.yelp.it/biz/doubletree-torino; Il personale è molto accogliente, attento e cortese. Ottima anche la possibilità di scelta per la colazione. Tutto il personale è molto gentile e la colazione ottima.
https://www.yelp.it/biz/dublin-house-bari; Insomma...un bel posto per una piacevole serata in compagnia di amici! Ambiente cordiale e informale, personale e cassiere simpatici. Personale simpatico e accogliente, rapporto qualità prezzo buono, da consigliare
https://www.yelp.it/biz/eat-sicily-torino; Buona accoglienza, veloce spiegazione del menù della serata. Locale con ampio dehor estivo, a due passi da Piazza Solferino! Labparte esterna del locale é accogliente ma assolutamente troppo rumorosa!
https://www.yelp.it/biz/eataly-bari; Locale molto carino,però andare ad una serata siciliana e aver finito gli arancini,nn è possibile,disorganizzazione In una calda serata di agosto la pizzeria era sprovvista di aria condizionata, ed è la prima nota negativa. Il Personale è gentile, professionale e sorridente.
https://www.yelp.it/biz/eataly-torino-torino; La pizza è buona, quella fritta ancora meglio. La pizza più buona di Torino in ASSOLUTO! Professionalita' e gentilezza in un ambiente molto accogliente.
https://www.yelp.it/biz/el-centenario-torino-2; Il personale è molto accogliente e simpatico. Sicuramente consigliato per una bella serata con amici Locale molto semplice dallo spirito Messicano, ideale per serate tra amici che amano i locali non molto silenziosi.
https://www.yelp.it/biz/emporio-gastronomico-torino; Nel quartiere della Crocetta un bel locale antico con uno spazioso dehor moderno. Il locale è molto curato e nel dehor si stava davvero bene! Il servizio è solerte ed allo stesso tempo il cibo è ottimo, curato e veramente di alto livello.
https://www.yelp.it/biz/eno-libero-emporio-enogastronomico-torino; Il locale è carino, forse un po' dispersivo ma ampio. Il locale è molto carino, arredato con gusto, molto giovanile e retrò. L'ambiente è accogliente, semplice, solare e alternativo, nel cuore di San Salvario.
https://www.yelp.it/biz/entremetier-di-lingweifu-torino; Personale gentile, location non di lusso, ma pulita. I prezzi sono decisamente buoni e il personale gentile e veloce. La pizza è molto buona e costa pochissimo.
https://www.yelp.it/biz/enzo-e-grazia-di-matera-grazia-torino; Il dehor è piccolo ma accogliente e il personale gentile. Accoglienza e servizio al cliente insufficente in contesto di medio livello e qualita'.....da ri edere ...! Personale gentile , prezzi non economici ma in linea con qualità - prezzo
https://www.yelp.it/biz/eos-torino; Bello vedere come ad un giovane chef visualizzazione ad un senso matura di ciò che è buon cibo.
https://www.yelp.it/biz/esperia-torino-2; Il personale é molto gentile e simpatico. Locale sul Po molto bello per la sua posizione e storicità. Ambiente curato e romantico, menù raffinato con ottime materie prime.
https://www.yelp.it/biz/estrella-do-sul-torino; Il locale è molto semplice, pulito e curato.
https://www.yelp.it/biz/exki-8-gallery-torino-2; Il personale è molto gentile e amichevole.
https://www.yelp.it/biz/exki-giolitti-torino-3; Locale ampio e luminoso con vetrata che da su via Carlo Alberto. Locale carino per fare una merenda, anche se i prezzi non sono così economici Il personale è molto gentile e garbato ed il locale ti mette a tuo agio.
https://www.yelp.it/biz/exki-pietro-micca-torino; Locale molto carino con prodotti vegetariani e vegani. Personale sempre professionale e molto disponibile, di sicuro un punto di forza del locale. Locale molto accogliente e personale giovane e gentile.
https://www.yelp.it/biz/farmacia-dei-sani-bari; Il locale è molto bello e particolare, l'accoglienza e il cibo davvero ottimi. Pienamente soddisfatti: ottimo cibo e atmosfera rilassante. personale accogliente e gentile Locale molto carino e cucina di alto livello.
https://www.yelp.it/biz/fassoneria-torino; Locale semplice, moderno con simpatiche tovagliette americane ai tavoli, spazio all'aperto disponibile. Bugheria accogliente e calda per serata tra amici. Ambiente accogliente ed informale, servizio disponibile e gentile.
https://www.yelp.it/biz/filo-di-marianna-torino; La cucina è semplice ma ottima per preparazione e freschezza dei cibi e il servizio è cortese e amichevole. Il ristorante è molto carino e accogliente. Il servizio è cortese e i piatti sono preparati con semplicità.
https://www.yelp.it/biz/fiorfood-torino; Il posto è interessante e la gentilezza del personale mette a proprio agio. Ambiente curato e caldo, personale molto ma molto attento. Servizio cortese , preparato , gentile e non invadente.
https://www.yelp.it/biz/fiorio-gelateria-torino; Interno carino e personale gentile, tutto molto buono
https://www.yelp.it/biz/focacceria-santagostino-torino; Il locale è carino, semplice ed essenziale nell'arredamento. Buona la farinata e la focaccia di Recco con ingredienti scelti Locale semplice e spartano oltre che molto caldo. Locale simpatico con personale gentile e accogliente e una buona varietà di pizze.
https://www.yelp.it/biz/focacceria-santagostino-torino-2; Il locale è carino, semplice ed essenziale nell'arredamento. Buona la farinata e la focaccia di Recco con ingredienti scelti Locale semplice e spartano oltre che molto caldo. Locale simpatico con personale gentile e accogliente e una buona varietà di pizze.
https://www.yelp.it/biz/focacceria-tipica-ligure-torino; Locale molto spartano ma adatto per uno spuntino di pranzo veloce ed economico. Il servizio è molto rapido, la pizza e la focaccia sono molto buone. Servizio veloce e personale gentile nonostante la premura.
https://www.yelp.it/biz/forchetta-e-scarpetta-torino; Locale piccolo ma accogliente personale simpatico e ben disposto. Locale carino personale cordiale,qualità del cibo buona anche se porzioni piccole prezzi nella media. Locale molto carino e tranquillo, personale gentile e disponibile, servizio accurato.
https://www.yelp.it/biz/fratelli-la-cozza-torino-2; Locale davvero ampio dallo stile eclettico ed informale. Il locale è molto ampio e bello. Una serata bella accompagnata da cibo ottimo !
https://www.yelp.it/biz/fratelli-roselli-torino; .... per una piacevole serata tra amici. Locale carino con un dehor molto curato. Bella zona e personale simpatico e gentile.
https://www.yelp.it/biz/friedas-pub-torino; Cucina nella media di un locale di questo tipo e servizio gentile.
https://www.yelp.it/biz/frulez-bari; Locale simpatico con servizio rapido ed efficace. Il personale è cordiale e sorridente e la cucina è quasi a vista. Bella location, ottimo cibo, buon rapporto qualità prezzo.
https://www.yelp.it/biz/fuzion-torino; Piatti deliziosi e personale molto simpatico che ti consiglia il meglio... Personale molto gentile e disponibile, ospitalità al top. 'Location carina, menu molto particolare con accostamenti di menu pizza classici a abbinamenti orientali chiamati appunto fuzion.
https://www.yelp.it/biz/galante-torino; Carta dei vini discreta e locale elegante anche se in stile primo  900.
https://www.yelp.it/biz/gandhi-torino; L'ideale per una cena fra amici e/o in famiglia. Il locale è elegante sontuoso, con il personale molto gentile e disponibile. Locale molto bello e accogliente con personale gentile cosi' come il proprietario.
https://www.yelp.it/biz/garden-caffetteria-torino; Inoltre Non é adatto ad una cena romantica!
https://www.yelp.it/biz/gasperini-bari; Personale gentile e simpatico da provare sicuramente !!!
https://www.yelp.it/biz/gatsbys-torino; Locale in stile moderno direttamente su una delle vie più belle e frequentate di Torino. Personale gentile e solerte e location molto bella Servizio gentile e cordiale, prezzi consoni alla posizione in centro Torino
https://www.yelp.it/biz/gaudenti-1971-torino; La location è carina, nuova, molto elegante e moderna. Locale carino, accogliente molto pulito ed ordinato.
https://www.yelp.it/biz/gelateria-delle-alpi-torino; Il personale è educato e informale, il servizio è lento. Locale carino e accogliente, il luogo ideale per gustarsi una cioccolata calda nelle sere fredde autunnali. Il personale è sempre gentile, i prezzi sono onesti.
https://www.yelp.it/biz/gelateria-due-salette-torino; Qualità bassa e personale non simpatico per nulla. Gelato da degustare .Fatto ancora a mano con una vecchia macchina il gelato è ottimo.Personale simpatico e disponibile.
https://www.yelp.it/biz/gelateria-grom-torino-2; Il personale è gentile ma ha modi di fare molto sbrigativi.
https://www.yelp.it/biz/gelateria-miretti-torino-7; Locale curato e pulito che offre piatti semplici per una pausa pranzo leggera e sfiziosa. Locale elegante e Cortese, serve in gelato davvero squisito! Il servizio è molto gentile e i prezzi sono buoni.
https://www.yelp.it/biz/gelateria-mondello-torino; Personale simpatico e disponibile, peccato che non facciano il cono piccolo anche per gli adulti. Personale gentile e buona location nel quadrilatero torinese Il personale è molto gentile, il gelato è davvero gustoso.
https://www.yelp.it/biz/gelateria-monginevro-smaldone-raffaele-torino; Il personale è sempre gentile e sorridente: caratteristica molto rara da trovare nella maggior parte dei posti. Grande vastità di gusti e personale gentile. Il locale è molto bello da vedere e il gelato è molto buono.
https://www.yelp.it/biz/gelateria-piccinni-bari; Un plauso anche al personale gentile e cordiale. Personale gentile e competente che dimostra molta dedizione nella realizzazione del loro lavoro. Il personale gentile e curato il locale.
https://www.yelp.it/biz/gelateria-piu-di-un-gelato-torino; locale piccolo pulito e personale gentile e paziente e davvero professionale.
https://www.yelp.it/biz/gelateria-popolare-torino; Davvero un'ottima meta per una serata in compagnia, gustando delle prelibatezze sane e naturali. Il locale è molto carino con ottima musica jazz in sottofondo. Per il resto personale gentile e prezzi ormai nella media.
https://www.yelp.it/biz/gennaro-esposito-torino-2; Personale accogliente e simpatico e i prezzi sono nella media. Street food......il nuovo modo di mangiare senza impegno a torino....ottima pizza e personale molto simpatico...!!... Il locale è semplice ma pulito, ed è possibile fermarsi per la consumazione apparecchiandosi da soli.
https://www.yelp.it/biz/giapponese-sakura-torino; Locale carino e simpatico ma per l'educazione non ci rientrerò più! Buona qualità e grande scelta nel menù, personale molto cortese, simpatico e disponibile! Peccato perché era un posto carino e accogliente...
https://www.yelp.it/biz/giapponese-xia-torino; Bel locale, personale cortese, cucina in stile made in Japan.
https://www.yelp.it/biz/giudice-esercizio-torino; L'occasione richiedeva una cena speciale e lo chef si è messo a completa disposizione per la scelta del menù. Il posto è sempre piacevole, soprattutto d'estate. Location carina ma soprattutto una buona scappatoia dalle serate afose di Torino (5 gradi di differenza).
https://www.yelp.it/biz/giusti-torino; Valido per una serata in compagnia di amici. Il personale è gentile e disponibile, a qualsiasi ora e per qualsiasi esigenza. Ampia scelta nel menù, pesce fresco, ma porzioni veramente piccole, caro.
https://www.yelp.it/biz/granbar-torino; Super consigliato per passare una serata in compagnia o una cena. Locale carino con un bel dehor e personale cortese. Bel locale per aperitivi o per un pre serata.
https://www.yelp.it/biz/grande-muraglia-di-zhans-rong-e-li-songhai-torino; La qualità degli ingredienti è molto buona ed il servizio abbastanza veloce. Personale molto efficiente e veloce a prendere le ordinazioni. Buon rapporto qualità prezzo e camerieri gentili, anche se non tutti parlano bene l'italiano.
https://www.yelp.it/biz/grezzo-torino; Locale molto bello e curato, pasticcini e prelibatezze che sembrano gioielli, alcuni poi vari altri a prezzo normale. E' un locale elegante, con prodotti di altissima qualità e un personale motivato e appassionato. Personale molto gentile e pronto a spiegare le diverse preparazioni e materie prime utilizzare.
https://www.yelp.it/biz/grill-burger-house-bari; Il personale molto gentile ha reso la serata perfetta!! Bella l'idea di personalizzare il proprio panino tramite una lista di ingredienti da selezionare. personale simpatico e disponibile Locale carino, bella l'idea di poter scegliere liberamente cosa mettere nel panino, e personale molto veloce, simpatico e disponibile.
https://www.yelp.it/biz/grom-torino; Piacevolissima sorpresa assaggiare un gelato di qualità così alta in una catena.Fossero tutte così.Promossi !!!
https://www.yelp.it/biz/grom-torino-2; Gelati di ottima qualità e personale gentile.
https://www.yelp.it/biz/grom-torino-4; Il personale è gentile ed il posto ben collegato coi mezzi e vicino ad un parcheggio multipiano, facilmente accessibile.
https://www.yelp.it/biz/grotta-azzurra-bari; In generale il locale è carino ma manca atmosfera, il cameriere è cortese ma freddo.
https://www.yelp.it/biz/gufo-bianco-torino; Personale molto simpatico e cordiale, prezzo giusto. La qualità è molto buona e il servizio impeccabile. Ottimo rapporto qualità prezzo unito ad una buona cortesia del personale.
https://www.yelp.it/biz/guido-gobino-torino-3; Questa camera deliziosa è l'aria condizionata !!! Ambiente raffinato e prodotti dal sapore unico. Personale sicuramente molto gentile e rapido nelle ordinazioni.
https://www.yelp.it/biz/gulp-bari; Il locale semplice, moderno, alternativo, giovanile come il nome che porta. Organizzatissimi piatti ottimi personale simpatico e disponibile specialmente Mariangela. Personale simpatico, cibo ottimo, servizio all'altezza nonostante i tanti clienti
https://www.yelp.it/biz/gusti-e-sapori-torino; Si mangia bene personale attento cordiale e simpatico locale accogliente. La pizza è molto buona (piuttosto bassa e croccante) e ce ne sono di diversi tipi. Con la certezza di gustarci la solita buona pizza in un locale accogliente e gradevole....
https://www.yelp.it/biz/gyrosteria-yannis-bari-2; Ottimo panino e moglie soddisfattissima... locale molto carino e caratteristico a due passi dall'ateneo... Locale molto carino situato al centro di Bari vicino l'Ateneo.
https://www.yelp.it/biz/habanero-torino-2; L'atmosfera è davvero quella giusta sia per passare una serata in compagnia ma anche per delle cenette intime. Personale accogliente e simpatico, piatti diversi dai soliti ristoranti messicani omologati! Il locale è semplice ma caratteristico, molto belle le candele all'interno.
https://www.yelp.it/biz/happy-days-bar-torino; Panettoni molto invitanti e personale simpatico . Un posto ideale per iniziare al meglio la giornata Personale simpatico. Personale gentile e professionale, arredamento in stile sabaudo perfettamente in armonia con il contesto cittadino.
https://www.yelp.it/biz/hokkaido-torino; Il personale e' comunque molto gentile e simpatico. Il locale è carino e c'è anke il dehor esterno riscaldato. Il personale è molto gentile e amichevole e nonostante quella piccola pecca il gusto non delude mai!
https://www.yelp.it/biz/home-burger-palese; Il personale però è gentile e simpatico! Locale accogliente e panini preparati al momento davvero ottimi!!! Il personale è molto educato, professionale e cordiale.
https://www.yelp.it/biz/horas-kebab-torino; Il locale è molto ampio, con dehor, moderno. Ambiente molto spartano ma personale gentile e simpatico. Personale simpatico e allegro, prezzi nella norma.
https://www.yelp.it/biz/hua-dou-cheng-torino; Servizio discreto e informale ideale per passare una serata allegra e low cost. Il personale è simpatico e l'ambiente accogliente. Anche il personale è gentile, disponibile e simpatico!
https://www.yelp.it/biz/hua-li-du-torino; Un plauso anche per accoglienza e servizio. Il personale è molto gentile e il locale è pulito. Locale curato e personale educato e professionale. vasta scelta di piatti sia cinesi che italiani.
https://www.yelp.it/biz/huntsman-pub-torino; Bel pub per passare una serata con amici. Il pub ideale per passare una serata in compagnia di amici davanti ad una partita in tv! Locale molto ampio con varie sale e anche tavoli da biliardo.
https://www.yelp.it/biz/i-soliti-amici-torino; Il locale è ampio, luminoso, adatto a tavolate, senza essere rumoroso. Il locale è ampio, il personale gentile e sorridente, il cibo buono. Bel locale molto ampio, personale gentile e disponibile, servizio veloce anche con il locale pieno.
https://www.yelp.it/biz/i-tartufi-bistrot-torino; Arredamento moderno ed essenziale con cucina a vista. Il locale si presenta piccolo ma molto accogliente ,con personale gentile e presente per ogni esigenza . Il locale è molto carino, essenziale e pulito.
https://www.yelp.it/biz/i-tesori-bari; Locale molto carino, personale gentile e disponibile. Il locale é curato in modo da evicare altri tempi, il personale e la proprietaria sono cortesi e professionali. Bel locale, accogliente e in ottima posizione.
https://www.yelp.it/biz/ichi-torino; Locale semplice, ma carino e personale gentile Arredo moderno e ristorante accogliente e pulito. Il ristorante Ichi presenta un bel locale, con personale simpatico ed un servizio veloce.
