url;review
https://www.yelp.it/biz/da-ciro-torino;Ideale per chi vuole passare una serata tra amici e mangiare bene.
https://www.yelp.it/biz/da-ciccillo-torino;Nota di merito al personale molto simpatico!
https://www.yelp.it/biz/curry-zone-turin;Posto molto interessante per passare una serata diversa!
https://www.yelp.it/biz/crocetta-torino;Buona l'accoglienza, buona la qualità dei piatti, buono il servizio.
https://www.yelp.it/biz/cris-e-bio-bari;Il personale è gentile, simpatico ed educato.
https://www.yelp.it/biz/costadoro-torino;Ottimo servizio personale simpatico, gentile e preparato.
https://www.yelp.it/biz/cornetti-night-torino-2;Il personale è stato simpatico e sorridente!
https://www.yelp.it/biz/cornetti-night-torino;Il personale è stato simpatico e sorridente!
https://www.yelp.it/biz/copacabana-torino;Carne buona e servizio gentile e simpatico.
https://www.yelp.it/biz/conte-verde-torino-2;Locale consigliato per chi desidera passare una serata in centro, senza pagare un occhio della testa e mangiar bene.
https://www.yelp.it/biz/conogelato-torino;Personale simpatico e gelato squisito, geniale l'idea di usare il latte di bufola.
https://www.yelp.it/biz/cit-ma-bon-torino;Il servizio è rapido e veloce, la location è molto semplice, ma la pizza è davvero squisita...consigliatissimo!!!
https://www.yelp.it/biz/cinese-mei-li-hua-torino;il locale è molto bello, arredamento tipico cinese. il cibo è ottimo, il personale gentilissimo e i prezzi buoni
https://www.yelp.it/biz/cinese-fang-xiang-bari;Servizio cortese e rapido, locale molto informale, menù molto ampio e prezzi ragionevoli.
https://www.yelp.it/biz/cinese-du-cheng-torino-2;Personale gentile, servizio svelto e piatti ottimi.
https://www.yelp.it/biz/cinese-chen-lon-torino;Locale molto bello con dehor e pulitissimo.
https://www.yelp.it/biz/ciclatera-sotto-il-mare-bari;Fantastica location per trascorrere una piacevole serata insieme agli amici.
https://www.yelp.it/biz/chiodi-latini-new-food-torino;Il tutto in un'atmosfera accogliente e finemente elegante.
https://www.yelp.it/biz/cera-una-volta-torino;Tutto è stato perfetto dall'accoglienza al servizio .
https://www.yelp.it/biz/cento-90-due-torino-2;Consigliato per chiunque voglia trascorrere una piacevole serata in compagnia!!!
https://www.yelp.it/biz/cecchi-torino;Un locale semplice, senza pretese ma con ottimo cibo.
https://www.yelp.it/biz/ceccarelli-torino;Serata con amici in questo locale storico.
https://www.yelp.it/biz/catullo-torino-2;Ottimo locale per passare una serata a Torino.
https://www.yelp.it/biz/casale93-torino;Bellissima serata in compagnia di uno staff cordiale e di compagnia...
https://www.yelp.it/biz/casablanca-bari;Locale molto spartano da nn molte pretese ma comunque accogliente.
https://www.yelp.it/biz/casa-vicina-torino;Serata con amici dell'accademia della cucina, cucina eccellente e servizio impeccabile.
https://www.yelp.it/biz/casa-del-barolo-torino-3;Locale accogliente, arredato con buon gusto con un suggestivo dehor.
https://www.yelp.it/biz/cantine-risso-torino;Ottimo posto per passare una serata in compagnia di amici e bere un buon bicchiere di vino.
https://www.yelp.it/biz/cammaf%C3%A0-torino-4;Consigliato se volete provare/mangiare un ottima pizza!
https://www.yelp.it/biz/caffetteria-pasticceria-torino;Il personale è simpatico, accogliente e professionale.
https://www.yelp.it/biz/caffetteria-mazzini-torino;La cameriera era gentile e disponibile, il vino eccellente, i prezzi bassi e le persone - guardando affascinante!
https://www.yelp.it/biz/caffeteria-federico-ii-bari;Da notare anche la cortesia del personale simpatico e disponibile verso il cliente.
https://www.yelp.it/biz/caffe-vergnano-torino;Molti quotidiani da leggere e personale molto simpatico.
https://www.yelp.it/biz/caff%C3%A8-torino-torino-2;Il servizio era rapido ma piuttosto freddo.
https://www.yelp.it/biz/caff%C3%A8-mulassano-torino-3;Locale elegante, raffinato, d epoca con marmi e bronzi.
https://www.yelp.it/biz/caff%C3%A8-bodoni-torino;Il servizio è rapido e molto gentile!
https://www.yelp.it/biz/cafe-vergnano-1882-torino;Servizio cortese prezzi adeguati alla qualità .
https://www.yelp.it/biz/cacio-e-pepe-torino;Il locale è molto semplice ed informale, gli spazi molto ristretti fra i vari tavoli.
https://www.yelp.it/biz/busters-coffee-torino;Il locale è molto carino, il personale simpatico.
https://www.yelp.it/biz/burgheria-torino-2;Che dire un ottimo posto per una serata fra amici.
https://www.yelp.it/biz/burgheria-torino;Tutto il personale è sempre gentile e simpatico.. continuate cosi
https://www.yelp.it/biz/bunet-torino;Il locale è abbastanza accogliente, stile liberty-moderno la saletta del bar.
https://www.yelp.it/biz/bucks-g-d-34-torino-2;Alle 00.30 di venerdì sera c'è il gioco del cervellone un modo coinvolgente e divertente di passare la serata.
https://www.yelp.it/biz/brek-torino;Il personale è gentile, molto comodo perchè è sotto i portici e se piove...
https://www.yelp.it/biz/brasserie-bordeaux-torino-3;Locale carino, giovanile, abbastanza affollato ma piacevole.
https://www.yelp.it/biz/brasserie-bordeaux-torino-2;Locale carino, giovanile, abbastanza affollato ma piacevole.
https://www.yelp.it/biz/braceria-signorile-bari;luogo accogliente personale specializzato un rapporto prezzo-qualita' ottimo una serata all'insegna di buon mangiare
https://www.yelp.it/biz/bottega-baretti-moncalieri;Personale gentile, locale carino con ampio dehor.
https://www.yelp.it/biz/botta-bari;Location semplice e accogliente, personale cordiale e disponibile.
https://www.yelp.it/biz/borgo-antico-bari;Il servizio è stato rapido ed estremamente favorevole e piacevole.
https://www.yelp.it/biz/bollicine-di-gigliotti-e-de-bartolo-torino;Personale sempre simpatico ed all'altezza della situazione.
https://www.yelp.it/biz/boja-fauss-torino-2;Personale molto gentile e simpatico, locale accogliente e confortevole!
https://www.yelp.it/biz/boheme-torino;Il posto é comunque piacevole, caldo nell'atmosfera ed informale nell'accoglienza.
https://www.yelp.it/biz/bocciofila-cavorettese-torino;Locale semplice in collina vicino alla piazza di Cavoretto.
https://www.yelp.it/biz/blue-eyes-bari;Locale piuttosto spartano, come anche il servizio.
https://www.yelp.it/biz/blah-blah-torino;Un locale adatto per passare una serata tra amici.
https://www.yelp.it/biz/black-e-white-bari;Posto piacevole , piatti ben presentati ed ottimi.
https://www.yelp.it/biz/black-angus-turin;Cibo di ottima qualità e personale simpatico e super disponibile!!!
https://www.yelp.it/biz/bistrot-turin-torino;Locale piacevole e accogliente con personale cordiale, simpatico e disponibile
https://www.yelp.it/biz/birrificio-torino-torino;Ottimo per una serata in compagnia di amici!
https://www.yelp.it/biz/birreria-la-divina-commedia-torino;Un locale informale per passare una bella serata tra amici.
https://www.yelp.it/biz/birreria-don-giovanni-torino;Presente la TV con eventi sportivi e comunque anche Buona musica di sottofondo.
https://www.yelp.it/biz/big-mama-club-torino;Ambiente accogliente, sembra di essere in un autobus.
https://www.yelp.it/biz/biffi-valenzano;Il personale è cortese e l'atmosfera piacevole.
https://www.yelp.it/biz/bicyclette-torino;Il personale è simpatico e il servizio velocissimo.
https://www.yelp.it/biz/biberon-torino;Il locale è molto semplice, ma l'ambiente è caldo e accogliente.
https://www.yelp.it/biz/biancofiore-bari;Bel locale in pieno centro città, intimo e accogliente, arredato con gusto e semplicità nel rispetto della tradizione.
https://www.yelp.it/biz/bene-cos%C3%AC-torino;Ideale per una serata con gli amici!
https://www.yelp.it/biz/beaubar-torino;personale sempre simpatico ed il titolare é davver.
https://www.yelp.it/biz/bbq-di-pennestri-davide-antonio-c-torino;Ambiente particolare con la lama d'acqua sulla parete, molto bello anche d'estate con il suo dehors sul Po.
https://www.yelp.it/biz/bastimento-torino;Il locale molto carino nel centro di Torino personale molto premuroso e servizio veloce anche se di sabato sera.
https://www.yelp.it/biz/barnum-torino;Consigliato per una serata con amici o con la ragazza!
https://www.yelp.it/biz/bari-napoli-bari;A dire di quest'ultimo la pizza era molto buona, leggera e condita al punto giusto.
https://www.yelp.it/biz/barbagia-di-ollolai-torino;È un locale semplice con cucina semplice, niente ricercatezza nell'arredamento o nei cibi, ma genuinità e cucina casereccia.
https://www.yelp.it/biz/baratti-e-milano-torino-2;Il locale è molto bello e raffinato.
https://www.yelp.it/biz/bar-torrefazione-beccuti-torino;Il personale è molto gentile e disponibile.
https://www.yelp.it/biz/bar-telebari-bari;Gelato buonissimo con molte varietà di gusti.Personale molto gentile e cortese facile da raggiungere
https://www.yelp.it/biz/bar-miramare-bari;Il personale è efficiente e gentile, i prodotti gustosi.
https://www.yelp.it/biz/bar-marconi-di-torre-francesco-torino;Il locale e arredato in modo semplice e il personale e gentile.
https://www.yelp.it/biz/bar-delle-scienze-torino;Personale simpatico e pronto ad ogni esigenza.
https://www.yelp.it/biz/bar-del-duomo-torino;Il locale è piuttosto semplice ma tutto si dimentica quando arrivano i piatti in tavola.
https://www.yelp.it/biz/banco-vini-e-alimenti-torino;Posto accogliente,accettato anche se in tardo pomeriggio di sabato,anche se al Banco (postazione peraltro gradevole essendo solo).
https://www.yelp.it/biz/banco-di-sicilia-torino;Se invece si vuole passare una serata serena con amici allora occorre scegliere un altro locale.
https://www.yelp.it/biz/baccanale-torino;Il personale è gentile ed il locale è accogliente!
https://www.yelp.it/biz/babayaga-bari;tutto freschissimo e personale educato e veloce!
https://www.yelp.it/biz/b2-burger-and-beer-torino;Il personale simpatico e a disposizione per ogni esigenza.
https://www.yelp.it/biz/b-eat-torino;Peccato per queste pecche perché il personale è davvero simpatico.
https://www.yelp.it/biz/augusto-torino;Sicuramente consigliato per passare una bellissima serata in compagnia.
https://www.yelp.it/biz/astoria-torino;Locale bello, ben curato e gestito da persone gentili ed attente.
https://www.yelp.it/biz/art-lunch-di-jo-cafe-torino;Piatti impiattati molto bene ma soprattutto cibo ottimo.
https://www.yelp.it/biz/arigato-torino;La location è carina e c'è anche un dehor per mangiare all'esterno.
https://www.yelp.it/biz/arcadia-torino-4;Tutto sommato una bella serata tra 2 amici.
https://www.yelp.it/biz/antonelli-torino;Prezzi ottimi e personale simpatico e efficiente.
https://www.yelp.it/biz/antichi-sapori-torre-a-mare;Personale gentile e premuroso... ottima frittura di mare grigliata di mare e i primi
https://www.yelp.it/biz/antica-salumeria-torino;Personale simpatico, locale interno con pochi coperti.
https://www.yelp.it/biz/antica-cafetteria-torino;Bel bar con servizio ineccepibile. locale molto bello, arredato con gusto e caffè molto buono
https://www.yelp.it/biz/angolo-del-parin-torino;Il personale è simpatico e a disposizione per chiarimenti sui piatti più tipici.
https://www.yelp.it/biz/anema-e-cozze-torino;Pizza buona ma non sensazionale, come ce ne sono tante a Torino.
https://www.yelp.it/biz/amici-miei-torino;Tutto da provare IL PERSONALE MOLTO GENTILE e simpatico GRAZIE
https://www.yelp.it/biz/america-graffiti-torino;Il personale è molto simpatico e gentile.
https://www.yelp.it/biz/alla-portata-torino;Il locale è semplice, il personale simpatico.
https://www.yelp.it/biz/alla-lettera-torino;Il servizio è stato veloce e il personale simpatico, adeguati i prezzi.
https://www.yelp.it/biz/alivella-torino;Ma merita veramente tanto per la pizza e per passare una bella serata in compagnia di amici!
https://www.yelp.it/biz/aldente-torino;Cibo ottimo, servizio impeccabile, simpatico il proprietario.
https://www.yelp.it/biz/alberto-marchetti-torino-2;Personale abbastanza gentile ed attento alle esigenze del cliente.
https://www.yelp.it/biz/alberto-marchetti-torino;La gelateria è decorata in stile moderno.
https://www.yelp.it/biz/ala-torino;Un ottima trattoria per passare la serata!
https://www.yelp.it/biz/al-sorso-preferito-bari;Servizio impeccabile: personale gentile, simpatico e sempre attento alle esigenze del cliente.
https://www.yelp.it/biz/al-savoia-bari;Forse un tempo era un riferimento per qualità e cortesia ma ora non più.
https://www.yelp.it/biz/al-raffaello-bari;Locale molto curato, ottimo servizio, Personale estremamente gradevole è simpatico allietavano la serata .
https://www.yelp.it/biz/al-pescatore-bari;Personale gentile e professionale, buon rapporto qualità prezzo.
https://www.yelp.it/biz/al-paradise-palese;Personale davvero simpatico e adeguato alla location.
https://www.yelp.it/biz/al-cantuccio-bari;Ottimo per una serata fra amici. locale non elegante
https://www.yelp.it/biz/al-bicerin-torino;Bel locale molto piccolo, storico in centro... buona cioccolata al bicerin caratteristico.
https://www.yelp.it/biz/al-111-bari-2;Bel locale, soprattutto all'esterno, molto ampio e luminoso.
https://www.yelp.it/biz/ai-4-assi-di-sanna-roberto-torino;Serata in famiglia Servizio efficiente e personale cortese.
https://www.yelp.it/biz/ai-2-ghiottoni-bari-2;Per chi vuole passare una serata e gustarsi un ottimo pesce.
https://www.yelp.it/biz/adonis-torino;Il locale è molto bello, con il bel tempo poi si può mangiare nel dehor in piazza.
https://www.yelp.it/biz/a-vucciria-torino;Encomiabile locale adatto per serate in famiglia e tra amici.
https://www.yelp.it/biz/a-picciridda-torino;Personale simpatico,tempi di attesa buoni,pulizia e accoglienza apprezzabili, prezzo...beh,un po alto!!!
https://www.yelp.it/biz/a-la-merenda-sinoira-torino;Ideale per una serata tra amici al cazzeggio!
https://www.yelp.it/biz/a-casa-di-pulcinella-torino;Locale semplice e spartano ideale per cene in gruppo.
https://www.yelp.it/biz/7-nani-torino;Il locale è spartano,come anche il personale che ci lavora.
https://www.yelp.it/biz/1610-bagel-torino;Il personale è molto gentile e simpatico.
