url;review
https://www.yelp.it/biz/ichiban-torino; Molto valido per una serata in compagnia e per mangiare a sazietà. Il servizio é anche veloce e il personale é gentile. Il servizio è buono e rapido, il personale molto cordiale.
https://www.yelp.it/biz/il-brigantino-torino; Personale gentile ma troppo distaccato, manca il rapporto con il cliente. Il personale è gentile, competente ed illustra le varie portate. Il locale è molto accogliente e essenziale.
https://www.yelp.it/biz/il-caciucco-torino; Serata con amici e prima volta al Caciucco. L'accoglienza ed il servizio sono decisamente superiori alla media. Il locale è molto bello e pulito, e si viene accolti da camerieri efficienti e solerti.
https://www.yelp.it/biz/il-cortiletto-torino-2; Buona cucina a vista, dehor nel cortiletto con tavoli apparecchiati sempre sobriamente, ma con i fiori freschi ogni giorno. Se vai in un locale e devi passare la serata in un'atmosfera elettrica meglio farsi due spaghi a casa. Locale delizioso con ottima qualità e portate sfiziose.
https://www.yelp.it/biz/il-fornaccio-bari; Ideale anche per passare una serata con famiglia o amici gustando un ottima pizza. Un locale semplice, con un pizzaiolo di lungo corso. Il locale è molto spartano ma la ristorazione è caratteristica.
https://www.yelp.it/biz/il-gelatiere-bari-3; Il locale semplice ma pulito il personale cortese e attento alle esigenze. Il personale è molto simpatico e ti aiuta nelle scelte quando sei in difficoltà! se volete passare una serata all'insegna della qualità e del risparmio è proprio il posto x voi!
https://www.yelp.it/biz/il-gelato-amico-torino; Altra nota positiva: la gentilezza del personale! Il personale è molto gentile e disponibile. Il locale è pulitissimo e il personale molto gentile.
https://www.yelp.it/biz/il-giglio-torino; Il locale molto accogliente, semplice ma poco moderno. Locale accogliente e informale, è consigliato prenotare. Il locale é una semplice ed informale trattoria ma la cucina di pesce é sempre ottima.
https://www.yelp.it/biz/il-padellino-torino; Serata tra amici di vecchia data in un posto nuovo, con la voglia di provare qualcosa di particolare. Bel locale informale in centro città con menù anche senza glutine. Personale gentile e locale carino, é l'ideale per una cena tra amici o in famiglia.
https://www.yelp.it/biz/il-panino-giusto-torino; molto gentile e disponibile...e poi le attese lunghe e spesso senza motivi ...peccato. Il personale è molto gentile e il servizio celere. Locale carino con un bel dheors, servizio gentile e veloce.
https://www.yelp.it/biz/il-peccato-torino; Ottimo per passare una serata a suon di musica con amici, parenti o con la propria compagna. Consigliatissimo quando volete passare una serata alternativa e poco impegnativa. Il numero uno per passare una serata cantando e bevendo.
https://www.yelp.it/biz/il-porticciolo-torino; Il locale è elegante e raffinato e i prezzi medi, ma il rapporto qualità/prezzo è più che giustificato. Il locale è carino, l'allestimento del tavolo anche. Locale carino e accogliente, un po' retrò, ma non guasta.
https://www.yelp.it/biz/il-ristoro-dei-mercanti-torino; Locale semplice pulito e ben curato, in pieno centro a pochi passi da via Garibaldi. Ambiente famigliare con personale molto gentile e premuroso. Nonostante la cortesia e l'atmosfera accogliente, il risultato finale di questo ristorante rimane scarso.
https://www.yelp.it/biz/il-rospetto-torino; Una varietà di pizze enorme e personale simpatico e veloce. Pizza buona, prezzo medio, d'estate bello il dehor esterno, personale gentile. Il servizio gentile ed anche simpatico con i bambini che non guasta.
https://www.yelp.it/biz/il-rustico-bari; Ottimo posto per passare la serata in compagnia di amici. Il personale è gentile e anche molto simpatico! Spartano . ...ma che soddisfa ampiamente . ...personale gentile e veloce.
https://www.yelp.it/biz/il-sedile-bari; La pizza è buona e sottile ed il servizio rapido. Personale gentile e accogliente e sempre disponibile. Pizza molto buona,sottile , gustosa e invitante.
https://www.yelp.it/biz/il-siculo-di-savona-monica-torino; Prezzi bassissimi e personale simpatico e gentile. L'ambiente è molto familiare e il personale è gentile e simpaticissimo. Il personale è sempre gentile, il locale è piccolo.
https://www.yelp.it/biz/il-tabisca-turin; Il personale gentile ma il balìa degli eventi e della quantità di persone da servire. Il locale è molto ampio ed è suddiviso su due piani, il personale molto professionale e cordiale. La pizza era buona, niente di eccezionale.
https://www.yelp.it/biz/il-vicolo-torino; Servizio: gentile e veloce Prezzo: medio Menu: ampio, con molta scelta e con porzioni davvero abbondanti. Il locale è accogliente, e il personale cortese. Ambiente accogliente e di design, personale gentilissimo e professionale, porzioni abbondanti e cibo di qualità cucinato con originalità.
https://www.yelp.it/biz/imbarchino-torino; Ottimo posto per passare una serata o un pomeriggio d'estate. Il locale è davvero carino..proprio sulla riva del Po.L'atmosfera é informale e il personale gentile e spiritoso! Bella location in riva al Po in mezzo alla natura, ma nel centro della citta`.
https://www.yelp.it/biz/imbarco-perosino-torino; Per passare una bella serata in compagnia come se foste a casa vostra. �? un locale molto spartano, ma piacevole all'interno. Personale simpatico e disponibile, sono dell'idea che molto dipende da come ci si pone...
https://www.yelp.it/biz/in-vino-veritas-torino; Ottima per una serata in compagnia di amici ed un bicchiere di buon vino, in ambiente semplice ed informale. Il personale molto simpatico e disponibile, ambiente informale. Consigliato per una serata fra amici nel cuore di Vanchiglia
https://www.yelp.it/biz/japs-torino-3; Locale carino ed essenziale è perfetto per la pausa pranzo o per le cene veloci. Ci sono tantissime possibilità di scelta comprese delle specialità stagionali.
https://www.yelp.it/biz/john-joy-torino; posto adatto ad una cena di coppia, ma allo stesso tempo pefetto per una tranquilla cena tra amici. La scelta del menù non è molto estesa, ma sicuramente si trova qualcosa che possa soddisfare il proprio gusto. Il cibo davvero buono e il locale molto bello, romantico e riservato.
https://www.yelp.it/biz/john-lennons-torino; Il posto ideale per passare una serata tra amici in allegria. �? adatto per passare una tranquilla serata in compagnia mangiando e bevendo tra bella musica. Che dire....birra ottima e personale simpatico e disponibile !!!
https://www.yelp.it/biz/jolly-principi-di-piemonte-torino; L'ambiente è molto curato e l'atmosfera intima.
https://www.yelp.it/biz/joys-pub-bari; Consigliabile per una serata tra amici o comunque qualcosa di informale. Posto ideale per passare una tranquilla serata tra amici. insomma un bel locale per stare in compagnia di amici, consigliato!!
https://www.yelp.it/biz/jubin-di-hu-lidan-torino; Il personale è stato gentile e il menù vasto. Personale accogliente, attento ai clienti, buon rapporto qualità prezzo. Volendo con meno di 10 euro si può mangiare in abbondanza... personale gentile
https://www.yelp.it/biz/jumping-jester-torino; Locale semplice e carino in zona centrale, a due passi dalla Stazione treni. Locale carino e grande ..... cibo buono ... Personale spesso gentile e piacevole...ma non sempre!
https://www.yelp.it/biz/karmacola-torino; Ottimo per passare una serata immersi nei profumi e i sapori dell'Oriente ad un ottimo rapporto qualità prezzo Il personale molto gentile e la location è particolare Il cibo è ottimo, il personale é cordiale e disponibile, il luogo è caratteristico e ben curato.
https://www.yelp.it/biz/kido-ism-torino; Il locale è molto bello e moderno con pochissimi tavoli e molto distanziati tra loro. accoglienza speciale attenzione a tutti i dettagli cibo raffinato ogni boccone è una esperienza da provare consigliatissimo Il cibo è ottimo, l'ambiente accogliente e il personale molto gentile.
https://www.yelp.it/biz/kipling-torino; Kipling è sempre un buon posto per una serata con amici. Ambiente curato e particolare, servizio simpatico, qualificato e non invadente con una buona carta dei vini. Personale molto gentile, ottima carta dei vini, cibo curato con un ottimo rapporto qualità prezzo.
https://www.yelp.it/biz/km5-torino; Posto interessante per passare una serata a chiaccherare e a bere con gli amici. Ambiente accogliente e moderno e personale disponibile. Locale ampio nella zona del quadrilatero romano.
https://www.yelp.it/biz/l-accademia-del-panino-torino; Panino molto buono e personale troppo simpatico. Personale simpatico, ottimo rapporto qualità / prezzo. Il personale molto simpatico e il servizio super veloce.
https://www.yelp.it/biz/l-aglio-torino; Il locale è ampio con arredo disomogeneo. Il piccolo Dehor esterno contribuisce a rendere il posto molto piacevole. Locale carino ben arredato, personale ottimo, simpatico, giovane e cordiale, mai invadente!
https://www.yelp.it/biz/l-angolo-divino-torino; Locale semplice dentro ma carino,molto belli i tavolini fuori all'aperto. Accogliente e semplice - menu soddisfacente - pizza buona come anche il resto - nel. Locale molto carino, in zona Gran Madre.
https://www.yelp.it/biz/l-birichin-torino-2; Posto molto accogliente con musica di sottofondo per creare la giusta atmosfera per passare una bella serata. Un locale non per tutti . un esperienza da provare per passare una serata diversa dal solito !! Caldo e accogliente, spesso galleria d'arte, moderno ma dal sapore familiare, al Birichin è facile sentirsi a casa.
https://www.yelp.it/biz/l-hamburgueria-di-eataly-torino; Locale molto spartano e personale molto gentile. Consigliato sia per cena veloce all'uscita da lavoro, sia con amici e famiglia. Locale molto carino ed accogliente diviso su due piani per poter accontentare tutti i tipi di clientela...
https://www.yelp.it/biz/l-oca-fola-torino; Il locale è accogliente, il personale simpatico. Locale ampio, personale attento e mai invadente, tempi giusti. Personale simpatico e babyfriendly, la pasta al ragù (ottimo!)
https://www.yelp.it/biz/l-osteria-le-ferriere-torino; Piacevole serata in locale carino e semplice. Bel locale, ottimo per passare una bella serata tra amici. Ottimo ristorante con personale simpatico e cortese.
https://www.yelp.it/biz/la-badessa-torino-2; Il locale è molto carino, ma il dehor sulla piazza è stupendo. Adatto sia ad una cena intima sia ad una cena tra amici (poco rumorosi). Il locale è sicuramente bello, così come quadri ed arredi che creano un'atmosfera sicuramente particolare.
https://www.yelp.it/biz/la-battigia-di-schiralli-antonio-bari; Locale semplice pulitissimo personale gentilissimo e preparato. Personale molto simpatico e disponibile anche se un po' rustico. Ottimo cibo cucinato in maniera impeccabile Crudo freschissimo Personale simpatico e cortese Anche il prezzo ok
https://www.yelp.it/biz/la-botte-gaia-torino; Ristorante piccolo ma accogliente con un personale di eccezionale cortesia e competenza. Troverete questo posto più accogliente e più disponibile per voi! Locale molto carino, 3 tavoli a disposizione dei clienti.
https://www.yelp.it/biz/la-bottega-del-gusto-torino; Il locale è semplice e la cucina riprende i piatti tipici piemontesi. Il ristorante e ben curato ambiente accogliente e ben gestito. Servizio cortese capace di consigliare al meglio.
https://www.yelp.it/biz/la-bufala-torino; Locale carino ma pizza da dimenticare: biscottosa e insipida. Il locale è bello e caratteristico, il personale quasi tutto partenopeo, la qualità della pizza eccellente!
https://www.yelp.it/biz/la-campana-torino-2; Locale semplice e genuino nelll'arredo un po Retrò. Il personale è stato davvero gentile e tra un piatto e l'altro c'è stata pochissima attesa. Il servizio è rapido ed il cameriere che ci portava le pietanze era attento e cortese.
https://www.yelp.it/biz/la-cantina-torino; Ottimo ambiente per una serata tra amici Cibo ottimo ed i costi sono veramente buoni. Se si vuole mangiare bene in in ambiente accogliente... casalingo...
https://www.yelp.it/biz/la-cantinella-torino; Personale molto accogliente, location sofisticata e riservata. Cenato per lavoro ... ottima pizza, ottima carne alla pietra e gentilezza da parte dello staff! Il locale è molto elegante e formale.
https://www.yelp.it/biz/la-capannina-torino-2; Pizza molto buona, piatti ottimi, camerieri gentilissimi. Bel locale, molto di classe, personale molto gentile e servizio efficiente. Anche il personale molto gentile, cordiale e professionale.
https://www.yelp.it/biz/la-casa-del-demone-torino; Personale simpatico e tempi d'attesa nella media. Punto in più: chiude molto tardi e permette di passare lì la serata in compagnia! Ideale per passare una serata fuori dagli schemi.
https://www.yelp.it/biz/la-cecchina-bari; Il locale è bello ed elegante,, con un ampio dehor coperto. Ottimo ristorante materie prime di qualità personale gentile e simpatico bello il locale prezzo adeguato complimenti da parma Il locale è molto carino e i piatti sono davvero squisiti.
https://www.yelp.it/biz/la-cena-coi-fiocchi-torino; Il personale è molto simpatico e so mangia bene. Se volete passare una serata in tranquillità degustando piatti della tradizione piemontese e siciliana non perdetevi questo posto. A mezzogiorno c'è un ottimo menù fisso molto economico oppure spendendo qualcosina in più buona scelta dal menù.
https://www.yelp.it/biz/la-conca-torino-2; Buona accoglienza in ambiente sufficientemente ampio da permettere una cena tranquilla. Il personale inoltre è molto gentile, disponibile e simpatico. Un bel locale tranquillo e raccolto che sicuramente consigliero'.Grazie per la bella serata.
https://www.yelp.it/biz/la-cuite-torino; Il locale è informale con un atmosfera decisamente piacevole e i piatti serviti con un sorriso. Locale molto carino in una zona caratteristica del centro storico di torino. Cibo davvero ottimo e prezzo del tutto ragionevole.
https://www.yelp.it/biz/la-drogheria-torino; Bel locale inserito in un bellissimo contesto. Il locale è molto carino, i camerieri gentili ma il servizio è molto lento. Il locale è molto carino e in una posizione ottima.
https://www.yelp.it/biz/la-fila-torino; Il personale è molto simpatico ed educato. Forno a legna.Locale non molto ampio, servizio veloce. Un bel dehor ed il personale gentile ed efficiente .
https://www.yelp.it/biz/la-gaia-scienza-torino; Il personale è molto simpatico e disponigìbile. Servizio semplice ma con personale gentile e disponibile. Locale semplice ma accogliente e gestito da uno staff gentile e ultradisponibile!
https://www.yelp.it/biz/la-granseola-torino; Ottima la cortesia del personale e l'ambiente è curato e accogliente.
https://www.yelp.it/biz/la-gricia-torino; Se volete passare una serata in ottima compagnia è il locale adatto con cucina genuina!!! Il locale è molto carino e il titolare è simpatico e garbato.... Il locale è ben curato e il servizio è buono.
https://www.yelp.it/biz/la-gustosa-torino; Il locale è ampio ed accogliente con diverse sale a disposizione, il servizio è veloce e puntuale. La pizza invece era davvero molto buona! Ottima la pizza, con un'ampia scelta dal menù, ben cotta e croccante.
https://www.yelp.it/biz/la-limonaia-torino; Atmosfera informale e molto gradevole, un servizio puntuale e preciso. Locale molto curato, perfetto per una serata romantica e servizio impeccabile. Locale molto carino e atmosfera intima e accogliente.
https://www.yelp.it/biz/la-luna-rossa-torino; Personale gentile e simpatico, prezzo assolutamente nella norma. L' ambiente è molto accogliente, il personale simpatico e cordiale. Ottimo per passare una serata in tranquillità godendosi una buona pizza!
https://www.yelp.it/biz/la-madia-torino; Il locale è molto semplice, quasi raccolto, molto famigliare. Ristorante molto carino pochi tavoli fuori dal centro ...apprezzabile per il parcheggio Personale molto gentile e professionale. Cibo ottimo e molto gentili le ragazze di sala attente ad ogni esigenza.
https://www.yelp.it/biz/la-magnolia-torino-3; Serata con amici, all'uscita soddisfatto solo chi ha scelto la pizza. Buona accoglienza, buon cibo e servizio veloce. L'accoglienza è stato buona e il servizio ottimo.
https://www.yelp.it/biz/la-mela-stregata-torino; Il locale è ampio e spazioso, il personale gentile anche se un po' frettoloso Nonostante la gentilezza del personale, l'aperitivo va un po' di traverso :scadente qualità degli alimenti e approssimativa preparazione. Da provare assolutamente le brioches alla nocciola e al cioccolato bianco...personale gentile...sempre aperto, anche in piena notte.
https://www.yelp.it/biz/la-monachella-torino; 'Piacevole serata nel cuore di Torino Ambiente piacevole Gentili il personale Ottima la pizza quasi vera napoletana! Il locale era bello - ama mangiare all'aperto. La pizza è davvero buona e vale la pena provarla.
https://www.yelp.it/biz/la-pace-torino; Il locale è ampio, l'accoglienza buona, ma prezzi sono medio alti. Il cibo ottimo, il ristorante ha un'atmosfera poetica, ottimo anche il personale, un posto veramente gradevole. Ambiente accogliente, nel cuore di San Salvario, non alla moda ma un vecchio ristorante tradizionale.
https://www.yelp.it/biz/la-pagoda-di-hu-lia-meng-torino; Il locale è semplice ma bellissimo, molto ben curato. Bel locale, prezzo molto buono considerando l'alta qualità dei prodotti. Per il resto il locale è molto carino, curato e pulito.
https://www.yelp.it/biz/la-panzanella-torino; L'accoglienza è stata ottima e l'atmosfera piacevole. Ottima la pizza, buona la cucina con i piatti della tradizione di casa. Nonostante ciò la pizza era davvero buona!
https://www.yelp.it/biz/la-parrilla-de-juan-bari; Il proprietario è simpatico e il personale molto gentile ma sinceramente se volete mangiare messicano andate altrove Bella location, buon servizio, personale gentile e preparato. Il locale è carino ed era molto affollato pur essendo un giorno infrasettimanale.
https://www.yelp.it/biz/la-piadineria-torino; Il locale è molto semplice e con posti sedere con sgabelli. Personale gentile, locale un tantino piccolo ma accogliente! Dove si può degustare una buona piadina cotta al momento in una cucina tutta a vista.
https://www.yelp.it/biz/la-piramide-torino; Il personale è gentile e abbastanza veloce. Buon cibo a 2.5 ) limitata gamma di pizza :Euro ma di buona qualità.
https://www.yelp.it/biz/la-provolina-bari; Serata di gruppo tra amici (poco meno di 20 persone). Personale simpatico disponibile e attento ai particolari... Posto carino ed accogliente, anche se di spazio ridotto.
https://www.yelp.it/biz/la-reseda-torino; Locale adatto per una serata senza pretese. Servizio cortese e veloce, locale abbastanza ampio e luminoso. Garanzia di una bella serata con buon cibo e prezzi giusto!
https://www.yelp.it/biz/la-ristonomia-torino; Comunque bella serata in un locale molto accogliente. Il locale molto carino e moderno, il personale cortese. Cena indimenticabile partendo dall'accoglienza della sala e del locale ben curato e pulito.
https://www.yelp.it/biz/la-romana-torino; Il gelato è ottimo ed il personale molto gentile! Personale gentile, locale pulito, gelato molto buono. Il locale è bello e curato, arredato con lo stile che caratterizza tutte le gelaterie di questa catena.
https://www.yelp.it/biz/la-stadera-pizzeria-la-stadera-di-muscariello-s-e-c-pizz-torino; Il locale è molto ampio, con diverse sale e parecchi tavoli. La disponibilità e cortesia del personale è stata ineccepibile, nonostante fosse una serata piuttosto intensa. Il locale è ampio, luminoso, con arredamento classico e funzionale, i tavoli sono posizionati a sufficiente distanza tra loro.
https://www.yelp.it/biz/la-svolta-torino; Cibo buono e personale simpatico e professionale. Comunque resta sempre un posto piacevole per una serata tranquilla. E infine si segnala l'assenza dell'aria condizionata nella saletta in una serata calda.
https://www.yelp.it/biz/la-tana-del-polpo-bari; Servizio perfetto e personale simpatico e disponibile. A questo fa ottima compagnia la gentilezza del personale. Personale gentile e disponibile, proprietario simpatico e super alla mano!!!
https://www.yelp.it/biz/la-taverna-dei-mercanti-turin; Locale caratteristico e personale molto simpatico e disponibile. Bella la location, buona l'accoglienza, ma soprattutto il cibo davvero ottimo. Super consigliato per chi vuole assaggiare i piatti tipici e passare una serata tranquilla in un bel locale.
https://www.yelp.it/biz/la-taverna-greca-torino-2; Ottimo per passare una serata in compagnia di amici o per una cena di coppia. Ottimo per una serata tra amici o in famiglia, ambiente caldo e vivo. Personale gentile,simpatico e dispinibile per ogni richiesta!
https://www.yelp.it/biz/la-uascezze-bari; Personale simpatico e spigliato che ti consiglia. bel locale con piatti tipici del borgo antico bella serata con amici posto veramente tipico personale molto educato Locale semplice, tovagliette di carta, servizio rapido, molto cordiale, prezzo veramente onesto, sicuramente un ottimo rapporto qualità prezzo.
https://www.yelp.it/biz/la-vecchia-europa-torino; Il locale è ampio e piacevole, il personale simpatico ed attento ed il prezzo è giusto. Il locale è ampio e anche la scelta delle pizze. locale molto ampio che può ospitare in contemporanea diverse tavolate numerose.
https://www.yelp.it/biz/la-via-del-sale-torino; Locale carino con arredamento molto semplice in pieno centro. SERVIZIO: 5/5 Personale molto professionale, simpatico, attento e veloce!!! Una bella serata in un ambiente accogliente e caldo.
https://www.yelp.it/biz/la-via-della-seta-torino; Cibo ottimo, presentato con classe e raffinatezza. Locale sempre pulito e personale gentile e cordiale. Ristorante pulito e personale gentile e disponibile.
https://www.yelp.it/biz/la-voglia-matta-torino-6; Giovanni (il proprietario) e' sempre gentile e disponibile, prezzi piu' che giusti e tutto davvero buono!
https://www.yelp.it/biz/las-vegas-torre-a-mare; Locale davvero carino, prezzi medio alti ma che garantiscono una ottima qualità del prodotto.
https://www.yelp.it/biz/le-cantine-di-bacco-torino; Il locale si presenta bene ed il personale è gentile anche se un pò assente. Cibo ottimo a cominciare dai malloreddus che erano meravigliosi. Il locale è accogliente, arredato con mobili di legno, i tavoli sono rustici e l'atmosfera tranquilla.
https://www.yelp.it/biz/le-due-antenne-bari; Serata con amici all'insegna della genuinità tipica della cucina barese. Locale ampio, personale cordiale, grandissima abbuffata di antipasti vari caldi, freddi, carne e pesce. La pizza è buona ma non eccellente.
https://www.yelp.it/biz/le-grand-tabu-bari; Per il titolare: non basta avere un bel locale e mettere bella musica con qualche bottiglia esposta !!! Una bella location.Il cibo molto buono anche se servito freddo.Cocktail ottimi.unica ma grande pecca,la cameriera!
https://www.yelp.it/biz/le-mura-bari; Consigliato anche per il servizio molto cortese, celere e disponibile! volete un posto accogliente e quasi intimo con una ottima pizza e una scelta di birre non usuale?
https://www.yelp.it/biz/le-plus-bon-bari; Personale gentile e simpatico, ottima pizza, prezzi contenuti. La pizza è sempre buona e ben condita! Ottima pizza, pizza per tutti i gusti e soprattutto a costi contenuti, menù adeguati per famiglie, Consigliatissima
https://www.yelp.it/biz/le-putrelle-osteria-torino; Locale semplice ed un tantino dimesso, ma tutto pieno, nonostante fosse lunedì. Locale carino, semplice, che si affaccia su una via abbastanza trafficata e disturbata. Locale carino adatto sia per una cena con amici sia per una coppia.
https://www.yelp.it/biz/le-rondini-torino; Il locale è molto semplice e tranquillo. Ottimo posto per passare una serata tra amici Il tutto in locale semplice con sevizio cortese e celere.
https://www.yelp.it/biz/le-tre-lanterne-bari; Locale spartano e molto genuino a conduzione familiare. Pizza molto buona, così come i loro calamari freschi !!! Il personale è gentile e il prezzi non sono economici, ma comunque nella fascia media
https://www.yelp.it/biz/le-veronique-bari-2; Aria condizionata, possibilità di seguire eventi sportivi e un servizio rapido e soddisfacente. Locale ampio e servizio efficiente e gentile. Bel locale, servizio celere e simpatico, pulizia assoluta.
https://www.yelp.it/biz/le-vitel-etonne-torino; Locale accogliente ed informale nel pieno centro di Torino. Il locale non è molto ampio, ma i tavoli sono sistemati in modo abbastanza razionale. Se non volete perdervi una bella serata o un buon pranzo passate dalla cucina di Vitel etonné.
https://www.yelp.it/biz/libery-pizza-e-artigianal-beer-torino; Locale molto carino,semplice ma ben curato, perfetta l'accoglienza dei proprietari ed il personale molto gentile e professionale. La pizza molto buona, con ingredienti di qualità. Ottima pizza con ingredienti genuini e di qualità !
https://www.yelp.it/biz/lo-scugnizzo-torino; Serata tra amici passata molto bene, cibo ottimo pizza gustosa, staff simpatico e comoetente Consigliato Ottima accoglienza e ottimo servizio da parte del personale. Locale carino ma con tavoli troppo vicini tra loro.
https://www.yelp.it/biz/lo-sfizio-bitritto; I sorrisi e la disponibilità dei proprietari ti accolgono in questo locale bello e caratteristico. Il personale è sempre gentile e molto disponibile. Location molto carina situata nel centro storico.
https://www.yelp.it/biz/lo-stonnato-torino; Locale semplice ma carino in San Salvario. Location carina semplice ma pulita e ordinata. Ristorante molto curato in centro a san salvario per cui perfetto per iniziare una serata tra amici!
