url;review
https://www.yelp.it/biz/moderat-bari;Personale comunque simpatico.. carino per gruppi numerosi.. per festeggiare nella parte esterna.
https://www.yelp.it/biz/mixer-bar-di-figliolia-m-torino;Personale gentile, è un bar che offre tutti i servizi di un esercizio di questo tipo.
https://www.yelp.it/biz/mister-hu-torino;buon cibo e bel locale, animato ed allegro. si mangia benone ed è l'ideale per cenare con gli amici.
https://www.yelp.it/biz/mina-torino;Locale semplice, ma il personale è molto gentile e la qualità del cibo molto buona.
https://www.yelp.it/biz/michi-tanzariello-torino;Il locale è piuttosto ampio arredato con gusto.
https://www.yelp.it/biz/miagola-cafe-torino;Location troppo carina, personale giovane, gentile e molto simpatico.
https://www.yelp.it/biz/mezzaluna-osteria-torino;Location carina, personale molto simpatico e disponibile.
https://www.yelp.it/biz/mexico-70-torino;Locale ampio, pulito anche dehor con ampio spazio.
https://www.yelp.it/biz/messicano-mamasita-torino;Ottima serata in compagnia di buon cibo messicano!
https://www.yelp.it/biz/menupizza-torino;Personale molto gentile , il locale appena ristrutturato , molto pulito e spazioso
https://www.yelp.it/biz/menodiciotto-torino;La cameriera piccolina é davvero molto gentile e disponibile...fa delle bellissime torte.
https://www.yelp.it/biz/mc-donalds-torino-2;Il locale si presenta come tutti quelli di questa catena, pulizia abbastanza buona e servizio discreto.
https://www.yelp.it/biz/mc-donald-torino;Locale molto ampio, con anche dehor esterno.
https://www.yelp.it/biz/mazzini-38-torino;Locale molto carino e moderno situato vicino al centro di Torino.
https://www.yelp.it/biz/matti-brown-bari;bel locale e piatti sfiziosi. personale gentile e simpatico. posto molto bello un pochino caro e piatti contenuti
https://www.yelp.it/biz/mastro-ciccio-di-mastrandrea-fabio-bari;Locale accogliente e giovanile, personale molto professionale.
https://www.yelp.it/biz/master-sandwich-torino;Servizio rapido e compagine lavorativa giovanile e allegra.
https://www.yelp.it/biz/masaniello-%C3%A9-turnat-torino;Locale carino, tutto intitolato ad un grande della storia popolare partenopea, Masaniello!
https://www.yelp.it/biz/martinucci-bari-2;Il personale è abbastanza gentile, ma sono molto lenti nel servire, anche quando non c'è gente.
https://www.yelp.it/biz/martin-pescatore-torino;Arredamento semplice con servizio molto professionale ed abbastanza rapido.
https://www.yelp.it/biz/marhaba-torino;Il personale è gentile e simpatico, disposto a dare consigli anche a chi non conosce questa cucina.
https://www.yelp.it/biz/mara-dei-boschi-torino;Il personale é sempre molto gentile e cortese!
https://www.yelp.it/biz/manhattan-pub-torino;Consigliato per una serata tra amici golosi!
https://www.yelp.it/biz/mamma-mia-torino-2;Buon cibo da condividere per una serata tra amici, rapporto qualità/prezzo ottimo.
https://www.yelp.it/biz/maltos-beer-bari;Perfetto per una serata con amici o in coppia.
https://www.yelp.it/biz/magorabin-torino;Locale non troppo ampio e finemente arredato.
https://www.yelp.it/biz/macario-caffe-torino;Personale poco simpatico Drink ... nulla di speciale...
https://www.yelp.it/biz/m-bun-torino-3;Serata con amici, menù a 11euro con panino vegetariano, patatine e vino.
https://www.yelp.it/biz/m-bun-torino;Formula del fast food self service ma in un ambiente molto accogliente e simpatico.
https://www.yelp.it/biz/lucky-nugget-saloon-torino;Tavoli ben distanziati locale carino, esperienza buona
https://www.yelp.it/biz/luce-e-gas-torino-2;Il locale è carino, ampio ed in stile orientale.
https://www.yelp.it/biz/lord-nelson-torino;Il posto ideale per passare una serata tra amici, atmosfera e arredamento da vero pub inglese!
https://www.yelp.it/biz/locanda-da-betty-torino;Il locale è semplice, dai colori caldi, arredato in modo volutamente spartano.
https://www.yelp.it/biz/lobelix-torino;Consigliato per passare una serata in compagnia.
https://www.yelp.it/biz/lo-stonnato-torino;Locale semplice ma carino in San Salvario.
https://www.yelp.it/biz/lo-sfizio-bitritto;I sorrisi e la disponibilità dei proprietari ti accolgono in questo locale bello e caratteristico.
https://www.yelp.it/biz/lo-scugnizzo-torino;Serata tra amici passata molto bene, cibo ottimo pizza gustosa, staff simpatico e comoetente Consigliato
https://www.yelp.it/biz/libery-pizza-e-artigianal-beer-torino;Locale molto carino,semplice ma ben curato, perfetta l'accoglienza dei proprietari ed il personale molto gentile e professionale.
https://www.yelp.it/biz/le-vitel-etonne-torino;Locale accogliente ed informale nel pieno centro di Torino.
https://www.yelp.it/biz/le-veronique-bari-2;Aria condizionata, possibilità di seguire eventi sportivi e un servizio rapido e soddisfacente.
https://www.yelp.it/biz/le-tre-lanterne-bari;Locale spartano e molto genuino a conduzione familiare.
https://www.yelp.it/biz/le-rondini-torino;Il locale è molto semplice e tranquillo.
https://www.yelp.it/biz/le-putrelle-osteria-torino;Locale semplice ed un tantino dimesso, ma tutto pieno, nonostante fosse lunedì.
https://www.yelp.it/biz/le-plus-bon-bari;Personale gentile e simpatico, ottima pizza, prezzi contenuti.
https://www.yelp.it/biz/le-mura-bari;Consigliato anche per il servizio molto cortese, celere e disponibile!
https://www.yelp.it/biz/le-grand-tabu-bari;Per il titolare: non basta avere un bel locale e mettere bella musica con qualche bottiglia esposta !!!
https://www.yelp.it/biz/le-due-antenne-bari;Serata con amici all'insegna della genuinità tipica della cucina barese.
https://www.yelp.it/biz/le-cantine-di-bacco-torino;Il locale si presenta bene ed il personale è gentile anche se un pò assente.
https://www.yelp.it/biz/las-vegas-torre-a-mare;Locale davvero carino, prezzi medio alti ma che garantiscono una ottima qualità del prodotto.
https://www.yelp.it/biz/la-voglia-matta-torino-6;Giovanni (il proprietario) e' sempre gentile e disponibile, prezzi piu' che giusti e tutto davvero buono!
https://www.yelp.it/biz/la-via-della-seta-torino;Cibo ottimo, presentato con classe e raffinatezza.
https://www.yelp.it/biz/la-via-del-sale-torino;Locale carino con arredamento molto semplice in pieno centro.
https://www.yelp.it/biz/la-vecchia-europa-torino;Il locale è ampio e piacevole, il personale simpatico ed attento ed il prezzo è giusto.
https://www.yelp.it/biz/la-uascezze-bari;Personale simpatico e spigliato che ti consiglia.
https://www.yelp.it/biz/la-taverna-greca-torino-2;Ottimo per passare una serata in compagnia di amici o per una cena di coppia.
https://www.yelp.it/biz/la-taverna-dei-mercanti-turin;Locale caratteristico e personale molto simpatico e disponibile.
https://www.yelp.it/biz/la-tana-del-polpo-bari;Servizio perfetto e personale simpatico e disponibile.
https://www.yelp.it/biz/la-svolta-torino;Cibo buono e personale simpatico e professionale.
https://www.yelp.it/biz/la-stadera-pizzeria-la-stadera-di-muscariello-s-e-c-pizz-torino;Il locale è molto ampio, con diverse sale e parecchi tavoli.
https://www.yelp.it/biz/la-romana-torino;Il gelato è ottimo ed il personale molto gentile!
https://www.yelp.it/biz/la-ristonomia-torino;Comunque bella serata in un locale molto accogliente.
https://www.yelp.it/biz/la-reseda-torino;Locale adatto per una serata senza pretese.
https://www.yelp.it/biz/la-provolina-bari;Serata di gruppo tra amici (poco meno di 20 persone).
https://www.yelp.it/biz/la-piramide-torino;Il personale è gentile e abbastanza veloce.
https://www.yelp.it/biz/la-piadineria-torino;Il locale è molto semplice e con posti sedere con sgabelli.
https://www.yelp.it/biz/la-parrilla-de-juan-bari;Il proprietario è simpatico e il personale molto gentile ma sinceramente se volete mangiare messicano andate altrove
https://www.yelp.it/biz/la-panzanella-torino;L'accoglienza è stata ottima e l'atmosfera piacevole.
https://www.yelp.it/biz/la-pagoda-di-hu-lia-meng-torino;Il locale è semplice ma bellissimo, molto ben curato.
https://www.yelp.it/biz/la-pace-torino;Il locale è ampio, l'accoglienza buona, ma prezzi sono medio alti.
https://www.yelp.it/biz/la-monachella-torino;'Piacevole serata nel cuore di Torino Ambiente piacevole Gentili il personale Ottima la pizza quasi vera napoletana!
https://www.yelp.it/biz/la-mela-stregata-torino;Il locale è ampio e spazioso, il personale gentile anche se un po' frettoloso
https://www.yelp.it/biz/la-magnolia-torino-3;Serata con amici, all'uscita soddisfatto solo chi ha scelto la pizza.
https://www.yelp.it/biz/la-madia-torino;Il locale è molto semplice, quasi raccolto, molto famigliare.
https://www.yelp.it/biz/la-luna-rossa-torino;Personale gentile e simpatico, prezzo assolutamente nella norma.
https://www.yelp.it/biz/la-limonaia-torino;Atmosfera informale e molto gradevole, un servizio puntuale e preciso.
https://www.yelp.it/biz/la-gustosa-torino;Il locale è ampio ed accogliente con diverse sale a disposizione, il servizio è veloce e puntuale.
https://www.yelp.it/biz/la-gricia-torino;Se volete passare una serata in ottima compagnia è il locale adatto con cucina genuina!!!
https://www.yelp.it/biz/la-granseola-torino;Ottima la cortesia del personale e l'ambiente è curato e accogliente.
https://www.yelp.it/biz/la-gaia-scienza-torino;Il personale è molto simpatico e disponigìbile.
https://www.yelp.it/biz/la-fila-torino;Il personale è molto simpatico ed educato.
https://www.yelp.it/biz/la-drogheria-torino;Bel locale inserito in un bellissimo contesto.
https://www.yelp.it/biz/la-cuite-torino;Il locale è informale con un atmosfera decisamente piacevole e i piatti serviti con un sorriso.
https://www.yelp.it/biz/la-conca-torino-2;Buona accoglienza in ambiente sufficientemente ampio da permettere una cena tranquilla.
https://www.yelp.it/biz/la-cena-coi-fiocchi-torino;Il personale è molto simpatico e so mangia bene.
https://www.yelp.it/biz/la-cecchina-bari;Il locale è bello ed elegante, con un ampio dehor coperto.
https://www.yelp.it/biz/la-casa-del-demone-torino;Personale simpatico e tempi d'attesa nella media.
https://www.yelp.it/biz/la-capannina-torino-2;Pizza molto buona, piatti ottimi, camerieri gentilissimi.
https://www.yelp.it/biz/la-cantinella-torino;Personale molto accogliente, location sofisticata e riservata.
https://www.yelp.it/biz/la-cantina-torino;Ottimo ambiente per una serata tra amici
https://www.yelp.it/biz/la-campana-torino-2;Locale semplice e genuino nelll'arredo un po Retrò.
https://www.yelp.it/biz/la-bufala-torino;Locale carino ma pizza da dimenticare: biscottosa e insipida.
https://www.yelp.it/biz/la-bottega-del-gusto-torino;Il locale è semplice e la cucina riprende i piatti tipici piemontesi.
https://www.yelp.it/biz/la-botte-gaia-torino;Ristorante piccolo ma accogliente con un personale di eccezionale cortesia e competenza.
https://www.yelp.it/biz/la-battigia-di-schiralli-antonio-bari;Locale semplice pulitissimo personale gentilissimo e preparato.
https://www.yelp.it/biz/la-badessa-torino-2;Il locale è molto carino, ma il dehor sulla piazza è stupendo.
https://www.yelp.it/biz/l-osteria-le-ferriere-torino;Piacevole serata in locale carino e semplice.
https://www.yelp.it/biz/l-oca-fola-torino;Il locale è accogliente, il personale simpatico.
https://www.yelp.it/biz/l-hamburgueria-di-eataly-torino;Locale molto spartano e personale molto gentile.
https://www.yelp.it/biz/l-birichin-torino-2;Posto molto accogliente con musica di sottofondo per creare la giusta atmosfera per passare una bella serata.
https://www.yelp.it/biz/l-angolo-divino-torino;Locale semplice dentro ma carino,molto belli i tavolini fuori all'aperto.
https://www.yelp.it/biz/l-aglio-torino;Il locale è ampio con arredo disomogeneo.
https://www.yelp.it/biz/l-accademia-del-panino-torino;Panino molto buono e personale troppo simpatico.
https://www.yelp.it/biz/km5-torino;Posto interessante per passare una serata a chiacchierare e a bere con gli amici.
https://www.yelp.it/biz/kipling-torino;Kipling è sempre un buon posto per una serata con amici.
https://www.yelp.it/biz/kido-ism-torino;Il locale è molto bello e moderno con pochissimi tavoli e molto distanziati tra loro.
https://www.yelp.it/biz/karmacola-torino;Ottimo per passare una serata immersi nei profumi e i sapori dell'Oriente ad un ottimo rapporto qualità prezzo
https://www.yelp.it/biz/jumping-jester-torino;Locale semplice e carino in zona centrale, a due passi dalla Stazione treni.
https://www.yelp.it/biz/jubin-di-hu-lidan-torino;Il personale è stato gentile e il menù vasto.
https://www.yelp.it/biz/joys-pub-bari;Consigliabile per una serata tra amici o comunque qualcosa di informale.
https://www.yelp.it/biz/jolly-principi-di-piemonte-torino;L'ambiente è molto curato e l'atmosfera intima.
https://www.yelp.it/biz/john-lennons-torino;Il posto ideale per passare una serata tra amici in allegria.
https://www.yelp.it/biz/john-joy-torino;posto adatto ad una cena di coppia, ma allo stesso tempo pefetto per una tranquilla cena tra amici.
https://www.yelp.it/biz/japs-torino-3;Locale carino ed essenziale è perfetto per la pausa pranzo o per le cene veloci.
https://www.yelp.it/biz/in-vino-veritas-torino;Ottima per una serata in compagnia di amici ed un bicchiere di buon vino, in ambiente semplice ed informale.
https://www.yelp.it/biz/imbarco-perosino-torino;Per passare una bella serata in compagnia come se foste a casa vostra.
https://www.yelp.it/biz/imbarchino-torino;Ottimo posto per passare una serata o un pomeriggio d'estate.
https://www.yelp.it/biz/il-vicolo-torino;Servizio: gentile e veloce Prezzo: medio Menu: ampio, con molta scelta e con porzioni davvero abbondanti.
https://www.yelp.it/biz/il-tabisca-turin;Il personale gentile ma il balìa degli eventi e della quantità di persone da servire.
https://www.yelp.it/biz/il-siculo-di-savona-monica-torino;Prezzi bassissimi e personale simpatico e gentile.
https://www.yelp.it/biz/il-sedile-bari;La pizza è buona e sottile ed il servizio rapido.
https://www.yelp.it/biz/il-rustico-bari;Ottimo posto per passare la serata in compagnia di amici.
https://www.yelp.it/biz/il-rospetto-torino;Una varietà di pizze enorme e personale simpatico e veloce.
https://www.yelp.it/biz/il-ristoro-dei-mercanti-torino;Locale semplice pulito e ben curato, in pieno centro a pochi passi da via Garibaldi.
https://www.yelp.it/biz/il-porticciolo-torino;Il locale è elegante e raffinato e i prezzi medi, ma il rapporto qualità/prezzo è più che giustificato.
https://www.yelp.it/biz/il-peccato-torino;Ottimo per passare una serata a suon di musica con amici, parenti o con la propria compagna.
https://www.yelp.it/biz/il-panino-giusto-torino;molto gentile e disponibile...e poi le attese lunghe e spesso senza motivi ...peccato.
https://www.yelp.it/biz/il-padellino-torino;Serata tra amici di vecchia data in un posto nuovo, con la voglia di provare qualcosa di particolare.
https://www.yelp.it/biz/il-giglio-torino;Il locale molto accogliente, semplice ma poco moderno.
https://www.yelp.it/biz/il-gelato-amico-torino;Altra nota positiva: la gentilezza del personale!
https://www.yelp.it/biz/il-gelatiere-bari-3;Il locale semplice ma pulito il personale cortese e attento alle esigenze.
https://www.yelp.it/biz/il-fornaccio-bari;Ideale anche per passare una serata con famiglia o amici gustando un ottima pizza.
https://www.yelp.it/biz/il-cortiletto-torino-2;Buona cucina a vista, dehor nel cortiletto con tavoli apparecchiati sempre sobriamente, ma con i fiori freschi ogni giorno.
https://www.yelp.it/biz/il-caciucco-torino;Serata con amici e prima volta al Caciucco.
https://www.yelp.it/biz/il-brigantino-torino;Personale gentile ma troppo distaccato, manca il rapporto con il cliente.
https://www.yelp.it/biz/ichiban-torino;Molto valido per una serata in compagnia e per mangiare a sazietà.
https://www.yelp.it/biz/ichi-torino;Locale semplice, ma carino e personale gentile
https://www.yelp.it/biz/i-tesori-bari;Locale molto carino, personale gentile e disponibile.
https://www.yelp.it/biz/i-tartufi-bistrot-torino;Arredamento moderno ed essenziale con cucina a vista.
https://www.yelp.it/biz/i-soliti-amici-torino;Il locale è ampio, luminoso, adatto a tavolate, senza essere rumoroso.
https://www.yelp.it/biz/huntsman-pub-torino;Bel pub per passare una serata con amici.
https://www.yelp.it/biz/hua-li-du-torino;Un plauso anche per accoglienza e servizio.
https://www.yelp.it/biz/hua-dou-cheng-torino;Servizio discreto e informale ideale per passare una serata allegra e low cost.
https://www.yelp.it/biz/horas-kebab-torino;Il locale è molto ampio, con dehor, moderno.
https://www.yelp.it/biz/home-burger-palese;Il personale però è gentile e simpatico!
https://www.yelp.it/biz/hokkaido-torino;Il personale e' comunque molto gentile e simpatico.
https://www.yelp.it/biz/happy-days-bar-torino;Panettoni molto invitanti e personale simpatico .
https://www.yelp.it/biz/habanero-torino-2;L'atmosfera è davvero quella giusta sia per passare una serata in compagnia ma anche per delle cenette intime.
https://www.yelp.it/biz/gyrosteria-yannis-bari-2;Ottimo panino e moglie soddisfattissima... locale molto carino e caratteristico a due passi dall'ateneo...
https://www.yelp.it/biz/gusti-e-sapori-torino;Si mangia bene personale attento cordiale e simpatico locale accogliente.
https://www.yelp.it/biz/gulp-bari;Il locale semplice, moderno, alternativo, giovanile come il nome che porta.
https://www.yelp.it/biz/guido-gobino-torino-3;Questa camera deliziosa è l'aria condizionata !!!
https://www.yelp.it/biz/gufo-bianco-torino;Personale molto simpatico e cordiale, prezzo giusto.
https://www.yelp.it/biz/grotta-azzurra-bari;In generale il locale è carino ma manca atmosfera, il cameriere è cortese ma freddo.
https://www.yelp.it/biz/grom-torino-4;Il personale è gentile ed il posto ben collegato coi mezzi e vicino ad un parcheggio multipiano, facilmente accessibile.
https://www.yelp.it/biz/grom-torino-2;Gelati di ottima qualità e personale gentile.
https://www.yelp.it/biz/grom-torino;Piacevolissima sorpresa assaggiare un gelato di qualità così alta in una catena.Fossero tutte così.Promossi !!!
https://www.yelp.it/biz/grill-burger-house-bari;Il personale molto gentile ha reso la serata perfetta!!
https://www.yelp.it/biz/grezzo-torino;Locale molto bello e curato, pasticcini e prelibatezze che sembrano gioielli, alcuni poi vari altri a prezzo normale.
https://www.yelp.it/biz/grande-muraglia-di-zhans-rong-e-li-songhai-torino;La qualità degli ingredienti è molto buona ed il servizio abbastanza veloce.
https://www.yelp.it/biz/granbar-torino;Super consigliato per passare una serata in compagnia o una cena.
https://www.yelp.it/biz/giusti-torino;Valido per una serata in compagnia di amici.
https://www.yelp.it/biz/giudice-esercizio-torino;L'occasione richiedeva una cena speciale e lo chef si è messo a completa disposizione per la scelta del menù.
https://www.yelp.it/biz/giapponese-xia-torino;Bel locale, personale cortese, cucina in stile made in Japan.
https://www.yelp.it/biz/giapponese-sakura-torino;Locale carino e simpatico ma per l'educazione non ci rientrerò più!
https://www.yelp.it/biz/gennaro-esposito-torino-2;Personale accogliente e simpatico e i prezzi sono nella media.
https://www.yelp.it/biz/gelateria-popolare-torino;Davvero un'ottima meta per una serata in compagnia, gustando delle prelibatezze sane e naturali.
https://www.yelp.it/biz/gelateria-piu-di-un-gelato-torino;locale piccolo pulito e personale gentile e paziente e davvero professionale.
https://www.yelp.it/biz/gelateria-piccinni-bari;Un plauso anche al personale gentile e cordiale.
https://www.yelp.it/biz/gelateria-monginevro-smaldone-raffaele-torino;Il personale è sempre gentile e sorridente: caratteristica molto rara da trovare nella maggior parte dei posti.
https://www.yelp.it/biz/gelateria-mondello-torino;Personale simpatico e disponibile, peccato che non facciano il cono piccolo anche per gli adulti.
https://www.yelp.it/biz/gelateria-miretti-torino-7;Locale curato e pulito che offre piatti semplici per una pausa pranzo leggera e sfiziosa.
https://www.yelp.it/biz/gelateria-grom-torino-2;Il personale è gentile ma ha modi di fare molto sbrigativi.
https://www.yelp.it/biz/gelateria-due-salette-torino;Qualità bassa e personale non simpatico per nulla.
https://www.yelp.it/biz/gelateria-delle-alpi-torino;Il personale è educato e informale, il servizio è lento.
https://www.yelp.it/biz/gaudenti-1971-torino;La location è carina, nuova, molto elegante e moderna.
https://www.yelp.it/biz/gatsbys-torino;Locale in stile moderno direttamente su una delle vie più belle e frequentate di Torino.
https://www.yelp.it/biz/gasperini-bari;Personale gentile e simpatico da provare sicuramente !!!
https://www.yelp.it/biz/garden-caffetteria-torino;Inoltre Non é adatto ad una cena romantica!
https://www.yelp.it/biz/gandhi-torino;L'ideale per una cena fra amici e/o in famiglia.
https://www.yelp.it/biz/galante-torino;Carta dei vini discreta e locale elegante anche se in stile primo  900.
https://www.yelp.it/biz/fuzion-torino;Piatti deliziosi e personale molto simpatico che ti consiglia il meglio...
https://www.yelp.it/biz/frulez-bari;Locale simpatico con servizio rapido ed efficace.
https://www.yelp.it/biz/friedas-pub-torino;Cucina nella media di un locale di questo tipo e servizio gentile.
https://www.yelp.it/biz/fratelli-roselli-torino;.... per una piacevole serata tra amici.
https://www.yelp.it/biz/fratelli-la-cozza-torino-2;Locale davvero ampio dallo stile eclettico ed informale.
https://www.yelp.it/biz/forchetta-e-scarpetta-torino;Locale piccolo ma accogliente personale simpatico e ben disposto.
https://www.yelp.it/biz/focacceria-tipica-ligure-torino;Locale molto spartano ma adatto per uno spuntino di pranzo veloce ed economico.
https://www.yelp.it/biz/focacceria-santagostino-torino-2;Il locale è carino, semplice ed essenziale nell'arredamento.
https://www.yelp.it/biz/focacceria-santagostino-torino;Il locale è carino, semplice ed essenziale nell'arredamento.
https://www.yelp.it/biz/fiorio-gelateria-torino;Interno carino e personale gentile, tutto molto buono
https://www.yelp.it/biz/fiorfood-torino;Il posto è interessante e la gentilezza del personale mette a proprio agio.
https://www.yelp.it/biz/filo-di-marianna-torino;La cucina è semplice ma ottima per preparazione e freschezza dei cibi e il servizio è cortese e amichevole.
https://www.yelp.it/biz/fassoneria-torino;Locale semplice, moderno con simpatiche tovagliette americane ai tavoli, spazio all'aperto disponibile.
https://www.yelp.it/biz/farmacia-dei-sani-bari;Il locale è molto bello e particolare, l'accoglienza e il cibo davvero ottimi.
https://www.yelp.it/biz/exki-pietro-micca-torino;Locale molto carino con prodotti vegetariani e vegani.
https://www.yelp.it/biz/exki-giolitti-torino-3;Locale ampio e luminoso con vetrata che da su via Carlo Alberto.
https://www.yelp.it/biz/exki-8-gallery-torino-2;Il personale è molto gentile e amichevole.
https://www.yelp.it/biz/estrella-do-sul-torino;Il locale è molto semplice, pulito e curato.
https://www.yelp.it/biz/esperia-torino-2;Il personale é molto gentile e simpatico.
https://www.yelp.it/biz/eos-torino;Bello vedere come ad un giovane chef visualizzazione ad un senso matura di ciò che è buon cibo.
https://www.yelp.it/biz/enzo-e-grazia-di-matera-grazia-torino;Il dehor è piccolo ma accogliente e il personale gentile.
https://www.yelp.it/biz/entremetier-di-lingweifu-torino;Personale gentile, location non di lusso, ma pulita.
https://www.yelp.it/biz/eno-libero-emporio-enogastronomico-torino;Il locale è carino, forse un po' dispersivo ma ampio.
https://www.yelp.it/biz/emporio-gastronomico-torino;Nel quartiere della Crocetta un bel locale antico con uno spazioso dehor moderno.
https://www.yelp.it/biz/el-centenario-torino-2;Il personale è molto accogliente e simpatico.
https://www.yelp.it/biz/eataly-torino-torino;La pizza è buona, quella fritta ancora meglio.
https://www.yelp.it/biz/eataly-bari;Locale molto carino,però andare ad una serata siciliana e aver finito gli arancini,non è possibile,disorganizzazione
https://www.yelp.it/biz/eat-sicily-torino;Buona accoglienza, veloce spiegazione del menù della serata.
https://www.yelp.it/biz/dublin-house-bari;Insomma...un bel posto per una piacevole serata in compagnia di amici!
https://www.yelp.it/biz/doubletree-torino;Il personale è molto accogliente, attento e cortese.
https://www.yelp.it/biz/dorian-gray-torino;Consigliatissimo per passare una buona serata con gli amici e un'ottima birra, ma anche con il proprio partner.
https://www.yelp.it/biz/don-panino-torino;Grande assortimento e personale davvero simpatico e gentile.
https://www.yelp.it/biz/don-gennaro-torino;Locale semplice e datato con pochi coperti.
https://www.yelp.it/biz/dolce-mania-di-lepori-raffaele-torino;Il locale è accogliente, con le vetrine presentate molto bene.
https://www.yelp.it/biz/dolce-basilico-torino;Il locale non è una classica pizzeria in cui passare una serata.
https://www.yelp.it/biz/dog-out-presso-otto-gallery-torino;Consigliato per il buon cibo, per il servizio e la cortesia del gestore
https://www.yelp.it/biz/diecicento-torino-2;Una bella serata fra amici, bei momenti e buoni sapori.
https://www.yelp.it/biz/dess%C3%AC-torino;Prezzi nella norma e locale carino, ma niente di che
https://www.yelp.it/biz/delfino-blu-torino;Provato in serata con amici ottimo ristorante con bella proposta vini .
https://www.yelp.it/biz/dausin-torino;Locale carino per una serata tra amici, con un'ottimo rapporto qualità prezzo.
https://www.yelp.it/biz/dal-vecchio-torino;Cena con genitori ed amici trascorsa in un bel locale con splendide persone.
https://www.yelp.it/biz/dai-saletta-torino-2;Locale spartano ma carino, servizio simpatico anche se non proprio rapidissimo.
https://www.yelp.it/biz/da-paolo-bari;La location è semplice ed informale ed il personale molto gentile .
https://www.yelp.it/biz/da-mauro-torino;Il personale è molto simpatico e cortese per fortuna
