url;review
https://www.yelp.it/biz/zucca-torino;Buona soluzione per trascorrere un' oretta con gli amici in un locale accogliente.
https://www.yelp.it/biz/zonk-di-brigada-igor-torino;Il locale è molto semplice e il personale gentile e disponibile.
https://www.yelp.it/biz/zichella-torino;Il locale è semplice, funzionale ma accogliente.
https://www.yelp.it/biz/zelli-wine-bar-torino;una tranquilla serata tra amici trascorsa allo zelli Bar.
https://www.yelp.it/biz/yu-jiasheng-torino;Ma il personale è sempre stato gentile e sorridente.
https://www.yelp.it/biz/younger-pub-bari;Serata con amici trascorsa in questo pub in compagnia di ottimo cibo.
https://www.yelp.it/biz/wispobish-torino;Servizio gentile, insomma un posto in cui passare una bella serata.
https://www.yelp.it/biz/winston-churchill-new-pub-torino;Il personale è simpatico e alla mano.
https://www.yelp.it/biz/windigo-saloon-bari;Perfetto per una serata con gli amici.
https://www.yelp.it/biz/waxy-torino;Personale gentile, prezzi nella media (media birra 5€), e bella ambientazione.
https://www.yelp.it/biz/wasabi-torino;Locale semplice e essenziale, nel tipico stile giapponese.
https://www.yelp.it/biz/walima-torino;Ottima soluzione per passare una serata alternativa.
https://www.yelp.it/biz/volver-torino-2;Locale semplice e puoi starci quanto vuoi.
https://www.yelp.it/biz/vitelloni-torino;Serata con amici, 10 adulti e altrettanti bambini.
https://www.yelp.it/biz/verdi-d-indivia-torino;Locale semplice ma carino e ben curato.
https://www.yelp.it/biz/vanilla-torino;C'è sempre un ottima scelta e il personale è gentile e simpatico.
https://www.yelp.it/biz/urban-bari;Posto accogliente, clima informale, ambiente giovanile e universitario.
https://www.yelp.it/biz/turet-torino;Ottimo per una serata in compagnia di amici e al tempo stesso per una cena in famiglia.
https://www.yelp.it/biz/tre-galline-torino-2;Il locale è semplice, ma accogliente: il personale attento e veloce.
https://www.yelp.it/biz/tre-galli-torino-2;In un vecchio edificio con uno stile moderno è un buon posto per cibo e vino.
https://www.yelp.it/biz/tre-da-tre-torino;Locale molto carino, grande e ospitale con personale simpatico e buoni piatti.
https://www.yelp.it/biz/trattoria-vineria-da-ale-torino;Il locale è semplice e i camerieri e la proprietaria gentilissimi.
https://www.yelp.it/biz/trattoria-valenza-torino;Da tenere in considerazione per una serata tra amici.
https://www.yelp.it/biz/trattoria-toscana-torino;Il personale è sicuramente simpatico e veloce.
https://www.yelp.it/biz/trattoria-torricelli-torino;Per una tranquilla serata con amici o di lavoro si va sul sicuro !
https://www.yelp.it/biz/trattoria-spirito-santo-torino-2;Peccato che non abbia un Dehor più capiente Per poter passare la serata.
https://www.yelp.it/biz/trattoria-pizzeria-mare-e-monti-torino;Locale non molto ampio ma curatissimo e pulito.
https://www.yelp.it/biz/trattoria-piemontese-torino;Locale semplice, buon servizio, cucina buona ed abbondante.
https://www.yelp.it/biz/trattoria-mombercelli-di-antico-elena-torino;Servizio cortese, cibo semplice ben cucinato, prezzi più che onesti.
https://www.yelp.it/biz/toscano-torino-3;Ideale per una serata tra amici per ricordare momenti piacevoli.
https://www.yelp.it/biz/torteria-berlicabarbis-torino;Posto perfetto per passare una bella e tranquilla serata tra amici/fidanzati.
https://www.yelp.it/biz/tor-na-torino;Locale molto ampio ed accogliente, personale professionale e cortese.
https://www.yelp.it/biz/tommy-tegamino-torino;Locale in stile moderno che propone anche diversi piatti oltre la pizza al tegamino e la farinata.
https://www.yelp.it/biz/tisaneria-della-consolata-torino;Se si vuole passare una serata diversa questo può essere il posto giusto.
https://www.yelp.it/biz/timeout-bari;Locale ampio che garantisce spazio per tutti.
https://www.yelp.it/biz/tiffany-lounge-torino;pranzo veramente delizioso e personale simpatico e gentile.
https://www.yelp.it/biz/tiella-bari;Il personale è molto simpatico ed educato.
https://www.yelp.it/biz/the-stuart-pub-bari;Il locale è molto carino e il personale veramente qualificato.
https://www.yelp.it/biz/the-queen-victoria-torino;Buono per passare una serata tranquilla tra amici.
https://www.yelp.it/biz/the-governor-pub-torino;Per passare una bella serata tra amici, birra e guardare una partita di calcio, super consigliato.
https://www.yelp.it/biz/the-egg-torino;Bellissima serata in un'atmosfera accogliente e ospitale!
https://www.yelp.it/biz/the-duke-of-wellington-torino;Serata fra amici per festeggiare un evento...
https://www.yelp.it/biz/the-bakery-torino;Una bella idea e del buon cibo,
https://www.yelp.it/biz/terra-di-mezzo-bari;ideale per passare una serata in compagnia.
https://www.yelp.it/biz/teriyaky-torino;Posto ideale per una cena veloce ....
https://www.yelp.it/biz/teapot-torino;Personale: educato, garbato e molto gentile  Cibo: vasta scelta tra tisane e infusi molto particolari e interessanti.
https://www.yelp.it/biz/taverna-i-miserabili-torino;Ottimo sia da cenetta a lume di candela che da serata in compagnia.
https://www.yelp.it/biz/taverna-delloca-torino;Serata tra amici, ottimo cibo piemontese e servizio gentile.
https://www.yelp.it/biz/tatami-bari;Personale simpatico e disponibile, in particolare il titolare è stato molto simpatico!
https://www.yelp.it/biz/tasty-burger-torino;Cena veloce in due coppie di amici.
https://www.yelp.it/biz/taiki-bari;Ambiente accogliente e fine, personale gentile e disponibile.
https://www.yelp.it/biz/taglio-torino;Pizza molto buona e particolare con ingredienti ricercati.
https://www.yelp.it/biz/tabit-bari;Il locale è semplice, pulito e moderno.
https://www.yelp.it/biz/t-bone-station-torino;Locale carino e personale gentile e simpatico, nonchè paziente!
https://www.yelp.it/biz/sweet-lab-torino;Il servizio è molto cortese, i prezzi nella media.
https://www.yelp.it/biz/sushitao-bari;cena in settimana con amici. serata piacevole e ambiente accogliente.
https://www.yelp.it/biz/sushi-sound-torino;locale carino, buon servizio e buon cibo.
https://www.yelp.it/biz/sushi-j-torino;Il personale è gentile, buon rapporto-qualità prezzo!
https://www.yelp.it/biz/storie-del-vecchio-sud-bari;Ottimo per passare una serata diversa dalle altre in compagnia di amici.
https://www.yelp.it/biz/stars-e-roses-torino;Il locale molto carino anche se i tavoli sono un po' stretti.
https://www.yelp.it/biz/st-martin-torino;Nel complesso buono per una serata con amici, staff cordiale
https://www.yelp.it/biz/spaghetteria-70cento-bari;Provato per caso per passare una serata in compagnia....
https://www.yelp.it/biz/spada-reale-torino;Servizio con personale qualificato ma simpatico e premuroso....
https://www.yelp.it/biz/soup-e-go-torino;Locale semplice per chi vuole trascorrere una serata tranquilla in compagnia.
https://www.yelp.it/biz/soul-kitchen-torino;Il locale è semplice, un po' vintage, il personale molto gentile ed entusiasta.
https://www.yelp.it/biz/sotto-la-mole-torino;Servizio cortese e discreto, ambiente semplice ed elegante...e molto silenzioso, il che è davvero ormai una rarità.
https://www.yelp.it/biz/solferino-torino;La serata in compagnia di amici in un weekend di relax è stata sublime.
https://www.yelp.it/biz/sir-francis-drake-torino;Locale carino e accogliente, possibilità di guardare eventi sportivi.
https://www.yelp.it/biz/singapore-torino;Del servizio non ci si può lamentare:il personale è gentile e i piatti arrivano subito.
https://www.yelp.it/biz/simini-giuliano-torino;Personale gentile e accogliente, bel locale e servizio efficiente.
https://www.yelp.it/biz/simbad-kebab-torino;Il proprietario è simpatico e il locale carino.
https://www.yelp.it/biz/silvano-torino-2;Il locale è carino e anche le panche all'esterno per sedersi.
https://www.yelp.it/biz/signorvino-torino;Serata con amici per aperitivo, ambiente accogliente ed informale.
https://www.yelp.it/biz/sicomoro-torino;Una pizza davvero buona, ottima accoglienza, prezzo giusto.
https://www.yelp.it/biz/sicily-bar-torino;Locale con arredo moderno pulito e Accogliente!
https://www.yelp.it/biz/sibir-torino-2;Personale simpatico e prezzo assolutamente giustificato per tutta quella roba!
https://www.yelp.it/biz/shore-torino;Bella serata in compagnia passata in questo bel locale del quadrilatero.
https://www.yelp.it/biz/shizen-torino;Il locale è molto carino e ben curato, atmosfera accogliente e personale gentilissimo e sorridente.
https://www.yelp.it/biz/shannon-torino;Bel locale in stile Irlandese e con qualche posto anche fuori.
https://www.yelp.it/biz/shamrock-inn-torino;Tipico posto in cui passare una piacevole serata in compagnia di amici.
https://www.yelp.it/biz/shaka-brah-torino;Ottimo per passare una piacevole serata con gli amici!
https://www.yelp.it/biz/sfashion-cafe-torino;Complimenti per l'ottima accoglienza e il servizio.
https://www.yelp.it/biz/seven-up-torino;Il locale è molto semplice, stile trattoria.
https://www.yelp.it/biz/serranos-torino;Bellissima serata in compagnia di amici !
https://www.yelp.it/biz/sen-mi-ya-torino-2;Consigliato per serate con amici e famiglia..
https://www.yelp.it/biz/scapadaca-torino;Serata con amici nel centro di Torino.
https://www.yelp.it/biz/scannabue-torino;Queste sono le tre componenti principali per una bella serata fra amici.
https://www.yelp.it/biz/scalo-vanchiglia-torino;Un buon posto per passare una serata tra amici.
https://www.yelp.it/biz/sbrodolone-torino;Negozio molto piccolo ma personale molto gentile e accogliente!
https://www.yelp.it/biz/sandrino-bari-2;Fatto notare al personale in servizio, è rimasto impassibile e freddo (si vede chiaramente che l'attività non è loro).
https://www.yelp.it/biz/sandrino-bari;Bel locale e personale gentile e con sorriso h24!
https://www.yelp.it/biz/san-tommaso-10-torino;Ambiente moderno e gentilezza da parte di tutto il personale.
https://www.yelp.it/biz/sa-corte-noa-torino;Locale molto curato con piccolo spazio all'aperto.
https://www.yelp.it/biz/rossosapore-torino;Locale molto accogliente, giovanile e caratteristico.Cibo buono.
https://www.yelp.it/biz/rossopomodoro-torino;Locale Semplice ed accogliente come tutti Rossopomodoro della catena.
https://www.yelp.it/biz/roar-roads-torino;Servizio gentile e cordiale, e sopratutto ottimo rapporto qualità/prezzo.
https://www.yelp.it/biz/rivareno-torino;Buonissimo gelato morbido e cremoso gusti nuovi molto gentile e disponibile prezzo giusto buona ubicazione
https://www.yelp.it/biz/ristrot-guviol-torino;Atmosfera accogliente, arredamento moderno, ma caldo e gradevole.
https://www.yelp.it/biz/ristrorante-la-chicca-torino-2;Ottimo cibo e personale efficiente e simpatico.
https://www.yelp.it/biz/ristoro-28-3-torino-2;Stile moderno ma comunque abbastanza intimo anche per una serata in coppia.
https://www.yelp.it/biz/ristoranti-tropicana-torino;Buona l'accoglienza, qualche attesa tra le portate, personale comunque gentile.
https://www.yelp.it/biz/ristoranti-taverna-delle-rose-torino-2;Buona l'accoglienza nella saletta posteriore piatti abbondanti, buoni ed adeguati allo stile del locale.
https://www.yelp.it/biz/ristoranti-alba-torino;Arredamento semplice ma al tempo stesso caldo ed accogliente.
https://www.yelp.it/biz/ristorante-ratatui-torino-2;L'ambiente è accogliente, pulito, semplice, adatto per pranzi fra colleghi, cene con amici o parenti.
https://www.yelp.it/biz/ristorante-peppino-torino;Locale carino ma semplice, niente di impedibile.
https://www.yelp.it/biz/ristorante-lo-scoglio-da-vito-bari-2;Location carina, vista mare, servizio rapido e molto molto cortese.
https://www.yelp.it/biz/ristorante-consorzio-torino;Cibo buono e personale simpatico e disponibile.
https://www.yelp.it/biz/ristopizza-giampaolo-bari;Il locale è semplice e raffinato, impreziosito dal classico tufo pugliese.
https://www.yelp.it/biz/re-vittorio-bari;Il locale è carino ed il personale gentile e accogliente.
https://www.yelp.it/biz/re-sole-torino-2;Ideale per una serata con gli amici.
https://www.yelp.it/biz/raspino-lorenzo-torino;Il locale è molto carino ed è possible sedersi anche in un comodo dehor esterno.
https://www.yelp.it/biz/quelli-che-ben-pensano-torino;Pizza molto buona e il personale simpatico.
https://www.yelp.it/biz/quelli-che-ben-pensano-2-torino;Il personale è simpatico e l'ambiente accogliente.
https://www.yelp.it/biz/quattro-soldi-torino;Personale simpatico e competente indirizzato con professionalità dai titolari.
https://www.yelp.it/biz/quanto-basta-bari;Locale ampio e pulito con personale e direzione molto attenti alle esigenze del cliente.
https://www.yelp.it/biz/quaglia-teresa-torino;Serata in compagnia di amici, cibo di ottima qualità, peccato per le porzioni davvero troppo piccole..
https://www.yelp.it/biz/punto-pizza-di-moro-michel-torino;Locale accogliente e pulito, personale simpatico e solare, farinata e pizza buonissime.
https://www.yelp.it/biz/primaepoi-torino-3;Locale ampio e luminoso, servizio estremamente affabile.
https://www.yelp.it/biz/prima-e-poi-torino;Locale ampio e luminoso, servizio estremamente affabile.
https://www.yelp.it/biz/premiata-osteria-dellhermada-torino;Ideale per una serata tra amici al cazzeggio!
https://www.yelp.it/biz/porto-di-savona-torino;È stata un'ottima cena tipica piemontese in centro cittá: il personale era simpatico e disponibile e il cibo ottimo.
https://www.yelp.it/biz/porcaloca-torino;Consigliatissimo per mangiare bene e passare una serata tra amici!
https://www.yelp.it/biz/poormanger-torino;Da provare per una serata tra amici senza troppe pretese
https://www.yelp.it/biz/ponte-regina-torino;Una pizzeria semplice con servizio cortese e una buona scelta di pizze abbastanza buone.
https://www.yelp.it/biz/ponte-dora-torino;la pizza è buona e questa è sicuramente una nota molto positiva!
https://www.yelp.it/biz/pollastrini-torino;Locale elegante e squisita accoglienza sono il giusto controno per una cena all'insegna della qualità.
https://www.yelp.it/biz/platti-torino-2;Ottimo il rapporto qualità prezzo cosi come l'accoglienza e la cortesia del personale.
https://www.yelp.it/biz/pizzificio-torino;Luogo per stare con amici e famiglia.
https://www.yelp.it/biz/pizzeria-vecchio-forno-garibaldi-torino;Tempi di attesa rapidi e servizio molto cortese e simpatico.
https://www.yelp.it/biz/pizzeria-vecchia-londra-torino;Il personale è gentile ed il servizio veloce.
https://www.yelp.it/biz/pizzeria-tarantini-al-cancello-rotto-bari;Locale ampio con posti a sedere interni o nel giardino adiacente verandato.
https://www.yelp.it/biz/pizzeria-spaccanapoli-torino;Atmosfera rilassante e servizio veramente buono con accoglienza gradevolissima.
https://www.yelp.it/biz/pizzeria-silvestro-torino;Bel locale, sia interno che dehor, accogliente, caldo, personale simpatico e preparato.
https://www.yelp.it/biz/pizzeria-queendici-torino;Locale semplice e senza pretese, servizio buono e personale simpatico.
https://www.yelp.it/biz/pizzeria-poldo-torino;Bel locale per stare in compagnia di amici
https://www.yelp.it/biz/pizzeria-pieros-torino;Locale spartano ma adatto per una cena informale e veloce, vicinissimo al centro.
https://www.yelp.it/biz/pizzeria-petit-roi-bitritto;Pizzeria nella norma in cui passare una serata tranquilla.
https://www.yelp.it/biz/pizzeria-osteria-dal-vassallo-bari;Il locale è semplice ed essenziale e si affaccia al teatro Petruzzelli.
https://www.yelp.it/biz/pizzeria-marfi-torino;Consigliatissimo come locale semplice per gustare un'ottima pizza con gli amici.
https://www.yelp.it/biz/pizzeria-la-tana-bari;Serata con amici, luogo un pochino affollato ma vale la pena.
https://www.yelp.it/biz/pizzeria-la-sueva-torino-3;Il locale è molto semplice e pulito.
https://www.yelp.it/biz/pizzeria-la-stua-torino;Il locale è carino (pur essendo semplice).
https://www.yelp.it/biz/pizzeria-la-sacrestia-torino;Il locale è davvero carino e ben decorato.
https://www.yelp.it/biz/pizzeria-gino-torino;Locale semplice e accogliente, solo un po' confusionario.
https://www.yelp.it/biz/pizzeria-giampy-di-mazzola-giuseppe-torino;Il locale presenta anche un dehor adatto alle tavolate numerose.
https://www.yelp.it/biz/pizzeria-gelateria-cecchi-torino;Locale semplice con bel deor di legno fronte entrata.
https://www.yelp.it/biz/pizzeria-fratelli-la-bufala-torino;Il locale è ampio e su due piani.
https://www.yelp.it/biz/pizzeria-enzo-e-ciro-di-fraddosio-v-c-bari;Ideale per una serata con gli amici o in famiglia.
https://www.yelp.it/biz/pizzeria-enzo-bari;Ottima pizza,forno a legna,locale spartano con servizio discreto,conduzione familiare..
https://www.yelp.it/biz/pizzeria-dual-torino;Il locale è ampio e ha tanti tavoli, l'atmosfera è chic e la pizza varia.
https://www.yelp.it/biz/pizzeria-di-cosimo-bari;Per una serata con gli amici e due chiacchere va piu che bene.
https://www.yelp.it/biz/pizzeria-da-michele-torino;Bella la location, soprattutto cenando nel dehor.
https://www.yelp.it/biz/pizzeria-da-donato-bari;Posto accogliente per passare una piacevole serata con amici e famiglia.
https://www.yelp.it/biz/pizzeria-da-candido-torino;Locale semplice e pulito, sempre abbastanza pieno di clienti.
https://www.yelp.it/biz/pizzeria-d-autore-bari;Posto accogliente, famigliare, la pizza veramente ottima e proprietari simpatici.
https://www.yelp.it/biz/pizzeria-continental-pizzorante-bari-2;Ormai a Bari c'è di meglio per trascorrere una serata con amici.
https://www.yelp.it/biz/pizzeria-chez-jo-bari;La pizza è buona, forse un pò sottile, ma va a gusti.
https://www.yelp.it/biz/pizzeria-bella-vita-torino;Tutto il cibo era ottimo, gradito anche dai bambini.
https://www.yelp.it/biz/pizzeria-baraonda-bari;Consigliato per una serata tra amici o un appuntamento informale.
https://www.yelp.it/biz/pizzeria-au-lapin-agile-torino-2;Locale ampio, ben strutturato ed arredato, colori rilassanti e quadri gradevoli esposti alle pareti.
https://www.yelp.it/biz/pizzeria-amalfi-torino;Il locale è semplice, ma curato e grazioso.
https://www.yelp.it/biz/pizzeria-alloca-di-pulcinella-torino;Il servizio è cortese e veloce, il dehor carino.
https://www.yelp.it/biz/pizzeria-aladino-bari;Va bene per una serata tra amici.
https://www.yelp.it/biz/pizzeria-al-buco-bari;Ambiente semplice ed accogliente, personale disponibile, simpatico ed educato.
https://www.yelp.it/biz/pizzeri-lapislazzulo-torino;Il locale non è molto ampio, ergo è consigliabile prenotare o optare per l'asporto.
https://www.yelp.it/biz/pizza-speedy-torino-2;Ottima la pizza , la farinata , e gli ingredienti .
https://www.yelp.it/biz/pizza-pistrocchio-torino;Perfetto per serate fra amici e con la famiglia.
https://www.yelp.it/biz/pizza-bon-bari;La.pizza è buona, molto alta e soprattutto economicissima.
https://www.yelp.it/biz/pizza-ad-hoc-torino;Bel locale, personale gentilissimo e ottima accoglienza.
https://www.yelp.it/biz/piu-di-un-gelato-torino;Il personale e' simpatico e gentile: sempre pronto a dare consigli/informazioni sui vari gusti di gelato.
https://www.yelp.it/biz/pistacchio-torino;Ottima qualità......peccato che il personale è simpatico come i sassolini nelle scarpe.
https://www.yelp.it/biz/pippo-paranza-torino;Insomma niente da dire personale gentile, e simpatico.
https://www.yelp.it/biz/piper-pub-torino;Il locale è molto ampio, spartano ma tenuto con cura.
https://www.yelp.it/biz/piola-cianci-torino;Locale un po' spartano ma grazioso, unica pecca è che lo spazio è molto ristretto.
https://www.yelp.it/biz/piano-b-torino;Serata tra amici a base di pizza.
https://www.yelp.it/biz/petit-baladin-torino;Atmosfera informale adatta ad un gruppo di amici.
https://www.yelp.it/biz/perbacco-bari;Il Locale non molto ampio ma curato e molto accogliente.
https://www.yelp.it/biz/pepino-torino;Personale gentile e simpatico, senza fretta il servizio.
https://www.yelp.it/biz/peperosso-torino;Il locale è ampio ed arredato con gusto.
https://www.yelp.it/biz/pepe-torino;Servizio abbastanza rapido, ma il personale in sala non conosce accoglienza, cortesia e sorrisi.
https://www.yelp.it/biz/pastis-torino;Locale semplice e con spazi all'aperto in zona quadrilatero!
https://www.yelp.it/biz/pastis-2020-torino;Locale semplice e con spazi all'aperto in zona quadrilatero!
https://www.yelp.it/biz/pastificio-defilippis-torino;Bella location con tanto di dehor nel centro storico di Torino lungo Via Lagrange.
https://www.yelp.it/biz/pasticceria-venier-torino;Locale carino, elegante,con una pasticceria di rilevo.
https://www.yelp.it/biz/pasticceria-beatrice-2008-torino;Locale molto carino ed elegante ma comunque informale.
https://www.yelp.it/biz/pasticceria-amore-torino;Aperitivo molto ricco con stuzzichini di qualità eccellente e personale molto gentile.
https://www.yelp.it/biz/pasta-mon-amour-torino;Servizio cortese ed impeccabile e ottimo rapporto qualità/prezzo
https://www.yelp.it/biz/passamaneria-torino;Locale non molto ampio, pizza eccellente, con possibilità di scegliere fra due tipi di impasti...
https://www.yelp.it/biz/panperfocaccia-torino-2;Ottima pizza, buon vino, servizio abbastanza veloce anche quando il locale e  pieno.
https://www.yelp.it/biz/panino-giusto-torino;molto gentile e disponibile...e poi le attese lunghe e spesso senza motivi ...peccato.
https://www.yelp.it/biz/panetteria-borgo-nuovo-torino;Il personale molto gentile e rapido nel servizio.
https://www.yelp.it/biz/pai-bikery-torino;Si mangia bene e il personale è molto gentile.
https://www.yelp.it/biz/paco-torino;Ottimo sia per un pranzo al volo sia per una serata tra amici!
https://www.yelp.it/biz/ottimo-torino;Il locale è carino e ben gestito, infatti il personale è molto cordiale e disponibile.
https://www.yelp.it/biz/osteria-sopravento-bari-2;Personale simpatico e attento oltre ad essere gentile e disponibile.
https://www.yelp.it/biz/osteria-rotonda-dei-facchinetti-torino;Locale altamente consigliato per una serata con amici o cene di tipo anche impegnato.
https://www.yelp.it/biz/osteria-povrom-torino;Il locale è abbastanza ampio e il personale molto cordiale oltre che efficiente.
https://www.yelp.it/biz/osteria-le-arpie-bari;Prodotti di ottima qualità e personale molto simpatico.
https://www.yelp.it/biz/osteria-del-fiat-torino;Molto piacevole per passarci una serata in compagnia.
https://www.yelp.it/biz/osteria-dei-quattro-gatti-bari;Adatto per una serata in compagnia, non per una cena ricercata e da fruitori con il palato esploratore.
https://www.yelp.it/biz/osteria-degli-ottoni-torino;Ideale per passare una serata tra amici o di lavoro.
https://www.yelp.it/biz/osteria-antichi-sapori-bari;Personale educato e professionale, il titolare è molto simpatico e gentile, cucina ottima.
https://www.yelp.it/biz/osteria-antiche-sere-torino;Un locale semplice, in cui sentirsi a casa.
https://www.yelp.it/biz/osteria-al-gambero-bari;Personale gentile ed accogliente e ben lieti di consigliare, accontentare i clienti.
https://www.yelp.it/biz/orso-torino;Il personale gentile e simpatico, che spiega e consiglia con accuratezza i propri prodotti completa l'opera.
https://www.yelp.it/biz/oro-birra-torino;Ideale per una bella serata in compagnia!
https://www.yelp.it/biz/opera-bari;L'ambiente è ideale per una serata tranquilla e l'atmosfera è rilassante.
https://www.yelp.it/biz/open-baladin-torino;Il locale è piuttosto ampio pulito e ben arredato.
https://www.yelp.it/biz/one-apple-torino;Personale molto efficiente in un'atmosfera elegante e giovanile
https://www.yelp.it/biz/olsen-di-caldi-cinzia-torino;Tutto ottimo e il locale molto accogliente.
https://www.yelp.it/biz/old-wild-west-torino-2;Da provare se si ama la carne e si vuole passare una bella serata tra amici.
https://www.yelp.it/biz/old-wild-west-torino;Bellissimo locale per una serata con amici.
https://www.yelp.it/biz/okinawa-torino;Un ottimo posto sia per una cenetta romantica che per una cena tra amici!!
https://www.yelp.it/biz/oinos-torino;Locale carino,bene arredato,ben frequentato ed in una delle vienpiù belle di torino.
https://www.yelp.it/biz/officine-panino-torino;Un posto adatto sia al mordi e fuggi che ad una serata in compagnia.
https://www.yelp.it/biz/o-raffertys-pub-torino;Locale accogliente, personale gentile e birra buona.
https://www.yelp.it/biz/nouvel-vis-a-vis-modugno;ristorante carino accogliente e caloroso. ottima cucina servizio discreto un po troppo caldo all interno per la stagione .
https://www.yelp.it/biz/niva-cremeria-torino;Personale simpatico e nei momenti di calma paziente nel descrivere i vari gusti e farveli eventualmente assaggiare.
https://www.yelp.it/biz/nishiki-torino;Servizio veloce ma attento e personale simpatico!
https://www.yelp.it/biz/new-mexico-torino-2;se ti va di mangiare un ottima pizza servita fumante al tavolo con un sorriso, vai in questa pizzeria.
https://www.yelp.it/biz/neko-cafe-torino;L' accoglienza ed il servizio lasciano desiderare.
https://www.yelp.it/biz/napul-e-bari;Locale molto bello e in pieno centro, personale accogliente e titolare simpatico.
https://www.yelp.it/biz/napples-torino;Ottima pizza in un ambiente molto giovanile.
https://www.yelp.it/biz/my-ecosmartfood-torino-2;Beh il posto è semplice ma accogliente!
https://www.yelp.it/biz/murphys-torino;In stile british ottimo per vedere sui maxischermi gli eventi sportivi.
https://www.yelp.it/biz/murphys-pub-torino;In stile british ottimo per vedere sui maxischermi gli eventi sportivi.
https://www.yelp.it/biz/mr-rooster-torino-3;Il locale si presenta ben ordinato e pulito.
https://www.yelp.it/biz/mordillo-torino;Locale ampio e luminoso, servizio nella media, la qualità non è eccellente ma è in linea con il prezzo.
https://www.yelp.it/biz/monte-dei-cappuccini-torino;Buona cena e bel locale, in bellissima location!
https://www.yelp.it/biz/monferrato-torino;Ambiente accogliente, 2 sale spaziose con arredamenti recenti e moderni.
https://www.yelp.it/biz/monegato-torino;Personale simpatico e piatti sempre diversi ma con un unico denominatore, la bontà.
