url;review
https://www.yelp.it/biz/1610-bagel-torino; Il personale è molto gentile e simpatico. Un look caldo ed accogliente e allo stesso tempo moderno ed alla moda. Per il resto personale simpatico e locale carino, a due passi dal cinema e in pieno centro.
https://www.yelp.it/biz/7-nani-torino; Il locale è spartano,come anche il personale che ci lavora. Personale gentile e super veloce benché sia solito trovare coda fuori dal locale. Il locale si presenta con uno stile un po all'antica, con il personale gentile e disponibile.
https://www.yelp.it/biz/a-casa-di-pulcinella-torino; Locale semplice e spartano ideale per cene in gruppo. Personale simpatico e gentile e locale caratteristico. Servizio del personale semplice ma discreto e cortese.
https://www.yelp.it/biz/a-la-merenda-sinoira-torino; Ideale per una serata tra amici al cazzeggio! Trascorsa una serata in compagnia di amici, posto delizioso, ottimo cibo, servizio e gentilezza impeccabile..... Serata fra amici (7 persone), i gestori si sono dimostrati disponibili e cordiali già dalle prime telefonate.
https://www.yelp.it/biz/a-picciridda-torino; Personale simpatico,tempi di attesa buoni,pulizia e accoglienza apprezzabili, prezzo...beh,un po alto!!! Locale molto semplice, personale disponibile e gentile, piatti buoni e abbondanti. Il servizio è abbastanza cortese anche se potrebbe essere più veloce.
https://www.yelp.it/biz/a-vucciria-torino; Encomiabile locale adatto per serate in famiglia e tra amici. Personale simpatico e premuroso Locale carino e adatto ad ogni evento.. IL locale è semplice, ma la cortesia e la cucina sono ottimi.
https://www.yelp.it/biz/adonis-torino; Il locale è molto bello, con il bel tempo poi si può mangiare nel dehor in piazza. Il personale è estremamente gentile e il servizio abbastanza rapido ( essendo sabato sera c'erano parecchi tavoli occupati). Locale carino e cibo diverso dal solito.
https://www.yelp.it/biz/ai-2-ghiottoni-bari-2; Per chi vuole passare una serata e gustarsi un ottimo pesce. Personale gentile e professionale, ottimi i frutti di mare, ma anche tutte le altre pietanze. Locale pulito e personale cordiale, ottima cucina e prodotti di prima qualità, con specialità di pesce curdo e cotto.
https://www.yelp.it/biz/ai-4-assi-di-sanna-roberto-torino; Serata in famiglia Servizio efficiente e personale cortese. Pizza buona, servizio veloce, un posto moderno, tanti camerieri, disponibili! Pizza ordinata uguale cena riuscita perfettamente in buona compagnia e con ottima pizza!!!
https://www.yelp.it/biz/al-111-bari-2; Bel locale, soprattutto all'esterno, molto ampio e luminoso. Buona l'accoglienza, ottima scelta tra antipasti, primi e secondi. Locale curato nel centro di Bari, ottima qualità degli alimenti, personale preparato e cortese, prezzi nella media.
https://www.yelp.it/biz/al-bicerin-torino; Bel locale molto piccolo, storico in centro... buona cioccolata al bicerin caratteristico. L'atmosfera che si respira nel piccolissimo locale è decisamente piacevole grazie anche al personale gentile e professionale. Il personale è molto gentile, ma sovente si deve aspettare fuori dal locale.
https://www.yelp.it/biz/al-cantuccio-bari; Ottimo per una serata fra amici. locale non elegante ideale x una piacevole serata ottima pizza e antipasti abbondanti sia caldi che freddi, sicuramente da provare La pizza è buona e gli antipasti molto caserecci.
https://www.yelp.it/biz/al-paradise-palese; Personale davvero simpatico e adeguato alla location. Personale educato e simpatico ti fa sentire a casa. Locale molto ampio con possibilità di cenare fuori(coperto) o dentro.
https://www.yelp.it/biz/al-pescatore-bari; Personale gentile e professionale, buon rapporto qualità prezzo. Personale educato, ingredienti freschi e genuini cucinati con maestria. Servizio molto professionale e pesce cucinato in maniera sublime.
https://www.yelp.it/biz/al-raffaello-bari; Locale molto curato, ottimo servizio, Personale estremamente gradevole è simpatico allietavano la serata . Bella location, ambiente molto raffinato e buona accoglienza. Serata in compagnia straordinaria corniciata da una splendida cena con panzerottata di lusso da 10 in pagella.
https://www.yelp.it/biz/al-savoia-bari; Forse un tempo era un riferimento per qualità e cortesia ma ora non più.
https://www.yelp.it/biz/al-sorso-preferito-bari; Servizio impeccabile: personale gentile, simpatico e sempre attento alle esigenze del cliente. Il cibo è ottimo e il servizio impeccabile. Buon cibo anche se non con grande scelta, ma comunque più che soddisfacente.
https://www.yelp.it/biz/ala-torino; Un ottima trattoria per passare la serata! Locale semplice e piccolino, con qualche tavolo di troppo. Il posto è molto semplice ma curato e il servizio molto rapido.
https://www.yelp.it/biz/alberto-marchetti-torino; La gelateria è decorata in stile moderno. Personale abbastanza gentile ed attento alle esigenze del cliente. Ottima gelateria nel centro di Torino con ingredienti naturali e personale gentile.
https://www.yelp.it/biz/alberto-marchetti-torino-2; Personale abbastanza gentile ed attento alle esigenze del cliente. Ottima gelateria nel centro di Torino con ingredienti naturali e personale gentile. Servizio ottimo e personale molto gentile, cordiale e disponibile.
https://www.yelp.it/biz/aldente-torino; Cibo ottimo, servizio impeccabile, simpatico il proprietario. Ambiente semplice e accogliente, pulizia e gentilezza. Il personale simpatico preparato e a disposizione per qualsiasi informazione.
https://www.yelp.it/biz/alivella-torino; Ma merita veramente tanto per la pizza e per passare una bella serata in compagnia di amici! Locale luminoso in stile moderno e pulito. Locale ampio, pulito e ben arredato, offre una pizza napoletana davvero buona.
https://www.yelp.it/biz/alla-lettera-torino; Il servizio è stato veloce e il personale simpatico, adeguati i prezzi. Ottima pizza per pochi soldi e un ronzio eccellente tutto intorno all'edificio. Il servizio è rapido e mediamente gentile.
https://www.yelp.it/biz/alla-portata-torino; Il locale è semplice, il personale simpatico. In più il personale è molto simpatico e cortese. Il ristorante è semplice ma accogliente con tovaglie immacolate ben apparecchiare.
https://www.yelp.it/biz/america-graffiti-torino; Il personale è molto simpatico e gentile. Il personale in compenso è stato veramente gentile e cortese. Il cibo è ottimo e abbondante, il servizio abbastanza veloce.
https://www.yelp.it/biz/amici-miei-torino; Tutto da provare IL PERSONALE MOLTO GENTILE e simpatico GRAZIE Locale ampio.. servizio attento.. la pizza è buona, morbida con i bordi alti. Il locale è ampio, i tavoli ben distanziati, per fortuna l'aria condizionata non manca.
https://www.yelp.it/biz/anema-e-cozze-torino; Pizza buona ma non sensazionale, come ce ne sono tante a Torino. I camerieri sono gentili ma dipende da chi ti capita. La pizza è buona, con bordi alti e un condimento saporito.
https://www.yelp.it/biz/angolo-del-parin-torino; Il personale è simpatico e a disposizione per chiarimenti sui piatti più tipici. Il personale molto gentile e preparato nel saper consigliare piatti e vini da abbinare. Personale molto gentile e disponibile, materie prime di ottima qualità e piatti cucinati con passione.
https://www.yelp.it/biz/antica-cafetteria-torino; Bel bar con servizio ineccepibile. locale molto bello, arredato con gusto e caffè molto buono
https://www.yelp.it/biz/antica-salumeria-torino; Personale simpatico, locale interno con pochi coperti. Bella la location, il dehor, ed accattivante l'insegna da antica trattoria. Bevande in quantità un pò ristretta Servizio rapido e personale gentile Prezzo in media (8 euro)
https://www.yelp.it/biz/antichi-sapori-torre-a-mare; Personale gentile e premuroso... ottima frittura di mare grigliata di mare e i primi Il personale è stato gentile e accogliente. I complimenti vanno oltre che allo chef anche a tutto lo staff ed al servizio rapido disponibile ed educato.
https://www.yelp.it/biz/antonelli-torino; Prezzi ottimi e personale simpatico e efficiente. I prodotti sono buoni e il personale è molto simpatico e disponibile. Il locale è arredato in stile moderno senza particolari che risaltino agli occhi.
https://www.yelp.it/biz/arcadia-torino-4; Tutto sommato una bella serata tra 2 amici. Il personale è gentile, simpatico e attento ad ogni esigenza del cliente. Sempre una certezza Il locale é molto bello, ampio,ma allo stesso tempo intimo.
https://www.yelp.it/biz/arigato-torino; La location è carina e c'è anche un dehor per mangiare all'esterno. Il locale ha un ampio dehors per l'estate e si trova parcheggio facilmente. Il locale è sicuramente ben curato e pulito e il cibo è fresco e squisito!
https://www.yelp.it/biz/art-lunch-di-jo-cafe-torino; Piatti impiattati molto bene ma soprattutto cibo ottimo. Cibo di qualità e personale gentile, consigliato! Personale molto gentile e preparato, anche sui vini (assaggio offerto!).
https://www.yelp.it/biz/astoria-torino; Locale bello, ben curato e gestito da persone gentili ed attente. Il locale è molto carino, stile berlinese. In generale è un posto accogliente, interessante.
https://www.yelp.it/biz/augusto-torino; Sicuramente consigliato per passare una bellissima serata in compagnia. Il personale è molto gentile e simpatico. Locale carino, piuttosto ampio e fornito di dehors.
https://www.yelp.it/biz/b-eat-torino; Peccato per queste pecche perché il personale è davvero simpatico. Cucina a vista, personale simpatico, ottimo cibo e ti senti in una puntata di A tavola con Guy! Locale molto carino a pochi passi dal museo del cinema.
https://www.yelp.it/biz/b2-burger-and-beer-torino; Il personale simpatico e a disposizione per ogni esigenza. Completano l'opera un locale semplice ed accogliente e personale molto gentile. LOCALE molto bello, pulito ed ordinato seppur non troppo grande.
https://www.yelp.it/biz/babayaga-bari; tutto freschissimo e personale educato e veloce!
https://www.yelp.it/biz/baccanale-torino; Il personale è gentile ed il locale è accogliente! Locale accogliente e gestione molto familiare, i ragazzi che saettano tra i tavoli sono cordiali e sempre sorridenti . Locale carino e pulito, atmosfera niente di particolare ne in bene ne in male.
https://www.yelp.it/biz/banco-di-sicilia-torino; Se invece si vuole passare una serata serena con amici allora occorre scegliere un altro locale. Tutta la tradizione siciliana in questo ristorante dal personale simpatico e accogliente. Il personale è gentile e il locale è accogliente.
https://www.yelp.it/biz/banco-vini-e-alimenti-torino; Posto accogliente,accettato anche se in tardo pomeriggio di sabato,anche se al Banco (postazione peraltro gradevole essendo solo). Ottimi i vini naturali, altra scelta fondamentale di questo posto. Locale molto carino con tavolini esterni a due passi dalla piazza Castello.
https://www.yelp.it/biz/bar-del-duomo-torino; Il locale è piuttosto semplice ma tutto si dimentica quando arrivano i piatti in tavola. Salvo solo il personale che è gentile Pietanze gustose ed abbondanti personale gentile e veloce.
https://www.yelp.it/biz/bar-delle-scienze-torino; Personale simpatico e pronto ad ogni esigenza. Locale molto carino rustico ampio Personale cortese aperitivo ottimo e stuzzichini abbondanti prezzi nella norma da ritornare Il locale é piccolo ma accogliente ed il personale giovane.
https://www.yelp.it/biz/bar-marconi-di-torre-francesco-torino; Il locale e arredato in modo semplice e il personale e gentile. Il personale è accogliente e cordiale..un posto lungamente consigliato anche per una serata in tranquillità con amici Ambiente accogliente e tè di ogni genere.
https://www.yelp.it/biz/bar-miramare-bari; Il personale è efficiente e gentile, i prodotti gustosi. Il servizio è apparso gentile e cortese. La location è carina, ed il servizio è discreto.
https://www.yelp.it/biz/bar-telebari-bari; Gelato buonissimo con molte varietà di gusti.Personale molto gentile e cortese facile da raggiungere Il personale è gentile e anche molto veloce. Locale esteticamente non particolarmente invitante, ma il gusto straordinario dei loro gelati fa dimenticare il resto!
https://www.yelp.it/biz/bar-torrefazione-beccuti-torino; Il personale è molto gentile e disponibile. Ottimo e in perfetto stile sabaudo il locale ed il suo personale sempre gentile. Comunque il servizio e' molto rapido, affabile e cortese.
https://www.yelp.it/biz/baratti-e-milano-torino-2; Il locale è molto bello e raffinato. Personale molto gentile, all'interno molte persone scattano fotografie. Servizio non molto cortese, anzi piuttosto assente e lento.
https://www.yelp.it/biz/barbagia-di-ollolai-torino; �? un locale semplice con cucina semplice, niente ricercatezza nell'arredamento o nei cibi, ma genuinità e cucina casereccia. Soprattutto il cibo era ottimo, in particolare i culurgiones. Locale elegante e allo stesso tempo famigliare.
https://www.yelp.it/biz/bari-napoli-bari; A dire di quest'ultimo la pizza era molto buona, leggera e condita al punto giusto. La pizza è stata molto buona così come le patatine speciali serviteci prima. Pizza molto buona, locale carino, si sta solo un po' stretti.
https://www.yelp.it/biz/barnum-torino; Consigliato per una serata con amici o con la ragazza! Va bene per una serata tra amici, meglio se giovani/universitari. Il personale è molto simpatico e disponibile.
https://www.yelp.it/biz/bastimento-torino; Il locale molto carino nel centro di Torino personale molto premuroso e servizio veloce anche se di sabato sera. Il personale è gentile, sorridente ed allegro. Locale molto curato in una bella zona di Torino.
https://www.yelp.it/biz/bbq-di-pennestri-davide-antonio-c-torino; Ambiente particolare con la lama d'acqua sulla parete, molto bello anche d'estate con il suo dehors sul Po. Il locale è carino ma nulla di che. Il tutto affiancato da massima disponibilità e cortesia dei proprietari.
https://www.yelp.it/biz/beaubar-torino; personale sempre simpatico ed il titolare é davver. Servizio rapido, personale simpatico e prezzi davvero.modici per la posizione. Personale simpatico e disponibile e ottima qualità del cibo e del servizio.
https://www.yelp.it/biz/bene-cos%C3%AC-torino; Ideale per una serata con gli amici!
https://www.yelp.it/biz/biancofiore-bari; Bel locale in pieno centro città, intimo e accogliente, arredato con gusto e semplicità nel rispetto della tradizione. La cucina è a vista e i ragazzi tutti sono molto ospitali e graziosi. Un rosato negramaro ha accompagnato il rapido pranzo di lavoro in un'atmosfera sempre molto accogliente e curata.
https://www.yelp.it/biz/biberon-torino; Il locale è molto semplice, ma l'ambiente è caldo e accogliente. Consigliatissimo per passare una serata divertente e anche per tirare tardi corrisponde perfettamente al locale nel quale vorresti passare la serata prima ancora di entrarci.
https://www.yelp.it/biz/bicyclette-torino; Il personale è simpatico e il servizio velocissimo. Locale molto semplice ma caratteristico e personale professionale. Personale è decisamente simpatico e la zona è incantevole.
https://www.yelp.it/biz/biffi-valenzano; Il personale è cortese e l'atmosfera piacevole. Curato anche l'ambiente per rendere il locale molto accogliente
https://www.yelp.it/biz/big-mama-club-torino; Ambiente accogliente, sembra di essere in un autobus.
https://www.yelp.it/biz/birreria-don-giovanni-torino; Presente la TV con eventi sportivi e comunque anche Buona musica di sottofondo. Prezzi assolutamente nella media....da provare per una serata in compagnia o in coppia! Ottimo punto di ritrovo per bere buona birra e vedersi eventi sportivi in Tv...
https://www.yelp.it/biz/birreria-la-divina-commedia-torino; Un locale informale per passare una bella serata tra amici. Consigliato per passare una serata in compagnia senza troppe pretese Bella serata in compagnia di buona musica, grazie al concerto della RMN.
https://www.yelp.it/biz/birrificio-torino-torino; Ottimo per una serata in compagnia di amici! �? un buon posto per una serata tra amici. Un bell'ambiente per passare una serata piacevole.
https://www.yelp.it/biz/bistrot-turin-torino; Locale piacevole e accogliente con personale cordiale, simpatico e disponibile 21 Bell ambiente, buon cibo (anche se le quantità  non proprio abbondanti) ottimo vino e dessert, servizio molto gioviale. Cibo ottimo, assolutamente da provare i fuori menù proposti, sono ottimi!!!
https://www.yelp.it/biz/black-angus-turin; Cibo di ottima qualità e personale simpatico e super disponibile!!! Locale arredato con stile, il proprietario molto simpatico e accogliente, carne salada squisita e hangus ottimo!!!! Carne buona e posto accogliente ma i prezzi sono un pó alti.
https://www.yelp.it/biz/black-e-white-bari; Posto piacevole , piatti ben presentati ed ottimi. Il locale è molto bello, raffinato e pulito, la cucina a vista è veramente molto particolare. Locale carino al centro di bari vecchia.
https://www.yelp.it/biz/blah-blah-torino; Un locale adatto per passare una serata tra amici. Locale molto carino, personale gentile e cordiale. Pranzo veloce con cibo buono e servizio rapido e cortese.
https://www.yelp.it/biz/blue-eyes-bari; Locale piuttosto spartano, come anche il servizio. Posto giusto per trascorrere una serata in compagnia mangiando e bevendo secondo la giusta qualità e prezzo rimanendo soddisfatti. Il servizio è stato abbastanza rapido, la location è molto semplice e il conto molto contenuto.
https://www.yelp.it/biz/bocciofila-cavorettese-torino; Locale semplice in collina vicino alla piazza di Cavoretto. La location è carina, bella posizione e semplicità. La location è carina ,nella collina torinese.
https://www.yelp.it/biz/boheme-torino; Il posto é comunque piacevole, caldo nell'atmosfera ed informale nell'accoglienza. Il personale è sempre simpatico e professionale. Personale gentile, musica, locale divertente ispirato agli anni '30.
https://www.yelp.it/biz/boja-fauss-torino-2; Personale molto gentile e simpatico, locale accogliente e confortevole! Il locale è ampio, pulito e arredato con gusto. Personale simpatico e disponibile, piatti curati e ben serviti e molto buoni.
https://www.yelp.it/biz/bollicine-di-gigliotti-e-de-bartolo-torino; Personale sempre simpatico ed all'altezza della situazione. I prezzi sono nella media e la pizza è buona. Il servizio è stato sempre molto gentile e disponibile.
https://www.yelp.it/biz/borgo-antico-bari; Il servizio è stato rapido ed estremamente favorevole e piacevole. Personale molto accogliente e gentile, pietanze ottime e cucinate al momento.. Bella la location e ottimo il servizio!
https://www.yelp.it/biz/botta-bari; Location semplice e accogliente, personale cordiale e disponibile. Ottima pizza....impasto molto digeribile, ambiente semplice ed accogliente! Locale semplice ma pizza ottima come anche la piadina.
https://www.yelp.it/biz/bottega-baretti-moncalieri; Personale gentile, locale carino con ampio dehor. Ambiente molto accogliente e piacevole, perfetto per una serata tra amici. Bel locale, ristrutturato, moderno e vintage al contempo.
https://www.yelp.it/biz/braceria-signorile-bari; luogo accogliente personale specializzato un rapporto prezzo-qualita' ottimo una serata all'insegna di buon mangiare Servizio gentile, carne di buona qualità e conto giusto. Locale molto accogliente, proprietario e staff molto attenti alle esigenze dei clienti.
https://www.yelp.it/biz/brasserie-bordeaux-torino-2; Locale carino, giovanile, abbastanza affollato ma piacevole. E' un posto semplice ma accogliente, molto carino l'arredo e il personale è disponibile e gentile. Locale accogliente dalle luci tenui, servizio giovane e simpatico, la cucina risulta particolare, con abbinamenti non comuni.
https://www.yelp.it/biz/brasserie-bordeaux-torino-3; Locale carino, giovanile, abbastanza affollato ma piacevole. E' un posto semplice ma accogliente, molto carino l'arredo e il personale è disponibile e gentile. Locale accogliente dalle luci tenui, servizio giovane e simpatico, la cucina risulta particolare, con abbinamenti non comuni.
https://www.yelp.it/biz/brek-torino; Il personale è gentile, molto comodo perchè è sotto i portici e se piove... Buon servizio e personale disponibilissimo e gentile. Bel locale...molto ben organizzati...ottimo rapporto qualità prezzo.
https://www.yelp.it/biz/bucks-g-d-34-torino-2; Alle 00.30 di venerdì sera c'è il gioco del cervellone un modo coinvolgente e divertente di passare la serata. Bel locale abbastanza grande. ha un menù molto vario e si mangia davvero bene. Locale bello, birra guinness fantastica gustata con delle patate fritte eccezionali.
https://www.yelp.it/biz/bunet-torino; Il locale è abbastanza accogliente, stile liberty-moderno la saletta del bar. Locale curato con personale simpatico ma cortese: aperitivo molto buono, forse poco vario, ma di qualità. locale molto bello, abbastanza spazioso, servizio quasi eccellente.
https://www.yelp.it/biz/burgheria-torino; Tutto il personale è sempre gentile e simpatico.. continuate cosi Locale semplice ma adatto per una paninoteca, prezzi in linea con la qualità offerta- Servizio cortese Peccato è un bel locale con un bel dehor, personale squisito ma il cibo è di scarsa qualità.
https://www.yelp.it/biz/burgheria-torino-2; Che dire un ottimo posto per una serata fra amici. Ottima serata in compagnia di amici, provati 3 hamburger diversi tutti con ingredienti ottimi e di alta qualità. Il locale è molto curato nei dettagli di pura estetica ma meno in quelli di pura funzionalità.
https://www.yelp.it/biz/busters-coffee-torino; Il locale è molto carino, il personale simpatico. Locale carino, molto giovanile e gentili i camerieri! Un bel posto accogliente da passare con gli amici.
https://www.yelp.it/biz/cacio-e-pepe-torino; Il locale è molto semplice ed informale, gli spazi molto ristretti fra i vari tavoli. Locale molto semplice ma decisamente carino, sia all'esterno sia all'interno. Personale molto gentile, simpatico, buona scelta nel menù, piatti ben preparati.
https://www.yelp.it/biz/cafe-vergnano-1882-torino; Servizio cortese prezzi adeguati alla qualità . Veramente rimasti malissimo per i pressi assurdi anche se il personale è gentile. Il locale è sicuramente molto carino così come il suo dehors in una via pedonale molto elegante.
https://www.yelp.it/biz/caff%C3%A8-bodoni-torino; Il servizio è rapido e molto gentile!
https://www.yelp.it/biz/caff%C3%A8-mulassano-torino-3; Locale elegante, raffinato, d epoca con marmi e bronzi.
https://www.yelp.it/biz/caff%C3%A8-torino-torino-2; Il servizio era rapido ma piuttosto freddo.
https://www.yelp.it/biz/caffe-vergnano-torino; Molti quotidiani da leggere e personale molto simpatico. locale molto ricercato ma allo stesso tempo semplice ed accogliente, ottimo per colazione, pranzo o solo per un caffè. Ambiente ben curato, personale cortese e professionale.
https://www.yelp.it/biz/caffeteria-federico-ii-bari; Da notare anche la cortesia del personale simpatico e disponibile verso il cliente. Il servizio è molto gentile, ma soprattutto si consuma un gelato molto buono e leggero, cioè non appesantisce. Bella la location che costeggia il borgo antico nelle prossimità de castello svevo barese.
https://www.yelp.it/biz/caffetteria-mazzini-torino; La cameriera era gentile e disponibile, il vino eccellente, i prezzi bassi e le persone - guardando affascinante!
https://www.yelp.it/biz/caffetteria-pasticceria-torino; Il personale è simpatico, accogliente e professionale. Carino e accogliente anche il locale, molto gentile anche la titolare. Atmosfera piacevole, per un salentino è come sentirsi a casa.
https://www.yelp.it/biz/cammaf%C3%A0-torino-4; Consigliato se volete provare/mangiare un ottima pizza! Anche il locale è carino rinnovato da poco
https://www.yelp.it/biz/cantine-risso-torino; Ottimo posto per passare una serata in compagnia di amici e bere un buon bicchiere di vino. Il personale è gentile, simpatico e disponibile. Il locale è spartano, rappresentativo del loro approccio, cucina senza fronzoli.
https://www.yelp.it/biz/casa-del-barolo-torino-3; Locale accogliente, arredato con buon gusto con un suggestivo dehor. Ideale sia per una cena con amici che pervuna cenetta romantica. Una cena impeccabile in un ambiente curato e accogliente.
https://www.yelp.it/biz/casa-vicina-torino; Serata con amici dell'accademia della cucina, cucina eccellente e servizio impeccabile. Il personale è gentile, attento, mai invadente. Il cibo superbo con una lista favolosa di vino e servizio molto professionale rendono questo ristorante davvero speciale.
https://www.yelp.it/biz/casablanca-bari; Locale molto spartano da nn molte pretese ma comunque accogliente. L'accoglienza e il servizio è stato scarso, il personale scortese. Buona cena in un bel locale sul mare, Pesce freschissimo e servizio impeccabile.
https://www.yelp.it/biz/casale93-torino; Bellissima serata in compagnia di uno staff cordiale e di compagnia... L'ambiente è accogliente, tranquillo, ampio e caldo. Se si vuol passare una serata in compagnia senza rischiare di spendere un patrimonio si può tranquillamente andare.
https://www.yelp.it/biz/catullo-torino-2; Ottimo locale per passare una serata a Torino. Locale adatto ad ogni genere di occasione (coppia, famiglia, amici, colleghi). Bella location ed un menù ampio(carne, pesce, pizze, ma non farinata).
https://www.yelp.it/biz/ceccarelli-torino; Serata con amici in questo locale storico. Locale non ampio ma decisamente curato nei dettagli, probabilmente per habitué buongustai. Una piacevole scoperta: locale delizioso, composto da tre salette, raccolte e silenziose.
https://www.yelp.it/biz/cecchi-torino; Un locale semplice, senza pretese ma con ottimo cibo. Ottima anche la pizza al tegamino ed il gelato.
