url;review
https://www.yelp.it/biz/monegato-torino; Ampia scelta di primi (porzioni abbondanti) e due secondi. C'è una buona scelta..Mai una delusione: quantità, qualità, che bontà! C'è una scelta abbastanza ampia e i piatti cambiano quotidianamente.
https://www.yelp.it/biz/monferrato-torino; Ampia scelta di antipasti della casa , tutti di buona qualità. Anche il rapporto qualità/prezzo è molto buono. Antipasti molto buoni così come i primi.
https://www.yelp.it/biz/monte-dei-cappuccini-torino; Porzioni generose prezzi giusti e un buon servizio ..da tornare! Dolci molto buoni speciale la caramella di pesche prezzi contenuti. Ottimi gli antipasti: flan di carciofi con bagna caüda veramente ottimo.
https://www.yelp.it/biz/mordillo-torino; La qualità dei prodotti è davvero scarsa. Ampia scelta e sfizioso cibo a prezzi davvero contenuti.. Ottima la pizza, ma non da meno il kebap!
https://www.yelp.it/biz/morelli-antonio-modugno; Il Conto è sempre adeguato alla qualità dei prodotti. Personale gentilissimo e molto disponibile sempre con il sorriso. Il rapporto qualità / prezzo è incredibile, così come la cortesia.
https://www.yelp.it/biz/mr-rooster-torino-3; Ampia scelta di panini e buone le proposte di stuzzichini (patate, crispy popcorn, alette di pollo...). La carne molto speziata ovviamente non so dire se era di buona qualità. ottima Ottima cucina ottima accoglienza un personale molto cortese pronto a risolvere qualsiasi problema del cliente.
https://www.yelp.it/biz/murphys-pub-torino; Ampia scelta di birre e belle porzioni del mangiare. Bel locale con un'ottima qualità di birre. I prezzi sono più che onesti vista l'ampia scelta e la grandissima qualità dei prodotti offerti.
https://www.yelp.it/biz/murphys-torino; Ampia scelta di birre e belle porzioni del mangiare. Bel locale con un'ottima qualità di birre. I prezzi sono più che onesti vista l'ampia scelta e la grandissima qualità dei prodotti offerti.
https://www.yelp.it/biz/my-ecosmartfood-torino-2; Locale ottimo per una cena semplice e vegetariana. Rapporto qualità/prezzo ottimo, personale giovane e molto gentile, ma non invadente. Bevande a parte.Buona la qualità dei prodotti e buono il gusto.
https://www.yelp.it/biz/napples-torino; Pizza buonissima, per gli amanti dell'impasto napoletano! Pizza abbastanza buona e impasto molto leggero,mangiarne una non basta. Pizze molto buone, ottimo l'impasto così come la qualità degli ingredienti.
https://www.yelp.it/biz/napul-e-bari; La pizza era ottima, tipico impasto napoletano ma facilmente digeribile. La pizza è buona, gli antipasti sono i classici(bruschetta, olive ecc.) Ottima pizza napoletana, ottimi ingredienti, antipasti buonissimi,locale bello, pulito, spazioso, accogliente.
https://www.yelp.it/biz/neko-cafe-torino; Antipasti e primi ottimi, menù corto ma interessante. Un carinissimo locale per gli amanti dei felini con un personale cortese ed un buon rapporto qualità prezzo. Grande varietà di torte disposte sotto le campane di vetro, molto buone.
https://www.yelp.it/biz/new-mexico-torino-2; se ti va di mangiare un ottima pizza servita fumante al tavolo con un sorriso, vai in questa pizzeria.
https://www.yelp.it/biz/nishiki-torino; Le porzioni buone e il posto accogliente. Prezzi nella media, circa 15 euro a pranzo e 25 a cena. è stato un ottimo pranzo con porzioni abbondanti e personale molto cordiale e di compagnia.
https://www.yelp.it/biz/niva-cremeria-torino; Personale sempre molto cortese e svelto nel smaltire la coda. buona scelta di gusti e di granite! Qualità eccezionale che evidenzia materie prime di primissimo livello.
https://www.yelp.it/biz/nouvel-vis-a-vis-modugno; La pizza è davvero ottima, sottile e saporita, non appesantisce e si resta davvero soddisfatti. Eccellente rapporto qualità prezzo e per chiudere, personale molto gentile. ristorante carino accogliente e caloroso. ottima cucina servizio discreto un po troppo caldo all interno per la stagione .
https://www.yelp.it/biz/nuovo-fizzarotti-bari; Il cibo è di ottima qualità dagli antipasti assortiti al dessert. Il rapporto qualità/prezzo è giusto e accettabile. Gli antipasti molto buoni corrispondevano alla descrizione e così tutto il resto.
https://www.yelp.it/biz/o-raffertys-pub-torino; I prezzi sono nella media, le porzioni sono abbondanti e la qualità è superiore a quella di un pub. Ottima scelta di cibo e birra in un locale dalla luce soffusa e dall'atmosfera irlandese. Carino buona qualità e personale cordiale ..
https://www.yelp.it/biz/oashi-torino; 13 Ristorante giapponese abbastanza bene, servizio ottimo e cordiale. Ristorante giapponese (si fa per dire) visto che i cuochi non son giapponesi.
https://www.yelp.it/biz/officine-panino-torino; La qualità dei prodotti è ottima ed il servizio eccellente. Buon assortimento di vini e birre e per i bambini bevande analcoliche. I panini sono veramente buoni con materie prime di qualità.
https://www.yelp.it/biz/oinos-torino; I sapori rispecchiano la qualità dei prodotti. Prezzi nella media considerando la qualità dei prodotti. La cena è stata molto piacevole e il servizio impeccabile .
https://www.yelp.it/biz/okinawa-torino; Okinawa tappa obbligata per chi cerca un buon rapporto qualità/prezzo. Personale gentilissimo, e chiacchierata davvero piacevole con il responsabile a fine cena. Il personale è cortese e il locale silenzioso.
https://www.yelp.it/biz/old-wild-west-torino; Ampia scelta di carne, di buona qualità, cotta e condita bene. Ottima scelta tra hamburger e carne alla griglia, buone le birre. ottimo e accogliente cibo molto buono e servizio velocissimo nonostante le varie prenotazioni tra l'altro sempre pieno di gente.
https://www.yelp.it/biz/old-wild-west-torino-2; Il rapporto qualità/prezzo non è, pero', conveniente. Carne del panino non di alta qualità.. prezzo comunque un po sopra la media.. esperienza non positiva.. La carne davvero gustosa e di ottima qualità.
https://www.yelp.it/biz/olsen-di-caldi-cinzia-torino; Rapporto qualità/prezzo nella media, ma ne vale la pena! anche qui vasta scelta e sempre diversa, sono torte fatte da loro, una più buona dell'altra! il personale poi e gentilissimo, Il locale e da visitare...ed assaporare
https://www.yelp.it/biz/one-apple-torino; Peccato perché il locale è molto carino. Locale carino ma il servizio è veramente scadente. Personale cortese, servizio rapido, cocktail buoni con prezzi nella media di un locale in pieno centro.
https://www.yelp.it/biz/oolivoo-bari; Pizza buona, non troppo spessa e croccante, cottura ottima e varietà adeguata. Locale carino, a pochi metri dal mare.
https://www.yelp.it/biz/open-baladin-torino; C'è un'ampia scelta di birre molto buone. Ampia la scelta, buone le birre e simpatico il servizio. Locale giovane e carino con ampia scelta di birre ed ottimi panini.
https://www.yelp.it/biz/opera-bari; è stata senza dubbio una bellissima cena in un locale molto ben curato! Buonissimi sia gli antipasti che i primi, giusti in quantità e che si presentano anche visivamente in maniera impeccabile. La qualità  è alta a prezzi ragionevoli e il servizio è buono.
https://www.yelp.it/biz/oro-birra-torino; Ampia scelta di birre ben illustrate dal gentile personale. Birre in bottiglia con scelta abbastanza ampia per trovare articoli interessanti. Ampia scelta di birre in bottiglia e alla spina a rotazione.
https://www.yelp.it/biz/ortigia-bistrot-torino; Prezzi alti ma edeguati alla qualità dei prodotti. Dolci buoni anche quelli come il passito di Siracusa. Menù vario ottimi antipasti involtini di Pesce spada su ricotta coniata.
https://www.yelp.it/biz/osteria-al-gambero-bari; Pesce fresco e porzioni abbondanti, personale simpatico e servizio rapido. Ottime le portate per qualità e quantità con un rapporto qualità/prezzo interessante. Pesce molto fresco cucinato con molta semplicità.
https://www.yelp.it/biz/osteria-antiche-sere-torino; Ottimo rapporto fra qualità, porzioni e prezzo. Porzioni abbondanti anche per i primi e i secondi. Il personale è gentilissimo e le porzioni abbondanti....un punto fermo in città.
https://www.yelp.it/biz/osteria-antichi-sapori-bari; Molto meglio la frittura di pesce ! A partire dal cibo di ottima qualità a finire al personale cordiale e molto preparato sui prodotti da vendere. Il servizio ottimo e il personale molto cortese.
https://www.yelp.it/biz/osteria-degli-ottoni-torino; Ottimi antipasti e un meraviglioso riso ai carciofi, ottimi anche i ravioli . La carta dei vini è di ottimo livello. Servizio cordiale ma non invadente, tempi di attesa non elevati , prezzo assolutamente competitivo !
https://www.yelp.it/biz/osteria-dei-quattro-gatti-bari; La pizza è ottima con buon impasto ed ingredienti di qualità. Porzioni abbondanti e ottimo rapporto qualità prezzo. Pizza buona, cucina semplice e ben presentata con antipasti abbondanti e buonissimi...prezzo assolutamente onesto.
https://www.yelp.it/biz/osteria-del-fiat-torino; Ampia scelta di antipasti, buoni i primi e le carni di secondo. Cena tranquilla, locale particolare in perfetto tema FIAT. Si mangia molto bene ed il rapporto qualità/prezzo è ottimo.
https://www.yelp.it/biz/osteria-del-frate-torino; Porzioni abbondanti e cibo di ottima qualità. Ottimi sia gli antipasti che i primi. Porzioni ottime e abbondanti e cibo di qualità al giusto prezzo.
https://www.yelp.it/biz/osteria-della-travi-bari; C'è una ampia scelta tra zucchine alla scapece, mozzarelline, peperoni, pizzette, melanzane. C è una ampia scelta tra zucchine alla scapece, mozzarelline, peperoni, pizzette, melanzane. cucina tipica in un ambiente molto familiare e davvero ben organizzato. ottimi gli antipasti abbondanti
https://www.yelp.it/biz/osteria-fate-infretta-a-tavola-torino; Ampia scelta di antipasti, buoni i primi e le carni di secondo. Cena tranquilla, locale particolare in perfetto tema FIAT. Si mangia molto bene ed il rapporto qualità/prezzo è ottimo.
https://www.yelp.it/biz/osteria-le-arpie-bari; Consigliato per chi vuole mangiare prodotti tipici pugliesi! Prodotti di ottima qualità e personale molto simpatico. Dolci buoni, locale piccolo e accogliente assediato da turisti.
https://www.yelp.it/biz/osteria-povrom-torino; Portate abbondanti e buon rapporto qualità/prezzo Consigliato Cena con menù fisso per la festività ottimo con un buonissimo prezzo. Il pesce è ben cucinato e di buona qualità sia per gli antipasti , primi e secondi..
https://www.yelp.it/biz/osteria-rotonda-dei-facchinetti-torino; Buoni gli antipasti  3 primi 1 pizza 1antipasto 2bottiglie d'acqua 1birra media 70€ Fritto di pesce eccellente e pizza buonissima veramente. Ampia scelta di piatti per chi 'corre' nella pausa pranzo.
https://www.yelp.it/biz/osteria-sopravento-bari-2; Ottimo per una cena o un pranzo tipico della zona. Cibo ottimo, gustoso, ben cucinato e ben servito, prezzo nella media. Piatti squisiti con prodotti di altissima qualità a prezzi davvero onesti.
https://www.yelp.it/biz/ottimo-torino; Ottima la pizza e i piatti di pesce cantano...per non parlare della parmigiana di melanzane .. Il rapporto qualità/prezzo nella media ed il servizio buono, le persone che ci lavorano sono gentili e disponibili. Il gelato è di buona qualità, il personale cortese.
https://www.yelp.it/biz/paco-torino; Il cibo è ottimo e la location molto particolare, ma a rendere veramente speciale il Paco è lo staff! A partire dal cibo che è di ottima qualità con dell'ottima carne che rispetta la qualità prezzo del locale. Cibo di ottima qualità, fresco e ben preparato.
https://www.yelp.it/biz/paese-zhou-torino-2; Unica nota il personale potrebbe essere un po' più cortese, ma magari era solo il giorno sbagliato. Ovviamente ci sono altri ristoranti molto più carini come arredamento ma come qualità prezzo non lo batte nessuno.
https://www.yelp.it/biz/pai-bikery-torino; La torteria è molto buona e i prezzi accessibili. Il cibo molto buono ed il rapporto qualità prezzo è eccellente. Il Pai Bikery è un posto accogliente anche se piccino.
https://www.yelp.it/biz/pan-cafe-torino; La scelta è ampia, il peccato è veniale. Le porzioni sono molto abbondanti e i prezzi nella media. Prezzi medio-alti (12-15 euro sia i primi che i secondi), porzioni abbondanti.
https://www.yelp.it/biz/panificio-el-focacciaro-bari; Ma anche tutto il resto è di ottima qualità! Entrando dal Focacciaro si ha solo l'imbarazzo della scelta! La focaccia di questo panificio e'di ottima qualita'e manifattura,quando sono a bari non perdo mai l'occasione di andarci.
https://www.yelp.it/biz/panificio-magda-bari; Ampia scelta di biscotti, brioche e torte. Il prezzo è modico e la scelta molto è ampia! Vasta scelta, ma in qualità e bontà pecca è peggiorato rispetto al passato!
https://www.yelp.it/biz/panino-giusto-torino; I panini sono vari e la scelta ampia! I prodotti sono di ottima qualità, insomma tutto ne giustifica il prezzo. Peccato per il personale che non sempre è così cortese.
https://www.yelp.it/biz/panperfocaccia-torino-2; Ampia scelta di pizze e focacce originali, anche gluten free. Pizza ottima e tempi di attesa onesti. La pizza buona ma servizio pressoché assente.
https://www.yelp.it/biz/pantagruel-torino; A cena menù alla carta variegato e gustoso e ampia scelta di pizze . Il prezzo vale la qualità e la bontà della pizza. Ottima la pizza, impasto leggero ne alto ne basso con ottima digeribilità.
https://www.yelp.it/biz/passaggio-in-india-torino; Buon ristorante indiano con ampia scelta di pietanze tipiche. Ampia scelta di menu prestabiliti anche vegetariani o alla carte. Lo sconto the fork 50\% restituisce al ristorante un buon rapporto qualità/prezzo.
https://www.yelp.it/biz/passamaneria-torino; una cena a base di pizza... assolutamente NELLA MEDIA. ottimi gli antipasti, ma... niente altro di entusiasmante Possibilità di scelta fra due tipologie d'impasto. A pranzo c'è un'ampia scelta tra la pizza a 7 euro e monopiatti ad 8.
https://www.yelp.it/biz/pasta-mon-amour-torino; Carta dei vini ampia, sia Italia che Francia......! Cibo ottima qualità , porzioni giuste , gusto notevole. Locale carino piatti con grandi nomi ma con porzioni piccolissime e poco saporite.
https://www.yelp.it/biz/pastamaneria-torino; La vasta scelta di portate e la bontà dei prodotti lo rende DA VISITARE Il servizio è fantastico e tutto è a un buon rapporto qualità/prezzo. Ottima qualità prezzo e prende i ticket.
https://www.yelp.it/biz/pasticceria-beatrice-2008-torino; Ampia scelta, troverete tutto quello che volete. Grande varietà di gusti e prodotti sempre freschi. Cappucino buono.Ampia scelta di croissant invitanti (anche per chi avesse intolleranze).
https://www.yelp.it/biz/pasticceria-venier-torino; Ma ciò nulla toglie alla qualità dei prodotti serviti. Pasticceria di grandissima qualità con prodotti che già dalla odore dimostrano la capacità dei pasticceri. Locale carino, elegante,con una pasticceria di rilevo.
https://www.yelp.it/biz/pastificio-defilippis-torino; Prodotti di eccellenza e materie prime ottime. Ampia la scelta e curata la preparazione e presentazione. Ottimi gli antipasti piemontesi, buonissima la preparazione dei primi.
https://www.yelp.it/biz/pastis-2020-torino; Ottima la pizza anche se non proprio abbondante. Rapporto qualità/prezzo 10 e lode * * * * * Ottimo sia per pranzo, cena o aperitivo. I prodotti freschi e di qualità ed anche i prezzi sono molto convenienti!
https://www.yelp.it/biz/pastis-torino; Ottima la pizza anche se non proprio abbondante. Rapporto qualità/prezzo 10 e lode * * * * * Ottimo sia per pranzo, cena o aperitivo. I prodotti freschi e di qualità ed anche i prezzi sono molto convenienti!
https://www.yelp.it/biz/pepe-torino; Conto adeguato alla qualità dei prodotti e alla professionalità del servizio. Personale cordiale e posto incantevole con vista parco nel centro di Torino. Il locale è carino, in una posizione ottimale.
https://www.yelp.it/biz/peperosso-torino; Forse la pizza è meglio della cucina visto che quasi tutti mangiavano la pizza. Il personale non è molto cordiale, sembra superficiale e poco attento al cliente e la pizza, la pizza... La gestione familiare garantisce un servizio cortese ed attento.
https://www.yelp.it/biz/pepino-torino; Locale molto carino, si tratta di una gelateria nella quale bisognerebbe tornare a primavera inoltrata per provare il gelato. Servizio cordiale come sempre, qualità dei drink e del cibo ottimo!!! Locale molto carino e cappuccino molto buono (con possibilità di averlo anche con latte di soia).
https://www.yelp.it/biz/perbacco-bari; Ampia anche la scelta di vini, amari e liquori. Ristorante di livello medio basso con un pessimo rapporto qualità/prezzo. Ottima carta dei vini, prezzi in media con la qualità dei prodotti.
https://www.yelp.it/biz/petit-baladin-torino; Ambiente piccolo ma molto carino. cibo buono, porzioni abbondanti. Idem per i prezzi (decisamente sopra la media) ma non per le porzioni. Ci dispiace altresi che non parla della qualità dei nostri prodotti, della Location, dell'atmosfera.
https://www.yelp.it/biz/piano-b-torino; Ottima la pizza, pasta leggera, ampia scelta e ben farcite. Pizza buona e impasto di qualita' non mette assolutamente sete. Dolci molto buoni, e tiramisu' davvero ottimo.
https://www.yelp.it/biz/piola-cianci-torino; Ottimo cibo e ottimo vino specie come qualità/prezzo. Non è mai spiccato per la Bontà dei piatti sicuramente ma per il rapporto qualità/prezzo si. Posto perfetto per mangiare buon cibo tipico piemontese e ottimo rapporto qualità/prezzo.
https://www.yelp.it/biz/piper-pub-torino; Ampia scelta di birre da tutto il mondo, ottimi panini. Ampia scelta di birre, cocktail, stuzzichini, primi o secondi piatti, panini, hamburger.... Vastissima scelta di birre di buona qualità.
https://www.yelp.it/biz/pippo-paranza-torino; Perfetta ambientazione ma soprattutto ottima cena di pesce con prodotti di buona qualità. Prezzi non alti e direttamente proporzionali alla qualità dei prodotti. Cibo discreto e buon rapporto qualità/prezzo, anche se le portate non sono abbondanti.
https://www.yelp.it/biz/piu-di-un-gelato-torino; Rapporto qualità prezzo più che buono, così come le quantità (forse addirittura esagerate€). Ottima la qualità, gusti particolari, ragazze davvero gentili. Gusto genuino e capisci che le materie prime sono ottime e trattate come si deve.
https://www.yelp.it/biz/pizza-ad-hoc-torino; Impasto e qualità veramente ottima della pizza! Ottima pizza, impasto molto leggero e croccante! Pizza buona con un impasto decisamente leggero.
https://www.yelp.it/biz/pizza-bon-bari; Pizzeria chiamata alle 20:50 per una prenotazione di 6 pizze e 12 birre di martedì. La.pizza è buona, molto alta e soprattutto economicissima. Vasta scelta di pizze a prezzi assolutamente nella media.
https://www.yelp.it/biz/pizza-pistrocchio-torino; Le pizze buone, contanto che sono d'asporto. Vasta scelta di pizze, una più buona dell'altra. Ottima pizza, cotta bene e personale gentile e preparato.
https://www.yelp.it/biz/pizza-speedy-torino; Ottima pizzeria low-cost : pizze buone anche se un po' troppo sottili . Prezzi economici con una vasta scelta di pizze e non solo.Un saluto a tutto lo staff. Pizza buona e portata fino a casa in meno di mezz'ora dall'ordine, regalano anche la bevanda a tua scelta.
https://www.yelp.it/biz/pizza-speedy-torino-2; Pizze buone, con ampia varietà di scelta. La pizza è molto buona, impasto fragrante e buone materie prime. La scelta è ampia e anche le pizze più semplici sono buone.
https://www.yelp.it/biz/pizza-speedy-torino-3; La pizza buona ma niente di eccezionale.. La pizza è buona, gli ingredienti sono ottimi e alcune pizze sono particolari e poco diffuse. Dovuto all'ottima pizza e anche al personale estremamente cortese.
https://www.yelp.it/biz/pizze-e-cozze-torino; Pizza ottima, servizio gentile e rapidissimo, buona qualità/prezzo. Pizza molto buona, del tipo napoletano, ben condita e con un buon impasto. Antipasti buoni..specialmente le cozze...buone ed in abbondanza.
https://www.yelp.it/biz/pizzeri-lapislazzulo-torino; Pizze molto grandi e sottili con ampia scelta, prezzi contenuti. Non troverete ne' antipasti ne' pizze alla napoletana con grandi cornicioni. Pizza buona, molto gustosa e molto grande.
https://www.yelp.it/biz/pizzeria-al-buco-bari; Antipasti vari e pizza davvero buonissima, sottile e ben condita. Pizza buonissima, antipasti altrettanto buoni, tutti molto disponibili e simpatici. E antipasti molto caserecci di buona qualità!
https://www.yelp.it/biz/pizzeria-aladino-bari; Ottima pizza, sia gli ingredienti che l'impasto. Ottima la pizza in questo ristorante, incredibili gli antipasti sia per qualità che per quantità. Prezzi bassi per una qualità mediocre sia per quanto riguarda gli antipasti che per le pizze.
https://www.yelp.it/biz/pizzeria-alloca-di-pulcinella-torino; Dolci buoni, ma non all'altezza della pizza. Cena pre concerto servizio veloce gentile pizza ottima . La pizza era buona, gli ingredienti abbondanti.
https://www.yelp.it/biz/pizzeria-amalfi-torino; Pizze buone e paste ancor di più. Molto buona sia la pizza che la cucina. pizze buone e condite molto abbondanti e pesce ottimo!
https://www.yelp.it/biz/pizzeria-antipasteria-bistro-bari; Il menu a 10€ e perfetto x chi vuole mangiare bene e spendere poco. Personale gentilissimo, la pulizia regna sovrana, bagno immacolato.
https://www.yelp.it/biz/pizzeria-au-lapin-agile-torino-2; La pizza buona e arricchita con prodotti di qualità. La pizza è molto buona, disponibile anche con impasto integrale. La pizza è ottima e la qualità dei prodotti si sente!
https://www.yelp.it/biz/pizzeria-baraonda-bari; Ottima pizza ed impasto leggero e ben lievitato. Ampia la scelta delle pizze, c'e solo l'imbarazzo della scelta. Ottima pizza cotta nel forno a legna.
https://www.yelp.it/biz/pizzeria-bella-vita-torino; Cena sabato sera con frittura di pesce. La pizza è buonissima, digeribile e condita generosamente. La pizza è buona ed il personale disponibile.
https://www.yelp.it/biz/pizzeria-chez-jo-bari; Pizza ottima servizio veloce e molto cordiali. Antipasti nella tradizione barese, abbondanti e vari. Tutto buonissimo dagli antipasti ai primi...pizza da sballo e secondi di carne e pesce sempre squisiti!
https://www.yelp.it/biz/pizzeria-continental-pizzorante-bari-2; Ottima la pizza in tutte innumerevoli varianti. Pizza ottima camerieri simpatici, accoglienti e sorridenti. La pizza è ottima, il ristorante altrettanto, ricco di antipasti freschi e a base di pesce.
https://www.yelp.it/biz/pizzeria-cristina-torino; Ottima pizza, personale molto gentile e accogliente. ...una delle pizze più buone della città.. Ottimi anche gli antipasti come da tradizione napoletana.
https://www.yelp.it/biz/pizzeria-d-autore-bari; Pizza ottima e antipasti ricercati di buonissima qualità! Ottima pizza, forno a legna, prodotti di qualità, cordialità. Pizza ottima, scelta molto ampia e servizio gentile e veloce.
https://www.yelp.it/biz/pizzeria-da-candido-torino; La scelta di pizze è molto vasta, consigliato! Le pizze hanno prezzi nella media/non sono care. Prezzi bassi e buona qualità della pizza, ottima farinata!
https://www.yelp.it/biz/pizzeria-da-donato-bari; Pizza ottima impasto meraviglioso ingredienti di qualità... Antipasti abbondanti e una pizza ottima per non parlare del dessert. Buona scelta di birre, dessert all'altezza del locale.
https://www.yelp.it/biz/pizzeria-da-michele-torino; Ottima pizza al padellino, leggera e gustosa! Pizza buona, farinata discreta.. un po' spessa rispetto ai concorrenti. La pizza è sempre buona. ma il servizio è veramente scarso e peggiora.
https://www.yelp.it/biz/pizzeria-di-cosimo-bari; I prodotti sono sempre buoni e di ottima qualità. Compresa l'ottima pizza , che è più grande del piatto stesso. La qualità dei prodotti è molto buona e la scelta molto varia.
https://www.yelp.it/biz/pizzeria-divina-bari; Preparazione artigianale degli antipasti e vasta scelta di carne alla brace.
https://www.yelp.it/biz/pizzeria-dual-torino; La pizza era buona, l'impasto integrale leggero. Ottima pizza, scelta dell' impasto alla romana, napoletana o integrale. Pizze molto buone con ingredienti freschi e la possibilità di scegliere l'impasto.
https://www.yelp.it/biz/pizzeria-enzo-bari; Pizza davvero buona, pizzaioli simpaticissimi e prezzi giusti. Ottima pizza,forno a legna,locale spartano con servizio discreto,conduzione familiare.. La pizza è buona, sia la massa sia gli ingredienti.
https://www.yelp.it/biz/pizzeria-enzo-e-ciro-di-fraddosio-v-c-bari; La pizza era molto squisita impasto ottimo e prodotti eccezionali. la pizza è davvero squisita i antipasti buoni e abbondanti. Ottima pizza e fantastici antipasti.... fragole con la panna (quando disponibili) top !!!
https://www.yelp.it/biz/pizzeria-fratelli-la-bufala-torino; La pizza è molto buona, di ottimo impasto e prodotti di qualità. In tutta onestà la pizza era molto buona, ben condita, ottimo impasto. L'impasto della pizza è leggero e digeribile e gli ingredienti di ottima qualità.
https://www.yelp.it/biz/pizzeria-gelateria-cecchi-torino; La pizza è buona, la farinata ottima. Farinata ottima così come la pizza (padellino). Farinate e pizze molto buone, ma da evitare il sabato.
https://www.yelp.it/biz/pizzeria-giampy-di-mazzola-giuseppe-torino; Servizio cordiale, locale grazioso e pizza buona...forse giusto l'impasto appena salato. Pizza ottima e piatti molto ben presentati. Ottima pizza e buon antipasto di alici !
https://www.yelp.it/biz/pizzeria-gino-torino; Pizza buona, impasto digeribile ingredienti di qualità . Ottima farinata e ottima pizza al padellino.......! La pizza è buonissima e la farinata favolosa.
