url;review
https://www.yelp.it/biz/gelateria-grom-torino-2; Ovviamente al primo posto sta l'ottima qualità dei gelati, preparati con prodotti scelti e di stagione. Gelato delizioso prodotto con ingredienti di ottima qualità e sani. L'antesignano delle gelaterie sabaude attenti alle materie prime.
https://www.yelp.it/biz/gelateria-miretti-torino-7; Nulla da dire sui prodotti e sulla qualità anche se i prezzi sono troppo elevati. Ampia scelta di gusti con anche la lista degli ingredienti€ Prezzo super conveniente se rapportato alla qualità del gelato. Personale gentilissimo , la ragazza che lavora lì è super cortese..
https://www.yelp.it/biz/gelateria-mondello-torino; La scelta è ampia, i gusti originali e ricercati. Ampia varietà di scelta per Yogurt bio e gelati. La scelta è ampia e si trovano gusti particolari come zabaione, passito, ricotta e fichi.
https://www.yelp.it/biz/gelateria-monginevro-smaldone-raffaele-torino; Ampia scelta di gusti, gelato cremoso e buonissimo. Rapporto qualità/prezzo inimitabile, certo non per tutti i gusti. Il personale è cordiale, sorridente e disponibile.
https://www.yelp.it/biz/gelateria-piccinni-bari; Gelato molto buono con ampia scelta di gusti, alcuni particolari. Il posto è pulito e offre una grande varietà di prodotti! Ottima qualità del gelato e varietà di gusti.
https://www.yelp.it/biz/gelateria-piu-di-un-gelato-torino; Gelati e frappè di ottima qualità, serviti in un ambiente piccolo ma confortevole, con personale disponibile e preparato. Questa piccola gelateria offre un gelato di alta qualità ad un prezzo onesto. locale piccolo pulito e personale gentile e paziente e davvero professionale.
https://www.yelp.it/biz/gelateria-popolare-torino; Questo punto è una conferma di qualità e bontà! Il locale è molto carino con ottima musica jazz in sottofondo. Per il resto personale gentile e prezzi ormai nella media.
https://www.yelp.it/biz/gennaro-esposito-torino-2; Nulla da dire sulla qualità e la bontà della pizza! Ottima pizza se pur in stile streetfood ,tutti col sorriso,prezzo basso,prodotti d alta qualità. La pizza è buona, anche la focaccia.
https://www.yelp.it/biz/giapponese-ohashi-torino; La scelta non è molto ampia ma il pesce è sempre fresco e saporito. anche il sushi so che è ottimo e vi è un'ampia scelta di piatti Pesce fresco, sushi fantastico, prezzi onesti e servizio rapido!
https://www.yelp.it/biz/giapponese-sakura-torino; Scelta ampia di piatti,anche diversi dal solito. Rullo poco fornito con prodotti e materie prime scadenti. Nel menu all you can eat alcune cose sono appetitose come i gamberoni grigliati o la frittura di pesce.
https://www.yelp.it/biz/giapponese-xia-torino; Mai avuto il sentore che il pesce non fosse fresco.
https://www.yelp.it/biz/ginza-sushi-king-torino; L'ambiente è carino e la locazione è facilmente raggiungibile: si trova non molto distante dalla stazione di porta nuova.
https://www.yelp.it/biz/giovanni-torino; Cena ottima con buone pietanze e bella presentazione. Una serata di lavoro finita co una cena davvero ottima. Buona scelta di vini e antipasti gustosi tipici della cultura piemontese.
https://www.yelp.it/biz/girarrosto-santa-rita-torino; La pizza e buona ed è disponibile anche in formato maxy... Pizza buona Arancini buonissimi e diverse varietà Pollo e patate buoni... Personale cortese Pulizia del locale ottima Prezzi eccessivi
https://www.yelp.it/biz/giudice-esercizio-torino; Servizio impeccabile, cena soddisfacente, in particolare il dessert, peccato per l'aperitivo abbastanza deludente (pizzette anonime). La cena è stata ottima, un vero piacere per il palato. Locale molto intimo e personale cordiale ,porzioni molto curate e cibo ottimo.
https://www.yelp.it/biz/giusti-torino; Ampia scelta nel menù, pesce fresco, ma porzioni veramente piccole, caro. Buon ristorante, cucina tradizionale buona ed abbondante. Buon rapporto qualità-prezzo, il servizio è impeccabile.
https://www.yelp.it/biz/gramsci-torino-2; Pizza molto buona,impasto ok e cotta al momento giusto. Buona la scelta di birre e vini. Pizza buonissima e cucina sempre al top.
https://www.yelp.it/biz/granbar-torino; Aperitivo a scelta tra pinsa o sushi a 10€ con prodotti di ottima qualità! Il gran bar offre un servizio impeccabile e di qualità  a costi accessibili in maniera cortese e sempre disponibile. Drink di buona qualità. 2 aperol spritz.
https://www.yelp.it/biz/grande-muraglia-di-zhans-rong-e-li-songhai-torino; Ottimo rapporto qualità/prezzo e cortesia completano un quadro positivissimo. Ottima scelta per un pranzo o una cena conviviale. Non vi è l'opzione per un menù fisso-cena ma vi è un buon rapporto qualità-prezzo. da provare
https://www.yelp.it/biz/greek-food-lab-torino-2; Interessanti i vini e le birre greche. I prezzi sono molto contenuti per delle porzioni così abbondanti. Il locale è carino ma faceva piuttosto freddo.
https://www.yelp.it/biz/grezzo-torino; Complimenti alla preparazione del personale e alla qualità dei prodotti. La qualità dei prodotti di Grezzo è di un altro livello. Il prezzo giustificato dalla ottima qualità dei prodotti, e nemmeno troppo elevato.
https://www.yelp.it/biz/grill-burger-house-bari; Tutto di ottima qualità con diverse birre artigianali e tanti antipasti originali. Ottimi anche gli antipasti, prezzi più che onesti. Il prezzo vale comunque la qualità dei prodotti.
https://www.yelp.it/biz/grom-torino; Buon servizio, prezzi nella media, gelato molto buono, personale cortese! Gelato e granite di ottima qualità e locale pulito. Fortunatamente a Torino non c'è che l'imbarazzo della scelta.
https://www.yelp.it/biz/grom-torino-2; Qualità dei prodotti elevata, prezzo alla stessa altezza della qualità. Ampia scelta di gusti in un angolo magnifico della vecchia Torino! Servizio impeccabile e scelta ampia, sempre aggiornata, di gusti, tutti buoni.
https://www.yelp.it/biz/grom-torino-4; Gelati prodotti con materie prime di ottima qualità, non eccessivamente grassi e pesanti ma gustosi e dalla consistenza perfetta. Il gelato è di un ottima qualità, ma i prezzi non sono competitivi, un po' altini. Il gelato è fatto di ingredienti di ottima qualità.
https://www.yelp.it/biz/grotta-azzurra-bari; Prezzi nella media, ma è disponibile anche un menù che prevede antipasti e pizza a 11 euro. Scelta modesta sia di primi che di secondi. In generale il locale è carino ma manca atmosfera, il cameriere è cortese ma freddo.
https://www.yelp.it/biz/gufo-bianco-torino; Ottimo per una cena in compagnia o di lavoro. Ottima carta dei vini, antipasti ben impiattati e decorati con gusto. Ottima scelta degli amici che hanno deciso di ritrovarci a cena in questo ristorante.
https://www.yelp.it/biz/guido-gobino-torino-3; L'elevata qualità e l'ampia scelta di prodotti giustifica appieno i prezzi non proprio economici. Ma sulla qualità e bontà del prodotto nulla da dire. Una vasta scelta tra gianduiotti e cremini, accompagnati da un buon bicerin :) Ottimo rapporto qualità/prezzo.
https://www.yelp.it/biz/gulp-bari; Ampia carta dei vini e notevole scelta di birre.... Ampia scelta di carne, ampia scelta di panini gourmet, tantissime birre artigianali e vini di buon livello. per non tralasciare l'ampia scelta di birre a disposizione ed alcune proposte regionali (umbro-toscane)!
https://www.yelp.it/biz/gusti-e-sapori-torino; Pizze sempre ottime e con ampia scelta. Ampia scelta di pizze con pasta e condimenti buoni! Pizza buonissima, con un impasto bello croccante, e ingredienti buoni.
https://www.yelp.it/biz/gyrosteria-yannis-bari-2; Vari vini e birre greci in menu oltre a classici soft drink. Ottimo panino e moglie soddisfattissima... locale molto carino e caratteristico a due passi dall'ateneo... Locale molto carino situato al centro di Bari vicino l'Ateneo.
https://www.yelp.it/biz/habanero-torino-2; Qualità dei prodotti, ambiente ben studiato, musica d'atmosfera e prezzi contenuti. Rapporto qualità/prezzo leggermente alto ma in linea con gli altri ristoranti etnici. Porzioni abbondanti qualità del cibo elevata e prezzi nella media dei locali della zona.
https://www.yelp.it/biz/hagakure-fusion-bari; Permettici di dissentire fortemente sulla questione qualità dei prodotti. Il personale è sempre gentile e dispensa ottimi consigli sui prodotti da scegliere. Quasi scontata la qualità dei prodotti utilizzati, davvero di livello elevato, non facilmente reperibili nei più blasonati fusion restaurant.
https://www.yelp.it/biz/hamp-bari; Rapporto qualità/prezzo ottimo, servizio veloce e cortese. Personale cortese ed ampia scelta del menù. Prezzi un filo alti ma all'altezza della qualità dei prodotti.
https://www.yelp.it/biz/happy-days-bar-torino; La qualità dei prodotti è abbastanza buona,ma i prezzi sono davvero esagerati. Il personale è sempre gentilissimo, attento, cordiale. Cibo ottimo, ottima qualita' e soprattutto gran varieta'.
https://www.yelp.it/biz/hokkaido-torino; Pesce fresco, prezzo moderato e menù con ampia scelta. Il pesce è fresco,grande varietà sul menù è ottimo rapporto qualità prezzo sia a pranzo che a cena. Qualità del sushi buona, ottimo rapporto qualità-prezzo.
https://www.yelp.it/biz/home-burger-palese; La qualità dei prodotti serviti è buona, considerando la predilezione dei prodotti locali (soprattutto nei formaggi)! Panini eccellenti con carne di ottima qualità e sapientemente conditi per non alterarne il gusto. Prezzi sopra alla media, servizio rapido e cortese.
https://www.yelp.it/biz/horas-kebab-torino; Buona scelta di kebab e pizza, piatti vegetariani. Pizza decisamente buona nonstante il forno elettrico...prezzi nella media. Come rapporto qualità/prezzo senz'altro... ma per bontà è indubbiamente al secondo posto rispetto a Demir di Piazza Adriano.
https://www.yelp.it/biz/hua-dou-cheng-torino; La cucina è ottima e alcune pietanze (involtini primavera speciali) non trovabili altrove. Personale molto cordiale e attento ,anche i prezzi sono molto contenuti ....... puoi cenare bene anche spendendo € 10 Locale molto pulito e personale gentile (in particolar modo la titolare...sempre sorridente e di buon umore).
https://www.yelp.it/biz/hua-li-du-torino; Prezzi molto contenuti e porzioni veramente abbondanti!! Le porzioni sono abbondanti e i prezzi contenuti. Il rapporto qualità/prezzo è eccellente ed il personale è molto accogliente.
https://www.yelp.it/biz/huntsman-pub-torino; Locale bello con buona scelta di birre. Buona scelta di birre alla spina . Vasta scelta di birre e menù ricco.
https://www.yelp.it/biz/i-soliti-amici-torino; Le pizze sono state buone, la tipologia rispecchia l'impasto un po' più spesso. La pizza buona, nella media, però ben cotta! La pizza ottima con ingredienti di prima qualità.
https://www.yelp.it/biz/i-soliti-ignoti-torino; La pizza è abbastanza buona, anche gli antipasti. Cena tra amici per un compleanno: la pizza era buona, bordo alto, morbida.... Buona cucina ed ottima pizza alla napoletana.
https://www.yelp.it/biz/i-tartufi-bistrot-torino; Conto giusto per la qualità dei prodotti. Prezzi adeguati e ottimo rapporto qualità/prezzo del vino. Il menù prevede un'ampia scelta di antipasti al tartufo, i primi invece non sono tanti, ma molto buoni!
https://www.yelp.it/biz/i-tesori-bari; La qualità dei prodotti e poi indiscutibile...uno su tutti: i cannoli. Locale molto carino, personale gentile e disponibile. Il locale é curato in modo da evicare altri tempi, il personale e la proprietaria sono cortesi e professionali.
https://www.yelp.it/biz/i-tre-scalini-torino; La pizza è decisamente buona e 'ricca'. Pizza: condimenti generosi e di buona qualità . Ottima pizza e ottimo rapporto qualità / prezzo!!!
https://www.yelp.it/biz/ichi-torino; Ampia scelta di piatti per un menù all you can eat. Sushi fresco forse c'è poca varietà di gusti nonostante l'ampia scelta di piatti. Per essere un all you can eat il cibo è di qualità a cena.
https://www.yelp.it/biz/ichiban-torino; La scelta è abbastanza ampia e il rapporto qualità prezzo è ottimo. Il prezzo della cena è assolutamente consono al cibo servito e al servizio. Il servizio é anche veloce e il personale é gentile.
https://www.yelp.it/biz/ij-brande-torino; Cena di pesce di livello e di ottima qualità. Rapporto qualità prezzo davvero buono per una cena piacevole e curata. Di certo in centro a Torino c'e' molto di meglio come rapporto qualità/prezzo.
https://www.yelp.it/biz/il-barotto-torino; Rapporto qualità/prezzo ottimo e buono per un aperitivo o una cena dai sapori del nord. Per non parlare della qualità dei loro prodotti dai salumi , ai formaggi, alle birre artigianali. Una scelta ampia di birra e vini di qualita.
https://www.yelp.it/biz/il-brigantino-torino; La qualità dei prodotti si avverte da subito. Carta dei vini ampia e non scontata, vino consigliato molto apprezzato. Il cibo era ottimo e la qualità dei prodotti è indiscutibile.
https://www.yelp.it/biz/il-buco-torino; Davvero il ristorante è elegantissimo curato nei dettagli e il proprietario è molto gentile. In definitiva un locale per chi non ha pretese e creca un onesto rapporto qualità/prezzo
https://www.yelp.it/biz/il-caciucco-torino; Alta qualità dei prodotti e ben serviti. Una buona cena con personale amichevole e gentile in un locale carino. Prezzo assolutamente giusto per la qualità offerta (menù degustazione 3 antipasti+2 primi+1 secondo 38€).
https://www.yelp.it/biz/il-cortiletto-torino-2; Porzioni molto piú che soddisfacenti e prezzi davvero contenuti. Locale delizioso con ottima qualità e portate sfiziose. La cucina è di tradizione prettamente piemontese con un occhio attento alle materie prime di ottima qualità.
https://www.yelp.it/biz/il-covo-del-gusto-perduto-bari; Frittura di pesce ottima accompagnata da un'ottima Verdeca , il personale gentilissimo ti fa sentire a casa .
https://www.yelp.it/biz/il-dolcetto-bari; La pasta dei cornetti è davvero molto buona e il personale cordiale. Vasta scelta di cornetti, brioches con tante varianti di farcitura.
https://www.yelp.it/biz/il-fornaccio-bari; I panzerotti sono squisiti....la pizza é ottima.... e gli antipasti sono gustosi. Grande varietà di panzerotti e buone pizze. Buone anche le pizze e prezzi più che giusti.
https://www.yelp.it/biz/il-gelatiere-bari-3; Ampia scelta per gli amanti del cioccolato. Prodotti di ottima qualità e varie tipologie di gusto. Generosi con le porzioni ed un ottimo rapporto qualità prezzo.
https://www.yelp.it/biz/il-gelato-amico-torino; Il rapporto qualità/prezzo è più che ottimo. I prezzi sono nella media, ed anzi per la qualità e naturalezza del gelato è più che conveniente! Banco con pozzetti(come una volta)e l'attenzione alle materie prime e al gelato naturale/vegano molto marcato.
https://www.yelp.it/biz/il-giglio-torino; Pesce molto buono e rapporto qualità/prezzo corretto. Piacevole serata per una cena di lavoro... prodotti di ottima qualità e personale gentilissimo.. ........... Locale nel centro di Torino con ampia scelta di piatti di pesce con porzioni abbondanti.
https://www.yelp.it/biz/il-padellino-torino; Personale gentilissimo, farinata eccellente, pizza molto molto buona. Una cosa è certa: la pizza è ottima. In questo locale sì mangia un'ottima pizza al padellino.
https://www.yelp.it/biz/il-panino-giusto-torino; I panini sono vari e la scelta ampia! I prodotti sono di ottima qualità, insomma tutto ne giustifica il prezzo. Peccato per il personale che non sempre è così cortese.
https://www.yelp.it/biz/il-peccato-torino; Lascio a chi legge le conclusioni sul prezzo e qualità ( prodotti Metro ). La cucina è varia (va dalla pizza ai secondi) ed è di buona qualità, manca solo qualche proposta vegana. I prezzi sono contenuti ed il servizio è eccellente.
https://www.yelp.it/biz/il-picchio-torino; La pizza ha un buon impasto digeribile ed è molto buona. Pizza ottima, sottile, ben cotta e digeribilissima. Buone sia le pizze che altre pietanze.
https://www.yelp.it/biz/il-porticciolo-torino; Ottimo rapporto qualità/prezzo, vale tutto quello che spenderete, da tornarci! La carta dei vini è ampia e il ricarico effettuato è corretto. Il menu è prevalentemente di pesce con una vasta scelta di antipasti primi e eco di.
https://www.yelp.it/biz/il-porto-torino; Cena ottima,cibo di qualità e ben cucinato... Veramente ottimi gli antipasti e il secondo di pesce. Le porzioni sono abbondanti e le materie prime fresche e di qualità.
https://www.yelp.it/biz/il-punto-verde-torino-2; Servizio inappuntabile e rapporto qualità/prezzo molto buono La cena è stata ottima (il carpaccio di seitan forse troppo saporito, ma davvero buono). Il locale è carino, piccolo ma tranquillo.
https://www.yelp.it/biz/il-ristoro-dei-mercanti-torino; Consigliatissimo anche per il rapporto qualità prezzo. Il cibo di qualità media, Buona l, ma le attenzioni ed i prezzi giustificano alcune pecche.Vicino al centro. Pasto super abbondante e di buona qualità, per una spesa oltre modo giusta!
https://www.yelp.it/biz/il-rospetto-torino; Ottima pizza e scelta di birre, decisamente da riprovare Pizza ottima per chi ama la pizza sottile e croccante!! La pizza ottima e disponibile con diversi tipi di impasto.
https://www.yelp.it/biz/il-rustico-bari; Ottimi antipasti, ottima pizza e personale gentilissimo. Antipasti all'italiana abbondantissimi e una pizza squisita.... Pizza buona, antipasti ricchi bevande in quantita'.
https://www.yelp.it/biz/il-sedile-bari; Pizza molto buona,sottile , gustosa e invitante. La pizza è ottima e i prezzi bassi. La pizza è buona e sottile ed il servizio rapido.
https://www.yelp.it/biz/il-siculo-di-savona-monica-torino; Prezzi ormai nella media della citta, qualità molto buona. Qualità prezzo perfetto al di sotto dello standard dei marchi in città Ottima anche la qualità degli altri gelati
https://www.yelp.it/biz/il-tabisca-turin; La pizza era buona, niente di eccezionale. Ottima la pizza margherita ovale, ben cotta. Dove mangiare una pizza ottima a Torino?
https://www.yelp.it/biz/il-vicolo-torino; Antipasti e piatti molto buoni e decisamente un buon rapporto qualità prezzo. Cucina ottima..una varietà e una grande attenzione ai particolari..unica pecca la location..una cena in vetrina! Antipasti buonissimi in particolare l'insalata di funghi porcini freschi e poi risotti ben fatti in svariate forme .
https://www.yelp.it/biz/imbarco-perosino-torino; Cibo di qualità ma con proposte un pò scontate... antipasti banali, agnolotti.. forse un menù più moderno attizzerebbe Il cibo era ottimo, c'era musica jazz dal vivo piacevole, e la vista era incredibile. Un plauso particolare al personale cortese e professionale, malgrado la giovane età
https://www.yelp.it/biz/in-vino-veritas-torino; Le porzioni sono abbondanti e il rapporto qualità/prezzo è buono. A cena un venerdì sera in questo locale....buon rapporto qualità/prezzo.. Piccola osteria in zona vanchiglia..porzioni abbondanti e molto gustosi..rapporto qualità/prezzo ottimo..ottima carta dei vini..da ritornarci!!
https://www.yelp.it/biz/indian-street-food-torino; Cibo ottimo, autentico e preparato sul momento.
https://www.yelp.it/biz/indiano-shri-ganesh-torino; Anche i dessert sono di buona qualità. C'è ampia scelta, anche di piatti vegani...Più Punto forte: Cucina indiana di buona qualità e ampia scelta.
https://www.yelp.it/biz/italians-wok-better-torino-3; Ottimo per un pranzo o una cena tranquilla.
https://www.yelp.it/biz/japs-torino-2; Il cibo e davvero buono e le porzioni sono abbondanti in più il rapporto qualità/prezzo e davvero interessante! La qualità del sushi è buona ed il rapporto qualità/prezzo adeguato. La varietà è sicuramente molto ampia, ci si perde nel menù....
https://www.yelp.it/biz/japs-torino-3; soprattutto c'è un'ampia scelta di cibo vegetariani! In generale il rapporto qualità/prezzo è discreto. Preparano anche porzioni d'asporto.buono il rapporto qualità prezzo
https://www.yelp.it/biz/john-joy-torino; Locale non economico ma in linea con la qualità dei prodotti. I prezzi sono alti ma il rapporto qualità/prezzo giustifica la spesa finale. Bella atmosfera ideale per una cena a 2 ma anche per una tranquilla cena con amici.
https://www.yelp.it/biz/john-lennons-torino; Locale molto carino..pizza molto buona ordinata la diavola e l'Americana sfoglia ottima.. Da sottolineare l' ampia scelta di portate da poter gustare, oltre ai panini! Ottima e ricca scelta di birre alla spina e cucina varia e positiva.
https://www.yelp.it/biz/joys-pub-bari; La qualità del cibo è davvero buona e ampia scelta anche per quanto riguarda le birre. Buona e varia la scelta di birre, nazionali ed estere. Ottima la scelta di birra, anche il cibo è molto buono.
https://www.yelp.it/biz/jubin-di-hu-lidan-torino; Cibo cinese e italiano di buona qualità, personale gentile, prezzi economici e vasta scelta di pietanze orientali. Ottimo rapporto qualità-prezzo in questo ristorante cinese.
https://www.yelp.it/biz/jumping-jester-torino; Menu vario da pub con ampia scelta birre. Ottima scelta di birre e piatti molto buoni. I prezzi sono decisamente contenuti e ci sono 4-5birre da scegliere.
https://www.yelp.it/biz/karmacola-torino; Ampia scelta per quanto riguarda il pane! Cibo ottimo, molto gustoso e in un'atmosfera originale. I piatti sono molto buoni e la scelta è ampia.
https://www.yelp.it/biz/kashmir-torino-2; Ampia scelta di piatti, per tutti i gusti e intolleranze. Molto consigliato per l'ottimo rapporto qualità/prezzo: buon cibo e ottimo prezzo. Il personale è molto cortese e disponoibile, i piatti superabbondantti a prezzi modici.
https://www.yelp.it/biz/kensho-torino; Indiscussa qualità dei prodotti, TUTTO preparato in modo eccellente. I prodotti sono di ottima qualità e il servizio è impeccabile. Pranzo con colleghi: ampia scelta di portate, locale raffinato, qualità dei piatti molto elevata.
https://www.yelp.it/biz/kido-ism-torino; Ottimo per una cena a 2 o anche in compagnia di amici. è stata una cena davvero ottima partendo dal servizio, molto cortese e premuroso. Il cibo è ottimo, l'ambiente accogliente e il personale molto gentile.
https://www.yelp.it/biz/kiki-torino; Ottimo per una cena romantica: farete un figurone. La qualità dei prodotti è eccezionale, il locale piccolino ma accogliente. Punti di forza: la qualità dei prodotti, veramente molto alta, e la preparazione dei piatti, molto curata.
https://www.yelp.it/biz/kipling-torino; Menù particolare e raffinato con prodotti e materie prime curate. Sicuramente da consigliare anche ai celiaci per un'ampia scelta di piatti gluten free. Vasta scelta di ottimi prodotti, trattati con attenzione calibrando tradizione, spezie e cromie.
https://www.yelp.it/biz/km5-torino; I cocktail sono molto buoni e la scelta dei vini non è ampia ma comunque di accettabile qualità. Buona scelta tra antipasti, primi e secondi che variano sempre..c'è una bella ricerca e la qualità è alta! Il locale è molto carino, accogliente e chic.
https://www.yelp.it/biz/kokoroya-torino; Il locale offre un'ampia scelta di gastronomia giapponese e di prodotti da comprare!!! Assicuro che il prezzo è giusto per la qualità dei prodotti serviti e per la cura del cliente. Questo è un vero ristorante giapponese, perfetto nella sua semplicità.
https://www.yelp.it/biz/kombu-torino; Le porzioni sono abbondanti e ottimo rapporto qualità prezzo Alta qualità dei prodotti nn proprio a buon mercato..!! Buono il rapporto qualità/prezzo, ma soprattutto brevissimi i tempi di attesa.
https://www.yelp.it/biz/kyoto-torino; Locale molto carino, servizio eccellente e sushi buonissimo! Il locale è carino, gestito da 2 ragazzi giovani. Cibo ottimo, un menu che offre tanto e servizio magnifico.
https://www.yelp.it/biz/l-accademia-del-panino-torino; ottima qualità dei prodotti, abbondante, davvero gustoso e super onesto con i prezzi!! Ampia scelta di panini per tutti i gusti. Ampia scelta di panini con alcune idee molto intriganti.
https://www.yelp.it/biz/l-aglio-torino; Locale molto carino in zona tranquilla con ampia scelta di parcheggio. Cena tranquilla con un'amica... cornice bella della pre collina di Torino. Il prezzo in linea con la cena ed il menù proposto.
https://www.yelp.it/biz/l-agrifoglio-torino; Ampia scelta di vini con ovviamente punte di eccellenza nei rossi piemontesi. Buon servizio ed ampia scelta di pietanze, soprattutto tipiche locali, di formaggi e vini. La carta dei vini non è molto ampia, ma i vini presenti sono molto interessanti.
https://www.yelp.it/biz/l-ancora-torino-2; Il prezzo in linea con la qualità dei prodotti. Pesce fresco, piatti di qualità, porzioni abbondanti e personale gentile. Buon ristorante con buon pesce fresco e porzioni molto abbondanti.
https://www.yelp.it/biz/l-ancora-torino-3; Rapporto qualità prezzo veramente bassa considerato il conto. Il locale è decisamente carino, arredato con cura ed accogliente. Servizio cortese e attento, personale molto simpatico e discreto.
https://www.yelp.it/biz/l-angolo-divino-torino; Qualita' delle materie prime e porzioni ottime. Ottimo il rapporto qualità/prezzo: due antipasti, due primi, due calici di vino e due caffè: meno di 50 Euro! Hanno un menù ristorante molto vario e anche la carta dei vini è ampia.
https://www.yelp.it/biz/l-antico-arco-cellamare; C'è una scelta abbastanza ampia di pizze. Ampia scelta di impasti per le pizze e di birre artigianali. Pizze buonissime e grande assortimento di birre (ma non alla spina!).
https://www.yelp.it/biz/l-birichin-torino-2; Ottima la faraona e ampia la carta dei vini. Servizio: servizio cortese,cordiale e competente, nonostante leggere disattenzioni. Servizio molto cordiale e preciso, il maitre Angelo molto simpatico e grande conoscitore di vini.
