url;review
https://www.yelp.it/biz/giapponese-ohashi-torino;La scelta non è molto ampia ma il pesce è sempre fresco e saporito.
https://www.yelp.it/biz/gennaro-esposito-torino-2;Nulla da dire sulla qualità e la bontà della pizza!
https://www.yelp.it/biz/gelateria-popolare-torino;Questo punto è una conferma di qualità e bontà!
https://www.yelp.it/biz/gelateria-piu-di-un-gelato-torino;Gelati e frappè di ottima qualità, serviti in un ambiente piccolo ma confortevole, con personale disponibile e preparato.
https://www.yelp.it/biz/gelateria-piccinni-bari;Gelato molto buono con ampia scelta di gusti, alcuni particolari.
https://www.yelp.it/biz/gelateria-monginevro-smaldone-raffaele-torino;Ampia scelta di gusti, gelato cremoso e buonissimo.
https://www.yelp.it/biz/gelateria-mondello-torino;La scelta è ampia, i gusti originali e ricercati.
https://www.yelp.it/biz/gelateria-miretti-torino-7;Nulla da dire sui prodotti e sulla qualità anche se i prezzi sono troppo elevati.
https://www.yelp.it/biz/gelateria-grom-torino-2;Ovviamente al primo posto sta l'ottima qualità dei gelati, preparati con prodotti scelti e di stagione.
https://www.yelp.it/biz/gelateria-due-salette-torino;I prodotti si rivelano di buona qualità, gentile il cameriere pur facendosi attendere inizialmente.
https://www.yelp.it/biz/gelateria-delle-alpi-torino;Qualità e prezzi onesti, accompagnati da porzioni abbondanti.
https://www.yelp.it/biz/gelateria-ciuffos-torino;Gusti ottimi e rapporto qualità/prezzo molto buono!
https://www.yelp.it/biz/gatsbys-torino;Ambiente semplice, nel pieno centro di torino.
https://www.yelp.it/biz/gasperini-bari;Il personale preparato su tutti i gusti, anche i più particolari, sorridente e gentile.
https://www.yelp.it/biz/gandhi-torino;Cucina ottima, piatti leggeri e porzioni abbondanti.
https://www.yelp.it/biz/galante-torino-2;Ampia scelta di proposte, sia mare che terra.
https://www.yelp.it/biz/galante-torino;Carta dei vini discreta e locale elegante anche se in stile primo  900.
https://www.yelp.it/biz/gadi-bari;Personale gentilissimo e sempre disponibile per qualsiasi cosa.
https://www.yelp.it/biz/fuzion-torino;Una pizza buonissima dall'impasto eccezionale e dagli ingredienti di ottima qualità.
https://www.yelp.it/biz/frulez-bari;Vengono utilizzati solo prodotti scelti e di buona qualità.
https://www.yelp.it/biz/freevolo-torino;E per finire ottimo rapporto qualità/prezzo e location!
https://www.yelp.it/biz/fratelli-roselli-torino;Ottima anche l'ampia scelta di birre artigianali.
https://www.yelp.it/biz/fratelli-la-cozza-torino-2;Le pizze sono buone ma l'offerta di piatti è ampia.
https://www.yelp.it/biz/forchetta-e-scarpetta-torino;Pranzo veloce con cibo discreto ma con un buon rapporto qualità/prezzo.
https://www.yelp.it/biz/focacceria-tipica-ligure-torino;Le focacce sono molto buone così come le pizze.
https://www.yelp.it/biz/focacceria-santagostino-torino-2;Una ampia scelta di pizza al taglio e farinata.
https://www.yelp.it/biz/focacceria-santagostino-torino;Una ampia scelta di pizza al taglio e farinata.
https://www.yelp.it/biz/focacceria-riviera-ligure-torino;Le focacce sono molto buone così come le pizze.
https://www.yelp.it/biz/fiorio-gelateria-torino-2;Nella storica gelateria di Torino il gelato e di ottima qualità, eccezionale fior di latte.
https://www.yelp.it/biz/fiorio-gelateria-torino;La scelta è infinita e c'è solo l'imbarazzo della scelta.
https://www.yelp.it/biz/fiorfood-torino;Ottimi gli antipasti e i primi ordinati.
https://www.yelp.it/biz/filo-di-marianna-torino;Dolci squisiti con porzioni esagerate...rapporto qualità prezzo del menu molto valido.
https://www.yelp.it/biz/fassoneria-torino;Prezzi nella media: 2 hamburger, piatto di crudi, 2 birre e due porzioni di fritte, 50€.
https://www.yelp.it/biz/farmacia-dei-sani-bari;Conto in linea con qualità dei prodotti degustati.
https://www.yelp.it/biz/farini-da-lia-torino;Prezzo perfettamente in sintonia con l'alta qualità dei prodotti!
https://www.yelp.it/biz/factory-bari;Panini davvero buoni e vasta scelta sulle birre.
https://www.yelp.it/biz/exki-pietro-micca-torino;Locale molto carino con prodotti vegetariani e vegani.
https://www.yelp.it/biz/estrella-do-sul-torino;i prezzi sono contenuti e sinceramente non sono mai riuscito ad arrivare fino alla fine.
https://www.yelp.it/biz/esperia-torino-2;Il servizio è cordiale e veloce, buon rapporto qualità/prezzo.
https://www.yelp.it/biz/eos-torino;Personale cortese, menù con poche voci ma ben selezionate, ottima carta dei vini.
https://www.yelp.it/biz/enzo-e-grazia-di-matera-grazia-torino;Prodotti freschi e ottimo caffè di buona qualità.
https://www.yelp.it/biz/entremetier-di-lingweifu-torino;La pizza è molto buona e costa pochissimo.
https://www.yelp.it/biz/enoteca-rossorubino-torino;Infine il vino con l'ampia scelta convince.
https://www.yelp.it/biz/eno-libero-emporio-enogastronomico-torino;Grande varietà di piatti, vini e birre.
https://www.yelp.it/biz/emporio-gastronomico-torino;Ottima pizza napoletana con impasto soffice e digeribile.
https://www.yelp.it/biz/el-puig-d-estelles-torino;Consigli di andarci per una cena tranquilla.
https://www.yelp.it/biz/el-pollo-loco-torino;Il menù offre un ampia scelta tra primi, secondi, contorni, panini e combinazioni.
https://www.yelp.it/biz/el-mir-torino;Ottima la qualità dei prodotti, la presentazione,la competenza sui vini.
https://www.yelp.it/biz/el-churrasco-bari-2;Servizio eccellente e carne di ottima qualità.
https://www.yelp.it/biz/el-centenario-torino-2;Ampia scelta tra antipasti primi e secondi, un ottimo reparto alcolici.
https://www.yelp.it/biz/el-centenario-torino;Ampia scelta tra antipasti primi e secondi, un ottimo reparto alcolici.
https://www.yelp.it/biz/eataly-torino-torino;Dolci ottimi, veramente buoni i cannoli siciliani
https://www.yelp.it/biz/eataly-bari;Buone le pizze, le birre artigianali ed il babà.
https://www.yelp.it/biz/eat-sicily-torino;Le porzioni erano abbondanti e di ottima qualità.
https://www.yelp.it/biz/dublin-house-bari;C'è una vasta scelta di birre, ma comunque i prezzi sono medio-alti.
https://www.yelp.it/biz/du-cesari-torino;Porzioni degli antipasti e dei primi abbonanti.
https://www.yelp.it/biz/doubletree-torino;Menu a buffet con un ottimo rapporto qualità/prezzo.
https://www.yelp.it/biz/dorian-gray-torino;Cibo di buona qualità e ottima scelta di birre.
https://www.yelp.it/biz/dora-in-poi-torino;Carta dei vini non ampia ma con ricarichi corretti.
https://www.yelp.it/biz/don-panino-torino;Ampia varietà di scelta di panini, buoni gli Hamburger
https://www.yelp.it/biz/don-gennaro-torino;C'è ampia scelta di ingredienti con pizze molto fantasiose.
https://www.yelp.it/biz/dolce-mania-di-lepori-raffaele-torino;Ampia scelta di gusti e tutto buonissimo.
https://www.yelp.it/biz/dolce-basilico-torino;Rapporto qualità prezzo perfetto e pizza buonissima.
https://www.yelp.it/biz/dog-out-presso-otto-gallery-torino;Il personale è gentilissimo e veloce nel servizio.
https://www.yelp.it/biz/diplomatic-torino;Ampia scelta, con personale molto attento e cortese.
https://www.yelp.it/biz/diecicento-torino-2;Pizza buona, impasto leggero e croccante, ingredienti freschi.
https://www.yelp.it/biz/dickens-inn-bari;Ampia scelta di panini e piadine, buona anche la scelta fra le birre.
https://www.yelp.it/biz/dess%C3%AC-torino;Prezzi nella norma e locale carino, ma niente di che
https://www.yelp.it/biz/delfino-blu-torino;Carta dei vini ampia e di qualità.
https://www.yelp.it/biz/dausin-torino;Gli antipasti sono vari e tutti buonissimi.
https://www.yelp.it/biz/dai-saletta-torino-2;Servizio cortese e non invadente, porzioni abbondanti.
https://www.yelp.it/biz/da-paolo-bari;Ottimi antipasti tutto molto fresco e genuino.
https://www.yelp.it/biz/da-nicola-torre-a-mare;Antipasti molto buoni,spiccava il crudo di mare molto fresco.
https://www.yelp.it/biz/da-nathalie-bari;Pesce fresco e gustoso, pizza ottima e sottile alla barese, antipasti vari e ottimi.
https://www.yelp.it/biz/da-mauro-torino;Ottimo il rapporto tra la qualità dei prodotti ed il prezzo degli stessi.
https://www.yelp.it/biz/da-giuliano-torino;La pizza buona, peccato tutto il resto.
https://www.yelp.it/biz/da-giannino-l-angolo-d-abruzzo-torino;Ottimo rapporto qualità/prezzo, I piatti sono davvero squisiti, come è descritto abbondantemente dalla grande maggioranza delle recensioni.
https://www.yelp.it/biz/da-ciro-torino;Pizza molto buona, leggera con impasto soffice.
https://www.yelp.it/biz/da-ciccillo-torino;Cibo ottimo: pizza E-NOR-ME e con ottime materie prime, e antipasti abbondantissimi.
https://www.yelp.it/biz/da-benito-torino;antipasti originali e vari...pesce fresco...servizio simpatico...ancora meglio da quando non si fuma...!
https://www.yelp.it/biz/curry-zone-turin;Il cibo è ottimo, sia come qualità che come rapporto qualità/prezzo.
https://www.yelp.it/biz/crocetta-torino;Buoni i vini e anche le birre!
https://www.yelp.it/biz/cris-e-bio-bari;Pizza ottima, antipasti buoni, personale educato e disponibile.
https://www.yelp.it/biz/cornetti-night-torino;Ampia scelta di cornetti con tanti topping e ripieni molto buoni!
https://www.yelp.it/biz/copacabana-torino;Gran buffet di antipasti caldi e freddi con scelta ampia e qualità più che accettabile.
https://www.yelp.it/biz/coox-torino;Buon ristorante vegano in centro a Torino, ottima la parmigiana ma la scelta dei piatti è ampia.
https://www.yelp.it/biz/conte-verde-torino-2;La pizza nella norma e il servizio buono.
https://www.yelp.it/biz/conogelato-torino;Personale cortese e professionale, prezzi piuttosto cari.
https://www.yelp.it/biz/complice-di-zhou-jinshu-torino;Se si sceglie la pizza...buona anche quella...gli ingredienti sono buoni e l'impasto anche.
https://www.yelp.it/biz/cit-ma-bon-torino;Buona la scelta di birre (Menabrea Ambrata).
https://www.yelp.it/biz/circolo-dei-lettori-torino;Da sottolineare il rapporto qualità/prezzo, davvero fuori dalla norma.
https://www.yelp.it/biz/cioccolato-peyrano-torino-2;Le materie prime sono ottime e il gusto ne guadagna.
https://www.yelp.it/biz/cinque-lire-torino;Ambiente accogliente e personale disponibile, per quanto giovane e piuttosto impacciato, sembravano le premesse per una buona cena.
https://www.yelp.it/biz/cinese-mei-li-hua-torino;La cucina è ottima, leggera e gustosa.
https://www.yelp.it/biz/cinese-fang-xiang-bari;Ampia varietà di scelta, personale molto gentile e ambiente pulito.
https://www.yelp.it/biz/cinese-du-cheng-torino-2;I prezzi sono contenuti, rapporto qualità/prezzo ottimo.
https://www.yelp.it/biz/cinese-chen-lon-torino;Personale molto cordiale e buon rapporto qualità/prezzo.
https://www.yelp.it/biz/ciclatera-sotto-il-mare-bari;Buona la scelta dei vini e delle birre.
https://www.yelp.it/biz/ciacolon-ca-veneta-torino;Ricco buffet ed i antipasti con l'imbarazzo della scelta.
https://www.yelp.it/biz/chiodi-latini-new-food-torino;nulla da dire sulla qualità dei prodotti e le capacità dello Chef: eccellente.
https://www.yelp.it/biz/chez-zeina-torino;Buona la scelta di antipasti e piatti nel menu, saporiti e tipici libanesi.
https://www.yelp.it/biz/che-bolle-in-pentola-torino;Antipasti e primi (sempre i soliti) buoni.
https://www.yelp.it/biz/cera-una-volta-torino;Antipasti e primi deliziosi annaffiati da un buon vino .
https://www.yelp.it/biz/cento-90-due-torino-2;Bellissimo locale con un'ampia scelta di antipasti,primi,secondi messi a disposizione per l'apericena.
https://www.yelp.it/biz/cecchi-torino;Sia la farinata che le pizze sono buonissime.
https://www.yelp.it/biz/ceccarelli-torino;La cucina curata e buona con un buon rapporto qualità/prezzo.
https://www.yelp.it/biz/catullo-torino-2;Così come molto buone sono le pizze.
https://www.yelp.it/biz/casale93-torino;Pizze di buona qualità, tipo Napoli, con intonaco, buono l'impasto.
https://www.yelp.it/biz/casablanca-bari;Buon servizio buona la scelta di pizze.
https://www.yelp.it/biz/casa-vicina-torino;Il rapporto qualità prezzo è davvero buono.
https://www.yelp.it/biz/casa-mad-torino;Consigliato per una cena tranquilla e amicale.
https://www.yelp.it/biz/casa-fiore-torino;Ottima la qualità dei prodotti proposti, presentati ottimamente.
https://www.yelp.it/biz/casa-del-barolo-torino-3;Cena ottima, piatti presentati benissimo e...un pane eccezionale!
https://www.yelp.it/biz/cantine-risso-torino;Buon rapporto qualità/prezzo.Se siete a Torino non perdetelo!
https://www.yelp.it/biz/cammaf%C3%A0-torino-4;Consigliato se volete provare/mangiare un ottima pizza!
https://www.yelp.it/biz/camilla-kitchen-torino;Carta dei vini ampia e personale gentile.
https://www.yelp.it/biz/caff%C3%A8-torino-torino-2;Servizio curato dal personale cortese, mai invadente e sempre premuroso.Nessun cameriere di secondo lavoro.
https://www.yelp.it/biz/cafe-vergnano-1882-torino;Locale gradevole e ordinato, cameriere gentile e simpatico.
https://www.yelp.it/biz/cafe-alberto-torino;Il cibo è tipico piemontese con personale molto cordiale e disponibile.
https://www.yelp.it/biz/cacio-e-pepe-torino;Le pizze sono molto buone, gustose, ben cotte.
https://www.yelp.it/biz/burgheria-torino-2;Dispongono anche di un'ottima scelta di birre.
https://www.yelp.it/biz/burgheria-torino;Lodevole la possibilità di personalizzare il proprio panino e ampia la scelta delle bevande.
https://www.yelp.it/biz/buosi-torino;Da ritornare .. ottimo qualità/ prezzo e personale cortese e gentile!
https://www.yelp.it/biz/bucks-g-d-34-torino-2;Ottime birre con prezzi nella media (3/5€)
https://www.yelp.it/biz/bruschetteria-pautasso-di-stecco-susanna-torino;ottima cena e personale gentilissimo, ci ritornerei sicuramente!!
https://www.yelp.it/biz/briss-torino;Eccezionali le materie prime e gli abbinamenti, tutto molto gustoso e ben presentato!
https://www.yelp.it/biz/brek-torino;Buon rapporto qualità/prezzo e piatti abbondanti e gustosi.
https://www.yelp.it/biz/brasserie-bordeaux-torino-3;Ottima carta dei vini e ottima l'idea di accompagnare la cena con vari tipi di pane!
https://www.yelp.it/biz/brasserie-bordeaux-torino-2;Ottima carta dei vini e ottima l'idea di accompagnare la cena con vari tipi di pane!
https://www.yelp.it/biz/braceria-signorile-bari;Ottimi anche gli antipasti ed i contorni.
https://www.yelp.it/biz/bottega-baretti-moncalieri;Pizza davvero buona, impasto e condimento eccezionali.
https://www.yelp.it/biz/botta-bari;Eccellente la pizza ed ottimi gli antipasti.
https://www.yelp.it/biz/borgo-dora-torino;Le porzioni sono abbondanti e di ottima qualità.
https://www.yelp.it/biz/borgo-antico-bari;Ottima la pizza è buonissimo gli antipasti!
https://www.yelp.it/biz/bollicine-di-gigliotti-e-de-bartolo-torino;I prezzi sono nella media e la pizza è buona.
https://www.yelp.it/biz/boja-fauss-torino-2;In conclusione: cibo di buona qualità, ampia scelta nel menù, prezzi medi.
https://www.yelp.it/biz/boheme-torino;Rapporto qualità/prezzo un po' sopra la media.
https://www.yelp.it/biz/bocciofila-mossetto-torino;Il personale è gentilissimo e cordiale e il cuoco ci sa fare con piatti tipici o rivisitati.
https://www.yelp.it/biz/bocciofila-cavorettese-torino;C'era un'ampia scelta di primi e secondi.
https://www.yelp.it/biz/blue-eyes-bari;Porzioni abbandonati e cibi di buona qualità.
https://www.yelp.it/biz/blah-blah-torino;Locale molto carino, personale gentile e cordiale.
https://www.yelp.it/biz/black-jack-torino;La pizza è davvero buona: l'impasto è ottimo, la vasta scelta di ingredienti a disposizione di qualità.
https://www.yelp.it/biz/black-e-white-bari;Cibo: prodotti del territorio di ottima qualità interpretati con personalità dallo chef.
https://www.yelp.it/biz/black-angus-turin;L'Angus su pietra di ottima qualità, ben preparato.
https://www.yelp.it/biz/bistrot-turin-torino;Ampia scelta di vini, prodotti tipici della regione, personale cordialissimo.
https://www.yelp.it/biz/birrificio-torino-torino;Buona scelta di birre davvero buone .
https://www.yelp.it/biz/birreria-la-divina-commedia-torino;Le pizze erano buone anche le birre alla spina erano buone.
https://www.yelp.it/biz/birreria-don-giovanni-torino;Ampia la scelta delle birre e molto socievoli i proprietari
https://www.yelp.it/biz/bicyclette-torino;Le crepes sono molto buone e la scelta è davvero ampia!
https://www.yelp.it/biz/biberon-torino;Ampia scelta di rum da tutto il mondo, selezione di birre e distillati.
https://www.yelp.it/biz/biancofiore-bari;Prezzi nella media per la qualità e tipologia di prodotti offerti.
https://www.yelp.it/biz/biancofarina-bari;Sia gli antipasti che le pizze sono buoni!
https://www.yelp.it/biz/berbel-torino;Il prezzo è adeguato alla qualità dei prodotti.
https://www.yelp.it/biz/bene-cos%C3%AC-torino;Ottima la scelta della musica in sottofondo, e il volume era perfetto per riuscire a chiacchierare.
https://www.yelp.it/biz/beaubar-torino;bar discreto nell'arredo ma con ampia scelta (panini, hamburger, piade). qualità prodotti buona, prezzi anche. comodissimo per museo cinema
https://www.yelp.it/biz/bbq-di-pennestri-davide-antonio-c-torino;Il locale è carino ma nulla di che.
https://www.yelp.it/biz/bastimento-torino;Piatti ben riusciti e di ottima qualità con prezzi però leggermente cari per le porzioni.
https://www.yelp.it/biz/barnum-torino;Il menù offre ottimi antipasti (abbondanti) e buone pietanze.
https://www.yelp.it/biz/bari-napoli-bari;Buonissima pizza e ottima qualità del cibo!
https://www.yelp.it/biz/barcollo-torino;Ampia scelta di cocktail a prezzi contenuti (sui 4 euro e 50).
https://www.yelp.it/biz/barbagia-di-ollolai-torino;Soprattutto il cibo era ottimo, in particolare i culurgiones.
https://www.yelp.it/biz/bar-telebari-bari;Vasta scelta nei gusti e location strategica per raggiungere facilmente il centro.
https://www.yelp.it/biz/bar-delle-scienze-torino;Il locale é piccolo ma accogliente ed il personale giovane.
https://www.yelp.it/biz/bar-del-duomo-torino;Buone porzioni e buon rapporto qualità prezzo.
https://www.yelp.it/biz/bangla-takeaway-torino;Più che consigliato per chi vuole mangiare vera cucina indiana di altissima qualità!
https://www.yelp.it/biz/banco-vini-e-alimenti-torino;Considerando la qualità dei prodotti prezzo adeguato.
https://www.yelp.it/biz/banco-di-sicilia-torino;Ampia scelta di piatti di pesce dagli antipasti alle altre portate.
https://www.yelp.it/biz/bacco-bari;Per chi non gradisce il crudo invece c'è ampia scelta di antipasti cotti.
https://www.yelp.it/biz/baccanale-torino;Subito sono arrivati degli ottimi antipasti: salumi,burrata,mozzarelline, polpette stupende.
https://www.yelp.it/biz/b2-burger-and-beer-torino;Vasta scelta di birre artigianali e servizio sempre al top!!
https://www.yelp.it/biz/b-eat-torino;La carne è ottima e il rapporto qualità/prezzo pure.
https://www.yelp.it/biz/augusto-torino;Pizza e cucina buoni,porzioni giuste prezzi onesti.
https://www.yelp.it/biz/astoria-torino;Il locale è molto carino, stile berlinese.
https://www.yelp.it/biz/artinfood-torino;Cena ottima, portate abbondanti, pane e focaccia buonissimi.
https://www.yelp.it/biz/arigato-torino;Tutto il cibo ottimo e porzioni abbondanti.
https://www.yelp.it/biz/arcadia-torino-4;Antipasti: battuta di buona qualità accompagnata (perchè?)
https://www.yelp.it/biz/antonelli-torino;Ottimo posto cn vista sul po.....vasta scelta di piatti e birre.......compresa la super tennent s alla spina ....
https://www.yelp.it/biz/antico-balon-torino;Dagli antipasti ai primi alla pizza, tutto ottimo.
https://www.yelp.it/biz/antichi-sapori-torre-a-mare;Menù fisso antipasti discreti ottimi primi Nel contesto discreta cena rapporto qualità prezzo Personale molto disponibile Soddisfatto
https://www.yelp.it/biz/antica-trattoria-del-sole-torino;Ottima scelta dei piatti: sempre ottimamente cucinati e presentati.
https://www.yelp.it/biz/antica-salumeria-torino;Taglieri abbondanti e buona qualità dei prodotti.
https://www.yelp.it/biz/angolo-del-parin-torino;Cena ottima, tutti soddisfatti, tutti in ufficio il mattino successivo.
https://www.yelp.it/biz/anema-e-cozze-torino;La pizza è buona, con bordi alti e un condimento saporito.
https://www.yelp.it/biz/amici-miei-torino;Ottima frittura di pesce è buonissima pizza.
https://www.yelp.it/biz/america-graffiti-torino;Ampia scelta di birre e di stuzzichini.
https://www.yelp.it/biz/alla-portata-torino;Vasta scelta della carta per antipasti, primi e pizza.
https://www.yelp.it/biz/alla-lettera-torino;La pizza e gli antipasti sono davvero buoni.
https://www.yelp.it/biz/alivella-torino;Pizza ottima...tipico impasto napoletano con cornicione alto e gommoso.
https://www.yelp.it/biz/aldente-torino;Prezzi nella media, porzioni abbondanti e tutto davvero squisito!!
https://www.yelp.it/biz/alcool-torino-2;Personale cordiale e gentile, cocktail ottimi e prezzi altrettanto.
https://www.yelp.it/biz/alberto-marchetti-torino-2;Ottimo ambiente e ampia scelta di gusti.
https://www.yelp.it/biz/alberto-marchetti-torino;Ottimo ambiente e ampia scelta di gusti.
https://www.yelp.it/biz/alberosole-bari;Porzioni un po' piccole in funzione del prezzo ma ribadisco di ottima qualità.
https://www.yelp.it/biz/ala-torino;Personale cordiale verdure fritte molto buone ed anche il cinghiale sicuramente da provare.
https://www.yelp.it/biz/al-tegamino-moncalieri;La pizza buona, ma comunque nella media.
https://www.yelp.it/biz/al-sorso-preferito-bari;Ottimi antipasti, in particolare le verdure fritte.
https://www.yelp.it/biz/al-raffaello-bari;Buona la frittura di pesce ed ottimi i dessert.
https://www.yelp.it/biz/al-pescatore-bari;Buona cucina con prodotti tradizionali e ampia scelta di pesce fresco.
https://www.yelp.it/biz/al-paradise-palese;Cibo di buona qualità, comprese le pizze.
https://www.yelp.it/biz/al-grassi-torino-2;Ampia anche la scelta di pesce come portata principale.
https://www.yelp.it/biz/al-gatto-nero-torino;Cena ottima di livello assoluto, nessuna sbavatura in nessun piatto (dagli antipasti al dessert) e buona lista dei vini.
https://www.yelp.it/biz/al-garamond-torino;Carta dei vini ampia e prezzo adeguato.
https://www.yelp.it/biz/al-cantuccio-bari;La pizza è buona e gli antipasti molto caserecci.
https://www.yelp.it/biz/al-cacimperio-torino;Ampia scelta di vini, soprattutto del territorio.
https://www.yelp.it/biz/al-111-bari-2;Ampia scelta fi pietanze, primi, pesce ,pizze.Ampia scelta di vini.Ottimo rapporto qualità/prezzo.
https://www.yelp.it/biz/ai-4-assi-di-sanna-roberto-torino;Pizza ordinata uguale cena riuscita perfettamente in buona compagnia e con ottima pizza!!!
https://www.yelp.it/biz/ai-2-ghiottoni-bari-2;Scelta di vini con un buon rapporto qualità/prezzo.
https://www.yelp.it/biz/adonis-torino;Ampia scelta di crepes, gustose anche per i vegetariani.
https://www.yelp.it/biz/a6-sciamadda-torino;Puoi mangiare bene Ottimi antipasti Sublime il pesce.
https://www.yelp.it/biz/a-vucciria-torino;La pizza era buona, e anche i cannoli siciliani fatti da loro.
https://www.yelp.it/biz/a-picciridda-torino;Potete degustare ottimo pesce e anche le pizze sono buone.
https://www.yelp.it/biz/a-la-merenda-sinoira-torino;Prezzi nella media e porzioni più abbondanti del solito.
https://www.yelp.it/biz/a-casa-di-pulcinella-torino;Ottima qualità delle pizze, in particolare buonissimo e molto leggero l'impasto.
https://www.yelp.it/biz/7-nani-torino;Proprio da questo si capisce che la pizza è ottima: impasto cottura e condimenti.
https://www.yelp.it/biz/500-calorie-torino;Il locale è carino, l'idea è originale, il personale è cortese.
https://www.yelp.it/biz/1610-bagel-torino;C'è un ampia scelta tra prodotti più ricercati rispetto alla banalità che trovi in giro.
