url;review
https://www.yelp.it/biz/1610-bagel-torino; C'è un ampia scelta tra prodotti più ricercati rispetto alla banalità che trovi in giro. Materie prime ottime, manipolate con grande maestria offrono un'ampia gamma di condimenti. Menù ristretto ma con prodotti di ottima qualità, con accostamenti particolari e ben studiati.
https://www.yelp.it/biz/500-calorie-torino; Il locale è carino, l'idea è originale, il personale è cortese. E' un piccolo ristorante con personale cordiale di aspettare. Location semplice prezzi nella media, materia prima nella media.
https://www.yelp.it/biz/7-nani-torino; Proprio da questo si capisce che la pizza è ottima: impasto cottura e condimenti. Personale cortese, pizze molto buone anche la farinata. Ottima la pizza al tegamino,soffice e ben cotta.
https://www.yelp.it/biz/a-casa-di-pulcinella-torino; Ottima qualità delle pizze, in particolare buonissimo e molto leggero l'impasto. La pizza è buonissima, impasto digeribile, ingredienti di ottima qualità e freschezza. Vasta scelta di birre in bottiglia e non da meno il menu pizza.
https://www.yelp.it/biz/a-la-merenda-sinoira-torino; Prezzi nella media e porzioni più abbondanti del solito. Ottima la cucina e buona la cantina con un ottimo rapporto qualità/prezzo. Buona scelta nel menù e presenza cordiale e professionale di personale giovane e volenteroso.
https://www.yelp.it/biz/a-picciridda-torino; Potete degustare ottimo pesce e anche le pizze sono buone. Pizza molto buona e ottimi piatti a base di pesce. Ottimi i vini ma anche le birre Collesi non facili da trovare altrove.
https://www.yelp.it/biz/a-vucciria-torino; La pizza era buona, e anche i cannoli siciliani fatti da loro. Le pizze erano buone, niente di eccezionale ma - in generale - niente da dire. Personale simpatico e premuroso Locale carino e adatto ad ogni evento..
https://www.yelp.it/biz/a6-sciamadda-torino; Puoi mangiare bene Ottimi antipasti Sublime il pesce. Il rapporto qualità/prezzo è decisamente oltre la media!!! Assolutamente da consigliare per la bontà e l'ottimo rapporto prezzo/qualità
https://www.yelp.it/biz/adonis-torino; Ampia scelta di crepes, gustose anche per i vegetariani. Piatti ben curati che si accompagnano ad un'ampia scelta di vini e prosecchi. Prezzi nella media, servizio veloce e camerieri molto gentili.
https://www.yelp.it/biz/ai-2-ghiottoni-bari-2; Scelta di vini con un buon rapporto qualità/prezzo. Altissima qualità dei prodotti presentati con maestria dallo cheff. Pesce fresco....il top....antipasti ottimi e un Primo superlativo....tutto molto buono da ritornare.
https://www.yelp.it/biz/ai-4-assi-di-sanna-roberto-torino; Pizza ordinata uguale cena riuscita perfettamente in buona compagnia e con ottima pizza!!! Pizze buone(pizza quella sottile) e condite bene, farinata squisita e servizio cordiale. Pizza buonissima ma la farinata è speciale !
https://www.yelp.it/biz/al-111-bari-2; Ampia scelta fi pietanze, primi, pesce ,pizze.Ampia scelta di vini.Ottimo rapporto qualità/prezzo. Qualità dei prodotti indiscutibile e servizio impeccabili. Particolarmente buone le pizze, cotte al punto giusto.
https://www.yelp.it/biz/al-cacimperio-torino; Ampia scelta di vini, soprattutto del territorio. Ampia scelta di vini e di altissima qualita. Buona scelta di antipasti e primi , nella media.
https://www.yelp.it/biz/al-cantuccio-bari; La pizza è buona e gli antipasti molto caserecci. Cibo buono ed abbondante e pizza molto buona. ideale x una piacevole serata ottima pizza e antipasti abbondanti sia caldi che freddi, sicuramente da provare
https://www.yelp.it/biz/al-garamond-torino; Carta dei vini ampia e prezzo adeguato. Dalle pietanza al servizio è stato tutto impeccabile. Il servizio è impeccabile, i piatti gustosi e le porzioni giuste.
https://www.yelp.it/biz/al-gatto-nero-torino; Cena ottima di livello assoluto, nessuna sbavatura in nessun piatto (dagli antipasti al dessert) e buona lista dei vini. Ottima qualità del cibo, ampia scelta dal pesce alla carne. La qualità dei prodotti e la loro preparazione è fuori discussione: eccellente.
https://www.yelp.it/biz/al-grassi-torino-2; Ampia anche la scelta di pesce come portata principale. La varietà del menù è ampia e la scelta è molto interessante. Considerando la qualità e l'ampia scelta di ingredienti freschi, questo potrebbe non essere un ristorante economico.
https://www.yelp.it/biz/al-paradise-palese; Cibo di buona qualità, comprese le pizze. Il cibo è ottimo , fresco e gustoso. Buona la qualità degli antipasti e dei secondi piatti.
https://www.yelp.it/biz/al-pescatore-bari; Buona cucina con prodotti tradizionali e ampia scelta di pesce fresco. L'offerta di antipasti e primi di pesce super! Qualità sempre al top, gli antipasti sono deliziosi e particolari.
https://www.yelp.it/biz/al-raffaello-bari; Buona la frittura di pesce ed ottimi i dessert. Il rapporto qualità/prezzo e sbilanciato per la qualità. Buoni i secondi con frittura di pesce e grigliata di carne.
https://www.yelp.it/biz/al-sorso-preferito-bari; Ottimi antipasti, in particolare le verdure fritte. Ottimi tutti gli antipasti, crudi e cotti. Nel complesso buona la qualità degli antipasti e dei primi.
https://www.yelp.it/biz/al-tegamino-moncalieri; Impasto alto non troppo gustoso ingredienti di farcitura di buona qualità. La pizza buona, ma comunque nella media. La pizza è così buona ed originale...
https://www.yelp.it/biz/ala-torino; Personale cordiale verdure fritte molto buone ed anche il cinghiale sicuramente da provare. Il menu offre una scelta abbastanza ampia tra piatti semplici e gustosi, anche di pesce. Cucina semplice ma buona e prezzi super competitivi.
https://www.yelp.it/biz/alberosole-bari; Porzioni un po' piccole in funzione del prezzo ma ribadisco di ottima qualità. Servizio impeccabile e atmosfera tranquilla, nel centro storico di Bari. Locale molto carino con personale davvero gentile.
https://www.yelp.it/biz/alberto-marchetti-torino; Ottimo ambiente e ampia scelta di gusti. Personale molto cortese e gelato squisito, varietà abbastanza ampia di gusti, alcuni abbastanza particolari. Gelato ottimo e grande gentilezza dei ragazzi/ragazze che sono a confezionare i coni.
https://www.yelp.it/biz/alberto-marchetti-torino-2; Ottimo ambiente e ampia scelta di gusti. Personale molto cortese e gelato squisito, varietà abbastanza ampia di gusti, alcuni abbastanza particolari. Gelato ottimo e grande gentilezza dei ragazzi/ragazze che sono a confezionare i coni.
https://www.yelp.it/biz/alcool-torino-2; Personale cordiale e gentile, cocktail ottimi e prezzi altrettanto.
https://www.yelp.it/biz/aldente-torino; Prezzi nella media, porzioni abbondanti e tutto davvero squisito!! Carta dei vini non particolarmente ampia ma ben bilanciata. La cena è stata ottima, vitello tonnato buonissimo, primi ben cotti, brasato morbidissimo!
https://www.yelp.it/biz/alivella-torino; Pizza ottima...tipico impasto napoletano con cornicione alto e gommoso. Cucina partenopea di ottima qualita sia pizze che ristorante, porzioni abbondanti. Il menu offre in ampia scelta di pizze e focacce ma anche di primi, secondi e dessert!
https://www.yelp.it/biz/alla-lettera-torino; La pizza e gli antipasti sono davvero buoni. Pizza ottima e servizio cortese e veloce. Prezzi nella media, pizza sotto la media.
https://www.yelp.it/biz/alla-portata-torino; Vasta scelta della carta per antipasti, primi e pizza. anche la pizza è buonissima insomma non potete non provare questo ristorante! I prezzi sono nella media ma come rapporto qualità/prezzo non ce n'è per nessuno!
https://www.yelp.it/biz/america-graffiti-torino; Ampia scelta di birre e di stuzzichini. Menù con ampia scelta, anzi tante cose sfiziose e non sai cosa prendere. La sala è molto ampia ed offre un servizio rapido, i piatti sono ben preparati e gradevoli.
https://www.yelp.it/biz/amici-miei-torino; Ottima frittura di pesce è buonissima pizza. Ottimi gli antipasti e le pizze naloletane. Ingredienti di buona qualità, impasto soffice .
https://www.yelp.it/biz/anema-e-cozze-torino; La pizza è buona, con bordi alti e un condimento saporito. Pizza buona ma non sensazionale, come ce ne sono tante a Torino. La scelta delle pizze è piuttosto limitata e sono anche più care della media.
https://www.yelp.it/biz/angolo-del-parin-torino; Cena ottima, tutti soddisfatti, tutti in ufficio il mattino successivo. Cucina ottima e super tipica, dagli antipasti ai secondi di carne davvero buonissimi. Il conto assolutamente equilibrato per la qualità e la bontà dei piatti, il personale é gentile e disponibile.
https://www.yelp.it/biz/antica-salumeria-torino; Taglieri abbondanti e buona qualità dei prodotti. Staff molto gentile ma rapporto qualità/prezzo sproporzionato. Consigliato a chi vuole mangiare qualcosa di diverso dalla solita pizza o come alternativa all'apericena.
https://www.yelp.it/biz/antica-trattoria-del-sole-torino; Ottima scelta dei piatti: sempre ottimamente cucinati e presentati. Locale curato e accogliente, pesce ottimo con cucciolo na originale e volta ad esaltarne il gusto. Comunque valido per chi vuole mangiare pesce di buona qualità.
https://www.yelp.it/biz/antichi-sapori-torre-a-mare; Menù fisso antipasti discreti ottimi primi Nel contesto discreta cena rapporto qualità prezzo Personale molto disponibile Soddisfatto Due secondi: gamberi al ghiaccio e frittura di pesce. Personale gentile e premuroso... ottima frittura di mare grigliata di mare e i primi
https://www.yelp.it/biz/antico-balon-torino; Dagli antipasti ai primi alla pizza, tutto ottimo. La pizza molto buona, prodotti freschi e di ottima qualità. La qualità dei prodotti è ottima .
https://www.yelp.it/biz/antonelli-torino; Ottimo posto cn vista sul po.....vasta scelta di piatti e birre.......compresa la super tennent s alla spina .... La location è splendida e il personale è sempre molto cortese. Il servizio é molto accurato e i camerieri sono ragazzi sorridenti ed educati.
https://www.yelp.it/biz/arcadia-torino-4; Antipasti: battuta di buona qualità accompagnata (perchè?) Ottima location e buona qualità anche se le porzioni sono un po' scarsine. Locale sempre carino in centro a Torino.Quando si hanno ospiti o una cena di lavoro e' un'ottima soluzione.Servizio efficente.
https://www.yelp.it/biz/arigato-torino; Tutto il cibo ottimo e porzioni abbondanti. La scelta è ampia, i piatti sono buoni, il prezzo è buono. Ottimo.. sushi buonissimo.. tutto fresco porzioni abbondanti molto pulito e personale gentilissimo.. consigliatissimo!!
https://www.yelp.it/biz/artinfood-torino; Cena ottima, portate abbondanti, pane e focaccia buonissimi. La qualità della materie prime é ottima e le porzioni abbondanti. Locale carino, personale gentile, ma cibo mediocre.
https://www.yelp.it/biz/astoria-torino; Il locale è molto carino, stile berlinese. Le bevute al bar sono molto buone ed hanno prezzi nella media dei locali di quel tipo. In generale è un posto accogliente, interessante.
https://www.yelp.it/biz/augusto-torino; Pizza e cucina buoni,porzioni giuste prezzi onesti. che dire...la pizza più buona di Torino. Pizza buona locale luminoso in centro .
https://www.yelp.it/biz/b-eat-torino; La carne è ottima e il rapporto qualità/prezzo pure. Ampia scelta di hamburger, sfiziosi starters, tacos, preparati con carne d'angus. Il rapporto qualità prezzo è eccellente e i prodotti utilizzati si sente che sono di qualità.
https://www.yelp.it/biz/b2-burger-and-beer-torino; Vasta scelta di birre artigianali e servizio sempre al top!! Il menù presenta una vasta scelta di birre artigianali e di panini. Locale piccolino..hamburger buoni così come i nachos..buona scelta di birre.buon rapporto qualità prezzo
https://www.yelp.it/biz/baccanale-torino; Subito sono arrivati degli ottimi antipasti: salumi,burrata,mozzarelline, polpette stupende. Antipasti: buoni affettati e mozzarelle e gli antipasti caldi anche se le melanzane alla parmigiana avevano navigavano nell'olio. Qualità eccellente nelle materie prime, porzioni abbondanti e piatti tradizionali, gustosi e cucinati benissimo...
https://www.yelp.it/biz/bacco-bari; Per chi non gradisce il crudo invece c'è ampia scelta di antipasti cotti. Cantina di vini ottima e di ampia scelta. Ottimi gli antipasti e altrettanto i primi piatti.
https://www.yelp.it/biz/banco-di-sicilia-torino; Ampia scelta di piatti di pesce dagli antipasti alle altre portate. La cucina é ottima e a chi piace dall'impasto spesso, la pizza è molto buona. Le porzioni sono generose e il servizio rapido.
https://www.yelp.it/biz/banco-vini-e-alimenti-torino; Considerando la qualità dei prodotti prezzo adeguato. Ampia scelta di vini sia in mescita sia in bottiglia. Enorme scelta di vini a ricarichi giusti, e birre artigianali, anche a spina.
https://www.yelp.it/biz/bangla-takeaway-torino; Più che consigliato per chi vuole mangiare vera cucina indiana di altissima qualità!
https://www.yelp.it/biz/bar-del-duomo-torino; Buone porzioni e buon rapporto qualità prezzo. Buona scelta tra antipasti..primi e secondi..ovviamente i piatti sono tutti di cucina piemontese. Cucina sana e casalinga con ampia scelta (panini, piadine, insalate, piatti freddi e caldi...)
https://www.yelp.it/biz/bar-delle-scienze-torino; Il locale é piccolo ma accogliente ed il personale giovane. Poi c'è una bella varietà di primi e secondi e piatti freddi. Locale non enorme ma funzionale e con dei prezzi nella media nonostante la posizione importante.
https://www.yelp.it/biz/bar-telebari-bari; C'è una vasta scelta al bancone ed è sempre un piacere tornarci Vasta scelta nei gusti e location strategica per raggiungere facilmente il centro. Prezzi nella media e panna montata inclusa.
https://www.yelp.it/biz/barbagia-di-ollolai-torino; Soprattutto il cibo era ottimo, in particolare i culurgiones. Il rapporto qualità prezzo è eccellente e l'accoglienza del proprietario è veramente unica. Il vino è buono e i prezzi sono contenuti.
https://www.yelp.it/biz/barcollo-torino; Ampia scelta di cocktail a prezzi contenuti (sui 4 euro e 50). I cocktail sono buoni e c'è una grande varietà di shots.
https://www.yelp.it/biz/bari-napoli-bari; Buonissima pizza e ottima qualità del cibo! La pizza buona ma nient'altro da aggiungere. Posto accogliente è carino,personale altamente qualificato,prodotti di prima scelta e qualità della pizza troppo,da ritornarci
https://www.yelp.it/biz/barnum-torino; Il menù offre ottimi antipasti (abbondanti) e buone pietanze. ristorante molto tipico. ottimi gli antipasti soprattutto gli insaccati e la salsiccia di Bra! Qualità dei prodotti medio alti, location ideale per gruppi numerosi purché abbiate prenotato in tempo.
https://www.yelp.it/biz/bastimento-torino; Piatti ben riusciti e di ottima qualità con prezzi però leggermente cari per le porzioni. La qualità della materia prima non si discute ma rapporto qualità/prezzo è troppo sbilanciato a favore del secondo. Frittura di calamaretti spillo eccellente baccalà preparato veramente bene Carta dei vini ben fatta, e ragazze ai tavoli servizievoli.
https://www.yelp.it/biz/bbq-di-pennestri-davide-antonio-c-torino; Il locale è carino ma nulla di che.
https://www.yelp.it/biz/beaubar-torino; bar discreto nell'arredo ma con ampia scelta (panini, hamburger, piade). qualità prodotti buona, prezzi anche. comodissimo per museo cinema Un bellissimo ambiente con molta varietà di scelta e un ottimo rapporto qualità/prezzo, panini ottimi, personale accogliente. Personale simpatico e disponibile e ottima qualità del cibo e del servizio.
https://www.yelp.it/biz/bene-cos%C3%AC-torino; Ottima la scelta della musica in sottofondo, e il volume era perfetto per riuscire a chiacchierare.
https://www.yelp.it/biz/berbel-torino; Il prezzo è adeguato alla qualità dei prodotti. La cena è stata ottima, raffinata, servita da personale estremamente professionale. Buona carta dei vini, e assai graditi e deliziosi i dessert.
https://www.yelp.it/biz/biancofarina-bari; Sia gli antipasti che le pizze sono buoni! Basta scelta di piatti e pizza ottima. Ottimi anche gli antipasti e i secondi.
https://www.yelp.it/biz/biancofiore-bari; Prezzi nella media per la qualità e tipologia di prodotti offerti. Bella la carta dei vini che offre ottimi prodotti della vinificazione pugliese Cucina ottima e di gusto , tutto buono , antipasti ,primi , secondi ecc. ecc . .
https://www.yelp.it/biz/biberon-torino; Ampia scelta di rum da tutto il mondo, selezione di birre e distillati. Qualità prezzo superlativo per la zona !!! Ottimo punto per bere troppo piccolino ma con una vasta scelta di rum e alcolici con costi contenuti.
https://www.yelp.it/biz/bicyclette-torino; Le crepes sono molto buone e la scelta è davvero ampia! Il personale è gentile e disponibile e c'è un'ottima scelta di birre. Lo staff è molto cordiale e amichevole e le birre bi buona qualità.
https://www.yelp.it/biz/birreria-don-giovanni-torino; Ampia la scelta delle birre e molto socievoli i proprietari Una buona scelta di birre, patatine fritte buonissime in porzioni abbondanti e personale gentile e allegro. Cibo buono e vario e buona scelta di birre.
https://www.yelp.it/biz/birreria-la-divina-commedia-torino; Le pizze sono molto buone: l'impasto è leggero e le farciture freschissime, pizza ottima. Le pizze erano buone anche le birre alla spina erano buone. Locale ampio ed accogliente,antipasti molto buoni (soprattutto i fritti) cosi' come la pizza.
https://www.yelp.it/biz/birrificio-torino-torino; Buona scelta di birre davvero buone . Ottime le birre e buona la scelta. Ottima scelta di birre anche se non sempre tutte disponibili.
https://www.yelp.it/biz/bistrot-turin-torino; Ampia scelta di vini, prodotti tipici della regione, personale cordialissimo. Ampia la scelta dei vini Spazi davvero angusti ma personale molto cortese Rapporto qualità/prezzo varia dai piatti che si ordinano ma comunque sufficente soprattutto per la posizione centralissima.
https://www.yelp.it/biz/black-angus-turin; L'Angus su pietra di ottima qualità, ben preparato. Il titolare è molto cortese e la cucina ottima ed al giusto prezzo. Carne buona e posto accogliente ma i prezzi sono un pó alti.
https://www.yelp.it/biz/black-e-white-bari; Cibo: prodotti del territorio di ottima qualità interpretati con personalità dallo chef. Ottima qualità del cibo, piatti molto ricercati, si va da piatti tradizionali a vere e proprie sperimentazioni. Locale luminosissimo e arredato con gusto moderno, servizio al tavolo cordiale e gentile.
https://www.yelp.it/biz/black-jack-torino; La pizza è davvero buona: l'impasto è ottimo, la vasta scelta di ingredienti a disposizione di qualità. Volete sapere come nonostante l'imbarazzo della scelta e la bontà della vostra pizza state perdendo clienti senza rendervene conto?? Pizza ottima qualità prezzo eccellente Bisognerebbe solo rinnovare il locale ma per il resto ottima.
https://www.yelp.it/biz/blah-blah-torino; Locale molto carino, personale gentile e cordiale. Ottimi primi e secondi, peccato che la scelta sia piuttosto scarsa. Menù variegato a pranzo e ottimo rapporto qualità-prezzo.
https://www.yelp.it/biz/blue-eyes-bari; Porzioni abbandonati e cibi di buona qualità. Portate molto abbondanti a prezzi davvero contenuti e con qualità dei prodotti nella media. La frittura di pesce troppo buona è veramente abbondante va bene per 2 persone.
https://www.yelp.it/biz/bocciofila-cavorettese-torino; C'era un'ampia scelta di primi e secondi. Ottimi gli antipasti, primi mai provati, secondi molto buoni. Pessimo il rapporto qualità/prezzo, ma ancora peggio il servizio e il personale.
https://www.yelp.it/biz/bocciofila-mossetto-torino; Il personale è gentilissimo e cordiale e il cuoco ci sa fare con piatti tipici o rivisitati.
https://www.yelp.it/biz/boheme-torino; Rapporto qualità/prezzo un po' sopra la media. Gin tonic con scelta ampia del gin da parte del preparatissimo barman. Ambiente molto carino, caldo e accogliente, personale cortese.
https://www.yelp.it/biz/boja-fauss-torino-2; In conclusione: cibo di buona qualità, ampia scelta nel menù, prezzi medi. Tra prodotti handmade e materie prime selezionate, troverete un menù accattivante e flessibile. Gli antipasti ( vitello tonnato e tris ) erano molto buoni con materie prime di ottima qualità.
https://www.yelp.it/biz/bollicine-di-gigliotti-e-de-bartolo-torino; I prezzi sono nella media e la pizza è buona. La pizza è sempre ottima, ben cotta e ben condita. Pizza davvero ottima, è molto buona anche la farinata farcita con nduja e gorgonzola...una bomba di gusto!!!!!
https://www.yelp.it/biz/borgo-antico-bari; Ottima la pizza è buonissimo gli antipasti! Dunque pizza e rapporto qualità prezzo pessimo. Pizza davvero buona, e per finire sorbetto fresco, e amaretto.
https://www.yelp.it/biz/borgo-dora-torino; Le porzioni sono abbondanti e di ottima qualità. Il servizio è molto cordiale e rapido.
https://www.yelp.it/biz/botta-bari; Eccellente la pizza ed ottimi gli antipasti. Ampia scelta di antipasti di qualità e pizza a dir poco SUBLIME. Ottima pizza....impasto molto digeribile, ambiente semplice ed accogliente!
https://www.yelp.it/biz/bottega-baretti-moncalieri; Pizza davvero buona, impasto e condimento eccezionali. Pizza buonissima sia quella con impasto tradizionale che integrale . Cibo di qualità con porzioni nella norma.
https://www.yelp.it/biz/braceria-signorile-bari; Ottimi anche gli antipasti ed i contorni. Grande varietà di bombette e zampina molto molto buona. luogo accogliente personale specializzato un rapporto prezzo-qualita' ottimo una serata all'insegna di buon mangiare
https://www.yelp.it/biz/brasserie-bordeaux-torino-2; Ottima carta dei vini e ottima l'idea di accompagnare la cena con vari tipi di pane! Cenetta in ottima compagnia con un vino rosso perfetto della casa e una scelta ampia di piatti. Da tornarci ogni volta che si vuole mangiare qualcosa di buono e particolare!
https://www.yelp.it/biz/brasserie-bordeaux-torino-3; Ottima carta dei vini e ottima l'idea di accompagnare la cena con vari tipi di pane! Cenetta in ottima compagnia con un vino rosso perfetto della casa e una scelta ampia di piatti. Da tornarci ogni volta che si vuole mangiare qualcosa di buono e particolare!
https://www.yelp.it/biz/brek-torino; Buon rapporto qualità/prezzo e piatti abbondanti e gustosi. Self service con ampia scelta di piatti..dai primi alla pizza..locale un po angusto..personale molto gentile..pasto normale e prezzi regolari. Ampia scelta di insalate preparate di continuo con la possibilità di 'personalizzazioni anche fantasiose.
https://www.yelp.it/biz/briss-torino; Eccezionali le materie prime e gli abbinamenti, tutto molto gustoso e ben presentato! Buona la carta dei vini completa ovviamente basata sui bianchi fermi e bollicine. Servizio impeccabile, professionalità, gentilezza e simpatia: molto difficile trovare le tre qualità insieme.
https://www.yelp.it/biz/bruschetteria-pautasso-di-stecco-susanna-torino; ottima cena e personale gentilissimo, ci ritornerei sicuramente!! Buona la qualità del cibo, porzioni generose e personale cortese. Menu davvero tipico e scelta ampia, qualità eccellente e servizio ottimo
https://www.yelp.it/biz/bucks-g-d-34-torino-2; Ottime birre con prezzi nella media (3/5€) Peccato perche il locale è abbastanza carino. Il cibo è servito anche, ma americano, come hamburger ecc.
https://www.yelp.it/biz/buosi-torino; Da ritornare .. ottimo qualità/ prezzo e personale cortese e gentile! La cucina ottima e i vini presentati in maniera eccelsa direttamente della proprietà. Scelta di vini di qualità Assolutamente consigliato
https://www.yelp.it/biz/burgheria-torino; Lodevole la possibilità di personalizzare il proprio panino e ampia la scelta delle bevande. Locale carino ma se siete freddolosi, in inverno, non sedetevi vicino alla vetrata. Il personale è cortese, peccato per i tempi di attesa un po' troppo lunghi.
https://www.yelp.it/biz/burgheria-torino-2; Dispongono anche di un'ottima scelta di birre. I prezzi ampiamente nella media con rapporto qualità/prezzo decisamente buono. Ottima scelta di birre e servizio veramente gentile e curato!
https://www.yelp.it/biz/cacio-e-pepe-torino; Le pizze sono molto buone, gustose, ben cotte. Pizza molto buona , personale cortese e disponibile . La pizza è decisamente buona così come il servizio.
https://www.yelp.it/biz/cafe-alberto-torino; Il cibo è tipico piemontese con personale molto cordiale e disponibile.
https://www.yelp.it/biz/cafe-vergnano-1882-torino; Locale gradevole e ordinato, cameriere gentile e simpatico. Servizio cortese prezzi adeguati alla qualità . Il personale è cortese, posto pulito,moderno, un po' caro( un caffè 2,50 euro, una sacher mono porzione 5 euro)
https://www.yelp.it/biz/caff%C3%A8-torino-torino-2; Servizio curato dal personale cortese, mai invadente e sempre premuroso.Nessun cameriere di secondo lavoro. Il servizio era rapido ma piuttosto freddo.
https://www.yelp.it/biz/camilla-kitchen-torino; Carta dei vini ampia e personale gentile. Materie prime di alta qualità e porzioni generose. Cena a base di pesce di ottima qualità, cucinato con sapienza ed originalità.
https://www.yelp.it/biz/cammaf%C3%A0-torino-4; Consigliato se volete provare/mangiare un ottima pizza! Anche il locale è carino rinnovato da poco
https://www.yelp.it/biz/cantine-risso-torino; Buon rapporto qualità/prezzo.Se siete a Torino non perdetelo! Ampia la scelta dei vini serviti in calice. Materie prime buone, ragazzi del servizio cortesi veloci e FANTATICI DESSERT fatti da loro con una ampia scelta.
https://www.yelp.it/biz/casa-del-barolo-torino-3; Cena ottima, piatti presentati benissimo e...un pane eccezionale! Ottimi gli antipasti di pesce ed alcuni primi. Ottimo per una cena di coppia o in compagnia!
