url;review
https://www.yelp.it/biz/l-hamburgueria-di-eataly-torino; Tutto da innaffiare con birre e vini di qualità Servizio self e ottimi vini e birre di qualità. Le birre sono buone ed il personale cortese e veloce
https://www.yelp.it/biz/l-idrovolante-torino; Cibo ottimo, porzioni non abbondanti ma presentate splendidamente e tutto davvero azzeccato e gustoso. Il conto comprende la ..scenografia ( giustamente) e penalizza il rapporto qualità/prezzo. Menù semplice ma completo con portate davvero interessanti ed un menù degustazione con un rapporto qualità/prezzo ottimale.
https://www.yelp.it/biz/l-oca-fola-torino; Antipasti e primi molto buoni, bellissimi piatti. Il conto mostra un ottimo rapporto qualità/prezzo. Carta dei vini con ampia e ottima scelta.
https://www.yelp.it/biz/l-osteria-di-pierantonio-torino; Il rapporto qualità/prezzo è il loro punto di forza. Porzioni abbondanti e servizio molto cortese e massima disponibilità . Buon rapporto qualità prezzo, perfetto per una cena tra amici senza troppe pretese.
https://www.yelp.it/biz/l-osteria-le-ferriere-torino; Riuniti per una cena di famiglia .... pizza buonissima con materie di prima qualità. Pizza ottima, ristorante piacevole e personale cortese. La pizza buona anche se un po' piccola.
https://www.yelp.it/biz/la-badessa-torino-2; Cena con menù degustazione: porzioni abbondanti con la possibilità di assaggiare le pietanze con una visione a 360° Prezzi: antipasti e primi nella norma, in media12-13€ a portata. Per la cena di Capodanno è stato proposto un menù fisso di ottima qualità e molto vario.
https://www.yelp.it/biz/la-battigia-di-schiralli-antonio-bari; La pizza buona tipicamente barese con base sottile. Ottimi tutti gli antipasti....grande quantità e buona qualità. Antipasti vari e abbondanti sia di crudo che di cotto Buona cantina con vini di qualità pugliesi.
https://www.yelp.it/biz/la-botte-gaia-torino; Ampia scelta di vini trattandosi di enoteca. Il personale è cortese e molto preparato. Ristorante piccolo ma accogliente con un personale di eccezionale cortesia e competenza.
https://www.yelp.it/biz/la-bottega-del-gusto-torino; Ottimi gli antipasti caldi e le guanciotte. Buoni gli antipasti Carne di buona qualità. Piatti di buona qualità, porzioni sufficienti per saziarsi.
https://www.yelp.it/biz/la-bufala-torino; Locale carino ma pizza da dimenticare: biscottosa e insipida. Servizio poco cordiale e decisamente non professionale.
https://www.yelp.it/biz/la-cabane-torino-2; Buono il servizio ed il rapporto qualità/prezzo abbastanza proporzionato. Ampia scelta nella carta dei vini e, in particolare, interessanti le etichette di champagne. Specializzato in cruditè è una buona scelta di champagne.
https://www.yelp.it/biz/la-campana-torino-2; Un buon rapporto qualità/prezzo per il pranzo proposto. La cucina è stata abbastanza buona anche se lontana da quella pugliese e il personale cordiale e disponibile. Rapporto qualità prezzo abbastanza alto anche senza coupon. 5 stelle di incoraggiamento, dato il punteggio non brillante finora!
https://www.yelp.it/biz/la-cantina-torino; Piatti buoni e abbondanti con un rapporto qualità/prezzo veramente soddisfacente! Cena ottima: buonissimo rapporto qualità prezzo, cortesia del ristoratore ed ottima atmosfera! Un piccolo locale con un'ampia scelta di vini per tutti i palati.
https://www.yelp.it/biz/la-cantinella-torino; Pizza buonissima e anche gli antipasti sono ottimi. Diverse cantine di vini con ampia scelta. Riccitour lo consiglia per l'ottimo rapporto quantità/qualità/prezzo/servizio/location.
https://www.yelp.it/biz/la-capannina-torino-2; Ampia scelta fra primi secondi e anche Pizza o focaccia! Pizza ottima sia con l'impasto normale sia con l'impasto integrale. Accoglienza buona la pizza ottima nell'impasto, digeribile, Napoletano, buoni gli ingredienti.
https://www.yelp.it/biz/la-casa-del-demone-torino; Buona la scelta di birre alla spina. Qualità prezzo molto buona e porzioni abbondanti! Ottimo rapporto qualità prezzo anche nella generosità delle porzioni.
https://www.yelp.it/biz/la-cecchina-bari; Antipasti e primi ottimi è molto ben presentati. Ottimi antipasti tipici e primi di pesce molto ricchi. Servizio rapido e cordiale, prezzo davvero onesto, forse porzioni un po' gourmet ma in ogni caso un'ottima esperienza!
https://www.yelp.it/biz/la-cena-coi-fiocchi-torino; Ottimi gli antipasti tra cui una eccellente caponata. Nel complesso ottimo servizio e buon rapporto qualità/prezzo. Il cibo è ottimo e c'è ampia scelta di vivande.
https://www.yelp.it/biz/la-conca-torino-2; Prezzi onesti e ampia possibilità di scelta. Cucina ottima, ampia varietà e cibi sempre freschi. Buona accoglienza in ambiente sufficientemente ampio da permettere una cena tranquilla.
https://www.yelp.it/biz/la-cuite-torino; Carta dei vini ampia per soddisfare tutti i gusti. Locale molto carino in una zona caratteristica del centro storico di torino. Buona la carta dei vini, più sui francesi che sugli italiani.
https://www.yelp.it/biz/la-drogheria-torino; Ampia scelta per ciò che riguarda il bere, cocktail sfiziosi! Locale molto carino, apericena con prodotti particolari e vari ma con poco rimpiazzo. Assolutamente da provarci ...i loro cocktail sono davvero buoni e di vasta scelta ...
https://www.yelp.it/biz/la-fila-torino; Buona la pizza e ottimi gli agnolotti. Ottimo l'impasto e di buona qualità gli ingredienti. La pizza buona perché non rimane pesante ma nulla di straordinario.
https://www.yelp.it/biz/la-gaia-scienza-torino; Antipasti buoni, ma i primi davvero ottimi. tra l'altro il rapporto qualità/prezzo è davvero eccellente! Qualità dei prodotti ottima, vino della casa molto buono.
https://www.yelp.it/biz/la-galina-scannata-torino; E un non meno importante ottimo rapporto qualità/prezzo.. Personale molto cortese, il ché predispone bene alla cena. Ottima qualità dei prodotti (il pesce è quello di Gallina).
https://www.yelp.it/biz/la-granseola-torino; A cena la scelta è più ampia. Anche i primi ed i secondi sono di ottima qualità. Ottimo per il pesce ed ottimo rapporto qualità-prezzo.
https://www.yelp.it/biz/la-gricia-torino; Seduti al tavolo alle 20 finito cena ( antipasti e primi ) alle 23.45. andare a torino e sentirsi a trastevere....cucina ottima e porzioni abbondanti...posto piccolo,prenotate.... Il locale è ben curato e il servizio è buono.
https://www.yelp.it/biz/la-gustosa-torino; Buone pizze con scelta ampia e buona anche la farinata. Locale carino e pulito.....buona la pizza , impasto gradevole e croccante. Ottima la pizza, con un'ampia scelta dal menù, ben cotta e croccante.
https://www.yelp.it/biz/la-limonaia-torino; Inoltre hanno anche un ottimo rapporto qualità/prezzo. Piatti veramente eccellenti e rapporto qualità/prezzo molto buono. La carta dei vini è ampia ed interessante.
https://www.yelp.it/biz/la-locanda-bari; Una continua conferma della professionalità del personale e un eccellente qualità dei prodotti. Locale molto carino, personale molto cordiale e sopratutto buonissimo il tutto, pesce fresco e prodotti veramente ricercati. Posto accogliente ...personale molto gentile e carine...piatti molto buoni antipasti con i sapori della Puglia ..tutto molto buono
https://www.yelp.it/biz/la-locanda-del-bollito-torino; La carta dei vini essenziale fa da giusta compagnia al menù stampato su semplici fogli A4. Menù gran bollito 21€ rappresenta un ottimo rapporto qualità prezzo. L'ambiente è semplice e non particolarmente curato ma il cibo è ottimo ed il servizio attento.
https://www.yelp.it/biz/la-luna-rossa-torino; La scelta delle pizze è molto ampia, disposti anche a varianti. Buona la pizza e buon rapporto qualità/prezzo Pizza davvero ottima sembrava di essere a Napoli!
https://www.yelp.it/biz/la-madia-torino; Il cibo era ottimo e le porzioni giuste! La carta dei vini non è molto ampia ma sicuramente non scarna. Prezzi alti con buon cibo servito in maniera elegante ma in porzioni da degustazione.
https://www.yelp.it/biz/la-magnolia-torino-3; Pizza favolosa soprattutto per l'impasto (mai assaggiata una pizza così buona)! Antipasti e pizza ottimi e conto nella media. La pizza è buona, niente da dire.
https://www.yelp.it/biz/la-monachella-torino; Ampia varietà di scelta...le birre sono di qualità e i prezzi onesti. Sia gli antipasti che i primi che le pizze sono molto buoni. Pizza ottima e servizio efficiente e disponibile.
https://www.yelp.it/biz/la-pace-torino; I primi e secondi nella norma come anche il costo complessivo della cena. L'ambiente è semplice e pulito, antipasto a self service molto ricco, altri antipasti disponibili. Il menù a 25 euro ha un rapporto qualità prezzo molto valido e le porzioni sono incredibili ..
https://www.yelp.it/biz/la-pagoda-di-hu-lia-meng-torino; Il ristorante ha un buon rapporto qualità/prezzo. L'offerta del menù è infatti molto ampia. Il personale è sempre gentilissimo,disponibile e gentile.
https://www.yelp.it/biz/la-panzanella-torino; Pizze davvero buone, sia come impasto che come ingredienti. Nonostante ciò la pizza era davvero buona! La pizza è abbastanza napoletana con ingredienti di buona qualità.
https://www.yelp.it/biz/la-parrilla-de-juan-bari; Ampia scelta di piatti e birre, bella musica, titolare simpatico e personale gentile. Ci sono piatti tipici e pietanze particolari ma con un 'ampia scelta. Locale molto carino in centro con una buona scelta di birre e cocktail.
https://www.yelp.it/biz/la-piadineria-torino; Inoltre il rapporto qualità/prezzo ormai è sfavorevole. Prodotti di ottima qualità serviti in tempi molto veloci. Ottima sia per qualità che per i prodotti utilizzati.
https://www.yelp.it/biz/la-pignata-bari; Cena ottima e sorbetto al mandarino sublime!! Scelta ampia e gustosa, originale e sapientemente interpretata. Ottimi gli antipasti da segnalare la freschezza dei prodotti utilizzati: pesce, verdure e mele cotogne etc.
https://www.yelp.it/biz/la-piramide-torino; La pizza è buonissima (con mozzarella che sa di mozzarella, non di gomma!!) I gelati son mediamente buoni...Le pizze al trancio buone ma meglio il calzone... La pizza ottima, soffice,in particolare si percepisce la freschezza degli ingredienti di prima qualità.
https://www.yelp.it/biz/la-porta-rossa-torino; Menù essenzialmente di pesce con un ampia scelta. Giuste le porzioni e il rapporto qualità prezzo. Locale carino e tranquillo e cena a base di pesce davvero ottima!
https://www.yelp.it/biz/la-prima-da-moreno-torino; Materie prime eccellenti, cucina raffinata, servizio impeccabile.
https://www.yelp.it/biz/la-provolina-bari; Per 4 pizze e 2 birre il conto è 45€. La pizza è buonissima , super sottile. Impasto decente e ingredienti di buona qualità.
https://www.yelp.it/biz/la-reseda-torino; La pizza è buona, impasto soffice e leggero al palato. Pizza buona e con molta scelta anche di impasti. scoperto tramite TA locale carino e pizza (integrale) molto buona.
https://www.yelp.it/biz/la-ristonomia-torino; Non molto ampia la scelta delle pietanze. Cena squisita e ottimo il rapporto qualità prezzo. Buon rapporto qualità prezzo, considerando la location e la qualità dei prodotti.
https://www.yelp.it/biz/la-romana-torino; Personale cortese e rapido nel servizio, preparati sui prodotti da vendere in negozio (non è una cosa scontata). Qualità fantasia e materie prime di base bio al top Servizio celere e èempre aperto Bravi ! Ottimo in rapporto al prezzo... tutti da scoprire i gusti particolari!
https://www.yelp.it/biz/la-stadera-pizzeria-la-stadera-di-muscariello-s-e-c-pizz-torino; Pizza molto buona, ben cotta e con prodotti di qualità. Le pizze sono buonissime, con impasto napoletano e ingredienti di qualità. La pizza era buona ma non entusiasmante.
https://www.yelp.it/biz/la-svolta-torino; Pizzeria con ampia scelta, anche di pizze particolari. Cena a sorpresa in un locale molto carino. Ottima pizza (la svolta) e anche il servizio.
https://www.yelp.it/biz/la-tana-del-polpo-bari; Il cibo è di qualità con abbondanti porzioni... Ottimo il primo è buona la frittura di pesce.Personale cordiale e simpatico, soprattutto la ragazza di origini albanesi. Ottima qualità degli ingredienti, piatti ben presentati, gentilezza del personale e conto più che onesto.
https://www.yelp.it/biz/la-taverna-dei-mercanti-turin; Dolci molto buoni e di creazione artigianale. Favolosi.. porzioni abbondanti e rapporto qualità prezzo ottimo! Tre ottimi antipasti e tre fantastici primi della cucina locale.
https://www.yelp.it/biz/la-taverna-greca-torino-2; Buona la qualità degli antipasti e della carne. Che dire: porzioni molto abbondanti e cibo ottimo. Dagli antipasti ai primi tutti piatti molto abbondanti e buoni.
https://www.yelp.it/biz/la-uascezze-bari; Antipasti buoni e vari della tradizione locale. Rapporto qualità/prezzo eccellente, servizio e location unici. Personale cordiale e professionale con spiegazione dei prodotti.
https://www.yelp.it/biz/la-vecchia-europa-torino; Ottima la pizza come impasto, ingredienti, cottura. Ampia scelta di pizze tutte molto buone. La pizza è ottima e la varietà è molto ampia.
https://www.yelp.it/biz/la-via-del-sale-torino; Porzioni veramente abbondanti e prezzi nella media. Buon ristorante in centro torino con buoni prodotti e buona scelta tra antipasti primi e secondi. Ampia scelta di piatti della tradizione piemontese, qualità eccellente.
https://www.yelp.it/biz/la-via-della-seta-torino; Le porzioni sono abbondanti e sicuramente il rapporto qualità/prezzo è qui elevato. Cibo ottimo e porzioni giuste di ottima qualità. Ottimi gli antipasti, tutti i tipi di involtini e poi la marmitta mongola che dire, favolosa.
https://www.yelp.it/biz/la-voglia-matta-torino-6; Le porzioni dei gelati sono abbondanti e la qualità prezzo ottima. A prezzi bassissimi gelati enormi e di buona qualità. I prezzi sono ottimi è c'è un eccellente rapporto qualità prezzo (anzi, la qualità è superiore al prezzo).
https://www.yelp.it/biz/laboratorio-comba-torino; Hanno un ottimo rapporto qualità prezzo e sono molto cortesi e disponibili con tutti. Dal punto di vista del rapporto qualità_prezzo, forse in Torino è una tra le più interessanti.
https://www.yelp.it/biz/le-due-antenne-bari; La pizza è buona ma non eccellente. Locale ampio, personale cordiale, grandissima abbuffata di antipasti vari caldi, freddi, carne e pesce.
https://www.yelp.it/biz/le-grand-tabu-bari; Una bella location.Il cibo molto buono anche se servito freddo.Cocktail ottimi.unica ma grande pecca,la cameriera! I piatto sono ben decorati e le pietanze di ottima qualità. Ottima la carta dei vini anche perché sono un sommelier ,-)
https://www.yelp.it/biz/le-plus-bon-bari; Pizza soddisfacente con ampia scelta ora hanno aggiunto dei tavoli . Pizza buonissima, condimenti di qualità e selezionati. Pizza ottima per qualità e quantità dei condimenti.
https://www.yelp.it/biz/le-putrelle-osteria-torino; La carta dei vini è moderatamente ampia. Buon rapporto qualità prezzo con porzioni medie. Ampia scelta di vini con etichette anche interessanti.
https://www.yelp.it/biz/le-rondini-torino; Le pizze sono tutte buone e fatte con prodotti di qualità Pizza molto buona, personale accogliente e disponibile. Pizza davvero ottima, non c'è che dire.
https://www.yelp.it/biz/le-tre-lanterne-bari; Pizza molto buona, così come i loro calamari freschi !!! Il cibo servito è stato di buona qualità, tuttavia niente di entusiasmante. Il cibo è ottimo come pure il servizio e l'ospitalità.
https://www.yelp.it/biz/le-veronique-bari-2; Buonissima pizza e grande varietà di pizze ed altro. Dolci molto buoni, dunque una cena perfetta sotto ogni punto di vista. Qualità dei prodotti sempre eccellente, ottime pizze, menu completo e variegato, servizio impeccabile.
https://www.yelp.it/biz/le-vigne-torino; Una cena deliziosa condita anche dal personale molto cordiale. Servizio cortese, attento e veloce, bella presentazione dei piatti, porzioni adeguate. cena di coppia in un ambiente famigliare con una buona scelta di piatti preparati con cura,personale gentile e disponibile,consigliabile
https://www.yelp.it/biz/le-vitel-etonne-torino; Dolci molto buoni, a partire dal bunet. Prezzi corretti per la qualità dei prodotti. Ottimi gli antipasti cosi' come i primi.
https://www.yelp.it/biz/libery-pizza-e-artigianal-beer-torino; Pizza buonissima e tante birre da assaporare. Pizza ottima (impasto stile napoletano) e prezzi onesti. Ottima pizza sia per impasto che per ingredienti.
https://www.yelp.it/biz/lo-scugnizzo-torino; La pizza era ottima, buonissimo l'impasto e il sugo. Ottima pizza, ingredienti freschi, impasto e cottura perfetti proprio come a Napoli. Pizza davvero ottima con ottime materie prime!
https://www.yelp.it/biz/lo-stonnato-torino; Molto buone le pizze al padellino, leggero anche l'impasto. Superba e abbondante la frittura di pesce. Un ottima pizza al tegamino con influenze napoletane.
https://www.yelp.it/biz/lobelix-torino; Ampia scelta al buffet e cibo di qualità. Ampia scelta di piatti nel buffet per l'apericena, cocktail da urlo.. Ampia scelta di piatti, anche se si nota subito l'uso indiscriminato e abbondante della maionese.
https://www.yelp.it/biz/locanda-da-betty-torino; Le porzioni sono giuste ed il rapporto qualità prezzo è ottimo. Cucina italiana.. si mangia bene al prezzo giusto per la qualità dei prodotti molto gentili e simpatici! Personale cordiale e ottimo livello di pulizia!
https://www.yelp.it/biz/lord-nelson-torino; Locale originale in centro a torino: pizza buona senza eccellere, la serata karaoke è divertente e il locale accogliente. Locale carino,karaoke esagerato e pessimo.al concerto di Vasco il volume era più basso!! Locale molto carino con personale molto gentile, e organizzazione della serata in maniera ottima!
https://www.yelp.it/biz/luce-e-gas-torino-2; Ampia scelta di pizze, cotte bene e buone. Offre un ampia scelta nel menù carne pesce pizza... La burrata non era freschissima ma tutto sommato le pizze erano buone, impasto gustoso.
https://www.yelp.it/biz/lucky-nugget-saloon-torino; Servizio accurato in un ristorante fashion, una cena a due e poi serata in discoteca al quasar. Tavoli ben distanziati locale carino, esperienza buona Il locale è arredato con gusto ed originalità con l'accostamento di classico e moderno ma che nell'insieme risulta armonioso.
https://www.yelp.it/biz/lunarossa-torino; La scelta delle pizze è molto ampia, disposti anche a varianti. Buona la pizza e buon rapporto qualità/prezzo Pizza davvero ottima sembrava di essere a Napoli!
https://www.yelp.it/biz/m-bun-torino; Vasta scelta di birre artigianali e prodotti biologici. Ottima la qualità e ampia la scelta dei piatti . Ampia scelta di panini e menù e il cibo è molto buoni!
https://www.yelp.it/biz/m-bun-torino-3; Ottima la qualità dei prodotti che parlano da soli. Menù vario con particolare attenzione alla qualità dei prodotti. Fast food non molto economico ma con un rapporto qualità/prezzo eccellente.
https://www.yelp.it/biz/macario-caffe-torino; Apericena super abbondante e con ampia scelta. Locale carino e piacevole grazie al dehor che condivide con altri locali attigui. Locale molto carino nel cuore del Quadrilatero.
https://www.yelp.it/biz/magorabin-torino; Prezzo assolutamente adeguato alla qualità dei prodotti e alla professionalità della brigata. Cucina raffinata, ambiente formale piatti straordinari, il ristorante ha pochi tavoli, perfetto per una cena a due . La qualità delle materie prime è eccellente e il piatto nella sua completezza risulta essere bellissimo oltre che buonissimo.
https://www.yelp.it/biz/maks-torino; Buonissimo locale centrale e pulito ...gusti favolosi e personale gentilissimo .. Non fatevi attrarre dall'ambiente carino e dai titoli altisonanti: francamente, è pessimo. I gusti non sono tradizionali ma di ottima qualità.
https://www.yelp.it/biz/maltos-beer-bari; Cibi ottimi e ampia scelta di birre! Ampia scelta di birre artigianali e alla spina. I prezzi sono nella media, ma i prodotti di buona qualità e sopratutto porzioni davvero grandi!
https://www.yelp.it/biz/mamasita-torino; Rapporto qualità/prezzo nella media dei ristoranti etnici di Torino. In ogni caso servizio cordiale e veloce,porzioni abbondanti e di qualità. Il cibo è davvero di ottima qualità, piatti cucinati bene e porzioni abbondanti.
https://www.yelp.it/biz/mamma-mia-torino-2; Ottima pizza, ingredienti freschi e di qualitá, impasto ben lievitato e digeribile. Porzioni abbondanti e buona qualità di pesce. Le pizze erano buone, impasto leggero, ingredienti freschi, purtroppo risultava un po' acquosa al centro.
https://www.yelp.it/biz/manhattan-pub-torino; Pizza buona, pasta buona, birre buone, buona musica (rock)... Cibo ottimo, porzioni giganti e prezzi bassi. Il cibo e  ottimo, e le porzioni generose.
https://www.yelp.it/biz/mar-rosso-torino-2; Le porzioni sono abbondanti e ottimo rapporto qualità prezzo. Tutto delizioso dal vino argentino fino al caffè senegalese (rapporto qualità/prezzo, ottimo!) I piatti sono ottimi e le porzioni abbondanti e il personale davvero gentilissimo.
https://www.yelp.it/biz/mara-dei-boschi-torino; Ampia scelta di gelati vegan, tra i quali l'incredibile marotto (gianduiotto vegan). Gelato di ottima qualità uno dei piu buoni di Torino. Personale giovane e gentile e materie prime di qualità!
https://www.yelp.it/biz/marechiaro-torino; Piatti particolari e pizza buona, ben lievitata Buone le pizze e anche i primi piatti. Il ristorante non so come funzioni ma la pizza è molto buona e la scelta è ampia.
https://www.yelp.it/biz/marhaba-torino; Le materie prime esposte nel frigo a vetrina testimoniano la freschezza dei piatti, tutti deliziosi (ed economici: 5-6 euro)!! Se vi capita fateci un salto prezzi contenuti e ottima qualita'! Locale piccolissimo ma veramente valido per la qualità della cucina
https://www.yelp.it/biz/martin-pescatore-torino; Dolci al cucchiaio e ottima scelta di vini . Ottimo per una cena in famiglia o un appuntamento romantico! Nell'ordine: antipasti da buoni a squisiti con qualche piccola pecca.
https://www.yelp.it/biz/martinucci-bari-2; Qualità e bontà al servizio del cliente! Ampia scelta di gusti per gelati dalle diverse 'taglie, con qualità ottima della cialda e ottima qualità del gelato. Il personale è gentilissimo. lo spettacolare bancone della pasticceria lo spettacolare bancone della pasticceria
https://www.yelp.it/biz/masaniello-%C3%A9-turnat-torino; Locale carino, tutto intitolato ad un grande della storia popolare partenopea, Masaniello!
https://www.yelp.it/biz/master-sandwich-torino; Panini davvero deliziosi con ottimo rapporto qualità/prezzo. Ampia scelta di panini per ogni palato! C'è un'ampia scelta di panini e sia i prodotti utilizzati che il pane sono veramente buoni.
https://www.yelp.it/biz/mastro-ciccio-di-mastrandrea-fabio-bari; La pizza è buona,forse un po' sottile. Prezzi contenuti e tutto buono e gustoso. Ampia scelta di panini buoni al palato e per gli occhi.
https://www.yelp.it/biz/matti-brown-bari; Ampia scelta di vini e personale cordiale! Togliti un carico e goditi il personale cordiale e le birre fredde! Rapporto qualità prezzo veramente giusto.Bravi bravi ragazzi!!!!
https://www.yelp.it/biz/mazzini-38-torino; Pizza molto buona, ottimo l' impasto e cottura. La pizza è davvero buona con pizze fresche topping, davvero magnifico! Pizza ottima, sottile, impasto saporito, ottime materie prime, per dirla tutta, una pizza non comune a tante altre.
https://www.yelp.it/biz/mc-donald-torino; Locale molto ampio, con anche dehor esterno.
https://www.yelp.it/biz/menupizza-torino; A questo punto direte almeno la pizza era buona?
https://www.yelp.it/biz/mercato-del-pesce-bari; Pesce fresco pescato ogni giorno Una volta che il pesce è finito, i pescatori chiudono la loro panchina.
https://www.yelp.it/biz/meridien-torino; Il locale è ben strutturato e ha una vasta scelta di vivande.
https://www.yelp.it/biz/messicano-mamasita-torino; Rapporto qualità/prezzo nella media dei ristoranti etnici di Torino. In ogni caso servizio cordiale e veloce,porzioni abbondanti e di qualità. Il cibo è davvero di ottima qualità, piatti cucinati bene e porzioni abbondanti.
https://www.yelp.it/biz/mexico-70-torino; Cucina ottima con un'ampia scelta di piatti cinesi e italiani,altrettanto buona anche la pizza! Buone le pizze e la cucina cinese. Vasta scelta di pizze e cibo cinese.
https://www.yelp.it/biz/mezzaluna-osteria-torino; Prodotti di ottima qualità, porzioni molto abbondanti e una sangria da sogno. Il rapporto qualità/prezzo è decisamente sopra la media. Cena molto tranquilla e rilassante con ottima musica di sottofondo e personale cortese.
https://www.yelp.it/biz/michi-tanzariello-torino; ottima pizza al tegamino dietro casa.. farinata era un po cruda..ma l'impasto era buono. Una delle pizze più buone di Torino! Una pizza buona digeribile e ricca di ingredienti.
https://www.yelp.it/biz/mina-torino; Da segnalare ottimi antipasti in porzioni abbondanti. La qualità dei prodotti utilizzati è eccellente. La carta dei vini non è molto ampia ma offre buone etichette.
https://www.yelp.it/biz/mister-hu-torino; Migliore il rapporto qualità/prezzo sulla cucina cinese. La qualità della cucina, cinese, thai o japan, è sempre stata eccelsa. Il cibo è ottimo e fresco ed il personale gentilissimo.
https://www.yelp.it/biz/mitiko-pizzeria-consegna-a-domicilio-torino; La pizza è molto buona, impasto leggero e fragrante, condimento abbondante e gustoso. la pizza è molto buona, l'impasto è piacevole, prezzi nella media. La pizza e' ottima cosi come il servizio.
https://www.yelp.it/biz/moderat-bari; Buona la carta dei vini,personale disponibile e pronto. Ammetto che il personale è cordiale, ma non salva tutto il resto. Cucina raffinata,presentazione dei piatti impeccabile, personale ineccepibile....che dire:ottimo!!!
