url;review
https://www.yelp.it/biz/%C3%A8-cucina-cesare-marretti-torino; Questo è un ottimo posto per le persone che vogliono ottimo cibo, un'ottima esperienza, e ancora, nessun menu.
https://www.yelp.it/biz/500-calorie-torino; Il locale è carino, l'idea è originale, il personale è cortese. Posto molto carino e con personale gentile. Locale piccolo ma molto gradevole, curato e le signore che lo gestiscono molto molto gentili.
https://www.yelp.it/biz/7-nani-torino; Un bel localino, tipico da pizza al padellino. Prenotazione effettuata sabato sera, perfettamente rispettata nei tempi. Poco adatto per una cena tranquilla, unico neo, il tavolo va liberato velocemente.
https://www.yelp.it/biz/a-casa-di-pulcinella-torino; Il locale è il luogo perfetto per passare una serata in famiglia ! Locale piccolo, ma molto carino e particolare in quanto ad arredamento, atmosfera familiare. Il personale è attento e particolarmente cortese.
https://www.yelp.it/biz/a-vucciria-torino; Il locale è pulito e i camerieri sono molto gentili. Sabato sera, in due, una fortuna trovare posto alle 20.30. Ci sono diverse sale: nella sala sotto c'e' anche musica dal vivo. una bella scoperta.
https://www.yelp.it/biz/a6-sciamadda-torino; Servizio eccellente, personale giovane, competente ed entusiasta. Personale gentile e simpatico (caffè e amaro rigorosamente genovese offerto dalla casa). Ottima esperienza in questo piccolo locale nel centro di Torino!
https://www.yelp.it/biz/ai-2-ghiottoni-bari-2; Il ristorante si presenta raffinato ed elegante. Il posto è elegante ed il personale è professionale. Per chi vuole passare una serata e gustarsi un ottimo pesce.
https://www.yelp.it/biz/ai-4-assi-di-sanna-roberto-torino; Serata in famiglia Servizio efficiente e personale cortese. Locale spazioso e molto pulito .Il personale è gentile e il servizio veloce.Ottimo rapporto qualità prezzo! Era un sabato sera, il locale era al completo, con una lunga fila all'ingresso in attesa ...
https://www.yelp.it/biz/al-111-bari-2; Si tratta di un locale raffinato e curato. Buono rapporto qualità prezzo, simpatici i camerieri è molto elegante. Delle pizze sul menù solo alcune erano disponibili perché mancavano molti ingredienti (di sabato sera!!!!!)
https://www.yelp.it/biz/al-bicerin-torino; Il locale è molto piccolo e delizioso. L'atmosfera che si respira nel piccolissimo locale è decisamente piacevole grazie anche al personale gentile e professionale. Un locale piccolino, ma accogliente, con tutto il mobilio in legno di una volta.
https://www.yelp.it/biz/al-cacimperio-torino; Ambiente raffinato con personale competente ed attivo. Decisamente un bel posto in cui passare una serata. Locale molto intimo gestito in modo magistrale da titolare.
https://www.yelp.it/biz/al-garamond-torino; La sala con pochi coperti e le luci soffuse rende l'ambiente molto intimo e romantico. LOCATION 8 Locale molto curato ed intimo, ottima atmosfera grazie ad una leggera musica di sottofondo. Cenetta romantica per festeggiare il primo anno di anniversario di matrimonio.
https://www.yelp.it/biz/al-grassi-torino-2; I primi piatti a volte ricordano la nouvelle cuisine. Anche i primi e i secondi , ottimi . Vino splendido. servizio eccellente ma mai invadente.
https://www.yelp.it/biz/al-paradise-palese; Il pesce è sempre freschissimo e si trovano sempre diversi tipi di frutti di mare. Crudo di mare freschissimo (ottimo rapporto qualità/prezzo),trofie pistacchio e gamberi eccezionale,come anche l'insalata di mare cotta. le pizze sono sfiziose e buonissime. il personale competente. locale raffinato per serate in compagnia. consigliatissimo
https://www.yelp.it/biz/al-savoia-bari; Forse un tempo era un riferimento per qualità e cortesia ma ora non più.
https://www.yelp.it/biz/al-sorso-preferito-bari; Anche questa volta il ristorante Al sorso preferito si è dimostrato all'altezza.... ottimi antipasti e fantastica cucina. Servizio impeccabile: personale gentile, simpatico e sempre attento alle esigenze del cliente. I primi piatti favolosi specialmente Il Risotto e gli indimenticabili spaghetti all'asassina .
https://www.yelp.it/biz/al-tegamino-moncalieri; Locale molto carino, curato pulito e personale gentile. La penultima volta ci è stato detto che l'impasto della pizza era finito (ore 20.30 di sabato sera). Il locale è carino, ma per il resto niente di che!
https://www.yelp.it/biz/alberosole-bari; Ristorante molto carino con ambiente accogliente, con soffitti alti in pietra viva, e atmosfera con luci soffuse... Luci soffuse, forse troppo se non si apprezza quel tipo d'illuminazione per cene che non siano romantiche. Bella atmosfera anche se il locale non è molto grande.
https://www.yelp.it/biz/alberto-marchetti-torino; Personale abbastanza gentile ed attento alle esigenze del cliente. Ottima gelateria nel centro di Torino con ingredienti naturali e personale gentile. Servizio ottimo e personale molto gentile, cordiale e disponibile.
https://www.yelp.it/biz/alberto-marchetti-torino-2; Personale abbastanza gentile ed attento alle esigenze del cliente. Ottima gelateria nel centro di Torino con ingredienti naturali e personale gentile. Servizio ottimo e personale molto gentile, cordiale e disponibile.
https://www.yelp.it/biz/alcool-torino-2; Sicuramente consigliato evitando magari il Sabato sera vista la calca.
https://www.yelp.it/biz/aldente-torino; Locale molto carino e pulito, primi piatti buoni, tartara di carne ottima, vitello non male. Ottimo cibo, ottimo vino, servizio cortese, a due passi dal centro, a fianco della Consolata. Il ristorante è carino anche se potrebbe essere più curato.
https://www.yelp.it/biz/alla-lettera-torino; Il sabato sera il locale è sempre pieno, sarebbe ottimale prenotare. Personale gentile e luogo accogliente anche se pienissimo. Ad ogni modo rimane un discreto rapporto qualità prezzo a pranzo.
https://www.yelp.it/biz/america-graffiti-torino; Locale molto carino in cui è possibile vivere l'atmosfera (o quasi) di una tipica cena americana anni 60. Il panino era buonissimo con un ottimo rapporto qualità  prezzo! Il personale è cortese ma lento nel servizio.
https://www.yelp.it/biz/amici-miei-torino; Il contesto è quello di un sabato sera e di una cena con altre due coppie. Il locale è molto carino e il poter mangiare fuori sotto i portici è gradevole Locale ampio.. servizio attento.. la pizza è buona, morbida con i bordi alti.
https://www.yelp.it/biz/anema-e-cozze-torino; I camerieri sono gentili ma dipende da chi ti capita. Il locale è carino ed accogliente e i camerieri gentili.
https://www.yelp.it/biz/antica-trattoria-del-sole-torino; Locale non troppo grande, intimo e pulito. Personale molto cortese, atmosfera piacevole, cibo ottimo e pesce sempre fresco.. Il personale di sala è molto competente e cordiale.
https://www.yelp.it/biz/antichi-sapori-torre-a-mare; Sabato sera insolitamente semipieno alle ore 21:15. Personale gentile e premuroso... ottima frittura di mare grigliata di mare e i primi Menù fisso antipasti discreti ottimi primi Nel contesto discreta cena rapporto qualità prezzo Personale molto disponibile Soddisfatto
https://www.yelp.it/biz/antico-balon-torino; Locale delizioso con pochi piatti nel menù ma tutti davvero ottimi e di qualità. Puntiamo alla qualità e non alla quantità Per un po' di attesa ci sta il Sabato sera Buona giornata Locale decisamente accogliente ed arredato in modo particolare (con molti cimeli calcistici appesi alle pareti).
https://www.yelp.it/biz/arcadia-torino-4; Sale molto suggestive e locale decisamente romantico. Location super romantica personale gentile e per nulla opprimente nel proporre portate!!! Queste colonne in pietra che raggiungono volte altissime crea un'atmosfera calda e gradevole.
https://www.yelp.it/biz/arigato-torino; Il locale non è molto raffinato ma nel complesso è pulito e accogliente. Locale carino e molto pulito.personale cortese e efficiente. Locale molto accogliente, curato negli arredi e pulito.
https://www.yelp.it/biz/augusto-torino; Locale pulito e con un servizio professionale. Sicuramente consigliato per passare una bellissima serata in compagnia. Il personale è molto gentile e simpatico.
https://www.yelp.it/biz/baccanale-torino; Locale carino e pulito, atmosfera niente di particolare ne in bene ne in male. Ottimi i primi piatti ma il meglio lo si trova nella carne! Il personale è gentile ed il locale è accogliente!
https://www.yelp.it/biz/bacco-bari; Consigliatissimo per chi vuole passare una serata unica. Servizio e atmosfera speciali con un ottimo rapporto qualità/prezzo. Locale elegante e informale, personale attento e cortese. il Sig.
https://www.yelp.it/biz/banco-di-sicilia-torino; Ottimo per una serata con la famiglia, con gli amici o in coppia. Se invece si vuole passare una serata serena con amici allora occorre scegliere un altro locale. Il personale è gentile e il locale è accogliente.
https://www.yelp.it/biz/bar-delle-scienze-torino; Il locale é piccolo ma accogliente ed il personale giovane. Poi c'è una bella varietà di primi e secondi e piatti freddi. Il personale molto gentile e veloce, disponibile nonostante il forte passaggio.
https://www.yelp.it/biz/bar-marconi-di-torre-francesco-torino; Orari flessibilissimi (venerdì e sabato chiude alle 3.00) e un bel modo di terminare un freddo sabato sera. Ambiente accogliente e tè di ogni genere. Il locale e arredato in modo semplice e il personale e gentile.
https://www.yelp.it/biz/bar-telebari-bari; Gelato buonissimo con molte varietà di gusti.Personale molto gentile e cortese facile da raggiungere Il personale è gentile e anche molto veloce. un must per i baresi sopratutto per il gelato. grande cortesia del personale.
https://www.yelp.it/biz/baratti-e-milano-torino-2; Locale molto raffinato, sia nell'arredamento che nell'atmosfera che si respira. Locale raffinato con una sua storia con arredi di specchi e argenti . Servizio inappuntabile con personale attento e cortese.
https://www.yelp.it/biz/barbagia-di-ollolai-torino; Locale elegante e allo stesso tempo famigliare. Un locale intimo e particolare, che racconta qualcosa. Il locale è abbastanza intimo, il cibo é ottimo, non molto abbondante e non c è grandissima varietà.
https://www.yelp.it/biz/barber-and-caffee-torino; Arredamento molto grazioso e ben equilibrato che permette di respirare un atmosfera romantica ed unica.
https://www.yelp.it/biz/bari-napoli-bari; Sabato sera, ingresso con prenotazione, anche puntuale. Confortevole per chi decide di trascorrere una serata piacevole insieme agli amici o a proprio partner. ottimo rapporto qualità prezzo. resta un must delle risto pizzerie della città. con qualità del cibo e buon bere
https://www.yelp.it/biz/bastimento-torino; Il locale molto carino nel centro di Torino personale molto premuroso e servizio veloce anche se di sabato sera. Il personale è gentile, sorridente ed allegro. Locale molto curato in una bella zona di Torino.
https://www.yelp.it/biz/bbq-di-pennestri-davide-antonio-c-torino; Buonissima la pizza, ottimi i primi di pesce, personale molto simpatico e gentile, che incentiva a tornarci. Il locale è carino ma nulla di che.
https://www.yelp.it/biz/berbel-torino; Sufficientemente intimo con atmosfera giusta per una cena romantica ma anche per piccoli gruppi. Raffinato ma con uno spazio esterno idoneo a tutti i giorni o a una serata anche romantica. Il tutto accompagnato da una musica dal vivo gradevole ma forse un po' troppo tranquilla per la serata.
https://www.yelp.it/biz/biancofiore-bari; Particolare non scontato: bella musica in sottofondo e persino a volume corretto. Locale intimo nel pieno centro della citta. Atmosfera calda ed accogliente,cibo ricercato e cucina prelibata.
https://www.yelp.it/biz/bicyclette-torino; Il locale è molto carino ed intimo. Il locale è piccolo ma l'atmosfera è calda e piacevole. Questo locale così intimo e carino é stata una bella scoperta!
https://www.yelp.it/biz/birreria-don-giovanni-torino; Presente la TV con eventi sportivi e comunque anche Buona musica di sottofondo. Ottimo locale per passare una serata tranquilla tra amici, fuori dal centro, ma facilmente raggiungibile. Accogliente e dall'atmosfera tradizionale con personale competente e gentile.
https://www.yelp.it/biz/birrificio-torino-torino; Un bell'ambiente per passare una serata piacevole. Ottimo per una serata informale con ottimo cibo! Ottimo per una serata in compagnia di amici!
https://www.yelp.it/biz/bistrot-turin-torino; Location centrale ma un po' troppo rumorosa e non indicata per chi cerca qualcosa di intimo e tranquillo. Il personale molto cordiale e professionale e il locale piccolino ma accogliente. Personale di sala gentile e ben preparato.
https://www.yelp.it/biz/black-angus-turin; Appena entri...atmosfera molto calda e profumo di carne buonissimo. Ristorante carino e molto accogliente, tutto nuovo con una bella atmosfera. Locale carino, sono riuscito ad andare solo 2 volte e in settimana, quindi poco gente e nessuna confusione.
https://www.yelp.it/biz/black-e-white-bari; Posto raffinato, meglio all'interno, cordialità e disponibilità. Locale molto carino e trendy nel delizioso centro storico, servizio molto curato, cortese e rapido. Chef e personale di sala al top.Posto incantevole,cibo di altissimo livello.Antipasti di incredibile bontà.
https://www.yelp.it/biz/black-jack-torino; Il locale non è tanto grande, è quel che si dice accogliente! Pizza ottima qualità prezzo eccellente Bisognerebbe solo rinnovare il locale ma per il resto ottima.
https://www.yelp.it/biz/blue-eyes-bari; Personale come sempre cortese e sorridente, tranquillizzante locato anni 80 e buona musica. Posto giusto per trascorrere una serata in compagnia mangiando e bevendo secondo la giusta qualità e prezzo rimanendo soddisfatti. Prodotto di qualità ad un prezzo eccezionale!
https://www.yelp.it/biz/boheme-torino; L'atmosfera è buona con musica in sottofondo. Locale a luci soffuse, caldo ed accogliente. Un eccellente rapporto qualità-prezzo e un pasto delizioso.
https://www.yelp.it/biz/boja-fauss-torino-2; Il locale è ampio, pulito e arredato con gusto. è un locale molto carino in San Salvario, nella zona più tranquilla. Ambiente pulito e caratteristica la stanza con cassette di legno sul soffitto..
https://www.yelp.it/biz/boka-torino; Ottimo cibo , ottimo servizio e personale , splendida location. Locale piccolino ma ben organizzato..Super gentili e disponibili...cura dei dettagli..
https://www.yelp.it/biz/borgo-antico-bari; Il personale molto cortese, simpatico e professionale. Personale gentile e disponibile, bel clima cordiale. Dunque pizza e rapporto qualità prezzo pessimo.
https://www.yelp.it/biz/botta-bari; Esperienza di un sabato sera con ingresso alle 20.30. Sabato sera con amici, voglia di buona pizza a Bari senza fare tanta strada. Pizza norcina molto buona e personale molto cortese nonostante la larga affluenza del sabato sera.
https://www.yelp.it/biz/bottega-baretti-moncalieri; Le luci soffuse danno un tocco originale. Ambiente molto raffinato e il servizio molto buono. Ambiente molto accogliente e piacevole, perfetto per una serata tra amici.
https://www.yelp.it/biz/braceria-signorile-bari; luogo accogliente personale specializzato un rapporto prezzo-qualita' ottimo una serata all'insegna di buon mangiare Servizio gentile, carne di buona qualità e conto giusto. Locale piccolo ma confortevole e ben arredato, il servizio è stato gentile e non invasivo, l'accoglienza da subito calorosa!
https://www.yelp.it/biz/brasserie-bordeaux-torino-2; Ottimo cibo, atmosfera calda, personale gentile ,coctails al top grazie a Edo (assaggiate i suoi esprimenti !!!) Locale accogliente dalle luci tenui, servizio giovane e simpatico, la cucina risulta particolare, con abbinamenti non comuni. Nel quartiere di San Salvario un sabato sera affollato ecco un ristorante con cucina di qualità e servizio solerte.
https://www.yelp.it/biz/briss-torino; Ristorante di pochi tavoli ( una decina), accogliente, confortevole, pulito. locale intimo e caratteristico, personale gentilissimo e molto attento..e cibo assolutamente ottimo!.. Il locale e' intimo una decina di tavoli in tutto , ben separati.
https://www.yelp.it/biz/bruschetteria-pautasso-di-stecco-susanna-torino; Piatti ricercati e ambiente pulito e ordinato. Locale accogliente, si riempie facilmente, specialmente la sera. Ristorante molto carino, rustico ma al contempo elegante.
https://www.yelp.it/biz/buosi-torino; Da ritornare .. ottimo qualità/ prezzo e personale cortese e gentile!
https://www.yelp.it/biz/burgheria-torino; Locale carino,stile americano anni 50,molto accogliente e pulito. Capitati per caso durante una passeggiata sabato sera: mai più! PS: la cucina a vista è positiva se è tutto impeccabile e pulito...
https://www.yelp.it/biz/busters-coffee-torino; Il locale è ampio, accogliente, il personale è educato e gentile. Il locale è molto carino, il personale simpatico. Un piccolo locale carino e ben arredato con personale molto simpatico.
https://www.yelp.it/biz/caff%C3%A8-della-posta-torino; Il bar è stato completamente ristrutturato da poco e dà  subito l'impressione di essere ben curato e pulito.
https://www.yelp.it/biz/caff%C3%A8-mulassano-torino-3; Locale elegante, raffinato, d epoca con marmi e bronzi.
https://www.yelp.it/biz/caff%C3%A8-torino-torino-2; Servizio curato dal personale cortese, mai invadente e sempre premuroso.Nessun cameriere di secondo lavoro.
https://www.yelp.it/biz/caffe-lumiere-torino; Bel localino d'atmosfera in stile primo '900, con tantissime tisane, cioccolati artigianali ed altre golosità. L'atmosfera è calda ed accogliente, il personale sempre gentile, e la cioccolata calda è impagabile. Peccato perché il personale è gentile ed educato in netto contrasto con il proprietario: un vero arrogante ineducato.
https://www.yelp.it/biz/camilla-kitchen-torino; Perfetto per una serata romantica ma anche per serata tra amici. Locale raffinato e di tendenza... molto elegante e giovanile allo stesso tempo. Locale molto accogliente con atmosfera relativamente sofisticata.
https://www.yelp.it/biz/cammaf%C3%A0-torino-4; Tutte ne parlavano molto bene e quindi si è deciso di provarla sabato sera. Anche il locale è carino rinnovato da poco Essendo piccolo il locale, buona la pizza e contenuto nei costi, c'è spesso da aspettare
https://www.yelp.it/biz/cantinero-de-cuba-bari; Locale parecchio grande, il coperto aumenta nelle sarate delle partite
https://www.yelp.it/biz/casa-del-barolo-torino-3; Atmosfera tranquilla e ideale per una serata romantica. Musica di sottofondo molto gradevole e molto pulito. Ideale sia per una cena con amici che pervuna cenetta romantica.
https://www.yelp.it/biz/casa-fiore-torino; Location curata ed elegante, il personale gentilissimo! Localino curato e con pochi tavoli, l'ideale per una cena intima e sicuramente di qualità. Locale elegante e raffinato che offre tutti i confort ai clienti, salviette e spazzolini nel bagno.
https://www.yelp.it/biz/casa-mad-torino; La musica di sottofondo è ricercata e decisamente piacevole. L'atmosfera è rilassante e il personale gentile. Consigliato per una cena tranquilla e amicale.
https://www.yelp.it/biz/casa-vicina-torino; Il rapporto qualità prezzo è davvero buono. Il personale è gentile, attento, mai invadente. Perfetto in tutto agnolotti da sogno filetto imperdibile Anche il rapporto qualità prezzo è ottimo.
https://www.yelp.it/biz/casablanca-bari; Bel ristorante situato sul mare con personale cortese. Servizio eccellente anche di sera con locale pieno. Location molto carina, con ampia terrazza direttamente sul mare.
https://www.yelp.it/biz/casale93-torino; Bellissima serata in compagnia di uno staff cordiale e di compagnia... I coperti sono molti ma il servizio è abbastanza celere e l'atmosfera calda. Se si vuol passare una serata in compagnia senza rischiare di spendere un patrimonio si può tranquillamente andare.
https://www.yelp.it/biz/catullo-torino-2; Locale elegante e attento alle esigenze del cliente. Ottimo locale per passare una serata a Torino. Location bellissima molto elegante personale molto accogliente e cordiale unica pecca prezzi un po' alti.
https://www.yelp.it/biz/ceccarelli-torino; Locale elegante e raffinato, cibo ottimo e preparato con cura. il locale è molto intimo ed accogliente, l'arredamento elegante e sobrio. Si passa una serata tranquilla mangiando bene, anche la ''tarte Tatin'
https://www.yelp.it/biz/cera-una-volta-torino; Per trascorrere una Romantica cena a lume di candela. Il ristorante è elegante ma non raffinato. Locale elegante e raffinato, ottimo il cibo e il servizio.
https://www.yelp.it/biz/che-bolle-in-pentola-torino; Locale accogliente, personale gentile e cibo delizioso. Consigliato per una piacevole serata con ottimo cibo. Atmosfera casereccia con personale molto attento e cordiale.
https://www.yelp.it/biz/chez-zeina-torino; Il locale è carino se però si capita in una sera con pochissimi commensali risulta freddo, in vari sensi. Il servizio è davvero impeccabile e il signore molto molto gentile e disponibile a spiegare ogni cosa. Propretario molto affabile e gentile e molto disponibile.
https://www.yelp.it/biz/chiodi-latini-new-food-torino; Il locale é molto piccolo, perfettamente curato, molto pulito. Bel localino, pochi tavoli ma molto carino e ben curato. Staff preparato molto attento senza essere mai invadente.
https://www.yelp.it/biz/cinese-du-cheng-torino-2; Locale ben curato, pulito, titolari gentili ed accoglienti, piatti gustosi. Il personale è gentile, il tempo di attesa è poco, sembra pulito e l'arredamento è quello classico cinese. Personale gentile, servizio svelto e piatti ottimi.
https://www.yelp.it/biz/cinese-mei-li-hua-torino; Un ristorante cinese che riesce allo stesso tempo ad essere semplice ed estremamente raffinato ed elegante. Il personale è gentile, purtroppo il cibo ha perso molti punti. Nulla da dire sul personale che era gentile e disponibile.
https://www.yelp.it/biz/cinese-nanchino-torino; Da segnalare che il personale è estremamente gentile e disponibile, ma purtroppo non basta.
https://www.yelp.it/biz/cinque-lire-torino; Personale cortese e sorridente, bagno pulito e carino. Ottimo locale accogliente e attento al cliente. Locale accogliente senza essere scenico, cucina buona che va dalla pizza ai menù di un certo livello.
https://www.yelp.it/biz/cioccolato-peyrano-torino-2; Personale gentile, inclusa la signora alla cassa, verosimilmente la gerente o proprietaria.
https://www.yelp.it/biz/circolo-dei-lettori-torino; Il servizio e' eccellente e l'ambiente raffinato. La location è molto suggestiva e l'atmosfera è serena, d'altri tempi. Da non sottovalutare l'ottimo rapporto qualità prezzo...
https://www.yelp.it/biz/complice-di-zhou-jinshu-torino; Personale molto cortese, a volte solo un po' disorganizzato. Servizio veloce e personale cortese, prezzi davvero contenuti. Il servizio è semplice ma il personale è cortese.
https://www.yelp.it/biz/conte-verde-torino-2; Ristorante molto accogliente e confortevole..personale cordiale e disponibile...ambiente pulito..qualità del cibo buona..buono anche il rapporto qualità prezzo. Locale consigliato per chi desidera passare una serata in centro, senza pagare un occhio della testa e mangiar bene. Piatti unici nel gusto tipico piemontese...buono...personale gentile e cortese.... prezzo accettabile ... centrale
https://www.yelp.it/biz/coox-torino; Personale molto disponibile e locale accogliente e pulito. Il personale è gentile, il ristorante sembra pulito ed il cibo è super! Piatti ben serviti e locale molto elegante, per non parlare dei dessert poi...unici!
https://www.yelp.it/biz/copacabana-torino; Ci si diverte in una accogliente atmosfera. Molto belli anche le serate con musica dal vivo o con dj. Il locale è accogliente e le pietanze buone ed in -abbondanza!
https://www.yelp.it/biz/cornetti-night-torino-2; Personale molto gentile e pronto a dispensare consigli. Un piccolo locale che racchiude enormi gioie! Locale piccolo ma carino,personale simpatico e gentile.
https://www.yelp.it/biz/costadoro-torino; Locale elegante ed accogliente, ottimo per gustare un aperitivo in pieno centro a Torino. colazione eccellente carinissimo il locale buonissime le brioches e caffè giusto rapporto qualità prezzo! Il personale è gentile e simpatico, il servizio rapido.
https://www.yelp.it/biz/da-benito-torino; Un posto in cui si mangia sicuramente bene e in cui è piacevole passare una serata all'insegna della tradizione. Il locale é curato e leggermente retrò, il servizio molto professionale con camerieri esperti e molto organizzati. Ambiente un po' datato ma personale molto gentile.
https://www.yelp.it/biz/da-ciccillo-torino; Il locale è piccolo ma proprio per questo motivo ti fa sentire subito un'atmosfera più raccolta e intima. Finalmente una pizzeria napoletana che accetta prenotazioni il sabato sera! Grandi ragazzi location curata e ampliata con una nuova sala stupenda.
https://www.yelp.it/biz/da-ciro-torino; Nonostante fosse sabato sera è andato tutto perfettamente Ideale per chi vuole passare una serata tra amici e mangiare bene. Sono in questo locale con un gruppo di amici di sabato sera.
https://www.yelp.it/biz/da-giannino-l-angolo-d-abruzzo-torino; Posto molto familiare per passare una serata. Locale intimo arredato come una classica trattoria. Luogo ideale per trascorrere una serata allegra e in compagnia.
https://www.yelp.it/biz/da-mauro-torino; Accoglierci di sabato sera in 14 era un problema.Impossibile prenotare. Il servizio è molto buono e cortese. Personale attento e gentile, nonostante un buon numero di clienti dalla cucina risposte pronte.
