url;review
https://www.yelp.it/biz/da-nicola-torre-a-mare; Il sito é sul mare e servono del pesce freschissimo. Un posto ottimo per coppie e serate con amici...una vista fantastica sul mare accompagnata da dell'ottimo cibo.. Primi piatti anch'essi buoni: riso patate e cozze da me particolarmente gradito e tagliolini ai frutti di mare.
https://www.yelp.it/biz/dai-saletta-torino-2; Cena del sabato sera, con amici, previa prenotazione. Rapporto qualità prezzo ottimo discreta cantina e atmosfera piacevole ! Ottimo per trascorrere una serata in totale relax in un ambiente easy.
https://www.yelp.it/biz/del-cambio-torino; Un locale accogliente, luci soffuse, l'opera del Pistoletto però non ha incontrato i nostri giusti. Piccolo aneddoto: Sabato sera, bevo un aperitivo in farmacia e nel frattempo telefono per prenotare un ristorante. Il locale è molto curato e ben conservato, il personale è molto professionale e cordiale e assolutamente efficiente.
https://www.yelp.it/biz/delfino-blu-torino; serata intima in una location elegante ottimo pesce tutto freschissimo e cucinato con maestria. Locale raffinato pulito e cucina ottima con pesce fresco e cotto alla perfezione complimenti!! Il Ristorante Delfino Blu è davvero stupendo con un dehor esterno bellissimo e l'atmosfera romantica.
https://www.yelp.it/biz/dickens-inn-bari; Ottimo per passare una serata tranquilla, o per ascoltare buona musica live. Classico stlile irlandese con quadri della guinness e luci soffuse,cibo ottimo,vastissima scelta di birre e personale gentile. Tutto sommato un pub senza infamia e senza lode in cui passare una serata tranquilla in compagnia.
https://www.yelp.it/biz/diecicento-torino-2; Il locale e Carino ben arredato ,un po di musica in sottofondo. Locale ben curato, molto intimo, con luce soffusa. Sabato sera passato in compagnia di amici in questa pizzeria.
https://www.yelp.it/biz/diplomatic-torino; Personale davvero cortese e disponibile che supplisce come può alle notevoli carenze. Personale della reception e di sala gentilissimo, cordiale, professionale e premuroso. Personale cortese e professionale e camere comode e pulite.
https://www.yelp.it/biz/dolce-mania-di-lepori-raffaele-torino; Il locale è carino e molto pulito. Il locale è accogliente, con le vetrine presentate molto bene. Il personale è sempre gentile e cordiale.oytimo qualità prezzo
https://www.yelp.it/biz/dora-in-poi-torino; Atmosfera rilassata e personale gentile e professionale. Il locale è accogliente e oggi suonavano musica dal vivo (chitarra e pianoforte). Ottimo e con un impiattamento all'Alessandro Borghese Il locale è molto carino, fresco e raffinato.
https://www.yelp.it/biz/du-cesari-torino; Il locale non è grande e la sera è affollato anche durante la settimana: consigliabile prenotare. Personale molto gentile, davvero accogliente e molto disponibile, sembra proprio di mangiare a casa. Il locale è molto accogliente ed il personale di sala gentile...
https://www.yelp.it/biz/dublin-house-bari; Insomma...un bel posto per una piacevole serata in compagnia di amici! Personale gentile e disponibile, ottimo ambiente ed ottima birra. Locale carino stile irlandese e lontano da traffico del centro perchè in zona parco 2 giugno.
https://www.yelp.it/biz/e-pronto-torino-2; Ottimo il cibo vegetariano e ottima l'accoglienza.
https://www.yelp.it/biz/eat-sicily-torino; Il locale è piuttosto accogliente, il bagno risultava pulito e comodo. Poi servizio perfetto cordiale gentile che si preoccupava del cliente.. posto molto pulito! continuo a pranzare e cenare da voi......ottimo cibo e servizio.....ampio dehors,sala interna molto elegante,saletta privata......arredamento molto elegante.
https://www.yelp.it/biz/eataly-bari; L'ambiente si presenta in modo spartano e per nulla raffinato o elegante, sia per la struttura che per l'arredamento. Locale molto carino,però andare ad una serata siciliana e aver finito gli arancini,nn è possibile,disorganizzazione Il Personale è gentile, professionale e sorridente.
https://www.yelp.it/biz/eataly-torino-torino; Professionalita' e gentilezza in un ambiente molto accogliente. Mangio spesso da Eataly con amici e con la famiglia, il servizio è veloce e il cibo p ottimo. ottimo cibo da consigliare reparto delle carni e pescheria.
https://www.yelp.it/biz/el-churrasco-bari-2; Locale accogliente, nella zona a piano terra, musica di sottofondo gradevole, servizio gentile veloce e paziente. Location molto carina, in stile osteria, atmosfera molto calda. Il locale è accogliente e con una atmosfera da trattoria.
https://www.yelp.it/biz/el-pollo-loco-torino; L'atmosfera tranquilla permette di trascorrere una serata tranquilla anche in presenza di bambini. Il locale è veramente carino e pulito. Ottimo locale x passare una serata tra amici.
https://www.yelp.it/biz/emporio-gastronomico-torino; Locale carino ma con tavoli interni un po' sacrificati. Menzione speciale per il servizio: gentile, veloce e disponibile. Locale molto carino e cibo nella media.
https://www.yelp.it/biz/eno-libero-emporio-enogastronomico-torino; Il personale molto cortese l'atmosfera molto colorata. Un locale intimo e piccolino con arredamenti vintage nel mezzo di San Salvario, quartiere della movida torinese. Personale attento ad ogni richiesta, locale esteticamente carino e pulito.
https://www.yelp.it/biz/enoteca-rossorubino-torino; Ottimo cibo, atmosfera accogliente e tanto vino. Locale davvero carino, ben curato nell'arredamento e nel design generale. Personale cortese e disponibile, servizio buono e prezzi adeguati!
https://www.yelp.it/biz/entremetier-di-lingweifu-torino; Personale gentile, location non di lusso, ma pulita. Ottimo il rapporto qualità prezzo e personale molto cordiale. è sempre rimasto eccellente sia la qualità prezzo, che cortesia.
https://www.yelp.it/biz/eos-torino; L'atmosfera giusta per trascorrere una piacevole serata. Locale piccolo 50 coperti max, arredato in stile moderno ed elegante. Il locale è molto intimo e ben arredato con cura per i particolari.
https://www.yelp.it/biz/esperia-torino-2; Luci soffuse sul Po,cenetta all'aperto,cibo buonissimo,posto d'eccellenza. Ambiente molto elegante e raffinato, personale cortese, servizio rapido e buona scelta di piatti, di ottima qualità. Il personale è cortese, l'ambiente super tranquillo, l'atmosfera nelle sere d'estate è magica.
https://www.yelp.it/biz/exki-8-gallery-torino-2; Il personale è molto gentile e amichevole.
https://www.yelp.it/biz/factory-bari; Locale particolarmente accogliente con luci alquanto soffuse. Ambiente adatto a trascorrere una serata tranquilla, fuori dalle formalità. Bel locale per passare una serata tranquilla con amici, mangiare dei panini/insalata/clubsandwich o bere qualcosa.
https://www.yelp.it/biz/farini-da-lia-torino; Locale piccolino nel quale e' indispensabile prenotare , pulito ed ordinato.Servizio cordiale e alla mano. Appena entrati il locale è accogliente e arredato in modo semplice ma piacevole. Il locale è carino anche se manca di luce naturale (che non guasta mai).
https://www.yelp.it/biz/farmacia-dei-sani-bari; Locale raffinato, quasi tutti i clienti vestono eleganti. Pienamente soddisfatti: ottimo cibo e atmosfera rilassante. personale accogliente e gentile Servizio eccellente, camerieri pronti a dare qualsiasi spiegazione e molto gentili.
https://www.yelp.it/biz/fiorio-gelateria-torino; Interno carino e personale gentile, tutto molto buono
https://www.yelp.it/biz/focacceria-riviera-ligure-torino; Servizio veloce e personale gentile nonostante la premura. Focacceria ottima gestita da personale gentile e sorridente. Molto comodo per pranzare in centro a Torino e mangiare pizza veramente buona, Da provare!!!
https://www.yelp.it/biz/forchetta-e-scarpetta-torino; Il locale è simpaticamente arredato in uno stile retrò...peccato per la musica di sottofondo un pò fuori tema ! Locale piccolo ma accogliente personale simpatico e ben disposto. Cibo di qualità con ottimo rapporto qualità prezzo.
https://www.yelp.it/biz/fratelli-la-cozza-torino-2; Accettano i ticket (chiedere conferma per il sabato sera), bancomat e carte di credito. Locale grande, pizza abb. buona ma niente di particolare. Il personale è gentile e l'ambiente sempre piacevole.
https://www.yelp.it/biz/fratelli-roselli-torino; Locale pulito con personale disponibile e preparato. Un localino piccolo e accogliente, personale cordiale e pizza strepitosa. Posto consigliato per cene con ottimo cibo in un'atmosfera serena e rilassante.
https://www.yelp.it/biz/freevolo-torino; Personale gentile e simpatico che crea una bella atmosfera. La location è perfetta per una serata romantica o in compagnia, nel Quadrilatero torinese, vicino al centro cittadino Bel posticino per trascorre una piacevole serata in compagnia di amici o in coppia mangiando del buon cibo.
https://www.yelp.it/biz/frulez-bari; Un delizioso connubio di sapori e semplicità  legati da un atmosfera calda ed accogliente. Luogo pulito e accogliente e personale molto gentile. Ambiente pulito , servizio veloce , piatti unici da gustare , molta varietà nella scelta .
https://www.yelp.it/biz/fuzion-torino; Il locale è piccolo ma pulito e moderno. Ambiente pulito e ben arredato anche se piccolino. Il locale è piccolo, pulito ma un po' freddo negli arredi.
https://www.yelp.it/biz/gadi-bari; Il locale è piccolo ma ben organizzato.
https://www.yelp.it/biz/galante-torino; Carta dei vini discreta e locale elegante anche se in stile primo  900.
https://www.yelp.it/biz/galante-torino-2; Ristorante elegante e raffinato, buona scelta di piatti sia di carne che di pesce. Il locale è molto raffinato e ben curato. locale raffinato, non molti coperti, conviene prenotare perchè è quasi sempre pieno.
https://www.yelp.it/biz/gandhi-torino; Servizio elegante e raffinato e piatti ottimi. Il locale è molto carino dall'atmosfera rilassata e tranquilla. Il locale è molto carino, elegante e suggestivo!
https://www.yelp.it/biz/gasperini-bari; Personale gentile e simpatico da provare sicuramente !!!
https://www.yelp.it/biz/gelateria-ciuffos-torino; Gelato ottimo e personale molto cortese, da provare. Ottimo il rapporto qualità/prezzo (16 euro un chilo).
https://www.yelp.it/biz/gelateria-miretti-torino-7; Locale intimo e accogliente, arredato con cura. Locale elegante e Cortese, serve in gelato davvero squisito! Locale curato e pulito che offre piatti semplici per una pausa pranzo leggera e sfiziosa.
https://www.yelp.it/biz/gelateria-mondello-torino; gelato molto buono in ambiente accogliente e pulito. Molto carino il locale con alcuni tavoli per sedersi Personale gentile e buona location nel quadrilatero torinese
https://www.yelp.it/biz/gelateria-monginevro-smaldone-raffaele-torino; Il personale è sempre gentile e sorridente: caratteristica molto rara da trovare nella maggior parte dei posti. Grande vastità di gusti e personale gentile. Ottimo gelato ed ottimo rapporto qualità prezzo .
https://www.yelp.it/biz/gelateria-piu-di-un-gelato-torino; locale piccolo pulito e personale gentile e paziente e davvero professionale. Il locale è piccolino, ma...ragazzi che gelato! Piccolo locale ma la qualità è altissima!
https://www.yelp.it/biz/gelateria-popolare-torino; Il locale è molto carino con ottima musica jazz in sottofondo. Nè manca mai la buona musica che stempera l'eventuale attesa Davvero un'ottima meta per una serata in compagnia, gustando delle prelibatezze sane e naturali.
https://www.yelp.it/biz/giapponese-ohashi-torino; Personale gentile e disponibile locale molto pulito sushi molto buono. Considerato ciò il rapporto qualità prezzo risulta davvero ottimo. Il servizio è gentile e garbatamente presente.
https://www.yelp.it/biz/giapponese-sakura-torino; Il locale si presenta pulito ed il personale è accogliente, i prezzi e i menu sono abbordabili. Locale carino e simpatico ma per l'educazione non ci rientrerò più! Personale cortese, perfetto anche se si hanno amici a cui non piace il pesce crudo.
https://www.yelp.it/biz/ginza-sushi-king-torino; L'ambiente è carino e la locazione è facilmente raggiungibile: si trova non molto distante dalla stazione di porta nuova.
https://www.yelp.it/biz/giovanni-torino; Locale raffinato in prossimità del centro di Torino. è un ristorante molto carino con particolare arredamento d'epoca, pulito e curato. Andati di sabato sera, il locale era strapieno ma nonostante ciò sono riusciti a servirci in tempi giusti.
https://www.yelp.it/biz/gramsci-torino-2; Luci soffuse, ambiente elegante e pulito, personale cortese. Assolutamente consigliato anche per la location molto intima con luci soffuse. Il locale è accogliente e tranquillo con questa atmosfera soffusa permette di passare una serata anche molto romantica.
https://www.yelp.it/biz/grande-muraglia-di-zhans-rong-e-li-songhai-torino; Ottimo rapporto qualità/prezzo e cortesia completano un quadro positivissimo. Buon rapporto qualità prezzo e camerieri gentili, anche se non tutti parlano bene l'italiano. Prezzo modesto in rapporto alla qualità ed alla quantità del cibo.
https://www.yelp.it/biz/greek-food-lab-torino-2; Anche la musica di sottofondo ci è sembrata inadatta al locale. Bagno pulito e profumato( cosa rara) Personale gentile e cibo buono! Un po' di attesa nei giorni festivi ed il sabato sera.
https://www.yelp.it/biz/grezzo-torino; E' un locale elegante, con prodotti di altissima qualità e un personale motivato e appassionato. Personale molto gentile e pronto a spiegare le diverse preparazioni e materie prime utilizzare.
https://www.yelp.it/biz/grom-torino-2; Locale piacevole e pulito ( gelato da asporto) Gelati di ottima qualità e personale gentile. Il locale piccolo e accogliente presenta i classici gusti della catena e il cono senza glutine.
https://www.yelp.it/biz/grotta-azzurra-bari; In generale il locale è carino ma manca atmosfera, il cameriere è cortese ma freddo. Scelta modesta sia di primi che di secondi.
https://www.yelp.it/biz/gufo-bianco-torino; Elegante e raffinato, un menù delicato ma anche dai gusti tradizionali. Locale raffinato, accogliente con un servizio molto professionale. Locale elegante, servizio di ualità ma non tutti i piatti seno risultati all'altezza delle aspettative.
https://www.yelp.it/biz/guido-gobino-torino-3; Personale sicuramente molto gentile e rapido nelle ordinazioni. Locale piccolo,con tavoli all'aperto lungo una bellissima via che porta al museo egizio. Il locale piccolo e carino ha una sala degustazione straordinaria...
https://www.yelp.it/biz/gulp-bari; Servizio eccellente, qualità del cibo ottima, atmosfera ricercata. Servizio gentile, unica pecca il locale è un po' piccolo. Struttura calda e accogliente, arredamento particolare, personale gentile, menu vasto.
https://www.yelp.it/biz/gusti-e-sapori-torino; Locale pulito e servizio capace e simpatico. Esperienza di un sabato sera con famiglia. A cena un sabato sera senza aver prenotato.
https://www.yelp.it/biz/gyrosteria-yannis-bari-2; Il locale è piccolino,ma accogliente e permette di immergersi in un'atmosfera greca. Ottimo panino e moglie soddisfattissima... locale molto carino e caratteristico a due passi dall'ateneo... Locale molto carino situato al centro di Bari vicino l'Ateneo.
https://www.yelp.it/biz/hokkaido-torino; Il personale è molto gentile e il locale pulito. Il personale è molto gentile ed il locale pulito!! Il posto è carino e sembra pulito e ben tenuto!
https://www.yelp.it/biz/hua-dou-cheng-torino; Il locale è pulito ed il personale molto gentile. Servizio discreto e informale ideale per passare una serata allegra e low cost. Locale molto pulito e personale gentile (in particolar modo la titolare...sempre sorridente e di buon umore).
https://www.yelp.it/biz/hua-dou-torino; Ottima cucina cinese e buonissima la pizza!
https://www.yelp.it/biz/i-soliti-ignoti-torino; Sabato sera una cenetta in 4 persone. Servizio celere anche di sabato sera e personale molto gentile. Locale molto accogliente e cibo gradevole, peccato però per il servizio.
https://www.yelp.it/biz/i-tartufi-bistrot-torino; Il locale è molto carino, essenziale e pulito. Il locale è piccolo, intimo ed il titolare è bravissimo. La qualità dei piatti era molto buona e il locale è accogliente e intimo.
https://www.yelp.it/biz/i-tesori-bari; Locale molto carino, personale gentile e disponibile. Il locale é curato in modo da evicare altri tempi, il personale e la proprietaria sono cortesi e professionali. Calda e accogliente, gentilezza ed attenzione per il cliente qui sono di casa.
https://www.yelp.it/biz/i-tre-scalini-torino; Consigliata per una tranquilla serata tra amici o in famiglia. Locale piccolino ma pulito e veloce nel servizio. Locale piccolo e carino rivestito di perlinato infonde una bella sensazione di calore e intimita' familiare.
https://www.yelp.it/biz/ichi-torino; Apparentemente pulito ed elegante presenta invece carenze igieniche notevoli. Location molto carina, ambiente pulito, personale cordiale. Locale accogliente, pulito, ben illuminato, non caotico.
https://www.yelp.it/biz/ij-brande-torino; Il locale è intimo, i colori ispirano tranquillità e le luci soffuse non creano fastidio. Locale elegante, molto intimo e tranquillo, ideale per serate romantiche o con poche coppie. Locale piccolo , ben arredato, intimo ed accogliente.
https://www.yelp.it/biz/il-barotto-torino; Locale accogliente , molto intimo e curato ! Locale davvero carino e particolare nel cuore di San Salvario. Serata piacevolissima in questo locale piuttosto piccolo ma ben arredato.
https://www.yelp.it/biz/il-brigantino-torino; Il locale è molto curato ed elegante. Locale elegante, cortesia e preparazione del personale, clientela raffinata. Locale pulito e silenzioso con ottimo cibo e personale gentilissimo.
https://www.yelp.it/biz/il-cortiletto-torino-2; Sabato sera piacevole al Cortiletto: Locale piccolo ed intimo, con cucina a vista. Colpisce subito l atmosfera intima ed accogliente :pochi tavoli,ben curati all interno di un cortile..molto suggestivo! Se vai in un locale e devi passare la serata in un'atmosfera elettrica meglio farsi due spaghi a casa.
https://www.yelp.it/biz/il-gelatiere-bari-3; Il locale semplice ma pulito il personale cortese e attento alle esigenze. se volete passare una serata all'insegna della qualità e del risparmio è proprio il posto x voi! Personale cortese ed educato, gelato buonissimo con la possibilità di scegliere vari gusti.
https://www.yelp.it/biz/il-giglio-torino; Locale piccolo, pulito anche se un po' freddo.. poca personalità. Pieno zeppo di pesce freschissimo e ricoperto di quel tanto delizioso sugo in cui era. Bel localino nel Centro di Torino, a due passi da Porta Palazzo o Via Garibaldi.
https://www.yelp.it/biz/il-padellino-torino; Arrivi di sabato sera anche senza prenotare e ti trovano sempre il posto... Nonostante fosse sabato sera e il locale fosse pieno il servizio è stato molto veloce e cortese. Locale carino, forse un po' troppo scuro.
https://www.yelp.it/biz/il-panino-giusto-torino; Peccato per il personale che non sempre è così cortese. peccato per il personale poco attento e scordiale. caffè ottimo accompagnato da una mattonella DaiDai croccante e cremoso!!! molto gentile e disponibile€e poi le attese lunghe e spesso senza motivi ...peccato.
https://www.yelp.it/biz/il-picchio-torino; Personale gentile e rapidissimo, che contribuisce a rendere l'atmosfera molto accogliente. Vino fresco e di qualità. il tutto per un prezzo molto competitivo. Locale sempre piacevole, servizio veloce e camerieri gentili, qualità del cibo deludente.
https://www.yelp.it/biz/il-porto-torino; Serata infrasettimanale e pertanto tranquilla... servizio cortese? I tavoli sono un po' piccoli, ma si cena a lume di candela. Locale accogliente, che ricorda proprio i ristorantini al mare.
https://www.yelp.it/biz/il-punto-verde-torino-2; Il locale è carino e molto pulito. Un ambiente pulito e senza fronzoli, cucina soddisfacente e prezzi onesti. Il personale gentile, la scelta e la qualità dei piatti discreta ma l'atmosfera è un po' trascurata.
https://www.yelp.it/biz/il-ristoro-dei-mercanti-torino; Il locale è molto intimo, la cucina è ottima e ben curata. Ambiente famigliare con personale molto gentile e premuroso. Consigliatissimo anche per il rapporto qualità prezzo.
https://www.yelp.it/biz/il-rustico-bari; Ottimo posto per passare la serata in compagnia di amici. Il personale è gentile e anche molto simpatico! Spartano . ...ma che soddisfa ampiamente . ...personale gentile e veloce.
https://www.yelp.it/biz/il-siculo-di-savona-monica-torino; L'ambiente è molto familiare e il personale è gentile e simpaticissimo. Qualità prezzo perfetto al di sotto dello standard dei marchi in città Il personale è sempre gentile, il locale è piccolo.
https://www.yelp.it/biz/il-tabisca-turin; Bene l'offerta di primi e secondi sia di mare che di terra. Il locale è molto carino e curato, meglio prenotare, la zona è molto affollata. Il personale gentile ma il balìa degli eventi e della quantità di persone da servire.
https://www.yelp.it/biz/il-vicolo-torino; Elegante e con un servizio eccellente, menu abbastanza vario e la carta dei vini un po' scarna. Il locale è accogliente, e il personale cortese. Ambiente accogliente e di design, personale gentilissimo e professionale, porzioni abbondanti e cibo di qualità cucinato con originalità.
https://www.yelp.it/biz/imbarchino-torino; Bello sia di giorno che di sera con buoni vini e buona musica. Ideale per un aperitivo e per ascoltare della buona musica. Ottimo posto per passare una serata o un pomeriggio d'estate.
https://www.yelp.it/biz/imbarco-perosino-torino; La cena è a lume di candela , romantico, ma Nn si vede ciò che si mangia nel piatto. Location suggestiva e festeggiamenti terminati con ottima musica. Per passare una bella serata in compagnia come se foste a casa vostra.
https://www.yelp.it/biz/in-vino-veritas-torino; COnsigliato per una serata tranquilla e casalinga! Luci soffuse, ambiente stretto, bagno in cortile. Una volta c'era un'atmosfera più romantica, ora un po' da famiglia.
https://www.yelp.it/biz/indian-street-food-torino; Sia del prezzo che della qualità e della quantità delle porzioni. Il locale e' proprio piccolo pensato soprattutto per il take-away visto che i posti al bancone sono veramente limitati.
https://www.yelp.it/biz/indiano-shri-ganesh-torino; Locale intimo, musica indiana di sottofondo molto rilassante e personale gentile. Atmosfera romantica, servizio impeccabile, cortesia e piatti deliziosi. Atmosfera romantica, servizio ottimo e soprattutto cibo divino.
https://www.yelp.it/biz/italians-wok-better-torino-3; Ottimo per un pranzo o una cena tranquilla. Unica precisazione: è possibile mangiare comodamente seduti ad uno dei pochi tavoli, ma non vi aspettate di essere serviti.
https://www.yelp.it/biz/japs-torino-2; L'ambiente è curato e molto pulito, dà una ottima impressione generale. Ambiente pulito e moderno, servizio cortese e rapido, cibo inaspettatamente buono. Il locale è piacevole, molto pulito e, x quanto possa essere un sushi bar, anche accogliente!
https://www.yelp.it/biz/john-joy-torino; L'atmosfera del locale é intima con luci soffuse e l'arredamento é molto chic. Posto stupendo elegante raffinato, cucina ottima, servizio eccezionale... Bella atmosfera ideale per una cena a 2 ma anche per una tranquilla cena con amici.
https://www.yelp.it/biz/joys-pub-bari; Ideale per passare una serata tranquilla con amici, spesso allietati da musica Live. Da riprovare in una giornata con musica dal vivo. Infine un avvertimento: in zona il sabato sera si fatica a trovare parcheggio.
https://www.yelp.it/biz/jubin-di-hu-lidan-torino; Il personale è stato gentile e il menù vasto. Volendo con meno di 10 euro si può mangiare in abbondanza... personale gentile Il locale è piccolino ma carino e anche economico.
https://www.yelp.it/biz/karmacola-torino; Luci soffuse, sala ampia per potere chiacchierare tranquillamente senza disturbarsi l'un l'altro, servizio impeccabile. Una serata speciale condita da ottimo cibo. Locale molto carino e a tema come anche la musica e gli odori.
https://www.yelp.it/biz/kashmir-torino-2; Locale piccolo ma accogliente: pulito, condizionato, a tema indiano. Consigliato per passare una serata con amici senza spendere troppo. Un po' lenta la consegna ma era sabato sera, quindi comprensibile.
https://www.yelp.it/biz/kensho-torino; Locale raffinato senza strafare, eccellenza nel servizio. Piacevolissima serata con ottimo cibo in location accogliente. Malgrado fosse sabato sera il servizio è stato eccellente.
https://www.yelp.it/biz/kido-ism-torino; Era una serata romantica a due, a cui lui non era stato invitato! Ambiente raffinato e servizio di ottimo livello. Il locale è intimo (una ventina di coperti) e ideale per una serata a due.
https://www.yelp.it/biz/kiki-torino; Ottimo per una cena romantica: farete un figurone. Pesce freschissimo, gusti originalissimi, personale gentile e simpatico, i sushimen eccezionali, e poi il locale pulito,romantico...insomma...TUTTO FANTASTICO! Locale intimo e non rumoroso ottimo per poter discorrere.
https://www.yelp.it/biz/kipling-torino; Locale pulito ed elegante, personale molto cortese, cibo delizioso. Super consigliato.. ristorante intimo e romantico consigliato per una elegante cena a lume di candela... Locale ben curato, elegante con un personale a modo.
https://www.yelp.it/biz/kokoroya-torino; Locale molto piccolo, ma pulito ed accogliente. Il kokoroya è un luogo piccolo e accogliente. Il locale è molto piccolo ma accogliente.
https://www.yelp.it/biz/kombu-torino; C'era una volta un locale carino, pulito, ben gestito. Il locale è molto carino e a tema, ma la serata non è iniziata benissimo. Kombu è una catena di sushi con un ottimo rapporto qualità prezzo.
