url;review
https://www.yelp.it/biz/kyoto-torino; Ambiente pulito, personale gentile e ampia scelta di piatti. Il locale è carino e pulito, il personale gentilissimo e il cibo davvero buono. La location è molto carina in pieno stile giapu, il locale è pulito e molto curato.
https://www.yelp.it/biz/l-aglio-torino; Oltre a mangiare bene servizio accogliente e atmosfera molto romantica! Il locale è accogliente ed elegante con un servizio cortese. Locale molto carino in zona tranquilla con ampia scelta di parcheggio.
https://www.yelp.it/biz/l-agrifoglio-torino; Ambiente piccolo, curato, non rumoroso e atmosfera rilassante. Il locale è accogliente ed intimo in pieno centro. In settimana il locale non è pieno ed insieme alla pacata musica in sottofondo, crea un connubio rilassante
https://www.yelp.it/biz/l-ancora-torino-2; Una serata romantica, tranquilla, splendida location, pesce freschissimo cucinato bene. per una cenetta romantica o per un piccolo spuntino a colazione. davvero soddisfatto. Locale molto carino, particolare nell'arredamento e gioco di luci.
https://www.yelp.it/biz/l-ancora-torino-3; Rapporto qualità prezzo veramente bassa considerato il conto. Il locale è decisamente carino, arredato con cura ed accogliente. Servizio cortese e attento, personale molto simpatico e discreto.
https://www.yelp.it/biz/l-angolo-divino-torino; La location essendo in Gran Madre e' molto bella con ambiente pulito e giovanile. Un locale piccolo,ma accogliente questo ristorante vicino alla Gran Madre! Cibo di qualità, varietà nel menu e personale gentile.
https://www.yelp.it/biz/l-antico-arco-cellamare; Locale molto piccolo ma bello pulito ordinato, servizio rapido, menù completo con varietà di pizze. Il locale è pervaso dalle urla del personale che sovrastano addirittura il vociare di una pizzeria di sabato sera. Il locale è accogliente e familiare, il titolare é sempre disponibile a giusti consigli e spiegazioni.
https://www.yelp.it/biz/l-birichin-torino-2; Posto molto accogliente con musica di sottofondo per creare la giusta atmosfera per passare una bella serata. Atmosfera romantica con personale cortese, competente e molto disponibile. Ambiente accogliente, pulito, ordinato, luci soffuse, camerieri precisi e puntuali, non invadenti e molto attenti. ...
https://www.yelp.it/biz/l-idrovolante-torino; Era una serata tranquilla, non troppo pieno di gente, il personale è stato cordiale. Perfetto per un pranzo immerso nel verde in riva al Po' o per una cenetta romantica. Location carina, romantica oserei dire, personale squisito, attento, sorridente.
https://www.yelp.it/biz/l-osteria-di-pierantonio-torino; Mercoledì sera musica dal vivo che accompagna. Cenato questa sera, serata piacevole, buona cucina e prezzo ragionevole. Super super consigliato a chiunque....ottimo cibo, ottima cucina, atmosfera simpaticissima ad ottimi prezzi......
https://www.yelp.it/biz/la-badessa-torino-2; Locale elegante e raffinato nel centro di Torino, ideale per una cenetta intima come per un pranzo di lavoro. L'ambiente accompagnato da una musica in sottofondo che ricorda antichi monasteri. locale curato, arredo particolare, sobrio ed elegante.
https://www.yelp.it/biz/la-battigia-di-schiralli-antonio-bari; La location é carina con pesce e bottiglie di vino in bellavista, un pò stile anni '80. Servizio cortese, rapido ed attento. pecse assolutamente freschissimo. prezzi ragionevoli data la posizione centralissima sul lungomare. Il servizio è cortese e i prezzi abbastanza onesti.
https://www.yelp.it/biz/la-botte-gaia-torino; Il locale è intimo, con pochi tavolini. Un locale intimo ed accogliente che offre una gamma interessante di vini e di prodotti regionali. La Botte Gaia è un locale piccolo e intimo, con ottima cucina e una selezine di vini decisamente interessante.
https://www.yelp.it/biz/la-bottega-del-gusto-torino; Renderei l'atmosfera un po' più calda con delle luci soft gialle. Ottima cena alla carta di sabato sera. Il locale è carino, pulito, con un bel dehors.
https://www.yelp.it/biz/la-bufala-torino; Locale deserto il sabato sera, in effetti poteva essere un indizio. Locale carino ma pizza da dimenticare: biscottosa e insipida.
https://www.yelp.it/biz/la-cabane-torino-2; L'idea di un aperitivo si è' trasformata in una cenetta romantica . Atmosfera e servizio accoglienti pochi tavoli ma molto intimo Un sabato sera, un bicchiere di bollicine, due ostriche, due gamberi viola ed uno scampo .. freschissimi.
https://www.yelp.it/biz/la-campana-torino-2; Ambiente piccolo ma pulito, ordinato con personale di sala educato. I camerieri molto gentili.. ma soprattutto il cibo, molto buono e raffinato! Rapporto qualità prezzo abbastanza alto anche senza coupon. 5 stelle di incoraggiamento, dato il punteggio non brillante finora!
https://www.yelp.it/biz/la-cantinella-torino; Locale molto intimo, candela sul tavolo e luci soffuse, personale gentile e molto presente. Locale raffinato ed elegante con personale professionale. bel locale intimo e raccolto, buon cibo e musica di sottofondo. un s.valentino romantico e rilassato
https://www.yelp.it/biz/la-capannina-torino-2; Un buon ristorante elegante e con luci soffuse(per serate romantiche). Sabato sera un po' affollato, ma comunque gestibile. Vale la pena ritornare per i primi o i secondi, magari la sera.
https://www.yelp.it/biz/la-casa-del-demone-torino; Ideale per passare una serata fuori dagli schemi. Locale molto caratteristico personale attento ai dettagli atmosfera dark. Punto in più: chiude molto tardi e permette di passare lì la serata in compagnia!
https://www.yelp.it/biz/la-cecchina-bari; Locale molto elegante e raffinato interno in pietra e arredato con gusto. La cura dei particolari e l'abbinamento ad un servizio cortese e professionale lo rendono accogliente e di atmosfera. Il locale è molto carino e i piatti sono davvero squisiti.
https://www.yelp.it/biz/la-cena-coi-fiocchi-torino; Il locale è elegante, ben organizzato e pulito. Il locale è intimo e molto accogliente. Locale piccolo e almeno la sera assolutamente da prenotare.
https://www.yelp.it/biz/la-cuite-torino; Locale molto intimo, personale educato, cibo ottimo. Location suggestiva in zona tranquilla e lontana dal traffico, piatti ricercati e buon vino. Pochi tavoli ma tanta professionalità, cortesia e simpatia.
https://www.yelp.it/biz/la-drogheria-torino; Il locale è molto carino, i camerieri gentili ma il servizio è molto lento. Il locale è molto carino e in una posizione ottima. Luogo accogliente e ben curato e personale estremamente gentile
https://www.yelp.it/biz/la-fila-torino; Il locale ha tavoli sia all'interno che all'esterno: è un locale abbastanza accogliente e pulito. Ambiente piccolo, molto accogliente, carino, e moderno. Servizio perfetto, tutto lo staff gentilissimo in particolar modo il tailandese.
https://www.yelp.it/biz/la-gaia-scienza-torino; Molto romantico mangiare a lume di candela!!! A lume di candela e sottofondo musicale sempre perfetto! Atmosfera molto romantica, saletta in penombra illuminata solo dal lume di candela.
https://www.yelp.it/biz/la-galina-scannata-torino; Il personale è cortese e gestisce discretamente l'affiollamento del sabato sera. Il locale è piccolo e deliziosamente ricorda nell'arredamento una barca: legni ovunque, particolari a tema e foto di mare. Locale piccolo, personale molto attento e gentile.
https://www.yelp.it/biz/la-granseola-torino; Il locale non è tanto grande ma accogliente. Anche i primi ed i secondi sono di ottima qualità. Ottima la cortesia del personale e l'ambiente è curato e accogliente.
https://www.yelp.it/biz/la-gricia-torino; Servizio adeguato non troppo lento non troppo veloce giusto per chi desiderare trascorrere la serata. Se volete passare una serata in ottima compagnia è il locale adatto con cucina genuina!!! A cena un sabato sera della scorsa settimana...il locale è accogliente e con una posizione ottima, su piazzetta E.
https://www.yelp.it/biz/la-gustosa-torino; Ottimo rapporto qualità prezzo (accettano i ticket anche alla sera) Locale carino e pulito.....buona la pizza , impasto gradevole e croccante. Ambiente piccolo ma accogliente e ospitale, personale molto cortese e disponibile.
https://www.yelp.it/biz/la-limonaia-torino; Locale molto carino e atmosfera intima e accogliente. Locale molto curato, perfetto per una serata romantica e servizio impeccabile. Cibo di qualità, atmosfera ed eleganza hanno reso una semplice cena in una bellissima serata.
https://www.yelp.it/biz/la-locanda-bari; Location suggestiva nel cuore della città vecchia. Atmosfera giusta per trascorrere un evento in tranquillità immersi nel centro storico di Bari!!!!!!!. L'interno del ristorante/dehor é carino ma non elegante ed é giusto cosi: é una locanda!
https://www.yelp.it/biz/la-locanda-del-bollito-torino; Per trascorrere una serata tranquilla e molto intima I pochi tavoli rendono l'atmosfera familiare e leggera. Locale piccolo e molto accogliente, ottimo bollito, gestore molto cortese.
https://www.yelp.it/biz/la-madia-torino; Piccola trattoria dalle luci soffuse e dall'ambiente rilassante, situata in zona Crimea. Elegante e raffinato Pochi coperti e pochi piatti: sinomimo di cura qualità e freschezza. Un locale piccolo ed elegante in pre collina.
https://www.yelp.it/biz/la-magnolia-torino-3; Difficile parcheggiare in zona soprattutto di sabato sera. Il ristorante è pulito con ambiente accogliente il personale è gentilissimo. Poco adatto per una cena tranquilla, più posto da famiglia e riunione di amiconi della compagniia.
https://www.yelp.it/biz/la-monachella-torino; Il locale ha un'atmosfera singolare: luci soffuse, suppellettili stile chiesa, ... Location carina in posizione centrale a Torino. Molto ben arredata e ben curata nei dettagli.
https://www.yelp.it/biz/la-pace-torino; Ambiente accogliente, nel cuore di San Salvario, non alla moda ma un vecchio ristorante tradizionale. Locale carino, muri e soffitti in mattoni a vista (discutibili colonne agli spigoli€), atmosfera calda. Il locale è ampio, l'accoglienza buona, ma prezzi sono medio alti.
https://www.yelp.it/biz/la-pagoda-di-hu-lia-meng-torino; Ambiente davvero tranquillo con musica in sottofondo, elegante, ordinato, pulitissimo. Ambiente pulito e fresco , cucina ottima Il locale è carino e molto pulito.
https://www.yelp.it/biz/la-panzanella-torino; Sia per la pizza che per i primi piatti questo locale, semplice ma accogliente, ci è piaciuto molto. Il servizio è gentile e - forse perchè sono capitato molto presto - velocissimo. Il rapporto qualità prezzo di questo locale è sicuramente ottimo, molto grande, e curato.
https://www.yelp.it/biz/la-parrilla-de-juan-bari; Accompagnato da un'ottima birra per trascorrere la serata. L'atmosfera che si vive in questo locale è piacevole. Pro: servizio veloce anche di sabato sera, si trova posto facilmente.
https://www.yelp.it/biz/la-piramide-torino; Bel localino situato in Via Po, ideale per uno spuntino al volo. Prodotti di qualità ad un prezzo equo, possibilità inoltre di sedersi sotto ai fantastici portici antichi. Locale piccolo, ma dalla posizione centrale e dal personale gentile.
https://www.yelp.it/biz/la-porta-rossa-torino; L'atmosfera tranquilla e rilassata consente di passare una piacevole serata fra chiacchiere e ottimo cibo. L'ambiente pur essendo pulito ed elegante, avrebbe bisogno di una rimodernata. ATMOSFERA: Locale carino, ma nulla di che.
https://www.yelp.it/biz/la-prima-da-moreno-torino; Locale elegante ma sobrio, servizio buono ma soprattutto cucina ottima...
https://www.yelp.it/biz/la-provolina-bari; Per chi vuole passare una serata senza grandi aspettative! Ottimo per una serata da passare in compagnia senza grosse pretese . Se di sabato sera la sala è quasi vuota il motivo c'è..
https://www.yelp.it/biz/la-reseda-torino; è un locale molto raffinato, tranquillo e pulito. Locale carino, molto pulito, non particolarmente d'atmosfera ma decisamente curato. Locale scoperto per caso un sabato sera.
https://www.yelp.it/biz/la-ristonomia-torino; Locale molto raffinato, personale cordiale,attento e professionale. Qualità alta e locale molto carino ed elegante. Il ristorante è davvero carino con arredamento delicato e romantico, atmosfera calda e cucine a vista.
https://www.yelp.it/biz/la-svolta-torino; Ambiente con luci soffuse, romantico e molto carino. Suggestivo il dehor con luci soffuse e piacevole musica. Atmosfera molto bella e particolare a cena (ottimo per cena al lume di candela).
https://www.yelp.it/biz/la-tana-del-polpo-bari; Atmosfera molto easy e buon rapporto qualità prezzo. Localino alla buona con pochi tavoli.....pesce fresco e prezzi contenuti. Per finire una trattoria di mare STREPITOSA per il connubio tra location cibo personale e conto pagato.
https://www.yelp.it/biz/la-taverna-dei-mercanti-turin; Locale accogliente e raffinato a conduzione familiare. Il ristorante è molto carino ma soprattutto pulito. Super consigliato per chi vuole assaggiare i piatti tipici e passare una serata tranquilla in un bel locale.
https://www.yelp.it/biz/la-uascezze-bari; Location suggestiva nel cuore di Bari molto bella e caratteristica. bel locale con piatti tipici del borgo antico bella serata con amici posto veramente tipico personale molto educato Location molto carina, tipica, così come le pietanze.
https://www.yelp.it/biz/la-via-del-sale-torino; Una bella serata in un ambiente accogliente e caldo. Peccato che non sia stata individuata una chiave per dare un'atmosfera giusta che accompagni la cena. Il locale è accogliente e il personale gentile e professionale.
https://www.yelp.it/biz/la-via-della-seta-torino; Locale accogliente con musica soffusa, pulito, cucina molto buona. Ristorante pulito e personale gentile e disponibile. Locale sempre pulito e personale gentile e cordiale.
https://www.yelp.it/biz/la-voglia-matta-torino-6; Il proprietario è simpatico e si prende cura del cliente con gentilezza. I prezzi sono ottimi è c'è un eccellente rapporto qualità prezzo (anzi, la qualità è superiore al prezzo). Giovanni (il proprietario) e' sempre gentile e disponibile, prezzi piu' che giusti e tutto davvero buono!
https://www.yelp.it/biz/laboratorio-comba-torino; Hanno un ottimo rapporto qualità prezzo e sono molto cortesi e disponibili con tutti. Dal punto di vista del rapporto qualità_prezzo, forse in Torino è una tra le più interessanti.
https://www.yelp.it/biz/le-cantine-di-bacco-torino; Il locale è accogliente, arredato con mobili di legno, i tavoli sono rustici e l'atmosfera tranquilla. Atmosfera calda e invitante, menu particolari e prezzi modici Il locale si presenta bene ed il personale è gentile anche se un pò assente.
https://www.yelp.it/biz/le-grand-tabu-bari; Tutto perfetto in qualità e quantità, ciò grazie all'attenzione che Giuseppe e il suo staff dedicano al cliente.
https://www.yelp.it/biz/le-veronique-bari-2; Il locale è molto elegante e raffinato. Ma per una serata tranquilla, in settimana, è molto piacevole andarci. Da consigliare per trascorrere una serata serena.
https://www.yelp.it/biz/le-vigne-torino; Serata tranquilla per mangiare alla piemontese con qualche variazione . Il locale è curato e trasmette un'atmosfera da osteria piemontese elegante ma non pretenziosa. Il servizio ottimo e il cibo delizioso.
https://www.yelp.it/biz/le-vitel-etonne-torino; Locale molto carino, pulito e accogliente con cucina a vista. Appena si entra si è colpiti dalla bella atmosfera e dalla cucina a vista . Locale intimo adatto ad una cena a due,cucina di qualità ,il vitello tonnato era molto buono .
https://www.yelp.it/biz/libery-pizza-e-artigianal-beer-torino; Locale raffinato ed accogliente, personale cortese e premuroso. Servizio veloce per essere sabato sera e locale full. Locale premiato si presenta intimo con pochi tavoli per commensali.
https://www.yelp.it/biz/lo-scugnizzo-torino; Bella l'atmosfera e la musica di sottofondo. Il locale è carino e pulito, ma abbastanza piccolo, i tavoli sono molto vicini tra di loro. Nel cuore del centro di Torino proprio accanto a Piazza Vittorio si può mangiare una buonissima pizza napoletana.
https://www.yelp.it/biz/lo-sfizio-bitritto; Locale piccolo e carino, pulito, coprimacchia di carta, essenziale. Consigliabile a tutti coloro che vogliono passare una serata calda e familiare! Personale altamente professionale e nello stesso tempo un atmosfera calda e accogliente.
https://www.yelp.it/biz/lo-stonnato-torino; Mercoledì sera di ottima qualità dal cibo al personale. Locale molto rumoroso sicuramente non per una cena tranquilla. Sabato sera, cena con amici.. locale particolare e carino ma assolutamente troppo rumoroso.
https://www.yelp.it/biz/lobelix-torino; Consigliato per passare una serata in compagnia. Provato un sabato sera e quindi un bel po affollato. Sabato sera, ore 19 circa, locale abbastanza pieno ma non ancora al top.. ciò avverrà verso le 20.
https://www.yelp.it/biz/locanda-da-betty-torino; Prima sera a Torino e questo posto ci ispirava, per l'atmosfera. Il locale è carino e pulito, il servizio rapido e gentile. Il locale è raccolto e intimo, dall'aspetto semplice e familiare, in pieno centro.
https://www.yelp.it/biz/luce-e-gas-torino-2; Cenato ieri sera in questo bel locale... ottimi i piatti, di buona qualità e gentile il personale... Il locale è carino, ampio ed in stile orientale. Primi piatti medioctri e pizza non eccelsa.
https://www.yelp.it/biz/lunarossa-torino; Ottimo per passare una serata in tranquillità godendosi una buona pizza! Chiude alle 11.30 persino di sabato sera, considerarlo nel caso si voglia mangiare a cena.. Fermati una sera per caso (un altro ristorante nei dintorni aveva già chiuso la cucina...alle 20.30!!!!!)
https://www.yelp.it/biz/m-bun-torino; Ambiente Pulito e ampio con area giochi per i più piccini.Servizio rapido e cortese.Prezzi comparati alla qualità del locale. Personale molto gentile e disponibile, prezzi onesti. L'ambiente è accogliente ed adatto a qualsiasi tipologia di viaggiatore ...
https://www.yelp.it/biz/m-bun-torino-3; Il locale è molto ampio e pulito. Bellissima serata in compagnia, ma la cosa più importante è stata l'ottima cucina! Il locale è molto ampio e pulito ed i posti a sedere sono spaziosi.
https://www.yelp.it/biz/macario-caffe-torino; Locale molto carino nel cuore del Quadrilatero. di sabato sera conviene prenotare e' molto frequentato. Sabato sera a bere qualcosa con amici in questo locale.
https://www.yelp.it/biz/magorabin-torino; Ambiente intimo con luci soffuse e un sottofondo musicale adeguato. Un locale elegante, non tradizionale, a lume di candela, ma per tutti. Sensazione di calore nell'arredamento con musica in sottofondo molto piacevole.
https://www.yelp.it/biz/mamasita-torino; Ottima serata in compagnia di buon cibo messicano! Personale attento ma non invasivo, ti accoglie in questa atmosfera messicana fantastica! Ottimo ristorante per la cucina accurata e saporita e per il locale molto accogliente con grande dehors estivo.
https://www.yelp.it/biz/mamma-mia-torino-2; Buona pizza e servizio rapido anche di sabato sera! L'ambiente è carino, non intimo ottimo per famiglie e gruppi di amici. Ottima accoglienza ricevuta e cortesia del personale, molto buona la pizza, sia al tegamino che al mattone.
https://www.yelp.it/biz/mar-rosso-torino-2; Una serata a lume di candela con una cucina molto particolare. Anche la musica d sottofondo era molto indicata e rilassante! La location è davvero carina, luci soffuse, bellissima atmosfera, così come le sedie e i tavolini.
https://www.yelp.it/biz/marechiaro-torino; Il locale è molto carino e pulito. Certamente l'aspettativa era molto alta e il sabato sera non è proprio una serata indicativa per trarre conclusioni. Il locale è elegante e tranquillo, la qualità del cibo molto buona.
https://www.yelp.it/biz/marhaba-torino; Il personale è gentile e simpatico, disposto a dare consigli anche a chi non conosce questa cucina. Locale non grande ma servizio ottimo e qualità cibo. Locale piccolo con due tavolini di appoggio per consumare piatti della cucina marocchina formato gastronomia.
https://www.yelp.it/biz/martinucci-bari-2; Trovare un posto di sabato sera è praticamente impossibile. Locale raffinato che si affaccia su una caratteristica piazza della Bari vecchia. Il locale è molto carino, proprio in Piazza Mercantile, pulito e con tavoli anche all'aperto.
https://www.yelp.it/biz/masaniello-%C3%A9-turnat-torino; Locale carino, tutto intitolato ad un grande della storia popolare partenopea, Masaniello! Il personale è gentile e giovane, i prezzi non eccessivi, calcolando la posizione.
https://www.yelp.it/biz/master-sandwich-torino; Il locale è piccolino, ma pulito e accogliente. Locale piccolo gestito in maniera tranquilla da due ragazzi. Il personale è molto gentile ed efficiente.
https://www.yelp.it/biz/matti-brown-bari; Raffinati decori africani e musica dal vivo. Staff professionale e ottimo cibo, spaghetti eccellenti! Rapporto qualità prezzo veramente giusto.Bravi bravi ragazzi!!!!
https://www.yelp.it/biz/menupizza-torino; Personale molto gentile , il locale appena ristrutturato , molto pulito e spazioso
https://www.yelp.it/biz/mezzaluna-osteria-torino; Cena molto tranquilla e rilassante con ottima musica di sottofondo e personale cortese. La Musica in sottofondo era gradevole. possibilità di menù per bambini. Il menu degustazione è squisito e il lume di candela ha sempre il suo fascino!
https://www.yelp.it/biz/michi-tanzariello-torino; Personale gentile, proprietario , Angelo, sempre presente e attento. Il personale è molto gentile e cortese. Locale molto grande, ampie sale, ottima scelta di pizze ,la farinata veramente squisita .
https://www.yelp.it/biz/mina-torino; Il locale è elegante e pulitissimo, il bagno nuovo, spazioso, pulito. Un piccolo neo la musica di sottofondo era derivata da una radio locale.... Ristorante carino e pulito con tavolini abbastanza grandi x poter mangiare con tutta comodità.
https://www.yelp.it/biz/mister-hu-torino; Il locale all'interno è molto carino e i camerieri sono gentili. Il locale è carino, un pò caotico, ma l'affollamento faceva pensare ad un ottimo ristorante. La prima impressione entrando è di un locale curato e carino, purtroppo i lati positivi finiscono qui...
https://www.yelp.it/biz/mixer-bar-di-figliolia-m-torino; Personale gentile, è un bar che offre tutti i servizi di un esercizio di questo tipo.
https://www.yelp.it/biz/moderat-bari; Locale accogliente ed elegante, frequentato per lo più da giovani, personale educato e gentile. Buoni sia i primi che i secondi piatti e prezzi giusti.
https://www.yelp.it/biz/moka-torino-2; L'ambiente è piccolo ma abbastanza moderno ed elegante, rendendolo un luogo ideale per passare un aperitivo durante la giornata.
https://www.yelp.it/biz/monte-dei-cappuccini-torino; Ottimi gli antipasti: flan di carciofi con bagna caüda veramente ottimo. Il personale inoltre è molto gentile ed il servizio veloce Camerieri molto gentili e disponibili, cibo davvero ottimo.
https://www.yelp.it/biz/mr-rooster-torino-3; è vero è sabato sera, è vero c'è gente ma se non riesci a evadere gli ordini Fermati. ottima Ottima cucina ottima accoglienza un personale molto cortese pronto a risolvere qualsiasi problema del cliente.
https://www.yelp.it/biz/murphys-pub-torino; Il tutto con buona musica e possibile visione delle partite di calcio! Ideale per vedere sport in televisione o per passare una serata in stile irlandese. Personale gentile e disponibile ottima l'offerta delle birre, la cucina e la musica adatta ad un pub.
https://www.yelp.it/biz/napples-torino; Locale molto carino nel cuore della movida torinese. Locale molto carino e molto affollato nonostante fosse lunedì sera. Locale splendido dall'atmosfera calda e informale, pizza napoletana e fritti al top, personale gentile.
https://www.yelp.it/biz/napul-e-bari; Il locale è carino, ben tenuto e molto pulito, l'atmosfera è piacevole. fantastica atmosfera personale attento ed educato grande pizza!!!! Locale accogliente e silenzioso e personale gentile.
https://www.yelp.it/biz/nishiki-torino; Ambiente pulito e personale accogliente e molto gentile. Posto carino e pulito, servizio abbastanza veloce, personale gentile. Sembra pulito e il personale è molto gentile e simpatico.
https://www.yelp.it/biz/nouvel-vis-a-vis-modugno; Eccellente rapporto qualità prezzo e per chiudere, personale molto gentile. ristorante carino accogliente e caloroso. ottima cucina servizio discreto un po troppo caldo all interno per la stagione . Il locale é accogliente e ricorda le trattorie di una volta.
https://www.yelp.it/biz/nuova-dezzuto-torino; Locale molto elegante, pasticceria raffinata, cappuccino delizioso,purtroppo personale poco attento. Personale educato, locale molto trendly ed elegante. Cortesia e professionalità in un Ambiente accogliente e raffinato.
https://www.yelp.it/biz/nuovo-fizzarotti-bari; Locale raffinato e particolare, molto intimo, personale gentile e riservato. Il locale è elegante ma originale nel suo stile, molto intima come atmosfera, personale gentilissimo e discreto. L'atmosfera del locale è piacevole, rilassante e discreta.
https://www.yelp.it/biz/o-raffertys-pub-torino; Il personale è gentile e l'atmosfera era piacevole e lo ha fatto servire cibo. Locale accogliente, personale gentile e birra buona. Il servizio è ottimo e la cameriera davvero gentile e disponibile.
https://www.yelp.it/biz/oinos-torino; Locale molto intimo ideale per le coppie. Ambiente pulito, ordinato elegante, mangiato pasta con pesto alla siciliana, capesante, polpo e sushi in versione siciliana. Il locale è elegante e bello, il personale cordiale e professionale.
