url;review
https://www.yelp.it/biz/paco-torino; Indicatissimo per trascorrere una serata in compagnia, atmosfera calorosa e frizzante, ci si sente subito a casa. Una bella serata dal gusto e calore Messicano. Il cibo è ottimo e la location molto particolare, ma a rendere veramente speciale il Paco è lo staff!
https://www.yelp.it/biz/panino-giusto-torino; unico neo troppo vicino allo juventus store...FORZA FROSINONE!! Peccato per il personale che non sempre è così cortese. molto gentile e disponibile€e poi le attese lunghe e spesso senza motivi ...peccato.
https://www.yelp.it/biz/panperfocaccia-torino-2; Ottima pizza, buon vino, servizio abbastanza veloce anche quando il locale e  pieno. Però camerieri molto gentili e cibo buono, soprattutto le pizze, le orecchiette e gli antipasti. Personale gentile ma tempi di attesa troppo troppo lunghi.
https://www.yelp.it/biz/pasta-mon-amour-torino; decisamente di buona qualità. prezzi medi. servizio veloce e cordiale. contesto che si presta tranquillamente a cenette intime. Menù ricco, piatti gustosi e di qualità, portate generose. Localino davvero ideale se si vuole gustare una cenetta romantica a lume di candela,soprattutto se per un anniversario.
https://www.yelp.it/biz/pastamaneria-torino; Prezzi abbordabili Nel complesso è un bel posto per provare della pasta veramente buona fatta in casa. Prezzo discreto vista la qualità del cibo Piccolo locale molto semplice in cui gustare ottimi primi piatti tradizionali a prezzi più che accettabili.
https://www.yelp.it/biz/pasticceria-amore-torino; Aperitivo molto ricco con stuzzichini di qualità eccellente e personale molto gentile. Buona scelta di brioches, bomboloni e ciambelle. Il tutto di ottima qualità, servito da personale cortese.
https://www.yelp.it/biz/pastificio-defilippis-torino; Il personale è molto cortese e la varietà di proposte è notevole... ovviamente offre vini e pietanze del luogo. Locale molto carino nel cuore di Torino, ottimo il servizio, personale molto gentile. Pasta fatta in casa davvero di ottima qualità.
https://www.yelp.it/biz/peperosso-torino; Per un pranzo di lavoro o una cenetta romantica. Locale accogliente, servizio cordiale e disponibile, qualità del cibo ottimo. Ristorante molto buono soprattutto qualità prezzo da raccomandare il titolare molto simpatico Personale gentile
https://www.yelp.it/biz/pepino-torino; servizio veloce e professionale,paziente soprattutto con i bambini a volte indecisi ma entusiasti di tanta bontà!!! Personale gentile e simpatico, senza fretta il servizio. Locale molto carino, si tratta di una gelateria nella quale bisognerebbe tornare a primavera inoltrata per provare il gelato.
https://www.yelp.it/biz/perbacco-bari; Il locale è davvero carino, molto intimo e familiare, la qualità del cibo ottima, il personale cortese. Il tutto condito da un servizio impeccabile. Il locale si presenta piccolo ma accogliente e molto silenzioso, solitamente con musica leggera in sottofondo.
https://www.yelp.it/biz/piano-b-torino; Bella location, con ampi spazi e possibilità di utilizzare il wi-fi. Locale carino, rumoroso il piano superiore adatto piu' a gruppi. Impasto molto leggero digeribile ottima qualità da tornare sicuramente, personale simpatico e disponibile...locale spazioso e originale
https://www.yelp.it/biz/piola-cianci-torino; Da non consigliare a famiglie con bambini o per serate tranquille. Personale cordiale e veloce con bassi tempi di attesa. Ottima qualità-prezzo, ma il mangiare resta appena sufficiente.
https://www.yelp.it/biz/pippo-paranza-torino; Può essere non semplice trovare parcheggio specialmente il venerdì e sabato sera. Da fuori sembra un locale carino stile marinaro....entri ed è freddo e piuttosto trasandato. Il personale è stato gentilissimo e il servizio veloce.
https://www.yelp.it/biz/pizza-ad-hoc-torino; Servizi igienici ampi, puliti ed in ordine (anche se ce n'è uno solo). Impasto e qualità veramente ottima della pizza! Locale carino ed accogliente e i prezzi sono giusti.
https://www.yelp.it/biz/pizza-pistrocchio-torino; Locale spartano personale gentile e disponibile, servizio velocissimo e pizza di gran qualità. Il personale è sempre cortese e pronto a soddisfare ogni richiesta. Perfetto per serate fra amici e con la famiglia.
https://www.yelp.it/biz/pizza-speedy-torino-2; Ottima la pizza , la farinata , e gli ingredienti . Ottima pizza e buon servizio di asporto.
https://www.yelp.it/biz/pizza-speedy-torino-3; Dovuto all'ottima pizza e anche al personale estremamente cortese.
https://www.yelp.it/biz/pizzeri-lapislazzulo-torino; Il personale è gentile e accogliente, il clima familiare. Locale tranquillo non molto grande Personale gentile Pizza buonissima con anche gusti un po particolari Pizza sottile e gigante! Personale gentile, disponibile e sorridenti che mettono allegria.
https://www.yelp.it/biz/pizzeria-aladino-bari; Pizza buona e locale accogliente, meglio prenotare se si è numerosi. Ottima la pizza in questo ristorante, incredibili gli antipasti sia per qualità che per quantità. Ottima la qualità ed il prezzo fate voi.........
https://www.yelp.it/biz/pizzeria-amalfi-torino; Comunque posto accogliente anche per famiglie e amici con cani. E' un buon risto/pizzeria con una buona scelta di piatti e quelli di pesce sono molto interessanti. Personale cordiale, ottima pizza al mattone dai freschi ingredienti e dalla leggerezza indescrivibile..
https://www.yelp.it/biz/pizzeria-au-lapin-agile-torino-2; Oltretutto è un locale tranquillo con ampi spazi ed accogliente. La zona è tranquilla e non è neppure stato difficile trovare parcheggio. Il servizio è stato impeccabile, le sale sono molto belle, pulite ed eleganti, non si direbbe a giudicare dall'ingresso.
https://www.yelp.it/biz/pizzeria-baraonda-bari; Ottima pizza ed impasto leggero e ben lievitato. Gli antipasti semplici ma gustosi e l'ottima pizza fanno di questo locale una splendida conferma...insomma...tutto buono! Gli ingredienti sono sempre freschi e l'estate si può gustare la pizza al fresco e soprattutto in relax :)
https://www.yelp.it/biz/pizzeria-bella-vita-torino; Tutto il cibo era ottimo, gradito anche dai bambini. Con i bimbi piccoli non si ha a disposizione tutto quel tempo per pizza e chiacchere con la nutella. I prezzi sono veramente bassi (anche senza coupon). ll personale è gentile e disponibile.
https://www.yelp.it/biz/pizzeria-continental-pizzorante-bari-2; Ambiente raffinato ma al tempo stesso familiare, la cortesia discreta d'altri tempi dei camerieri, la pizza ottima. La Sfiziosa è davvero una pizza eccezionale. Anche una nota positiva va fatta al personale cordiale e gentile sempre pronto a soddisfare ogni richiesta!
https://www.yelp.it/biz/pizzeria-da-donato-bari; Trovare parcheggio in zona però è un'impresa. Ottima anche la scelta delle birre artigianali. Si sente che gli ingredienti utilizzati sono di ottima qualità.
https://www.yelp.it/biz/pizzeria-da-michele-torino; Il locale è piccolo ma ha un'atmosfera familiare e cordiale I proprietari ed il personale: simpatici e cordiali come sempre. La qualità del cibo e delle pizze rimane sempre buona ma assolutamente non paragonabile con il conto finale.
https://www.yelp.it/biz/pizzeria-di-cosimo-bari; La qualità dei prodotti è molto buona e la scelta molto varia. Personale cortese e gentile, Giacomo (il più anziano della famiglia) ha sempre un sorriso per tutti. La sala è ben curata e il personale è molto gentile.
https://www.yelp.it/biz/pizzeria-divina-bari; Piatti tipici della cucina pugliese di ottima qualità , nonchè pizze della tradizione barese con ingredienti freschi e di stagione.
https://www.yelp.it/biz/pizzeria-dual-torino; Personale gentile e professionale e paziente con i bimbi. Unico neo è la difficoltà di trovare parcheggio vicino, ma ne approfitteremo per fare una passeggiata! Un locale simpatico ed una buona scelta di pizze e di piatti nel menu.
https://www.yelp.it/biz/pizzeria-enzo-e-ciro-di-fraddosio-v-c-bari; Il locale si trova in una via centrale di Bari, ma con il dramma del parcheggio in città. Ottima la pizza e i medaglioni che fanno qui!! La pizza era molto squisita impasto ottimo e prodotti eccezionali.
https://www.yelp.it/biz/pizzeria-fratelli-la-bufala-torino; Vero relax per chi ha bimbi piccoli ma anche per chi non ne ha, avendo spazi separati e dedicati. Locale molto ampio (ttimo per i bambini), pizza buona, personale cortese e prezzi buoni. Se si hanno bimbi e si vuole passare una serata tranquilli c è l area bimbi con animatrice.....
https://www.yelp.it/biz/pizzeria-giampy-di-mazzola-giuseppe-torino; Si fatica a trovare il parcheggio nel week end ma ci vuole un po di fortuna.Consigliato Locale molto carino sia la parte fuori che dentro e curato nei dettagli. Come sempre cortesia del personale e sobrietà di ambiente regalano tranquillità.
https://www.yelp.it/biz/pizzeria-gino-torino; Nonostante la sala piena il servizio è veloce e cortese. Pizza super buona e ottima scelta delle materie prime ! Il rapporto qualità prezzo è ottimo e il personale molto gentile e disponibile.
https://www.yelp.it/biz/pizzeria-la-sacrestia-torino; Il locale è davvero carino e ben decorato.
https://www.yelp.it/biz/pizzeria-poldo-torino; Servizio ottimo e rapido, prezzi giusti, farinata e pizze buone. Il servizio è veloce, il personale gentile. Allora : il personale è educato e professionale, gentile con la clientela e veloce nel servizio.
https://www.yelp.it/biz/pizzeria-silvestro-torino; Ospitali e cordiali con i bimbi piccoli. Servizio molto veloce e personale cortese, inoltre il locale è molto carino. Il cibo e' sempre ottimo e chiacchiere e focaccia sono SUPER!
https://www.yelp.it/biz/pizzeria-tarantini-al-cancello-rotto-bari; Buona cucina locale che offre pesce freschissimo. Il personale è efficiente, cortese, professionale e ben preparato. Ottimo ristorantae con vasta scelta tra pizza carne pesce e primi piatti ottima cucina personale gentile.
https://www.yelp.it/biz/pizzeria-vecchia-londra-torino; Il personale è gentile ed il servizio veloce. Caratteristico pub birreria con piatti caldi di buona qualità a prezzi modici. Il personale è gentile e il servizio abbastanza veloce.
https://www.yelp.it/biz/pizzeria-vecchio-forno-garibaldi-torino; Un po meno facile e trovare parcheggio nei dintorni. Il locale è piccolo ma il personale è sempre gentile e discreto. Locale accogliente e curato, servizio cordiale e ottimo cibo!
https://www.yelp.it/biz/platti-torino-2; Locale elegante e raffinato e personale gentilissimo e disponibile. E una buona scelta anche per il pranzo con piatti della tradizione o insalate leggere. Il 'Platti è un locale elegante, con ampia sala, frequentato da gente bene.
https://www.yelp.it/biz/poormanger-torino; Scortesi e poco disponibili con le famiglie con bambini. Prezzi onesti e personale cordiale e gentile. Il personale é cordiale, professionale e attento al cliente dal momento dell'ingresso fino al momento del conto.
https://www.yelp.it/biz/porcaloca-torino; Buon punto di riferimento per una serata tra amici anche con bimbi piccoli. Nonostante fossimo piuttosto numerosi e il locale fosse pieno il servizio è stato abbastanza veloce. Prezzi onesti e personale gentile, infatti è sempre piena!
https://www.yelp.it/biz/porto-di-savona-torino; Personale cordiale e pronto a consigliare ed a spiegare i vari piatti. Il cibo è ottimo, l'atmosfera è romantica tipica della tradizione torinese, il personale molto gentile Locale gradevole, servizio cortese, cucina ottima e prezzi corretti.
https://www.yelp.it/biz/premiata-osteria-dellhermada-torino; Il locale é molto familiare ed accogliente, un atmosfera che ricorda molto un'osteria o una locanda. Cucina molto curata in un ambiente più che accogliente. Buona scelta nel menù e presenza cordiale e professionale di personale giovane e volenteroso.
https://www.yelp.it/biz/prima-e-poi-torino; Il locale è carino ed in centro a Torino. La pizza poi è veramente buona è leggera. Inoltre anche una buona scelta di primi sfiziosi.
https://www.yelp.it/biz/quattro-soldi-torino; Il locale è carino ed il servizio velocissimo, conto in due con acqua e caffè 55€ Il ristorante ha un'ampia offerta di piatti e pizze di ottima qualità, il personale è molto cortese e cordiale. In generale il servizio è veloce e piacevole.
https://www.yelp.it/biz/quelli-che-ben-pensano-torino; Servizio veloce, pizze molto buone e locale abbastanza familiare ed informale. Ottima la qualità del cibo, pizza buonissima e personale gentile e professionale. Buona la birra alla spina rossa servizio velocissimo e personale gentile!
https://www.yelp.it/biz/re-vittorio-bari; Il locale è carino ed il personale gentile e accogliente.
https://www.yelp.it/biz/ristopizza-giampaolo-bari; In sintesi bel locale, personale cortese e disponibile, cibo tutto buono, compreso la pizza, e prezzo nella norma. Bella la location e la Scelta delle luci ovattate! Il locale è gradevole e caratteristico, di aspetto un po' rustico.
https://www.yelp.it/biz/ristorante-consorzio-torino; Il locale e' accogliente, il menu' comprende specialita' locali preparate con cura e molto buone. Buona la scelta , ottima la stagionalità . La cucina è ispirata alla tradizione piemontese ma con l'intrusione piacevole di alcune materie prime provenienti da altre regioni.
https://www.yelp.it/biz/ristorante-lo-scoglio-da-vito-bari-2; Menù ampio basato su piatti di pesce di ottima qualità. Buona scelta di piatti fra antipasti, primi, secondi e dessert, anche fuori menù. Il locale è elegante, il personale cortese.
https://www.yelp.it/biz/ristorante-peppino-torino; Il personale è cordiale e la qualità del cibo comunque discreta. Personale gentile, tempi rapidi, prezzi nella media. Locale carino zona quadrilatero molto frequentato da avventori stranieri.
https://www.yelp.it/biz/ristorante-ratatui-torino-2; Ambiente accogliente, conduzione familiare ma di qualità. Il locale è molto carino, caratteristico, trattoria dall'aspetto familiare. Si mangia bene e l'atmosfera è quasi familiare, gestione semplice e molto cordiale.
https://www.yelp.it/biz/ristoranti-sardegna-torino; Il locale è carino e spazioso, il personale cordiale e disponibile. Lo chef è molto gentile e disponibile a spiegare i suoi piatti tipici . Il locale è accogliente,la cameriera è stata molto gentile e rapida.
https://www.yelp.it/biz/ristoranti-taverna-delle-rose-torino-2; Sicuramente un bel posto, accogliente, caldo e con la giusta attenzione al cliente. Menù ricco è vario, scelta ampia in grado di soddisfare i gusti di tutti. Prezzi un po' alti ma giustificati dalla buona qualità del cibo e dalle porzioni generose.
https://www.yelp.it/biz/ristrot-guviol-torino; Il servizio è molto professionale e piacevole, con estrema attenzione alle necessità di ogni cliente. Il personale cortese, attento alle esigenze del cliente! Il locale è molto accogliente e arredato con gusto.
https://www.yelp.it/biz/roar-roads-torino; è molto più di un pub: ottima cucina con scelta di primi, secondi e dessert. Ci sono venuta spesso perché la qualità del cibo era meritevole.. Servizio rapido e adeguato all'ora di pranzo. personale gentile e cortese.
https://www.yelp.it/biz/rossopomodoro-torino; Ingredienti di buona qualità ma pizza totalmente cruda. La barista è una ragazza molto carina gentile e professionale. Personale gentile e disponibile, simpatici i camerieri.
https://www.yelp.it/biz/sandrino-bari; Bel locale e personale gentile e con sorriso h24! PS anche in passato altro personale non è mai stato molto accogliente Lo staff accogliente e gentile è sempre pronto a soddisfare ogni richiesta del cliente.
https://www.yelp.it/biz/sandrino-bari-2; una valida alternativa a Martinucci per quanto riguarda il gelato nel centro storico ingredienti freschi e di qualità consigliato
https://www.yelp.it/biz/sen-mi-ya-torino-2; Sushi di buona qualità con formula all you can eat! Il personale era più o meno cordiale (molto disponibile la ragazza). La qualità del cibo è peggiorata molto rispetto a una volta.
https://www.yelp.it/biz/seven-up-torino; Lo staff molto gentile e disponibile, accurato alle esigenze del cliente. Prezzo onestissimo, quanto la simpatia del servizio. Ambiente confortevole e personale accogliente e molto gentile.
https://www.yelp.it/biz/sfashion-cafe-torino; Camerieri gentili e cibo all'altezza, ottimo rapporto qualità prezzo. Locale molto carino e nel pieno centro di Torino. Servizio veloce ed efficiente, personale molto gentile e garbato, cibi ottimi.
https://www.yelp.it/biz/sibir-torino-2; Bel locale, spazioso e arredato senza eccessi. Complimenti al personale molto gentile e disponibile. Il personale gentile e disponibile anche nella spiegazione delle portate.
https://www.yelp.it/biz/siciloso-torino; Il locale è carino, ma il personale disorganizzatissimo. U bel posto, con un arredo originale, tavolini comodi, belle luci, un bel bancone e persone simpatiche. Quanto alla location il locale è molto carino e ben curato, personale gentile.
https://www.yelp.it/biz/sicomoro-torino; Il ristorante è molto elegante e il personale cordiale. Locale carino, personale gentile, ma pizza assolutamente normale, nulla di eccezionale. Locale carino ed accogliente, anche le pizze sono buone.
https://www.yelp.it/biz/silvano-torino-2; Bel locale situato non proprio in centro ma comodo per arrivarci. Locale carino, comodo per una pausa caffè, il gelato merita una fermata ma se siete in zona. Il locale è carino e anche le panche all'esterno per sedersi.
https://www.yelp.it/biz/singapore-torino; Il locale è abbastanza grande, nel weekend è meglio prenotare! Personale cordiale, servizio veloce, cibo cinese di ottima qualità e prezzi bassi. Del servizio non ci si può lamentare:il personale è gentile e i piatti arrivano subito.
https://www.yelp.it/biz/sotto-la-mole-torino; Posizione fantastica ..veramente sotto la Mole Antonelliana! Locale carino ma sopratutto cena eccellente con piatti tipici di altissima qualità. Ottima la cucina: un ottimo rapporto tra qualità e prezzo.
https://www.yelp.it/biz/soul-kitchen-torino; Il servizio è ottimo, con personale molto gentile e attento. Locale molto carino, posto tranquillo, personale cordiale e disponibile. Il locale è molto carino, il servizio a tavola e del personale nonchè i piatti sono molto ricercati.
https://www.yelp.it/biz/soup-e-go-torino; Locale molto molto carino, piccolo ma, in realtà, spazioso (ha posto sia dentro che fuori). Formula ideale per un pasto self service di buona qualità con insalate fresche e verdure. Locale curato e personale gentile, cibo preparato con cura.
https://www.yelp.it/biz/spada-reale-torino; Bel locale, personale gentile, piatti buoni con un prezzo in linea alla città. Personale disponibile e piatti di buona qualità. Il personale è stato molto gentile e disponibile a spiegare i piatti tipici.
https://www.yelp.it/biz/spaghetteria-70cento-bari; Il personale è cortese e disponibile, si respira un'aria familiare ormai difficile trovare! Spaghetteria nel centro di Bari locale accogliente forse solo un po' freddo, servizio perfetto e veloce. Personale molto gentile e disponibile e piatti di spaghetti abbondanti.
https://www.yelp.it/biz/sushitao-bari; Il locale è molto pulito e il cibo ottimo. Cibo ottimo, camerieri gentilissimi e soprattutto simpatici e disponibili. Locale molto grande in cui è abbastanza facile trovare posto senza prenotazione.
https://www.yelp.it/biz/t-bone-station-torino; Ambiente caldo e accogliente , personale qualificato e presente, servizio rapido e pietanze gustose e invitanti. Carne di ottima qualità, antipasti molto buoni. Il locale è molto grande e ben arredato, il servizio molto veloce e il personale cortese.
https://www.yelp.it/biz/taiki-bari; In settimana servizio veloce e qualità eccellente. Tantissima varietà di roll e piatti tradizionali giapponesi accompagnati da un servizio ottimo e veloce. Ottima qualità, personale impeccabile e qualificato, location accogliente, preparazione del sushi goduriosa sia alla vista che al palato.
https://www.yelp.it/biz/taverna-delloca-torino; Locale carino e accogliente,personale gentile e preparato. Locale accogliente, il personale da quanto necessario per sentirti coccolato e bene. Prezzo adeguato alla qualità del cibo e personale molto gentile.
https://www.yelp.it/biz/taverna-rossa-di-zappia-pasquale-torino; Il personale è molto gentile, disponibile e il locale è molto carino.
https://www.yelp.it/biz/teapot-torino; Atmosfera familiare molto calda con personale accogliente. Situato a TORINO questo locale presenta un location davvero unica, familiare, ma soprattutto di grande gusto e sapore! Il locale è carino, le seggiole tutte diverse e le teiere sugli scaffali rendono particolare e familiare il locale.
https://www.yelp.it/biz/the-bakery-torino; Personale gentile anche se un po con la testa rra le nuvole. Il locale è molto carino e la vetrina ti ispira sin da subito e ti fa decidere di entrare. Sono venuta qui spesso per il pranzo ed è sempre un piacere: posto piacevole e personale cordiale.
https://www.yelp.it/biz/the-egg-torino; Locale elegante con bella cucina a vista. Un'ottima scelta per una pausa pranzo vicino all'ufficio. Lo chef e lo staff presenti durante la cena ma non invadenti cibo ottimo.
https://www.yelp.it/biz/the-stuart-pub-bari; Il locale è molto carino e il personale veramente qualificato. Il personale è molto cordiale e i titolari affabili e simpatici! Gestito da personale accogliente, cordiale, giovane ed attento.
https://www.yelp.it/biz/tiella-bari; Locale molto carino,luci giuste,sedute comode.In questo periodo si trova agevolmente parcheggio lì vicino!! Prezzi davvero convenienti rispetto a quantità e qualità del cibo. Locale caldo e accogliente, ottimo servizio per gentilezza e disponibilità.
https://www.yelp.it/biz/tobiko-torino; Il servizio è impeccabile e disponibile per ogni dubbio o richiesta . Qualità del sushi molto alta e personale gentile ma non invadente. Il personale è gentile e discreto .
https://www.yelp.it/biz/tommy-tegamino-torino; Posto carino e personale gentile ed efficiente. Locale accogliente e personale gentile e disponibile. La pizza era molto buona così come gli ingredienti di ottima qualità.
https://www.yelp.it/biz/toscano-torino-3; Ottima cucina toscana in un posticino carino. Personale molto gentile e ambiente semplice da vera trattoria. Il cibo è di ottima qualità e molto buono.
https://www.yelp.it/biz/trattoria-alba-torino; Il locale è accogliente e l'atmosfera è familiare. Ottima anche la pizza, sia per impasto che per le salse. E questo è un buon segno di qualità del cibo.
https://www.yelp.it/biz/trattoria-da-cinzia-torino; Ambiente accogliente , semplice e molto familiare. Trattoria con piatti tipici abruzzesi e non , cucina semplice ma buona, prezzo nella media €..da provare Alcuni buoni piatti tipici abruzzesi, oltre alle varie solite pietanze, La proprietaria è simpatica e alla mano.
https://www.yelp.it/biz/trattoria-mombercelli-di-antico-elena-torino; Esperienza molto tranquilla in un bel posto, un piccolo gioiello nascosto dal centro. Cucina molto buona e semplice con piatti della tradizione piemontese e non. Locale piccolo ma molto pulito e accogliente.
https://www.yelp.it/biz/trattoria-piemontese-torino; Locale ampio con mattoni rossi a vista e seggiolini in legno che sanno molto di rustico. Trattoria/ ristorante di buona qualità, con prezzi interessanti e cortesia del caso. Peronale: gentile e disponibile, sempre attenti ad ogni esigenza.
https://www.yelp.it/biz/trattoria-spirito-santo-torino-2; Unico neo, scarso parcheggio nei dintorni, ma non si può pretendere in via Guido Reni!!! Il locale è accogliente, con le vetrine presentate molto bene. Materie prima buona qualità anche se aggiungerei più gusti di frutta.
https://www.yelp.it/biz/trattoria-torricelli-torino; L ambiente e' sempre accogliente e familiare e il servizio e' gestito in maniera garbata e simpatica. L'ambiente è molto curato e pulito, il personale gentile e disponibile. Ottima cucina ambiente sobrio ma di classe.
https://www.yelp.it/biz/tre-galline-torino-2; Il cibo è spettacolare: rispetta perfettamente la tradizione piemontese con leggero tocco di modernità. Servizio impeccabile, a partire da Leonardo, attenzione,cura e dedizione rendono questo posto speciale. Menù importante essendo tutti piatti tipici, anche impegnativi.
https://www.yelp.it/biz/turet-torino; Aperitivo al piano superiore ricco e di ottima qualità. Servizio professionale e molto simpatico il personale. Oltretutto i camerieri non sono stati gentili.
https://www.yelp.it/biz/urban-bari; Location molto accogliente con luci calde e ampi spazi. però il servizio è accogliente e personale gentile. Il locale è davvero accogliente e il personale gentilissimo.
https://www.yelp.it/biz/vale-un-per%C3%B9-torino; Cucina molto buona coi piatti tipici Peruviani.
https://www.yelp.it/biz/vanilla-torino; Il personale è cortese, cordiale e simpatico :) Si sente subito che il gelato è di ottima qualità, con una consistenza cremosa e gusti originali. Gelato di ottima qualità e grande cortesia del personale.
https://www.yelp.it/biz/vitelloni-torino; Locale carino e con area giochi dedicata ai bimbi. Il locale è adatto a famiglie con bambini ed è prenotabile online. Bel posto per passare una serata con i bambini.
https://www.yelp.it/biz/vo-torino; Personale gentile, preparato e servizio di alto livello, tavoli ampi e spazio adeguato tra di essi, corretta l'illuminazione. Il personale molto gentile vi consiglierà qualche buon piatto. L'ambiente e' accogliente e rilassante adatto ad una cena romantica ma anche ad una colazione di lavoro.
