url;review
https://www.yelp.it/biz/%C3%A8-cucina-cesare-marretti-torino; Il menu è impostato con gli ingredienti più freschi possibili.
https://www.yelp.it/biz/500-calorie-torino; Il locale è carino, l'idea è originale, il personale è cortese. Posto molto carino e con personale gentile. E' un piccolo ristorante con personale cordiale di aspettare.
https://www.yelp.it/biz/a-casa-di-pulcinella-torino; Questa e' l'essenza di questa pizzeria : ottima pizza , grazie ad ottimi prodotti . Servizio veloce , staff cordiale e super efficiente ....ma attese per sedersi INFINITE ...4 stelle. Il locale è il luogo perfetto per passare una serata in famiglia !
https://www.yelp.it/biz/a-picciridda-torino; Locale molto gradevole, sempre molto pieno di persone, ma il servizio è molto efficiente. Il personale è molto cortese e il locale accogliente. Il personale è molto gentile ed accogliente, con un bel sorriso.
https://www.yelp.it/biz/a-vucciria-torino; Personale simpatico e premuroso Locale carino e adatto ad ogni evento.. Unica nota bella della serata è stato il bravissimo e simpaticissimo cantante. Il locale è pulito e i camerieri sono molto gentili.
https://www.yelp.it/biz/a6-sciamadda-torino; Il servizio è molto veloce e il sorriso non manca mai rendendo il tutto ancora più piacevole. Si mangia da dio e il servizio è impeccabile. Personale gentile e simpatico (caffè e amaro rigorosamente genovese offerto dalla casa).
https://www.yelp.it/biz/adonis-torino; Unico neo:curerei un po' di più il locale, cheè piuttosto anonimo. Locale carino e cibo diverso dal solito. Un locale piccolo ma carino e personale molto gentile.
https://www.yelp.it/biz/ai-4-assi-di-sanna-roberto-torino; Locale spazioso e molto pulito .Il personale è gentile e il servizio veloce.Ottimo rapporto qualità prezzo! Il locale è carino, soprattutto il dehor, ma purtroppo la qualità  lascia molto a desiderare. Il personale è sempre gentile ed efficiente, i prezzi sono giusti..per cui non so proprio che aggiungere...provatela.
https://www.yelp.it/biz/al-111-bari-2; Cibo di buona qualità nel rispetto della stagionalita e località. Prezzo ottimo per la qualità del cibo. Bella location, buon servizio e molta cordialità.
https://www.yelp.it/biz/al-bicerin-torino; Bel locale molto piccolo, storico in centro... buona cioccolata al bicerin caratteristico. L'atmosfera che si respira nel piccolissimo locale è decisamente piacevole grazie anche al personale gentile e professionale. Servizio impeccabile ma manca l'attrazione che giustifichi la fama e la spesa
https://www.yelp.it/biz/al-cacimperio-torino; Potete trovare parcheggio piu' facilmmente nel vicino Corso Galileo Ferraris. Locale elegante, cantina ben fornita, ottimo per cene in coppia o di lavoro. Buona scelta di antipasti e primi , nella media.
https://www.yelp.it/biz/al-savoia-bari; Forse un tempo era un riferimento per qualità e cortesia ma ora non più.
https://www.yelp.it/biz/al-sorso-preferito-bari; Il cibo è ottimo e il servizio impeccabile. Anche questa volta il ristorante Al sorso preferito si è dimostrato all'altezza.... ottimi antipasti e fantastica cucina. Servizio impeccabile: personale gentile, simpatico e sempre attento alle esigenze del cliente.
https://www.yelp.it/biz/al-tegamino-moncalieri; Conto molto elevato rispetto alla qualità del cibo, locale carino e personale molto cortese. Il locale è carino, ma per il resto niente di che! Il locale è carino ma non molto di più, i posti sono piuttosto scomodi.
https://www.yelp.it/biz/ala-torino; Un ottima trattoria per passare la serata! Ci si sente casa Menù molto ricco, cordiali e gentili. Il personale è stato gentile, il servizio abbastanza veloce, i piatti squisiti.
https://www.yelp.it/biz/alberosole-bari; Ristorante molto carino con ambiente accogliente, con soffitti alti in pietra viva, e atmosfera con luci soffuse... Locale non molto grande ma ben ristrutturato e belle volte in pietra. Servizio impeccabile e atmosfera tranquilla, nel centro storico di Bari.
https://www.yelp.it/biz/alberto-marchetti-torino; Personale abbastanza gentile ed attento alle esigenze del cliente. Ottima gelateria nel centro di Torino con ingredienti naturali e personale gentile. Servizio ottimo e personale molto gentile, cordiale e disponibile.
https://www.yelp.it/biz/alcool-torino-2; Ambiente curato, spazi ampi, grande varietà  di cocktail Personale cordiale e gentile, cocktail ottimi e prezzi altrettanto.
https://www.yelp.it/biz/alla-lettera-torino; Ottima pizza per pochi soldi e un ronzio eccellente tutto intorno all'edificio. Niente di speciale ma un bel posto. Personale cordiale e disponibile anche se a volte troppo pressante e altre poco presente!
https://www.yelp.it/biz/america-graffiti-torino; Il servizio è veloce e i camerieri sono super cortesi. Il cibo è ottimo e abbondante, il servizio abbastanza veloce. Il personale è cortese ma lento nel servizio.
https://www.yelp.it/biz/amici-miei-torino; Il servizio è abbastanza veloce e la qualità sembra essere buona. Servizio veloce e impeccabile, e soprattutto cordialissimo. Abbastanza gentile il personale con un servizio veloce.
https://www.yelp.it/biz/anema-e-cozze-torino; I camerieri sono gentili ma dipende da chi ti capita. Il locale è gradevole, con ampio affaccio su corso Matteotti, un arredo semplice e non pacchiano. Il locale è carino ed accogliente e i camerieri gentili.
https://www.yelp.it/biz/augusto-torino; Il personale è molto gentile e simpatico. Bel locale per una pausa pranzo in Torino e prezzi davvero buoni... Ottima qualità, vasta scelta tra primi, secondi, pizze e insalate con bevanda e caffè.
https://www.yelp.it/biz/b-eat-torino; Personale cordiale e disponibile. ..... cibo buonissimo a due passi dalla mole ! buona scelta di hamburger, tutti buonissimi, e servizio impeccabile...il tutto ad un passo dalla mole.. Locale molto carino a pochi passi dal museo del cinema.
https://www.yelp.it/biz/babayaga-bari; tutto freschissimo e personale educato e veloce!
https://www.yelp.it/biz/banco-di-sicilia-torino; Facile trovare parcheggio in zona in settimana. Locale gradevole ma rumoroso (in particolare nel mese delle cene aziendali). Piatti tipici siciliani cucinati con bravura e con quantità eccezionali .
https://www.yelp.it/biz/bari-napoli-bari; ottimo rapporto qualità prezzo. resta un must delle risto pizzerie della città. con qualità del cibo e buon bere Buonissima pizza e ottima qualità del cibo! Posto accogliente è carino,personale altamente qualificato,prodotti di prima scelta e qualità della pizza troppo,da ritornarci
https://www.yelp.it/biz/barnum-torino; Cibo di buona qualità in un'atmosfera semplice, quasi familiare. Il locale è accogliente e familiare, il personale cordiale e simpatico. Cibo di buona qualità, atmosfera piacevole, personale cordiale, ottimo il rapporto cibo e prezzo.
https://www.yelp.it/biz/bastimento-torino; Atmosfera familiare in un locale luminoso nonostante le dimensioni. Il servizio è veloce e impeccabile, il conto è al di sopra della media ma giustificato dal servizio proposto. Il locale molto carino nel centro di Torino personale molto premuroso e servizio veloce anche se di sabato sera.
https://www.yelp.it/biz/bbq-di-pennestri-davide-antonio-c-torino; Il locale è carino ma nulla di che. Il tutto affiancato da massima disponibilità e cortesia dei proprietari.
https://www.yelp.it/biz/bene-cos%C3%AC-torino; Ottima la scelta della musica in sottofondo, e il volume era perfetto per riuscire a chiacchierare.
https://www.yelp.it/biz/biancofiore-bari; Unico neo: trovare un parcheggio nelle vicinanze, soprattutto il fine settimana. Il posto ideale in cui trascorrere una bella serata. Bel locale in pieno centro città, intimo e accogliente, arredato con gusto e semplicità nel rispetto della tradizione.
https://www.yelp.it/biz/bistrot-turin-torino; Ampia la scelta dei vini Spazi davvero angusti ma personale molto cortese 21 Bell ambiente, buon cibo (anche se le quantità  non proprio abbondanti) ottimo vino e dessert, servizio molto gioviale. Cibo ottimo, assolutamente da provare i fuori menù proposti, sono ottimi!!!
https://www.yelp.it/biz/black-e-white-bari; Ottima qualità del cibo, piatti molto ricercati, si va da piatti tradizionali a vere e proprie sperimentazioni. Posto piacevole , piatti ben presentati ed ottimi. La qualità del cibo è alta, i piatti sono ben curati e i camerieri sono molto gentili e premurosi.
https://www.yelp.it/biz/blue-eyes-bari; Nonostante l'affluenza di gente il servizio è sempre ottimo, sono veloci ed i prezzi sono davvero buoni. Servizio molto veloce per rinnovare i clienti che aspettano fuori, ottimi tutti i piatti e prezzi molto bassi. La qualità del cibo è sempre buona, l'ambiente accogliente e il servizio gentile.
https://www.yelp.it/biz/borgo-antico-bari; Personale molto accogliente e gentile, pietanze ottime e cucinate al momento.. Il personale molto cortese, simpatico e professionale. Bella la location e ottimo il servizio!
https://www.yelp.it/biz/borgo-dora-torino; Le porzioni sono abbondanti e di ottima qualità. I prezzi sono Bassi e qualità è buona. Stupiti dai prezzi bassi e dalle porzioni abbondanti.
https://www.yelp.it/biz/botta-bari; Locale accogliente, ambiente familiare e personale molto disponibile. Bella serata davvero in un clima di accoglienza familiare. Ambiente rustico familiare, servizio veloce, personale gentile, professionale ed efficiente, ingredienti freschissimi, possibilità di scegliere tra varie farine.
https://www.yelp.it/biz/braceria-signorile-bari; Rimango sempre soddisfatto dalla qualità e dalla cortesia del personale . Locale molto accogliente, proprietario e staff molto attenti alle esigenze dei clienti. Locale molto accogliente, personale molto amichevole e le carne più buona in assoluto ad un prezzo ottimo!
https://www.yelp.it/biz/brek-torino; Struttura su due piani con ampi spazi e molti tavoli! Il personale è gentile, molto comodo perchè è sotto i portici e se piove... Self service con cibi davvero di ottima qualità, freschezza e varietà.
https://www.yelp.it/biz/burgheria-torino; Locale carino ma se siete freddolosi, in inverno, non sedetevi vicino alla vetrata. Personale gentile e cortese, materie prime decenti, non ben valorizzate, pertanto cattivo rapporto qualità prezzo. Il personale è cortese, peccato per i tempi di attesa un po' troppo lunghi.
https://www.yelp.it/biz/busters-coffee-torino; Il locale è ampio, accogliente, il personale è educato e gentile. Il locale è molto carino, il personale simpatico. Un piccolo locale carino e ben arredato con personale molto simpatico.
https://www.yelp.it/biz/cacio-e-pepe-torino; Personale gentile prezzo buono e cibo fresco che varia dalla pizza alla pasta, alla carne e al pesce. Locale accogliente, personale molto disponibile e cortese, cibo ottimo e presentazione dei piatti fantastica. Buona la qualità del cibo, fantastici i bucatini cacio e pepe!
https://www.yelp.it/biz/caff%C3%A8-torino-torino-2; Servizio curato dal personale cortese, mai invadente e sempre premuroso.Nessun cameriere di secondo lavoro.
https://www.yelp.it/biz/caffe-vittorio-veneto-torino; Parcheggio comodo sotterraneo Buffet di cibi con buona scelta non refrigerati e non coperti. Peccato però...personale comunque gentile..e location carina in questa meravigliosa piazza.... Bella location e vista stupenda in quel di piazza vittorio.
https://www.yelp.it/biz/camilla-kitchen-torino; Un menù non troppo ricco, ma concentrato su piatte particolari. Bella location nel centro di Torino a pochi passi da piazza Vittorio Buon pesce e discreta scelta di champagne Servizio impeccabile e rapporto qualità prezzo TOP!
https://www.yelp.it/biz/cammaf%C3%A0-torino-4; Consigliato se volete provare/mangiare un ottima pizza! Anche il locale è carino rinnovato da poco La pizza è veramente buona, consigliato per gli abitanti di Torino che vogliono mangiare una ottima pizza. :)
https://www.yelp.it/biz/cantine-risso-torino; è un locale molto carino, ambientazione semplice e familiare, tutto in legno. Un vantaggio: la sera è facile trovare parcheggio nel piazzale antistante che durante il mattino è riservato ai mercatali Piatti tipici della tradizione piemontese, ottimo vino (Barbera consigliatissimo) e presentazione dei piatti davvero sbalorditiva.
https://www.yelp.it/biz/casale93-torino; Il personale è gentile, premuroso e attento alle richieste del cliente. Il locale è grande e tende a essere un po' dispersivo. Tutto ottimo e il servizio è stato impeccabile,ottima accoglienza e buona qualità prezzo.
https://www.yelp.it/biz/catullo-torino-2; Luogo adatto per famiglie o per coppie. Locale elegante e attento alle esigenze del cliente. Bel posto in cui cenare, la pizza è buona e il locale grande..
https://www.yelp.it/biz/cecchi-torino; Posto consigliato anche per le famiglie con bambini piccoli. Ottima anche la pizza al tegamino ed il gelato. Il locale non è grande ma ne vale la pena aspettare .
https://www.yelp.it/biz/chez-zeina-torino; Titolare gentilissimo e simpaticissimo molto disponibile e attento ai desideri dei suoi ospiti. Cibo ottimo e abbondante Personale estremamente cortese e competente Affrontate la cosa con lo spirito giusto e senza preconcetti. Il servizio è davvero impeccabile e il signore molto molto gentile e disponibile a spiegare ogni cosa.
https://www.yelp.it/biz/ciacolon-ca-veneta-torino; Ottima location e ottimo personale Gentile e attento al dettaglio e alla cura dell'ospite senza mai essere invadente !! Personale cortese che esaudisce velocemente le richieste (pane, vino etc.). Il locale è molto carino e ben curato, la cucina davvero ottima.
https://www.yelp.it/biz/cinese-du-cheng-torino-2; Ottimo ristorante si mangia proprio bene da ritornare I prezzi sono accessibili a tutti il servizio e ottimo La qualità del cibo è ottima, anche se i prezzi sono leggermente superiori alla media. Personale gentile, servizio svelto e piatti ottimi.
https://www.yelp.it/biz/cinese-mei-li-hua-torino; Unico neo: il parcheggio è decisamente difficile da trovare. Il personale è gentile, purtroppo il cibo ha perso molti punti. Nulla da dire sul personale che era gentile e disponibile.
https://www.yelp.it/biz/cinese-nanchino-torino; Da segnalare che il personale è estremamente gentile e disponibile, ma purtroppo non basta. Possibilità di scegliere fra diversi menu fissi.
https://www.yelp.it/biz/complice-di-zhou-jinshu-torino; Personale molto cortese, a volte solo un po' disorganizzato. Servizio veloce e personale cortese, prezzi davvero contenuti. Il servizio è semplice ma il personale è cortese.
https://www.yelp.it/biz/coox-torino; Ambiente accogliente e personale gentile, menù sfizioso con piatti ben presentati. Il locale è molto carino e semplice. Il personale è stato gentile e disponibile.
https://www.yelp.it/biz/cornetti-night-torino-2; Locale aperto tutte le sere con ottima scelta di croissant e delizie varie. Personale molto gentile e pronto a dispensare consigli. Quante volte capita di aver trascorso una bella serata, magari in zona movida,ma di sentire che manca ancora qualcosina.
https://www.yelp.it/biz/cris-e-bio-bari; Bel locale, parcheggio esterno, pizza fina croccante e digeribile. Locale adatto sia a famiglie sia a giovani con il retro del locale con musica. Il personale è gentile, simpatico ed educato.
https://www.yelp.it/biz/da-ciccillo-torino; Questa pizzeria si trova lungo via nizza e non è facile trovare parcheggio nella zona. Ambiente professionale ma al tempo stesso personale molto cordiale e caloroso. Ingredienti DI QUALITè a prezzi contenuti, personale gentile e disponibile e la BURRATA è qualcosa di incredibile !
https://www.yelp.it/biz/da-ciro-torino; Il locale e' carino ed accogliente, il servizio e' veloce. Personale gentile e disponibile, ambiente curato e senza eccessi. Il locale è molto carino, con arredo particolare.
https://www.yelp.it/biz/da-giannino-l-angolo-d-abruzzo-torino; Posto molto familiare per passare una serata. Ottima cucina ambiente tipico regionale servizio eccellente prezzi nella media da provare Le porzioni sono decisamente abbondanti ed il servizio abbastanza veloce.
https://www.yelp.it/biz/da-giuliano-torino; Famiglie con bambini piccoli e calcio in tv, è il vero affare. La pizza è veramente buona ma i bimbi, presumo figli dei gestori... rumorosissimi! Camerieri gentili e sorridenti, servizio solerte e pizza buona.
https://www.yelp.it/biz/da-paolo-bari; L' ambiente è accogliente,spazioso e pulito, il personale gentile e professionale. Personale gentile ...Prezzi accessibili a tutti...adatto a coppie. ..famiglie. ..compagnie giovani. Locale accogliente e personale gentile ed attento ... ampia scelta di vini per ogni gusto ed esigenza ..
https://www.yelp.it/biz/dai-saletta-torino-2; Ottima cucina tipica piemontese, con piatti della tradizione gustosi e ben proporzionati. Per chi vuole assaporare la tradizione piemontese e' il locale giusto . Complimenti per la qualità del servizio e del cibo Ottimo rapporto qualità prezzo.
https://www.yelp.it/biz/delfino-blu-torino; Bel posto , ottimo pesce, e personale eccellente, facile da trovare parcheggio, e, prezzi adeguati al cibo Qualità del cibo elevatissima (il Plateau Royale è qualcosa di sublime!). Il locale elegante, il personale cordiale, professionale e molto attento nei confronti dei clienti e i piatti sono squisiti.
https://www.yelp.it/biz/dess%C3%AC-torino; Prezzi nella norma e locale carino, ma niente di che
https://www.yelp.it/biz/du-cesari-torino; Buona la scelta dei vini in bottiglia e lo sfuso rosso Cesanese. Comunque il locale si presenta come una classica osteria e il personale é molto disponibile e simpatico. Personale molto gentile, davvero accogliente e molto disponibile, sembra proprio di mangiare a casa.
https://www.yelp.it/biz/eataly-bari; La qualità del cibo eccezionale con un menù in grado di soddisfare adulti e bambini. Facile trovare parcheggio auto (zona periferica e strisce bianche non a pagamento su uno dei lati della strada). Il Personale è gentile, professionale e sorridente.
https://www.yelp.it/biz/eataly-torino-torino; Il servizio è (quasi) sempre impeccabile, i ragazzi sono gentili e disponibili. Qualità eccellente , velocità e cortesia del personale. Ottima scelta, posto accattivante, cibo ottimo a prezzi giusti.
https://www.yelp.it/biz/el-centenario-torino-2; El Centenario è un locale adatto a tutti famiglie con bambini, comitive e coppie. Cibo di buona qualità, hanno menù per bambini. Tre cose che per una cena in famiglia con bimbi piccoli sono il massimo!!
https://www.yelp.it/biz/el-pollo-loco-torino; Birra rossa di ottima qualità, cibo buono patatine all'altezza! Locale accogliente e pulito Personale gentile e attento A soddisfare le esigenze del cliente. Il personale è gentile, rapido e sempre attento.
https://www.yelp.it/biz/emporio-gastronomico-torino; Nel quartiere della Crocetta un bel locale antico con uno spazioso dehor moderno. Il servizio è solerte ed allo stesso tempo il cibo è ottimo, curato e veramente di alto livello. Menù ricco e assortito, la pizza è molto buona, i piatti tipici piemontesi deliziosi.
https://www.yelp.it/biz/eno-libero-emporio-enogastronomico-torino; Il posto è caldo ed accogliente, curato, elegante. Inoltre il personale è davvero cordiale e professionale. Locale carino, arredato con gusto ed informalità.
https://www.yelp.it/biz/entremetier-di-lingweifu-torino; E ci trovi famiglie con bambini, coppie, singoli e gruppi di ogni età. Sempre all'altezza delle aspettative.Dehors ampio e comodo.Porzioni spettacolari e tutto cucinato bene.Prezzi contenuti per il tipo di cucina. Le paste sono di ottima qualità ed in proporzioni generose.
https://www.yelp.it/biz/esperia-torino-2; Personale cordiale e cortese in una location d'altri tempi lungo il Po. Personale cortese, veloce, il gestore : Giancarlo, sempre disponibile garantisce professionalità ed assistenza. Ambiente curato e romantico, menù raffinato con ottime materie prime.
https://www.yelp.it/biz/exki-8-gallery-torino-2; Il personale è molto gentile e amichevole.
https://www.yelp.it/biz/exki-pietro-micca-torino; Locale molto carino con prodotti vegetariani e vegani. Ottima qualità dei prodotti, i prezzi un po' sopra la media ma li valgono tutti. Personale sempre professionale e molto disponibile, di sicuro un punto di forza del locale.
https://www.yelp.it/biz/farini-da-lia-torino; Appena entrati il locale è accogliente e arredato in modo semplice ma piacevole. Il locale è carino anche se manca di luce naturale (che non guasta mai). Bel locale e ottima accoglienza da uno staff competente e allegro.
https://www.yelp.it/biz/fassoneria-torino; Personale molto cordiale e disponibile, atmosfera familiare e calorosa. Ottima qualità della carne e altri piatti a scelta per chi non volesse mangiare solo un panino. Personale gentile, servizio veloce nonostante la giovane età dei ragazzi in cucina e del servizio ai tavoli.
https://www.yelp.it/biz/focacceria-riviera-ligure-torino; Molto comodo per pranzare in centro a Torino e mangiare pizza veramente buona, Da provare!!! Buona qualità , prezzi buoni, servizio veloce Servizio veloce e personale gentile nonostante la premura.
https://www.yelp.it/biz/focacceria-santagostino-torino-2; Personale molto gentile anche con i bimbi. Le pizze sono veramente buonissime e i prezzi sono contenuti. Il gestore è molto gentile e disponibile.
https://www.yelp.it/biz/forchetta-e-scarpetta-torino; Che dire.. davvero ottima qualità, soprattutto considerando il prezzo cui viene offerto. Qualità eccellente e grande cortesia, che contraddistingue sempre il locale. e personale cortese, a pranzo offre anche menù fisso
https://www.yelp.it/biz/fratelli-la-cozza-torino-2; Locale con ampi spazi, carino, con arredamento particolare quasi buffo. Servizio molto veloce per la pizza, attesa per il caffè molto lunga. Locale grande, pizza abb. buona ma niente di particolare.
https://www.yelp.it/biz/fratelli-roselli-torino; Pizza buonissima personale presente e simpatico piccolo locale ma molto familiare da provare ottimi anche i piatti da portata Semifreddo con meringhe e cioccolato buono Personale davvero gentile e cordiale Prezzo nella media Piacevole scoperta ... pizzeria che merita una sosta con personale cordiale.
https://www.yelp.it/biz/freevolo-torino; Sicuro è in un ottima posizione e il servizio è veloce. Entrecote non di buona qualità, filamentosa e appena si fredda diventa una BIG BUBLE. Personale gentile e simpatico che crea una bella atmosfera.
https://www.yelp.it/biz/frulez-bari; Locale carino, accogliente ma stretto di spazi. Il personale è cordiale e sorridente e la cucina è quasi a vista. Staff giovane ma disponibile Bel posto, complimenti
https://www.yelp.it/biz/fuzion-torino; Una pizza buonissima dall'impasto eccezionale e dagli ingredienti di ottima qualità. Personale molto gentile e disponibile, ospitalità al top. Le pizze sono di buona qualità sia per impasto (morbido e non gommoso) che per il condimento.
https://www.yelp.it/biz/gadi-bari; I gelati sono artigianali e di buona qualità. Il gelato è artigianale e di ottima qualità.
https://www.yelp.it/biz/galante-torino-2; Servizio molto buono e il conto in linea con qualità del cibo e con la raffinatezza del posto. Servizio sempre impeccabile, ed ogni piatto curato in tutti i dettagli. Buona scelta di vini e conto appena un pò elevato sulla media.
https://www.yelp.it/biz/gasperini-bari; Non ampio ma buona scelta gusti freschi. Personale gentile e simpatico da provare sicuramente !!!
https://www.yelp.it/biz/gelateria-mondello-torino; Gelati di ottima qualità con numerosi gusti da scegliere. Molto carino il locale con alcuni tavoli per sedersi A Torino non mancano le gelaterie di buona qualità, Mondello è una di queste.
https://www.yelp.it/biz/gennaro-esposito-torino; OMG questa pizza era veramente buono !!! Pizza veramente buona, personale cortese e, una volta seduti, servizio veloce.
https://www.yelp.it/biz/girarrosto-santa-rita-torino; Personale cortese Pulizia del locale ottima Prezzi eccessivi Personale cortese Locale pulito Unica pecca prezzi eccessivi Ma non solo in questo esercizio... Prezzi bassi : trancio di pizza ai funghi, trancio di farinata e birra piccola 6,50 euro
https://www.yelp.it/biz/grill-burger-house-bari; Un locale carino, con ottima carne, di ottima qualità. Tutto di ottima qualità con diverse birre artigianali e tanti antipasti originali. Personale gentile e disponibile, prezzi nella media.
https://www.yelp.it/biz/grom-torino-2; Servizio impeccabile e scelta ampia, sempre aggiornata, di gusti, tutti buoni. Gelati di ottima qualità e personale gentile.
https://www.yelp.it/biz/gulp-bari; Locale giovanile con un ottima scelta di birre e buon cibo. Posto eccellente...cibo ottimo...Se si vuol mangiare bene come norcineria é davvero il top!!! Locale ormai di moda a Bari per passare una bella serata.
https://www.yelp.it/biz/gusti-e-sapori-torino; Gusti e Sapori gode di un'ottima posizione centrale e ha ampi spazi al suo interno, nonchè nel dehors. Coniuga una qualità del cibo decisamente buona e prezzi contenuti. Camerieri gentili che facevano del loro meglio per districarsi tra i numerosi clienti da servire.
https://www.yelp.it/biz/hamp-bari; Posto adatto anche alle famiglie con bambini. Il locale è molto carino, semplice ed accogliente. Locale molto carino , vicino da piazza del ferrarese .
https://www.yelp.it/biz/home-burger-palese; Panini eccellenti con carne di ottima qualità e sapientemente conditi per non alterarne il gusto. La carne all'interno del panino era veramente buona...un buon hamburger veramente. Locale accogliente e panini preparati al momento davvero ottimi!!!
