url;review
https://www.yelp.it/biz/horas-kebab-torino; Servizio veloce e cortese, ma cibo pessimo. Un kebab occidentale con carne di ottima qualità italiana. Locale non curatissimo ma la qualità del cibo vince su tutto!
https://www.yelp.it/biz/hua-dou-torino; Ottima cucina cinese e buonissima la pizza!
https://www.yelp.it/biz/huntsman-pub-torino; Un ottimo Pub con personale gentile e disponibile e anche se giovani tutti molto professionali. Sia le specialità che i panini di ottima qualità e buona anche la varietà di birre. Il cibo non di ottima qualità, i drink erano annacquati, le birre buone.
https://www.yelp.it/biz/i-soliti-ignoti-torino; Adatto per le famiglie e i gruppi numerosi Locale in bella location di piccolo parco cittadino. Un bel locale , spazioso e personale cordiale.
https://www.yelp.it/biz/i-tartufi-bistrot-torino; Ottima la qualità dei tartufi, eccellente il bianco. Buona scelta di vini, proprietario gentile e disponibile che sa consigliare i clienti. Il locale si presenta piccolo ma molto accogliente ,con personale gentile e presente per ogni esigenza .
https://www.yelp.it/biz/ichi-torino; Bel locale, un ambiente molto carino e pulito. Locale molto carino, cibo molto curato e di ottima qualità, personale molto gentile. Il cibo è ottimo, il servizio è rapido e cortese e il locale è davvero carino.
https://www.yelp.it/biz/il-dolcetto-bari; La pasta dei cornetti è davvero molto buona e il personale cordiale.
https://www.yelp.it/biz/il-gelatiere-bari-3; C'è un po' di difficoltà nel trovare parcheggio essendo una zona molto trafficate e adiacente al Policlinico. Personale cortese ed educato, gelato buonissimo con la possibilità di scegliere vari gusti. Unico neo, il locale è piccolo e quando è molto pieno diventa un vero caos...
https://www.yelp.it/biz/il-picchio-torino; Vedere la grande partita Juventus Inter bel locale tutto buono gente e personale cordiale ci. Personale molto gentile e preparato il tutto ad un prezzo giusto.Alla prossima complimenti ! Personale gentile con limoncello a fine pasto offerto.
https://www.yelp.it/biz/il-porto-torino; Il locale è carino e ben tenuto, lo spazio non è molto tra i piccoli tavoli. Il servizio è veloce e attento nel rispetto dei tempi! Il personale è sempre gentile e disponibile.
https://www.yelp.it/biz/il-siculo-di-savona-monica-torino; L'ambiente è molto familiare e il personale è gentile e simpaticissimo. Consigliatissimo... e per finire i prezzi sono anche molto più bassi di altre rinomate gelaterie in Torino Ottima anche la qualità degli altri gelati
https://www.yelp.it/biz/il-vicolo-torino; Il locale è accogliente, e il personale cortese. Ambiente accogliente e di design, personale gentilissimo e professionale, porzioni abbondanti e cibo di qualità cucinato con originalità. Ma soprattutto locale accogliente, professionalità e rapporto qualità prezzo eccelsa!
https://www.yelp.it/biz/imbarchino-torino; Il locale è davvero carino..proprio sulla riva del Po.L'atmosfera é informale e il personale gentile e spiritoso! Bella location in riva al Po in mezzo alla natura, ma nel centro della citta`. Ottimo posto per passare una serata o un pomeriggio d'estate.
https://www.yelp.it/biz/indian-street-food-torino; Cibo ottimo, autentico e preparato sul momento.
https://www.yelp.it/biz/japs-torino-2; Il personale è gentile e disponibile, anche nell'offrire eventuali combinazioni di piatti per ridurre la spesa. Cibo davvero ottimo, così come la qualitàprezzo. Il cibo è ottimo e di buonissima qualità.
https://www.yelp.it/biz/japs-torino-3; La qualità del cibo è molto buona. Sushi di buona qualità, discreta varietà e buoni anche i piatti caldi. I piatti sono super buoni e la qualità eccellente
https://www.yelp.it/biz/joys-pub-bari; Non sempre facile trovare un parcheggio nelle vicinanze. Unica pecca è trovare parcheggio, ma con un colpo di fortuna si trova. Infine un avvertimento: in zona il sabato sera si fatica a trovare parcheggio.
https://www.yelp.it/biz/karmacola-torino; Il locale si trova al piano interrato ed ha una discreta possibilità di parcheggio nelle vie limitrofe. Gran bella serata grazie sia all'energia che si respira, molto relax... Il personale molto gentile e la location è particolare
https://www.yelp.it/biz/kipling-torino; Il personale crea una situazione accogliente e familiare che consente di apprezzare pienamente le portate. Personale molto gentile e attento, il parcheggio sotterraneo di piazza Bodoni viene offerto dal ristorante tramite voucher prepagato Personale molto gentile, ottima carta dei vini, cibo curato con un ottimo rapporto qualità prezzo.
https://www.yelp.it/biz/l-accademia-del-panino-torino; Ottimo club sandwich con pane nero al carbon vegetale servizio ottimo cameriera gentilissima con i bambini ottimo veramente Il personale e gentile e disponibile, se siete in zona, consigliatissimo! Il locale è abbastanza piccolo e il personale molto cordiale.
https://www.yelp.it/biz/l-aglio-torino; Locale molto carino in zona tranquilla con ampia scelta di parcheggio. Bella location (anche se manca un insegna fuori) Buon servizio ma prezzi fuori media per cio che viene servito. Ottima cucina, bellissima scoperta questo ristorante un po' nascosto!
https://www.yelp.it/biz/l-antico-arco-cellamare; La gentilezza e la disponibilità di Vito e Angela rendono il locale ancora più familiare. Il locale è accogliente e familiare, il titolare é sempre disponibile a giusti consigli e spiegazioni. Tutto sommato la pizza servitaci è stata all'altezza dell'aspettativa preparata con ingredienti e farine di buona qualità.
https://www.yelp.it/biz/l-oca-fola-torino; Unico difetto la difficoltà di trovare parcheggio. Ottima cucina piemontese: pochi piatti, ma di livello. Tutto di alta qualità e cucinato divinamente. .. personale molto gentile e professiorale. ..
https://www.yelp.it/biz/l-osteria-le-ferriere-torino; Insomma accoglienza familiare 3) Pochi ma buoni, macché buoni, ottimi !!! Bel locale moderno, ben decorato, pulito, spazioso, con tavoli ben distanziati e tanto spazio a disposizione. Locale carino situato a pochi metri dal Piero Della Francesca.
https://www.yelp.it/biz/la-campana-torino-2; Il servizio è stato ottimo, la cameriera era discreta e sempre sorridente. La cucina é semplice e tradizionale pugliese ma non mancano piatti tipici piemontesi e vegetariani. La cucina è stata abbastanza buona anche se lontana da quella pugliese e il personale cordiale e disponibile.
https://www.yelp.it/biz/la-cantina-torino; Cibo ottimo ed i costi sono veramente buoni. Se si vuole mangiare bene in in ambiente accogliente... casalingo... Il personale è cortese, l'ambiente caldo e accogliente.
https://www.yelp.it/biz/la-cantinella-torino; Personale molto accogliente, location sofisticata e riservata. Cenato per lavoro ... ottima pizza, ottima carne alla pietra e gentilezza da parte dello staff! Assolutamente consigliato per passare una bella serata in due
https://www.yelp.it/biz/la-capannina-torino-2; Essendo un po' decentrato dal centro è facile trovare parcheggio, negli adiacenti Corso Vittorio o Corso Matteotti. Tutto il personale cordiale , ambiente accogliente , piatti perfetti nelle quantità e soprattutto nella qualità. Bel locale, molto di classe, personale molto gentile e servizio efficiente.
https://www.yelp.it/biz/la-casa-del-demone-torino; Personale simpatico e buona scelta di cocktail e shots. Complessivamente piacevole con servizio veloce e buoni cocktail A parte una ottima cucina con carne di qualità davvero buona, merita una visita solo per l'ambiente.
https://www.yelp.it/biz/la-cecchina-bari; Il locale è molto carino e i piatti sono davvero squisiti. Locale molto elegante e raffinato interno in pietra e arredato con gusto. Ambiente è accogliente come pure il servizio.
https://www.yelp.it/biz/la-drogheria-torino; Bel locale inserito in un bellissimo contesto. Il locale è molto carino, i camerieri gentili ma il servizio è molto lento. Il locale è molto carino e in una posizione ottima.
https://www.yelp.it/biz/la-fila-torino; Il personale è gentile e sempre disponibile, la pizza è buona e ha un costo nella media. Ottima pizza, ma il servizio, l'accoglienza e la cortesia eccellono su tutto!! Locale carino in stile belle époque, proprio di fronte al Museo egizio, servizio rapido e cordiale, pizza davvero mediocre.
https://www.yelp.it/biz/la-gaia-scienza-torino; Cibo ottimo, accoglienza calorosa e ottimo rapporto qualità- prezzo, menù con piatti della tradizione cucinati in maniera casereccia. I proprietari gentilissimi e il cibo è OTTIMO. Menù non molto vasto ma con prodotti di ottima qualità e ben curati.
https://www.yelp.it/biz/la-granseola-torino; Il locale non è tanto grande ma accogliente. Anche i primi ed i secondi sono di ottima qualità. Ottima la cortesia del personale e l'ambiente è curato e accogliente.
https://www.yelp.it/biz/la-gricia-torino; Ha tavolini nella piazza e carino il locale all'interno. Ottima la cucina, ambiente accogliente, piatti curati e servizio rapido e cortese. Il cibo era TANTO e di ottima qualità, il vino della casa gradevole.
https://www.yelp.it/biz/la-gustosa-torino; Ottima la pizza, con un'ampia scelta dal menù, ben cotta e croccante. Buona scelta di vini e bevande, così come di dessert. Locale carino e pulito.....buona la pizza , impasto gradevole e croccante.
https://www.yelp.it/biz/la-limonaia-torino; Locale molto carino e atmosfera intima e accogliente. Locale molto carino ed accogliente con una bella atmosfera. Il personale è cordiale, appassionato ma mai invadente.
https://www.yelp.it/biz/la-locanda-bari; è un ambiente rustico, caratteristico e molto accogliente, situato sicuramente in una zona strategica di Bari... Prodotto fresco e servizio impeccabile lo ha sempre contraddistinto. Bella la location, Bari Vecchia nel clima natalizio.
https://www.yelp.it/biz/la-madia-torino; Il servizio è ottimo, anche perchè i tavoli non sono molto numerosi. Ristorante molto carino pochi tavoli fuori dal centro ...apprezzabile per il parcheggio Personale molto gentile e professionale. Il servizio e' ottimo ed ingentilito dal sorriso cortese e dall'attenzione di due sorridenti signorine .
https://www.yelp.it/biz/la-mela-stregata-torino; Il locale è ampio e spazioso, il personale gentile anche se un po' frettoloso Sarà vero che l'aperitivo in questo luogo non è caro ma la qualità del cibo non è eccellente. Da provare assolutamente le brioches alla nocciola e al cioccolato bianco...personale gentile...sempre aperto, anche in piena notte.
https://www.yelp.it/biz/la-piadineria-torino; Personale gentile, locale un tantino piccolo ma accogliente! Prodotti di ottima qualità serviti in tempi molto veloci. Ottima la qualità della sfoglia e degli ingredienti, le piadine sono sempre ben farcite al punto giusto!
https://www.yelp.it/biz/la-piramide-torino; Ottime materie prime e ottima cucina,veramente casalinga. Il servizio è ottimo e veloce, condito da una grande gentilezza degli addetti. Il servizio è cordiale e i prezzi davvero bassi per la qualità offerta.
https://www.yelp.it/biz/la-reseda-torino; Il locale e  grazioso e pulito adatto per le famiglie ! Il locale non è molto grande, ma è carino. la pizza è buona, e quella integrale va provata sicuramente Pizza buona e con molta scelta anche di impasti.
https://www.yelp.it/biz/la-tana-del-polpo-bari; Pesce freschissimo, personale accogliente e familiare e cucina top! Ottima qualità degli ingredienti, piatti ben presentati, gentilezza del personale e conto più che onesto. Cibo ottimo, servizio impeccabile, proprietario presente e competente.
https://www.yelp.it/biz/la-taverna-dei-mercanti-turin; Locale accogliente e raffinato a conduzione familiare. Locale familiare e molto accogliente, personale gentilissimo ed attento. Super consigliato per chi vuole assaggiare i piatti tipici e passare una serata tranquilla in un bel locale.
https://www.yelp.it/biz/la-taverna-greca-torino-2; Il personale è cortese e alla mano, e anche l'atmosfera è familiare. Ottimo per una serata tra amici o in famiglia, ambiente caldo e vivo. Locale tranquillo con personale gentile e disponibile!
https://www.yelp.it/biz/la-via-della-seta-torino; Prezzi contenuti, servizio impareggiabile: gentili, molto veloci e accoglienti. Personale cordiale e sempre disponibile, in un ambiente tranquillo. Cibo ottimo, presentato con classe e raffinatezza.
https://www.yelp.it/biz/le-cantine-di-bacco-torino; Il locale si presenta bene ed il personale è gentile anche se un pò assente. Cibo ottimo a cominciare dai malloreddus che erano meravigliosi. Il locale è accogliente, arredato con mobili di legno, i tavoli sono rustici e l'atmosfera tranquilla.
https://www.yelp.it/biz/le-due-antenne-bari; Locale ampio, personale cordiale, grandissima abbuffata di antipasti vari caldi, freddi, carne e pesce.
https://www.yelp.it/biz/le-grand-tabu-bari; Per il titolare: non basta avere un bel locale e mettere bella musica con qualche bottiglia esposta !!! Una bella location.Il cibo molto buono anche se servito freddo.Cocktail ottimi.unica ma grande pecca,la cameriera! I piatto sono ben decorati e le pietanze di ottima qualità.
https://www.yelp.it/biz/le-lupin-dei-f-lli-zambetta-bari; Locale grande, ideale quando si hanno dei bambini che hanno il loro giusto spazio per muoversi. Qualità del cibo e prezzi nella norma Locale molto grande, con diverse tipologie di menù fisso.
https://www.yelp.it/biz/le-putrelle-osteria-torino; è un locale carino e adatto anche a bambini piccoli. Ma assolutamente qualità ottima su tutto anche il personale gentile e attento. Prezzi assolutamente contenuti e in equilibrio con ottima qualità.
https://www.yelp.it/biz/le-rondini-torino; Nulla di entusiasmante ma comunque un buon locale...Si presenta leggermente scuro o meglio,forse scarsamente illuminato, arredamento standard ma gradevole. Personale gentile, posto gradevole e pizze come si deve. Locale molto accogliente con un personale cordiale e disponibile.
https://www.yelp.it/biz/le-tre-lanterne-bari; Il locale è accogliente e la conduzione familiare ti fa sentire a casa. Il personale è gentile e il prezzi non sono economici, ma comunque nella fascia media Il cibo servito è stato di buona qualità, tuttavia niente di entusiasmante.
https://www.yelp.it/biz/le-veronique-bari-2; Il locale è molto accogliente, caldo, personale gentile, il titolare molto simpatico e con la battuta pronta! Il locale è molto elegante e raffinato. La pizza era veramente buona , nulla da criticare
https://www.yelp.it/biz/le-vitel-etonne-torino; Personale di sala molto cordiale e servizio veloce. Ottima invece la qualità e il prezzo!!! Locale molto carino e con tavoli ben distanziati.
https://www.yelp.it/biz/libery-pizza-e-artigianal-beer-torino; Non adatto a famiglie con bambini piccoli è più indicato a gruppi di amici o a coppie Ottima pizza con ingredienti genuini e di qualità ! Ottima pizza e ottime birre artigianali, locale rustico in zona crocetta , impasto buono e cameriri gentilissimi ,
https://www.yelp.it/biz/lo-scugnizzo-torino; Facile trovare parcheggio su C.so San Maurizio se si arriva prima delle 21. Servizio veloce ma attento e conto basso per una pizzeria in centro !!!! Locale carino ma con tavoli troppo vicini tra loro.
https://www.yelp.it/biz/lo-stonnato-torino; La cortesia del personale è degna di nota, il locale molto carino. Un ottima pizza al tegamino con influenze napoletane. Il locale è molto carino, diverso dal solito.
https://www.yelp.it/biz/m-bun-torino; Buona la qualità della carne, ampi spazi per gruppi numerosi... Al piano di sotto vi è moltissimo spazio e l'area bimbi. Locale accattivante soprattutto per i bambini nel piano interrato, carne e pane molto buoni.
https://www.yelp.it/biz/m-bun-torino-3; I tavoli erano ampi ed è possibile utilizzare un'area bimbi. Bel posto vicino al centro di Torino, locale con area giochi bimbi. Bel locale grande e comodo con personale gentile e disponibile.
https://www.yelp.it/biz/maltos-beer-bari; Il locale è posto in una stradina periferica del quartiere poggiofranco e spesso è difficoltoso trovare parcheggio. Pub carino con personale gentile ed accogliente e con tanti posti a sedere anche all'esterno, in una verandina riscaldata. Il personale è gentile ed il servizio abbastanza veloce.
https://www.yelp.it/biz/mamasita-torino; Locale accogliente e molto spazioso, comodo anche per gruppi numerosi. Ottimo ristorante per la cucina accurata e saporita e per il locale molto accogliente con grande dehors estivo. Riproverò un'altra volta anche perché il personale è molto gentile.
https://www.yelp.it/biz/mamma-licia-torino; Menù non troppo ricco ma con cose interessanti. Ambiente rustico, ricorda una trattoria di altri tempi.
https://www.yelp.it/biz/marechiaro-torino; Locale pulito con ampi spazi per gli ospiti. Locale spazioso e personale gentile e disponibile Il locale è molto carino e pulito.
https://www.yelp.it/biz/martinucci-bari-2; Il personale è abbastanza gentile, ma sono molto lenti nel servire, anche quando non c'è gente. Personale cordiale, il conto si fa sentire. Ottima qualità e fantasia nella scelta dei gusti.
https://www.yelp.it/biz/masaniello-%C3%A9-turnat-torino; Locale carino, tutto intitolato ad un grande della storia popolare partenopea, Masaniello! Il menù è ricco di piatti tipici e nuovi abbinamenti, per accontentare i curiosi, ma anche gli scettici. Il personale è gentile e giovane, i prezzi non eccessivi, calcolando la posizione.
https://www.yelp.it/biz/mc-donalds-torino-4; Consigliato comunque per la qualità del cibo preparate sempre fresco.
https://www.yelp.it/biz/mcdonalds-bari-3; E' situato su due piani - c'erano posti liberi al piano terra.
https://www.yelp.it/biz/mexico-70-torino; Personale più che gentile, pregio difficile da trovare oggi giorno. Il personale e molto accogliente e molto disponibili. Personale cordiale e veloce..come rapporto qualità prezzo nella media..
https://www.yelp.it/biz/mezzaluna-osteria-torino; Ambiente carino, parcheggio in prossimità, c'è anche un negozio all'interno. Ambiente accogliente, personale cordiale ed efficiente, atmosfera molto particolare. Un locale molto carino, si notano subito i toni caldi e accoglienti dell'arredamento oltre che un servizio molto valido.
https://www.yelp.it/biz/miagola-cafe-torino; Personale molto gentile, ambiente molto pulito e soprattutto accogliente. E' un locale accogliente, rilassante, musica di sottofondo grafevole e i gatti che ti girano intorno sono meravigliosi. Il posto è molto luminoso ed il personale molto gentile.
https://www.yelp.it/biz/michi-tanzariello-torino; Locale ampio e piacevole anche se con spazi stretti tra i tavoli. Personale gentile, proprietario , Angelo, sempre presente e attento. Ottima pizza e farinata, personale frettoloso ma comprensibile con la mole di lavoro che hanno ogni sera.
https://www.yelp.it/biz/monegato-torino; Anzitutto il locale è accogliente colorato e l'ambiente è familiare. Consigliato soprattutto a pranzo per chi non ha molto tempo per mangiare piatti tipici piemontesi e non solo Ottimo per primi piatti discreti ed economici.
https://www.yelp.it/biz/monferrato-torino; Ottima cucina piemontese è una carta dei vini degna con ottime bottiglie con qualità /prezzo molto interessante. Personale gentile ed accogliente, con grande disponibilità nei confronti del cliente. Ristorante con piatti della tradizione piemontese di qualità eccezionale con un servizio impeccabile.
https://www.yelp.it/biz/monte-dei-cappuccini-torino; Ottimi gli antipasti: flan di carciofi con bagna caüda veramente ottimo. Buona cena e bel locale, in bellissima location! Il personale inoltre è molto gentile ed il servizio veloce
https://www.yelp.it/biz/mr-rooster-torino-3; I panini non erano ottimi e un po' piccoli ma i prezzi abbastanza bassi. Fast food specializzato nel pollo, personale gentile e ottima varietà di menù tra cui scegliere. Continueremo sicuramente a preferirvi rispetto ad altri fast food!
https://www.yelp.it/biz/napples-torino; Il locale molto carino, un po' diverso dal solito, davvero grazioso. Ottima qualità, prezzi nella norma e il personale molto cortese. Locale molto carino e molto affollato nonostante fosse lunedì sera.
https://www.yelp.it/biz/new-mexico-torino-2; se ti va di mangiare un ottima pizza servita fumante al tavolo con un sorriso, vai in questa pizzeria.
https://www.yelp.it/biz/niva-cremeria-torino; Personale sempre molto cortese e svelto nel smaltire la coda. buona scelta di gusti e di granite! L'ambiente è curato, luminoso, pulito ed accogliente.
https://www.yelp.it/biz/nuova-dezzuto-torino; Cortesia e professionalità in un Ambiente accogliente e raffinato. Locale molto elegante, pasticceria raffinata, cappuccino delizioso,purtroppo personale poco attento. Locale elegante, sempre un piacere fare tappa quando in zona.
https://www.yelp.it/biz/nuovo-fizzarotti-bari; Primi piatti freddi, sembravano preparati in anticipo e riscaldati. Buona la qualità e la varietà dei cibi. Locale carino e ordinato, la responsabile gentile.
https://www.yelp.it/biz/old-wild-west-torino; Molto indicato anche per le famiglie con bambini. posto gradevole divertente idealew per amici o famiglie...la qualità della carne è ottima il servizio veloce Qualità del cibo molto buona, veloce il servizio e prezzi nella norma.
https://www.yelp.it/biz/olsen-di-caldi-cinzia-torino; Tutto ottimo e il locale molto accogliente. L'ambiente è sempre caldo ed accogliente, il personale è educato ma malinconico, un sorriso in più non guasterebbe. Il servizio è veloce e il locale è molto carino sebbene molto piccolo.
https://www.yelp.it/biz/oolivoo-bari; Personale gentile, bello il posto direttamente sul mare ma il cibo purtroppo poco gradevole.......mozzarelle a parte...... Locale carino, a pochi metri dal mare. Camerieri disponibili e gentili e servizio veloce.
https://www.yelp.it/biz/open-baladin-torino; Il menù comprende un'ampia scelta di piatti e stuzzichini tutti di ottima qualità e le porzioni sono enormi. Menù ricco con un ottimo rapporto qualità/prezzo! Bravi anche loro a dare un buon servizio cordiale e professionale.
https://www.yelp.it/biz/opera-bari; Il personale è gentile, disponibile e ben preparato. Posto accogliente e con la luce giusta, servizio veloce e cordiale. Ristorante di ottima qualità , personale gentile e disponibile per qualsiasi esigente.
https://www.yelp.it/biz/ortigia-bistrot-torino; Locale carino e accogliente, personale molto gentile e disponibile. Il personale è gentile, disponibile e professionale. Locale carino con personale professionale e cortese.
https://www.yelp.it/biz/osteria-al-gambero-bari; Buonissima cena in questo ristorante a conduzione familiare. L'ambiente è accogliente e familiare ed hai la sensazione di essere invitato a casa dei suoi titolari. Cibo di ottima qualità, cucinato in modo semplice e sublime. 10 e lode al pesce crudo e ai fritti.
https://www.yelp.it/biz/osteria-antichi-sapori-bari; Il servizio ottimo e il personale molto cortese. Altra pecca non hanno un menù ricco così le scelte si riducono molto. Prodotti di qualità e primi piatti molto buoni e arricchiti da una bellissima presentazione!
https://www.yelp.it/biz/osteria-dei-quattro-gatti-bari; Locale davvero molto accogliente, grandi spazi , grandi tavolate ma anche ottimo per cene a 2. Locale molto accogliente e personale molto cordiale. Qualità del cibo buona, porzioni un po' scarse, prezzi alti per il servizio.
https://www.yelp.it/biz/osteria-del-fiat-torino; Il locale è raccolto e dall'aria familiare, il cibo nella norma. Tempi di attesa molto brevi e personale gentile . Locale molto carino e particolare, con tanti richiami alla sotria industriale di Torino.
https://www.yelp.it/biz/osteria-del-frate-torino; personale gentile, cibo molto buono, conto più basso di quanto pensassi, sicuramente da consigliare. Ottima scelta, locale carino, buon rapporto qualità prezzo. Posto molto accogliente,caldo pulito e personale gentilissimo..
https://www.yelp.it/biz/osteria-della-travi-bari; Ambiente rustico, locale pulito ma con spazi non troppo ampi. Atmosfera familiare, gli antipasti sono tanti e gustosi, principalmente a base di verdure. cucina tipica in un ambiente molto familiare e davvero ben organizzato. ottimi gli antipasti abbondanti
https://www.yelp.it/biz/osteria-fate-infretta-a-tavola-torino; Il locale è raccolto e dall'aria familiare, il cibo nella norma. Tempi di attesa molto brevi e personale gentile . Locale molto carino e particolare, con tanti richiami alla sotria industriale di Torino.
https://www.yelp.it/biz/osteria-le-arpie-bari; Il personale sempre gentile e accogliente a due passi dalla basilica di San Nicola. Posto caldo e da subito accogliente, personale gentilissimo e ottimo consigliere. Personale gentile e presente e servizio veloce.
https://www.yelp.it/biz/osteria-rotonda-dei-facchinetti-torino; Personale gentile e accogliente, ambiente familiare, cibo eccellente. Il locale è molto familiare, ben arredato e pulito. Locale accogliente, ambiente familiare, staff gentile, simpatico, cordiale e disponibile, cibo eccellente.
https://www.yelp.it/biz/osteria-sopravento-bari-2; Questo è un ristorante abbastanza semplice ma con prezzi più bassi. Cibo ottimo, dalle semplici bruschette al polpo. Pietanze preparate con cura e materie prime di ottima qualità.
https://www.yelp.it/biz/ottimo-torino; Il gelato è di buona qualità, il personale cortese. Personale molto cordiale e sorridente, gusti particolari ed unici,quali mango e zenzero o pompelmo rosa e Campari. Il locale è carino e ben gestito, infatti il personale è molto cordiale e disponibile.
