url;review
https://www.yelp.it/biz/yoshi-bar-torino;Locale non molto grande, ma con cibo di ottima qualità, cibi freschi e molto buoni, Personale educato e gentile.
https://www.yelp.it/biz/wasabi-torino;Ambiente accogliente e ottimo cibo,ingredienti freschi, cucinati alla perfezione e serviti in ciotole eleganti...personale gentile e molto disponibile.
https://www.yelp.it/biz/vo-torino;Il locale offre la giusta privacy a tutti, il servizio è di prim'ordine, preciso e cordiale ma mai invadente.
https://www.yelp.it/biz/vintage-torino;ottima accoglienza da parte dello staff di sala e del titolare. cena eccellente e in atmosfera ovattata.
https://www.yelp.it/biz/villa-somis-torino;Tutto inizia così, con un menù degustazione di 9 portate di carattere, equilibrate, presentate molto bene, tutte veramente ottime.
https://www.yelp.it/biz/tre-galline-torino-2;Dario , il cameriere, molto attento e professionale cura i propri clienti e cerca di accontentarli in ogni modo.
https://www.yelp.it/biz/tre-galli-torino-2;Il cibo è gustoso, tra tradizione ed innovazione, ampia la scelta di vini.Personale gentile ed accogliente Merita una visita
https://www.yelp.it/biz/trattoria-da-cinzia-torino;Zona ospedale un po' decentrata, Personale cordiale, possibilità di menù fisso anche a cena con piatti tipici abruzzesi.
https://www.yelp.it/biz/torteria-berlicabarbis-torino;Ma va bene così, fuori l'aria è freschina e le foglie svolazzano: a suo modo è confortante.
https://www.yelp.it/biz/tiffany-caff%C3%A8-bari;Gustoso gelato, camerieri di lingua tedesca e prezzi molto onesti!
https://www.yelp.it/biz/tiella-bari;Prezzi onesti...e poi scopri che larga parte della gestione e quella del Vassallo ...merita e si ritornerà!!
https://www.yelp.it/biz/the-stuart-pub-bari;Il personale è molto cordiale e i titolari affabili e simpatici!
https://www.yelp.it/biz/teapot-torino;Personale: educato, garbato e molto gentile  Cibo: vasta scelta tra tisane e infusi molto particolari e interessanti.
https://www.yelp.it/biz/taiki-bari;Personale sempre molto gentile e disponibile e pronti a soddisfare il cliente al meglio, SEMPRE SORRIDENTI.
https://www.yelp.it/biz/solferino-torino;Ambiente cordiale, personale preparato e pronto a darvi consigli e suggerimenti preziosi per una cucina piemontese di tutto rispetto.
https://www.yelp.it/biz/signorvino-torino;Tutto confermato (buona qualità dei cibi, quantità corrette, prezzi ragionevoli, personale gentile...) in un ambiente decisamente più bello.
https://www.yelp.it/biz/shodai-bari;Ogni criitica veritiera è sempre bene accetta ma correttezza vuole che si menzionino i fatti nel loro reale svolgimento.
https://www.yelp.it/biz/sfashion-cafe-torino;Per la difficoltà incontrata a Torino per trovare un posto decente non costosissimo per mangiare... può andar bene.
https://www.yelp.it/biz/seven-up-torino;Peccato davvero.. per quanto il personale sia gentile ciò non basta al cliente se manca il buon cibo.
https://www.yelp.it/biz/sandrino-bari-2;Questa gelateria posizionata in piazza Mercantile, nel cuore del borgo antico, offre un ottimo gelato a prezzi nella media.
https://www.yelp.it/biz/sandrino-bari;Un localino veramente carino, ben arredato e confortevole, sito in pieno centro a Bari, nei pressi della stazione ferroviaria.
https://www.yelp.it/biz/roar-roads-torino;personale gentile e disponibile e servizio molto buono e veloce nonostante il locale fosse pieno di gente.
https://www.yelp.it/biz/ristrot-guviol-torino;Ottimo servizio e cucina interessante che, senza essere pretenziosa, abbina molto bene sapori nuovi e gusti del territorio.
https://www.yelp.it/biz/ristoranti-tromlin-torino;Due stelle perché il locale è intimo e grazioso, arredamento rustico ma piacevole, e perché il servizio è gentile.
https://www.yelp.it/biz/ristoranti-taverna-delle-rose-torino-2;Beh che dire, luogo romantico, cibo ottimo e abbondante, servizio cordiale e disponibile , il cameriere è gentilissimo.
https://www.yelp.it/biz/ristoranti-sardegna-torino;I piatti sono fantastici: pura Sardegna, dal pane frattau alle seadas, dai vini all'acqua (sì, l'acqua, avete letto bene!).
https://www.yelp.it/biz/ristoranti-alba-torino;La famiglia che gestisce il locale è davvero molto gentile e sollecita, ma le note positive si fermano qui.
https://www.yelp.it/biz/ristorante-enoteca-parlap%C3%A0-torino-2;Mauro è stato molto accogliente e attento.
https://www.yelp.it/biz/prima-e-poi-torino;La pizza è poco qualitativa, il locale bruttino e i prezzi alti come in altri posti limitrofi più carini.
https://www.yelp.it/biz/pizzeria-fratelli-la-bufala-torino;È vero che quando si va a mangiare fuori, la cosa più importante è mangiare bene...
https://www.yelp.it/biz/pizzeria-enzo-e-ciro-di-fraddosio-v-c-bari;Il personale è sempre simpaticamente lo stesso, con alcune recenti immissioni come la simpatica e bella figlia del titolare.
https://www.yelp.it/biz/pizzeria-baraonda-bari;Semplice pizzeria con forno a legna,posto simpatico,personale cortese, ma la cosa fondamentale che deve essere ottima e' scarsa..
https://www.yelp.it/biz/pizzeria-aladino-bari;La pizzeria/ ristorante rientra nella categoria mangi tanto e bene.
https://www.yelp.it/biz/pizza-speedy-torino-3;Per il resto pizza normale, personale al telefono gentile, fattorino anche (aveva pure il resto!)
https://www.yelp.it/biz/pippo-paranza-torino;Una nota di merito il fritto che era fatto molto e bene ed anche il conto.
https://www.yelp.it/biz/perbacco-bari;Il proprietario e' molto gentile e assiste i clienti nelle scelte illustrando tutte le caratteristiche dei piatti proposti .
https://www.yelp.it/biz/pepino-torino;Servizio poco attento, del resto la posizione a portata dei turisti, rende il posto sempre pieno di clientela.
https://www.yelp.it/biz/panino-giusto-torino;Nota davvero positiva è il caffè: buono e accompagnato da un cubetto di gelato ricoperto offerto dalla casa.
https://www.yelp.it/biz/panificio-magda-bari;Lo storico panificio Magda ha riaperto da poco con una nuova veste più fresca e più moderna.
https://www.yelp.it/biz/panificio-el-focacciaro-bari;Il personale è molto gentile e i prezzi assolutamente nella media Da provare assolutamente
https://www.yelp.it/biz/panetteria-borgo-nuovo-torino;Il personale molto gentile e rapido nel servizio.
https://www.yelp.it/biz/pai-bikery-torino;Il servizio è stato veloce e attento, le ragazze sono molto solari e disponibili.
https://www.yelp.it/biz/paese-zhou-torino-2;Si mangia bene, arriva tutto subito e si paga poco, ottimo per pranzi veloci o pranzi con colleghi.
https://www.yelp.it/biz/ottimo-torino;Nota di merito ulteriore per il servizio, che si è dimostrato attento e di una gentilezza non scontata.
https://www.yelp.it/biz/osteria-rotonda-dei-facchinetti-torino;Inoltre servizio impeccabile, piatti ben serviti oltre che buoni, personale cordiale, disponibile e sorridente..e prezzo assolutamente abbordabile Consigliatissimo!
https://www.yelp.it/biz/osteria-dei-quattro-gatti-bari;La pizza è molto grande e buona, lo staff è gentile e i prezzi sono nella media.
https://www.yelp.it/biz/osteria-degli-ottoni-torino;Piatti ottimi e con buon rapporto qualità prezzo Locale molto accogliente, personale gentile ed efficiente, consigliata la prenotazione.
https://www.yelp.it/biz/osteria-antichi-sapori-bari;A partire dal cibo di ottima qualità a finire al personale cordiale e molto preparato sui prodotti da vendere.
https://www.yelp.it/biz/opera-bari;Da Lecce con la famiglia in questo ristorante ottimo per accoglienza e gentilezza del personale.
https://www.yelp.it/biz/old-wild-west-torino;Il personale è molto gentile e disponiobile, inoltre nonostante durante le partite sia ovviamente affollatissimo non ti fanno fretta.
https://www.yelp.it/biz/okinawa-torino;Piatti molto curati , vasta scelta, personale gentile e disponibile , prezzo giusto per il rapporto costo qualità ....
https://www.yelp.it/biz/nuovo-fizzarotti-bari;Ben posizionato in centro, abbastanza frequentato, personale gentile, un menu con il giusto numero di portate tra cui scegliere.
https://www.yelp.it/biz/napul-e-bari;Pizzeria napoletana con classica pizza con bordi alti, il locale è ben accogliente ,il personale è gentile e cortese.
https://www.yelp.it/biz/mr-rooster-torino-3;Ottima Ottima cucina ottima accoglienza un personale molto cortese pronto a risolvere qualsiasi problema del cliente.
https://www.yelp.it/biz/mezzaluna-osteria-torino;Locale tranquillo, accogliente , personale molto gentile, il menu permette di accontentare diversi gusti, i prezzi non sono elevati.
https://www.yelp.it/biz/masaniello-%C3%A9-turnat-torino;Il personale è gentile e giovane, i prezzi non eccessivi, calcolando la posizione.
https://www.yelp.it/biz/marechiaro-torino;Cura e accoglienza da parte del titolare e del personale che ti fa sentire un ospite gradito .
https://www.yelp.it/biz/mare-nostrum-torino;si sente il sapore del pesce cucinato bene per niente influenzato da additivi che ne alterano il gusto!
https://www.yelp.it/biz/maltos-beer-bari;Pub carino con personale gentile ed accogliente e con tanti posti a sedere anche all'esterno, in una verandina riscaldata.
https://www.yelp.it/biz/magorabin-torino;Il personale è attento, cortese e preparato nonostante la giovane età, presente il giusto senza essere soffocante.
https://www.yelp.it/biz/locanda-da-betty-torino;Locale piccolo ma molto bello, personale gentile e preparato, porzioni abbondanti e buone, tanti piatti che fanno voglia.
https://www.yelp.it/biz/le-vitel-etonne-torino;Il locale è accogliente, il personale gentile, preparato e disponibile a venire incontro alle esigenze del cliente.
https://www.yelp.it/biz/le-tre-lanterne-bari;posto come tanti nulla di particolare..menu a prezzi tutto sommato onesti proprietario gentilissimo pizza che sa di biscotto!!!!
https://www.yelp.it/biz/le-rondini-torino;Personale cordiale, lavale abbastanza pulito, mangiare nella norma prezzo giusto X quello che mangi fine serata offerto limoncello
https://www.yelp.it/biz/le-grand-tabu-bari;Staff molto cordiale e disponibile, ambiente molto accogliente e allo stesso tempo elegante.
https://www.yelp.it/biz/la-via-della-seta-torino;Bel ristorante cinese in centro curato in tutto personale gentile e buona cucina a prezzi del tutto onesti .
https://www.yelp.it/biz/la-uascezze-bari;Locale semplice, tovagliette di carta, servizio rapido, molto cordiale, prezzo veramente onesto, sicuramente un ottimo rapporto qualità prezzo.
https://www.yelp.it/biz/la-taverna-greca-torino-2;Il locale non è dei più grandi e spaziosi, ma il personale è molto cortese ed il cibo delizioso.
https://www.yelp.it/biz/la-svolta-torino;Locale effettivamente bello, servizio ottimo e gentile, unica pecca la poca scelta di pizze e non modificabili.
https://www.yelp.it/biz/la-stadera-pizzeria-la-stadera-di-muscariello-s-e-c-pizz-torino;Pulito, personale gentile e preparato, menù ricco, ma non eccessivo. la pietanze ordinate erano di buona qualità.
https://www.yelp.it/biz/la-ristonomia-torino;Si deve tornare per forza.....anche per il personale cordiale e attento...e sopratutto per il conto..... decisamente sotto le aspettative!
https://www.yelp.it/biz/la-prima-da-moreno-torino;Lui è un vero signore, gentile e accogliente pronto a consigliarti quale piatti scegliere in base ai tuoi gusti.
https://www.yelp.it/biz/la-piadineria-torino;il personale è sempre molto cordiale e ti aiuta a scegliere la combinazione giusta tra gli ingredienti. ottima!!
https://www.yelp.it/biz/la-pagoda-di-hu-lia-meng-torino;Il locale è carino, non molto grande, il personale è gentile e si intrattiene molto con i clienti conosciuti.
https://www.yelp.it/biz/la-mela-stregata-torino;Da provare assolutamente le brioches alla nocciola e al cioccolato bianco...personale gentile...sempre aperto, anche in piena notte.
https://www.yelp.it/biz/la-maison-di-chez-rino%C3%B2-torino;Sicuramente un esperienza da fare, né più né meno della visita alla Mole!
https://www.yelp.it/biz/la-gola-torino;Non importa che il vecchio signore sia un uomo gentile ...
https://www.yelp.it/biz/la-cecchina-bari;Personale gentile e accogliente piatti pregevoli che rendono onore alla eccelle tradizione culinaria pugliese, riservando slanci di armoniosa creatività.
https://www.yelp.it/biz/la-capannina-torino-2;Ristornate pizzeria nel centro di Torino molto accogliente ed elegante , il sevizio è cordiale e abbastanza rapido .
https://www.yelp.it/biz/la-cabane-torino-2;Ristorante semplice piccolo e carino, servizio curato di buon livello ma informale, accoglienza ottima e bella atmosfera.
https://www.yelp.it/biz/la-bufala-torino;vicino al multisala Ideal, è un posticino tranquillo con ottima accoglienza e buona pizza.
https://www.yelp.it/biz/la-bottega-del-gusto-torino;In generale, cibo di qualità, ben cucinato e ottimo come il vino, servizio attento ma mai invadente, conto giusto.
https://www.yelp.it/biz/la-badessa-torino-2;Personale attento e cordiale,sensibile alle richieste dei clienti, anche se sicuramente la stanchezza di questi giorni si fa sentire.
https://www.yelp.it/biz/l-osteria-di-pierantonio-torino;Il mercoledì sera c'è anche una pianista che allieta la serata suonando bene ma in modo non invasivo.
https://www.yelp.it/biz/l-idrovolante-torino;Pranzo di laurea, location mozzafiato su una palafitta all'interno del parco Valentino, staff super gentile, cibo eccezionale e raffinato!
https://www.yelp.it/biz/l-antico-arco-cellamare;Locale non ristrutturato all'ultimo grido dell'Hi-Tech ma semplice e funzionale, a conduzione familiare con personale semplicemente cordiale e disponibile.
https://www.yelp.it/biz/l-aglio-torino;Cena con amici in questo grazioso ristoranti ai piedi della collina torinese... personale molto gentile servizio ottimo piatti raffinati!!!
https://www.yelp.it/biz/kirkuk-kaff%C3%A8-torino-2;Buono, ambiente e cucina Kurda, Turca, Persiana e Irachena
https://www.yelp.it/biz/kipling-torino;Si mangia abbastanza bene ma si paga antipasto, primo o secondo 45 euro) davvero più di quanto meriti.
https://www.yelp.it/biz/karmacola-torino;Unica pecca il personale non trasmettono quel senso di accoglienza, che si può trovare in altri locali etnici.
https://www.yelp.it/biz/joys-pub-bari;Un confortevole luogo nel quale trascorrere una piacevole serata con gli amici.
https://www.yelp.it/biz/in-vino-veritas-torino;Locale molto intimo e piccolo, cibo molto buono e si beve benissimo, staff super simpatico, prezzi modici.
https://www.yelp.it/biz/imbarchino-torino;Il locale è davvero carino..proprio sulla riva del Po.L'atmosfera é informale e il personale gentile e spiritoso!
https://www.yelp.it/biz/il-siculo-di-savona-monica-torino;La premessa è che appena entri ti salutano con grande calore e questa è sicuramente una immediata nota positiva.
https://www.yelp.it/biz/il-picchio-torino;Personale simpatico e cortese, ma... alla fine sembrava mancasse qualcosa... forse un po' di anima in più
https://www.yelp.it/biz/il-gelatiere-bari-3;Lo staff è cordiale e giovanile e i gusti del gelato buonissimi, ogni volta è una sfida sceglierli!
https://www.yelp.it/biz/il-dolcetto-bari;La pasta dei cornetti è davvero molto buona e il personale cordiale.
https://www.yelp.it/biz/il-cortiletto-torino-2;locale piccolo ma molto carino,signora gentile in sala cibo squisito ...un pochin lunghe le attese e cuoco scorbutico.
https://www.yelp.it/biz/il-brigantino-torino;Servizio attento e cordiale Lo chef come il gestore si sono presentati per un feedback questo è da apprezzare.
https://www.yelp.it/biz/ij-brande-torino;Un ristorante che pur avendo consapevolmente raggiunto livelli di eccellenza, nn ha perduto l'umiltà nel servizio e dell'accoglienza.
https://www.yelp.it/biz/i-tesori-bari;Molto carini gli interni, ti invogliano ad entrare per un caffè o una fetta di torta!
https://www.yelp.it/biz/hua-dou-cheng-torino;Personale molto cordiale e attento ,anche i prezzi sono molto contenuti ....... puoi cenare bene anche spendendo € 10
https://www.yelp.it/biz/gulp-bari;Il locale è molto carino, il personale estremamente gentile e il cibo buono e di ottima qualità.
https://www.yelp.it/biz/guido-gobino-torino-3;Tutto molto raffinato e gustoso: ottima accoglienza, ambiente raffinato ed esclusivo ma soprattutto la qualità gustosa dei prodotti offerti.
https://www.yelp.it/biz/gufo-bianco-torino;È stata una serata perfetta, resa tale anche grazie al servizio efficiente, veloce, attento, premuroso dall'inizio fino alla fine.
https://www.yelp.it/biz/giapponese-ohashi-torino;Il personale non è esclusivamente giapponese, molto gentile e cordiale, anche se con qualche imprecisione al servizio ai tavoli.
https://www.yelp.it/biz/galante-torino;Interessante, tipico locale piemontese con cucina di carne e pesce rivisitati in chiave moderna.
https://www.yelp.it/biz/gadi-bari;I tavolini interni permettono di mangiare il gelato con calma, personale simpatico e gentilissimo.
https://www.yelp.it/biz/fuzion-torino;La pasta delle pizze era gustosissima e leggera, l'accostamento con gli ingredienti orientali azzeccatissimo, il servizio gentile ed accogliente.
https://www.yelp.it/biz/fratelli-roselli-torino;Ambiente moderno e vivace in zona Politecnico, con dehors, viste le ridotte dimensioni del locale, personale efficiente e gentile.
https://www.yelp.it/biz/fiorio-caff%C3%A8-torino;Il gelato di Fiorio è molto buono, artigianale, fatto in pochi gusti ma buonissimi.
https://www.yelp.it/biz/farmacia-dei-sani-bari;Guidati in un'esperienza culinaria spettacolare dal titolare, personale efficiente e cordiale,mai invadente, è stato un trionfo di sapori.
https://www.yelp.it/biz/family-bar-torino;Ambiente modernissimo e curato, servizio cordiale, facilità di parcheggio
https://www.yelp.it/biz/eos-torino;Ne vale la pena, bel locale curato, come la cucina.. personale attento e buona carta dei vini.. bravi
https://www.yelp.it/biz/enoteca-rossorubino-torino;L'accoglienza e la gentilezza dei proprietari si uniscono alla perfezione del dettaglio e alla qualità dei gustosi piatti.
https://www.yelp.it/biz/el-churrasco-bari-2;Carne fantastica,personale cordiale e molto attento , tanta varietà di piatti preparati con cura e di un ottimo livello.
https://www.yelp.it/biz/e-pronto-torino-2;Ottimo il cibo vegetariano e ottima l'accoglienza.
https://www.yelp.it/biz/del-cambio-torino;Ogni dettaglio è cura e raffinatezza dall'accoglienza alla presentazione dei piatti, dal servizio preciso e attento all'ambiente squisito.
https://www.yelp.it/biz/da-paolo-bari;Locale accogliente e personale gentile ed attento ... ampia scelta di vini per ogni gusto ed esigenza ..
https://www.yelp.it/biz/da-ciccillo-torino;L'ambiente è informale, con bicchieri di plastica e tovaglioli di carta, il personale e' estremamente gentile, simpatico è disponibile.
https://www.yelp.it/biz/cornetti-night-torino-2;Fin da subito verrete accolti da un'immensità di prelibatezze (sia sulla carta che esposte), e scegliere non sarà semplice.
https://www.yelp.it/biz/cinese-du-cheng-torino-2;Ottimo ristorante si mangia proprio bene da ritornare I prezzi sono accessibili a tutti il servizio e ottimo
https://www.yelp.it/biz/cera-una-volta-torino;È stata veramente una bella sorpresa, perché si mangia davvero bene e c'è una scelta di vini esagerata.
https://www.yelp.it/biz/casa-vicina-torino;Personale molto professionale e cordiale. il Menù è molto adatto alla stagione con piatti stuzzicanti e gustosi.
https://www.yelp.it/biz/casa-mad-torino;Piatti della cucina italiana preparati al momento con ingredienti freschissimi, ambiente meraviglioso e personale cortese, cordiale e amichevole.
https://www.yelp.it/biz/caffe-vergnano-torino;Bella e pratica la disposizione dei tavoli, il personale è molto gentile e professionale.
https://www.yelp.it/biz/caffe-mozart-bari;In ogni caso il caffè era ottimo, come pure i cornetti, personale simpaticissimo, cordiale e abbastanza veloce.Niente da ridire.
https://www.yelp.it/biz/caff%C3%A8-torino-torino-2;Entrate e sarete accolti da uno splendido sfondo di lampadari e grandi scalinate.
https://www.yelp.it/biz/caff%C3%A8-mulassano-torino-3;Ci sono pannelli in legno e specchi antichi che rivestono le pareti, i camerieri sono vecchi e amichevoli.
https://www.yelp.it/biz/caff%C3%A8-borghese-bari;Il Cafe Borghese è un bar molto confortevole con un'ottima atmosfera.
https://www.yelp.it/biz/burgheria-torino-2;Il menù è poco chiaro,ma il locale si salva perché si mangia molto bene e l'attesa è poca .
https://www.yelp.it/biz/buosi-torino;Da ritornare .. ottimo qualità/ prezzo e personale cortese e gentile!
https://www.yelp.it/biz/botta-bari;Impasto gustoso e digeribilissimo, ingredienti di prima qualità, servizio familiare e simpatico, tovaglia e tovaglioli in tessuto e puliti.
https://www.yelp.it/biz/boja-fauss-torino-2;Eccellente la qualità del cibo e la presentazione dei piatti, personale disponibile , paziente , gentile e simpatico .
https://www.yelp.it/biz/blue-eyes-bari;Il titolare Nicola è una persona davvero gentile e simpatica, il nipote, il cameriere Francesco è sempre molto cortese.
https://www.yelp.it/biz/black-e-white-bari;Location elegante, servizio premuroso ed attento, cestino del pane ricco con focaccia barese e grissini fatti a mano.
https://www.yelp.it/biz/bistrot-turin-torino;Il posto perfetto per chi vuole mangiare bene, tipico e a un prezzo accessibile (circa 80 euro tutto).
https://www.yelp.it/biz/berbel-torino;Il personale di sala, gentilissimo e molto attento, si muoveva con discrezione in un ambiente molto chic e curato.
https://www.yelp.it/biz/baratti-e-milano-torino-2;Prezzo/Qualità: Voto 8 Accoglienza/Professionalità: Voto 7 Da consigliare: Voto 9 (almeno per l'ambiente e l'arredo)
https://www.yelp.it/biz/bar-telebari-bari;Gelato buonissimo con molte varietà di gusti.Personale molto gentile e cortese facile da raggiungere
https://www.yelp.it/biz/bar-cavour-55-bari;Niente da dire sul servizio, cordiale, cameriere vestito elegante, buon servizio.
https://www.yelp.it/biz/banco-di-sicilia-torino;Menu pranzo conveniente (pizza, bevanda e caffè a 7,50€) e personale cortese, disponibile e silenziosamente attento a tutto.
https://www.yelp.it/biz/baccanale-torino;Il posto poi è carino e giovanile, e il personale sempre molto simpatico e cordiale.
https://www.yelp.it/biz/babayaga-bari;La gelateria è piccola, il personale poco cordiale.
https://www.yelp.it/biz/arigato-torino;Porzioni giuste, qualità ottima (tempura di gamberi e verdure veramente delicata) e personale molto gentile e disponibile.
https://www.yelp.it/biz/arcadia-torino-4;Location molto bella ed il personale gentile e disponibile... questo è il bello del ristorante.
https://www.yelp.it/biz/alberosole-bari;Servizio molto gentile, ordine e pulizia ai tavoli e negli angoli più reconditi.
https://www.yelp.it/biz/al-sorso-preferito-bari;Ottimo ristorante, curato, camerieri attenti, il cuoco simpatico per certi versi pittoresco ma ben inquadrato nel contesto.
https://www.yelp.it/biz/al-savoia-bari;Ottima caffè, personale cordiale posto abbastanza elegante ottima scelta di pasticceria , tavolini anche all'esterno per un aperitivo.
https://www.yelp.it/biz/al-cacimperio-torino;Locale semplice ma accogliente, personale gentile, cucina varia con impronta piemontese, ma il pezzo forte è la carne.
https://www.yelp.it/biz/al-bicerin-torino;L'atmosfera che si respira nel piccolissimo locale è decisamente piacevole grazie anche al personale gentile e professionale.
https://www.yelp.it/biz/ai-2-ghiottoni-bari-2;Locale pulito e personale cordiale, ottima cucina e prodotti di prima qualità, con specialità di pesce curdo e cotto.
https://www.yelp.it/biz/a6-sciamadda-torino;Piatti proposti di buon livello,buono il vinello bianco ligure, prezzi più che onesti, posti a disposizione pochi.
