url;review
https://www.yelp.it/biz/zheng-yang-torino-2;"Ottimo, veramente buono e tutto pulito e ordinato e personale gentile, anche di sabato si può mangiare tranquillamente !"
https://www.yelp.it/biz/zelli-wine-bar-torino;"locale carino propietario molto cordiale musica carina e buoni i cocktail . nn male per stare in compagnia."
https://www.yelp.it/biz/yoshi-bar-torino;"Il servizio e' cordiale e veloce, l'atmosfera molto piacevole e accogliente, ma sopprattuto il cibo era ottimo, delizioso."
https://www.yelp.it/biz/waxy-torino;"Luci basse, tavoli e arredi di legno, grande bancone, sgabelli, tappezzeria e carta da parati, vecchie e vintage insieme."
https://www.yelp.it/biz/wasabi-torino;"Locale piccolino ma molto grazioso, e il personale di nazionalita' nipponica ha saputo creare una giusta intima atmosfera."
https://www.yelp.it/biz/walima-torino;"Sembra una cantina a dire il vero però con cuscini arabi, narghilè e the che rendono l'atmosfera veramente bella."
https://www.yelp.it/biz/vyta-torino;"Personale accogliente,locale molto carino ed elegante,molto ben fornito,ottimo sia per fermarsi a chiacchierare che per un caffè veloce"
https://www.yelp.it/biz/vo-torino;"All'entrata hai un'altra idea : tenui e caldi i colori delle pareti, i tavoli ben distanziati un locale elegante."
https://www.yelp.it/biz/vitelloni-torino;"Il personale è stato gentile e disponibile, il locale era pulito e spazioso e la tavola apparecchiata con cura."
https://www.yelp.it/biz/vintage-torino;"è inammissibile che il Vintage sia un ristorante stellato nell'anno 2017: forse nel 2007 ma certo non oggi."
https://www.yelp.it/biz/vinolento-torino;"è stata una serata veramente piacevole, i piatti erano vari e buonissimi, il personale gentile e sorridente."
https://www.yelp.it/biz/villa-somis-torino;"Posto vivamente consigliato, che si presta ad ogni tipo di contesto che spazia dalla cena lavorativa a quella romantica."
https://www.yelp.it/biz/vermouth-anselmo-torino;"Atmosfera ricercata ma anche informale con elementi regali in stile primi '900, insomma una serata deliziosa e di scoperta.."
https://www.yelp.it/biz/vanilla-torino;"Il locale è piccolo, ma molto accogliente e pulito, il personale è gentile e sorridente."
https://www.yelp.it/biz/turet-torino;"Un locale che , a seconda dell'ora in cui si arriva , si può trovare un'atmosfera diversa ."
https://www.yelp.it/biz/tre-galline-torino-2;"Locale accogliente, elegante ma informale con personale davvero professionale, offre i piatti della tipica cucina Piemontese davvero ottimi."
https://www.yelp.it/biz/tre-galli-torino-2;"Tipico Quadrilatero di Torino, quindi bel locale, bella atmosfera, curato ma nel contempo tutto un po' storto e scompagnato."
https://www.yelp.it/biz/trattoria-vineria-da-ale-torino;"Il personale gentile e cortese, il cibo ottimo e genuino, locale semplice ma ben arredato e pulito."
https://www.yelp.it/biz/trattoria-valenza-torino;"è rimasto forse l'unico in città ad avere l'atmosfera autentica della vecchia trattoria piemontese."
https://www.yelp.it/biz/trattoria-toscana-torino;"Il locale è ben organizzato, affollato (sabato sera) ma ben gestito dal personale di sala."
https://www.yelp.it/biz/trattoria-mombercelli-di-antico-elena-torino;"Consigliato a chi non si crogiola nei locali finto vintage/retrò alla moda, ma ama le cose schiette e buone."
https://www.yelp.it/biz/trattoria-da-cinzia-torino;"Visto da fuori non dice molto come locale e dentro è piccolino, ma ha un'atmosfera molto famigliare."
https://www.yelp.it/biz/trattoria-casalinga-torino;"Se vuoi passare una serata con gli amici ad un prezzo conveniente, la trattoria Viareggio è la soluzione giusta!"
https://www.yelp.it/biz/trattoria-alba-torino;"La gentilezza della proprietaria ha infine assieme al prezzo assolutamente ottimo fatto finire in bellezza la serata."
https://www.yelp.it/biz/toscano-torino-3;"L'interno, superati i gradini, pare calato negli anni '70 e l'atmosfera è quella delle trattorie."
https://www.yelp.it/biz/torteria-berlicabarbis-torino;"Fateci un salto al pomeriggio, la sera, soprattutto nei week end solo se avete tanto tempo a disposizione."
https://www.yelp.it/biz/torino-citt%C3%A1-torino;"Ad autunno la fiera del tartufo é molto bella e interessante per i fanatici di questo fungo pregiato."
https://www.yelp.it/biz/tobiko-torino;"Un locale molto carino ben arredato , atmosfera gradevole, cibo di ottima qualità e preparato in maniera impeccabile."
https://www.yelp.it/biz/tisaneria-della-consolata-torino;"Nel complesso è un locale molto tranquillo, ideale per una serata al calduccio e quattro chiacchiere con degli amici."
https://www.yelp.it/biz/tiella-bari;"Valida alternativa per uno spuntino o una cena familiare fuori casa, divertente punto d'incontro per una serata tra amici."
https://www.yelp.it/biz/the-stuart-pub-bari;"Pub dall'atmosfera scozzese... ottima la selezione di birre , personale efficiente e i proprietari simpaticissimi."
https://www.yelp.it/biz/the-egg-torino;"Questo bistrot si trova all'interno dello stesso ristorante gourmet dello Chef Batavia, quindi bella location curata e semi elegante."
https://www.yelp.it/biz/the-duke-of-wellington-torino;"Da tornare più per l'atmosfera che per il cibo, magari con un gruppo di amici per vedere le partite."
https://www.yelp.it/biz/terra-di-mezzo-bari;"CONSIGLIATO per una cena in comitiva, per una buona birra alla spina,o semplicemente per vedere la partita della sera."
https://www.yelp.it/biz/teapot-torino;"Forse un po' caro, ma la zona tranquilla e la qualità del cibo valgono il prezzo del biglietto!"
https://www.yelp.it/biz/taverna-rossa-di-zappia-pasquale-torino;"Voglio salutare il 2017 alla Taverna Rossa in buona compagnia, musica, balli e ottima cena !!"
https://www.yelp.it/biz/taverna-delloca-torino;"Una cena tra colleghi.. locale simpatico tra il rustico ed il raffinato."
https://www.yelp.it/biz/tadadatta-pub-bari;"Posto carino, senza tante pretese, ideale per una serata con gli amici."
https://www.yelp.it/biz/taco-bang-torino;"Atmosfera accogliente, servizio rapido e cibo ottimo per un pranzo veloce ma sostazioso e dal gusto un po' diverso"
https://www.yelp.it/biz/tabit-bari;"Un locale nuovo, pulito titolare con conoscenza del suo lavoro e dei material usati per preparare i piatti serviti."
https://www.yelp.it/biz/t-bone-station-torino;"Cibo ottimo, menù molto vario e che ha messo d'accordo 14 persone, prezzi nella norma e serata assolutamente piacevole!"
https://www.yelp.it/biz/sushitao-bari;"Cenetta tra amici con formula all you can eat con un costo poco superiore ai 20 euro per persona."
https://www.yelp.it/biz/sushi-yu-torino;"Locale molto accogliente e pulito, sushi molto buono, piatti elaborati, e soprattutto pesce fresco ,) da tornarci assolutamente"
https://www.yelp.it/biz/sushi-sound-torino;"Ambiente Soft con piacevole arredamento e luci, ma tavoli troppo vicini e le voci degli altri cilenti rimbombano troppo."
https://www.yelp.it/biz/strawberry-torino;"Situato a pochi passi dal centro di Torino, questo locale ha fatto dell'originalità  il suo marchio di fabbrica."
https://www.yelp.it/biz/storie-del-vecchio-sud-bari;"Per quelli che cercano serata molto easy è l'ideale anche perché i prezzi sono molto abbordabli."
https://www.yelp.it/biz/st-martin-torino;"Locale fantastico, camerieri molto gentili, atmosfera stupenda da passare con amici a bere ottime birre e ridere, tanti complimenti"
https://www.yelp.it/biz/spazio-la-stampa-torino;"La visita si svolge alla sera, solo su prenotazione e con visita guidata."
https://www.yelp.it/biz/spaghetteria-70cento-bari;"Una fantastica esperienza compiuta Sabato 31 Gennaio, durante una bellissima serata in compagnia di un bel gruppo di amici."
https://www.yelp.it/biz/spada-reale-torino;"Buon rapporto qualità-prezzo considerando anche la posizione, alle spalle di piazza Vittorio ed il locale ben arredato e pulito."
https://www.yelp.it/biz/soup-e-go-torino;"Ideale per una pausa pranzo di lavoro o una serata di chiacchiere e relax."
https://www.yelp.it/biz/soul-kitchen-torino;"Il tutto in una abitazione molto particolare che crea la giusta atmosfera per poter assaporare i piatti proposti."
https://www.yelp.it/biz/sotto-la-mole-torino;"Servizio cortese e discreto, ambiente semplice ed elegante...e molto silenzioso, il che è davvero ormai una rarità."
https://www.yelp.it/biz/solferino-torino;"Il locale è molto bello, nella cornice belle epoque di Piazza Solferino con ampia sala all'interno intima ed accogliente."
https://www.yelp.it/biz/soci%C3%A9te-lut%C3%A9ce-torino-2;"Serata molto bella, cena con presentazione di tre fragranze molto particolari."
https://www.yelp.it/biz/sir-francis-drake-torino;"Questo pub è davvero l'ideale per passare una bella serata in compagnia bevendo birra e magari guardando una partita."
https://www.yelp.it/biz/silvano-torino-2;"Il gelato è ottimo la scelta un po' limitata ma il gusto è delizioso, personale gentile e preparato."
https://www.yelp.it/biz/signorvino-torino;"Leggere commenti come il tuoi ci riempie davvero il cuore ci da la forza per fare sempre meglio!"
https://www.yelp.it/biz/sicomoro-torino;"Una volta sistemati e ordinato, il servizio è stato molto veloce, nonostante l'affluenza di un primaverile sabato sera."
https://www.yelp.it/biz/siciloso-torino;"U bel posto, con un arredo originale, tavolini comodi, belle luci, un bel bancone e persone simpatiche."
https://www.yelp.it/biz/sibir-torino-2;"E' molto spazioso, elegante per una cena a due e soprattutto il cibo è di ottima qualità ed abbondante."
https://www.yelp.it/biz/shodai-bari;"La qualità del cibo è ottima, il locale molto elegante e raffinato e il personale disponibile e molto professionale"
https://www.yelp.it/biz/shizen-torino;"Il locale é molto elegante e il servizio é preciso e puntuale ma anche molto competente e alla mano!"
https://www.yelp.it/biz/sharazad-torino;"Il cibo è molto buono, le porzioni sono abbondanti il giusto,Un angolo di Medio Oriente nel cuore di Torino."
https://www.yelp.it/biz/sfashion-cafe-torino;"Il sabato sera è molto affollato, ma l'attesa non è mai stata così lunga da farci desistere."
https://www.yelp.it/biz/seven-up-torino;"Bel localino caratteristico, con panche di legno e simpatia e gentilezza fuori dal comune delle cameriere."
https://www.yelp.it/biz/sen-mi-ya-torino-2;"Locale molto moderno e molto pulito, ottimo pesce e ottimo servizio, un po scarso la carta dei vini."
https://www.yelp.it/biz/sciuscia-pizzeria-torino;"Locale davvero carino esteticamente, in una posizione invidiabile e comoda per un post serata in Piazza Vittorio."
https://www.yelp.it/biz/scannabue-torino;"I piatti della tradizione piemontese, italiana e di mare prevedono elaborazioni contemporanee e un impiattamento curato e impeccabile."
https://www.yelp.it/biz/scalo-vanchiglia-torino;"una bella tavola all'ingresso, 14 amici. servizio veloce e preciso, ottimo vino e buon cibo hanno scandito la serata."
https://www.yelp.it/biz/sandrino-bari-2;"Questa gelateria posizionata in piazza Mercantile, nel cuore del borgo antico, offre un ottimo gelato a prezzi nella media."
https://www.yelp.it/biz/sandrino-bari;"Un localino veramente carino, ben arredato e confortevole, sito in pieno centro a Bari, nei pressi della stazione ferroviaria."
https://www.yelp.it/biz/san-tommaso-10-torino;"Ottima atmosfera , ottima cucina , servizio professionale , prezzo adeguato al servizio ed alla qualità del cibo ."
https://www.yelp.it/biz/san-giorgio-torino;"Scoperta per caso e di corsa prima di andare al CAB41."
https://www.yelp.it/biz/sa-corte-noa-torino;"Sera prenatalizia, ottimi mallureddus con sugo di salsiccia, buono il filettino di maiale, cannonau discreto servizio gentile"
https://www.yelp.it/biz/rossosapore-torino;"La sera è sempre pieno, un servizio un po' approssimativo ( tranne il padrone che è molto gentile)."
https://www.yelp.it/biz/roar-roads-torino;"Vecchia birreria in centro da sempre super frequentata e da sempre con tantissime buone proposte x la sera."
https://www.yelp.it/biz/rizzelli-torino;"Prezzi un po' sopra la media ma la serata e' risultata molto piacevole in una location del tutto originale."
https://www.yelp.it/biz/ristrot-guviol-torino;"Il servizio informale e giovane, seppur discreto e attento ha coronato una serata bella e saporita."
https://www.yelp.it/biz/ristoro-28-3-torino-2;"Ristorante nel cuore della crocetta, la proprietaria Raffaella è sempre super gentile e il cibo sempre fresco e ottimo."
https://www.yelp.it/biz/ristoranti-tropicana-torino;"Sabato sera ore otto prenotato x 13 persone.personale gentile ed educato pizza veramente buona e incredibilmente veloce!"
https://www.yelp.it/biz/ristoranti-tromlin-torino;"Due stelle perché il locale è intimo e grazioso, arredamento rustico ma piacevole, e perché il servizio è gentile."
https://www.yelp.it/biz/ristoranti-taverna-delle-rose-torino-2;"(ps: ricordarsi di prenotare un posto nella sala a lume di candela per un ambiente più intimo e romantico)."
https://www.yelp.it/biz/ristoranti-sardegna-torino;"Il locale si presenta bene, pulito e accogliente. il cibo è ricercato, e i piatti sono sempre molto abbondanti."
https://www.yelp.it/biz/ristoranti-alba-torino;"San Valentino 2015 , serata riuscitissima.......nonostante la sua penosa sceneggiata con il ristorante al completo!!!!!!!!!!!!"
https://www.yelp.it/biz/ristorante-ratatui-torino-2;"Il cortile è veramente intimo che ha come unico inconveniente le zanzare...ma il locale fornisce persino prodotti da spruzzarsi."
https://www.yelp.it/biz/ristorante-peppino-torino;"Locale pulito, accogliente, piccolino, quindi si sta un po' stretti, ma le ragazze trovano soluzioni per accontentare tutti."
https://www.yelp.it/biz/ristorante-enoteca-parlap%C3%A0-torino-2;"Ci sedevano a tavola per due in un'alcova di vino, molto privata e romantica."
https://www.yelp.it/biz/ristorante-consorzio-torino;"Consorzio è sempre una sicurezza, forse più adatto per cena romantica che per cena tra amici in gruppi numerosi."
https://www.yelp.it/biz/ristopizza-giampaolo-bari;"Il locale, abbastanza vicino a Bari vecchia per una piacevole passeggiata, ha un'ottima atmosfera ed eccellenti piatti di pesce."
https://www.yelp.it/biz/re-sole-torino-2;"Stati in serata estiva quindi all' aperto è proprio piacevole (magari munirsi di autan anche se dispongono di zampironi)."
https://www.yelp.it/biz/quo-vadis-torino-2;"Location romantica e luci soffuse la sera , prezzi giusti , la qualità non è a buon mercato ."
https://www.yelp.it/biz/quattro-soldi-torino;"Il locale è molto intimo, elegante e dallo stile piacevolmente all'antica, molto pulito e in ordine."
https://www.yelp.it/biz/punto-pizza-di-moro-michel-torino;"Ingredienti freschi e di alta qualità, prezzo basso, buon servizio, una grande selezione di pizza, atmosfera calda e amichevole."
https://www.yelp.it/biz/prima-e-poi-torino;"Consumato antipasto di mare caldo, pizza Prima e poi, con frutti di mare e cozze a volontà...."
https://www.yelp.it/biz/premiata-osteria-dellhermada-torino;"La cortesia nel servizio da parte dei camerieri e l'ottima qualità del cibo hanno reso la serata davvero piacevole."
https://www.yelp.it/biz/porto-di-savona-torino;"L'atmosfera torinese la fa da padrona, servizio cortese e premuroso, qualità del cibo buona, ottimo rapporto qualità prezzo."
https://www.yelp.it/biz/poormanger-torino;"Leggermente pesante la sera essendo comunque una patata abbastanza grossa e il ripieno abbondante, ma fattibilissimo."
https://www.yelp.it/biz/pony-bubble-tea-torino;"Sono in una posizione fantastica e sebbene sia molto piccola all'interno, c'è un grande salotto all'aperto."
https://www.yelp.it/biz/ponte-regina-torino;"Il locale è accogliente e pulito, il personale gentile e disponibile, il pesce è sempre fresco è buonissimo."
https://www.yelp.it/biz/pollastrini-torino;"Menu' con scelta di antipasti di terra e di mare, primi e secondi sia di terra che di mare."
https://www.yelp.it/biz/platti-torino-2;"In un esercizio pubblico conta la qualità, l'arredo, l'atmosfera ma, più di tutto, il servizio."
https://www.yelp.it/biz/pizzeria-vecchia-londra-torino;"Consigliatissimo, per chi ama passare una serata con amici o per altre occasioni non se lo lasci sfuggire."
https://www.yelp.it/biz/pizzeria-tarantini-al-cancello-rotto-bari;"Buona la location, ottimo il servizio ai tavoli, gli antipasti cotti di mare e di terra vari e gustosi."
https://www.yelp.it/biz/pizzeria-spaccanapoli-torino;"Bel ristorante/pizzeria, un locale pulito e curato, climatizzato, disponibile anche un piccolo dehor Personale gentile e simpatico."
https://www.yelp.it/biz/pizzeria-silvestro-torino;"Come primi spaghetti alla chitarra ai frutti di mare e scialatelli con carciofi freschi e gamberi...come secondo..."
https://www.yelp.it/biz/pizzeria-pizza-e-altro-bari;"La pizza la sanno fare bene e l'antipasto di mare servito (sostanzialmente polpo) era davvero ottimo oltre che abbondante."
https://www.yelp.it/biz/pizzeria-petit-roi-bitritto;"Inoltre la cortesia del personale e soprattutto del proprietario Angelo ha reso la ns serata ancora piu piacevole."
https://www.yelp.it/biz/pizzeria-la-sacrestia-torino;"Per una serata molto tarda, un ottimo ristorante."
https://www.yelp.it/biz/pizzeria-ideal-di-atzori-alberto-torino;"Una bella serata con una buona mangiata,pizza gustosissima,farinata perfetta e buonissima,posto invitante e con musica rilassante.Un posto perfetto!.."
https://www.yelp.it/biz/pizzeria-gino-torino;"Doveva essere una serata rilassante ed e' diventata una maratona."
https://www.yelp.it/biz/pizzeria-fratelli-la-bufala-torino;"Se si hanno bimbi e si vuole passare una serata tranquilli c è l area bimbi con animatrice....."
https://www.yelp.it/biz/pizzeria-enzo-e-ciro-di-fraddosio-v-c-bari;"Qualche problemuccio con il cameriere e la tecnologia per le ordinazioni ma tutto sommato una bella serata."
https://www.yelp.it/biz/pizzeria-dual-torino;"Location ideale per passare una bella serata con famiglia o amici e perché no anche con la propria ragazza."
https://www.yelp.it/biz/pizzeria-di-cosimo-bari;"Per una serata con gli amici e due chiacchere va piu che bene."
https://www.yelp.it/biz/pizzeria-da-michele-torino;"Trattoria che a breve festeggiera' 100 anni, atmosfera rustica ma cittadina, personale gentile e col sorriso."
https://www.yelp.it/biz/pizzeria-da-donato-bari;"Pizza buonissima, ambiente elegante e raffinato,sembra un ristorante e personale preparato gentile e cortese"
https://www.yelp.it/biz/pizzeria-da-candido-torino;"Gli ingredienti ottimi fanno sì che le pizze, anche quelle più originali, siano sempre delicate e digeribili."
https://www.yelp.it/biz/pizzeria-continental-pizzorante-bari-2;"Ambiente raffinato ma al tempo stesso familiare, la cortesia discreta d'altri tempi dei camerieri, la pizza ottima."
https://www.yelp.it/biz/pizzeria-chez-jo-bari;"Un pò di ritardo nel servizio, ma ci poteva stare essendo sabato sera."
https://www.yelp.it/biz/pizzeria-bella-vita-torino;"Il menu' e' interessante con primi e secondi di terra e di mare."
https://www.yelp.it/biz/pizzeria-baraonda-bari;"Il locale è semplice e pulito, i proprietari e lo staff molto gentili ed educati."
https://www.yelp.it/biz/pizzeria-aladino-bari;"Va bene per una serata tra amici."
https://www.yelp.it/biz/pizza-speedy-torino-3;"Non deludono mai, la pizza è davvero buonissima, molto più di certi ristoranti frequentatissimi!"
https://www.yelp.it/biz/pizza-speedy-torino-2;"La pizza è molto buona, arriva sempre calda e fragrante e il personale è sempre molto gentile."
https://www.yelp.it/biz/pizza-ad-hoc-torino;"Anche il servizio è stato molto veloce, nonostante fosse sabato sera e il locale fosse pieno."
https://www.yelp.it/biz/piu-di-un-gelato-torino;"Eccellente location nel pieno centro di Torino, carina ed elegante la struttura, prezzi economici, personale gentile e preparato"
https://www.yelp.it/biz/pistacchio-torino;"Atmosfera raccolta, molto piacevole per passare un pomeriggio davanti ad una tazza di te, cioccolata ecc."
https://www.yelp.it/biz/pippo-paranza-torino;"INTERNI Due sale, una più piccola che funge anche da ingresso tutt'altro che tranquilla e una seconda più appartata."
https://www.yelp.it/biz/piper-pub-torino;"Se volete trascorrere una serata allegra, divertente con i vostri amici questo e' il posto ideale."
https://www.yelp.it/biz/piola-cianci-torino;"Il dehors è riscaldato e nonostante i 4° esterni, si è piacevolmente cenato, affacciati sul Largo Quattro Marzo."
https://www.yelp.it/biz/piazza-vittorio-veneto-torino;"In questo spazio effettivamente enorme pulsa il cuore di Torino, infatti quasi obbligatoriamente tutti passano per qui."
https://www.yelp.it/biz/petit-baladin-torino;"La cena è stata molto apprezzata sia per i piatti molto gustosi che per l'atmosfera giovane."
https://www.yelp.it/biz/perbacco-bari;"ambiente raffinato ma come a casa , simpatia ed eleganza del proprietario fano di questo ristorante un posto unico."
https://www.yelp.it/biz/pepino-torino;"ambiente caldo ed accogliente, un locale raffinato,elegante, storico un buon bicerìn in ottima compagnia."
https://www.yelp.it/biz/peperosso-torino;"Posto affollato (era giovedì sera e non c'era un tavolo libero) ma accogliente."
https://www.yelp.it/biz/pastificio-defilippis-torino;"Un ristorante elegante ma dall'atmosfera rilassata, servizio attento, premuroso, impeccabile, menù invitante e pietanze davvero squisite."
https://www.yelp.it/biz/pasticceria-venier-torino;"Personale premuroso, locale elegante e raffinata pasticceria...tre cose che fanno della pasticceria Venier un posto imperdibile!"
https://www.yelp.it/biz/pasticceria-amore-torino;"Per non parlare del fatto che non si parlano quando sono vicini ma da lontano alzando la voce."
https://www.yelp.it/biz/pastamaneria-torino;"Dall'esterno non invoglia molto, però una volta entrati si è ben accolti con una buona atmosfera e poco rumore."
https://www.yelp.it/biz/pasta-mon-amour-torino;"Ottimo rapporto qualità prezzo, pesonale simpatico e cordiale,locale super accogliente: molto intimo nel cuore della movida torinese, san salvario!"
https://www.yelp.it/biz/passamaneria-torino;"Ma anche gli antipasti di terra e di mare sono dalla qualità ottima: tutta merce fresca e squisita."
https://www.yelp.it/biz/passaggio-in-india-torino;"Il servizio è stato un po' lento (era sabato sera e la sala era piena), ma il personale gentile."
https://www.yelp.it/biz/panperfocaccia-torino-2;"Di sabato sera molto affollato con spazi ristretti meglio prenotare cucina e pizze buone servizio cordiale e veloce."
https://www.yelp.it/biz/pan-cafe-torino;"Ottima cucina piemontese, si può scegliere alla carta, o prendere i menu fissi (terra o mare) a 25 euro."
https://www.yelp.it/biz/palazzo-bricherasio-torino;"Un bellissimo palazzo antico (1636) nel cuore di Torino che organizzava bellissime mostre d arte."
https://www.yelp.it/biz/pai-bikery-torino;"Da consigliare assolutamente per la qualità del cibo e la disponibilità dello staff in una atmosfera molto carina."
https://www.yelp.it/biz/paese-zhou-torino-2;"Classico ristorante cinese, discreto, senza nulla di particolare, cibo nella norma, pesce surgelato, ma buono, locale pulito."
https://www.yelp.it/biz/ottimo-torino;"Il gelato è incredibilmente buono e l'atmosfera è genuina e simpatica!"
https://www.yelp.it/biz/osteria-sopravento-bari-2;"Bel locale, abbastanza curato, piccolo, ci sono pochi tavoli perciò è molto intimo, si sta comunque molto comodi."
https://www.yelp.it/biz/osteria-rotonda-dei-facchinetti-torino;"La pizza al padellino era talmente non buona che il vostro piatto è tornato in cucina pulito."
https://www.yelp.it/biz/osteria-povrom-torino;"Il presonale è molto gentile, il locale un po' anni '80, ma comunque una bella atmosfera."
https://www.yelp.it/biz/osteria-le-arpie-bari;"Gustosissimi i primi in particolare le orecchiette con vongole e porcini e straordinari cavateli ai frutti di mare ."
https://www.yelp.it/biz/osteria-fate-infretta-a-tavola-torino;"E' la vera osteria, non solo nell'arredo anche l'atmosfera che si percepisce concorre a definire questo simpatico locale."
https://www.yelp.it/biz/osteria-della-travi-bari;"Il tutto con una modica cifra, posto carino, pulito da fermarsi per una buona cena."
https://www.yelp.it/biz/osteria-del-frate-torino;"L'osteria é caratterizzata da un ambiente molto caratteristico e romantico, il personale si è mostrato molto attento e gentile."
https://www.yelp.it/biz/osteria-del-fiat-torino;"E' la vera osteria, non solo nell'arredo anche l'atmosfera che si percepisce concorre a definire questo simpatico locale."
https://www.yelp.it/biz/osteria-dei-quattro-gatti-bari;"Adatto per una serata in compagnia, non per una cena ricercata e da fruitori con il palato esploratore."
https://www.yelp.it/biz/osteria-degli-ottoni-torino;"Fantastica l'atmosfera data dalla presenza di un camino a legna e dal soffitto a volta con mattoni a vista."
https://www.yelp.it/biz/osteria-antichi-sapori-bari;"Locale molto pulito e curato e personale gentile e cordiale, con un'evidente passione per il proprio lavoro."
https://www.yelp.it/biz/osteria-antiche-sere-torino;"Servizio impeccabile, atmosfera da vera trattoria in una zona in cui non sono ammessi i falsi storici del centro."
https://www.yelp.it/biz/osteria-al-gambero-bari;"E 'stato un pasto delizioso e un ottimo posto per prendere una bottiglia di vino per il traghetto."
https://www.yelp.it/biz/ortigia-bistrot-torino;"Il locale è bellissimo e tranquillo, ideale per le coppie e per trascorrere una bella serata con gli amici."
https://www.yelp.it/biz/oro-birra-torino;"Quella fu una gran bella serata, il calore umano e la voglia di stare insieme cancellarono i tristi pensieri."
https://www.yelp.it/biz/opera-bari;"Locale elegante alle spalle di Bari vecchia. 20 tavoli con tovagliato in stoffa.Musica da piano bar molto discreta."
