url;review
https://www.yelp.it/biz/ristoranti-taverna-delle-rose-torino-2; Ambiente familiare ma curato, luci piacevolmente soffuse che creano una bella atmosfera, personale preparato, simpatico o gentilissimo. Bella sorpresa, si è accolti in un ambiente familiare con un servizio efficiente. Proprietario molto gentile anche nei confronti dei nostri bimbi.
https://www.yelp.it/biz/ristrot-guviol-torino; Il Locale è situato in centro a Torino, non centralissimo, ma comodo da trovare. Una bella esperienza che coniuga gusto, vista, olfatto. Locale situato in posizione centrale, comodo ed accogliente.
https://www.yelp.it/biz/roar-roads-torino; I tempi di attesa sono ancora un po' altini, soprattutto se si hanno bambini con se'. L'ambiente così come il personale è cordiale ed accogliente, come deve essere in un vero pub. Sembra un locale adatto ai turisti (.. se il turista sei tu cerchi di evitare).
https://www.yelp.it/biz/rossopomodoro-torino; Per pagare la cassa funzionava benissimo e per validare il ticket del parcheggio invece no? Pizza dei bambini con pomodoro crudo e due pezzettini di wustel secchi........Bocciatissimo..... se potete evitate. Prezzo giusto con in più un omaggio di due ore del parcheggio.
https://www.yelp.it/biz/sandrino-bari; La location è bella e molto familiare. Davvero un peccato la location piccola, potrebbero attrarre e contenere molte più persone per le cose buone che fanno! Tutto molto buono...il gelato è unico, sapori unici.provate il pistacchio e il fondente di Sandrino.
https://www.yelp.it/biz/sandrino-bari-2; Paghi 2 euro per due grandi scoop (gelato Piccola) e devi pagare prima e puoi ordinare in seguito. Il gelato al cioccolato fondente che preparano in questa gelateria è unico per qualità.
https://www.yelp.it/biz/sen-mi-ya-torino-2; La soluzione è comoda anche perchè non si accede ad un buffet ma si ordina alla carta. Locale molto moderno e molto pulito, ottimo pesce e ottimo servizio, un po scarso la carta dei vini. Qualità e composizione ottima, posto carino e molto pulito, personale gentile, cortese e disponibile.
https://www.yelp.it/biz/seven-up-torino; Il locale, in posizione centrale e comoda a negozi e musei, è molto familiare e accogliente. Oltre al servizio, la nota positiva è che visto l'ambiente ristretto, si può fare amicizia coi commensali. Il ristorante si trova in una delle strade principali di Torino, quindi è facilmente raggiungibile a piedi.
https://www.yelp.it/biz/sfashion-cafe-torino; Il tutto accompagnato non dai soliti stuzzichini ma da un piatto grande di assaggi di vario tipo. La cucina spazia dalla pizza a piatti tipici della tradizione italiana senza però mai raggiungere un'eccellenza. SI pooì mangiare fuori se il tempo lo permette, al primo e secondo piano.
https://www.yelp.it/biz/sibir-torino-2; E' molto spazioso, elegante per una cena a due e soprattutto il cibo è di ottima qualità ed abbondante. Il ristorante é spazioso e ben arredato, un po' buio per ricalcare l'atmosfera siberiana. E' situato nel cuore del quadrilatero, comodo rispetto ai parcheggi.
https://www.yelp.it/biz/siciloso-torino; C'era un unico primo e un unico secondo, menu fisso a 9 euro.
https://www.yelp.it/biz/sicomoro-torino; Adatto a coppie, ma anche a gruppi di amici. Ps: parcheggio impossibile, partite un'ora prima di casa. Ambiente elegante e raffinato ma al tempo stesso moderno e originale nei dettagli!
https://www.yelp.it/biz/silvano-torino-2; Locale carino, comodo per una pausa caffè, il gelato merita una fermata ma se siete in zona. Da registrare inoltre un servizio abbastanza freddo e parco di sorriso. Bel locale situato non proprio in centro ma comodo per arrivarci.
https://www.yelp.it/biz/singapore-torino; Personale cordiale, servizio veloce, cibo cinese di ottima qualità e prezzi bassi.
https://www.yelp.it/biz/sotto-la-mole-torino; Situato di fronte alla Mole, il locale è silenzioso ed espone con orgoglio attestati di riconoscimento per i formaggi. La location è molto carina e si trova proprio, come dice il nome del locale appunto, sotto la mole. la location da sola merita una visita.. il sotto la mole non poteva chiamarsi in altro nome .
https://www.yelp.it/biz/soul-kitchen-torino; Unico aspetto negativo il servizio, che non è assolutamente all'altezza del tipo di locale e di cucina. Questo locale propone piatti particolari, ben realizzati e ottimamente presentati in un ambiente tranquillo, quasi intimo. Focaccia gourmet mentre assoluta nota negativa per la Farinata piccola e veramente cruda.
https://www.yelp.it/biz/soup-e-go-torino; Locale molto molto carino, piccolo ma, in realtà, spazioso (ha posto sia dentro che fuori). A partire dall'ambiente che è curato e caldo, il personale molto gentile e la qualità delle zuppe molto elevata. Ideale per una pausa pranzo diversa dal solito panino, fresca e salutare e a prezzi contenuti.
https://www.yelp.it/biz/spada-reale-torino; Un po' più di spazio avrebbe reso la conversazione più agevole e il soggiorno più comodo. Locale spazioso, appena a ridosso della piazza ma con prezzi onesti e pietanze ben presentate. Menu vario, con piatti elaborati e di qualità in una location centralissima e comoda.
https://www.yelp.it/biz/spaghetteria-70cento-bari; Il nuovo menù coniuga la tradizione della vecchia spaghetteria con l'innovazione di nuove proposte. Il personale è cortese e disponibile, si respira un'aria familiare ormai difficile trovare! Locale facilmente raggiungibile nel centro di Bari, atmosfera familiare e non caotica.
https://www.yelp.it/biz/spazio-la-stampa-torino; Spazi interattivi, personaggi che hanno reso famosa la testata.
https://www.yelp.it/biz/sushitao-bari; Comoda la possibilità del menù all you can eat , costo 20€ a pranzo. Personale disponibile parcheggio facile da trovare , il susci era veramente buono. Nonostante questo la qualità del pesce è buona e l ambiente risulta accogliente.
https://www.yelp.it/biz/t-bone-station-torino; Pulled pork divino, menù bimbi ottimo e presentato in una macchina di cartone (bimbo). Per parcheggiare, c'è una convenzione con un parcheggio in via Confienza. Ristorante di carne, eclettico per ospitalità, dalla famiglia a gruppi numerosi.
https://www.yelp.it/biz/taiki-bari; Servizio: cortesi e di media velocità, locale pulito e tranquillo, in un punto comodo da raggiungere. Il locale tra l'altro è stato ampliato ed ora è più spazioso ed accogliente. Locale figo,chic,spazioso ma accogliente grazie anche alla competenza dei proprietari e del personale.
https://www.yelp.it/biz/taverna-delloca-torino; Grazie per l'attenzione portata per una persona gluten Free, una a dieta e per i bimbi. Situato in posizione centrale affacciato sul giardino Aiuola Balbo a pochi passi dal parcheggio Valdo Fusi. Il locale si trova nel centro di Torino, ed è un po' penalizzato per il parcheggio.
https://www.yelp.it/biz/taverna-rossa-di-zappia-pasquale-torino; Pizza ottima, sia tradizionale che al Tegamino, anche ottima la birra alla spina, locale familiare e accogliente La pizza è in due versioni: classic or padellino, per la gioia dei bambini. Unprepossessing dall'esterno si tratta di un ristorante a conduzione familiare locale vero e proprio.
https://www.yelp.it/biz/teapot-torino; Il locale è carino, le seggiole tutte diverse e le teiere sugli scaffali rendono particolare e familiare il locale. Situato a TORINO questo locale presenta un location davvero unica, familiare, ma soprattutto di grande gusto e sapore! L'ambiente appare molto familiare e accogliente, il proprietario gentilissimo e attento e tutti molto cordiali e sorridenti.
https://www.yelp.it/biz/the-bakery-torino; Anche i bambini apprezzano, ci si torna volentieri. Piccolo locale in centro città, molto colorato e pulito in stile anglosassone con echi francesi. La location e' molto carina: piccola ma ben studiata e con molto dettagli simpatici.
https://www.yelp.it/biz/the-egg-torino; Chef giovanissimi che cucinano a vista dei commensali, cura del dettaglio e cortesia in un ambiente accogliente e genuino. Ambiente informale ma elegante, servizio molto attento e offerta gastronomica originale e molto gustosa. Ottima l'accoglienza, ottima la proposta del menù della cena con gli assaggi di cicchetti.
https://www.yelp.it/biz/the-stuart-pub-bari; Classico irish pub, il locale ha una convenzione con un parcheggio data la difficoltà in zona.
https://www.yelp.it/biz/tiella-bari; Valida alternativa per uno spuntino o una cena familiare fuori casa, divertente punto d'incontro per una serata tra amici. Locale molto carino,luci giuste,sedute comode.In questo periodo si trova agevolmente parcheggio lì vicino!! Di sabato festivo e con opportuna prenotazione.Locale affollato e con spazi limitati.
https://www.yelp.it/biz/tobiko-torino; Comoda da raggiungere con parcheggio nelle vicinanze di piazza Solferino. In conclusione, un posto da cui ci si aspetta molto di più di ciò che poi effettivamente si riceve. L'ambiente, inoltre, è curato e tranquillo, ben differente dai locali super affollati che solitamente si incontrano a pranzo.
https://www.yelp.it/biz/tommy-tegamino-torino; Insomma, un posto ideale per mangiare, anche a pranzo, in modo simpatico e gustoso. Il locale è piccolo ma davvero molto carino, curato e pulito. Molto carino, pulito e ben gestito con cordialità ed esperienza!
https://www.yelp.it/biz/toscano-torino-3; Cena con amici, ambiente familiare,mangiare di ottima qualità e possibilità di scegliere tra piatti tipicamente toscani e non. Il locale è datato negli arredi, conduzione familiare, personale gentile e non assillante servizio veloce, pulizia buona. Il ristorante si trova proprio in centro di Torino (parcheggio piazza Arbarello), traversa di via Barbaroux.
https://www.yelp.it/biz/trattoria-alba-torino; E' stata una piacevole sorpresa: una vera trattoria a conduzione familiare, piatti tradizionali ad un prezzo realmente concorrenziale. Ambiente semplice e pulito, personale molto gentile (anche con i bambini), cibo buono e conto onesto. Simpatica trattoria in pieno centro a Torino, pratica e comoda da raggiungere.
https://www.yelp.it/biz/trattoria-da-cinzia-torino; La posizione non è centrale, ma raggiungibile molto comodamente con la metropolitana nelle vicinanza parcheggio taxi. Ultimo ma non meno importante il clima familiare e la gentilezza dei proprietari. Trattoria storica a gestione familiare nel quartiere San salvario con cucina tipica abruzzese.
https://www.yelp.it/biz/trattoria-mombercelli-di-antico-elena-torino; Famiglie, coppie di giovani e anziani, gente comune della zona tutto molto tranquillo come a casa. Per gruppi numerosi si consiglia di prenotare, il locale è molto piccolo. Trattoria a conduzione familiare, ambiente casalingo, porzioni generose, buon rapporto qualità/prezzo.
https://www.yelp.it/biz/trattoria-piemontese-torino; Locale ampio con mattoni rossi a vista e seggiolini in legno che sanno molto di rustico. È abbastanza grande per poter organizzare cene con gruppi numerosi. Peccato perche era comodo per certe serate nella zona
https://www.yelp.it/biz/trattoria-spirito-santo-torino-2; Unico neo, scarso parcheggio nei dintorni, ma non si può pretendere in via Guido Reni!!! Atmosfera fmiliare Tutto buono, coniuga qualità eccellente a prezzi contenuti. Adesso i coni sono al biscotto, e i prezzi sono rimasti quasi invariati, cioè bassi vista la media torinese.
https://www.yelp.it/biz/trattoria-torricelli-torino; L ambiente e' sempre accogliente e familiare e il servizio e' gestito in maniera garbata e simpatica. Locale semplice senza fronzoli ma ben arredato e con spazi confortevoli, all'esterno si teova in grazioso dehor. Il locale è arredato con semplicita e finalmente tavoli larghi ed ampi anche per 2/3 persone.
https://www.yelp.it/biz/tre-galline-torino-2; Buona cucina tradizionale piemontese in ambiente familiare. Dolce, acqua e una bottiglia piccola di Goj, Barbera vivace, come il suo nome (Goj = Gioia in piemontese). Un nota ancora più alta va al guanciotto brasato, confermando quanto indicato dal proprietario si taglia con un grissino!
https://www.yelp.it/biz/turet-torino; Sottolineo 29 visto che il numero massimo sarebbe stato 25, semmai avessero voluto giocare il numero vincente al lotto. La location e' ottima, centrale ma vicina a parecchi parcheggi a sbarra. Un ambiente informale in cui poter andare anche coi bambini.
https://www.yelp.it/biz/urban-bari; Il locale è spazioso ed originale, creato appositamente per ritenersi accogliente. Location molto accogliente con luci calde e ampi spazi. Il posto è elegante e pulito, il servizio efficiente e si può mangiare quel che si vuole con poco.
https://www.yelp.it/biz/vale-un-per%C3%B9-torino; Cucina molto buona coi piatti tipici Peruviani.
https://www.yelp.it/biz/vanilla-torino; Un buon gelato in pieno centro: si può scegliere fra numerosi gusti, alcuni classici altri più originali. Peccato per gli spazi ormai troppo angusti per contenere una clientela affezionata e straripante Gelateria assolutamente DELIZIOSA...piccola, accogliente, pulitissima....gelati super buoni ...anche quelli vegani........tutto fatto con passione e professionalità'.......Simone e Bruno sono speciali......consigliatissimo!!!!!!!!!!!!!!
https://www.yelp.it/biz/vitelloni-torino; Il personale è stato gentile e disponibile, il locale era pulito e spazioso e la tavola apparecchiata con cura. Il locale è spazioso e spesso anche pieno, ma il servizio è veloce ed efficiente. Girocarne con amici, il locale è ottimo per le cene di gruppo, essendo spazioso.
https://www.yelp.it/biz/vo-torino; Personale gentile, preparato e servizio di alto livello, tavoli ampi e spazio adeguato tra di essi, corretta l'illuminazione. Ristorante a pochi passi dal centro e con difficoltà di parcheggio nei dintorni. Livello del servizio elevato, spazi adeguati tra i tavoli ed arredamento curato.
https://www.yelp.it/biz/volver-torino-2; Ottimo posto anche per una cena in famiglia con bambini con menù ad ok. Luogo accogliente e familiare, il servizio è l'accoglienza impeccabili, gentili! L'ambiente è anche abbastanza spartano infatti i tavoli di legno sono coperti con tovagliette di carta.
https://www.yelp.it/biz/vyta-torino; Il personale e' molto gentile e sono a disposizione anche numerosi tavoli sia all'interno che all'esterno. Il bar è tranquillo è comodo, ampi tavoli Prima di partire in stazione porta nuova VyTA è' il posto ideale per un panino e un caffè.
https://www.yelp.it/biz/wispobish-torino; I prezzi sono acettabili in rapporto con la qualita .Locale nuovo, pulito, e persone giovani e in gamba. Locale molto carino e colorato in cui poter assaggiare un pò di piatti tipici.
https://www.yelp.it/biz/zucca-torino; Questo locale storico situato nel centro di Torino è consigliato per ogni tipo di occasione: lavoro, amici,coppie e famiglie. Il piano terra è tuttavia poco spazioso per sedersi ed i prezzi abbastanza elevati. Torino si può fregiare di un bar elegante, pulito, con un ottimo servizio merito di personale esperto e professionale.
