url;review
https://www.yelp.it/biz/mc-donalds-torino-5; È stato davvero stupendo osservare come gli operatori pluriservizio maneggiassero il cibo a mani nude, davvero. A pranzo e durante la giornata si servono i soliti menù e panini tipici della catena.
https://www.yelp.it/biz/mcdonalds-bari-3; E' situato su due piani - c'erano posti liberi al piano terra.
https://www.yelp.it/biz/mexico-70-torino; Il ristorante è molto spazioso e accogliente, i piatti sono abbondanti e a un prezzo del tutto ragionevole. Classico ristorantino cinese di quartiere posto su c.so Montegrappa viale alberato, nei pressi del Parco della Tesoriera. Zona sicuramente decentrata, ma buona per il parcheggio.
https://www.yelp.it/biz/mezzaluna-osteria-torino; Ambiente familiare, il locale è tutto dipinto con scene pittoresce di una vita in un borgo di mare. Anche ad ordinare una sola portata non si resta con spazi utili ad una seconda portata. L osteria Mezzaluna conserva l'impronta tipica di un osteria ma in un contesto curato, familiare...
https://www.yelp.it/biz/miagola-cafe-torino; Per i bambini è un posto fantastico ma anche per gli adulti che amano gli animali è perfetto! Comodo da raggiungere a piedi dal centro di Torino e con la macchina parcheggiata in Piazza Carlo Felice. Sono puliti e hanno il pelo morbido, mentre le loro cuccette e case-gioco-graffiatoio sono praticamente nuove.
https://www.yelp.it/biz/michi-tanzariello-torino; il locale consente numerosi coperti, è arredato in stile piacevole e moderno. Locale ampio e piacevole anche se con spazi stretti tra i tavoli. (Accettano prenotazione solo x gruppi da 10 persone in su)
https://www.yelp.it/biz/monegato-torino; Anzitutto il locale è accogliente colorato e l'ambiente è familiare. Locale che si affaccia sul parcheggio coperto di via madama. Consigliato soprattutto a pranzo per chi non ha molto tempo per mangiare piatti tipici piemontesi e non solo
https://www.yelp.it/biz/monferrato-torino; Qui è tutto classico e medio, non ci sono spazi per avventure ma neppure per delusioni. Scelto uno dei 4menù degustazione x gruppi. Servizio impeccabile, ambiente piacevole e tranquillo, conto non a buon mercato ma in linea con la qualità del cibo.
https://www.yelp.it/biz/monte-dei-cappuccini-torino; La struttura non dispone di un parcheggio privato e data la località turistica non è facile trovare facilmente. Difficoltoso arrivare (il parcheggio in zona non è cosa facile) ma vale la pena. Location molto bella ..difficile il parcheggio ma bisogna adattarsi!
https://www.yelp.it/biz/mr-rooster-torino-3; Al momento presente solo una sala sul piano principale, è in apertura una seconda sala al piano seminterrato. ottima Ottima cucina ottima accoglienza un personale molto cortese pronto a risolvere qualsiasi problema del cliente. I panini non erano ottimi e un po' piccoli ma i prezzi abbastanza bassi.
https://www.yelp.it/biz/napples-torino; Si consiglia se non necessario di non usare auto ma la comoda fermata Marconi della metro. Il locale è pulito e il servizio veloce ma cortese e puntuale, il proprietario alla cassa è sempre gentilissimo. Location semplice ma curata, personale molto gentile e cordiale, prezzi bassi e ottime combinazioni di pizze.
https://www.yelp.it/biz/niva-cremeria-torino; Questa piccola perla fi gelateria artigianale nel cuore di Torino è stata una piacevolissima sorpresa. in centro locale pulito e elegante, a volte la coda fuori dal locale! La piccola gelateria si trova nei pressi della stazione ferroviaria Porta Nuova.
https://www.yelp.it/biz/nuova-dezzuto-torino; Ed è piuttosto evidente che la presenza dei bambini non è gradita. E per la bimba anche le pizzette ! Si può pagare in piedi al banco all'interno di un centro commerciale 2 crodini 10 eur ????
https://www.yelp.it/biz/nuovo-fizzarotti-bari; Personale cordiale e gentile, ambiente piccolo ma rilassante ed elegante, sito nel bel Corso Vittorio Emanuele II a Bari. L'ambiente è moderno e pulito, le luci soffuse, la musica di sottofondo e tutti (clientela e personale)parlano sottovoce. Posizione centrale con ambiente piccolo, Tavoli moderni arredati con complementi dal bel design ma dalla poca praticità.
https://www.yelp.it/biz/old-wild-west-torino; Comodo all'Allianz Arena il locale è uguale ai vari fratelli sparsi più o meno in tutta Italia. posto gradevole divertente idealew per amici o famiglie...la qualità della carne è ottima il servizio veloce Senza infamia e senza lode, posto carino da portarci i bambini.
https://www.yelp.it/biz/olsen-di-caldi-cinzia-torino; Non c'è possibilità di parcheggio nelle vie limitrofe quindi una sana passeggiata è d'obbligo. Il posto è molto carino, si tratta di una piccola sala da thé in centro (traversa di via Garibaldi). L'ambiente è sempre caldo ed accogliente, il personale è educato ma malinconico, un sorriso in più non guasterebbe.
https://www.yelp.it/biz/oolivoo-bari; Location carina, ristorante nuovo e pulito con camerieri simpatici e gentili.
https://www.yelp.it/biz/open-baladin-torino; Locale in pieno centro, con la grande comodità di avere il parcheggio sotterraneo di piazzale Valdo Fusi (a pagamento). Le pareti di vetro consentono ai genitori di osservare i propri figli giocare nella piazza pedonale. Locale giovanile e molto vivace, nel centro della città, moderno e bene attrezzato.
https://www.yelp.it/biz/opera-bari; È perfetto sia per le coppie che per le famiglie. Locale elegante alle spalle di Bari vecchia. 20 tavoli con tovagliato in stoffa.Musica da piano bar molto discreta. Pesce freschissimo e cucina creativa e ricercata in un ambiente accogliente e piacevole, personale gentilissimo!!!
https://www.yelp.it/biz/ortigia-bistrot-torino; Il locale è bellissimo e tranquillo, ideale per le coppie e per trascorrere una bella serata con gli amici. Ottimi sia la presentazione dei piatti, che la freschezza degli alimenti, ambiente molto accogliente e proprietario simpaticissimo. Cena davvero squisita, personale cortese e professionale, ambiente intimo, pochi tavoli e buona musica jazz di sottofondo.
https://www.yelp.it/biz/osteria-al-gambero-bari; L'ambiente è accogliente e familiare ed hai la sensazione di essere invitato a casa dei suoi titolari. Buonissima cena in questo ristorante a conduzione familiare. Vito, il titolare è l'unica cosa positiva un po' invecchiato ma sempre il re dell'accoglienza e della simpatia.
https://www.yelp.it/biz/osteria-antichi-sapori-bari; Locale molto pulito e curato e personale gentile e cordiale, con un'evidente passione per il proprio lavoro. Servizio in sala ottima accoglienza.Location e professionalita unica nel vero senso della parola. È adatto per una cena in famiglia...in un ambiente caldo.
https://www.yelp.it/biz/osteria-dei-quattro-gatti-bari; Non si può far attendere i clienti più di un ora al freddo, magari ci sono anche i bambini. Locale davvero molto accogliente, grandi spazi , grandi tavolate ma anche ottimo per cene a 2. Il ristorante è comodo, moderno ed il servizio è rapido e puntuale.
https://www.yelp.it/biz/osteria-del-fiat-torino; Con la nuova linea della metro è abbastanza comodo arrivarci, anche per chi non ha l'auto. Una bella scoperta in una zona comoda agli ospedali e al centro commerciale del lingotto. Comodo vicino al lingotto ma decisamente per turisti, mediocre e decisamente caro.
https://www.yelp.it/biz/osteria-del-frate-torino; Ben arredato, parcheggio ampio vicino al ristorante, menu non ampio ma di qualità superiore alla media. Anche il sugo al pomodoro, condimento della pasta dei bambini, era profumatissimo e ottimo! Più che Osteria, piatti perfetti e accoglienza famigliare ma discreta, un appetitivo e bruschetta al tavolo in attesa dell'ordinazione.
https://www.yelp.it/biz/osteria-della-travi-bari; Variegati e numerosi gli antipasti serviti (funqhi, pepata di cozze, frittata, finocchi gratinati, focaccia, verdure grigliate, ecc.). Ambiente storico, un poco troppo luminoso, ma ti accoglie con calore, storia ed affetto familiare. cucina tipica in un ambiente molto familiare e davvero ben organizzato. ottimi gli antipasti abbondanti
https://www.yelp.it/biz/osteria-fate-infretta-a-tavola-torino; Una bella scoperta in una zona comoda agli ospedali e al centro commerciale del lingotto. Comodo vicino al lingotto ma decisamente per turisti, mediocre e decisamente caro. Il locale è raccolto e dall'aria familiare, il cibo nella norma.
https://www.yelp.it/biz/osteria-le-arpie-bari; Piatto di orecchiette in bianco per la bimba, mezza caraffa di vino..46 euro...mangiato bene, pesronale gradevole e simpatico! Leggere tanta soddisfazione nelle sue parole, anche per la straordinaria bontà dei nostri dessert tipici, ci gratifica enormemente. Sapori tipici di mare e di terra e finalmente le orecchiette al ragù con braciola...
https://www.yelp.it/biz/osteria-rotonda-dei-facchinetti-torino; Locale ampio, con parcheggio nelle vicinanze.Buona scelta, piatti di qualità, personale veloce e gentile. Locale luminoso familiare chef molto cordiale cucina ottima piatti ben impiattati abbinamenti sapori ricercati Personale gentile e disponibile, una mano in più nelle ore di punta farebbe comodo!
https://www.yelp.it/biz/osteria-sopravento-bari-2; Grazie, grazie ed ancora grazie al proprietario Sergio(ne) in cucina, e Alberto in sala, cordiali e in clima familiare. Inoltre la conduzione è familiare e ti mette molto a tuo agio! Locale piccolino, accogliente e con una forte atmosfera familiare.
https://www.yelp.it/biz/ottimo-torino; Una comoda panchetta all'esterno della vetrina permette di sbafarsi i coni di varie pezzature. Ottime quelle salate, a pranzo o per uno spuntino gustoso diverso dai soliti panini / tramezzini dei bar. Anche il prezzo è conveniente, 2€ il cono piccolo in confronto ai 2.50/3€ soliti.
https://www.yelp.it/biz/paco-torino; Allegria musica e tanto cibo buono , condito da un servizio familiare e veramente accogliente!!! Il cibo è molto buono ed è affascinante vedere i cuochi preparare il proprio piatto in un ambiente amichevole. Il locale si presenta molto bene, pulito ed elegante da fuori e pieno di carattere all'interno.
https://www.yelp.it/biz/palazzo-barolo-torino; Le guide che accompagnano i visitatori sono appassionate ma dilettanti, i soliti volontari. Lo scalone interno che porta al piano nobile è bellissimo
https://www.yelp.it/biz/panino-giusto-torino; Grazioso, pulito con un servizio di qualità e i cibi preparati in maniera rapida e molto buona. All' interno del centro commerciale 8 gallery, ideale per pausa pranzo o pasti veloci. Sicuramente un posto adatto all'8 Gallery: pratico e con piatti veloci.
https://www.yelp.it/biz/panperfocaccia-torino-2; Di sabato sera molto affollato con spazi ristretti meglio prenotare cucina e pizze buone servizio cordiale e veloce. Detto questo con i prezzi che hanno, due seggiolini da 9,90€ potrebbero anche comprarli. Location comoda, nel centro di Torino, con possibilità di pranzare all'aperto.
https://www.yelp.it/biz/pasta-mon-amour-torino; L'unica pecca è il parcheggio: non si trova facilmente! Per coppie o amici ma non gruppi numerosi . x il parcheggio è vero......:(  a presto!!
https://www.yelp.it/biz/pastamaneria-torino; Prezzi onestissimi, i gestori del locale cucinano e servono ai tavoli in un'atmosfera subito familiare e intima. Si presenta molto piccolo internamente, per cui è adatto al massimo per famiglie di 4 persone. Sapori intensi ma leggeri e digeribili, apprezzati anche dai bimbi.
https://www.yelp.it/biz/pastificio-defilippis-torino; Affollato spesso al mezzogiorno, comodo anche per mangiare da soli al bancone lungo le pareti. Piccolo ma con eccellente utilizzo degli spazi. Tra i secondi: lo stinco di maiale con purea di mele renette, il brasato con castagne e la trippa.
https://www.yelp.it/biz/peperosso-torino; La gestione familiare garantisce un servizio cortese ed attento. Bella la zona, un po' difficile il parcheggio. Ristorante modesto e familiare ma certamente genuino.
https://www.yelp.it/biz/pepino-torino; Forse manca un poco di fantasia nei pur numerosi gusti dei gelati e nella preparazione di cocktail. servizio veloce e professionale,paziente soprattutto con i bambini a volte indecisi ma entusiasti di tanta bontà!!! La posizione lo rende una breve pausa dall'ufficio e una pausa dall'essere in gruppi turistici.
https://www.yelp.it/biz/perbacco-bari; Il locale è davvero carino, molto intimo e familiare, la qualità del cibo ottima, il personale cortese. Ambiente raccolto, con pochi tavoli, certamente intimo ed al tempo stesso familiare. Per entrare bisogna suonare il camPanello, sintomatico di ambiente raccolto e familiare.
https://www.yelp.it/biz/piano-b-torino; Si tratta di un locale piacevole, ben arredato e con spazi comodi per conversare senza essere ascoltati dai vicini. Impasto molto leggero digeribile ottima qualità da tornare sicuramente, personale simpatico e disponibile...locale spazioso e originale La margherita per la bimba a forma di coniglietto bella e molto buona.
https://www.yelp.it/biz/piazza-vittorio-veneto-torino; Ospita inoltre numerosi ristoranti, locali e negozi, molti dei quali rinomati.
https://www.yelp.it/biz/piola-cianci-torino; Cibo buono, location privo di spazi e personale che ti da fretta, inserita nel centro storico di Torino. Piccolissima trattoria nel centro di Torino a due passi dal Duomo e da un comodo parcheggio sotterraneo. Il locale è la classica Piola in cui si respira un'aria familiare e di rustico.
https://www.yelp.it/biz/pippo-paranza-torino; Può essere non semplice trovare parcheggio specialmente il venerdì e sabato sera. Ambiente piccolo ma familiare, veloci nel servizio e gentilissimi. Ristorante piccino e modesto in zona quadrilatero.
https://www.yelp.it/biz/pizza-ad-hoc-torino; Servizi igienici ampi, puliti ed in ordine (anche se ce n'è uno solo). Ottima esperienza, pizza buonissima, personale disponibile, locale spazioso, buoni prezzi. Insomma, una bella serata in un clima piacevolmente familiare.
https://www.yelp.it/biz/pizza-pistrocchio-torino; Ottima la possibilità di prendere pizze piccole per i bambini il che permette di non sprecare e risparmiare. Pausa a pranzo al lavoro , locale pulito personale gentile prezzi nella norma la pizza era molto buona Ottima la possibilità di prendere la pizza piccola che permette di risparmiare e non avanzare inutilmente la pizza.
https://www.yelp.it/biz/pizzeri-lapislazzulo-torino; Pur prenotando si aspetta per via dei numerosi clienti, ma comunque vieni avvertito al momento della prenotazione. I proprietari sono sempre molto gentili e disponibili,rendono l'ambiente molto accogliente e familiare. Il personale è gentile e accogliente, il clima familiare.
https://www.yelp.it/biz/pizzeria-aladino-bari; Pizza buona e locale accogliente, meglio prenotare se si è numerosi. Prezzi bassi per una qualità mediocre sia per quanto riguarda gli antipasti che per le pizze. Il locale non è bello, il cibo non molto saporito ma i prezzi sicuramente bassi.
https://www.yelp.it/biz/pizzeria-amalfi-torino; Comunque posto accogliente anche per famiglie e amici con cani. Soliti, essendo vicino alla vecchia residenza a recarci presso la Pizzeria Amalfi...una vera scoperta! L'ambiente è piuttosto anonimo ma il cibo fa per fortuna dimenticare questo dettaglio secondario.
https://www.yelp.it/biz/pizzeria-au-lapin-agile-torino-2; L'unica difficoltà è rappresentata , senza responsabilità del titolare, dal reperire parcheggi alla vettura all'esterno del locale. L'unico problema, non legato al locale, e' la difficolta' di trovare parcheggio. La zona è tranquilla e non è neppure stato difficile trovare parcheggio.
https://www.yelp.it/biz/pizzeria-baraonda-bari; Locale adatto per vivere serate in un clima familiare e a cene con gli amici di sempre! È un locale a conduzione familiare ed è sempre stata una gradevole esperienza, senza pretese ma gradevole. L'ambiente è semplice ma tutto sommato curato (c'è anche la TV) e la gestione è familiare.
https://www.yelp.it/biz/pizzeria-bella-vita-torino; Con i bimbi piccoli non si ha a disposizione tutto quel tempo per pizza e chiacchere con la nutella. Un po' fuori mano e, in zona, è difficile trovare parcheggio. Tutto il cibo era ottimo, gradito anche dai bambini.
https://www.yelp.it/biz/pizzeria-continental-pizzorante-bari-2; Ambiente raffinato ma al tempo stesso familiare, la cortesia discreta d'altri tempi dei camerieri, la pizza ottima. Pizzeria in pieno centro, locale spazioso ed accogliente, personale gentile, ampia scelta di antipasti e pizze strepitose. In centro ma vicino ad un cavalcavia, non il massimo, comunque comodo anche perchè vicino alla stazione
https://www.yelp.it/biz/pizzeria-da-donato-bari; Impeccabile, Decisamente da provare, ambiente familiare scelta molto vasta di pizze, cortesia del personale ottima. Consigliatissimo anche per famiglie e per comitive non numerose. Trovare parcheggio in zona però è un'impresa.
https://www.yelp.it/biz/pizzeria-da-michele-torino; Antica trattoria a gestione familiare con una particolare cucina a vista, pochi tavoli e forse un po' troppo affollato. Non c'è parcheggio, meglio prenotare prima, si mangia anche piatti tipici torinesi. piacevole. Il locale è piccolo ma ha un'atmosfera familiare e cordiale
https://www.yelp.it/biz/pizzeria-di-cosimo-bari; Possibilità di mangiare anche una pizza seduti nella sala adiacente, sia pur con pochi posti a sedere. A parte questo dettaglio, la pizza è quella di sempre e i prezzi sono bassi. Il locale è piccolino ma organizzato abbastanza bene nonostante la mole di persone..
https://www.yelp.it/biz/pizzeria-divina-bari; Clima informale e atmosfera calda e familiare. Piatti tipici della cucina pugliese di ottima qualità , nonchè pizze della tradizione barese con ingredienti freschi e di stagione.
https://www.yelp.it/biz/pizzeria-dual-torino; Posto in una delle più belle piazze di Torino, il locale presenta ambienti luminosi e ampi. Unico neo è la difficoltà di trovare parcheggio vicino, ma ne approfitteremo per fare una passeggiata! Ideale per famiglie grazie alla possibilità di gustare anche pizze e burger .
https://www.yelp.it/biz/pizzeria-enzo-e-ciro-di-fraddosio-v-c-bari; Il locale si trova in una via centrale di Bari, ma con il dramma del parcheggio in città. Il posto è carino, all'aperto. nessun problema per il parcheggio e disponibilità di posti in abbondanza. I locali sono fantasticamente uguali da quasi venti anni o più, creando un ambiente familiare.
https://www.yelp.it/biz/pizzeria-fratelli-la-bufala-torino; Vero relax per chi ha bimbi piccoli ma anche per chi non ne ha, avendo spazi separati e dedicati. Locale molto bello , accogliente e grande.Bimbi visibili da un vetro mentre giocano e tu sei a tavola . Se si hanno bimbi e si vuole passare una serata tranquilli c è l area bimbi con animatrice.....
https://www.yelp.it/biz/pizzeria-giampy-di-mazzola-giuseppe-torino; Meglio raggiungerla in metro (fermata Marconi) il parcheggio è difficile da trovare come per tutta San Salvario !! Si fatica a trovare il parcheggio nel week end ma ci vuole un po di fortuna.Consigliato Posizione sicuramente comoda a due passi da San Salvario.
https://www.yelp.it/biz/pizzeria-gino-torino; Farinata e pizza fantastiche, ambiente familiare e camerieri molto gentili. Ambiente molto familiare e un pochino caotico il fine settimana. Farinata buonissima, tegamino molto buono, unico difetto non poter prenotare.. però l'attesa vale la pena.. consigliato!
https://www.yelp.it/biz/pizzeria-la-sacrestia-torino; Ambiente retrò, aperto fino a tardi, personale sempre con il sorriso.
https://www.yelp.it/biz/pizzeria-poldo-torino; Locale Super Illuminato con possibilità di parcheggio. Ottima pizza al tegamino,alla pala, farinata spettacolare.Personale gentile e disponibile,forse troppo apprensivi.Locale accogliente e pulito. Tavolini all'aperto nell'area pedonale con sfondo della chiesa di San Bernardino in fondo al viale.
https://www.yelp.it/biz/pizzeria-silvestro-torino; E' localizzato in posizione spesso trafficata ,ma si trova sempre parcheggio . Ospitali e cordiali con i bimbi piccoli. Il tutto coccolati in un ambiente bello, pulitissimo (bagni compresi) e confortevole adatto ad ogni occasione, con prezzi corretti.
https://www.yelp.it/biz/pizzeria-tarantini-al-cancello-rotto-bari; Ottima accoglienza giardino all'aperto accogliente e ben attrezzato con personale educati e professionale. Locale moderno e spazioso, con menù vario, ma con prezzi fuori dalla media. Il parcheggio ha qualche problemino se non si trova lungo la via
https://www.yelp.it/biz/pizzeria-vecchia-londra-torino; Ristorantino molto comodo e servizio a pranzo molto rapido. Ambiente un po' retro, menu con una vasta scelta, sia di cucina che di pizzeria e servizio molto cordiale. Ambiente intimo e raccolto, ottimo per una tranquilla cenetta a due, in famiglia o con pochi amici.
https://www.yelp.it/biz/pizzeria-vecchio-forno-garibaldi-torino; Conviene prenotare e tenere presente che in zona il parcheggio è un problema. Locale semplice, molto accogliente anche se con spazi un pò ridotti. Il locale è piccino per cui conviene prenotare tutti molto cordiali
https://www.yelp.it/biz/platti-torino-2; Accoglienza molto garbata e gentile, un benvenuto con un calice di prosecco accompagnato da una salsiccia di Bra eccellente. Il cameriere in sala seppure abbastanza impreparato è stato l'unico a prodigarsi per servirci al meglio delle sue possibilità. Ottimo il rapporto qualità prezzo cosi come l'accoglienza e la cortesia del personale.
https://www.yelp.it/biz/poormanger-torino; Locale molto noto in centro Torino, adatto ai giovani e molto organizzato per servire velocemente i numerosi avventori. Scortesi e poco disponibili con le famiglie con bambini. Non accettano prenotazioni data la mole di gente di passaggio ma svolgono un servizio di ricambio tavolo abbastanza efficiente.
https://www.yelp.it/biz/porcaloca-torino; Se si presentassero col sorriso forse la grande pizzeria d'asporto diventerebbe un po' più familiare. Buon punto di riferimento per una serata tra amici anche con bimbi piccoli. Farinata molto buona e pizza altrettanto..sia al tegamino che al.mattone. locale bello e pulito personale gentile
https://www.yelp.it/biz/porto-di-savona-torino; Comodo e buono , cucina italiana . Pranzo di coppia, un locale storico di Torino e un ambiente davvero accogliente Servizio impeccabile, preciso e molto cortese. Ideale per gli amanti del buon cibo all'interno di un locale caratteristico in una delle più belle piazze d'Europa.
https://www.yelp.it/biz/premiata-osteria-dellhermada-torino; Il locale é molto familiare ed accogliente, un atmosfera che ricorda molto un'osteria o una locanda. Posto sulla precollina, dietro la Gran Madre, con possibilità di parcheggio in zona. La piccola saletta grazie a un sapiente gioco di specchi!
https://www.yelp.it/biz/prima-e-poi-torino; Una buona pizza, ben posizionato, grande abbastanza per ospitare gruppi, TV con la trasmissione delle partite di calcio. C'è un menù per i bimbi, con seggioloni/fasciatoio e bavagliolini d'ordinanza. Locale comodo vicino alla stazione Porta Nuova.
https://www.yelp.it/biz/quattro-soldi-torino; Il ristorante è un classico locale per giovani e famiglie. Il locale è molto intimo, elegante e dallo stile piacevolmente all'antica, molto pulito e in ordine. Il servizio all'altezza è una buona accoglienza dei gestori con un buon rapporto qualità prezzo.
https://www.yelp.it/biz/quelli-che-ben-pensano-torino; Servizio veloce, pizze molto buone e locale abbastanza familiare ed informale. Sabato sera con famiglia,pizza molto buona e ben condita,anche per bambini! Unico neo perché il locale è grazioso, con tanto di dehors, sono veloci a servire e gentili.
https://www.yelp.it/biz/ristopizza-giampaolo-bari; Ristorante di classe in un punto chic e appartato del centro città, dispone di ampi spazi sfruttati con eleganza. Menù descritto dal capo sala a voce con ampi consigli su pietanze e vino. Locale adatto a gruppi di amici perché un po' caotico data l'ampiezza della sala.
https://www.yelp.it/biz/ristorante-consorzio-torino; Consorzio è sempre una sicurezza, forse più adatto per cena romantica che per cena tra amici in gruppi numerosi. Il menù degustazione da 35€ è la scelta ideale per conoscere la cucina di questo ristorante ed apprezzarla. ambiente accogliente ed informale , servizio attento e gentile , menu degustazione consigliato , grignolino casalese ottimo .......
https://www.yelp.it/biz/ristorante-lo-scoglio-da-vito-bari-2; Cos'altro aggiungere, per il problema del parcheggio basta fare due passi a piedi. Ambiente e servizio familiare ed elegante, ottimo anche per lavoro. Ristorante molto adatto ad estimatori del crudo di mare e del pesce da gustare in tutte le sue forme.
https://www.yelp.it/biz/ristorante-peppino-torino; Comodo da raggiungere a piedi, il locale si presenta bene e pulito... Locale pulito, accogliente, piccolino, quindi si sta un po' stretti, ma le ragazze trovano soluzioni per accontentare tutti. locale storico al centro di torino con piatti mediocri e prezzi popolari ideale per il pranzo di lavoro
https://www.yelp.it/biz/ristorante-ratatui-torino-2; Sito nelle vicinanze di Piazza Risorgimento, il ristorante a conduzione familiare si presenta grazioso e appartato. Lati positivi: è un posto molto spazioso, caratteristico (è un ex circolo del PCI !) Si mangia bene e l'atmosfera è quasi familiare, gestione semplice e molto cordiale.
https://www.yelp.it/biz/ristoranti-sardegna-torino; Il locale è carino e spazioso, il personale cordiale e disponibile. Rapporto qualità prezzo perfetto, anzi, oserei dire che per la qualità e quantità del cibo i prezzi sono bassi. Il locale si presenta bene, pulito e accogliente. il cibo è ricercato, e i piatti sono sempre molto abbondanti.
