url;review
https://www.yelp.it/biz/fratelli-roselli-torino; Pizza buonissima personale presente e simpatico piccolo locale ma molto familiare da provare ottimi anche i piatti da portata Grande parcheggio a pochi metri: la zona ormai è diventata caotica e questo aiuta ed evita arrabbiature. Anche gli spazi interni sono non particolarmente curati, molto ridotti e solo parzialmente compensati dai 2 dehors.
https://www.yelp.it/biz/freevolo-torino; Ambiente ideale per coppie o gruppi di amici. Qui la cordialità e' di casa, i cocktail sono perfettamente eseguiti e l'ambiente è sempre allegro e solare. Adatto si per coppie che per serate con gli amici (anche con figli).
https://www.yelp.it/biz/frulez-bari; Posto molto luminoso, spazioso con cucina a vista e ben curato. L'ambiente è tranquillo e spazioso, il personale gentilissimo. Locale carino, accogliente ma stretto di spazi.
https://www.yelp.it/biz/fuzion-torino; L' impasto della pizza (un pò piccola) era molto leggero ma gli ingredienti non molto ci sono piaciuti. L unico rimpianto e quello di non poterci andare spesso non essendo di Torino!!! Niente da dire sul locale moderno, pulito, sedie e tavoli comodi, cameriera super gentile.
https://www.yelp.it/biz/gadi-bari; È un posto molto carino, moderno, originale e assolutamente divertente se si è in compagnia di bambini. Davvero buono, personale gentile, idea originale, rapporto qualità prezzo buonissimo, locale pulito e carino.
https://www.yelp.it/biz/galante-torino-2; Il ristorante, ben posizionato in città, non possiede parcheggio ma non si ha difficoltà a parcheggiare in zona. Posizione centrale, ma con facilità di parcheggio: cosa ormai rarissima, soprattutto nelle nuove zone della movida Torinese. I tavoli, ampi e ben allestiti, sono apprezzabilmente distanziati, ciò che favorisce l'intimità e la conversazione.
https://www.yelp.it/biz/gelateria-mondello-torino; Gelati di ottima qualità con numerosi gusti da scegliere. Il gelato è molto buono e cremoso, il locale è accogliente e pulito, il personale gentile e disponibile. Il sapore autentico della nocciola e il pistacchio con la loro cremosita' rende il gelato unico!!!!!
https://www.yelp.it/biz/gennaro-esposito-torino; L'ambiente non è niente di speciale, pulito e semplice, ma tu vieni qui per il cibo. Il posto è piccolo ma molto pulito ei camerieri sono gentilissimi e professionali. Questa è una piccola pizzeria e viene affollata.
https://www.yelp.it/biz/girarrosti-santa-rita-torino; Questo girarrosto, comodo per la sua posizione centrale, è piccolo ma estremamente attraente.
https://www.yelp.it/biz/girarrosto-santa-rita-torino; Prezzi bassi : trancio di pizza ai funghi, trancio di farinata e birra piccola 6,50 euro Personale cortese Locale pulito Unica pecca prezzi eccessivi Ma non solo in questo esercizio...
https://www.yelp.it/biz/grill-burger-house-bari; Spazi un po ristretti ma servizio gentilissimo, in prima serata è frequentato soprattutto da adolescenti. Unico neo : posto abbastanza piccolo (forse da evitare il sabato sera o comunque nelle giornate boom) . Tempi d'attesa per sedersi ad un tavolo variabili a causa della piccola dimensione del locale.
https://www.yelp.it/biz/grom-torino-2; Pistacchio * Caramello salato ** Caffè * Servizio, ambiente **** Locale piacevole e pulito ( gelato da asporto) Domenica 3 giugno hanno avuto un problema tecnico.
https://www.yelp.it/biz/gulp-bari; Unica pecca è che gli spazi sono un po' stretti e di conseguenza si affollano subito. Dispone di ampio parcheggio, non del locale, che consente di parcheggiare nelle immediate vicinanze. Unico problema è che essendo un buon locale è sempre pieno quindi occorre prenotare con qualche giorno di anticipo
https://www.yelp.it/biz/gusti-e-sapori-torino; il ristorante è grande ma la distribuzione degli spazi è gradevole. ottimi sia la pizza che i piatti. Se volete un posto intimo per mangiare non fa per voi...per il resto buona scelta per gruppi numerosi Gusti e Sapori gode di un'ottima posizione centrale e ha ampi spazi al suo interno, nonchè nel dehors.
https://www.yelp.it/biz/hamp-bari; Consigliatissimo a tutti...anche a chi ha bambini piccoli piccoli. Posto adatto anche alle famiglie con bambini. Si consuma seduti a dei tavolini, in un ambiente non molto ampio ma accogliente e arredato con gusto.
https://www.yelp.it/biz/home-burger-palese; Homeburger è nell'ala partenze dell'aeroporto di Bari, è un bel locale luminoso, pulito, grande e comodo. Dispone di tavoli e tavoloni molto ampi. La comodità di avere questo punto di riferimento proprio all'interno dell'aeroporto viene ben pagata, i prezzi non sono bassi.
https://www.yelp.it/biz/horas-kebab-torino; Ottimo kebab per qualità, prezzo all'interno di un locale spazioso, molto pulito con una cucina efficiente, veloce e splendente. Proposta ampia e varia e orari molto ampi. Ambiente accogliente e sicuramente consigliato per mangiare con gli amici.
https://www.yelp.it/biz/huntsman-pub-torino; Atmosfera giovanile, spazi ampi, servizio veloce con personale dinamico e simpatico, inoltre ottima pizza e prezzi ok. In pieno centro, ambienti molto ampi, 2 dehors e sala fumatori. La sua posizione è comoda ed è piuttosto grande.
https://www.yelp.it/biz/i-soliti-ignoti-torino; Ci avevano destinato un tavolo in una zona per gruppi già rumorosa per gruppi di fine scuola. Cibo ottimo, servizio accurato anche se non velocissimo, atmosfera gradevole, location perfetta in un parco dedicato Il locale è dentro un parco cittadino/impianto sportivo, gli spazi interni sono ben disposti e ampi.
https://www.yelp.it/biz/i-tartufi-bistrot-torino; Il ristorante è piccolo piccolo e si può cenare sia all'interno che nella verandina antistante. Il gioco non vale la candela.... porzioni davvero ridicole !!!! Per chi desidera una verticale di tartufo accompagnato da un ottimo Barbara delle langhe questo è il posto ideale.
https://www.yelp.it/biz/ichi-torino; Trovar parcheggio in quella zona, può richiedere tempo, a seconda dei giorni. Unica scomodità è l'assenza di un parcheggio comodo. Semplicemente fantastico per la qualità del cibo.. per l'accoglienza da parte del personale e cosa molto importante la pulizia.
https://www.yelp.it/biz/il-gelatiere-bari-3; C'è un po' di difficoltà nel trovare parcheggio essendo una zona molto trafficate e adiacente al Policlinico. La sede vicino a parco 2 giugno permette anche una bella passeggiata nel verde. Peccato la posizione, non ottimale per il parcheggio, ma comunque ne vale la pena!!!
https://www.yelp.it/biz/il-picchio-torino; Il locale è moderno, con due ampi dehors esterni ed una grande sala interna. Il locale e' moderno, niente di speciale ma pulito e ordinato, camerieri gentili e menu' ben variegato. E' sempre stato un ottimo ristoratore e ha garantito un'accoglienza e professionalità esemplari.
https://www.yelp.it/biz/il-porto-torino; Il locale non è molto grande, ma gli arredi ricreano l'ambiente marinaro, dalle reti agli attrezzi per la pesca. Servizio molto gentile e cortese e ambiente caloroso ma allo stesso tempo elegante e pulitissimo. Ambiente Caratteristico e clima famigliare sono i primi due elementi che saltano all' occhio.
https://www.yelp.it/biz/il-siculo-di-savona-monica-torino; L'ambiente è molto familiare e il personale è gentile e simpaticissimo. Consigliatissimo... e per finire i prezzi sono anche molto più bassi di altre rinomate gelaterie in Torino L'insalata ottima e buona la scelta in menù del piatto unico (primo,secondo e contorno).
https://www.yelp.it/biz/il-vicolo-torino; Alle pareti fotografie fatte con pannelli fonoassorbenti ci accolgono e un simpatico personale di sale a conduzione familiare. Trovato il locale, bisogna trovare un parcheggio, cosa non facile. Gentilissimi e organizzati nel caso di bambini.
https://www.yelp.it/biz/imbarchino-torino; Posto molto carino e tranquillo sulla riva del Po, all'interno del parco del Valentino! Ottima la location, direttamente vista fiume ne parco del Valentino. L'ideale per un godersi al 100\% il parco!
https://www.yelp.it/biz/indian-street-food-torino; Il posto è piccino, con qualche sgabello e due piccoli banconi.
https://www.yelp.it/biz/istanbul-pizza-kebab-torino; Una piccola area salotto con tre tavoli e un bar con tre sedie.
https://www.yelp.it/biz/japs-torino-2; Posticino tranquillo e moderno, che offre piatti tipici della cucina giapponese insieme a numerosi drink. Atmosfera semplice e familiare, ottimo sushi accompagnato da una buona carta dei vini. Comodo per chi è di fretta ma anche per il Take away!
https://www.yelp.it/biz/japs-torino-3; Comoda la scelta di poter mangiare li o di poter portare a casa perchè take away! Amplio menu con piatti vegetariani, per celiaci e munù bambini. Questa bella catena di ristoranti / gastronomie giapponesi ai piedi delle alpi ha molto di cosmopolita.
https://www.yelp.it/biz/joys-pub-bari; È sempre una soddisfazione soddisfare i nostri amici e malgrado la location del locale crei difficoltà oggettive (parcheggi ). Serata che da ripetere volentieri, magari però sperando in un po' di fortuna in più per il parcheggio. Bellissima atmosfera, il joy's è un posto accogliente (anche con i bimbi, il che è un valore aggiunto!
https://www.yelp.it/biz/karmacola-torino; C'era un dj nella sala grande e due danzatori stile Bollywood che hanno coinvolto il pubblico, bambini compresi. Il locale si trova al piano interrato ed ha una discreta possibilità di parcheggio nelle vie limitrofe. Il locale è spazioso e ben arredato, il personale è molto gentile e professionale.
https://www.yelp.it/biz/kipling-torino; Personale molto gentile e attento, il parcheggio sotterraneo di piazza Bodoni viene offerto dal ristorante tramite voucher prepagato Coniuga alla perfezione le due soluzioni, proponendo piatti sia tipici piemontesi che di stampo internazionale. Il personale crea una situazione accogliente e familiare che consente di apprezzare pienamente le portate.
https://www.yelp.it/biz/kirkuk-kaff%C3%A8-torino-2; Si vanta di essere stato il primo kebabaro a Torino. c'è una piccola selezione di birre estere. Buono, ambiente e cucina Kurda, Turca, Persiana e Irachena
https://www.yelp.it/biz/l-accademia-del-panino-torino; Ottimo club sandwich con pane nero al carbon vegetale servizio ottimo cameriera gentilissima con i bambini ottimo veramente A due passi dalla Mole Antonelliana e davanti a Palazzo Nuovo, puoi trovare cortesia e qualità. Vicino alla Mole, posticino tranquillo, personale fantastico pronto a darti consigli e un panino memorabile!
https://www.yelp.it/biz/l-aglio-torino; Posticino particolare, fuori dai soliti percorsi turistici, in un' area tranquilla e piena di parcheggio. Locale molto carino in zona tranquilla con ampia scelta di parcheggio. Dehour ombroso seppur sulla via, tavoli ampi, da giardino.
https://www.yelp.it/biz/l-antico-arco-cellamare; Locale non ristrutturato all'ultimo grido dell'Hi-Tech ma semplice e funzionale, a conduzione familiare con personale semplicemente cordiale e disponibile. vasta scelta di impasti, attenzione e cura delle materie prime, gentilezza e professionalità in un locale a conduzione familiare. La pizzeria si presenta un po' spartana con tovagliato di carta ma i numerosi attestati ti caricano di aspettative.
https://www.yelp.it/biz/l-oca-fola-torino; Attenzione le porzioni sono particolarmente abbondanti per cui regolarsi bene nelle ordinazioni dei bimbi. Unico difetto la difficoltà di trovare parcheggio. Ottimo servizio , camerieri gentili veloci nonostante la folta clientela, cibo ottimo servito con cura ambiente pulito e confortevole
https://www.yelp.it/biz/l-osteria-le-ferriere-torino; Bel locale moderno, ben decorato, pulito, spazioso, con tavoli ben distanziati e tanto spazio a disposizione. Tutto questo senza pagare il coperto e in una zona comoda per il parcheggio. Insomma accoglienza familiare 3) Pochi ma buoni, macché buoni, ottimi !!!
https://www.yelp.it/biz/la-campana-torino-2; Ristorante a due passi dal museo egizio, molto comodo per chi visita sia il centro che il museo. Il servizio è gradevolissimo e familiare, d'altra parte, si sa, il personale è lo specchio dei proprietari. La cucina (il menu comprendeva antipasto piemontese, agnolotti, brasato e bonet) è più che dignitosa, anche se non eccezionale.
https://www.yelp.it/biz/la-cantina-torino; Ambiente semplice ma caldo e curato, un menu fisso a 16€ (si, 16€ per cenare in centro, una favola!) La cucina tipica piemontese da gustare in un ambiente volutamente scarno e da locale anni 60. Questo posto è il connubio tra ambiente rustico e allegro ed una cucina davvero favolosa!!
https://www.yelp.it/biz/la-cantinella-torino; 21 Locale situato di fianco alla Gran Madre, comodo al parcheggio di piazza Vittorio. Il personale, qualificato, cerca di porre attenzione al cliente accontentandolo e facendolo sentire coccolato in quell'ambiente dalle luci soffuse. Un bellissimo locale arredato con cura ed un ambiente che risulta perfetto per una cena di coppia..
https://www.yelp.it/biz/la-capannina-torino-2; Essendo un po' decentrato dal centro è facile trovare parcheggio, negli adiacenti Corso Vittorio o Corso Matteotti. I coperti erano numerosi ed il ristorante era pieno. Nessun ristoratore, pur di fare più coperti, deve far mangiare i commensali al gelo: bisogna renderlo adatto!!!
https://www.yelp.it/biz/la-casa-del-demone-torino; Unica pecca il parcheggio,un po' difficile da trovare ... Cena con bambini in gita a torino! A parte una ottima cucina con carne di qualità davvero buona, merita una visita solo per l'ambiente.
https://www.yelp.it/biz/la-cecchina-bari; Un dehor sulla più bella piazza di Bari vecchia, personale sollecito e sorridente, ambiente curato, bella scelta di piatti. In conclusione, era parecchio tempo che volevo provare il ristorante La Cecchina e sono uscito totalmente soddisfatto! Apprezzato il vino consigliato (prezzo onestissimo) e la competenza e cortesia del servizio.
https://www.yelp.it/biz/la-drogheria-torino; Prezzo nella norma ma buffet molto ricco e atmosfera molto tranquillo, ideale per un apericena con gli amici Hanno riservato due salette al piano superiore con buffet privato davvero eccezionale Molta cortesia Davvero consigliato! il ragazzo delle ordinazioni, l'unico in verità non troppo gentile, rispondeva ogni volte Arriverà.
https://www.yelp.it/biz/la-fila-torino; Ulteriore punto a favore: si mangia davvero bene, in un ambiente confortevole, pulito e familiare, i prezzi sono accessibili. Il gestore è veramente simpatico, la posizione centrale lo rende comodo per poi proseguire la visita della città. In sala i tavoli sono un po' troppo ravvicinati, e le luci fredde rendono più freddo anche l'ambiente.
https://www.yelp.it/biz/la-gaia-scienza-torino; Lo staff gentilissimo e familiare che non disdegna di scambiare due chiacchere in allegria. Sia in coppia che in gruppi numerosi. Accoglienza ottima, assistenza precisa durante la cena...il tutto accompagnato dalla simpatia dei proprietari, da molti anni gestori del ristorante.
https://www.yelp.it/biz/la-granseola-torino; A pranzo è possibile degustare due menù (o carne o pesce) oltre che una decina di piatti alla carta. Ottima la cortesia del personale e l'ambiente è curato e accogliente.
https://www.yelp.it/biz/la-gricia-torino; L'unico appunto i prezzi scritti sul menù sono senza iva, quindi pensavamo di spendere meno, però tutto buono. Se volete passare una serata in ottima compagnia è il locale adatto con cucina genuina!!! Ottima la cucina, ambiente accogliente, piatti curati e servizio rapido e cortese.
https://www.yelp.it/biz/la-gustosa-torino; Bello il posto, un po' piccino, ma pulito, ordinato e piacevole. Gli spazi sono ristretti e i tavoli sono praticamente attaccati Piatti di pesce soprattutto, comodo il dehor esterno.
https://www.yelp.it/biz/la-limonaia-torino; I numerosi libri all'ingresso richiamano lo studio che si ritrova nei piatti e nella loro presentazione, curata e attenta. Indicato soprattutto per coppie e famiglie non numerose. Ottimo ristorante da conoscere, ambiente sereno ed accogliente, servizio ottimo e in tempi giusti, cucina di livello molto apprezzabile.
https://www.yelp.it/biz/la-locanda-bari; Ristorante al centro di Bari con una bel dehors spazioso e personale capace. Nella piazza principale di Bari vecchia questo locale offre un fantastico ambiente per gustare piatti tipici di ottima qualità. Location molto accogliente e ben curata, personale qualificato e disponibilissimo, menù studiato e con prodotti tipici, da 10!
https://www.yelp.it/biz/la-madia-torino; Ristorante molto carino pochi tavoli fuori dal centro ...apprezzabile per il parcheggio Personale molto gentile e professionale. L'ambiente molto confortevole dalla dimensione degli spazi, alla scelta dei colori e delle luci. Il servizio è ottimo, anche perchè i tavoli non sono molto numerosi.
https://www.yelp.it/biz/la-mela-stregata-torino; Peccato l'angolo slot in cui si raduna un sacco di gente incallita per il gioco. Il locale è ampio e spazioso, il personale gentile anche se un po' frettoloso Situato in piazza Carducci, il bar è spazioso, ma non curato nei dettagli.
https://www.yelp.it/biz/la-piadineria-torino; Una cosa é non condividere dei valori, un'altra cosa é prendersi gioco dei clienti solo per guadagnare. Ideale per la pausa pranzo o come alternativa alla solita pizza o fast food per una tappa veloce. Ottima la qualità dei cibi e dei condimenti,molto pulito e anche molto veloci nel consegnare le piadine.
https://www.yelp.it/biz/la-piramide-torino; La posizione ottima, con fermata bus difronte e il servizio è comodo e veloce. Da studentessa universitaria, la posizione del locale è molto comoda. Classica pizzeria da asporto in ottima posizione, locale con una decina di posti all'interno e dehors sotto i portici.
https://www.yelp.it/biz/la-reseda-torino; Staff molto gentile , ambiente accogliente , comodo per il parcheggio e tempi molto comodi per l'ordine Il servizio infatti è rapido e l'atmosfera creata nel complesso è familiare e naturale, piacevole. Se sei alla ricerca di un locale moderno ma familiare ove mangiare divinamente ...
https://www.yelp.it/biz/la-tana-del-polpo-bari; E poi i ragazzi in sala fanno gioco di squadra, tutti con il sorriso. Ottimo per osservare la gente e gruppi e coppie felici. Pesce freschissimo, personale accogliente e familiare e cucina top!
https://www.yelp.it/biz/la-taverna-dei-mercanti-turin; Locale familiare e molto accogliente, personale gentilissimo ed attento. Locale accogliente e raffinato a conduzione familiare. Vitello tonnato perfetto, buoni gli altri antipasti ed eccezionali i primi tipici piemontesi assaggiati, questi ultimi con porzioni abbondanti.
https://www.yelp.it/biz/la-taverna-greca-torino-2; Adatto per coppie, gruppi di amici, famiglia, il servizio è generalmente efficiente e ben organizzato. Ottima cena, personale preparatissimo sulla cucina e sul menu, gentilissimi e tolleranti con i bambini. Il personale è cortese e alla mano, e anche l'atmosfera è familiare.
https://www.yelp.it/biz/la-via-della-seta-torino; Parcheggio inesistente, ma se si prosegue 50m in direzione San Mauro, vi è una piazza molto comoda da sfruttare. Buon parcheggio e gentilezza del personale all'arrivo. Il rapporto al prezzo è ottimo, il cibo è buono con porzioni da locale cinese, il locale è pulito.
https://www.yelp.it/biz/lady-bar-torino; Il bar si trova nelle vicinanze di Palazzo Nuovo, il Museo del Cinema e della Mole Antonelliana.
https://www.yelp.it/biz/le-cantine-di-bacco-torino; Il parcheggio in zona è leggermente difficoltoso quindi bisogna sapersi gestire con gli orari. Ambiente non particolarmente spazioso , ma gradevole . Il locale è spazioso, pulito e accogliente.
https://www.yelp.it/biz/le-grand-tabu-bari; Staff molto cordiale e disponibile, ambiente molto accogliente e allo stesso tempo elegante.
https://www.yelp.it/biz/le-lupin-dei-f-lli-zambetta-bari; Locale grande, ideale quando si hanno dei bambini che hanno il loro giusto spazio per muoversi. È spazioso e arredato vagamente in stile bistrot francese (tovaglie a quadri etc). Ideale per la pausa pranzo dei lavoratori e studenti, essendo vicinissimo al campus universitario.
https://www.yelp.it/biz/le-putrelle-osteria-torino; È un locale carino e adatto anche a bambini piccoli. Il parcheggio è abbastanza difficoltoso ma non impossibile. L'ambiente è fresco e gradevole, il personale gentilissimo ed efficiente, il prezzo molto contenuto rispetto alla qualità.
https://www.yelp.it/biz/le-rondini-torino; ottimo e accogliente, comodo durante la visita della città posto in posizione strategica, vasta scelta nel menu Ciao personale cordiale, lavale abbastanza pulito, mangiare nella norma prezzo giusto X quello che mangi fine serata offerto limoncello Anche come ambiente è carino ma essendo molto silenzioso e i tavoli abbastanza ravvicinati non c'è molta privacy.
https://www.yelp.it/biz/le-tre-lanterne-bari; Il locale, abbastanza anonimo, si trova in periferia ed è stato semplice trovare parcheggio. Il locale è accogliente e la conduzione familiare ti fa sentire a casa. La sala è accogliente, a conduzione familiare, locale pulito e ordinato.
https://www.yelp.it/biz/le-veronique-bari-2; Le Vèronique a Poggiofranco ha sicuramente una nota positiva rispetto all'altra sede cioè là comoda possibilità di parcheggio. Carina e molto arieggiata la verandina sul retro, adatta per gruppi di famiglie molto numerosi. Locale fresco ed elegante situato in una nuova zona della città, con facilità di parcheggio.
https://www.yelp.it/biz/le-vitel-etonne-torino; conto adeguato alla qualità dei piatti. spazi un po' stretti. Posto piccino, vicino alla Mole, quasi da evitare si direbbe. Locale molto caratteristico, il ns tavolo si trovava in cantina circondato da vini e in un ambiente davvero accogliente.
https://www.yelp.it/biz/libery-pizza-e-artigianal-beer-torino; I gusti non sono numerosi ma esprimono il talento degli chef. Posto piccolo ed accogliente, ideale per una visita in coppia, pizza gustosa e ricca scelta di birre artigianali. Il scelta è stata decisamente azzeccata, i tempi per essere serviti veloci, locale pulito e prezzi nella media.
https://www.yelp.it/biz/lo-scugnizzo-torino; Facile trovare parcheggio su C.so San Maurizio se si arriva prima delle 21. Un po stretti gli spazi, ma servizio cortese e veloce. L'unico appunto, il prezzo, forse leggermente caro: 95 euro per 5 pizze, 4 birre, 1 acqua e 4 amari.
https://www.yelp.it/biz/lo-stonnato-torino; Unico aspetto negatuvo è stata la mancanza di professionalità da parte del personale che serve ai tavoli. I prezzi sono accessibili e il menù è caratterizzato da piatti tipici della cucina mediterranea italiana. Unica piccola pecca: i tavoli sono molto vicini e quindi manca un pò di intimità.
https://www.yelp.it/biz/m-bun-torino; Ambiente Pulito e ampio con area giochi per i più piccini.Servizio rapido e cortese.Prezzi comparati alla qualità del locale. A cena in un locale adatto agli adulti e anche ai bambini sia per giocare che per mangiare. Locale accattivante soprattutto per i bambini nel piano interrato, carne e pane molto buoni.
https://www.yelp.it/biz/m-bun-torino-3; Il menù bimbi parte da 8 euro, per passare a 11 con birra piccola o 13 con  media. Locale pulito, con un area riservata ai bambini e con il distributore di calze antiscivolo. Bel posto vicino al centro di Torino, locale con area giochi bimbi.
https://www.yelp.it/biz/maltos-beer-bari; Pub carino con personale gentile ed accogliente e con tanti posti a sedere anche all'esterno, in una verandina riscaldata. Il locale è spazioso al suo interno ed il parcheggio lo trovi facilmente, poche birre alla spina ma buone. Il locale è posto in una stradina periferica del quartiere poggiofranco e spesso è difficoltoso trovare parcheggio.
https://www.yelp.it/biz/mamasita-torino; Buone pietanze non meravigliose, ma buone, locale accogliente e familiare, servizio sereno e conto onesto l. Locale accogliente e molto spazioso, comodo anche per gruppi numerosi. Adatto a tutti, coppie, famiglie e amici!
https://www.yelp.it/biz/mamma-licia-torino; bellissimo posto, un po' retrò, ambiente easy e cordiale, personale piacevolissimo, servizio veloce....bisogna prenotare xò almeno il sabato sera! Ambiente rustico, ricorda una trattoria di altri tempi.
https://www.yelp.it/biz/mare-nostrum-torino; Ingresso particolare quasi nascosto ma si capisce che si sta per entrare in un luogo unico!
https://www.yelp.it/biz/marechiaro-torino; Ristorante vicinissimo al centro,grande e ben attrezzato.Primi piatti superlativi,il salmone con zucchine strepitoso.Prezzi nella media Si mangiava bene ed era comoda per le attrazioni del centro. Ottima location, situato in centro Torino, locale ampio e spazioso.
https://www.yelp.it/biz/martinucci-bari-2; Servizio celere e impeccabile, anche per gruppi numerosi ed eventi speciali. Il borgo antico di Bari è sempre stupendo ma una bella passeggiata deve terminare con un ottimo gelato. Il locale è originale e sempre pulito nonostante l'andirivieni di clienti ed il personale è paziente e disponibile.
https://www.yelp.it/biz/masaniello-%C3%A9-turnat-torino; Il menù è ricco di piatti tipici e nuovi abbinamenti, per accontentare i curiosi, ma anche gli scettici.
https://www.yelp.it/biz/mc-donalds-torino-4; Si trova in un luogo molto centrale ed è molto utile se si viaggia con i bambini. Locale sporco, non idoneo a passeggini o disabili, privo di ascensore, casse lentissime ed in posizione scomodissima. Si sviluppa su 2 piani e per un invalido non c'è modo di andare al secondo piano.
