url;review
https://www.yelp.it/biz/zucca-torino;Questo locale storico situato nel centro di Torino è consigliato per ogni tipo di occasione: lavoro, amici,coppie e famiglie.
https://www.yelp.it/biz/wispobish-torino;I prezzi sono acettabili in rapporto con la qualita .Locale nuovo, pulito, e persone giovani e in gamba.
https://www.yelp.it/biz/vyta-torino;Il personale e' molto gentile e sono a disposizione anche numerosi tavoli sia all'interno che all'esterno.
https://www.yelp.it/biz/volver-torino-2;Ottimo posto anche per una cena in famiglia con bambini con menù ad ok.
https://www.yelp.it/biz/vo-torino;Personale gentile, preparato e servizio di alto livello, tavoli ampi e spazio adeguato tra di essi, corretta l'illuminazione.
https://www.yelp.it/biz/vitelloni-torino;Il personale è stato gentile e disponibile, il locale era pulito e spazioso e la tavola apparecchiata con cura.
https://www.yelp.it/biz/vanilla-torino;Un buon gelato in pieno centro: si può scegliere fra numerosi gusti, alcuni classici altri più originali.
https://www.yelp.it/biz/vale-un-per%C3%B9-torino;Cucina molto buona coi piatti tipici Peruviani.
https://www.yelp.it/biz/urban-bari;Il locale è spazioso ed originale, creato appositamente per ritenersi accogliente.
https://www.yelp.it/biz/turet-torino;Sottolineo 29 visto che il numero massimo sarebbe stato 25, semmai avessero voluto giocare il numero vincente al lotto.
https://www.yelp.it/biz/tre-galline-torino-2;Buona cucina tradizionale piemontese in ambiente familiare.
https://www.yelp.it/biz/trattoria-torricelli-torino;L ambiente e' sempre accogliente e familiare e il servizio e' gestito in maniera garbata e simpatica.
https://www.yelp.it/biz/trattoria-spirito-santo-torino-2;Unico neo, scarso parcheggio nei dintorni, ma non si può pretendere in via Guido Reni!!!
https://www.yelp.it/biz/trattoria-piemontese-torino;Locale ampio con mattoni rossi a vista e seggiolini in legno che sanno molto di rustico.
https://www.yelp.it/biz/trattoria-mombercelli-di-antico-elena-torino;Famiglie, coppie di giovani e anziani, gente comune della zona tutto molto tranquillo come a casa.
https://www.yelp.it/biz/trattoria-da-cinzia-torino;La posizione non è centrale, ma raggiungibile molto comodamente con la metropolitana nelle vicinanza parcheggio taxi.
https://www.yelp.it/biz/trattoria-alba-torino;E' stata una piacevole sorpresa: una vera trattoria a conduzione familiare, piatti tradizionali ad un prezzo realmente concorrenziale.
https://www.yelp.it/biz/toscano-torino-3;Cena con amici, ambiente familiare,mangiare di ottima qualità e possibilità di scegliere tra piatti tipicamente toscani e non.
https://www.yelp.it/biz/tommy-tegamino-torino;Insomma, un posto ideale per mangiare, anche a pranzo, in modo simpatico e gustoso.
https://www.yelp.it/biz/tobiko-torino;Comoda da raggiungere con parcheggio nelle vicinanze di piazza Solferino.
https://www.yelp.it/biz/tiella-bari;Valida alternativa per uno spuntino o una cena familiare fuori casa, divertente punto d'incontro per una serata tra amici.
https://www.yelp.it/biz/the-stuart-pub-bari;Classico irish pub, il locale ha una convenzione con un parcheggio data la difficoltà in zona.
https://www.yelp.it/biz/the-egg-torino;Chef giovanissimi che cucinano a vista dei commensali, cura del dettaglio e cortesia in un ambiente accogliente e genuino.
https://www.yelp.it/biz/the-bakery-torino;Anche i bambini apprezzano, ci si torna volentieri.
https://www.yelp.it/biz/teapot-torino;Il locale è carino, le seggiole tutte diverse e le teiere sugli scaffali rendono particolare e familiare il locale.
https://www.yelp.it/biz/taverna-rossa-di-zappia-pasquale-torino;Pizza ottima, sia tradizionale che al Tegamino, anche ottima la birra alla spina, locale familiare e accogliente
https://www.yelp.it/biz/taverna-delloca-torino;Grazie per l'attenzione portata per una persona gluten Free, una a dieta e per i bimbi.
https://www.yelp.it/biz/taiki-bari;Servizio: cortesi e di media velocità, locale pulito e tranquillo, in un punto comodo da raggiungere.
https://www.yelp.it/biz/t-bone-station-torino;Pulled pork divino, menù bimbi ottimo e presentato in una macchina di cartone (bimbo).
https://www.yelp.it/biz/sushitao-bari;Comoda la possibilità del menù all you can eat , costo 20€ a pranzo.
https://www.yelp.it/biz/spazio-la-stampa-torino;Spazi interattivi, personaggi che hanno reso famosa la testata.
https://www.yelp.it/biz/spaghetteria-70cento-bari;Il nuovo menù coniuga la tradizione della vecchia spaghetteria con l'innovazione di nuove proposte.
https://www.yelp.it/biz/spada-reale-torino;Un po' più di spazio avrebbe reso la conversazione più agevole e il soggiorno più comodo.
https://www.yelp.it/biz/soup-e-go-torino;Locale molto molto carino, piccolo ma, in realtà, spazioso (ha posto sia dentro che fuori).
https://www.yelp.it/biz/soul-kitchen-torino;Il locale è molto carino, il servizio a tavola e del personale nonchè i piatti sono molto ricercati.
https://www.yelp.it/biz/sotto-la-mole-torino;Situato di fronte alla Mole, il locale è silenzioso ed espone con orgoglio attestati di riconoscimento per i formaggi.
https://www.yelp.it/biz/singapore-torino;Del servizio non ci si può lamentare:il personale è gentile e i piatti arrivano subito.
https://www.yelp.it/biz/silvano-torino-2;Locale carino, comodo per una pausa caffè, il gelato merita una fermata ma se siete in zona.
https://www.yelp.it/biz/sicomoro-torino;Adatto a coppie, ma anche a gruppi di amici.
https://www.yelp.it/biz/siciloso-torino;Un bel posto, con un arredo originale, tavolini comodi, belle luci, un bel bancone e persone simpatiche.
https://www.yelp.it/biz/sibir-torino-2;E' molto spazioso, elegante per una cena a due e soprattutto il cibo è di ottima qualità ed abbondante.
https://www.yelp.it/biz/sfashion-cafe-torino;Il tutto accompagnato non dai soliti stuzzichini ma da un piatto grande di assaggi di vario tipo.
https://www.yelp.it/biz/seven-up-torino;Il locale, in posizione centrale e comoda a negozi e musei, è molto familiare e accogliente.
https://www.yelp.it/biz/sen-mi-ya-torino-2;La soluzione è comoda anche perchè non si accede ad un buffet ma si ordina alla carta.
https://www.yelp.it/biz/sandrino-bari-2;una valida alternativa a Martinucci per quanto riguarda il gelato nel centro storico ingredienti freschi e di qualità consigliato
https://www.yelp.it/biz/sandrino-bari;La location è bella e molto familiare.
https://www.yelp.it/biz/rossopomodoro-torino;Per pagare la cassa funzionava benissimo e per validare il ticket del parcheggio invece no?
https://www.yelp.it/biz/roar-roads-torino;I tempi di attesa sono ancora un po' altini, soprattutto se si hanno bambini con se'.
https://www.yelp.it/biz/ristrot-guviol-torino;Il Locale è situato in centro a Torino, non centralissimo, ma comodo da trovare.
https://www.yelp.it/biz/ristoranti-taverna-delle-rose-torino-2;Ambiente familiare ma curato, luci piacevolmente soffuse che creano una bella atmosfera, personale preparato, simpatico o gentilissimo.
https://www.yelp.it/biz/ristoranti-sardegna-torino;Il locale è carino e spazioso, il personale cordiale e disponibile.
https://www.yelp.it/biz/ristorante-ratatui-torino-2;Sito nelle vicinanze di Piazza Risorgimento, il ristorante a conduzione familiare si presenta grazioso e appartato.
https://www.yelp.it/biz/ristorante-peppino-torino;Comodo da raggiungere a piedi, il locale si presenta bene e pulito...
https://www.yelp.it/biz/ristorante-lo-scoglio-da-vito-bari-2;Cos'altro aggiungere, per il problema del parcheggio basta fare due passi a piedi.
https://www.yelp.it/biz/ristorante-consorzio-torino;Consorzio è sempre una sicurezza, forse più adatto per cena romantica che per cena tra amici in gruppi numerosi.
https://www.yelp.it/biz/ristopizza-giampaolo-bari;Ristorante di classe in un punto chic e appartato del centro città, dispone di ampi spazi sfruttati con eleganza.
https://www.yelp.it/biz/re-vittorio-bari;Il locale è carino ed il personale gentile e accogliente.
https://www.yelp.it/biz/quelli-che-ben-pensano-torino;Servizio veloce, pizze molto buone e locale abbastanza familiare ed informale.
https://www.yelp.it/biz/quattro-soldi-torino;Il ristorante è un classico locale per giovani e famiglie.
https://www.yelp.it/biz/prima-e-poi-torino;Una buona pizza, ben posizionato, grande abbastanza per ospitare gruppi, TV con la trasmissione delle partite di calcio.
https://www.yelp.it/biz/premiata-osteria-dellhermada-torino;Il locale é molto familiare ed accogliente, un atmosfera che ricorda molto un'osteria o una locanda.
https://www.yelp.it/biz/porto-di-savona-torino;Comodo e buono , cucina italiana .
https://www.yelp.it/biz/porcaloca-torino;Se si presentassero col sorriso forse la grande pizzeria d'asporto diventerebbe un po' più familiare.
https://www.yelp.it/biz/poormanger-torino;Locale molto noto in centro Torino, adatto ai giovani e molto organizzato per servire velocemente i numerosi avventori.
https://www.yelp.it/biz/platti-torino-2;Accoglienza molto garbata e gentile, un benvenuto con un calice di prosecco accompagnato da una salsiccia di Bra eccellente.
https://www.yelp.it/biz/pizzeria-vecchio-forno-garibaldi-torino;Conviene prenotare e tenere presente che in zona il parcheggio è un problema.
https://www.yelp.it/biz/pizzeria-vecchia-londra-torino;Ristorantino molto comodo e servizio a pranzo molto rapido.
https://www.yelp.it/biz/pizzeria-tarantini-al-cancello-rotto-bari;Ottima accoglienza giardino all'aperto accogliente e ben attrezzato con personale educati e professionale.
https://www.yelp.it/biz/pizzeria-silvestro-torino;E' localizzato in posizione spesso trafficata ,ma si trova sempre parcheggio .
https://www.yelp.it/biz/pizzeria-poldo-torino;Locale Super Illuminato con possibilità di parcheggio.
https://www.yelp.it/biz/pizzeria-la-sacrestia-torino;Ambiente retrò, aperto fino a tardi, personale sempre con il sorriso.
https://www.yelp.it/biz/pizzeria-gino-torino;Farinata e pizza fantastiche, ambiente familiare e camerieri molto gentili.
https://www.yelp.it/biz/pizzeria-giampy-di-mazzola-giuseppe-torino;Meglio raggiungerla in metro (fermata Marconi) il parcheggio è difficile da trovare come per tutta San Salvario !!
https://www.yelp.it/biz/pizzeria-fratelli-la-bufala-torino;Vero relax per chi ha bimbi piccoli ma anche per chi non ne ha, avendo spazi separati e dedicati.
https://www.yelp.it/biz/pizzeria-enzo-e-ciro-di-fraddosio-v-c-bari;Il locale si trova in una via centrale di Bari, ma con il dramma del parcheggio in città.
https://www.yelp.it/biz/pizzeria-dual-torino;Posto in una delle più belle piazze di Torino, il locale presenta ambienti luminosi e ampi.
https://www.yelp.it/biz/pizzeria-divina-bari;Clima informale e atmosfera calda e familiare.
https://www.yelp.it/biz/pizzeria-di-cosimo-bari;Possibilità di mangiare anche una pizza seduti nella sala adiacente, sia pur con pochi posti a sedere.
https://www.yelp.it/biz/pizzeria-da-michele-torino;Antica trattoria a gestione familiare con una particolare cucina a vista, pochi tavoli e forse un po' troppo affollato.
https://www.yelp.it/biz/pizzeria-da-donato-bari;Impeccabile, Decisamente da provare, ambiente familiare scelta molto vasta di pizze, cortesia del personale ottima.
https://www.yelp.it/biz/pizzeria-continental-pizzorante-bari-2;Ambiente raffinato ma al tempo stesso familiare, la cortesia discreta d'altri tempi dei camerieri, la pizza ottima.
https://www.yelp.it/biz/pizzeria-bella-vita-torino;Con i bimbi piccoli non si ha a disposizione tutto quel tempo per pizza e chiacchere con la nutella.
https://www.yelp.it/biz/pizzeria-baraonda-bari;Locale adatto per vivere serate in un clima familiare e a cene con gli amici di sempre!
https://www.yelp.it/biz/pizzeria-au-lapin-agile-torino-2;L'unica difficoltà è rappresentata , senza responsabilità del titolare, dal reperire parcheggi alla vettura all'esterno del locale.
https://www.yelp.it/biz/pizzeria-amalfi-torino;Comunque posto accogliente anche per famiglie e amici con cani.
https://www.yelp.it/biz/pizzeria-aladino-bari;Pizza buona e locale accogliente, meglio prenotare se si è numerosi.
https://www.yelp.it/biz/pizzeri-lapislazzulo-torino;Pur prenotando si aspetta per via dei numerosi clienti, ma comunque vieni avvertito al momento della prenotazione.
https://www.yelp.it/biz/pizza-speedy-torino-3;Dovuto all'ottima pizza e anche al personale estremamente cortese.
https://www.yelp.it/biz/pizza-speedy-torino-2;Ottima la pizza , la farinata , e gli ingredienti .
https://www.yelp.it/biz/pizza-pistrocchio-torino;Ottima la possibilità di prendere pizze piccole per i bambini il che permette di non sprecare e risparmiare.
https://www.yelp.it/biz/pizza-ad-hoc-torino;Servizi igienici ampi, puliti ed in ordine (anche se ce n'è uno solo).
https://www.yelp.it/biz/pippo-paranza-torino;Può essere non semplice trovare parcheggio specialmente il venerdì e sabato sera.
https://www.yelp.it/biz/piola-cianci-torino;Cibo buono, location privo di spazi e personale che ti da fretta, inserita nel centro storico di Torino.
https://www.yelp.it/biz/piazza-vittorio-veneto-torino;Ospita inoltre numerosi ristoranti, locali e negozi, molti dei quali rinomati.
https://www.yelp.it/biz/piano-b-torino;Si tratta di un locale piacevole, ben arredato e con spazi comodi per conversare senza essere ascoltati dai vicini.
https://www.yelp.it/biz/perbacco-bari;Il locale è davvero carino, molto intimo e familiare, la qualità del cibo ottima, il personale cortese.
https://www.yelp.it/biz/pepino-torino;Forse manca un poco di fantasia nei pur numerosi gusti dei gelati e nella preparazione di cocktail.
https://www.yelp.it/biz/peperosso-torino;La gestione familiare garantisce un servizio cortese ed attento.
https://www.yelp.it/biz/pastificio-defilippis-torino;Affollato spesso al mezzogiorno, comodo anche per mangiare da soli al bancone lungo le pareti.
https://www.yelp.it/biz/pasticceria-amore-torino;Aperitivo molto ricco con stuzzichini di qualità eccellente e personale molto gentile.
https://www.yelp.it/biz/pastamaneria-torino;Prezzi onestissimi, i gestori del locale cucinano e servono ai tavoli in un'atmosfera subito familiare e intima.
https://www.yelp.it/biz/pasta-mon-amour-torino;L'unica pecca è il parcheggio: non si trova facilmente!
https://www.yelp.it/biz/panperfocaccia-torino-2;Di sabato sera molto affollato con spazi ristretti meglio prenotare cucina e pizze buone servizio cordiale e veloce.
https://www.yelp.it/biz/panino-giusto-torino;Grazioso, pulito con un servizio di qualità e i cibi preparati in maniera rapida e molto buona.
https://www.yelp.it/biz/palazzo-barolo-torino;Le guide che accompagnano i visitatori sono appassionate ma dilettanti, i soliti volontari.
https://www.yelp.it/biz/paco-torino;Allegria musica e tanto cibo buono , condito da un servizio familiare e veramente accogliente!!!
https://www.yelp.it/biz/ottimo-torino;Una comoda panchetta all'esterno della vetrina permette di sbafarsi i coni di varie pezzature.
https://www.yelp.it/biz/osteria-sopravento-bari-2;Grazie, grazie ed ancora grazie al proprietario Sergio(ne) in cucina, e Alberto in sala, cordiali e in clima familiare.
https://www.yelp.it/biz/osteria-rotonda-dei-facchinetti-torino;Locale ampio, con parcheggio nelle vicinanze.Buona scelta, piatti di qualità, personale veloce e gentile.
https://www.yelp.it/biz/osteria-le-arpie-bari;Piatto di orecchiette in bianco per la bimba, mezza caraffa di vino..46 euro...mangiato bene, pesronale gradevole e simpatico!
https://www.yelp.it/biz/osteria-fate-infretta-a-tavola-torino;Una bella scoperta in una zona comoda agli ospedali e al centro commerciale del lingotto.
https://www.yelp.it/biz/osteria-della-travi-bari;Variegati e numerosi gli antipasti serviti (funqhi, pepata di cozze, frittata, finocchi gratinati, focaccia, verdure grigliate, ecc.).
https://www.yelp.it/biz/osteria-del-frate-torino;Ben arredato, parcheggio ampio vicino al ristorante, menu non ampio ma di qualità superiore alla media.
https://www.yelp.it/biz/osteria-del-fiat-torino;Con la nuova linea della metro è abbastanza comodo arrivarci, anche per chi non ha l'auto.
https://www.yelp.it/biz/osteria-dei-quattro-gatti-bari;Locale davvero molto accogliente, grandi spazi , grandi tavolate ma anche ottimo per cene a 2.
https://www.yelp.it/biz/osteria-antichi-sapori-bari;A partire dal cibo di ottima qualità a finire al personale cordiale e molto preparato sui prodotti da vendere.
https://www.yelp.it/biz/osteria-al-gambero-bari;L'ambiente è accogliente e familiare ed hai la sensazione di essere invitato a casa dei suoi titolari.
https://www.yelp.it/biz/ortigia-bistrot-torino;Il locale è bellissimo e tranquillo, ideale per le coppie e per trascorrere una bella serata con gli amici.
https://www.yelp.it/biz/opera-bari;È perfetto sia per le coppie che per le famiglie.
https://www.yelp.it/biz/open-baladin-torino;Locale in pieno centro, con la grande comodità di avere il parcheggio sotterraneo di piazzale Valdo Fusi (a pagamento).
https://www.yelp.it/biz/oolivoo-bari;Personale gentile, bello il posto direttamente sul mare ma il cibo purtroppo poco gradevole.......mozzarelle a parte......
https://www.yelp.it/biz/olsen-di-caldi-cinzia-torino;Non c'è possibilità di parcheggio nelle vie limitrofe quindi una sana passeggiata è d'obbligo.
https://www.yelp.it/biz/old-wild-west-torino;Comodo all'Allianz Arena il locale è uguale ai vari fratelli sparsi più o meno in tutta Italia.
https://www.yelp.it/biz/nuovo-fizzarotti-bari;Personale cordiale e gentile, ambiente piccolo ma rilassante ed elegante, sito nel bel Corso Vittorio Emanuele II a Bari.
https://www.yelp.it/biz/nuova-dezzuto-torino;Per quanto riguarda il resto del personale ben educato e sicuramente avranno tanto da insegnare al cosiddetto responsabile.
https://www.yelp.it/biz/niva-cremeria-torino;Questa piccola perla di gelateria artigianale nel cuore di Torino è stata una piacevolissima sorpresa.
https://www.yelp.it/biz/new-mexico-torino-2;se ti va di mangiare un ottima pizza servita fumante al tavolo con un sorriso, vai in questa pizzeria.
https://www.yelp.it/biz/napples-torino;Si consiglia se non necessario di non usare auto ma la comoda fermata Marconi della metro.
https://www.yelp.it/biz/mr-rooster-torino-3;Al momento presente solo una sala sul piano principale, è in apertura una seconda sala al piano seminterrato.
https://www.yelp.it/biz/monte-dei-cappuccini-torino;La struttura non dispone di un parcheggio privato e data la località turistica non è facile trovare facilmente.
https://www.yelp.it/biz/monferrato-torino;Qui è tutto classico e medio, non ci sono spazi per avventure ma neppure per delusioni.
https://www.yelp.it/biz/monegato-torino;Anzitutto il locale è accogliente colorato e l'ambiente è familiare.
https://www.yelp.it/biz/michi-tanzariello-torino;il locale consente numerosi coperti, è arredato in stile piacevole e moderno.
https://www.yelp.it/biz/miagola-cafe-torino;Per i bambini è un posto fantastico ma anche per gli adulti che amano gli animali è perfetto!
https://www.yelp.it/biz/mezzaluna-osteria-torino;Ambiente familiare, il locale è tutto dipinto con scene pittoresce di una vita in un borgo di mare.
https://www.yelp.it/biz/mexico-70-torino;Il ristorante è molto spazioso e accogliente, i piatti sono abbondanti e a un prezzo del tutto ragionevole.
https://www.yelp.it/biz/mcdonalds-bari-3;E' situato su due piani - c'erano posti liberi al piano terra.
https://www.yelp.it/biz/mc-donalds-torino-5;È stato davvero stupendo osservare come gli operatori pluriservizio maneggiassero il cibo a mani nude, davvero.
https://www.yelp.it/biz/mc-donalds-torino-4;Si trova in un luogo molto centrale ed è molto utile se si viaggia con i bambini.
https://www.yelp.it/biz/masaniello-%C3%A9-turnat-torino;Il menù è ricco di piatti tipici e nuovi abbinamenti, per accontentare i curiosi, ma anche gli scettici.
https://www.yelp.it/biz/martinucci-bari-2;Servizio celere e impeccabile, anche per gruppi numerosi ed eventi speciali.
https://www.yelp.it/biz/marechiaro-torino;Ristorante vicinissimo al centro,grande e ben attrezzato.Primi piatti superlativi,il salmone con zucchine strepitoso.Prezzi nella media
https://www.yelp.it/biz/mare-nostrum-torino;Ingresso particolare quasi nascosto ma si capisce che si sta per entrare in un luogo unico!
https://www.yelp.it/biz/mamma-licia-torino;bellissimo posto, un po' retrò, ambiente easy e cordiale, personale piacevolissimo, servizio veloce....bisogna prenotare xò almeno il sabato sera!
https://www.yelp.it/biz/mamasita-torino;Buone pietanze non meravigliose, ma buone, locale accogliente e familiare, servizio sereno e conto onesto l.
https://www.yelp.it/biz/maltos-beer-bari;Pub carino con personale gentile ed accogliente e con tanti posti a sedere anche all'esterno, in una verandina riscaldata.
https://www.yelp.it/biz/m-bun-torino-3;Il menù bimbi parte da 8 euro, per passare a 11 con birra piccola o 13 con  media.
https://www.yelp.it/biz/m-bun-torino;Ambiente Pulito e ampio con area giochi per i più piccini.Servizio rapido e cortese.Prezzi comparati alla qualità del locale.
https://www.yelp.it/biz/lo-stonnato-torino;Locale carino nel cuore di San Salvario che offre una cucina a 360°, buoni i primi e la pizza.
https://www.yelp.it/biz/lo-scugnizzo-torino;Facile trovare parcheggio su C.so San Maurizio se si arriva prima delle 21.
https://www.yelp.it/biz/libery-pizza-e-artigianal-beer-torino;I gusti non sono numerosi ma esprimono il talento degli chef.
https://www.yelp.it/biz/le-vitel-etonne-torino;conto adeguato alla qualità dei piatti. spazi un po' stretti.
https://www.yelp.it/biz/le-veronique-bari-2;Le Vèronique a Poggiofranco ha sicuramente una nota positiva rispetto all'altra sede cioè là comoda possibilità di parcheggio.
https://www.yelp.it/biz/le-tre-lanterne-bari;Il locale, abbastanza anonimo, si trova in periferia ed è stato semplice trovare parcheggio.
https://www.yelp.it/biz/le-rondini-torino;ottimo e accogliente, comodo durante la visita della città posto in posizione strategica, vasta scelta nel menu
https://www.yelp.it/biz/le-putrelle-osteria-torino;È un locale carino e adatto anche a bambini piccoli.
https://www.yelp.it/biz/le-lupin-dei-f-lli-zambetta-bari;Locale grande, ideale quando si hanno dei bambini che hanno il loro giusto spazio per muoversi.
https://www.yelp.it/biz/le-grand-tabu-bari;Per il titolare: non basta avere un bel locale e mettere bella musica con qualche bottiglia esposta !!!
https://www.yelp.it/biz/le-due-antenne-bari;Locale ampio, personale cordiale, grandissima abbuffata di antipasti vari caldi, freddi, carne e pesce.
https://www.yelp.it/biz/le-cantine-di-bacco-torino;Il parcheggio in zona è leggermente difficoltoso quindi bisogna sapersi gestire con gli orari.
https://www.yelp.it/biz/lady-bar-torino;Il bar si trova nelle vicinanze di Palazzo Nuovo, il Museo del Cinema e della Mole Antonelliana.
https://www.yelp.it/biz/la-via-della-seta-torino;Parcheggio inesistente, ma se si prosegue 50m in direzione San Mauro, vi è una piazza molto comoda da sfruttare.
https://www.yelp.it/biz/la-taverna-greca-torino-2;Adatto per coppie, gruppi di amici, famiglia, il servizio è generalmente efficiente e ben organizzato.
https://www.yelp.it/biz/la-taverna-dei-mercanti-turin;Locale familiare e molto accogliente, personale gentilissimo ed attento.
https://www.yelp.it/biz/la-tana-del-polpo-bari;E poi i ragazzi in sala fanno gioco di squadra, tutti con il sorriso.
https://www.yelp.it/biz/la-reseda-torino;Staff molto gentile , ambiente accogliente , comodo per il parcheggio e tempi molto comodi per l'ordine
https://www.yelp.it/biz/la-piramide-torino;La posizione ottima, con fermata bus difronte e il servizio è comodo e veloce.
https://www.yelp.it/biz/la-piadineria-torino;Una cosa é non condividere dei valori, un'altra cosa é prendersi gioco dei clienti solo per guadagnare.
https://www.yelp.it/biz/la-mela-stregata-torino;Peccato l'angolo slot in cui si raduna un sacco di gente incallita per il gioco.
https://www.yelp.it/biz/la-madia-torino;Ristorante molto carino pochi tavoli fuori dal centro ...apprezzabile per il parcheggio Personale molto gentile e professionale.
https://www.yelp.it/biz/la-locanda-bari;Ristorante al centro di Bari con una bel dehors spazioso e personale capace.
https://www.yelp.it/biz/la-limonaia-torino;I numerosi libri all'ingresso richiamano lo studio che si ritrova nei piatti e nella loro presentazione, curata e attenta.
https://www.yelp.it/biz/la-gustosa-torino;Bello il posto, un po' piccino, ma pulito, ordinato e piacevole.
https://www.yelp.it/biz/la-gricia-torino;A cena un sabato sera della scorsa settimana...il locale è accogliente e con una posizione ottima, su piazzetta E.
https://www.yelp.it/biz/la-granseola-torino;A pranzo è possibile degustare due menù (o carne o pesce) oltre che una decina di piatti alla carta.
https://www.yelp.it/biz/la-gaia-scienza-torino;Lo staff gentilissimo e familiare che non disdegna di scambiare due chiacchere in allegria.
https://www.yelp.it/biz/la-fila-torino;Ulteriore punto a favore: si mangia davvero bene, in un ambiente confortevole, pulito e familiare, i prezzi sono accessibili.
https://www.yelp.it/biz/la-drogheria-torino;Prezzo nella norma ma buffet molto ricco e atmosfera molto tranquillo, ideale per un apericena con gli amici
https://www.yelp.it/biz/la-cecchina-bari;Un dehor sulla più bella piazza di Bari vecchia, personale sollecito e sorridente, ambiente curato, bella scelta di piatti.
https://www.yelp.it/biz/la-casa-del-demone-torino;Unica pecca il parcheggio,un po' difficile da trovare ...
https://www.yelp.it/biz/la-capannina-torino-2;Essendo un po' decentrato dal centro è facile trovare parcheggio, negli adiacenti Corso Vittorio o Corso Matteotti.
https://www.yelp.it/biz/la-cantinella-torino;21 Locale situato di fianco alla Gran Madre, comodo al parcheggio di piazza Vittorio.
