url;review
https://www.yelp.it/biz/la-cantina-torino;Ambiente semplice ma caldo e curato, un menu fisso a 16€ (si, 16€ per cenare in centro, una favola!)
https://www.yelp.it/biz/la-campana-torino-2;Ristorante a due passi dal museo egizio, molto comodo per chi visita sia il centro che il museo.
https://www.yelp.it/biz/l-osteria-le-ferriere-torino;Bel locale moderno, ben decorato, pulito, spazioso, con tavoli ben distanziati e tanto spazio a disposizione.
https://www.yelp.it/biz/l-oca-fola-torino;Attenzione le porzioni sono particolarmente abbondanti per cui regolarsi bene nelle ordinazioni dei bimbi.
https://www.yelp.it/biz/l-antico-arco-cellamare;Locale non ristrutturato all'ultimo grido dell'Hi-Tech ma semplice e funzionale, a conduzione familiare con personale semplicemente cordiale e disponibile.
https://www.yelp.it/biz/l-aglio-torino;Posticino particolare, fuori dai soliti percorsi turistici, in un' area tranquilla e piena di parcheggio.
https://www.yelp.it/biz/l-accademia-del-panino-torino;Ottimo club sandwich con pane nero al carbon vegetale servizio ottimo cameriera gentilissima con i bambini ottimo veramente
https://www.yelp.it/biz/kirkuk-kaff%C3%A8-torino-2;Si vanta di essere stato il primo kebabaro a Torino. c'è una piccola selezione di birre estere.
https://www.yelp.it/biz/kipling-torino;Personale molto gentile e attento, il parcheggio sotterraneo di piazza Bodoni viene offerto dal ristorante tramite voucher prepagato
https://www.yelp.it/biz/karmacola-torino;C'era un dj nella sala grande e due danzatori stile Bollywood che hanno coinvolto il pubblico, bambini compresi.
https://www.yelp.it/biz/joys-pub-bari;È sempre una soddisfazione soddisfare i nostri amici e malgrado la location del locale crei difficoltà oggettive (parcheggi ).
https://www.yelp.it/biz/japs-torino-3;Comoda la scelta di poter mangiare li o di poter portare a casa perchè take away!
https://www.yelp.it/biz/japs-torino-2;Posticino tranquillo e moderno, che offre piatti tipici della cucina giapponese insieme a numerosi drink.
https://www.yelp.it/biz/istanbul-pizza-kebab-torino;Una piccola area salotto con tre tavoli e un bar con tre sedie.
https://www.yelp.it/biz/indian-street-food-torino;Il posto è piccino, con qualche sgabello e due piccoli banconi.
https://www.yelp.it/biz/imbarchino-torino;Posto molto carino e tranquillo sulla riva del Po, all'interno del parco del Valentino!
https://www.yelp.it/biz/il-vicolo-torino;Alle pareti fotografie fatte con pannelli fonoassorbenti ci accolgono e un simpatico personale di sale a conduzione familiare.
https://www.yelp.it/biz/il-siculo-di-savona-monica-torino;L'ambiente è molto familiare e il personale è gentile e simpaticissimo.
https://www.yelp.it/biz/il-porto-torino;Il locale non è molto grande, ma gli arredi ricreano l'ambiente marinaro, dalle reti agli attrezzi per la pesca.
https://www.yelp.it/biz/il-picchio-torino;Il locale è moderno, con due ampi dehors esterni ed una grande sala interna.
https://www.yelp.it/biz/il-gelatiere-bari-3;C'è un po' di difficoltà nel trovare parcheggio essendo una zona molto trafficate e adiacente al Policlinico.
https://www.yelp.it/biz/il-dolcetto-bari;La pasta dei cornetti è davvero molto buona e il personale cordiale.
https://www.yelp.it/biz/ichi-torino;Trovar parcheggio in quella zona, può richiedere tempo, a seconda dei giorni.
https://www.yelp.it/biz/i-tartufi-bistrot-torino;Il ristorante è piccolo piccolo e si può cenare sia all'interno che nella verandina antistante.
https://www.yelp.it/biz/i-soliti-ignoti-torino;Cibo ottimo, servizio accurato anche se non velocissimo, atmosfera gradevole, location perfetta in un parco dedicato.
https://www.yelp.it/biz/huntsman-pub-torino;Atmosfera giovanile, spazi ampi, servizio veloce con personale dinamico e simpatico, inoltre ottima pizza e prezzi ok.
https://www.yelp.it/biz/hua-dou-torino;Ottima cucina cinese e buonissima la pizza!
https://www.yelp.it/biz/horas-kebab-torino;Ottimo kebab per qualità, prezzo all'interno di un locale spazioso, molto pulito con una cucina efficiente, veloce e splendente.
https://www.yelp.it/biz/home-burger-palese;Homeburger è nell'ala partenze dell'aeroporto di Bari, è un bel locale luminoso, pulito, grande e comodo.
https://www.yelp.it/biz/hamp-bari;Consigliatissimo a tutti...anche a chi ha bambini piccoli piccoli.
https://www.yelp.it/biz/gusti-e-sapori-torino;il ristorante è grande ma la distribuzione degli spazi è gradevole. ottimi sia la pizza che i piatti.
https://www.yelp.it/biz/gulp-bari;Unica pecca è che gli spazi sono un po' stretti e di conseguenza si affollano subito.
https://www.yelp.it/biz/grom-torino-2;Servizio impeccabile e scelta ampia, sempre aggiornata, di gusti, tutti buoni.
https://www.yelp.it/biz/grill-burger-house-bari;Spazi un po ristretti ma servizio gentilissimo, in prima serata è frequentato soprattutto da adolescenti.
https://www.yelp.it/biz/girarrosto-santa-rita-torino;Prezzi bassi : trancio di pizza ai funghi, trancio di farinata e birra piccola 6,50 euro
https://www.yelp.it/biz/girarrosti-santa-rita-torino;Questo girarrosto, comodo per la sua posizione centrale, è piccolo ma estremamente attraente.
https://www.yelp.it/biz/gennaro-esposito-torino;L'ambiente non è niente di speciale, pulito e semplice, ma tu vieni qui per il cibo.
https://www.yelp.it/biz/gelateria-mondello-torino;Gelati di ottima qualità con numerosi gusti da scegliere.
https://www.yelp.it/biz/gasperini-bari;Personale gentile e simpatico da provare sicuramente !!!
https://www.yelp.it/biz/galante-torino-2;Il ristorante, ben posizionato in città, non possiede parcheggio ma non si ha difficoltà a parcheggiare in zona.
https://www.yelp.it/biz/gadi-bari;È un posto molto carino, moderno, originale e assolutamente divertente se si è in compagnia di bambini.
https://www.yelp.it/biz/fuzion-torino;davvero gentile e disponibile, parlando con lui si capisce davvero quanta passione e dedizione metta il quello che fa.
https://www.yelp.it/biz/frulez-bari;Posto molto luminoso, spazioso con cucina a vista e ben curato.
https://www.yelp.it/biz/freevolo-torino;Ambiente ideale per coppie o gruppi di amici.
https://www.yelp.it/biz/fratelli-roselli-torino;Pizza buonissima personale presente e simpatico piccolo locale ma molto familiare da provare ottimi anche i piatti da portata
https://www.yelp.it/biz/fratelli-la-cozza-torino-2;Scelta ideale per accontentare palati diversi (bimbi, giovani e adulti).
https://www.yelp.it/biz/forchetta-e-scarpetta-torino;Localino piccolo ma confortevole...titolare e dipendenti simpatici...cenetta all'insegna del gusto e prezzi competitivi per l'ottima qualità dei piatti !!
https://www.yelp.it/biz/focacceria-santagostino-torino-2;I posti a sedere sono un plus che rende il tutto più comodo e piacevole
https://www.yelp.it/biz/focacceria-riviera-ligure-torino;Comodo perché è in pieno centro a Torino, a due passi dal museo egizio, ideale per un pranzo rapido.
https://www.yelp.it/biz/fassoneria-torino;Il locale è in una zona della movida torinese, con facilità di parcheggio nella vicina piazza della Repubblica.
https://www.yelp.it/biz/faro-bar-torino;Il negozio è pulito, il personale è molto cordiale e c'è un sacco di posti a sedere coperti all'aperto.
https://www.yelp.it/biz/farini-da-lia-torino;Fuori dal centro vicino al Campus Einaudi con facilità di parcheggio.
https://www.yelp.it/biz/family-bar-torino;Ambiente modernissimo e curato, servizio cordiale, facilità di parcheggio
https://www.yelp.it/biz/exki-pietro-micca-torino;Il locale è sicuramente molto utile per una pausa veloce durante la giornata, gli spazi sono ampi e rilassanti.
https://www.yelp.it/biz/exki-8-gallery-torino-2;Spazioso e comodo per una pausa rilassante.
https://www.yelp.it/biz/esperia-torino-2;Luogo adatto non solo per giocare a tennis ma anche per organizzare pranzi di lavoro (tranquillità, discrezione...).
https://www.yelp.it/biz/entremetier-di-lingweifu-torino;E poi un via vai di cameriere e bambini cinesi (bambini, si, che servono ai tavoli perdendosi tra questi!!!!)
https://www.yelp.it/biz/eno-libero-emporio-enogastronomico-torino;Ottimo per famiglie nel fine settimana, molto alla mano, in coppia meglio di sera.
https://www.yelp.it/biz/emporio-gastronomico-torino;Situato in ottima posizione, nei pressi di Corso Vittorio Emanuele, ottime possibilità di parcheggio.
https://www.yelp.it/biz/el-pollo-loco-torino;L'atmosfera tranquilla permette di trascorrere una serata tranquilla anche in presenza di bambini.
https://www.yelp.it/biz/el-centenario-torino-2;Grande scelta di piatti di ogni tipo, è presente anche un menù bimbi e una varia proposta senza glutine.
https://www.yelp.it/biz/eataly-torino-torino;Vi sono numerosi punti ristoro (a tema, carne, pesce, pizza, ecc.) al piano vendita.
https://www.yelp.it/biz/eataly-bari;Comodità per il grande parcheggio gratuito per i clienti, annesso alla struttura (praticamente a ridosso della Fiera del Levante).
https://www.yelp.it/biz/du-cesari-torino;Comunque il locale si presenta come una classica osteria e il personale é molto disponibile e simpatico.
https://www.yelp.it/biz/dess%C3%AC-torino;Prezzi nella norma e locale carino, ma niente di che
https://www.yelp.it/biz/delfino-blu-torino;Bel posto , ottimo pesce, e personale eccellente, facile da trovare parcheggio, e, prezzi adeguati al cibo
https://www.yelp.it/biz/dai-saletta-torino-2;Tutto è perfetto: i piatti sono deliziosi, i padroni di casa sono persone gentili e l'atmosfera è davvero familiare.
https://www.yelp.it/biz/da-paolo-bari;L' ambiente è accogliente,spazioso e pulito, il personale gentile e professionale.
https://www.yelp.it/biz/da-giuliano-torino;Il locale è nuovo di zecca...ma la gestione è sempre la stessa...familiare, molto semplice e cordiale.
https://www.yelp.it/biz/da-giannino-l-angolo-d-abruzzo-torino;Ambiente familiare e ben curato, ottima la cena e servizio veloce e gentile.
https://www.yelp.it/biz/da-ciro-torino;E poi è in una zona comoda al centro e si trova parcheggio facilmente.
https://www.yelp.it/biz/da-ciccillo-torino;Occorre assolutamente prenotare, in quanto gli spazi sono ridotti e c'è il rischio di non trovare posto.
https://www.yelp.it/biz/cris-e-bio-bari;Locale adatto sia a famiglie sia a giovani con il retro del locale con musica.
https://www.yelp.it/biz/cornetti-night-torino-2;Quante volte capita di aver trascorso una bella serata, magari in zona movida,ma di sentire che manca ancora qualcosina.
https://www.yelp.it/biz/coox-torino;Situato in piazza Vittorio, è comodo per uscire la sera.
https://www.yelp.it/biz/complice-di-zhou-jinshu-torino;Da menzionare gli Spaghetti all'Americana ed il Menù Bimbi, quest'ultimo indice di attenzione anche verso i più piccoli.
https://www.yelp.it/biz/cinese-nanchino-torino;Da segnalare che il personale è estremamente gentile e disponibile, ma purtroppo non basta.
https://www.yelp.it/biz/cinese-mei-li-hua-torino;Posto in zona con facilità di parcheggio e dehors estivo.
https://www.yelp.it/biz/cinese-du-cheng-torino-2;E' comodo arrivarci in bus perchè la fermata Bertola è in prossimità del locale.
https://www.yelp.it/biz/ciacolon-ca-veneta-torino;Parcheggio abbastanza facile davanti al locale, servizi impeccabili, consigliato prenotare perché il locale è molto frequentato.
https://www.yelp.it/biz/chez-zeina-torino;Ottima accoglienza, locale spazioso, servizio familiare e, soprattutto buonissima cucina libanese.
https://www.yelp.it/biz/cecchi-torino;Sono attrezzati di seggioloni e il personale coi bimbi è particolarmente gentile e attento.
https://www.yelp.it/biz/catullo-torino-2;Famoso anche tra personaggi di spicco, ambiente a modo e alla moda (scusate il gioco di parole).
https://www.yelp.it/biz/casale93-torino;Attenzione al parcheggio: in zona bisogna girare un po', per trovarne, specialmente la sera.
https://www.yelp.it/biz/cantine-risso-torino;Un vantaggio: la sera è facile trovare parcheggio nel piazzale antistante che durante il mattino è riservato ai mercatali
https://www.yelp.it/biz/cammaf%C3%A0-torino-4;Anche il locale è carino rinnovato da poco
https://www.yelp.it/biz/camilla-kitchen-torino;Il locale è stirato a pochi passa da piazza Vittorio Veneto con la comodità dei parcheggi.
https://www.yelp.it/biz/caffe-vittorio-veneto-torino;Parcheggio comodo sotterraneo Buffet di cibi con buona scelta non refrigerati e non coperti.
https://www.yelp.it/biz/caffe-mozart-bari;L'arredo e la capacità di accoglienza (numerosi posti a sedere sia all'interno che all'esterno) sono validi.
https://www.yelp.it/biz/caff%C3%A8-torino-torino-2;In una bella giornata, è un luogo ideale per sedersi e guardare la gente della città .
https://www.yelp.it/biz/cacio-e-pepe-torino;Per la sera potete parcheggiare nella zona del mercato, quindi non ci sono nemmeno problemi di parcheggio in settimana.
https://www.yelp.it/biz/busters-coffee-torino;Ottimo personale e comoda la struttura con tavoli interni ed esterni.
https://www.yelp.it/biz/burgheria-torino;Bellissimo posto con vetrate, richiama un po' i locali inglesi, comodo, accogliente e caldo.
https://www.yelp.it/biz/brek-torino;Buona soluzione per mangiare in maniera veloce e sana, a differenza dei numerosi fast food presenti in città.
https://www.yelp.it/biz/braceria-signorile-bari;Locale piccolo ma confortevole e ben arredato, il servizio è stato gentile e non invasivo, l'accoglienza da subito calorosa!
https://www.yelp.it/biz/botta-bari;Impasto gustoso e digeribilissimo, ingredienti di prima qualità, servizio familiare e simpatico, tovaglia e tovaglioli in tessuto e puliti.
https://www.yelp.it/biz/borgo-medioevale-torino;Riconostruzione ottocentesca di edifici medievali situata nel Parco del Valentino, è una graziosa amenità , ma non molto di più.
https://www.yelp.it/biz/borgo-dora-torino;I prezzi sono Bassi e qualità è buona.
https://www.yelp.it/biz/borgo-antico-bari;Una sinfonia di sapori della cucina barese, siete riusciti a rendere unico ed entusiasmante ogni boccone.
https://www.yelp.it/biz/blue-eyes-bari;Posto giusto per trascorrere una serata in compagnia mangiando e bevendo secondo la giusta qualità e prezzo rimanendo soddisfatti.
https://www.yelp.it/biz/black-e-white-bari;Elegante, pulito, indicato per serate di coppia, sconsigliato ai bambini.
https://www.yelp.it/biz/bistrot-turin-torino;Ampia la scelta dei vini Spazi davvero angusti ma personale molto cortese
https://www.yelp.it/biz/biancofiore-bari;Forse serviva un cameriere in più ma va detto che il locale non è molto spazioso.
https://www.yelp.it/biz/bene-cos%C3%AC-torino;Ottima la scelta della musica in sottofondo, e il volume era perfetto per riuscire a chiacchierare.
https://www.yelp.it/biz/bbq-di-pennestri-davide-antonio-c-torino;Un posto molto bello anche per grandi gruppi di persone.
https://www.yelp.it/biz/bastimento-torino;Il posto è' molto carino, intimo ma da la sensazione di essere molto spazioso.
https://www.yelp.it/biz/barnum-torino;Qualità dei prodotti medio alti, location ideale per gruppi numerosi purché abbiate prenotato in tempo.
https://www.yelp.it/biz/bari-napoli-bari;Ambiente etnico che a tratti ti catapulta in un posto esoterico e allo stesso tempo familiare.
https://www.yelp.it/biz/bar-lo-scudiero-torino;Nota negativa è il parcheggio, il cancello elettronico è rimasto aperto per tutta la nottata.
https://www.yelp.it/biz/banco-di-sicilia-torino;Questo ristorante è vivino allo stadio ed è molto comodo per chi va a vedere la partita.
https://www.yelp.it/biz/babayaga-bari;La gelateria è piccola, il personale poco cordiale.
https://www.yelp.it/biz/b-eat-torino;L'ambiente è familiare e molto rilassato, il personale, dai camerieri, ai cuochi, al proprietario, è amichevole e attento.
https://www.yelp.it/biz/augusto-torino;Quintino, il locale si presente molto bene, con ampi spazi e tavoli.
https://www.yelp.it/biz/armeria-reale-torino;Molto apprezzata anche dai bambini, soprattutto grazie ai cavalli e alle armature che adornano lo spazio.
https://www.yelp.it/biz/anema-e-cozze-torino;Il locale è gradevole, con ampio affaccio su corso Matteotti, un arredo semplice e non pacchiano.
https://www.yelp.it/biz/amici-miei-torino;Locale in centro, spazi piccoli sfruttati all'inverosimile, tavoli di ridottissime dimensioni e clienti stipati come sardine.
https://www.yelp.it/biz/america-graffiti-torino;Il servizio attento e comodo parcheggio davanti al locake
https://www.yelp.it/biz/alla-lettera-torino;Comodo da raggiungere da Porta Nuova, offre una pizza molto buona e una ricca selezione di primi e secondi.
https://www.yelp.it/biz/alcool-torino-2;Ambiente curato, spazi ampi, grande varietà  di cocktail
https://www.yelp.it/biz/alberto-marchetti-torino;Peccato che il cono baby (1 gusto) sia realmente dedicato ai bambini tant'è che un adulto non può usufruirne.
https://www.yelp.it/biz/alberosole-bari;Ristorante molto carino con ambiente accogliente, con soffitti alti in pietra viva, e atmosfera con luci soffuse...
https://www.yelp.it/biz/ala-torino;Storico locale nel cuore nel quartiere Vanchiglia il cui fascino è la semplicità e l'ambiente familiare.
https://www.yelp.it/biz/al-tegamino-moncalieri;Il locale è molto casalingo e abbastanza spazioso perché disponde di due piani.
https://www.yelp.it/biz/al-sorso-preferito-bari;Pulito, ordinato e con accoglienza molto gioviale e familiare.
https://www.yelp.it/biz/al-savoia-bari;Forse un tempo era un riferimento per qualità e cortesia ma ora non più.
https://www.yelp.it/biz/al-cacimperio-torino;Il locale non si prenderà molto bene, spazi ristretti e tavoli che non consentono una eventuale discussione.
https://www.yelp.it/biz/al-bicerin-torino;Goditi la meravigliosa atmosfera di una piccola piazza con una deliziosa bevanda calda e opzionalmente una selezione di biscotti.
https://www.yelp.it/biz/al-111-bari-2;Comodo il dehor che affaccia direttamente sul corso principale.
https://www.yelp.it/biz/ai-4-assi-di-sanna-roberto-torino;Pizza molto buona , servizio gentile e premuroso, personale disponibile , dehor esterno caldo e spazioso .
https://www.yelp.it/biz/adonis-torino;Il cibo è di qualità, il servizio amichevole e professionale al tempo stesso, il ristorante comodo ed essenziale.
https://www.yelp.it/biz/a6-sciamadda-torino;Parcheggio difficile ma non impossibile , conto onestissimo!!!
https://www.yelp.it/biz/a-vucciria-torino;Sala piccola tavoli appiccicati uno all altro, musica del pianobar altissima e gente che ti balla praticamente sul tavolo.
https://www.yelp.it/biz/a-picciridda-torino;I camerieri non sembravano abbastanza numerosi da stare dietro a tutto.
https://www.yelp.it/biz/a-casa-di-pulcinella-torino;Pizza con diverse farine volendo (oggi segale) e con taglia bimbi leggermente più piccola.
https://www.yelp.it/biz/500-calorie-torino;Molto carino il posto, anche se piccolino sia dentro sia nel dehor da una decina di posti.
https://www.yelp.it/biz/%C3%A8-cucina-cesare-marretti-torino;Il menu è impostato con gli ingredienti più freschi possibili.
