url;review
https://www.yelp.it/biz/zheng-yang-torino-2;Ottima la zuppa con spaghettini, pollo e uovo.
https://www.yelp.it/biz/wiener-haus-torino;Buon rapporto qualità  prezzo, tutte le porzioni sono molto abbondanti.
https://www.yelp.it/biz/waxy-torino;Oltre a bere si può anche mangiare: offrono buone e sfiziose bruschette e carni buone.
https://www.yelp.it/biz/wasabi-torino;Locale strettamente giapponese come arredamento , abbigliamento e titolari , non è Ayce ma come prezzi è accessibile .
https://www.yelp.it/biz/volver-torino-2;Posto giusto per una buona grigliata , buon vino e buone le patate spagnole ......... pit stop obbligato !
https://www.yelp.it/biz/vo-torino;Carne buona, uovo particolare e piacevole, come la salsa ai peperoni che guarniva il piatto.
https://www.yelp.it/biz/vintage-torino;Da non perdere il gelato fatto in casa, così come il pane.
https://www.yelp.it/biz/villa-somis-torino;Tutto inizia così, con un menù degustazione di 9 portate di carattere, equilibrate, presentate molto bene, tutte veramente ottime.
https://www.yelp.it/biz/verdi-d-indivia-torino;Ieri erano ad esempio presenti due primi, due torte salate, hamburger veg, verdure sia cotte che crude, diverse torte,...
https://www.yelp.it/biz/tre-galline-torino-2;Carne all'albese da manuale, un'interessante lasagnetta con verdure e chips di barbabietola e un'ottima tarte tatin.
https://www.yelp.it/biz/tre-galli-torino-2;L'antipasto (carne cruda di Fassone con aringhe al verde) era molto buono.
https://www.yelp.it/biz/trattoria-spirito-santo-torino-2;A torino ci sono numerose ottime gelateria ma questa le batte tutte per il rapporto qualità - prezzo.
https://www.yelp.it/biz/trattoria-mombercelli-di-antico-elena-torino;Pesce bollito (nasello e non persico come descritto in menù) con patate veramente da regime.
https://www.yelp.it/biz/trattoria-da-cinzia-torino;Carni varie e di agnello sono la specialità del locale insieme ad ottimi primi rigorosamente abruzzesi.
https://www.yelp.it/biz/torteria-berlicabarbis-torino;Da sottolineare la possibilità di scegliere se prendere una fetta intera o una mezza fetta (a prezzo dimezzato ovviamente).
https://www.yelp.it/biz/tisaneria-della-consolata-torino;Le torte sono buone (idilliaca la simil torta 900) e c'è una bella scelta di the e tisane.
https://www.yelp.it/biz/teapot-torino;Discreta la scelta delle torte, da provare anche colazione all'americana con uova strapazzate e bacon.
https://www.yelp.it/biz/taverna-delloca-torino;Arriva il tagliere variegato di paté e salumi a base di carne d'oca accompagnato da cetriolini e marmellata.
https://www.yelp.it/biz/taco-bang-torino;I burritos sono davvero ben preparati, le alette di pollo croccanti e ricoperte da un'ottima salsa bbq.
https://www.yelp.it/biz/tabit-bari;Si trova in una zona piuttosto isolata, seppure nelle vicinanze del Lungomare e della spiaggia di Pane e pomodoro.
https://www.yelp.it/biz/t-bone-station-torino;l'ambiente non è particolarmente affascinante ma la qualità della carne è buona, le porzioni giuste, forse un po' caro
https://www.yelp.it/biz/stars-e-roses-torino;In cassa avete fatto i complimenti per le carni e adesso scrivete così così 22.17 ora dello scontrino....
https://www.yelp.it/biz/spaghetteria-70cento-bari;Ampia scelta nel menù con primi che spaziano dal pesce, alla carne e alle verdure.
https://www.yelp.it/biz/soup-e-go-torino;Ideale per una pausa pranzo diversa dal solito panino, fresca e salutare e a prezzi contenuti.
https://www.yelp.it/biz/solferino-torino;Personale molto gentile e disponibile, porzioni abbondanti, piatti di qualità, ampia scelta sia di carne che di pesce.
https://www.yelp.it/biz/simini-giuliano-torino;Menù ricchissimo dai frutti di mare, ai tartufi, alle lumache il tutto accompagnato da salse buonissime.
https://www.yelp.it/biz/signorvino-torino;Piatto di carne e formaggio parzialmente divorato :) Piatto di carne e formaggio parzialmente divorato :)
https://www.yelp.it/biz/sicomoro-torino;Cena tra amici in una grande tavolata: chi pesce, chi carne, chi sushi, chi pasta.
https://www.yelp.it/biz/siciloso-torino;Le patate buone, mentre la scaloppina aveva il sapore dell'aglio, null'altro.
https://www.yelp.it/biz/sibir-torino-2;Il menù offre un'ampia scelta di piatti tipici della tradizione siberiana ed una vasta gamma di carni e tagli.
https://www.yelp.it/biz/shodai-bari;Ottimo ristorante giapponese il posto giusto se si vuole mangiare del buon sushi.ottima carta dei vini .servizio impeccabile
https://www.yelp.it/biz/seven-up-torino;Dopo le lamentele la titolare ha detto: la carne è buona ma non riusciva nemmeno lei a tagliarla ...
https://www.yelp.it/biz/settes%C3%AC-torino-2;Tanta cura e attenzione ai dettagli nella preparazione e presentazione di cibo di alta qualità !
https://www.yelp.it/biz/sen-mi-ya-torino-2;Mai andato a cenare o pranzare a un ristorante giapponese.
https://www.yelp.it/biz/scannabue-torino;Due antipasti di alici in tre forme:su crostini con un accenno di burro, al verde e fritte.
https://www.yelp.it/biz/sbrodolone-torino;Veloci nella preparazione della pizza, panini e piadine Panino con pollo alla griglia super consigliato(3.90€) !
https://www.yelp.it/biz/sa-corte-noa-torino;La tavola è apparecchiata con cura e subito ci portano un bel cesto di pane fresco, davvero molto buono.
https://www.yelp.it/biz/rossosapore-torino;La pizza risulta buona ma ordinando una focaccia con cotto verdure e patate viene a costare 9 euro.
https://www.yelp.it/biz/rossopomodoro-torino;Piatti scelti:1 polentina fritta su crema 4formaggi, 1cuoppo di alici fritte ed una tiella(lo sformatino di pasta... eccezionale!)
https://www.yelp.it/biz/ristrot-guviol-torino;Tartare di gambero, tartare di carne, mousse di uovo al tartufo, tutti i primi proveti eccellenti.
https://www.yelp.it/biz/ristoranti-tromlin-torino;Il cibo molto piemontese cucinato con prodotti molto ma veramente molto a km.0 ed un ottimo rapporto qualità prezzo.
https://www.yelp.it/biz/ristoranti-taverna-delle-rose-torino-2;Sia i piatti di pesce che di carne sono molto buoni e la location è veramente molto carina.
https://www.yelp.it/biz/ristoranti-alba-torino;Ottimi peperoni ala bagna cauda, la carne cruda tipica piemontese, risotto al barolo, l immancabile vitello tonnato, buon servizio.
https://www.yelp.it/biz/ristorante-ratatui-torino-2;Secondi...couscous con carne e verdure:couscous secco,con nessun tipo di accordo con le verdure e la carne.
https://www.yelp.it/biz/ristorante-g-torino;Vecchia scuola italiana, con prosecco e antipasto, servizio formale e una discreta scelta di piatti locali e standard.
https://www.yelp.it/biz/ristorante-consorzio-torino;Si è passati da un uovo in camicia con pancetta e crema di formaggiodelizioso a degli agnolotti gobbi squisiti.
https://www.yelp.it/biz/ristopizza-giampaolo-bari;Buon vino, buoni antipasti e poi più di mezz'ora di attesa per un dentice al forno con patate.
https://www.yelp.it/biz/quo-vadis-torino-2;Così è, un solo piatto di Fassona con patatine fritte e acqua € 35 , alla faccia !
https://www.yelp.it/biz/quattro-soldi-torino;Porzioni giganti, gnocchi in quantità industriali e buoni, carne in abbondante quantità (spiedone) ma di qualità non ottima.
https://www.yelp.it/biz/primaepoi-torino-3;A pranzo hanno menu pizza e menù pasta con bibita e caffè incluso molto conveniente.
https://www.yelp.it/biz/prima-e-poi-torino;A pranzo hanno menu pizza e menù pasta con bibita e caffè incluso molto conveniente.
https://www.yelp.it/biz/porto-di-savona-torino;Vitello tonnato e carne cruda ottimi per non parlare del brasato che si scioglieva in bocca con il purè...
https://www.yelp.it/biz/porcaloca-torino;A pranzo il menu pizza costa solo 7 euro, inclusi bibita a scelta e caffè.
https://www.yelp.it/biz/poormanger-torino;Ottima cena a base di patate veramente buona e originale per la varietà di abbinamenti con i condimenti.
https://www.yelp.it/biz/pony-bubble-tea-torino;Sono in una posizione fantastica e sebbene sia molto piccola all'interno, c'è un grande salotto all'aperto.
https://www.yelp.it/biz/ponte-regina-torino;Assolutamente da assaggiare le patatine fritte, sempre freschissime, tagliate con maestria: sottili, croccanti e morbide.
https://www.yelp.it/biz/pollastrini-torino;Il coperto comprende anche il pane, i grissini, noti come rubatà, e dei piccoli crackers, sempre artigianali.
https://www.yelp.it/biz/pizzeria-vecchio-forno-garibaldi-torino;Se vi aggradano le patate al forno trovate sempre una bella teglia pronta !
https://www.yelp.it/biz/pizzeria-spaccanapoli-torino;Prenotato per circa 30 persone per avere un menù a 13 euro con pizza al metro e bibita.
https://www.yelp.it/biz/pizzeria-silvestro-torino;piatti abbondanti e di qualità..ottime le portate sia a base di carne che di pesce..
https://www.yelp.it/biz/pizzeria-queendici-torino;Il locale offre un'ampia varietà di pizze e focacce unite alla brace di carne e pesce ed antipasti.
https://www.yelp.it/biz/pizzeria-pieros-torino;Da fuori non sembra, ma menù particolare con qualche ingrediente ricercato come il tartufo, rende il locale speciale.
https://www.yelp.it/biz/pizzeria-petit-roi-bitritto;Patatine chips e tre birre 58 €€ Era un posto da me preferito ma opterò per altro .
https://www.yelp.it/biz/pizzeria-osteria-dal-vassallo-bari;La pizza e' buonissima specialmente la vassallo e si spazia da carne a pesce tutto ottimo
https://www.yelp.it/biz/pizzeria-il-pirata-bari;Locale semplice come arredamento e in ottima posizione con ampio parcheggio .prezzo adeguato alla qualità e quantità
https://www.yelp.it/biz/pizzeria-gino-torino;Prezzo delle bibite nella media. 11€ pizza, farinata e bibita.
https://www.yelp.it/biz/pizzeria-giampy-di-mazzola-giuseppe-torino;pranzo veloce di lavoro. pesce spada, patate acqua caffè.. gentili e veloci: consigliato. locale moderno e semplice.
https://www.yelp.it/biz/pizzeria-fratelli-la-bufala-torino;Tornando alla cucina:pizza gustosa con un ottima pasta,insalate non banali,carne tenera e di buona qualitá.
https://www.yelp.it/biz/pizzeria-enzo-e-ciro-di-fraddosio-v-c-bari;Come definire la pizzeria da Enzo e Ciro, con il nomignolo la qualità è un ingrediente di questo luogo.
https://www.yelp.it/biz/pizzeria-dual-torino;Hamburger non esaltante, ma nel complesso un buon posto per una serata informale in compagnia.
https://www.yelp.it/biz/pizzeria-divina-bari;Preparazione artigianale degli antipasti e vasta scelta di carne alla brace.
https://www.yelp.it/biz/pizzeria-da-michele-torino;Primi abbondanti a base di pesce o funghi e secondi, principalmente di carne, gustosi e in buona proporzione.
https://www.yelp.it/biz/pizzeria-da-candido-torino;Gli ingredienti ottimi fanno sì che le pizze, anche quelle più originali, siano sempre delicate e digeribili.
https://www.yelp.it/biz/pizzeria-d-autore-bari;Sia da asporto sia (ancora meglio) da gustare nel locale la pizza di Antonio è sempre una garanzia !!!
https://www.yelp.it/biz/pizzeria-antipasteria-bistro-bari;Il menù a prezzo fisso è molto buono tutta roba genuina.
https://www.yelp.it/biz/pizzeria-alloca-di-pulcinella-torino;Posto carino e molto strategico, fronte stadio comunale, buonissimo per serate ma anche per pranzi a buon prezzo.
https://www.yelp.it/biz/pizze-e-cozze-torino;Il menù prevede oltre le pizze un buon assortimento di primi secondi, sia di carne che di pesce.
https://www.yelp.it/biz/pizza-speedy-torino-3;La pizza è buona, gli ingredienti sono ottimi e alcune pizze sono particolari e poco diffuse.
https://www.yelp.it/biz/pizza-bon-bari;Pizza di ottima qualita' e prezzo, da non perdere il calzone di cipolla e di carne.
https://www.yelp.it/biz/pizza-ad-hoc-torino;Offre molte tipologie di pizze, qualche primo, insalate e hamburger.
https://www.yelp.it/biz/piola-cianci-torino;Piatti buoni e particolari, ottima carne cruda come antipasto, secondi di alto livello.
https://www.yelp.it/biz/piano-b-torino;Posto molto elegante e carino, carne di ottima qualità e buonissima, personale ben preparato e gentile.
https://www.yelp.it/biz/perbacco-bari;Location molto curata e accogliente, buone le orecchiette e i medaglioni di carne.
https://www.yelp.it/biz/pastificio-defilippis-torino;Nella foto allegata: tajarin guanciale e mozzarella di bufala affumicata.
https://www.yelp.it/biz/pastamaneria-torino;Il pasto è accompagnato da una morbida e gustosa focaccia bianca al posto del pane.
https://www.yelp.it/biz/passamaneria-torino;Si tratta di palline di pasta della pizza fritte da intingere in burrata e pomodoro..
https://www.yelp.it/biz/panperfocaccia-torino-2;Buona zuppa di lenticchie, gnocchi al ragù e tortino di patate e fontina.
https://www.yelp.it/biz/panificio-magda-bari;Il locale offre anche tantissime specialità quali panzerotti, arancine di riso crocchette di patate e molto altro ancora.
https://www.yelp.it/biz/panificio-el-focacciaro-bari;Troverete dell'ottima focaccia barese, panzerottini ripieni di carne macinata o pomodoro e mozzarella, crocchette di patate, arancini e rusticini.
https://www.yelp.it/biz/pan-cafe-torino;Cena abbondante e veloci nel servire prezzi nella media consigliato Locale climatizzato carne buona piatti abbondanti
https://www.yelp.it/biz/pai-bikery-torino;Lo stesso menù brunch è di fatto ridotto a poche proposte, il resto sono sandwich o hamburger o caffetteria.
https://www.yelp.it/biz/paese-zhou-torino-2;Ovviamente ci sono altri ristoranti molto più carini come arredamento ma come qualità prezzo non lo batte nessuno.
https://www.yelp.it/biz/osteria-sopravento-bari-2;Orecchiette e riso patate e cozze buonissime, per non parlare della melanzana di pesce consigliataci dallo chef (memorabile!!!).
https://www.yelp.it/biz/osteria-povrom-torino;Interessanti e da provare anche i menù fissi per la cena a 25 euro,sia di carne che di pesce.
https://www.yelp.it/biz/osteria-le-arpie-bari;Consigliati gli antipasti (tutti) ed i primi (da provare la teglia di patate riso e cozze).
https://www.yelp.it/biz/osteria-del-frate-torino;Tutta la qualità del cibo è ottima, dagli antipasti, sia di carne che di pesce, ai secondi.
https://www.yelp.it/biz/osteria-dei-quattro-gatti-bari;Ampio il locale, buono il menù di pizze, carne e pesce.
https://www.yelp.it/biz/osteria-degli-ottoni-torino;Certo il petto di pollo era un po' asciutto ma l'insieme e' stato gradevole.
https://www.yelp.it/biz/osteria-antichi-sapori-bari;A partire dal cibo di ottima qualità a finire al personale cordiale e molto preparato sui prodotti da vendere.
https://www.yelp.it/biz/osteria-antiche-sere-torino;Antipasti della casa molto sfiziosi, tajerin o gnocchi con funghi buonissimi e secondi di carne altrettanto buoni.
https://www.yelp.it/biz/osteria-al-gambero-bari;Cibo di ottima qualità, cucinato in modo semplice e sublime. 10 e lode al pesce crudo e ai fritti.
https://www.yelp.it/biz/opera-bari;Da sottolineare l'altissima qualità della materia prima, pasta fresca, pesce fresco, patate fritte NON surgelate (una rarità).
https://www.yelp.it/biz/open-baladin-torino;La carne di Fassone piemontese scelta per i nostri hamburgher è presidio slow food, Pulita, Giusta e Buona quindi.
https://www.yelp.it/biz/oolivoo-bari;Patate riso e cozze polpo arrosto ed altro.
https://www.yelp.it/biz/oinos-torino;ottimo sia come location che come cibo in pieno centro, ottimo in tutto cibo giapponese particolare e buono
https://www.yelp.it/biz/officine-panino-torino;I panini sono abbondanti e preparati con buoni ingredienti con prezzi competitivi tra i 6 e i 7 euro.
https://www.yelp.it/biz/nuovo-fizzarotti-bari;Cenetta tra amici, antipastini e carne...tutto molto buono, personale molto professionale, atmosfera piacevolissima..consigliato!
https://www.yelp.it/biz/nouvel-vis-a-vis-modugno;Buone le verdure grigliate e la scaloppina di pollo.
https://www.yelp.it/biz/my-ecosmartfood-torino-2;Molto apprezzati gli ottimi hamburger (splendida carne di fassone ) e la pasta alla norma eccezionale.
https://www.yelp.it/biz/morelli-antonio-modugno;un'ottima soluzione per la pausa pranzo. varietà di panini e rosticceria assortita. un pranzo veloce ma di otima qualità
https://www.yelp.it/biz/monte-dei-cappuccini-torino;La carne, provata in varie occasioni è sempre arrivata con una cottura non richiesta o non adatta al taglio.
https://www.yelp.it/biz/monferrato-torino;Antipasti ottimo, carne cruda e vitello tonnato da sballo Primi eccellenti, agnolotti con il plin e taglierini ai gunghi.
https://www.yelp.it/biz/mina-torino;Nulla da eccepire sull'antipasto (4 fettine di salumi e un'insalatina di sedano con una tartare di carne cruda).
https://www.yelp.it/biz/miagola-cafe-torino;con riso venere e verdure saltate, verdure grigliate, insalata, spinaci e pane non duro, di più!
https://www.yelp.it/biz/mezzaluna-osteria-torino;Menu ancora piu ricco, piatti nuovi di carne e pesce.il menu degustazione molto abbondante e sfizioso.
https://www.yelp.it/biz/mexico-70-torino;Andateci giusto se avete 10 euro in tasca e volete fare una cena completa senza guardare qualità ed altro.
https://www.yelp.it/biz/menupizza-torino;Una Margherita e una bibita offerta 4,50 €, che volete di più?
https://www.yelp.it/biz/menodiciotto-torino;Si può mangiare un panino guardando una parte della Torino storica.
https://www.yelp.it/biz/mazzini-38-torino;Resta comunque la straordinaria simpatia e disponibilità  del personale, un buon servizio e prezzi decisamente nella media torinese.
https://www.yelp.it/biz/master-sandwich-torino;Pane morbido, diverse varietà di panini (alcuni molto interessanti), molto vicino a piazza castello, servizio veloce e prezzo adeguato
https://www.yelp.it/biz/masaniello-%C3%A9-turnat-torino;Il menù è ricco di piatti tipici e nuovi abbinamenti, per accontentare i curiosi, ma anche gli scettici.
https://www.yelp.it/biz/marechiaro-torino;Menù molto vario sia di pesce che di carne, oltre a servire una pizza che aveva un ottimo aspetto.
https://www.yelp.it/biz/mare-nostrum-torino;Pesce bianco pomodoro e pane grattugiato Pesce bianco pomodoro e pane grattugiato Tutto fritto.
https://www.yelp.it/biz/manz%C3%B2-torino;Va bene se ti piace la carne più rara, ma se ti piacciono, un medium sarà  ancora sanguinoso ...
https://www.yelp.it/biz/mamma-mia-torino-2;pizza discreta , ingredienti ottimi, servizio veloce ed attento, molto comodo per chi frequenta palazzo nuovo, locale molto frecuentato
https://www.yelp.it/biz/mamasita-torino;La carne e' tenera, gustosa, le salse sono sfiziose, le tortilias leggere, ed il chipote e' fantastico.
https://www.yelp.it/biz/magorabin-torino;C'erano molte sorprese all'inizio e alla fine del pasto, compresi gli amuse-bouche (molti), il pane (s) e il dessert.
https://www.yelp.it/biz/m-bun-torino;Un buon hamburger in zona centro a Torino, locale ben tenuto e personale gentile, da provare con prezzi modici
https://www.yelp.it/biz/luce-e-gas-torino-2;Molto buona la grigliata di pesce un po' ridotto invece il piatto di carne .
https://www.yelp.it/biz/locanda-da-betty-torino;Da segnalare le carni e le verdure in carpione, che raramente si trovano nei menù.
https://www.yelp.it/biz/lo-stonnato-torino;si mangia bene e molto variegato: carne, pesce o pizza molto buona!
https://www.yelp.it/biz/lo-sfizio-bitritto;Da: polpo e gamberi, e la pasta e la carne bovina è stato preparato con cura e perfezione culinaria.
https://www.yelp.it/biz/libery-pizza-e-artigianal-beer-torino;Ha la birra artigianale Baladin alla spina, servita o direttamente in teku o portata nello spillatore da 1,5 L.
https://www.yelp.it/biz/libanese-el-mir-torino;Non avendo un metro di paragone il tutto è sembrato gustoso e di buona qualità , ma non entusiasmante.
https://www.yelp.it/biz/le-vitel-etonne-torino;carne di fassona al coltello che si scioglie in bocca, buone anche le acciughe del cantabrico in salsa verde!
https://www.yelp.it/biz/le-veronique-bari-2;Il tutto servito nel piatto (anche la carne), su di un foglio di carta.
https://www.yelp.it/biz/le-tre-lanterne-bari;, patatine e olive fritte, bruschette, bevande e caffè, il tutto ad un modico prezzo.
https://www.yelp.it/biz/le-rondini-torino;Il secondo era fritto di pesce, discreto, con contorno di patatine.
https://www.yelp.it/biz/le-putrelle-osteria-torino;Successivamente arrivano degli Agnolotti alle tre carni con burro e nocciole, altra meraviglia che accarezza il palato.
https://www.yelp.it/biz/le-lupin-dei-f-lli-zambetta-bari;È spazioso e arredato vagamente in stile bistrot francese (tovaglie a quadri etc).
https://www.yelp.it/biz/le-grand-tabu-bari;Il menù offre tante prelibatezze di carne e pesce.
https://www.yelp.it/biz/las-vegas-torre-a-mare;Fin quando ci fosse qualità nel prodotto poteva essere giustificato , ma qui c'è solo polvere di gelato ....
https://www.yelp.it/biz/la-via-del-sale-torino;Molto vario e gustoso il cestino del pane, ottimi i vini, presi un bianco e un rosso al calice.
https://www.yelp.it/biz/la-uascezze-bari;Immancabile il riso, patate e cozze, ma ottima anche la parmigiana di zucchine e le fave e cicorie.
https://www.yelp.it/biz/la-taverna-dei-mercanti-turin;La cucina è fatta in casa, da provare la pasta fresca e la carne Grazie
https://www.yelp.it/biz/la-tana-del-polpo-bari;Tanto per cambiare e per fare qualcosa di diverso, si può andare a mangiare un panino in questo ristorante.
https://www.yelp.it/biz/la-ristonomia-torino;Menù sempre molto originale e di tendenza, anche se non mancano ottimi piatti classici sia di carne che pesce.
https://www.yelp.it/biz/la-pupetta-bari;Sfiziosi i primi piatti, focacce molto buone, in particolare il calzone con cime di rapa (davvero gustoso!).
https://www.yelp.it/biz/la-provolina-bari;Il menu è caratteristico della cucina locale e varia dal pesce, alla carne e alla semplice pizza.
https://www.yelp.it/biz/la-prima-da-moreno-torino;Lo chef, se non scegli dal menù alla carta, ti chiede se preferisci carne o pesce.
https://www.yelp.it/biz/la-porta-rossa-torino;Due cose soprattutto: l'ottima bottarga, proveniente direttamente da Favignana, e pane e focacce: prodotti eccellenti in un ambiente cordiale.
https://www.yelp.it/biz/la-piramide-torino;Da La Piramide trovate una vastissima scelta, tra pizze, panini, gelati e bibite e... tutti ottimi!
https://www.yelp.it/biz/la-piadineria-torino;Mediamente con 7 euro di riesce a prendere una piadina ed una bibita in lattina.
https://www.yelp.it/biz/la-pace-torino;di positivo c'è molta scelta fra pesce e carne,il personale è gentile.
https://www.yelp.it/biz/la-monachella-torino;Buona la pizza e buona la carne.
https://www.yelp.it/biz/la-madia-torino;Menù che presenta pesce e carne, con proposte sfiziose, idee interessanti senza eccedere nella sperimentazione.
https://www.yelp.it/biz/la-locanda-bari;(Un particolare apprezzamento ad un antipasto di Carpaccio di Funghi con stilettata con carne di cavallo ed aceto balsamico).
https://www.yelp.it/biz/la-limonaia-torino;Gustiamo ostriche, gamberi, una rana pescatrice in brodo di prosciutto crudo e un panino con carne di mora romagnola.
https://www.yelp.it/biz/la-fila-torino;In pieno centro questo ristorante offre piatti sia di carne che di pesce, oltre ad un'ottima pizza.
https://www.yelp.it/biz/la-conca-torino;Tutto era così fresco e si poteva assolutamente assaggiarlo.
https://www.yelp.it/biz/la-cena-coi-fiocchi-torino;Polpette di vitello e patate al forno...squisite, e due porzioni di spinaci perché erano gustosissimi!
https://www.yelp.it/biz/la-cecchina-bari;Il pane era finito ma non ce ne hanno portato dell'altro. 2 bottiglie di acqua. 78 euro totali.
https://www.yelp.it/biz/la-capannina-torino-2;La qualità del cibo (in particolare la carne) è indiscutibile.
https://www.yelp.it/biz/la-cantinella-torino;Ristorante pizzeria che offre una discreta varietà di piatti di pesce e di carne di discreta qualità!
https://www.yelp.it/biz/la-cabane-torino-2;Tutto molto buono, accuratamente servito, accompagnato da ottimo pane di segale caldo e dal classico beurre a' tartiner!
https://www.yelp.it/biz/la-bufala-torino;Particolarmente gradevole la scelta della birra Menabrea alla spina è una scelta comoda per iniziare una serata in centro.
https://www.yelp.it/biz/la-bottega-del-gusto-torino;Servizio rapido. qualità  dei piatti eccelsa. specialità : tris di carne crudo, cous cous alle verdure e tanto tanto altro....
https://www.yelp.it/biz/la-battigia-di-schiralli-antonio-bari;Ristorante dall'atmosfera vintage, con un menù e una carta dei vini vicini alla tradizione barese e, insieme, ricercati.
https://www.yelp.it/biz/la-badessa-torino-2;Ottima la carta dei vini a completare il tutto Prezzi assolutamente nella norma e rapporto qualità/prezzo più che ottimo
https://www.yelp.it/biz/l-osteria-le-ferriere-torino;Carne di alta qualità e cotta al punto giusto, appena scottata, come la fiorentina deve essere.
https://www.yelp.it/biz/l-osteria-di-pierantonio-torino;Risotto alla pescatora eccellente gamberoni alla griglia freschi e sardine (fritte ) da sogno.
https://www.yelp.it/biz/l-idrovolante-torino;Il ristorante propone buoni piatti di carne e di pesce, i piatti sono ben cucinati e presentati molto bene.
https://www.yelp.it/biz/l-birichin-torino-2;Il must da assaggiare è l'uovo su letto di patate e fonduta con spolverata di tartufo, davvero squisito!
https://www.yelp.it/biz/l-antico-arco-cellamare;Le patatine fritte sono fantastiche come anche formaggi e salumi.
https://www.yelp.it/biz/l-ancora-torino-3;Arriva il secondo. la frittura. 2 calamari, due gamberi 4 rondelle di patate.
https://www.yelp.it/biz/l-ancora-torino-2;Il pane è fatto da loro, locale consigliato alle coppie.
https://www.yelp.it/biz/l-agrifoglio-torino;Gli asparagi erano freschi e tenerissimi, le tagliatelle buonissime per non parlare della carne, più che ottima.
https://www.yelp.it/biz/kombu-torino;Veramente ottimi gli udon, sia per il sapore sia per le consistenze della verdura e del pollo.
