url;review
https://www.yelp.it/biz/kipling-torino;Un menù ben nutrito... antipasto piemontese con carne cruda, vitello tonnato e quiche con cipolla rossa, delicata e deliziosa!
https://www.yelp.it/biz/john-joy-torino;Millefoglie di melanzane e salmone ... melanzane fritte e oleose su salmone e salsina di cui sopra.
https://www.yelp.it/biz/japs-torino-2;Posticino tranquillo e moderno, che offre piatti tipici della cucina giapponese insieme a numerosi drink.
https://www.yelp.it/biz/indiano-shri-ganesh-torino;I sapori sono buoni, etnici ma non particolarmente strani, ceci speziati e il pollo tandori erano particolarmente buoni.
https://www.yelp.it/biz/in-vino-veritas-torino;Il menu` dell'Osteria e` molto valido, composto principalmente da piatti a base di carne e cacciagione.
https://www.yelp.it/biz/imbarco-perosino-torino;Coperto a 3 euro, e considerando il pane semicongelato si potrebbe fare qualcosa di più.
https://www.yelp.it/biz/imbarchino-torino;E' possibile assaggiare ottimi panini e prodotti equo e solidali.
https://www.yelp.it/biz/il-vicolo-torino;Era tutto ottimo, anche gli altri hanno apprezzato, non solo i risotti, anche la carne.
https://www.yelp.it/biz/il-sedile-bari;Pizzeria nella media, i prezzi sono buoni e la pizza decente, peccato per i panzerotti che sono surgelati.
https://www.yelp.it/biz/il-porto-torino;Il pesce è assolutamente ottimo ed anche vino, pane e grissini!
https://www.yelp.it/biz/il-picchio-torino;Servizio scarsissimo camerieri simpatici ma non competenti. 60€ in due(grazie a chi a preso margherita e bibita).
https://www.yelp.it/biz/il-peccato-torino;Hamburger di angus (200gr) 7€, menù carne a 12 € :antipasto bibita e ribs (700gr) con contorno!
https://www.yelp.it/biz/il-padellino-torino;Da provare anche gli antipasti della casa, burrada, frittelle e patatine impanate.
https://www.yelp.it/biz/il-giglio-torino;Il pane veniva portato in autonomia appena veniva finito.
https://www.yelp.it/biz/il-fornaccio-bari;Panzerotti fritti squisiti tradizionali con pomodoro e mozzarella,con la carne,con mortadella e provolone e con le rape.
https://www.yelp.it/biz/il-cortiletto-torino-2;Da consigliare le paste fresche realizzate rigorosamente in casa e le carni.
https://www.yelp.it/biz/il-caffe-di-roma-torino;, per il pranzo poco indicato, c'è poca scelta di panini e piatti, d altronde è specializzato in caffè!
https://www.yelp.it/biz/il-caciucco-torino;Come primi un risotto certosino (molto delicato) ed un fusillone gamberi, guanciale e ricotta.
https://www.yelp.it/biz/il-buco-torino;In definitiva un locale per chi non ha pretese e creca un onesto rapporto qualità/prezzo
https://www.yelp.it/biz/il-brigantino-torino;Ottimo il polpo in agrodolce, mentre l'ombrina di secondo è risultata deludente, accompagnata da salse prive di aggiunta.
https://www.yelp.it/biz/ij-brande-torino;I menù provati spaziavano dal pesce crudo alla carne, tutto meravigliosamente abbinato a vini di ottime etichette.
https://www.yelp.it/biz/i-tre-scalini-torino;La pizza era altrettanto buona e la lista per la scelta era ricca di tipi diversi di pizze.
https://www.yelp.it/biz/i-soliti-amici-torino;Arriva dell'ottimo pane ed una focaccia bianca niente di eccezionale, magari due pomodorini non sarebbero stati una cattiva idea.
https://www.yelp.it/biz/huntsman-pub-torino;Pub sempre aperto buona selezione di birre e sicuramente buoni hamburger carne di buona qualità.... da tener presente!
https://www.yelp.it/biz/hua-li-du-torino;Dapprima solo cinese, ultimamente (già da un po') si è aggiunta anche la cucina giapponese.
https://www.yelp.it/biz/hua-dou-cheng-torino;In generale le salse appaiono molto dense, collose.
https://www.yelp.it/biz/gyrosteria-yannis-bari-2;Ottimo panino e moglie soddisfattissima... locale molto carino e caratteristico a due passi dall'ateneo...
https://www.yelp.it/biz/gusti-e-sapori-torino;Arrosto di vitello con patate al forno e verdure saltate in padella.
https://www.yelp.it/biz/gufo-bianco-torino;Oltre alle verdure e alla carne danno anche l'uovo di quaglia, cosa che non si trova ovunque.
https://www.yelp.it/biz/grotta-azzurra-bari;Prezzi nella media, ma è disponibile anche un menù che prevede antipasti e pizza a 11 euro.
https://www.yelp.it/biz/grezzo-torino;La resa del gusto non sempre è soddisfacente, l'utilizzo di soli prodotti vegani non riesce a soddisfare il palato.
https://www.yelp.it/biz/granbar-torino;Aperitivo corretto, ma per stuzzichini solo patatine e pezzi di bruschette al pomodoro (pane e pezzetti di pomodoro).
https://www.yelp.it/biz/gramsci-torino-2;Buoni i dessert, peccato solo che il biscotto della cheese cake
https://www.yelp.it/biz/giusti-torino;Le patatine fritte sono vere, tagliate a mano e fritte come a casa.
https://www.yelp.it/biz/giudice-esercizio-torino;Due antipasti di carne, due secondi di carne, 2 calici di vino e bottiglia d'acqua.. 82€!!
https://www.yelp.it/biz/girarrosto-santa-rita-torino;Arrosto, pollo, salsiccia, pizze varie e farinata, patate al forno e fritte.
https://www.yelp.it/biz/giovanni-torino;Mangiato antipasti di pesce e carne...ottimo il salmone e il vitel tonnè. ..così come i gamberi rossi crudi !
https://www.yelp.it/biz/giapponese-ohashi-torino;Quello che una volta era un costoso ed elitario ristorante giapponese di sushi ora non merita decisamente una visita.
https://www.yelp.it/biz/gennaro-esposito-torino-2;Pizza insapore e piccola, pochissima mozzarella e con pomodoro di scarsa qualità, l'impasto come una pizza dei kebab.
https://www.yelp.it/biz/gennaro-esposito-torino;C'è una scelta di molti condimenti diversi, e servono anche una birra bionda o rossa alla spina o vino.
https://www.yelp.it/biz/galante-torino;Interessante, tipico locale piemontese con cucina di carne e pesce rivisitati in chiave moderna.
https://www.yelp.it/biz/fuzion-torino;Sushi roll originali e rivisitati con ingredienti di origine italiana (pesce cotto e non crudo, carne, formaggi e verdure).
https://www.yelp.it/biz/frulez-bari;Preso una pitta vegana, e frisella con tonno e mozzarella e poi un hamburger con salmone e verdura.
https://www.yelp.it/biz/freevolo-torino;La cucina non entusiasma... buoni i paccheri col pesce e gli spaghetti... pollo al curry poco gustoso.
https://www.yelp.it/biz/fratelli-roselli-torino;Hamburger di fassone spettacolare, con le patate al forno e il pane fatto con l'impasto della pizza.
https://www.yelp.it/biz/fratelli-la-cozza-torino-2;Il menù prevede pizze (impasto alla napoletana) e varie altre proposte di primi, secondi di carne e pesce.
https://www.yelp.it/biz/focacceria-tipica-ligure-torino;I prezzi sono ottimi e l'ambiente è molto casalingo, adatto per una breve sosta o tra amici senza pretese.
https://www.yelp.it/biz/focacceria-santagostino-torino-2;La farinata bio buonissima appena sfornata, la classica margherita ottima come anche patate e olive.
https://www.yelp.it/biz/focacceria-riviera-ligure-torino;I prezzi sono ottimi e l'ambiente è molto casalingo, adatto per una breve sosta o tra amici senza pretese.
https://www.yelp.it/biz/farmacia-dei-sani-bari;Spaghetti con colatura di alici veramente buoni, spaghettoni con la bottarga e limone esageratamente salati.Brasato di carne stopposo.
https://www.yelp.it/biz/farini-da-lia-torino;Grandi quantità e grande qualità di pesce, crudo a volontà, antipasti caldi, ampia scelta di primi e di secondi.
https://www.yelp.it/biz/exki-xxsettembre-torino;Gli ingredienti del molleaux con grassi idrogenati Gli ingredienti del molleaux con grassi idrogenati La loro filosofia...
https://www.yelp.it/biz/exki-pietro-micca-torino;Un pò limitata la scelta dei panini e tramezzini preconfezionati.
https://www.yelp.it/biz/exki-8-gallery-torino-2;E' una valida alternativa per pranzo ad un panino o a una pizza.
https://www.yelp.it/biz/eos-torino;Mentre la grissinopoli non era altro con un quadratino di carne di maiale con impanatura molto spessa di grissini.
https://www.yelp.it/biz/el-churrasco-bari-2;Carne fantastica,personale cordiale e molto attento , tanta varietà di piatti preparati con cura e di un ottimo livello.
https://www.yelp.it/biz/eataly-torino-torino;Tirare su uno sgabello, avere un ottimo bicchiere di vino, cibo fresco e di buona qualità  e pane fresco.
https://www.yelp.it/biz/eataly-bari;E finalmente il grande giorno è arrivato... panze-rotto, verdure in pastella, rigatoni alla carbonara e Giotto (hamburger) con patate.
https://www.yelp.it/biz/eat-sicily-torino;Menù ricco di piatti di pesce con qualcosa anche di carne.
https://www.yelp.it/biz/e-pronto-torino-2;E in luogo del pane, crackers di riso....
https://www.yelp.it/biz/diplomatic-torino;Tutto sommato, per il prezzo pagato (67 euro nel weekend), un rapporto qualità-prezzo più che soddisfacente.
https://www.yelp.it/biz/diecicento-torino-2;L'antipasto di carne cruda altrettanto gustoso e di eccellente qualità.
https://www.yelp.it/biz/delfino-blu-torino;Cucina ricca e spazia tra mare e carne ottima pizza menu degustazione molto buono e completo è sempre pieno
https://www.yelp.it/biz/dausin-torino;Gentilissimo e professionali Qualità ottima Prezzi bassi  Buonissimi tutti gli antipasti con un pane e salame di altro tempi.
https://www.yelp.it/biz/da-nicola-torre-a-mare;Primi piatti anch'essi buoni: riso patate e cozze da me particolarmente gradito e tagliolini ai frutti di mare.
https://www.yelp.it/biz/da-nathalie-bari;Il pesce crudo è fresco, tagliato e servito alla giapponese, col crostaceo che ha ancora il profumo dell'acqua salata.
https://www.yelp.it/biz/da-mauro-torino;Lunghissima carat che viene aggiornata quotidianamente con ampia scelta di primi, secondi di carne e secondi di pesce.
https://www.yelp.it/biz/da-ciro-torino;Quattro pezzi di pollo niente crostini niente bacon e le uova non erano neanche previste nel menù.
https://www.yelp.it/biz/da-benito-torino;Ottima carne e pesce fresco, una vasta scelta di piatti.
https://www.yelp.it/biz/cris-e-bio-bari;Il menù, tra l'altro, comprende solo antipasti (mozzarelle acide, pizza di patate di cartone, popizze(?)
https://www.yelp.it/biz/costadoro-torino;I prezzi sono nella norma e il servizio e la qualità  delle cose servite sono di un altissima qualità .
https://www.yelp.it/biz/coox-torino;Due antipasti , Un primo , un secondo , patatine e 2 bicchieri di vino 45 euro.
https://www.yelp.it/biz/cit-ma-bon-torino;Il posto è piccolo, semplice ma la differenza la fanno la qualità del cibo e la gentilezza del personale.
https://www.yelp.it/biz/circolo-dei-lettori-torino;Buonissimi i Tajiarin, per non parlare dei secondi di carne che si sciolgono in bocca.
https://www.yelp.it/biz/cinque-lire-torino;Il formaggio avvolto in vitello (presumibilmente una specialità piemontese) era come prosciutto e formaggio per toast senza il pane.
https://www.yelp.it/biz/cera-una-volta-torino;Così per caso con due amici, cena fantastica, carne cruda eccezionale davvero.
https://www.yelp.it/biz/cecchi-torino;Chi ama la farinata non può non andare almeno una volta nella sua vita a mangiare qua.
https://www.yelp.it/biz/ceccarelli-torino;Ottimi i primi, così come i secondi con una vasta possibilità di scelta tra carni e pesci.
https://www.yelp.it/biz/catullo-torino-2;Ottima grigliata di pesce, buona la panzarella e molto buono il polipo grigliato con patate (piatto del giorno).
https://www.yelp.it/biz/casale93-torino;Ottimo ristorante , si mangia bene ed hanno varieta' di cucina, pesce, carne e pizza.
https://www.yelp.it/biz/casa-vicina-torino;C'era creatività, ingredienti non tecnici di qualità, è stato davvero salato, come le salse erano riscaldate!!!
https://www.yelp.it/biz/casa-mad-torino;Sembrava di mangiare pane vecchio: pochissimo condimento, impasto asciuttissimo e gommoso.
https://www.yelp.it/biz/casa-fiore-torino;Carne e pesce buonissimiii tutte le materie prime di alta qualità esaltate dalla bravura dello chef!!!
https://www.yelp.it/biz/casa-del-barolo-torino-3;Ma anche il tonno in crosta di pistacchi, il polipo su purea di patate viola.... insomma tutto ottimo.
https://www.yelp.it/biz/casa-amica-friski-torino;Arrotolato di pollo a rosto con le papate al forno con rossmarino,peppe nero e vino bianco spumante...
https://www.yelp.it/biz/cantine-risso-torino;Ottimo il pane, il tortino greco e ovviamente il tagliere di salumi e formaggi!
https://www.yelp.it/biz/cantina-babette-torino;Peccato per i prezzi, decisamente alti, soprattutto sproporzionato il rapporto quantità /qualità /prezzo
https://www.yelp.it/biz/cammaf%C3%A0-torino-4;Questa è la vera pizza napoletana e non può non piacere agli amanti della pizza!
https://www.yelp.it/biz/camilla-kitchen-torino;Una nota mentre i grissini sono squisiti il pane seppur scaldato non è nulla di eccezionale, arricchirei la scelta.
https://www.yelp.it/biz/caffetteria-pasticceria-torino;Questa pasticceria è un vero paradiso di golosità specializzati in prodotti SALENTINI CONOSCIUTA PER I FAVOLOSI PASTICCIOTTI DA PROVARE
https://www.yelp.it/biz/caffe-vittorio-veneto-torino;Il personale è disponibile e accogliente ma il buffet è molto scarso, poca varietà e ancor meno qualità.
https://www.yelp.it/biz/caffe-vergnano-torino;Ottime le insalate con riso basmati e pollo oppure con cereali e salmone da comporre a piacimento.
https://www.yelp.it/biz/caffe-mozart-bari;Si va al Mozart solo per l'ambiente perché in realtà i prezzi sono esagerati per una qualità bassissima.
https://www.yelp.it/biz/caffe-lumiere-torino;Un luogo ideale per fare colazione o pranzo - il panino e torta di fichi sono superlativi!
https://www.yelp.it/biz/caff%C3%A8-torino-torino-2;Due aperitivi perfetti con deliziosi piccoli morsi in uno straordinario spazio architettonico.
https://www.yelp.it/biz/caff%C3%A8-bodoni-torino;Sempre disponibili torte fatte in casa, panini e toast anche per vegetariani e cioccolato torinese.
https://www.yelp.it/biz/cafe-vergnano-1882-torino;Possibilità di ordinare piatti unici mega insalate e panini sfiziosi.
https://www.yelp.it/biz/cafe-tabac-torino;Ottima locazione, scelta degli antipasti, qualità degli ingredienti e del personale.
https://www.yelp.it/biz/caf%C3%A9-accorsi-palace-torino;I cocktail e i vini sono buoni.
https://www.yelp.it/biz/bunet-torino;Da Bunet 4 panini piccoli e 2 caffè costano € 8,80 al banco e € 13,00 serviti in sala.
https://www.yelp.it/biz/bruschetteria-pautasso-di-stecco-susanna-torino;Per chi ama la carne, soprattutto cruda, questo è il posto ideale: il tris di carni crude è spettacolare.
https://www.yelp.it/biz/briss-torino;Da segnalare la carbottarga (carbonara con bottarga al posto del guanciale) e il tonno alla piastra decisamente ottimi.
https://www.yelp.it/biz/brek-torino;Panini belli abbondanti, materie prime di qualità, prezzi più che competitivi, personale gentilissimo, efficiente e simpatico.
https://www.yelp.it/biz/bottega-baretti-moncalieri;Personale gentile e disponibile e cibo veramente buono, sia la pizza (e le loro mega focacce) che la carne.
https://www.yelp.it/biz/borgo-dora-torino;Porzioni sempre decisamente abbondanti, atmosfera tranquilla anche se il sabato il locale è sempre piuttosto pieno di avventori.
https://www.yelp.it/biz/borgo-antico-bari;Acqua da litro ogni 2 persone e bibita a scelta per ciascuno.
https://www.yelp.it/biz/bord%C3%B2-torino;Propongono un cucina essenziale ma di altissima qualità  sempre con prodotti della stagione presentati in piatti curati e sfiziosi.
https://www.yelp.it/biz/bocciofila-mossetto-torino;Primo: dei fusilli (completamente scotti) con un sugo di pancetta, olive (in scatola) e cipolle.
https://www.yelp.it/biz/black-e-white-bari;Location elegante, servizio premuroso ed attento, cestino del pane ricco con focaccia barese e grissini fatti a mano.
https://www.yelp.it/biz/black-angus-turin;La carne, molto tenera e virtuosa, cotta al punto giusto, servita a tavola si una lastra di pietra incandescente.
https://www.yelp.it/biz/bistrot-turin-torino;Unica pecca, il pane un po duretto come se fosse avanzato dal giorno prima, per il resto tutto ok.
https://www.yelp.it/biz/bilab%C3%AC-bari;Latticini di alta qualità , formaggi stagionati saporiti, marmellata e confettura Birra stile amber-ale.
https://www.yelp.it/biz/biffi-valenzano;Bar ben rifinito al suo interno con Tv e la possibilità  di vedere le partite di calcio.
https://www.yelp.it/biz/biancofiore-bari;pietanze tipicamente pugliesi,dalla carne al pesce, ottimi i primi, servizio buono, rapporto qualità prezzo nella media
https://www.yelp.it/biz/biancofarina-bari;Comunque è una buona pizzeria con una buona qualità di carne e prezzi moderati per la location.
https://www.yelp.it/biz/berbel-torino;Ottimo variazione di pesce e crostacei crudi con tre salse e baccalà altrettanto all'altezza.
https://www.yelp.it/biz/bene-cos%C3%AC-torino;Sono disponibili anche panini con burger di pollo, di cinghiale o vegetariani.
https://www.yelp.it/biz/barnum-torino;Il menu vario tra carne e pesce, piatti della cucina tradizionale con ottime preparazioni ed eccellenti materie prime.
https://www.yelp.it/biz/bar-torrefazione-beccuti-torino;ottimo caffè ,buoni croissant e anche i tramezzini / panini, locale tipico sabaudo molto carino ed accogliente seppur piccino.
https://www.yelp.it/biz/bar-lo-scudiero-torino;Locale e piatti buoni, da evitare se come oggi l'affluenza è stata elevata.
https://www.yelp.it/biz/bacco-bari;Il pane è fatto in casa, la piccola pasticceria anche.
https://www.yelp.it/biz/baccanale-torino;Da provare la pierrade con varia scelta di carne da cucinare sulla pietra ollare rovente...evitando le proprie dita.
https://www.yelp.it/biz/art-lunch-di-jo-cafe-torino;Ottimi i piatti di carne come la location e la cortesia che si può trovare in questa struttura.
https://www.yelp.it/biz/arcadia-torino-4;Così se in comitiva si ha qualcuno che non apprezza il giapponese la serata sarà comunque perfetta.
https://www.yelp.it/biz/antonelli-torino;Tanto vale mangiare un panino sulle panchine.
https://www.yelp.it/biz/antico-balon-torino;Qui comunque i prodotti sono tutti freschissimi e di giornata, anche il pane é fatto da loro.
https://www.yelp.it/biz/antichi-sapori-torre-a-mare;Il secondo presentato come una scultura che abbraccia le delizie del mare crude al forno e fritte.
https://www.yelp.it/biz/antica-trattoria-del-sole-torino;E il rapporto tra la qualità del vostro pasto e il conto finale sarà la finale, piacevole sorpresa !!
https://www.yelp.it/biz/angolo-del-parin-torino;Il cotechino era talmente buono che potevi assaporare i gusti della carne e degli aromi, sentirli e riconoscerli.
https://www.yelp.it/biz/amici-miei-torino;Molto buona la serie di antipasti contenenti vare combinazioni diverse di salumi formaggi e pane fritto!
https://www.yelp.it/biz/alla-portata-torino;Esempio, un primo e una grigliata di carne costano una decina di euro a testa.
https://www.yelp.it/biz/alla-lettera-torino;A pranzo menù pizza con bibita piccola e caffè al prezzo convenzionale di 7,50€
https://www.yelp.it/biz/alivella-torino;Buonissima la pizza con le melanzane fritte.... buonissimi i primi....titolare simpatico e disponibile sempre!!!!!!
https://www.yelp.it/biz/algomas-caf%C3%A9-torino;Birra artigianale Gilac alla spina, Beba e Baladin in bottiglia.
https://www.yelp.it/biz/aldente-torino;Buonissima la carne salada, primi e secondi buoni, in complesso un buon prezzo per le portate offerte.
https://www.yelp.it/biz/alberosole-bari;La presentazione è all'altezza del luogo, curata e particolare, non meno pregiata la scelta dei vini e dei superalcolici.
https://www.yelp.it/biz/al-tegamino-moncalieri;La pizza è buona e sostanziosa, adatta anche a persone vegeteriane in quanto non è presente carne nel menu.
https://www.yelp.it/biz/al-sorso-preferito-bari;Antipasti surgelati e di scarsa qualità: insalata di polipo condita con sabbia, patatine fritte al sapore di uovo...
https://www.yelp.it/biz/al-savoia-bari;Si può osservare tranquillamente osservare il passeggio dei baresi sorseggiando una bibita.
https://www.yelp.it/biz/al-paradise-palese;Piatti ottimi sia di pesce, loro specialità, che di carne.
https://www.yelp.it/biz/al-garamond-torino;Menù davvero impeccabile con diversità di pesce e carne.
https://www.yelp.it/biz/al-cacimperio-torino;Carne eccezionale di qualità e cucinata in modo perfetto Porzioni abbondanti Carta dei vini adeguata e ricca di proposte.
https://www.yelp.it/biz/al-111-bari-2;Rapporto qualità prezzo più che eccellente, soprattutto per un locale situato in una via principale del centro di Bari.
https://www.yelp.it/biz/ai-2-ghiottoni-bari-2;Sia che si ordina carne o pesce sono di ottima qualità e freschezza,e lo chef e bravissimo.
https://www.yelp.it/biz/a6-sciamadda-torino;Poi ravioli gustosissimi, il panino con polipo fritto, il brandacujun e la buridda oltre, ovviamente, alla focaccia.
https://www.yelp.it/biz/a-picciridda-torino;Il secondo: un hamburger spesso mezzo centimetro, nero, poiché era cucinato in un olio riciclato.
https://www.yelp.it/biz/a-casa-di-pulcinella-torino;Tutte ricche e con buoni ingredienti: una margherita, una salamino, una spaccalegna senza patate ma con 'nduja (fuori menu).
https://www.yelp.it/biz/500-calorie-torino;Ma i piatti sono gustosi e con ingredienti sani e freschi, cucinati con cura e tutto in vista.
https://www.yelp.it/biz/%C3%A8-cucina-cesare-marretti-torino;I prodotti sono freschi e preparati ogni giorno e il menu cambia ogni giorno.
